transaction_id,posting_date_raw,invoice_date_raw,fiscal_period,entity_code,account_code_raw,cost_center_raw,vendor_name_raw,invoice_number,po_number,currency_code,amount_raw,tax_code,narrative,source_system,posting_date,invoice_date,amount,amount_is_negative,narrative_lower,processing_timestamp,source_file
TXN000001,23-01-2026,16-01-2026,2026-01,AUS01,5620,,Adobe,INV30892,,AUD,6049.77,GST,Payment for license,Manual Entry,2026-01-23,2026-01-16,6049.77,False,payment for license,2026-02-23 16:50:30.516232,Raw_GL_Export.csv
TXN000002,26-02-2026,23-02-2026,2026-02,AUS01,5610,,Federal Express,INV73318,PO2850,NZD,27549.99,GST-FREE,Payment for consulting,Manual Entry,2026-02-26,2026-02-23,27549.99,False,payment for consulting,2026-02-23 16:50:30.516232,Raw_GL_Export.csv
TXN000003,2025-08-02,2025-07-28,2025-08,AUS01,5620,,McKinsey,INV97797,PO9504,AUD,31735.11,GST-FREE,Payment for license,API Import,2025-08-02,2025-07-28,31735.11,False,payment for license,2026-02-23 16:50:30.516232,Raw_GL_Export.csv
TXN000004,04-10-2025,30-09-2025,2025-10,AUS01,5500,,WeWork Australia,INV11526,PO3571,GBP,6774.58,GST,Payment for license,Manual Entry,2025-10-04,2025-09-30,6774.58,False,payment for license,2026-02-23 16:50:30.516232,Raw_GL_Export.csv
TXN000005,28-01-2026,25-01-2026,2026-01,AUS01,5020,,Hays,INV16599,PO7203,NZD,10916.04,INPUT,Payment for consulting,Oracle,2026-01-28,2026-01-25,10916.04,False,payment for consulting,2026-02-23 16:50:30.516232,Raw_GL_Export.csv
TXN000006,03-01-2026,26-12-2025,2026-01,AUS01,5900,,Optus Pty,INV51426,,AUD,38560.86,EXPORT,Payment for consulting,SAP,2026-01-03,2025-12-26,38560.86,False,payment for consulting,2026-02-23 16:50:30.516232,Raw_GL_Export.csv
TXN000007,04-01-2026,28-12-2025,2026-01,AUS01,5010,,AWS,INV76628,PO8474,AUD,35651.07,INPUT,Payment for subscription,Workday,2026-01-04,2025-12-28,35651.07,False,payment for subscription,2026-02-23 16:50:30.516232,Raw_GL_Export.csv
TXN000008,2026-01-27,2026-01-23,2026-01,AUS01,5920,,LinkedIn Corp,INV96136,PO8414,NZD,25250.77,EXPORT,Payment for services,SAP,2026-01-27,2026-01-23,25250.77,False,payment for services,2026-02-23 16:50:30.516232,Raw_GL_Export.csv
TXN000009,25/10/2025,24/10/2025,2025-10,AUS01,5310,,WeWork Australia,INV23935,,NZD,24691.31,INPUT,Payment for goods,Manual Entry,2025-10-25,2025-10-24,24691.31,False,payment for goods,2026-02-23 16:50:30.516232,Raw_GL_Export.csv
TXN000010,05-10-2025,03-10-2025,2025-10,AUS01,5220,,SAP,INV38257,PO4122,USD,5521.49,EXPORT,Payment for subscription,SAP,2025-10-05,2025-10-03,5521.49,False,payment for subscription,2026-02-23 16:50:30.516232,Raw_GL_Export.csv
TXN000011,25-02-2026,24-02-2026,2026-02,AUS01,5620,,Atlassian Pty,INV75382,,GBP,20636.72,GST-FREE,Payment for services,API Import,2026-02-25,2026-02-24,20636.72,False,payment for services,2026-02-23 16:50:30.516232,Raw_GL_Export.csv
TXN000012,14-02-2026,05-02-2026,2026-02,AUS01,5810,,Oracle,INV23573,PO6273,USD,32899.21,GST-FREE,Payment for license,Manual Entry,2026-02-14,2026-02-05,32899.21,False,payment for license,2026-02-23 16:50:30.516232,Raw_GL_Export.csv
TXN000013,14/02/2026,09/02/2026,2026-02,AUS01,5400,,BCG,INV28111,PO9393,NZD,20432.77,GST-FREE,Payment for subscription,API Import,2026-02-14,2026-02-09,20432.77,False,payment for subscription,2026-02-23 16:50:30.516232,Raw_GL_Export.csv
TXN000014,11/28/2025,11/19/2025,2025-11,AUS01,5620,,Workday,INV99995,PO3173,USD,9516.1,INPUT,Payment for goods,API Import,2025-11-28,2025-11-19,9516.1,False,payment for goods,2026-02-23 16:50:30.516232,Raw_GL_Export.csv
TXN000015,01/18/2026,01/16/2026,2026-01,AUS01,5810,,WeWork Australia,INV98374,PO9747,GBP,26268.0,EXPORT,Payment for subscription,Manual Entry,2026-01-18,2026-01-16,26268.0,False,payment for subscription,2026-02-23 16:50:30.516232,Raw_GL_Export.csv
TXN000016,2026-01-26,2026-01-17,2026-01,AUS01,5100,,Amazon,INV36201,,GBP,6625.17,GST,Payment for goods,Workday,2026-01-26,2026-01-17,6625.17,False,payment for goods,2026-02-23 16:50:30.516232,Raw_GL_Export.csv
TXN000017,01/22/2026,01/19/2026,2026-01,AUS01,5910,,MSFT,INV57013,PO2679,NZD,9259.64,GST,Payment for license,API Import,2026-01-22,2026-01-19,9259.64,False,payment for license,2026-02-23 16:50:30.516232,Raw_GL_Export.csv
TXN000018,28/01/2026,19/01/2026,2026-01,AUS01,5400,,Accenture Pty,INV60014,PO6122,NZD,31212.83,GST,Payment for license,SAP,2026-01-28,2026-01-19,31212.83,False,payment for license,2026-02-23 16:50:30.516232,Raw_GL_Export.csv
TXN000019,05/01/2025,04/27/2025,2025-05,AUS01,5610,,Optus Pty,INV87120,PO4218,USD,41025.74,INPUT,Payment for goods,Workday,2025-01-05,2025-04-27,41025.74,False,payment for goods,2026-02-23 16:50:30.516232,Raw_GL_Export.csv
TXN000020,15/01/2026,13/01/2026,2026-01,AUS01,5120,,Oracle,INV46583,PO3131,AUD,17036.2,EXPORT,Payment for goods,API Import,2026-01-15,2026-01-13,17036.2,False,payment for goods,2026-02-23 16:50:30.516232,Raw_GL_Export.csv
TXN000021,01/28/2026,01/27/2026,2026-01,AUS01,5310,,LinkedIn Corp,INV88234,,USD,1893.33,INPUT,Payment for license,Workday,2026-01-28,2026-01-27,1893.33,False,payment for license,2026-02-23 16:50:30.516232,Raw_GL_Export.csv
TXN000022,01/16/2026,01/14/2026,2026-01,AUS01,5900,,McKinsey,INV76209,,USD,43068.75,GST,Payment for license,API Import,2026-01-16,2026-01-14,43068.75,False,payment for license,2026-02-23 16:50:30.516232,Raw_GL_Export.csv
TXN000023,2026-02-13,2026-02-07,2026-02,AUS01,5210,,Workday,INV38632,PO9691,NZD,14964.89,INPUT,Payment for consulting,API Import,2026-02-13,2026-02-07,14964.89,False,payment for consulting,2026-02-23 16:50:30.516232,Raw_GL_Export.csv
TXN000024,2026-01-27,2026-01-25,2026-01,AUS01,5700,,WeWork Australia,INV15226,PO6258,GBP,10891.62,GST-FREE,Payment for consulting,SAP,2026-01-27,2026-01-25,10891.62,False,payment for consulting,2026-02-23 16:50:30.516232,Raw_GL_Export.csv
TXN000025,02/13/2026,02/04/2026,2026-02,AUS01,5800,,KPMG Australia,INV77411,PO8300,AUD,41018.98,INPUT,Payment for consulting,SAP,2026-02-13,2026-04-02,41018.98,False,payment for consulting,2026-02-23 16:50:30.516232,Raw_GL_Export.csv
TXN000026,10/05/2025,04/05/2025,2025-05,AUS01,5510,,Google,INV92173,,AUD,7616.03,GST,Payment for goods,Manual Entry,2025-05-10,2025-05-04,7616.03,False,payment for goods,2026-02-23 16:50:30.516232,Raw_GL_Export.csv
TXN000027,2025-12-27,2025-12-23,2025-12,AUS01,5520,,Telstra Corp,INV13113,PO6434,AUD,33635.4,GST-FREE,Payment for services,SAP,2025-12-27,2025-12-23,33635.4,False,payment for services,2026-02-23 16:50:30.516232,Raw_GL_Export.csv
TXN000028,2026-01-03,2025-12-31,2026-01,AUS01,5900,,Deloitte Touche,INV43901,PO8391,AUD,25915.81,GST-FREE,Payment for consulting,Manual Entry,2026-01-03,2025-12-31,25915.81,False,payment for consulting,2026-02-23 16:50:30.516232,Raw_GL_Export.csv
TXN000029,2026-01-11,2026-01-04,2026-01,AUS01,5700,,Atlassian Pty,INV86756,,AUD,28899.88,GST,Payment for services,Workday,2026-01-11,2026-01-04,28899.88,False,payment for services,2026-02-23 16:50:30.516232,Raw_GL_Export.csv
TXN000030,2026-01-17,2026-01-12,2026-01,AUS01,5900,,EY Australia,INV59992,PO1504,AUD,12740.13,EXPORT,Payment for consulting,Oracle,2026-01-17,2026-01-12,12740.13,False,payment for consulting,2026-02-23 16:50:30.516232,Raw_GL_Export.csv
TXN000031,18/01/2026,15/01/2026,2026-01,AUS01,5800,,DHL Express,INV49066,PO7113,NZD,43210.03,GST-FREE,Payment for services,API Import,2026-01-18,2026-01-15,43210.03,False,payment for services,2026-02-23 16:50:30.516232,Raw_GL_Export.csv
TXN000032,28/01/2026,26/01/2026,2026-01,AUS01,5010,,AWS,INV49936,,GBP,24218.13,GST,Payment for subscription,Oracle,2026-01-28,2026-01-26,24218.13,False,payment for subscription,2026-02-23 16:50:30.516232,Raw_GL_Export.csv
TXN000033,14/04/2025,11/04/2025,2025-04,AUS01,5120,,ServiceNow Inc,INV97946,PO1891,NZD,8825.25,GST-FREE,Payment for license,Manual Entry,2025-04-14,2025-04-11,8825.25,False,payment for license,2026-02-23 16:50:30.516232,Raw_GL_Export.csv
TXN000034,2026-02-21,2026-02-16,2026-02,AUS01,5700,,Salesforce,INV53365,PO4842,NZD,4509.29,EXPORT,Payment for services,Workday,2026-02-21,2026-02-16,4509.29,False,payment for services,2026-02-23 16:50:30.516232,Raw_GL_Export.csv
TXN000035,2026-02-20,2026-02-16,2026-02,AUS01,5310,,Hays,INV86568,,GBP,14842.74,INPUT,Payment for license,Workday,2026-02-20,2026-02-16,14842.74,False,payment for license,2026-02-23 16:50:30.516232,Raw_GL_Export.csv
TXN000036,01/26/2025,01/19/2025,2025-01,AUS01,5120,,AWS,INV93995,PO6889,NZD,11153.26,GST-FREE,Payment for goods,Workday,2025-01-26,2025-01-19,11153.26,False,payment for goods,2026-02-23 16:50:30.516232,Raw_GL_Export.csv
TXN000037,16-11-2025,08-11-2025,2025-11,AUS01,5320,,EY Australia,INV94613,PO5597,GBP,24870.06,GST-FREE,Payment for goods,API Import,2025-11-16,2025-11-08,24870.06,False,payment for goods,2026-02-23 16:50:30.516232,Raw_GL_Export.csv
TXN000038,02/07/2026,02/05/2026,2026-02,AUS01,5800,,Salesforce,INV86269,PO4485,AUD,38246.47,GST,Payment for services,API Import,2026-07-02,2026-05-02,38246.47,False,payment for services,2026-02-23 16:50:30.516232,Raw_GL_Export.csv
TXN000039,09-12-2025,06-12-2025,2025-12,AUS01,5320,,DHL Express,INV27548,PO9362,USD,40125.55,INPUT,Payment for services,Manual Entry,2025-12-09,2025-12-06,40125.55,False,payment for services,2026-02-23 16:50:30.516232,Raw_GL_Export.csv
TXN000040,2025-11-12,2025-11-08,2025-11,AUS01,5920,,Adobe,INV84233,PO3395,USD,20135.3,GST-FREE,Payment for consulting,Workday,2025-11-12,2025-11-08,20135.3,False,payment for consulting,2026-02-23 16:50:30.516232,Raw_GL_Export.csv
TXN000041,02/02/2026,25/01/2026,2026-02,AUS01,5210,,Salesforce,INV97632,,NZD,16687.64,GST,Payment for subscription,Manual Entry,2026-02-02,2026-01-25,16687.64,False,payment for subscription,2026-02-23 16:50:30.516232,Raw_GL_Export.csv
TXN000042,16-06-2025,15-06-2025,2025-06,AUS01,5010,,McKinsey,INV44513,PO3848,AUD,31697.76,INPUT,Payment for consulting,Manual Entry,2025-06-16,2025-06-15,31697.76,False,payment for consulting,2026-02-23 16:50:30.516232,Raw_GL_Export.csv
TXN000043,2026-01-12,2026-01-03,2026-01,AUS01,5220,,Federal Express,INV55224,PO8898,USD,23285.09,INPUT,Payment for license,SAP,2026-01-12,2026-01-03,23285.09,False,payment for license,2026-02-23 16:50:30.516232,Raw_GL_Export.csv
TXN000044,17/11/2025,09/11/2025,2025-11,AUS01,5120,,ServiceNow Inc,INV37723,,AUD,23202.9,INPUT,Payment for goods,Workday,2025-11-17,2025-11-09,23202.9,False,payment for goods,2026-02-23 16:50:30.516232,Raw_GL_Export.csv
TXN000045,2026-02-20,2026-02-16,2026-02,AUS01,5410,,BCG,INV72786,,AUD,21720.1,EXPORT,Payment for goods,Manual Entry,2026-02-20,2026-02-16,21720.1,False,payment for goods,2026-02-23 16:50:30.516232,Raw_GL_Export.csv
TXN000046,01/02/2026,31/01/2026,2026-02,AUS01,5110,,Adobe,INV85008,,USD,28366.37,GST,Payment for goods,Workday,2026-02-01,2026-01-31,28366.37,False,payment for goods,2026-02-23 16:50:30.516232,Raw_GL_Export.csv
TXN000047,06-12-2025,26-11-2025,2025-12,AUS01,5600,,Amazon,INV68877,PO8723,NZD,42631.7,GST-FREE,Payment for consulting,Oracle,2025-12-06,2025-11-26,42631.7,False,payment for consulting,2026-02-23 16:50:30.516232,Raw_GL_Export.csv
TXN000048,08-01-2026,29-12-2025,2026-01,AUS01,5110,,Oracle,INV69437,PO2127,NZD,7630.7,INPUT,Payment for goods,Manual Entry,2026-01-08,2025-12-29,7630.7,False,payment for goods,2026-02-23 16:50:30.516232,Raw_GL_Export.csv
TXN000049,13/01/2025,11/01/2025,2025-01,AUS01,5000,,SAP,INV33255,PO1639,GBP,37210.49,GST,Payment for license,API Import,2025-01-13,2025-01-11,37210.49,False,payment for license,2026-02-23 16:50:30.516232,Raw_GL_Export.csv
TXN000050,2026-02-25,2026-02-23,2026-02,AUS01,5500,,Slack,INV78425,PO1711,AUD,40373.91,EXPORT,Payment for license,Manual Entry,2026-02-25,2026-02-23,40373.91,False,payment for license,2026-02-23 16:50:30.516232,Raw_GL_Export.csv
TXN000051,08-01-2026,01-01-2026,2026-01,AUS01,5320,,GCP,INV40475,PO2373,GBP,6111.35,EXPORT,Payment for subscription,API Import,2026-01-08,2026-01-01,6111.35,False,payment for subscription,2026-02-23 16:50:30.516232,Raw_GL_Export.csv
TXN000052,18-01-2026,13-01-2026,2026-01,AUS01,5200,,AWS,INV78126,,AUD,26051.62,GST,Payment for goods,Workday,2026-01-18,2026-01-13,26051.62,False,payment for goods,2026-02-23 16:50:30.516232,Raw_GL_Export.csv
TXN000053,02/14/2026,02/12/2026,2026-02,AUS01,5110,,Telstra Corp,INV84012,PO5514,NZD,11832.5,EXPORT,Payment for consulting,Oracle,2026-02-14,2026-12-02,11832.5,False,payment for consulting,2026-02-23 16:50:30.516232,Raw_GL_Export.csv
TXN000054,14-08-2025,11-08-2025,2025-08,AUS01,5320,,Seek Limited,INV62183,PO2951,NZD,44484.02,INPUT,Payment for goods,Manual Entry,2025-08-14,2025-08-11,44484.02,False,payment for goods,2026-02-23 16:50:30.516232,Raw_GL_Export.csv
TXN000055,26/03/2025,24/03/2025,2025-03,AUS01,5200,,Robert Half International,INV31068,PO1086,GBP,35395.04,GST,Payment for services,Oracle,2025-03-26,2025-03-24,35395.04,False,payment for services,2026-02-23 16:50:30.516232,Raw_GL_Export.csv
TXN000056,16-02-2026,14-02-2026,2026-02,AUS01,5020,,Deloitte Touche,INV60374,PO7564,USD,16750.5,GST,Payment for license,API Import,2026-02-16,2026-02-14,16750.5,False,payment for license,2026-02-23 16:50:30.516232,Raw_GL_Export.csv
TXN000057,2026-01-10,2026-01-07,2026-01,AUS01,5620,,Hays,INV35525,,GBP,580.9,INPUT,Payment for license,API Import,2026-01-10,2026-01-07,580.9,False,payment for license,2026-02-23 16:50:30.516232,Raw_GL_Export.csv
TXN000058,17/05/2025,07/05/2025,2025-05,AUS01,5120,,Microsoft,INV30636,,NZD,10842.62,GST,Payment for subscription,Manual Entry,2025-05-17,2025-05-07,10842.62,False,payment for subscription,2026-02-23 16:50:30.516232,Raw_GL_Export.csv
TXN000059,12-01-2026,05-01-2026,2026-01,AUS01,5600,,SAP,INV21818,PO6703,AUD,33187.96,GST,Payment for subscription,Workday,2026-01-12,2026-01-05,33187.96,False,payment for subscription,2026-02-23 16:50:30.516232,Raw_GL_Export.csv
TXN000060,08/01/2026,31/12/2025,2026-01,AUS01,5400,,AWS,INV83220,,NZD,7959.06,GST,Payment for subscription,Workday,2026-01-08,2025-12-31,7959.06,False,payment for subscription,2026-02-23 16:50:30.516232,Raw_GL_Export.csv
TXN000061,03/04/2025,02/23/2025,2025-03,AUS01,5910,,Deloitte Touche,INV41886,PO8517,GBP,43475.89,EXPORT,Payment for consulting,API Import,2025-04-03,2025-02-23,43475.89,False,payment for consulting,2026-02-23 16:50:30.516232,Raw_GL_Export.csv
TXN000062,2026-01-28,2026-01-20,2026-01,AUS01,5100,,Deloitte Touche,INV98724,PO6172,AUD,17282.03,GST-FREE,Payment for consulting,Workday,2026-01-28,2026-01-20,17282.03,False,payment for consulting,2026-02-23 16:50:30.516232,Raw_GL_Export.csv
TXN000063,2025-08-17,2025-08-12,2025-08,AUS01,5210,,KPMG Australia,INV19965,PO3924,AUD,18011.99,INPUT,Payment for consulting,Workday,2025-08-17,2025-08-12,18011.99,False,payment for consulting,2026-02-23 16:50:30.516232,Raw_GL_Export.csv
TXN000064,12/02/2026,02/02/2026,2026-02,AUS01,5220,,Oracle,INV40783,PO5348,USD,22505.07,GST-FREE,Payment for goods,Oracle,2026-02-12,2026-02-02,22505.07,False,payment for goods,2026-02-23 16:50:30.516232,Raw_GL_Export.csv
TXN000065,07/07/2025,27/06/2025,2025-07,AUS01,5320,,Zoom,INV98580,PO9071,AUD,5482.54,GST,Payment for license,SAP,2025-07-07,2025-06-27,5482.54,False,payment for license,2026-02-23 16:50:30.516232,Raw_GL_Export.csv
TXN000066,2026-02-25,2026-02-17,2026-02,AUS01,5320,,McKinsey,INV74330,,GBP,40425.64,INPUT,Payment for license,Workday,2026-02-25,2026-02-17,40425.64,False,payment for license,2026-02-23 16:50:30.516232,Raw_GL_Export.csv
TXN000067,13/02/2026,03/02/2026,2026-02,AUS01,5110,,MSFT,INV75860,PO3863,GBP,21576.57,GST,Payment for consulting,SAP,2026-02-13,2026-02-03,21576.57,False,payment for consulting,2026-02-23 16:50:30.516232,Raw_GL_Export.csv
TXN000068,23-09-2025,17-09-2025,2025-09,AUS01,5710,,AWS,INV86153,,AUD,30367.23,EXPORT,Payment for subscription,API Import,2025-09-23,2025-09-17,30367.23,False,payment for subscription,2026-02-23 16:50:30.516232,Raw_GL_Export.csv
TXN000069,10/28/2025,10/25/2025,2025-10,AUS01,5520,,Deloitte Touche,INV57962,,USD,12196.43,INPUT,Payment for consulting,Oracle,2025-10-28,2025-10-25,12196.43,False,payment for consulting,2026-02-23 16:50:30.516232,Raw_GL_Export.csv
TXN000070,08/14/2025,08/08/2025,2025-08,AUS01,5920,,DHL Express,INV85483,PO2636,NZD,20337.73,GST-FREE,Payment for subscription,Oracle,2025-08-14,2025-08-08,20337.73,False,payment for subscription,2026-02-23 16:50:30.516232,Raw_GL_Export.csv
TXN000071,18-01-2026,11-01-2026,2026-01,AUS01,5200,,Zoom,INV33148,PO3203,USD,21337.12,GST,Payment for license,API Import,2026-01-18,2026-01-11,21337.12,False,payment for license,2026-02-23 16:50:30.516232,Raw_GL_Export.csv
TXN000072,01/24/2026,01/16/2026,2026-01,AUS01,5300,,Deloitte Touche,INV17869,,AUD,17988.25,GST-FREE,Payment for subscription,Manual Entry,2026-01-24,2026-01-16,17988.25,False,payment for subscription,2026-02-23 16:50:30.516232,Raw_GL_Export.csv
TXN000073,2026-02-27,2026-02-19,2026-02,AUS01,5800,,BCG,INV55107,,NZD,16307.19,INPUT,Payment for services,Workday,2026-02-27,2026-02-19,16307.19,False,payment for services,2026-02-23 16:50:30.516232,Raw_GL_Export.csv
TXN000074,28/02/2026,18/02/2026,2026-02,AUS01,5600,,Oracle,INV68580,PO7243,NZD,16044.4,EXPORT,Payment for license,Workday,2026-02-28,2026-02-18,16044.4,False,payment for license,2026-02-23 16:50:30.516232,Raw_GL_Export.csv
TXN000075,15/02/2025,12/02/2025,2025-02,AUS01,5620,,BCG,INV19351,,GBP,28444.18,EXPORT,Payment for subscription,Oracle,2025-02-15,2025-02-12,28444.18,False,payment for subscription,2026-02-23 16:50:30.516232,Raw_GL_Export.csv
TXN000076,01/11/2026,01/06/2026,2026-01,AUS01,5710,,PWC,INV57600,PO9535,GBP,12279.04,EXPORT,Payment for consulting,Manual Entry,2026-11-01,2026-06-01,12279.04,False,payment for consulting,2026-02-23 16:50:30.516232,Raw_GL_Export.csv
TXN000077,06/01/2026,05/01/2026,2026-01,AUS01,5110,,Accenture Pty,INV37600,,NZD,42325.64,GST,Payment for services,SAP,2026-01-06,2026-01-05,42325.64,False,payment for services,2026-02-23 16:50:30.516232,Raw_GL_Export.csv
TXN000078,03-02-2026,25-01-2026,2026-02,AUS01,5010,,Amazon,INV23622,,GBP,23626.83,GST,Payment for goods,SAP,2026-02-03,2026-01-25,23626.83,False,payment for goods,2026-02-23 16:50:30.516232,Raw_GL_Export.csv
TXN000079,21-02-2026,16-02-2026,2026-02,AUS01,5210,,Accenture Pty,INV27206,PO3795,NZD,19997.9,GST-FREE,Payment for services,SAP,2026-02-21,2026-02-16,19997.9,False,payment for services,2026-02-23 16:50:30.516232,Raw_GL_Export.csv
TXN000080,02/22/2026,02/16/2026,2026-02,AUS01,5920,,Seek Limited,INV81898,PO9835,GBP,43876.67,INPUT,Payment for goods,API Import,2026-02-22,2026-02-16,43876.67,False,payment for goods,2026-02-23 16:50:30.516232,Raw_GL_Export.csv
TXN000081,20-02-2026,10-02-2026,2026-02,AUS01,5410,,EY Australia,INV21738,PO6992,NZD,21726.16,GST-FREE,Payment for consulting,Workday,2026-02-20,2026-02-10,21726.16,False,payment for consulting,2026-02-23 16:50:30.516232,Raw_GL_Export.csv
TXN000082,02/05/2026,02/04/2026,2026-02,AUS01,5000,,Slack,INV74478,PO8816,NZD,12975.62,GST,Payment for subscription,SAP,2026-05-02,2026-04-02,12975.62,False,payment for subscription,2026-02-23 16:50:30.516232,Raw_GL_Export.csv
TXN000083,25-03-2025,20-03-2025,2025-03,AUS01,5610,,ServiceNow Inc,INV63967,PO8161,AUD,24714.73,GST-FREE,Payment for consulting,Oracle,2025-03-25,2025-03-20,24714.73,False,payment for consulting,2026-02-23 16:50:30.516232,Raw_GL_Export.csv
TXN000084,06-02-2025,30-01-2025,2025-02,AUS01,5210,,Deloitte Touche,INV77713,PO5454,AUD,19058.55,GST-FREE,Payment for subscription,API Import,2025-02-06,2025-01-30,19058.55,False,payment for subscription,2026-02-23 16:50:30.516232,Raw_GL_Export.csv
TXN000085,06/26/2025,06/19/2025,2025-06,AUS01,5200,,Salesforce,INV93478,PO8418,USD,6234.42,GST,Payment for subscription,API Import,2025-06-26,2025-06-19,6234.42,False,payment for subscription,2026-02-23 16:50:30.516232,Raw_GL_Export.csv
TXN000086,16/08/2025,10/08/2025,2025-08,AUS01,5000,,Zoom,INV34371,PO5622,AUD,43640.26,GST,Payment for subscription,Oracle,2025-08-16,2025-08-10,43640.26,False,payment for subscription,2026-02-23 16:50:30.516232,Raw_GL_Export.csv
TXN000087,23-02-2026,22-02-2026,2026-02,AUS01,5210,,Google,INV54815,PO9165,USD,761.15,GST-FREE,Payment for subscription,Manual Entry,2026-02-23,2026-02-22,761.15,False,payment for subscription,2026-02-23 16:50:30.516232,Raw_GL_Export.csv
TXN000088,2026-02-23,2026-02-17,2026-02,AUS01,5020,,Zoom,INV19356,PO3975,AUD,12066.01,EXPORT,Payment for goods,Workday,2026-02-23,2026-02-17,12066.01,False,payment for goods,2026-02-23 16:50:30.516232,Raw_GL_Export.csv
TXN000089,27-02-2026,26-02-2026,2026-02,AUS01,5100,,Accenture Pty,INV42396,PO1549,GBP,34728.02,EXPORT,Payment for goods,Manual Entry,2026-02-27,2026-02-26,34728.02,False,payment for goods,2026-02-23 16:50:30.516232,Raw_GL_Export.csv
TXN000090,2026-01-24,2026-01-15,2026-01,AUS01,5700,,Workday,INV52344,,GBP,17571.62,INPUT,Payment for services,API Import,2026-01-24,2026-01-15,17571.62,False,payment for services,2026-02-23 16:50:30.516232,Raw_GL_Export.csv
TXN000091,2025-05-17,2025-05-12,2025-05,AUS01,5500,,EY Australia,INV97385,,USD,16283.16,GST,Payment for services,Oracle,2025-05-17,2025-05-12,16283.16,False,payment for services,2026-02-23 16:50:30.516232,Raw_GL_Export.csv
TXN000092,21-01-2026,15-01-2026,2026-01,AUS01,5000,,Adobe,INV41862,,NZD,26352.89,EXPORT,Payment for services,API Import,2026-01-21,2026-01-15,26352.89,False,payment for services,2026-02-23 16:50:30.516232,Raw_GL_Export.csv
TXN000093,26-06-2025,16-06-2025,2025-06,AUS01,5110,,Regus Australia,INV21980,PO6544,AUD,11267.63,EXPORT,Payment for services,SAP,2025-06-26,2025-06-16,11267.63,False,payment for services,2026-02-23 16:50:30.516232,Raw_GL_Export.csv
TXN000094,12/03/2025,03/03/2025,2025-03,AUS01,5900,,GCP,INV83184,PO6690,USD,22004.15,INPUT,Payment for consulting,Oracle,2025-03-12,2025-03-03,22004.15,False,payment for consulting,2026-02-23 16:50:30.516232,Raw_GL_Export.csv
TXN000095,01-01-2026,26-12-2025,2026-01,AUS01,5800,,Slack,INV67344,PO9892,NZD,40449.97,EXPORT,Payment for consulting,Oracle,2026-01-01,2025-12-26,40449.97,False,payment for consulting,2026-02-23 16:50:30.516232,Raw_GL_Export.csv
TXN000096,19/02/2026,10/02/2026,2026-02,AUS01,5320,,McKinsey,INV19027,PO8362,GBP,12462.07,GST-FREE,Payment for subscription,Workday,2026-02-19,2026-02-10,12462.07,False,payment for subscription,2026-02-23 16:50:30.516232,Raw_GL_Export.csv
TXN000097,11/18/2025,11/10/2025,2025-11,AUS01,5000,,Robert Half International,INV91229,PO4912,GBP,33041.23,GST,Payment for subscription,SAP,2025-11-18,2025-10-11,33041.23,False,payment for subscription,2026-02-23 16:50:30.516232,Raw_GL_Export.csv
TXN000098,22-02-2025,18-02-2025,2025-02,AUS01,5510,,Hays,INV63713,PO2809,USD,27625.46,INPUT,Payment for services,API Import,2025-02-22,2025-02-18,27625.46,False,payment for services,2026-02-23 16:50:30.516232,Raw_GL_Export.csv
TXN000099,2026-02-22,2026-02-21,2026-02,AUS01,5910,,Slack,INV24031,PO2617,USD,39319.83,GST-FREE,Payment for services,API Import,2026-02-22,2026-02-21,39319.83,False,payment for services,2026-02-23 16:50:30.516232,Raw_GL_Export.csv
TXN000100,21-01-2026,13-01-2026,2026-01,AUS01,5510,,Deloitte Touche,INV11715,PO4419,AUD,16549.3,GST,Payment for consulting,SAP,2026-01-21,2026-01-13,16549.3,False,payment for consulting,2026-02-23 16:50:30.516232,Raw_GL_Export.csv
TXN000101,2026-01-15,2026-01-09,2026-01,AUS01,5520,,AusPost,INV90862,,NZD,35761.81,GST,Payment for services,SAP,2026-01-15,2026-01-09,35761.81,False,payment for services,2026-02-23 16:50:30.516232,Raw_GL_Export.csv
TXN000102,02/27/2026,02/25/2026,2026-02,AUS01,5200,,GCP,INV34832,,AUD,32660.22,EXPORT,Payment for goods,API Import,2026-02-27,2026-02-25,32660.22,False,payment for goods,2026-02-23 16:50:30.516232,Raw_GL_Export.csv
TXN000103,21/12/2025,12/12/2025,2025-12,AUS01,5800,,AusPost,INV98407,PO7997,AUD,34506.13,INPUT,Payment for services,Oracle,2025-12-21,2025-12-12,34506.13,False,payment for services,2026-02-23 16:50:30.516232,Raw_GL_Export.csv
TXN000104,26/01/2026,17/01/2026,2026-01,AUS01,5400,,Robert Half International,INV56179,PO6319,NZD,29623.18,EXPORT,Payment for subscription,Manual Entry,2026-01-26,2026-01-17,29623.18,False,payment for subscription,2026-02-23 16:50:30.516232,Raw_GL_Export.csv
TXN000105,25-01-2026,19-01-2026,2026-01,AUS01,5610,,Accenture Pty,INV57187,PO8331,USD,16940.33,INPUT,Payment for consulting,SAP,2026-01-25,2026-01-19,16940.33,False,payment for consulting,2026-02-23 16:50:30.516232,Raw_GL_Export.csv
TXN000106,2025-05-24,2025-05-19,2025-05,AUS01,5610,,Amazon,INV10860,PO4635,USD,44704.2,INPUT,Payment for goods,Workday,2025-05-24,2025-05-19,44704.2,False,payment for goods,2026-02-23 16:50:30.516232,Raw_GL_Export.csv
TXN000107,02/01/2026,01/23/2026,2026-02,AUS01,5510,,Zoom,INV30461,,AUD,1794.36,INPUT,Payment for subscription,API Import,2026-01-02,2026-01-23,1794.36,False,payment for subscription,2026-02-23 16:50:30.516232,Raw_GL_Export.csv
TXN000108,08/09/2025,03/09/2025,2025-09,AUS01,5900,,EY Australia,INV20118,PO8905,AUD,25714.87,GST-FREE,Payment for goods,Manual Entry,2025-09-08,2025-09-03,25714.87,False,payment for goods,2026-02-23 16:50:30.516232,Raw_GL_Export.csv
TXN000109,2026-02-27,2026-02-17,2026-02,AUS01,5620,,EY Australia,INV20286,PO6478,AUD,32912.44,EXPORT,Payment for subscription,Manual Entry,2026-02-27,2026-02-17,32912.44,False,payment for subscription,2026-02-23 16:50:30.516232,Raw_GL_Export.csv
TXN000110,2026-02-14,2026-02-10,2026-02,AUS01,5800,,AWS,INV51853,PO3450,GBP,2530.34,GST,Payment for subscription,API Import,2026-02-14,2026-02-10,2530.34,False,payment for subscription,2026-02-23 16:50:30.516232,Raw_GL_Export.csv
TXN000111,23/02/2026,20/02/2026,2026-02,AUS01,5010,,DHL Express,INV39109,PO7460,GBP,33902.53,GST,Payment for goods,Oracle,2026-02-23,2026-02-20,33902.53,False,payment for goods,2026-02-23 16:50:30.516232,Raw_GL_Export.csv
TXN000112,2025-07-11,2025-07-03,2025-07,AUS01,5600,,MSFT,INV75774,PO3136,GBP,11888.85,EXPORT,Payment for goods,Manual Entry,2025-07-11,2025-07-03,11888.85,False,payment for goods,2026-02-23 16:50:30.516232,Raw_GL_Export.csv
TXN000113,18/02/2026,10/02/2026,2026-02,AUS01,5400,,SAP,INV66369,PO2467,USD,10979.95,INPUT,Payment for services,Manual Entry,2026-02-18,2026-02-10,10979.95,False,payment for services,2026-02-23 16:50:30.516232,Raw_GL_Export.csv
TXN000114,09/14/2025,09/08/2025,2025-09,AUS01,5200,,McKinsey,INV49953,,NZD,26765.08,GST,Payment for subscription,API Import,2025-09-14,2025-08-09,26765.08,False,payment for subscription,2026-02-23 16:50:30.516232,Raw_GL_Export.csv
TXN000115,27-01-2026,17-01-2026,2026-01,AUS01,5110,,Optus Pty,INV36173,PO3555,AUD,41597.17,GST-FREE,Payment for services,SAP,2026-01-27,2026-01-17,41597.17,False,payment for services,2026-02-23 16:50:30.516232,Raw_GL_Export.csv
TXN000116,2026-02-24,2026-02-20,2026-02,AUS01,5610,,Zoom,INV49992,PO1372,NZD,716.62,GST,Payment for subscription,Oracle,2026-02-24,2026-02-20,716.62,False,payment for subscription,2026-02-23 16:50:30.516232,Raw_GL_Export.csv
TXN000117,24/02/2026,20/02/2026,2026-02,AUS01,5520,,Deloitte Touche,INV97590,,GBP,28074.59,GST-FREE,Payment for license,API Import,2026-02-24,2026-02-20,28074.59,False,payment for license,2026-02-23 16:50:30.516232,Raw_GL_Export.csv
TXN000118,02/02/2026,01/30/2026,2026-02,AUS01,5010,,KPMG Australia,INV16957,PO1136,USD,35534.56,INPUT,Payment for services,Manual Entry,2026-02-02,2026-01-30,35534.56,False,payment for services,2026-02-23 16:50:30.516232,Raw_GL_Export.csv
TXN000119,02/22/2026,02/16/2026,2026-02,AUS01,5920,,GCP,INV40299,PO9331,AUD,13233.05,EXPORT,Payment for services,Workday,2026-02-22,2026-02-16,13233.05,False,payment for services,2026-02-23 16:50:30.516232,Raw_GL_Export.csv
TXN000120,2026-01-16,2026-01-13,2026-01,AUS01,5200,,Robert Half International,INV15210,,GBP,25274.87,GST,Payment for license,Workday,2026-01-16,2026-01-13,25274.87,False,payment for license,2026-02-23 16:50:30.516232,Raw_GL_Export.csv
TXN000121,11-10-2025,04-10-2025,2025-10,AUS01,5800,,Adobe,INV56580,PO4869,AUD,15670.42,INPUT,Payment for license,Workday,2025-10-11,2025-10-04,15670.42,False,payment for license,2026-02-23 16:50:30.516232,Raw_GL_Export.csv
TXN000122,2026-02-26,2026-02-21,2026-02,AUS01,5400,,Amazon,INV61491,PO2438,NZD,10228.66,INPUT,Payment for consulting,API Import,2026-02-26,2026-02-21,10228.66,False,payment for consulting,2026-02-23 16:50:30.516232,Raw_GL_Export.csv
TXN000123,22/01/2026,15/01/2026,2026-01,AUS01,5210,,Zoom,INV68873,PO4387,GBP,43677.12,INPUT,Payment for goods,API Import,2026-01-22,2026-01-15,43677.12,False,payment for goods,2026-02-23 16:50:30.516232,Raw_GL_Export.csv
TXN000124,18/03/2025,15/03/2025,2025-03,AUS01,5300,,Slack,INV96013,PO3589,GBP,44806.29,GST-FREE,Payment for subscription,SAP,2025-03-18,2025-03-15,44806.29,False,payment for subscription,2026-02-23 16:50:30.516232,Raw_GL_Export.csv
TXN000125,2025-03-18,2025-03-15,2025-03,AUS01,5310,,Zoom,INV63903,PO5485,AUD,34468.03,EXPORT,Payment for goods,Oracle,2025-03-18,2025-03-15,34468.03,False,payment for goods,2026-02-23 16:50:30.516232,Raw_GL_Export.csv
TXN000126,04/02/2026,01/02/2026,2026-02,AUS01,5000,,PWC,INV13418,PO8808,USD,26876.6,GST-FREE,Payment for goods,API Import,2026-02-04,2026-02-01,26876.6,False,payment for goods,2026-02-23 16:50:30.516232,Raw_GL_Export.csv
TXN000127,28-02-2026,22-02-2026,2026-02,AUS01,5120,,Federal Express,INV35330,,GBP,21375.73,GST-FREE,Payment for consulting,SAP,2026-02-28,2026-02-22,21375.73,False,payment for consulting,2026-02-23 16:50:30.516232,Raw_GL_Export.csv
TXN000128,09-01-2025,05-01-2025,2025-01,AUS01,5800,,SAP,INV90879,PO6323,USD,3069.52,EXPORT,Payment for consulting,Oracle,2025-01-09,2025-01-05,3069.52,False,payment for consulting,2026-02-23 16:50:30.516232,Raw_GL_Export.csv
TXN000129,14-02-2026,13-02-2026,2026-02,AUS01,5610,,Federal Express,INV78242,,NZD,17797.37,GST,Payment for consulting,SAP,2026-02-14,2026-02-13,17797.37,False,payment for consulting,2026-02-23 16:50:30.516232,Raw_GL_Export.csv
TXN000130,08-02-2026,07-02-2026,2026-02,AUS01,5520,,Federal Express,INV62171,PO5684,AUD,8624.28,EXPORT,Payment for consulting,Oracle,2026-02-08,2026-02-07,8624.28,False,payment for consulting,2026-02-23 16:50:30.516232,Raw_GL_Export.csv
TXN000131,02/14/2026,02/04/2026,2026-02,AUS01,5010,,Zoom,INV21854,PO2854,GBP,37362.22,EXPORT,Payment for goods,API Import,2026-02-14,2026-04-02,37362.22,False,payment for goods,2026-02-23 16:50:30.516232,Raw_GL_Export.csv
TXN000132,23/02/2026,16/02/2026,2026-02,AUS01,5410,,McKinsey,INV87373,PO4308,GBP,1218.55,EXPORT,Payment for consulting,SAP,2026-02-23,2026-02-16,1218.55,False,payment for consulting,2026-02-23 16:50:30.516232,Raw_GL_Export.csv
TXN000133,02/09/2026,02/06/2026,2026-02,AUS01,5710,,Atlassian Pty,INV93109,PO9582,AUD,5226.01,EXPORT,Payment for consulting,API Import,2026-09-02,2026-06-02,5226.01,False,payment for consulting,2026-02-23 16:50:30.516232,Raw_GL_Export.csv
TXN000134,20/01/2026,13/01/2026,2026-01,AUS01,5520,,Federal Express,INV84120,PO3459,AUD,34594.89,INPUT,Payment for goods,Oracle,2026-01-20,2026-01-13,34594.89,False,payment for goods,2026-02-23 16:50:30.516232,Raw_GL_Export.csv
TXN000135,2026-01-06,2025-12-30,2026-01,AUS01,5300,,EY Australia,INV25408,PO4323,GBP,13066.25,GST-FREE,Payment for services,API Import,2026-01-06,2025-12-30,13066.25,False,payment for services,2026-02-23 16:50:30.516232,Raw_GL_Export.csv
TXN000136,02/25/2026,02/24/2026,2026-02,AUS01,5420,,Hays,INV89689,PO4897,GBP,24503.2,GST,Payment for goods,API Import,2026-02-25,2026-02-24,24503.2,False,payment for goods,2026-02-23 16:50:30.516232,Raw_GL_Export.csv
TXN000137,22-12-2025,14-12-2025,2025-12,AUS01,5410,,Optus Pty,INV42075,PO5556,AUD,27094.62,GST,Payment for license,API Import,2025-12-22,2025-12-14,27094.62,False,payment for license,2026-02-23 16:50:30.516232,Raw_GL_Export.csv
TXN000138,27/01/2026,26/01/2026,2026-01,AUS01,5120,,Zoom,INV29054,PO5889,AUD,29432.13,GST,Payment for subscription,SAP,2026-01-27,2026-01-26,29432.13,False,payment for subscription,2026-02-23 16:50:30.516232,Raw_GL_Export.csv
TXN000139,2025-08-02,2025-07-26,2025-08,AUS01,5120,,Adobe,INV69682,PO6901,NZD,27537.93,GST-FREE,Payment for services,SAP,2025-08-02,2025-07-26,27537.93,False,payment for services,2026-02-23 16:50:30.516232,Raw_GL_Export.csv
TXN000140,02/25/2026,02/19/2026,2026-02,AUS01,5320,,Federal Express,INV48382,PO2999,AUD,34154.05,GST,Payment for subscription,Workday,2026-02-25,2026-02-19,34154.05,False,payment for subscription,2026-02-23 16:50:30.516232,Raw_GL_Export.csv
TXN000141,17-01-2026,08-01-2026,2026-01,AUS01,5200,,Workday,INV73394,PO5705,AUD,5007.67,GST,Payment for consulting,API Import,2026-01-17,2026-01-08,5007.67,False,payment for consulting,2026-02-23 16:50:30.516232,Raw_GL_Export.csv
TXN000142,02/28/2026,02/23/2026,2026-02,AUS01,5510,,WeWork Australia,INV78118,PO9154,USD,27681.62,EXPORT,Payment for consulting,Oracle,2026-02-28,2026-02-23,27681.62,False,payment for consulting,2026-02-23 16:50:30.516232,Raw_GL_Export.csv
TXN000143,20/10/2025,15/10/2025,2025-10,AUS01,5200,,AWS,INV37175,PO7793,AUD,1177.01,GST,Payment for consulting,SAP,2025-10-20,2025-10-15,1177.01,False,payment for consulting,2026-02-23 16:50:30.516232,Raw_GL_Export.csv
TXN000144,02/11/2026,02/02/2026,2026-02,AUS01,5900,,Workday,INV43347,PO6042,AUD,28863.76,INPUT,Payment for subscription,API Import,2026-11-02,2026-02-02,28863.76,False,payment for subscription,2026-02-23 16:50:30.516232,Raw_GL_Export.csv
TXN000145,01/18/2026,01/17/2026,2026-01,AUS01,5100,,BCG,INV33020,,NZD,17882.61,GST,Payment for subscription,Manual Entry,2026-01-18,2026-01-17,17882.61,False,payment for subscription,2026-02-23 16:50:30.516232,Raw_GL_Export.csv
TXN000146,2026-02-16,2026-02-13,2026-02,AUS01,5500,,Zoom,INV70616,PO7782,GBP,40153.42,INPUT,Payment for services,API Import,2026-02-16,2026-02-13,40153.42,False,payment for services,2026-02-23 16:50:30.516232,Raw_GL_Export.csv
TXN000147,01/10/2025,01/01/2025,2025-01,AUS01,5520,,Amazon,INV56346,,USD,26025.15,INPUT,Payment for goods,Workday,2025-10-01,2025-01-01,26025.15,False,payment for goods,2026-02-23 16:50:30.516232,Raw_GL_Export.csv
TXN000148,2026-02-27,2026-02-21,2026-02,AUS01,5400,,Adobe,INV50407,PO6152,GBP,8513.31,GST,Payment for services,Workday,2026-02-27,2026-02-21,8513.31,False,payment for services,2026-02-23 16:50:30.516232,Raw_GL_Export.csv
TXN000149,2026-01-14,2026-01-06,2026-01,AUS01,5210,,Regus Australia,INV38329,PO3867,GBP,37342.64,INPUT,Payment for services,Workday,2026-01-14,2026-01-06,37342.64,False,payment for services,2026-02-23 16:50:30.516232,Raw_GL_Export.csv
TXN000150,2026-02-26,2026-02-22,2026-02,AUS01,5020,,Optus Pty,INV34931,PO8921,AUD,35976.24,GST-FREE,Payment for license,Workday,2026-02-26,2026-02-22,35976.24,False,payment for license,2026-02-23 16:50:30.516232,Raw_GL_Export.csv
TXN000151,02/25/2026,02/22/2026,2026-02,AUS01,5810,,GCP,INV70210,PO9558,USD,9312.9,GST,Payment for services,SAP,2026-02-25,2026-02-22,9312.9,False,payment for services,2026-02-23 16:50:30.516232,Raw_GL_Export.csv
TXN000152,2026-01-10,2025-12-31,2026-01,AUS01,5920,,Google,INV23513,PO6119,NZD,21062.73,GST,Payment for services,API Import,2026-01-10,2025-12-31,21062.73,False,payment for services,2026-02-23 16:50:30.516232,Raw_GL_Export.csv
TXN000153,01/25/2026,01/21/2026,2026-01,AUS01,5310,,SAP,INV67817,PO5467,USD,12966.88,INPUT,Payment for goods,Oracle,2026-01-25,2026-01-21,12966.88,False,payment for goods,2026-02-23 16:50:30.516232,Raw_GL_Export.csv
TXN000154,2026-01-09,2026-01-08,2026-01,AUS01,5610,,Robert Half International,INV82006,PO3319,AUD,9375.32,INPUT,Payment for subscription,API Import,2026-01-09,2026-01-08,9375.32,False,payment for subscription,2026-02-23 16:50:30.516232,Raw_GL_Export.csv
TXN000155,08/01/2026,06/01/2026,2026-01,AUS01,5300,,BCG,INV71700,PO1826,GBP,2377.61,GST,Payment for services,Manual Entry,2026-01-08,2026-01-06,2377.61,False,payment for services,2026-02-23 16:50:30.516232,Raw_GL_Export.csv
TXN000156,2025-10-02,2025-09-25,2025-10,AUS01,5400,,Oracle,INV53559,PO9740,GBP,27772.56,INPUT,Payment for services,Manual Entry,2025-10-02,2025-09-25,27772.56,False,payment for services,2026-02-23 16:50:30.516232,Raw_GL_Export.csv
TXN000157,19/06/2025,17/06/2025,2025-06,AUS01,5910,,LinkedIn Corp,INV71675,,AUD,20555.73,EXPORT,Payment for goods,Oracle,2025-06-19,2025-06-17,20555.73,False,payment for goods,2026-02-23 16:50:30.516232,Raw_GL_Export.csv
TXN000158,02/28/2026,02/22/2026,2026-02,AUS01,5400,,Oracle,INV69412,PO2070,NZD,35516.16,INPUT,Payment for consulting,SAP,2026-02-28,2026-02-22,35516.16,False,payment for consulting,2026-02-23 16:50:30.516232,Raw_GL_Export.csv
TXN000159,12-02-2026,04-02-2026,2026-02,AUS01,5920,,Adobe,INV76577,,NZD,34580.57,GST-FREE,Payment for services,Workday,2026-02-12,2026-02-04,34580.57,False,payment for services,2026-02-23 16:50:30.516232,Raw_GL_Export.csv
TXN000160,2025-06-18,2025-06-13,2025-06,AUS01,5520,,LinkedIn Corp,INV91379,,GBP,26615.06,GST-FREE,Payment for goods,Manual Entry,2025-06-18,2025-06-13,26615.06,False,payment for goods,2026-02-23 16:50:30.516232,Raw_GL_Export.csv
TXN000161,2025-02-13,2025-02-07,2025-02,AUS01,5200,,Telstra Corp,INV81372,PO3835,GBP,25567.78,INPUT,Payment for services,API Import,2025-02-13,2025-02-07,25567.78,False,payment for services,2026-02-23 16:50:30.516232,Raw_GL_Export.csv
TXN000162,27-06-2025,25-06-2025,2025-06,AUS01,5600,,LinkedIn Corp,INV33091,PO7648,NZD,25023.44,EXPORT,Payment for services,API Import,2025-06-27,2025-06-25,25023.44,False,payment for services,2026-02-23 16:50:30.516232,Raw_GL_Export.csv
TXN000163,04-02-2026,29-01-2026,2026-02,AUS01,5500,,MSFT,INV86122,PO1003,AUD,9870.77,GST-FREE,Payment for goods,Oracle,2026-02-04,2026-01-29,9870.77,False,payment for goods,2026-02-23 16:50:30.516232,Raw_GL_Export.csv
TXN000164,01/15/2026,01/08/2026,2026-01,AUS01,5610,,Optus Pty,INV49286,PO5989,USD,9334.21,INPUT,Payment for consulting,Workday,2026-01-15,2026-08-01,9334.21,False,payment for consulting,2026-02-23 16:50:30.516232,Raw_GL_Export.csv
TXN000165,2026-01-03,2025-12-24,2026-01,AUS01,5510,,DHL Express,INV58394,PO1870,USD,38377.48,GST,Payment for services,API Import,2026-01-03,2025-12-24,38377.48,False,payment for services,2026-02-23 16:50:30.516232,Raw_GL_Export.csv
TXN000166,02/27/2026,02/25/2026,2026-02,AUS01,5920,,KPMG Australia,INV91948,PO7271,AUD,10662.33,EXPORT,Payment for consulting,Manual Entry,2026-02-27,2026-02-25,10662.33,False,payment for consulting,2026-02-23 16:50:30.516232,Raw_GL_Export.csv
TXN000167,14/01/2026,11/01/2026,2026-01,AUS01,5500,,Slack,INV64687,,USD,25038.43,INPUT,Payment for goods,Oracle,2026-01-14,2026-01-11,25038.43,False,payment for goods,2026-02-23 16:50:30.516232,Raw_GL_Export.csv
TXN000168,2025-01-01,2024-12-31,2025-01,AUS01,5110,,Hays,INV21097,,GBP,43876.38,GST-FREE,Payment for consulting,Manual Entry,2025-01-01,2024-12-31,43876.38,False,payment for consulting,2026-02-23 16:50:30.516232,Raw_GL_Export.csv
TXN000169,26-02-2026,16-02-2026,2026-02,AUS01,5120,,LinkedIn Corp,INV60425,PO4044,GBP,24887.05,EXPORT,Payment for consulting,API Import,2026-02-26,2026-02-16,24887.05,False,payment for consulting,2026-02-23 16:50:30.516232,Raw_GL_Export.csv
TXN000170,01-11-2025,28-10-2025,2025-11,AUS01,5710,,Robert Half International,INV14385,PO8917,NZD,18546.62,INPUT,Payment for subscription,SAP,2025-11-01,2025-10-28,18546.62,False,payment for subscription,2026-02-23 16:50:30.516232,Raw_GL_Export.csv
TXN000171,19-09-2025,17-09-2025,2025-09,AUS01,5110,,PWC,INV42142,PO2279,GBP,23311.03,GST,Payment for license,API Import,2025-09-19,2025-09-17,23311.03,False,payment for license,2026-02-23 16:50:30.516232,Raw_GL_Export.csv
TXN000172,2025-05-10,2025-05-04,2025-05,AUS01,5520,,AWS,INV85230,PO7897,GBP,20486.16,EXPORT,Payment for subscription,Workday,2025-05-10,2025-05-04,20486.16,False,payment for subscription,2026-02-23 16:50:30.516232,Raw_GL_Export.csv
TXN000173,10/01/2026,09/01/2026,2026-01,AUS01,5710,,EY Australia,INV85778,,NZD,2857.66,EXPORT,Payment for services,Workday,2026-01-10,2026-01-09,2857.66,False,payment for services,2026-02-23 16:50:30.516232,Raw_GL_Export.csv
TXN000174,2026-01-26,2026-01-21,2026-01,AUS01,5500,,Google,INV43036,,USD,22801.27,INPUT,Payment for subscription,Workday,2026-01-26,2026-01-21,22801.27,False,payment for subscription,2026-02-23 16:50:30.516232,Raw_GL_Export.csv
TXN000175,02/28/2026,02/27/2026,2026-02,AUS01,5800,,Atlassian Pty,INV96396,PO3873,USD,40964.9,GST-FREE,Payment for subscription,Oracle,2026-02-28,2026-02-27,40964.9,False,payment for subscription,2026-02-23 16:50:30.516232,Raw_GL_Export.csv
TXN000176,16/01/2026,07/01/2026,2026-01,AUS01,5920,,Microsoft,INV88059,PO3525,NZD,44284.82,GST-FREE,Payment for consulting,Manual Entry,2026-01-16,2026-01-07,44284.82,False,payment for consulting,2026-02-23 16:50:30.516232,Raw_GL_Export.csv
TXN000177,25-01-2026,21-01-2026,2026-01,AUS01,5700,,Optus Pty,INV17120,PO2900,USD,9567.47,INPUT,Payment for services,Oracle,2026-01-25,2026-01-21,9567.47,False,payment for services,2026-02-23 16:50:30.516232,Raw_GL_Export.csv
TXN000178,15-01-2026,07-01-2026,2026-01,AUS01,5300,,Seek Limited,INV72205,,USD,17153.06,EXPORT,Payment for license,Manual Entry,2026-01-15,2026-01-07,17153.06,False,payment for license,2026-02-23 16:50:30.516232,Raw_GL_Export.csv
TXN000179,01/01/2026,12/24/2025,2026-01,AUS01,5400,,McKinsey,INV66595,PO5466,AUD,4471.66,INPUT,Payment for subscription,Workday,2026-01-01,2025-12-24,4471.66,False,payment for subscription,2026-02-23 16:50:30.516232,Raw_GL_Export.csv
TXN000180,2026-01-09,2026-01-04,2026-01,AUS01,5620,,DHL Express,INV98065,PO4193,GBP,34814.48,GST-FREE,Payment for license,Workday,2026-01-09,2026-01-04,34814.48,False,payment for license,2026-02-23 16:50:30.516232,Raw_GL_Export.csv
TXN000181,22/04/2025,16/04/2025,2025-04,AUS01,5520,,AWS,INV63903,,AUD,37442.86,GST,Payment for services,Manual Entry,2025-04-22,2025-04-16,37442.86,False,payment for services,2026-02-23 16:50:30.516232,Raw_GL_Export.csv
TXN000182,12/01/2026,07/01/2026,2026-01,AUS01,5220,,SAP,INV17455,PO4552,AUD,1164.15,GST,Payment for license,SAP,2026-01-12,2026-01-07,1164.15,False,payment for license,2026-02-23 16:50:30.516232,Raw_GL_Export.csv
TXN000183,2026-02-23,2026-02-21,2026-02,AUS01,5920,,Slack,INV24528,PO5150,GBP,29572.12,GST-FREE,Payment for subscription,Manual Entry,2026-02-23,2026-02-21,29572.12,False,payment for subscription,2026-02-23 16:50:30.516232,Raw_GL_Export.csv
TXN000184,2026-02-22,2026-02-14,2026-02,AUS01,5220,,Telstra Corp,INV46344,PO7271,NZD,11654.41,GST,Payment for consulting,Workday,2026-02-22,2026-02-14,11654.41,False,payment for consulting,2026-02-23 16:50:30.516232,Raw_GL_Export.csv
TXN000185,01/02/2026,12/28/2025,2026-01,AUS01,5120,,Optus Pty,INV89993,PO9061,AUD,22178.31,GST-FREE,Payment for services,Oracle,2026-02-01,2025-12-28,22178.31,False,payment for services,2026-02-23 16:50:30.516232,Raw_GL_Export.csv
TXN000186,18-02-2026,14-02-2026,2026-02,AUS01,5610,,GCP,INV14569,,GBP,32221.47,GST,Payment for license,Workday,2026-02-18,2026-02-14,32221.47,False,payment for license,2026-02-23 16:50:30.516232,Raw_GL_Export.csv
TXN000187,25-02-2026,24-02-2026,2026-02,AUS01,5500,,Zoom,INV44922,,AUD,41986.93,EXPORT,Payment for subscription,Manual Entry,2026-02-25,2026-02-24,41986.93,False,payment for subscription,2026-02-23 16:50:30.516232,Raw_GL_Export.csv
TXN000188,2026-01-19,2026-01-10,2026-01,AUS01,5710,,Hays,INV80795,,GBP,19678.99,GST,Payment for consulting,Manual Entry,2026-01-19,2026-01-10,19678.99,False,payment for consulting,2026-02-23 16:50:30.516232,Raw_GL_Export.csv
TXN000189,01/04/2026,12/29/2025,2026-01,AUS01,5700,,EY Australia,INV57887,PO6571,GBP,2578.24,GST,Payment for services,Manual Entry,2026-04-01,2025-12-29,2578.24,False,payment for services,2026-02-23 16:50:30.516232,Raw_GL_Export.csv
TXN000190,01/25/2026,01/21/2026,2026-01,AUS01,5120,,Microsoft,INV61131,PO6886,GBP,29766.96,INPUT,Payment for consulting,SAP,2026-01-25,2026-01-21,29766.96,False,payment for consulting,2026-02-23 16:50:30.516232,Raw_GL_Export.csv
TXN000191,21-06-2025,17-06-2025,2025-06,AUS01,5110,,Microsoft,INV74124,PO9856,USD,1238.87,GST-FREE,Payment for subscription,Manual Entry,2025-06-21,2025-06-17,1238.87,False,payment for subscription,2026-02-23 16:50:30.516232,Raw_GL_Export.csv
TXN000192,18-02-2026,17-02-2026,2026-02,AUS01,5010,,BCG,INV63150,,AUD,15263.57,GST,Payment for license,Manual Entry,2026-02-18,2026-02-17,15263.57,False,payment for license,2026-02-23 16:50:30.516232,Raw_GL_Export.csv
TXN000193,22/01/2026,12/01/2026,2026-01,AUS01,5210,,Salesforce,INV95699,,AUD,33122.14,EXPORT,Payment for license,SAP,2026-01-22,2026-01-12,33122.14,False,payment for license,2026-02-23 16:50:30.516232,Raw_GL_Export.csv
TXN000194,08/01/2026,07/01/2026,2026-01,AUS01,5120,,MSFT,INV69793,PO2047,NZD,36951.19,GST,Payment for services,SAP,2026-01-08,2026-01-07,36951.19,False,payment for services,2026-02-23 16:50:30.516232,Raw_GL_Export.csv
TXN000195,16/02/2026,14/02/2026,2026-02,AUS01,5900,,SAP,INV52498,,GBP,15246.71,EXPORT,Payment for license,API Import,2026-02-16,2026-02-14,15246.71,False,payment for license,2026-02-23 16:50:30.516232,Raw_GL_Export.csv
TXN000196,02/05/2026,02/01/2026,2026-02,AUS01,5810,,Microsoft,INV45899,,USD,15164.12,GST,Payment for consulting,Oracle,2026-05-02,2026-01-02,15164.12,False,payment for consulting,2026-02-23 16:50:30.516232,Raw_GL_Export.csv
TXN000197,01/23/2025,01/14/2025,2025-01,AUS01,5120,,Optus Pty,INV27481,,USD,41662.83,GST,Payment for license,Manual Entry,2025-01-23,2025-01-14,41662.83,False,payment for license,2026-02-23 16:50:30.516232,Raw_GL_Export.csv
TXN000198,25/03/2025,24/03/2025,2025-03,AUS01,5500,,Google,INV95426,PO5648,AUD,424.36,GST,Payment for consulting,Manual Entry,2025-03-25,2025-03-24,424.36,False,payment for consulting,2026-02-23 16:50:30.516232,Raw_GL_Export.csv
TXN000199,23/02/2026,19/02/2026,2026-02,AUS01,5110,,PWC,INV90024,PO3949,GBP,18600.21,GST-FREE,Payment for consulting,API Import,2026-02-23,2026-02-19,18600.21,False,payment for consulting,2026-02-23 16:50:30.516232,Raw_GL_Export.csv
TXN000200,10/03/2025,09/27/2025,2025-10,AUS01,5410,,AWS,INV91123,PO9842,USD,8716.44,GST,Payment for license,Oracle,2025-03-10,2025-09-27,8716.44,False,payment for license,2026-02-23 16:50:30.516232,Raw_GL_Export.csv
TXN000201,15/01/2026,10/01/2026,2026-01,AUS01,5010,CC9198,Atlassian Pty,INV75210,,USD,30867.44,EXPORT,Payment for services,SAP,2026-01-15,2026-01-10,30867.44,False,payment for services,2026-02-23 16:50:30.516232,Raw_GL_Export.csv
TXN000202,07/21/2025,07/16/2025,2025-07,AUS01,5200,CC9445,Deloitte Touche,INV15677,,NZD,27795.19,EXPORT,Payment for services,API Import,2025-07-21,2025-07-16,27795.19,False,payment for services,2026-02-23 16:50:30.516232,Raw_GL_Export.csv
TXN000203,06/02/2026,05/02/2026,2026-02,AUS01,5500,CC9527,Atlassian Pty,INV87687,PO7865,AUD,40289.05,EXPORT,Payment for goods,Workday,2026-02-06,2026-02-05,40289.05,False,payment for goods,2026-02-23 16:50:30.516232,Raw_GL_Export.csv
TXN000204,2026-01-08,2026-01-02,2026-01,AUS01,5210,CC9100,Accenture Pty,INV38922,,GBP,39157.9,EXPORT,Payment for license,Manual Entry,2026-01-08,2026-01-02,39157.9,False,payment for license,2026-02-23 16:50:30.516232,Raw_GL_Export.csv
TXN000205,02-02-2026,30-01-2026,2026-02,AUS01,5200,CC9950,LinkedIn Corp,INV69996,PO6875,USD,17491.13,GST-FREE,Payment for subscription,Oracle,2026-02-02,2026-01-30,17491.13,False,payment for subscription,2026-02-23 16:50:30.516232,Raw_GL_Export.csv
TXN000206,11/06/2025,10/06/2025,2025-06,AUS01,5710,CC9582,MSFT,INV70106,PO6629,NZD,6228.92,EXPORT,Payment for goods,Workday,2025-06-11,2025-06-10,6228.92,False,payment for goods,2026-02-23 16:50:30.516232,Raw_GL_Export.csv
TXN000207,20/01/2026,10/01/2026,2026-01,AUS01,5120,CC9591,ServiceNow Inc,INV38369,PO8581,AUD,18585.16,EXPORT,Payment for subscription,SAP,2026-01-20,2026-01-10,18585.16,False,payment for subscription,2026-02-23 16:50:30.516232,Raw_GL_Export.csv
TXN000208,24-02-2026,20-02-2026,2026-02,AUS01,5210,CC9335,Telstra Corp,INV85196,PO7844,USD,40142.84,GST-FREE,Payment for services,SAP,2026-02-24,2026-02-20,40142.84,False,payment for services,2026-02-23 16:50:30.516232,Raw_GL_Export.csv
TXN000209,2026-01-16,2026-01-09,2026-01,AUS01,5510,CC9403,Seek Limited,INV20890,PO1203,AUD,20414.62,GST-FREE,Payment for consulting,Oracle,2026-01-16,2026-01-09,20414.62,False,payment for consulting,2026-02-23 16:50:30.516232,Raw_GL_Export.csv
TXN000210,01/05/2026,12/31/2025,2026-01,AUS01,5210,CC9663,Google,INV31207,PO1399,AUD,21642.25,INPUT,Payment for consulting,Manual Entry,2026-05-01,2025-12-31,21642.25,False,payment for consulting,2026-02-23 16:50:30.516232,Raw_GL_Export.csv
TXN000211,25/05/2025,18/05/2025,2025-05,AUS01,5120,CC9808,Regus Australia,INV92222,,GBP,31705.2,GST,Payment for subscription,API Import,2025-05-25,2025-05-18,31705.2,False,payment for subscription,2026-02-23 16:50:30.516232,Raw_GL_Export.csv
TXN000212,01/02/2026,12/26/2025,2026-01,AUS01,5810,CC9276,Workday,INV17184,PO6963,AUD,27958.44,INPUT,Payment for services,SAP,2026-02-01,2025-12-26,27958.44,False,payment for services,2026-02-23 16:50:30.516232,Raw_GL_Export.csv
TXN000213,11/13/2025,11/05/2025,2025-11,AUS01,5610,CC9041,Regus Australia,INV83499,PO4354,NZD,7969.51,GST,Payment for goods,Workday,2025-11-13,2025-05-11,7969.51,False,payment for goods,2026-02-23 16:50:30.516232,Raw_GL_Export.csv
TXN000214,2026-02-08,2026-01-31,2026-02,AUS01,5800,CC9961,Workday,INV76003,PO5540,USD,14488.83,INPUT,Payment for services,SAP,2026-02-08,2026-01-31,14488.83,False,payment for services,2026-02-23 16:50:30.516232,Raw_GL_Export.csv
TXN000215,09/12/2025,09/04/2025,2025-09,AUS01,5500,CC9513,Atlassian Pty,INV69241,PO2075,GBP,31971.16,INPUT,Payment for goods,Manual Entry,2025-12-09,2025-04-09,31971.16,False,payment for goods,2026-02-23 16:50:30.516232,Raw_GL_Export.csv
TXN000216,2026-02-03,2026-01-27,2026-02,AUS01,5120,CC9295,Salesforce,INV29392,PO4346,AUD,7498.0,GST,Payment for license,SAP,2026-02-03,2026-01-27,7498.0,False,payment for license,2026-02-23 16:50:30.516232,Raw_GL_Export.csv
TXN000217,10-02-2026,01-02-2026,2026-02,AUS01,5110,CC9485,WeWork Australia,INV48209,,GBP,20029.32,GST,Payment for services,Oracle,2026-02-10,2026-02-01,20029.32,False,payment for services,2026-02-23 16:50:30.516232,Raw_GL_Export.csv
TXN000218,05/27/2025,05/20/2025,2025-05,AUS01,5600,CC9351,McKinsey,INV70031,PO3161,GBP,26741.74,EXPORT,Payment for subscription,Oracle,2025-05-27,2025-05-20,26741.74,False,payment for subscription,2026-02-23 16:50:30.516232,Raw_GL_Export.csv
TXN000219,04/26/2025,04/22/2025,2025-04,AUS01,5500,CC9380,KPMG Australia,INV69759,PO3634,AUD,6760.39,INPUT,Payment for license,Workday,2025-04-26,2025-04-22,6760.39,False,payment for license,2026-02-23 16:50:30.516232,Raw_GL_Export.csv
TXN000220,06/12/2025,03/12/2025,2025-12,AUS01,5120,CC9243,Atlassian Pty,INV67788,,AUD,44720.41,GST-FREE,Payment for goods,Oracle,2025-12-06,2025-12-03,44720.41,False,payment for goods,2026-02-23 16:50:30.516232,Raw_GL_Export.csv
TXN000221,2025-12-18,2025-12-12,2025-12,AUS01,5320,CC9151,Regus Australia,INV79945,PO1408,GBP,24340.01,GST-FREE,Payment for consulting,Manual Entry,2025-12-18,2025-12-12,24340.01,False,payment for consulting,2026-02-23 16:50:30.516232,Raw_GL_Export.csv
TXN000222,25/12/2025,17/12/2025,2025-12,AUS01,5310,CC9159,AWS,INV72116,PO3409,NZD,29161.25,INPUT,Payment for license,Manual Entry,2025-12-25,2025-12-17,29161.25,False,payment for license,2026-02-23 16:50:30.516232,Raw_GL_Export.csv
TXN000223,2026-02-11,2026-02-03,2026-02,AUS01,5010,CC9142,Atlassian Pty,INV68454,PO6347,NZD,1213.32,GST-FREE,Payment for services,API Import,2026-02-11,2026-02-03,1213.32,False,payment for services,2026-02-23 16:50:30.516232,Raw_GL_Export.csv
TXN000224,21/01/2026,11/01/2026,2026-01,AUS01,5510,CC9227,PWC,INV98744,PO2431,USD,1112.43,EXPORT,Payment for license,Manual Entry,2026-01-21,2026-01-11,1112.43,False,payment for license,2026-02-23 16:50:30.516232,Raw_GL_Export.csv
TXN000225,07-01-2026,01-01-2026,2026-01,AUS01,5610,CC9619,Robert Half International,INV62108,,AUD,40889.27,INPUT,Payment for consulting,Workday,2026-01-07,2026-01-01,40889.27,False,payment for consulting,2026-02-23 16:50:30.516232,Raw_GL_Export.csv
TXN000226,01/13/2026,01/12/2026,2026-01,AUS01,5300,CC9353,WeWork Australia,INV38271,PO8278,NZD,43990.81,GST,Payment for consulting,Manual Entry,2026-01-13,2026-12-01,43990.81,False,payment for consulting,2026-02-23 16:50:30.516232,Raw_GL_Export.csv
TXN000227,10/01/2026,03/01/2026,2026-01,AUS01,5800,CC9917,AusPost,INV28827,,USD,37614.47,GST,Payment for consulting,API Import,2026-01-10,2026-01-03,37614.47,False,payment for consulting,2026-02-23 16:50:30.516232,Raw_GL_Export.csv
TXN000228,2026-01-11,2026-01-01,2026-01,AUS01,5810,CC9384,Google,INV64331,,AUD,18484.78,INPUT,Payment for consulting,API Import,2026-01-11,2026-01-01,18484.78,False,payment for consulting,2026-02-23 16:50:30.516232,Raw_GL_Export.csv
TXN000229,25/01/2026,21/01/2026,2026-01,AUS01,5120,CC9852,Federal Express,INV49582,PO5979,NZD,24968.63,GST,Payment for consulting,API Import,2026-01-25,2026-01-21,24968.63,False,payment for consulting,2026-02-23 16:50:30.516232,Raw_GL_Export.csv
TXN000230,24-02-2026,20-02-2026,2026-02,AUS01,5000,CC9810,AWS,INV26276,PO5713,USD,11894.2,EXPORT,Payment for consulting,Oracle,2026-02-24,2026-02-20,11894.2,False,payment for consulting,2026-02-23 16:50:30.516232,Raw_GL_Export.csv
TXN000231,16/01/2026,15/01/2026,2026-01,AUS01,5100,CC9783,PWC,INV88497,PO8872,GBP,44745.55,GST,Payment for license,Manual Entry,2026-01-16,2026-01-15,44745.55,False,payment for license,2026-02-23 16:50:30.516232,Raw_GL_Export.csv
TXN000232,10/28/2025,10/20/2025,2025-10,AUS01,5710,CC9837,Atlassian Pty,INV44018,,NZD,23112.41,GST,Payment for services,Oracle,2025-10-28,2025-10-20,23112.41,False,payment for services,2026-02-23 16:50:30.516232,Raw_GL_Export.csv
TXN000233,11-02-2025,08-02-2025,2025-02,AUS01,5320,CC9167,MSFT,INV16385,,NZD,16316.24,INPUT,Payment for license,SAP,2025-02-11,2025-02-08,16316.24,False,payment for license,2026-02-23 16:50:30.516232,Raw_GL_Export.csv
TXN000234,17/02/2026,14/02/2026,2026-02,AUS01,5810,CC9096,Adobe,INV45580,PO6939,NZD,39272.7,INPUT,Payment for services,API Import,2026-02-17,2026-02-14,39272.7,False,payment for services,2026-02-23 16:50:30.516232,Raw_GL_Export.csv
TXN000235,12/19/2025,12/16/2025,2025-12,AUS01,5000,CC9140,KPMG Australia,INV54605,PO3671,NZD,35068.47,EXPORT,Payment for services,Oracle,2025-12-19,2025-12-16,35068.47,False,payment for services,2026-02-23 16:50:30.516232,Raw_GL_Export.csv
TXN000236,05/02/2026,01/02/2026,2026-02,AUS01,5900,CC9918,Atlassian Pty,INV25278,PO1284,GBP,20776.06,GST,Payment for consulting,Workday,2026-02-05,2026-02-01,20776.06,False,payment for consulting,2026-02-23 16:50:30.516232,Raw_GL_Export.csv
TXN000237,01/10/2026,01/07/2026,2026-01,AUS01,5910,CC9452,BCG,INV25544,,USD,31974.28,GST,Payment for goods,Oracle,2026-10-01,2026-07-01,31974.28,False,payment for goods,2026-02-23 16:50:30.516232,Raw_GL_Export.csv
TXN000238,10/01/2026,06/01/2026,2026-01,AUS01,5110,CC9080,Telstra Corp,INV66524,,AUD,3590.31,EXPORT,Payment for services,SAP,2026-01-10,2026-01-06,3590.31,False,payment for services,2026-02-23 16:50:30.516232,Raw_GL_Export.csv
TXN000239,2026-02-26,2026-02-18,2026-02,AUS01,5100,CC9930,Deloitte Touche,INV22648,PO4365,AUD,3074.51,GST,Payment for license,Oracle,2026-02-26,2026-02-18,3074.51,False,payment for license,2026-02-23 16:50:30.516232,Raw_GL_Export.csv
TXN000240,04/06/2025,04/05/2025,2025-04,AUS01,5020,CC9149,PWC,INV76179,PO2623,NZD,15913.93,GST-FREE,Payment for license,SAP,2025-06-04,2025-05-04,15913.93,False,payment for license,2026-02-23 16:50:30.516232,Raw_GL_Export.csv
TXN000241,17/01/2026,13/01/2026,2026-01,AUS01,5300,CC9175,AWS,INV58033,PO4033,AUD,41598.02,EXPORT,Payment for consulting,SAP,2026-01-17,2026-01-13,41598.02,False,payment for consulting,2026-02-23 16:50:30.516232,Raw_GL_Export.csv
TXN000242,10/06/2025,09/29/2025,2025-10,AUS01,5410,CC9219,Robert Half International,INV26202,PO9515,USD,18400.25,INPUT,Payment for goods,Manual Entry,2025-06-10,2025-09-29,18400.25,False,payment for goods,2026-02-23 16:50:30.516232,Raw_GL_Export.csv
TXN000243,05/25/2025,05/20/2025,2025-05,AUS01,5520,CC9739,Microsoft,INV60434,,AUD,14832.38,GST,Payment for license,Workday,2025-05-25,2025-05-20,14832.38,False,payment for license,2026-02-23 16:50:30.516232,Raw_GL_Export.csv
TXN000244,22-01-2026,18-01-2026,2026-01,AUS01,5520,CC9417,KPMG Australia,INV72347,PO7020,GBP,8576.45,GST,Payment for goods,SAP,2026-01-22,2026-01-18,8576.45,False,payment for goods,2026-02-23 16:50:30.516232,Raw_GL_Export.csv
TXN000245,22-02-2026,20-02-2026,2026-02,AUS01,5400,CC9448,Google,INV87405,PO3764,AUD,6537.2,EXPORT,Payment for services,Workday,2026-02-22,2026-02-20,6537.2,False,payment for services,2026-02-23 16:50:30.516232,Raw_GL_Export.csv
TXN000246,01/07/2026,01/03/2026,2026-01,AUS01,5610,CC9864,DHL Express,INV75419,,AUD,10555.85,EXPORT,Payment for license,API Import,2026-07-01,2026-03-01,10555.85,False,payment for license,2026-02-23 16:50:30.516232,Raw_GL_Export.csv
TXN000247,09-02-2026,03-02-2026,2026-02,AUS01,5500,CC9682,DHL Express,INV69589,,GBP,23062.51,GST-FREE,Payment for subscription,Manual Entry,2026-02-09,2026-02-03,23062.51,False,payment for subscription,2026-02-23 16:50:30.516232,Raw_GL_Export.csv
TXN000248,16/02/2026,13/02/2026,2026-02,AUS01,5000,CC9101,MSFT,INV33474,PO6356,AUD,22466.26,GST,Payment for goods,Workday,2026-02-16,2026-02-13,22466.26,False,payment for goods,2026-02-23 16:50:30.516232,Raw_GL_Export.csv
TXN000249,2025-08-20,2025-08-18,2025-08,AUS01,5700,CC9769,Hays,INV74258,PO9887,GBP,9166.74,EXPORT,Payment for subscription,API Import,2025-08-20,2025-08-18,9166.74,False,payment for subscription,2026-02-23 16:50:30.516232,Raw_GL_Export.csv
TXN000250,2026-02-18,2026-02-17,2026-02,AUS01,5410,CC9901,Atlassian Pty,INV68006,PO1538,GBP,20310.19,EXPORT,Payment for goods,API Import,2026-02-18,2026-02-17,20310.19,False,payment for goods,2026-02-23 16:50:30.516232,Raw_GL_Export.csv
TXN000251,01/22/2026,01/19/2026,2026-01,AUS01,5500,CC9441,Slack,INV24336,PO9037,NZD,32235.97,EXPORT,Payment for license,API Import,2026-01-22,2026-01-19,32235.97,False,payment for license,2026-02-23 16:50:30.516232,Raw_GL_Export.csv
TXN000252,19-01-2026,11-01-2026,2026-01,AUS01,5520,CC9874,Adobe,INV87469,PO6779,AUD,17673.18,EXPORT,Payment for subscription,Workday,2026-01-19,2026-01-11,17673.18,False,payment for subscription,2026-02-23 16:50:30.516232,Raw_GL_Export.csv
TXN000253,2025-07-02,2025-06-22,2025-07,AUS01,5010,CC9131,Regus Australia,INV91940,PO2594,NZD,36448.95,GST,Payment for consulting,Workday,2025-07-02,2025-06-22,36448.95,False,payment for consulting,2026-02-23 16:50:30.516232,Raw_GL_Export.csv
TXN000254,12-02-2026,06-02-2026,2026-02,AUS01,5010,CC9677,Accenture Pty,INV87664,,USD,10634.53,INPUT,Payment for services,Workday,2026-02-12,2026-02-06,10634.53,False,payment for services,2026-02-23 16:50:30.516232,Raw_GL_Export.csv
TXN000255,02/04/2026,02/01/2026,2026-02,AUS01,5000,CC9551,McKinsey,INV84455,PO7900,AUD,20794.83,EXPORT,Payment for subscription,SAP,2026-04-02,2026-01-02,20794.83,False,payment for subscription,2026-02-23 16:50:30.516232,Raw_GL_Export.csv
TXN000256,23-02-2026,13-02-2026,2026-02,AUS01,5000,CC9324,Federal Express,INV74010,,GBP,14576.72,GST,Payment for goods,Workday,2026-02-23,2026-02-13,14576.72,False,payment for goods,2026-02-23 16:50:30.516232,Raw_GL_Export.csv
TXN000257,02/16/2026,02/13/2026,2026-02,AUS01,5610,CC9306,Regus Australia,INV80232,,GBP,9158.96,GST,Payment for subscription,SAP,2026-02-16,2026-02-13,9158.96,False,payment for subscription,2026-02-23 16:50:30.516232,Raw_GL_Export.csv
TXN000258,10-02-2026,06-02-2026,2026-02,AUS01,5610,CC9760,Google,INV18817,PO9700,AUD,26674.72,INPUT,Payment for consulting,Manual Entry,2026-02-10,2026-02-06,26674.72,False,payment for consulting,2026-02-23 16:50:30.516232,Raw_GL_Export.csv
TXN000259,02/07/2026,02/05/2026,2026-02,AUS01,5620,CC9843,EY Australia,INV36224,PO5116,NZD,19537.68,INPUT,Payment for license,API Import,2026-07-02,2026-05-02,19537.68,False,payment for license,2026-02-23 16:50:30.516232,Raw_GL_Export.csv
TXN000260,15/01/2026,14/01/2026,2026-01,AUS01,5620,CC9720,Oracle,INV45118,PO9728,GBP,9661.58,EXPORT,Payment for license,Manual Entry,2026-01-15,2026-01-14,9661.58,False,payment for license,2026-02-23 16:50:30.516232,Raw_GL_Export.csv
TXN000261,2026-01-19,2026-01-10,2026-01,AUS01,5200,CC9373,LinkedIn Corp,INV67067,PO2055,USD,10892.79,INPUT,Payment for goods,Manual Entry,2026-01-19,2026-01-10,10892.79,False,payment for goods,2026-02-23 16:50:30.516232,Raw_GL_Export.csv
TXN000262,01/09/2026,01/06/2026,2026-01,AUS01,5220,CC9703,Accenture Pty,INV35154,,GBP,10807.91,GST-FREE,Payment for subscription,Manual Entry,2026-09-01,2026-06-01,10807.91,False,payment for subscription,2026-02-23 16:50:30.516232,Raw_GL_Export.csv
TXN000263,16-01-2026,09-01-2026,2026-01,AUS01,5620,CC9927,Microsoft,INV13819,,USD,7255.2,GST-FREE,Payment for subscription,API Import,2026-01-16,2026-01-09,7255.2,False,payment for subscription,2026-02-23 16:50:30.516232,Raw_GL_Export.csv
TXN000264,2026-01-06,2025-12-29,2026-01,AUS01,5900,CC9020,MSFT,INV18333,PO7668,AUD,14194.32,INPUT,Payment for subscription,SAP,2026-01-06,2025-12-29,14194.32,False,payment for subscription,2026-02-23 16:50:30.516232,Raw_GL_Export.csv
TXN000265,13/02/2026,09/02/2026,2026-02,AUS01,5100,CC9584,Robert Half International,INV75070,PO4900,AUD,23535.89,INPUT,Payment for license,SAP,2026-02-13,2026-02-09,23535.89,False,payment for license,2026-02-23 16:50:30.516232,Raw_GL_Export.csv
TXN000266,10/25/2025,10/19/2025,2025-10,AUS01,5910,CC9598,Federal Express,INV28910,,USD,42103.95,GST-FREE,Payment for goods,Workday,2025-10-25,2025-10-19,42103.95,False,payment for goods,2026-02-23 16:50:30.516232,Raw_GL_Export.csv
TXN000267,15-04-2025,10-04-2025,2025-04,AUS01,5920,CC9603,MSFT,INV51482,PO8780,GBP,24052.8,GST,Payment for goods,Workday,2025-04-15,2025-04-10,24052.8,False,payment for goods,2026-02-23 16:50:30.516232,Raw_GL_Export.csv
TXN000268,26/01/2026,20/01/2026,2026-01,AUS01,5500,CC9732,Regus Australia,INV96798,PO1895,NZD,1046.23,GST,Payment for goods,Workday,2026-01-26,2026-01-20,1046.23,False,payment for goods,2026-02-23 16:50:30.516232,Raw_GL_Export.csv
TXN000269,18-12-2025,13-12-2025,2025-12,AUS01,5620,CC9981,Regus Australia,INV67986,PO7438,AUD,24117.49,GST-FREE,Payment for subscription,Workday,2025-12-18,2025-12-13,24117.49,False,payment for subscription,2026-02-23 16:50:30.516232,Raw_GL_Export.csv
TXN000270,03/02/2026,29/01/2026,2026-02,AUS01,5200,CC9880,Adobe,INV14440,,GBP,28447.74,EXPORT,Payment for services,Manual Entry,2026-02-03,2026-01-29,28447.74,False,payment for services,2026-02-23 16:50:30.516232,Raw_GL_Export.csv
TXN000271,16-01-2026,10-01-2026,2026-01,AUS01,5710,CC9432,GCP,INV56118,PO9973,USD,31461.85,GST,Payment for subscription,Manual Entry,2026-01-16,2026-01-10,31461.85,False,payment for subscription,2026-02-23 16:50:30.516232,Raw_GL_Export.csv
TXN000272,2026-01-23,2026-01-22,2026-01,AUS01,5620,CC9656,Oracle,INV10403,PO6006,GBP,35616.77,GST-FREE,Payment for subscription,API Import,2026-01-23,2026-01-22,35616.77,False,payment for subscription,2026-02-23 16:50:30.516232,Raw_GL_Export.csv
TXN000273,2025-02-03,2025-01-31,2025-02,AUS01,5210,CC9528,Slack,INV69177,PO3187,GBP,35689.64,INPUT,Payment for subscription,Oracle,2025-02-03,2025-01-31,35689.64,False,payment for subscription,2026-02-23 16:50:30.516232,Raw_GL_Export.csv
TXN000274,02/22/2026,02/17/2026,2026-02,AUS01,5200,CC9086,AusPost,INV84762,,NZD,8266.83,EXPORT,Payment for services,API Import,2026-02-22,2026-02-17,8266.83,False,payment for services,2026-02-23 16:50:30.516232,Raw_GL_Export.csv
TXN000275,21/02/2026,19/02/2026,2026-02,AUS01,5420,CC9203,Deloitte Touche,INV88694,,USD,2335.26,EXPORT,Payment for services,Workday,2026-02-21,2026-02-19,2335.26,False,payment for services,2026-02-23 16:50:30.516232,Raw_GL_Export.csv
TXN000276,2025-09-06,2025-09-05,2025-09,AUS01,5710,CC9538,Telstra Corp,INV25533,,GBP,37243.86,EXPORT,Payment for goods,Oracle,2025-09-06,2025-09-05,37243.86,False,payment for goods,2026-02-23 16:50:30.516232,Raw_GL_Export.csv
TXN000277,12/28/2025,12/23/2025,2025-12,AUS01,5800,CC9506,Federal Express,INV88654,,USD,19465.76,GST-FREE,Payment for subscription,Oracle,2025-12-28,2025-12-23,19465.76,False,payment for subscription,2026-02-23 16:50:30.516232,Raw_GL_Export.csv
TXN000278,14/02/2026,07/02/2026,2026-02,AUS01,5900,CC9149,Amazon,INV90960,PO5068,NZD,43928.15,GST-FREE,Payment for subscription,API Import,2026-02-14,2026-02-07,43928.15,False,payment for subscription,2026-02-23 16:50:30.516232,Raw_GL_Export.csv
TXN000279,22-06-2025,20-06-2025,2025-06,AUS01,5000,CC9480,Slack,INV37815,PO7935,NZD,43850.52,EXPORT,Payment for license,Workday,2025-06-22,2025-06-20,43850.52,False,payment for license,2026-02-23 16:50:30.516232,Raw_GL_Export.csv
TXN000280,2026-02-03,2026-01-25,2026-02,AUS01,5010,CC9053,BCG,INV89478,PO1745,USD,21244.87,INPUT,Payment for services,Workday,2026-02-03,2026-01-25,21244.87,False,payment for services,2026-02-23 16:50:30.516232,Raw_GL_Export.csv
TXN000281,17-02-2026,12-02-2026,2026-02,AUS01,5400,CC9687,Regus Australia,INV86085,,USD,43565.8,GST,Payment for goods,API Import,2026-02-17,2026-02-12,43565.8,False,payment for goods,2026-02-23 16:50:30.516232,Raw_GL_Export.csv
TXN000282,01/16/2026,01/08/2026,2026-01,AUS01,5110,CC9091,McKinsey,INV51060,,GBP,6466.63,GST,Payment for goods,Manual Entry,2026-01-16,2026-08-01,6466.63,False,payment for goods,2026-02-23 16:50:30.516232,Raw_GL_Export.csv
TXN000283,01/28/2026,01/22/2026,2026-01,AUS01,5410,CC9289,Deloitte Touche,INV31624,PO9049,NZD,23312.07,EXPORT,Payment for goods,API Import,2026-01-28,2026-01-22,23312.07,False,payment for goods,2026-02-23 16:50:30.516232,Raw_GL_Export.csv
TXN000284,28-02-2026,27-02-2026,2026-02,AUS01,5200,CC9152,MSFT,INV44108,,USD,8323.05,EXPORT,Payment for consulting,Manual Entry,2026-02-28,2026-02-27,8323.05,False,payment for consulting,2026-02-23 16:50:30.516232,Raw_GL_Export.csv
TXN000285,04-07-2025,03-07-2025,2025-07,AUS01,5420,CC9365,Hays,INV26207,PO4337,GBP,22235.19,GST-FREE,Payment for subscription,Oracle,2025-07-04,2025-07-03,22235.19,False,payment for subscription,2026-02-23 16:50:30.516232,Raw_GL_Export.csv
TXN000286,27/02/2026,18/02/2026,2026-02,AUS01,5910,CC9279,Workday,INV64580,PO5033,AUD,23718.09,GST-FREE,Payment for consulting,SAP,2026-02-27,2026-02-18,23718.09,False,payment for consulting,2026-02-23 16:50:30.516232,Raw_GL_Export.csv
TXN000287,2026-02-11,2026-02-06,2026-02,AUS01,5700,CC9696,Atlassian Pty,INV52406,,GBP,16872.77,GST,Payment for services,Manual Entry,2026-02-11,2026-02-06,16872.77,False,payment for services,2026-02-23 16:50:30.516232,Raw_GL_Export.csv
TXN000288,27-11-2025,19-11-2025,2025-11,AUS01,5620,CC9978,PWC,INV96005,PO8423,AUD,14891.27,GST,Payment for subscription,API Import,2025-11-27,2025-11-19,14891.27,False,payment for subscription,2026-02-23 16:50:30.516232,Raw_GL_Export.csv
TXN000289,05/01/2026,04/01/2026,2026-01,AUS01,5900,CC9659,KPMG Australia,INV81716,PO7248,NZD,35936.8,GST,Payment for services,Manual Entry,2026-01-05,2026-01-04,35936.8,False,payment for services,2026-02-23 16:50:30.516232,Raw_GL_Export.csv
TXN000290,09/02/2026,05/02/2026,2026-02,AUS01,5810,CC9886,DHL Express,INV31356,PO7592,AUD,1020.99,GST-FREE,Payment for subscription,Oracle,2026-02-09,2026-02-05,1020.99,False,payment for subscription,2026-02-23 16:50:30.516232,Raw_GL_Export.csv
TXN000291,01/04/2026,12/27/2025,2026-01,AUS01,5900,CC9442,EY Australia,INV58163,PO9021,USD,16221.09,GST,Payment for consulting,Manual Entry,2026-04-01,2025-12-27,16221.09,False,payment for consulting,2026-02-23 16:50:30.516232,Raw_GL_Export.csv
TXN000292,01/16/2026,01/06/2026,2026-01,AUS01,5610,CC9433,Google,INV66899,PO2522,GBP,36513.65,GST-FREE,Payment for services,API Import,2026-01-16,2026-06-01,36513.65,False,payment for services,2026-02-23 16:50:30.516232,Raw_GL_Export.csv
TXN000293,11-01-2026,07-01-2026,2026-01,AUS01,5620,CC9702,Zoom,INV48103,PO2297,GBP,23774.81,GST,Payment for consulting,Workday,2026-01-11,2026-01-07,23774.81,False,payment for consulting,2026-02-23 16:50:30.516232,Raw_GL_Export.csv
TXN000294,05/02/2026,31/01/2026,2026-02,AUS01,5910,CC9254,Telstra Corp,INV15910,PO9366,NZD,25627.25,GST,Payment for consulting,Manual Entry,2026-02-05,2026-01-31,25627.25,False,payment for consulting,2026-02-23 16:50:30.516232,Raw_GL_Export.csv
TXN000295,04-02-2026,25-01-2026,2026-02,AUS01,5910,CC9259,WeWork Australia,INV24933,PO8583,NZD,26392.0,GST,Payment for goods,Oracle,2026-02-04,2026-01-25,26392.0,False,payment for goods,2026-02-23 16:50:30.516232,Raw_GL_Export.csv
TXN000296,27-02-2025,26-02-2025,2025-02,AUS01,5020,CC9426,EY Australia,INV97852,PO5342,NZD,26465.66,EXPORT,Payment for subscription,Oracle,2025-02-27,2025-02-26,26465.66,False,payment for subscription,2026-02-23 16:50:30.516232,Raw_GL_Export.csv
TXN000297,07/02/2026,05/02/2026,2026-02,AUS01,INVALID_ACCT,CC4100,Deloitte Touche,INV10766,PO1217,AUD,19577.57,GST,Payment for goods,Manual Entry,2026-02-07,2026-02-05,19577.57,False,payment for goods,2026-02-23 16:50:30.516232,Raw_GL_Export.csv
TXN000298,15-01-2026,05-01-2026,2026-01,AUS01,INVALID_ACCT,CC3200,EY Australia,INV49669,,NZD,31110.74,EXPORT,Payment for goods,SAP,2026-01-15,2026-01-05,31110.74,False,payment for goods,2026-02-23 16:50:30.516232,Raw_GL_Export.csv
TXN000299,2026-01-07,2026-01-06,2026-01,AUS01,INVALID_ACCT,CC2000,Amazon,INV95162,,USD,21702.16,GST-FREE,Payment for license,Oracle,2026-01-07,2026-01-06,21702.16,False,payment for license,2026-02-23 16:50:30.516232,Raw_GL_Export.csv
TXN000300,01/03/2026,12/26/2025,2026-01,AUS01,INVALID_ACCT,CC1200,Seek Limited,INV29978,PO8295,GBP,1079.58,GST-FREE,Payment for consulting,Manual Entry,2026-03-01,2025-12-26,1079.58,False,payment for consulting,2026-02-23 16:50:30.516232,Raw_GL_Export.csv
TXN000301,01-07-2025,21-06-2025,2025-07,AUS01,INVALID_ACCT,CC2000,SAP,INV16674,PO2682,NZD,25667.43,EXPORT,Payment for consulting,Manual Entry,2025-07-01,2025-06-21,25667.43,False,payment for consulting,2026-02-23 16:50:30.516232,Raw_GL_Export.csv
TXN000302,28-01-2026,18-01-2026,2026-01,AUS01,INVALID_ACCT,CC4100,KPMG Australia,INV77286,PO8993,AUD,21988.59,EXPORT,Payment for goods,SAP,2026-01-28,2026-01-18,21988.59,False,payment for goods,2026-02-23 16:50:30.516232,Raw_GL_Export.csv
TXN000303,2026-01-17,2026-01-10,2026-01,AUS01,INVALID_ACCT,CC4100,McKinsey,INV72041,,AUD,12126.41,EXPORT,Payment for license,Workday,2026-01-17,2026-01-10,12126.41,False,payment for license,2026-02-23 16:50:30.516232,Raw_GL_Export.csv
TXN000304,15-02-2026,14-02-2026,2026-02,AUS01,INVALID_ACCT,CC1200,KPMG Australia,INV40422,PO6556,USD,21168.9,EXPORT,Payment for license,Manual Entry,2026-02-15,2026-02-14,21168.9,False,payment for license,2026-02-23 16:50:30.516232,Raw_GL_Export.csv
TXN000305,03/05/2025,02/26/2025,2025-03,AUS01,INVALID_ACCT,CC3100,Regus Australia,INV91506,,GBP,36009.0,GST-FREE,Payment for services,Manual Entry,2025-05-03,2025-02-26,36009.0,False,payment for services,2026-02-23 16:50:30.516232,Raw_GL_Export.csv
TXN000306,05/01/2026,01/01/2026,2026-01,AUS01,INVALID_ACCT,CC1200,Hays,INV49800,,AUD,35727.36,EXPORT,Payment for license,SAP,2026-01-05,2026-01-01,35727.36,False,payment for license,2026-02-23 16:50:30.516232,Raw_GL_Export.csv
TXN000307,07/01/2025,06/26/2025,2025-07,AUS01,INVALID_ACCT,CC3000,Adobe,INV18344,PO2867,USD,37274.9,GST,Payment for license,Oracle,2025-01-07,2025-06-26,37274.9,False,payment for license,2026-02-23 16:50:30.516232,Raw_GL_Export.csv
TXN000308,04/09/2025,27/08/2025,2025-09,AUS01,INVALID_ACCT,CC2100,BCG,INV29815,PO9444,NZD,34644.89,INPUT,Payment for license,SAP,2025-09-04,2025-08-27,34644.89,False,payment for license,2026-02-23 16:50:30.516232,Raw_GL_Export.csv
TXN000309,2025-07-23,2025-07-15,2025-07,AUS01,INVALID_ACCT,CC3200,Atlassian Pty,INV83724,,AUD,35196.19,GST,Payment for services,Oracle,2025-07-23,2025-07-15,35196.19,False,payment for services,2026-02-23 16:50:30.516232,Raw_GL_Export.csv
TXN000310,2026-01-21,2026-01-17,2026-01,AUS01,INVALID_ACCT,CC3000,Adobe,INV23014,,NZD,31896.53,EXPORT,Payment for subscription,Workday,2026-01-21,2026-01-17,31896.53,False,payment for subscription,2026-02-23 16:50:30.516232,Raw_GL_Export.csv
TXN000311,27/10/2025,25/10/2025,2025-10,AUS01,INVALID_ACCT,CC2000,Optus Pty,INV42154,PO8760,GBP,34637.95,GST,Payment for subscription,Workday,2025-10-27,2025-10-25,34637.95,False,payment for subscription,2026-02-23 16:50:30.516232,Raw_GL_Export.csv
TXN000312,17/02/2025,15/02/2025,2025-02,AUS01,INVALID_ACCT,CC2100,Regus Australia,INV29871,PO9677,GBP,16292.89,GST-FREE,Payment for consulting,Oracle,2025-02-17,2025-02-15,16292.89,False,payment for consulting,2026-02-23 16:50:30.516232,Raw_GL_Export.csv
TXN000313,05-02-2026,29-01-2026,2026-02,AUS01,INVALID_ACCT,CC3100,LinkedIn Corp,INV29082,PO9476,NZD,42473.94,EXPORT,Payment for services,SAP,2026-02-05,2026-01-29,42473.94,False,payment for services,2026-02-23 16:50:30.516232,Raw_GL_Export.csv
TXN000314,02/11/2026,02/04/2026,2026-02,AUS01,INVALID_ACCT,CC1200,Telstra Corp,INV96530,PO3473,AUD,17757.66,GST,Payment for license,SAP,2026-11-02,2026-04-02,17757.66,False,payment for license,2026-02-23 16:50:30.516232,Raw_GL_Export.csv
TXN000315,06/21/2025,06/14/2025,2025-06,AUS01,INVALID_ACCT,CC3100,EY Australia,INV46671,PO3406,NZD,40924.47,GST,Payment for consulting,Manual Entry,2025-06-21,2025-06-14,40924.47,False,payment for consulting,2026-02-23 16:50:30.516232,Raw_GL_Export.csv
TXN000316,21/01/2026,12/01/2026,2026-01,AUS01,INVALID_ACCT,CC4100,Optus Pty,INV35859,PO2380,NZD,39956.6,EXPORT,Payment for services,API Import,2026-01-21,2026-01-12,39956.6,False,payment for services,2026-02-23 16:50:30.516232,Raw_GL_Export.csv
TXN000317,11-01-2026,08-01-2026,2026-01,AUS01,INVALID_ACCT,CC4000,KPMG Australia,INV78332,PO3621,USD,4267.6,INPUT,Payment for services,SAP,2026-01-11,2026-01-08,4267.6,False,payment for services,2026-02-23 16:50:30.516232,Raw_GL_Export.csv
TXN000318,11/26/2025,11/22/2025,2025-11,AUS01,INVALID_ACCT,CC2100,Telstra Corp,INV44046,PO6807,AUD,32966.18,INPUT,Payment for services,SAP,2025-11-26,2025-11-22,32966.18,False,payment for services,2026-02-23 16:50:30.516232,Raw_GL_Export.csv
TXN000319,2026-01-25,2026-01-17,2026-01,AUS01,INVALID_ACCT,CC2100,AWS,INV86230,PO9737,GBP,15320.22,GST-FREE,Payment for license,Oracle,2026-01-25,2026-01-17,15320.22,False,payment for license,2026-02-23 16:50:30.516232,Raw_GL_Export.csv
TXN000320,03/12/2025,03/07/2025,2025-03,AUS01,INVALID_ACCT,CC4100,Slack,INV23792,PO4154,GBP,23433.03,GST-FREE,Payment for subscription,Manual Entry,2025-12-03,2025-07-03,23433.03,False,payment for subscription,2026-02-23 16:50:30.516232,Raw_GL_Export.csv
TXN000321,04/02/2026,28/01/2026,2026-02,AUS01,INVALID_ACCT,CC3100,Google,INV72423,,AUD,2892.5,GST-FREE,Payment for services,Workday,2026-02-04,2026-01-28,2892.5,False,payment for services,2026-02-23 16:50:30.516232,Raw_GL_Export.csv
TXN000322,22-12-2025,12-12-2025,2025-12,AUS01,INVALID_ACCT,CC4000,DHL Express,INV67682,PO9020,NZD,26335.24,EXPORT,Payment for consulting,Oracle,2025-12-22,2025-12-12,26335.24,False,payment for consulting,2026-02-23 16:50:30.516232,Raw_GL_Export.csv
TXN000323,05/01/2026,28/12/2025,2026-01,AUS01,INVALID_ACCT,CC3200,Slack,INV72043,,AUD,31281.73,EXPORT,Payment for goods,API Import,2026-01-05,2025-12-28,31281.73,False,payment for goods,2026-02-23 16:50:30.516232,Raw_GL_Export.csv
TXN000324,2025-09-12,2025-09-02,2025-09,AUS01,INVALID_ACCT,CC3100,Atlassian Pty,INV15279,PO2929,AUD,16694.41,INPUT,Payment for subscription,Workday,2025-09-12,2025-09-02,16694.41,False,payment for subscription,2026-02-23 16:50:30.516232,Raw_GL_Export.csv
TXN000325,02/12/2026,02/07/2026,2026-02,AUS01,INVALID_ACCT,CC3200,Amazon,INV16376,PO5999,USD,6482.08,EXPORT,Payment for subscription,Oracle,2026-12-02,2026-07-02,6482.08,False,payment for subscription,2026-02-23 16:50:30.516232,Raw_GL_Export.csv
TXN000326,06-01-2026,05-01-2026,2026-01,AUS01,INVALID_ACCT,CC1100,WeWork Australia,INV73068,PO8411,AUD,39182.15,EXPORT,Payment for subscription,Manual Entry,2026-01-06,2026-01-05,39182.15,False,payment for subscription,2026-02-23 16:50:30.516232,Raw_GL_Export.csv
TXN000327,16/01/2026,13/01/2026,2026-01,AUS01,INVALID_ACCT,CC4000,LinkedIn Corp,INV52626,,GBP,30058.21,GST-FREE,Payment for license,API Import,2026-01-16,2026-01-13,30058.21,False,payment for license,2026-02-23 16:50:30.516232,Raw_GL_Export.csv
TXN000328,14-02-2026,10-02-2026,2026-02,AUS01,INVALID_ACCT,CC3100,BCG,INV46356,PO3713,AUD,43117.77,EXPORT,Payment for services,API Import,2026-02-14,2026-02-10,43117.77,False,payment for services,2026-02-23 16:50:30.516232,Raw_GL_Export.csv
TXN000329,02/21/2026,02/12/2026,2026-02,AUS01,INVALID_ACCT,CC1100,Google,INV84743,PO8796,USD,42987.06,GST,Payment for license,SAP,2026-02-21,2026-12-02,42987.06,False,payment for license,2026-02-23 16:50:30.516232,Raw_GL_Export.csv
TXN000330,04/01/2026,03/01/2026,2026-01,AUS01,INVALID_ACCT,CC2100,Workday,INV21094,PO6249,USD,37353.11,EXPORT,Payment for consulting,API Import,2026-01-04,2026-01-03,37353.11,False,payment for consulting,2026-02-23 16:50:30.516232,Raw_GL_Export.csv
TXN000331,02-01-2025,01-01-2025,2025-01,AUS01,INVALID_ACCT,CC3000,Telstra Corp,INV60070,,USD,18730.65,INPUT,Payment for services,SAP,2025-01-02,2025-01-01,18730.65,False,payment for services,2026-02-23 16:50:30.516232,Raw_GL_Export.csv
TXN000332,18/02/2026,13/02/2026,2026-02,AUS01,INVALID_ACCT,CC1200,Oracle,INV50212,PO3772,NZD,34596.88,GST-FREE,Payment for services,API Import,2026-02-18,2026-02-13,34596.88,False,payment for services,2026-02-23 16:50:30.516232,Raw_GL_Export.csv
TXN000333,11/01/2026,10/01/2026,2026-01,AUS01,INVALID_ACCT,CC1000,EY Australia,INV64109,PO5225,GBP,4533.62,GST-FREE,Payment for consulting,SAP,2026-01-11,2026-01-10,4533.62,False,payment for consulting,2026-02-23 16:50:30.516232,Raw_GL_Export.csv
TXN000334,02/08/2025,29/07/2025,2025-08,AUS01,INVALID_ACCT,CC4100,Accenture Pty,INV25083,,GBP,22937.1,EXPORT,Payment for subscription,Manual Entry,2025-08-02,2025-07-29,22937.1,False,payment for subscription,2026-02-23 16:50:30.516232,Raw_GL_Export.csv
TXN000335,18-03-2025,16-03-2025,2025-03,AUS01,INVALID_ACCT,CC3200,Amazon,INV45279,PO2663,GBP,28546.0,GST,Payment for goods,API Import,2025-03-18,2025-03-16,28546.0,False,payment for goods,2026-02-23 16:50:30.516232,Raw_GL_Export.csv
TXN000336,21/02/2025,16/02/2025,2025-02,AUS01,INVALID_ACCT,CC4100,AusPost,INV28660,PO3755,GBP,3867.49,GST-FREE,Payment for goods,API Import,2025-02-21,2025-02-16,3867.49,False,payment for goods,2026-02-23 16:50:30.516232,Raw_GL_Export.csv
TXN000337,14-01-2026,13-01-2026,2026-01,AUS01,INVALID_ACCT,CC1000,LinkedIn Corp,INV10071,,NZD,29422.34,GST-FREE,Payment for consulting,Workday,2026-01-14,2026-01-13,29422.34,False,payment for consulting,2026-02-23 16:50:30.516232,Raw_GL_Export.csv
TXN000338,02/20/2026,02/13/2026,2026-02,AUS01,INVALID_ACCT,CC3000,Workday,INV49405,,NZD,2142.26,GST,Payment for services,Oracle,2026-02-20,2026-02-13,2142.26,False,payment for services,2026-02-23 16:50:30.516232,Raw_GL_Export.csv
TXN000339,02/24/2026,02/17/2026,2026-02,AUS01,INVALID_ACCT,CC2000,Robert Half International,INV93252,,NZD,39788.53,INPUT,Payment for consulting,Workday,2026-02-24,2026-02-17,39788.53,False,payment for consulting,2026-02-23 16:50:30.516232,Raw_GL_Export.csv
TXN000340,02/08/2026,02/02/2026,2026-02,AUS01,INVALID_ACCT,CC2000,LinkedIn Corp,INV94730,PO8807,NZD,812.77,GST-FREE,Payment for services,SAP,2026-08-02,2026-02-02,812.77,False,payment for services,2026-02-23 16:50:30.516232,Raw_GL_Export.csv
TXN000341,22/01/2026,15/01/2026,2026-01,AUS01,INVALID_ACCT,CC4000,Hays,INV80601,,GBP,24262.1,GST,Payment for consulting,SAP,2026-01-22,2026-01-15,24262.1,False,payment for consulting,2026-02-23 16:50:30.516232,Raw_GL_Export.csv
TXN000342,12-05-2025,02-05-2025,2025-05,AUS01,INVALID_ACCT,CC3000,Federal Express,INV26353,PO4161,USD,37777.65,GST,Payment for consulting,SAP,2025-05-12,2025-05-02,37777.65,False,payment for consulting,2026-02-23 16:50:30.516232,Raw_GL_Export.csv
TXN000343,2026-02-08,2026-02-03,2026-02,AUS01,INVALID_ACCT,CC3000,SAP,INV38986,,AUD,36751.01,INPUT,Payment for consulting,Workday,2026-02-08,2026-02-03,36751.01,False,payment for consulting,2026-02-23 16:50:30.516232,Raw_GL_Export.csv
TXN000344,01/02/2026,12/25/2025,2026-01,AUS01,INVALID_ACCT,CC4100,Workday,INV24541,PO9197,AUD,8904.3,EXPORT,Payment for consulting,Oracle,2026-02-01,2025-12-25,8904.3,False,payment for consulting,2026-02-23 16:50:30.516232,Raw_GL_Export.csv
TXN000345,18/01/2025,08/01/2025,2025-01,AUS01,INVALID_ACCT,CC4100,Oracle,INV26702,,AUD,26508.59,GST,Payment for license,Oracle,2025-01-18,2025-01-08,26508.59,False,payment for license,2026-02-23 16:50:30.516232,Raw_GL_Export.csv
TXN000346,01/17/2026,01/13/2026,2026-01,AUS01,INVALID_ACCT,CC1000,Deloitte Touche,INV94012,PO1849,GBP,187.78,EXPORT,Payment for subscription,Manual Entry,2026-01-17,2026-01-13,187.78,False,payment for subscription,2026-02-23 16:50:30.516232,Raw_GL_Export.csv
TXN000347,28-02-2026,23-02-2026,2026-02,AUS01,INVALID_ACCT,CC1100,LinkedIn Corp,INV39431,,GBP,16330.09,GST,Payment for consulting,API Import,2026-02-28,2026-02-23,16330.09,False,payment for consulting,2026-02-23 16:50:30.516232,Raw_GL_Export.csv
TXN000348,02/15/2026,02/14/2026,2026-02,AUS01,INVALID_ACCT,CC3100,SAP,INV39573,PO7943,NZD,3773.22,GST,Payment for services,Oracle,2026-02-15,2026-02-14,3773.22,False,payment for services,2026-02-23 16:50:30.516232,Raw_GL_Export.csv
TXN000349,07/01/2026,01/01/2026,2026-01,AUS01,INVALID_ACCT,CC2100,Salesforce,INV13148,PO6477,AUD,1351.49,EXPORT,Payment for subscription,Oracle,2026-01-07,2026-01-01,1351.49,False,payment for subscription,2026-02-23 16:50:30.516232,Raw_GL_Export.csv
TXN000350,04-01-2026,31-12-2025,2026-01,AUS01,INVALID_ACCT,CC3000,MSFT,INV19556,PO8184,NZD,23433.41,GST-FREE,Payment for services,Manual Entry,2026-01-04,2025-12-31,23433.41,False,payment for services,2026-02-23 16:50:30.516232,Raw_GL_Export.csv
TXN000351,2026-01-19,2026-01-17,2026-01,AUS01,INVALID_ACCT,CC1000,Microsoft,INV26716,,GBP,14166.25,GST,Payment for consulting,SAP,2026-01-19,2026-01-17,14166.25,False,payment for consulting,2026-02-23 16:50:30.516232,Raw_GL_Export.csv
TXN000352,10-02-2026,08-02-2026,2026-02,AUS01,INVALID_ACCT,CC1100,MSFT,INV62649,,AUD,13341.76,EXPORT,Payment for consulting,Oracle,2026-02-10,2026-02-08,13341.76,False,payment for consulting,2026-02-23 16:50:30.516232,Raw_GL_Export.csv
TXN000353,2025-03-28,2025-03-20,2025-03,AUS01,INVALID_ACCT,CC3100,LinkedIn Corp,INV54514,PO1425,GBP,39609.22,GST,Payment for consulting,API Import,2025-03-28,2025-03-20,39609.22,False,payment for consulting,2026-02-23 16:50:30.516232,Raw_GL_Export.csv
TXN000354,11/02/2026,09/02/2026,2026-02,AUS01,INVALID_ACCT,CC1100,AWS,INV85132,,AUD,26720.6,GST-FREE,Payment for license,Workday,2026-02-11,2026-02-09,26720.6,False,payment for license,2026-02-23 16:50:30.516232,Raw_GL_Export.csv
TXN000355,12-01-2026,04-01-2026,2026-01,AUS01,INVALID_ACCT,CC4100,Optus Pty,INV17928,,USD,11017.55,GST,Payment for license,Manual Entry,2026-01-12,2026-01-04,11017.55,False,payment for license,2026-02-23 16:50:30.516232,Raw_GL_Export.csv
TXN000356,02/17/2026,02/12/2026,2026-02,AUS01,INVALID_ACCT,CC4100,Zoom,INV48150,PO1132,USD,21181.62,INPUT,Payment for license,API Import,2026-02-17,2026-12-02,21181.62,False,payment for license,2026-02-23 16:50:30.516232,Raw_GL_Export.csv
TXN000357,22/02/2026,21/02/2026,2026-02,AUS01,INVALID_ACCT,CC2000,Robert Half International,INV36263,PO4297,AUD,19050.55,GST-FREE,Payment for services,Workday,2026-02-22,2026-02-21,19050.55,False,payment for services,2026-02-23 16:50:30.516232,Raw_GL_Export.csv
TXN000358,07-01-2026,30-12-2025,2026-01,AUS01,INVALID_ACCT,CC4100,BCG,INV53072,,NZD,27763.03,EXPORT,Payment for consulting,SAP,2026-01-07,2025-12-30,27763.03,False,payment for consulting,2026-02-23 16:50:30.516232,Raw_GL_Export.csv
TXN000359,16/02/2026,15/02/2026,2026-02,AUS01,INVALID_ACCT,CC2000,ServiceNow Inc,INV73012,PO6431,GBP,28114.01,GST-FREE,Payment for consulting,Oracle,2026-02-16,2026-02-15,28114.01,False,payment for consulting,2026-02-23 16:50:30.516232,Raw_GL_Export.csv
TXN000360,13/02/2026,12/02/2026,2026-02,AUS01,INVALID_ACCT,CC3000,AWS,INV28664,,AUD,16169.11,GST,Payment for goods,API Import,2026-02-13,2026-02-12,16169.11,False,payment for goods,2026-02-23 16:50:30.516232,Raw_GL_Export.csv
TXN000361,01/25/2026,01/24/2026,2026-01,AUS01,INVALID_ACCT,CC1000,SAP,INV44340,PO6567,USD,12856.13,GST-FREE,Payment for license,Oracle,2026-01-25,2026-01-24,12856.13,False,payment for license,2026-02-23 16:50:30.516232,Raw_GL_Export.csv
TXN000362,06/02/2026,05/02/2026,2026-02,AUS01,INVALID_ACCT,CC1200,Deloitte Touche,INV59666,PO2818,AUD,1042.62,GST-FREE,Payment for subscription,Oracle,2026-02-06,2026-02-05,1042.62,False,payment for subscription,2026-02-23 16:50:30.516232,Raw_GL_Export.csv
TXN000363,10-02-2026,06-02-2026,2026-02,AUS01,INVALID_ACCT,CC3000,Regus Australia,INV18569,,USD,42358.16,EXPORT,Payment for goods,Oracle,2026-02-10,2026-02-06,42358.16,False,payment for goods,2026-02-23 16:50:30.516232,Raw_GL_Export.csv
TXN000364,07-02-2026,01-02-2026,2026-02,AUS01,INVALID_ACCT,CC3000,Telstra Corp,INV80184,,USD,41453.51,GST-FREE,Payment for goods,Workday,2026-02-07,2026-02-01,41453.51,False,payment for goods,2026-02-23 16:50:30.516232,Raw_GL_Export.csv
TXN000365,2025-05-08,2025-05-03,2025-05,AUS01,INVALID_ACCT,CC1200,Robert Half International,INV71691,PO2062,GBP,9494.77,GST,Payment for goods,API Import,2025-05-08,2025-05-03,9494.77,False,payment for goods,2026-02-23 16:50:30.516232,Raw_GL_Export.csv
TXN000366,02/13/2026,02/05/2026,2026-02,AUS01,INVALID_ACCT,CC4000,LinkedIn Corp,INV78875,PO9106,USD,14549.86,INPUT,Payment for consulting,Workday,2026-02-13,2026-05-02,14549.86,False,payment for consulting,2026-02-23 16:50:30.516232,Raw_GL_Export.csv
TXN000367,19-02-2026,09-02-2026,2026-02,AUS01,INVALID_ACCT,CC1000,Workday,INV40721,PO6013,USD,40280.32,EXPORT,Payment for consulting,Manual Entry,2026-02-19,2026-02-09,40280.32,False,payment for consulting,2026-02-23 16:50:30.516232,Raw_GL_Export.csv
TXN000368,19/01/2026,13/01/2026,2026-01,AUS01,INVALID_ACCT,CC2100,Google,INV68262,PO4771,USD,33847.86,INPUT,Payment for license,SAP,2026-01-19,2026-01-13,33847.86,False,payment for license,2026-02-23 16:50:30.516232,Raw_GL_Export.csv
TXN000369,01/15/2026,01/08/2026,2026-01,AUS01,INVALID_ACCT,CC3200,LinkedIn Corp,INV51552,,GBP,18461.98,EXPORT,Payment for services,Oracle,2026-01-15,2026-08-01,18461.98,False,payment for services,2026-02-23 16:50:30.516232,Raw_GL_Export.csv
TXN000370,15/01/2026,10/01/2026,2026-01,AUS01,INVALID_ACCT,CC1100,WeWork Australia,INV46231,PO2612,AUD,13323.85,GST,Payment for services,SAP,2026-01-15,2026-01-10,13323.85,False,payment for services,2026-02-23 16:50:30.516232,Raw_GL_Export.csv
TXN000371,2026-02-12,2026-02-03,2026-02,AUS01,INVALID_ACCT,CC2000,BCG,INV49677,PO5496,USD,30412.32,INPUT,Payment for goods,API Import,2026-02-12,2026-02-03,30412.32,False,payment for goods,2026-02-23 16:50:30.516232,Raw_GL_Export.csv
TXN000372,01/05/2026,01/04/2026,2026-01,AUS01,INVALID_ACCT,CC2100,KPMG Australia,INV63183,PO1194,NZD,35262.46,EXPORT,Payment for consulting,API Import,2026-05-01,2026-04-01,35262.46,False,payment for consulting,2026-02-23 16:50:30.516232,Raw_GL_Export.csv
TXN000373,25/05/2025,18/05/2025,2025-05,AUS01,INVALID_ACCT,CC2000,ServiceNow Inc,INV70476,PO2406,USD,21402.28,EXPORT,Payment for subscription,Oracle,2025-05-25,2025-05-18,21402.28,False,payment for subscription,2026-02-23 16:50:30.516232,Raw_GL_Export.csv
TXN000374,14-01-2026,10-01-2026,2026-01,AUS01,INVALID_ACCT,CC3200,Optus Pty,INV50051,PO1158,AUD,16924.04,GST-FREE,Payment for consulting,Workday,2026-01-14,2026-01-10,16924.04,False,payment for consulting,2026-02-23 16:50:30.516232,Raw_GL_Export.csv
TXN000375,11/02/2026,04/02/2026,2026-02,AUS01,INVALID_ACCT,CC3100,DHL Express,INV84393,PO3279,NZD,14740.97,GST,Payment for goods,Workday,2026-02-11,2026-02-04,14740.97,False,payment for goods,2026-02-23 16:50:30.516232,Raw_GL_Export.csv
TXN000376,19-02-2026,12-02-2026,2026-02,AUS01,INVALID_ACCT,CC2000,DHL Express,INV72230,,AUD,24098.63,GST-FREE,Payment for license,Manual Entry,2026-02-19,2026-02-12,24098.63,False,payment for license,2026-02-23 16:50:30.516232,Raw_GL_Export.csv
TXN000377,08/21/2025,08/19/2025,2025-08,AUS01,5120,CC1100,Unlisted Company,INV13517,,USD,1539.46,EXPORT,Payment for services,Manual Entry,2025-08-21,2025-08-19,1539.46,False,payment for services,2026-02-23 16:50:30.516232,Raw_GL_Export.csv
TXN000378,10/01/2026,06/01/2026,2026-01,AUS01,5300,CC4000,Unknown Vendor LLC,INV32521,PO7731,GBP,2679.65,GST,Payment for consulting,Oracle,2026-01-10,2026-01-06,2679.65,False,payment for consulting,2026-02-23 16:50:30.516232,Raw_GL_Export.csv
TXN000379,04/01/2026,26/12/2025,2026-01,AUS01,5410,CC3200,Unknown Vendor LLC,INV27030,PO6075,GBP,42983.84,GST-FREE,Payment for consulting,Manual Entry,2026-01-04,2025-12-26,42983.84,False,payment for consulting,2026-02-23 16:50:30.516232,Raw_GL_Export.csv
TXN000380,02/06/2026,01/27/2026,2026-02,AUS01,5200,CC4000,New Vendor XYZ,INV68422,,NZD,9156.45,GST-FREE,Payment for consulting,API Import,2026-06-02,2026-01-27,9156.45,False,payment for consulting,2026-02-23 16:50:30.516232,Raw_GL_Export.csv
TXN000381,26/01/2026,17/01/2026,2026-01,AUS01,5310,CC4100,New Vendor XYZ,INV21941,,GBP,20875.03,GST,Payment for consulting,Workday,2026-01-26,2026-01-17,20875.03,False,payment for consulting,2026-02-23 16:50:30.516232,Raw_GL_Export.csv
TXN000382,02/23/2026,02/16/2026,2026-02,AUS01,5610,CC1200,New Vendor XYZ,INV70008,PO4005,USD,8163.06,EXPORT,Payment for license,SAP,2026-02-23,2026-02-16,8163.06,False,payment for license,2026-02-23 16:50:30.516232,Raw_GL_Export.csv
TXN000383,2026-01-13,2026-01-09,2026-01,AUS01,5920,CC1200,Unregistered Supplier,INV38476,PO7738,NZD,30032.9,GST,Payment for license,SAP,2026-01-13,2026-01-09,30032.9,False,payment for license,2026-02-23 16:50:30.516232,Raw_GL_Export.csv
TXN000384,2026-02-12,2026-02-10,2026-02,AUS01,5510,CC3000,New Vendor XYZ,INV76330,,GBP,7501.28,GST-FREE,Payment for services,SAP,2026-02-12,2026-02-10,7501.28,False,payment for services,2026-02-23 16:50:30.516232,Raw_GL_Export.csv
TXN000385,21-01-2026,14-01-2026,2026-01,AUS01,5310,CC3100,Mystery Corp,INV25031,PO3236,GBP,1796.08,INPUT,Payment for subscription,Manual Entry,2026-01-21,2026-01-14,1796.08,False,payment for subscription,2026-02-23 16:50:30.516232,Raw_GL_Export.csv
TXN000386,16-11-2025,14-11-2025,2025-11,AUS01,5020,CC4000,Mystery Corp,INV31150,,GBP,6397.48,INPUT,Payment for services,API Import,2025-11-16,2025-11-14,6397.48,False,payment for services,2026-02-23 16:50:30.516232,Raw_GL_Export.csv
TXN000387,04/02/2026,30/01/2026,2026-02,AUS01,5100,CC4000,New Vendor XYZ,INV98785,,USD,3583.58,GST,Payment for consulting,Workday,2026-02-04,2026-01-30,3583.58,False,payment for consulting,2026-02-23 16:50:30.516232,Raw_GL_Export.csv
TXN000388,06/02/2025,05/02/2025,2025-02,AUS01,5700,CC4000,Mystery Corp,INV61199,PO8274,GBP,31383.73,GST,Payment for services,API Import,2025-02-06,2025-02-05,31383.73,False,payment for services,2026-02-23 16:50:30.516232,Raw_GL_Export.csv
TXN000389,2025-11-01,2025-10-25,2025-11,AUS01,5810,CC2000,Mystery Corp,INV21978,,NZD,40903.16,GST-FREE,Payment for services,SAP,2025-11-01,2025-10-25,40903.16,False,payment for services,2026-02-23 16:50:30.516232,Raw_GL_Export.csv
TXN000390,11/01/2026,09/01/2026,2026-01,AUS01,5210,CC1100,Mystery Corp,INV52879,PO4105,USD,2076.16,GST,Payment for license,Oracle,2026-01-11,2026-01-09,2076.16,False,payment for license,2026-02-23 16:50:30.516232,Raw_GL_Export.csv
TXN000391,18-01-2026,11-01-2026,2026-01,AUS01,5100,CC2000,Mystery Corp,INV11965,PO6181,AUD,16110.28,GST-FREE,Payment for services,Manual Entry,2026-01-18,2026-01-11,16110.28,False,payment for services,2026-02-23 16:50:30.516232,Raw_GL_Export.csv
TXN000392,07-10-2025,03-10-2025,2025-10,AUS01,5020,CC2100,Unlisted Company,INV63883,PO9185,NZD,2072.86,GST-FREE,Payment for services,API Import,2025-10-07,2025-10-03,2072.86,False,payment for services,2026-02-23 16:50:30.516232,Raw_GL_Export.csv
TXN000393,26/03/2025,21/03/2025,2025-03,AUS01,5100,CC4100,Unregistered Supplier,INV53522,,GBP,30537.73,GST-FREE,Payment for subscription,Manual Entry,2025-03-26,2025-03-21,30537.73,False,payment for subscription,2026-02-23 16:50:30.516232,Raw_GL_Export.csv
TXN000394,02/03/2026,02/02/2026,2026-02,AUS01,5610,CC4100,New Vendor XYZ,INV75984,PO1217,GBP,23045.07,GST-FREE,Payment for goods,SAP,2026-03-02,2026-02-02,23045.07,False,payment for goods,2026-02-23 16:50:30.516232,Raw_GL_Export.csv
TXN000395,2026-02-20,2026-02-15,2026-02,AUS01,5210,CC3100,Mystery Corp,INV75369,,AUD,2790.54,INPUT,Payment for goods,Manual Entry,2026-02-20,2026-02-15,2790.54,False,payment for goods,2026-02-23 16:50:30.516232,Raw_GL_Export.csv
TXN000396,2025-07-07,2025-07-03,2025-07,AUS01,5800,CC4100,New Vendor XYZ,INV94358,PO1648,NZD,6128.59,INPUT,Payment for license,Manual Entry,2025-07-07,2025-07-03,6128.59,False,payment for license,2026-02-23 16:50:30.516232,Raw_GL_Export.csv
TXN000397,01/21/2026,01/20/2026,2026-01,AUS01,5210,CC3000,Unregistered Supplier,INV97163,PO4644,USD,9341.2,GST,Payment for license,Manual Entry,2026-01-21,2026-01-20,9341.2,False,payment for license,2026-02-23 16:50:30.516232,Raw_GL_Export.csv
TXN000398,07/17/2025,07/14/2025,2025-07,AUS01,5420,CC1000,Unknown Vendor LLC,INV16829,PO3318,GBP,3242.32,GST-FREE,Payment for goods,Oracle,2025-07-17,2025-07-14,3242.32,False,payment for goods,2026-02-23 16:50:30.516232,Raw_GL_Export.csv
TXN000399,03/01/2026,24/12/2025,2026-01,AUS01,5520,CC2000,Mystery Corp,INV50824,,AUD,19238.17,EXPORT,Payment for goods,Oracle,2026-01-03,2025-12-24,19238.17,False,payment for goods,2026-02-23 16:50:30.516232,Raw_GL_Export.csv
TXN000400,14/02/2026,04/02/2026,2026-02,AUS01,5210,CC2100,Unregistered Supplier,INV45633,PO8883,GBP,43550.89,GST-FREE,Payment for services,Workday,2026-02-14,2026-02-04,43550.89,False,payment for services,2026-02-23 16:50:30.516232,Raw_GL_Export.csv
TXN000401,13-01-2026,10-01-2026,2026-01,AUS01,5500,CC3200,New Vendor XYZ,INV12596,PO8002,GBP,34238.57,EXPORT,Payment for services,Workday,2026-01-13,2026-01-10,34238.57,False,payment for services,2026-02-23 16:50:30.516232,Raw_GL_Export.csv
TXN000402,20/02/2026,11/02/2026,2026-02,AUS01,5800,CC1200,Unregistered Supplier,INV47122,PO8878,GBP,20917.94,EXPORT,Payment for services,Workday,2026-02-20,2026-02-11,20917.94,False,payment for services,2026-02-23 16:50:30.516232,Raw_GL_Export.csv
TXN000403,05-02-2026,01-02-2026,2026-02,AUS01,5110,CC2000,Unknown Vendor LLC,INV74415,PO7812,AUD,38788.32,INPUT,Payment for consulting,Workday,2026-02-05,2026-02-01,38788.32,False,payment for consulting,2026-02-23 16:50:30.516232,Raw_GL_Export.csv
TXN000404,13-02-2026,08-02-2026,2026-02,AUS01,5620,CC4100,Unknown Vendor LLC,INV60439,PO3660,GBP,39836.48,GST,Payment for goods,Manual Entry,2026-02-13,2026-02-08,39836.48,False,payment for goods,2026-02-23 16:50:30.516232,Raw_GL_Export.csv
TXN000405,01/09/2026,12/31/2025,2026-01,AUS01,5710,CC3200,Unregistered Supplier,INV42347,,AUD,29325.69,EXPORT,Payment for services,Workday,2026-09-01,2025-12-31,29325.69,False,payment for services,2026-02-23 16:50:30.516232,Raw_GL_Export.csv
TXN000406,2025-11-21,2025-11-18,2025-11,AUS01,5220,CC4100,New Vendor XYZ,INV11617,,USD,11517.53,GST-FREE,Payment for services,Manual Entry,2025-11-21,2025-11-18,11517.53,False,payment for services,2026-02-23 16:50:30.516232,Raw_GL_Export.csv
TXN000407,2026-02-13,2026-02-04,2026-02,AUS01,5200,CC3100,Mystery Corp,INV75620,PO7271,GBP,11453.92,INPUT,Payment for license,Workday,2026-02-13,2026-02-04,11453.92,False,payment for license,2026-02-23 16:50:30.516232,Raw_GL_Export.csv
TXN000408,24-02-2025,22-02-2025,2025-02,AUS01,5100,CC4100,Unregistered Supplier,INV62162,PO1105,USD,12179.06,GST-FREE,Payment for goods,Manual Entry,2025-02-24,2025-02-22,12179.06,False,payment for goods,2026-02-23 16:50:30.516232,Raw_GL_Export.csv
TXN000409,2026-01-01,2025-12-30,2026-01,AUS01,5810,CC3100,Unlisted Company,INV32365,,GBP,29488.0,EXPORT,Payment for goods,Oracle,2026-01-01,2025-12-30,29488.0,False,payment for goods,2026-02-23 16:50:30.516232,Raw_GL_Export.csv
TXN000410,07-01-2026,04-01-2026,2026-01,AUS01,5510,CC1100,New Vendor XYZ,INV33950,PO4143,USD,8435.15,GST,Payment for subscription,Manual Entry,2026-01-07,2026-01-04,8435.15,False,payment for subscription,2026-02-23 16:50:30.516232,Raw_GL_Export.csv
TXN000411,2025-11-15,2025-11-12,2025-11,AUS01,5020,CC2100,Unknown Vendor LLC,INV54846,,GBP,5698.2,GST,Payment for goods,Manual Entry,2025-11-15,2025-11-12,5698.2,False,payment for goods,2026-02-23 16:50:30.516232,Raw_GL_Export.csv
TXN000412,2026-01-16,2026-01-15,2026-01,AUS01,5010,CC2100,Unknown Vendor LLC,INV59239,PO5355,AUD,4448.2,GST,Payment for consulting,Manual Entry,2026-01-16,2026-01-15,4448.2,False,payment for consulting,2026-02-23 16:50:30.516232,Raw_GL_Export.csv
TXN000413,02/25/2026,02/15/2026,2026-02,AUS01,5410,CC3000,Unregistered Supplier,INV57344,PO7200,NZD,44975.09,GST-FREE,Payment for license,SAP,2026-02-25,2026-02-15,44975.09,False,payment for license,2026-02-23 16:50:30.516232,Raw_GL_Export.csv
TXN000414,01/12/2026,01/10/2026,2026-01,AUS01,5000,CC3200,New Vendor XYZ,INV79550,,USD,1253.05,GST,Payment for goods,Workday,2026-12-01,2026-10-01,1253.05,False,payment for goods,2026-02-23 16:50:30.516232,Raw_GL_Export.csv
TXN000415,15-02-2026,06-02-2026,2026-02,AUS01,5410,CC2000,Unknown Vendor LLC,INV15997,PO6333,NZD,846.7,INPUT,Payment for consulting,Oracle,2026-02-15,2026-02-06,846.7,False,payment for consulting,2026-02-23 16:50:30.516232,Raw_GL_Export.csv
TXN000416,20-02-2026,13-02-2026,2026-02,AUS01,5800,CC4100,Unknown Vendor LLC,INV96289,PO2645,NZD,19313.44,EXPORT,Payment for consulting,Workday,2026-02-20,2026-02-13,19313.44,False,payment for consulting,2026-02-23 16:50:30.516232,Raw_GL_Export.csv
TXN000417,20/01/2026,17/01/2026,2026-01,AUS01,5920,CC4000,Unlisted Company,INV49498,PO9990,AUD,5840.97,GST,Payment for consulting,Oracle,2026-01-20,2026-01-17,5840.97,False,payment for consulting,2026-02-23 16:50:30.516232,Raw_GL_Export.csv
TXN000418,2025-02-15,2025-02-07,2025-02,AUS01,5700,CC4000,Mystery Corp,INV23824,PO1478,USD,9602.67,GST,Payment for goods,Workday,2025-02-15,2025-02-07,9602.67,False,payment for goods,2026-02-23 16:50:30.516232,Raw_GL_Export.csv
TXN000419,02/13/2026,02/09/2026,2026-02,AUS01,5800,CC2100,New Vendor XYZ,INV21854,PO6452,AUD,29979.89,EXPORT,Payment for goods,API Import,2026-02-13,2026-09-02,29979.89,False,payment for goods,2026-02-23 16:50:30.516232,Raw_GL_Export.csv
TXN000420,2026-02-25,2026-02-19,2026-02,AUS01,5400,CC3100,Unlisted Company,INV43959,,GBP,36399.29,GST-FREE,Payment for services,SAP,2026-02-25,2026-02-19,36399.29,False,payment for services,2026-02-23 16:50:30.516232,Raw_GL_Export.csv
TXN000421,02/03/2026,01/24/2026,2026-02,AUS01,5200,CC1100,Unlisted Company,INV59832,PO1027,NZD,5821.04,INPUT,Payment for subscription,SAP,2026-03-02,2026-01-24,5821.04,False,payment for subscription,2026-02-23 16:50:30.516232,Raw_GL_Export.csv
TXN000422,19/01/2026,12/01/2026,2026-01,AUS01,5410,CC3000,Unregistered Supplier,INV23970,PO9819,USD,23436.84,GST-FREE,Payment for consulting,Workday,2026-01-19,2026-01-12,23436.84,False,payment for consulting,2026-02-23 16:50:30.516232,Raw_GL_Export.csv
TXN000423,02/05/2026,02/01/2026,2026-02,AUS01,5500,CC3200,Mystery Corp,INV88496,PO9230,NZD,6649.59,GST,Payment for services,Workday,2026-05-02,2026-01-02,6649.59,False,payment for services,2026-02-23 16:50:30.516232,Raw_GL_Export.csv
TXN000424,28-02-2025,24-02-2025,2025-02,AUS01,5500,CC2100,New Vendor XYZ,INV30014,PO4450,AUD,44153.31,INPUT,Payment for goods,SAP,2025-02-28,2025-02-24,44153.31,False,payment for goods,2026-02-23 16:50:30.516232,Raw_GL_Export.csv
TXN000425,28/01/2026,20/01/2026,2026-01,AUS01,5800,CC3100,Unregistered Supplier,INV54225,PO8756,USD,44598.74,EXPORT,Payment for subscription,Manual Entry,2026-01-28,2026-01-20,44598.74,False,payment for subscription,2026-02-23 16:50:30.516232,Raw_GL_Export.csv
TXN000426,2026-01-13,2026-01-04,2026-01,AUS01,5800,CC2100,Unregistered Supplier,INV22755,,USD,31579.78,EXPORT,Payment for license,SAP,2026-01-13,2026-01-04,31579.78,False,payment for license,2026-02-23 16:50:30.516232,Raw_GL_Export.csv
TXN000427,01/28/2026,01/20/2026,2026-01,AUS01,5620,CC1200,Unlisted Company,INV48152,PO4436,USD,19940.58,EXPORT,Payment for goods,Oracle,2026-01-28,2026-01-20,19940.58,False,payment for goods,2026-02-23 16:50:30.516232,Raw_GL_Export.csv
TXN000428,2025-04-24,2025-04-18,2025-04,AUS01,5800,CC4100,Unknown Vendor LLC,INV99056,PO1922,USD,17007.36,EXPORT,Payment for services,Workday,2025-04-24,2025-04-18,17007.36,False,payment for services,2026-02-23 16:50:30.516232,Raw_GL_Export.csv
TXN000429,16/01/2026,15/01/2026,2026-01,AUS01,5100,CC4000,Unregistered Supplier,INV42112,,GBP,43640.74,EXPORT,Payment for goods,Manual Entry,2026-01-16,2026-01-15,43640.74,False,payment for goods,2026-02-23 16:50:30.516232,Raw_GL_Export.csv
TXN000430,02/16/2026,02/06/2026,2026-02,AUS01,5120,CC3100,Unknown Vendor LLC,INV46073,PO8292,GBP,38933.82,EXPORT,Payment for subscription,SAP,2026-02-16,2026-06-02,38933.82,False,payment for subscription,2026-02-23 16:50:30.516232,Raw_GL_Export.csv
TXN000431,2026-01-04,2026-01-02,2026-01,AUS01,5100,CC3200,Unlisted Company,INV45877,PO2549,USD,1133.9,EXPORT,Payment for license,Oracle,2026-01-04,2026-01-02,1133.9,False,payment for license,2026-02-23 16:50:30.516232,Raw_GL_Export.csv
TXN000432,13-02-2026,06-02-2026,2026-02,AUS01,5300,CC4100,Mystery Corp,INV63127,PO1323,AUD,14702.78,GST-FREE,Payment for consulting,API Import,2026-02-13,2026-02-06,14702.78,False,payment for consulting,2026-02-23 16:50:30.516232,Raw_GL_Export.csv
TXN000433,27-03-2025,25-03-2025,2025-03,AUS01,5510,CC4100,Unlisted Company,INV96321,PO3960,AUD,33932.52,GST-FREE,Payment for license,Oracle,2025-03-27,2025-03-25,33932.52,False,payment for license,2026-02-23 16:50:30.516232,Raw_GL_Export.csv
TXN000434,01-02-2026,26-01-2026,2026-02,AUS01,5100,CC1000,Mystery Corp,INV83727,,USD,29403.56,GST,Payment for services,SAP,2026-02-01,2026-01-26,29403.56,False,payment for services,2026-02-23 16:50:30.516232,Raw_GL_Export.csv
TXN000435,02/04/2026,01/29/2026,2026-02,AUS01,5520,CC1200,New Vendor XYZ,INV78084,PO5807,AUD,11250.34,GST,Payment for license,Manual Entry,2026-04-02,2026-01-29,11250.34,False,payment for license,2026-02-23 16:50:30.516232,Raw_GL_Export.csv
TXN000436,05-01-2026,30-12-2025,2026-01,AUS01,5510,CC3000,Unlisted Company,INV41077,,USD,30988.07,GST,Payment for goods,Workday,2026-01-05,2025-12-30,30988.07,False,payment for goods,2026-02-23 16:50:30.516232,Raw_GL_Export.csv
TXN000437,28/02/2026,25/02/2026,2026-02,AUS01,5610,CC4000,Mystery Corp,INV19746,PO5270,NZD,12555.07,EXPORT,Payment for consulting,Oracle,2026-02-28,2026-02-25,12555.07,False,payment for consulting,2026-02-23 16:50:30.516232,Raw_GL_Export.csv
TXN000438,13-02-2026,11-02-2026,2026-02,AUS01,5220,CC3100,Mystery Corp,INV92984,PO4156,USD,3268.06,INPUT,Payment for subscription,API Import,2026-02-13,2026-02-11,3268.06,False,payment for subscription,2026-02-23 16:50:30.516232,Raw_GL_Export.csv
TXN000439,22/01/2026,15/01/2026,2026-01,AUS01,5910,CC1200,Unregistered Supplier,INV20161,,GBP,17114.49,GST-FREE,Payment for license,SAP,2026-01-22,2026-01-15,17114.49,False,payment for license,2026-02-23 16:50:30.516232,Raw_GL_Export.csv
TXN000440,22-07-2025,20-07-2025,2025-07,AUS01,5310,CC1100,Unregistered Supplier,INV39591,,NZD,35035.39,GST-FREE,Payment for services,Manual Entry,2025-07-22,2025-07-20,35035.39,False,payment for services,2026-02-23 16:50:30.516232,Raw_GL_Export.csv
TXN000441,08-02-2026,06-02-2026,2026-02,AUS01,5900,CC1100,Oracle,INV22522,PO5620,NZD,-20617.53,EXPORT,Payment for license,Workday,2026-02-08,2026-02-06,-20617.53,True,payment for license,2026-02-23 16:50:30.516232,Raw_GL_Export.csv
TXN000442,2026-01-20,2026-01-19,2026-01,AUS01,5120,CC3000,Federal Express,INV72503,PO5244,USD,-32775.87,EXPORT,Payment for services,API Import,2026-01-20,2026-01-19,-32775.87,True,payment for services,2026-02-23 16:50:30.516232,Raw_GL_Export.csv
TXN000443,23/09/2025,20/09/2025,2025-09,AUS01,5110,CC3100,PWC,INV42651,PO7852,AUD,-4169.76,INPUT,Payment for consulting,Oracle,2025-09-23,2025-09-20,-4169.76,True,payment for consulting,2026-02-23 16:50:30.516232,Raw_GL_Export.csv
TXN000444,02/15/2026,02/07/2026,2026-02,AUS01,5510,CC2100,PWC,INV50001,PO2424,GBP,-24022.33,GST-FREE,Payment for subscription,Manual Entry,2026-02-15,2026-07-02,-24022.33,True,payment for subscription,2026-02-23 16:50:30.516232,Raw_GL_Export.csv
TXN000445,02/25/2026,02/23/2026,2026-02,AUS01,5620,CC1100,Salesforce,INV85407,,USD,-2851.14,GST-FREE,Payment for subscription,API Import,2026-02-25,2026-02-23,-2851.14,True,payment for subscription,2026-02-23 16:50:30.516232,Raw_GL_Export.csv
TXN000446,2026-01-16,2026-01-09,2026-01,AUS01,5700,CC4000,Slack,INV63145,,GBP,-25159.52,GST,Payment for goods,SAP,2026-01-16,2026-01-09,-25159.52,True,payment for goods,2026-02-23 16:50:30.516232,Raw_GL_Export.csv
TXN000447,23-02-2026,14-02-2026,2026-02,AUS01,5800,CC3000,Accenture Pty,INV98410,PO9577,AUD,-19692.06,GST-FREE,Payment for goods,Oracle,2026-02-23,2026-02-14,-19692.06,True,payment for goods,2026-02-23 16:50:30.516232,Raw_GL_Export.csv
TXN000448,02/03/2026,01/31/2026,2026-02,AUS01,5510,CC3000,MSFT,INV58927,PO6537,GBP,-25274.16,GST-FREE,Payment for goods,API Import,2026-03-02,2026-01-31,-25274.16,True,payment for goods,2026-02-23 16:50:30.516232,Raw_GL_Export.csv
TXN000449,2026-02-28,2026-02-23,2026-02,AUS01,5300,CC3200,KPMG Australia,INV38503,PO9446,NZD,-39368.01,EXPORT,Payment for services,Manual Entry,2026-02-28,2026-02-23,-39368.01,True,payment for services,2026-02-23 16:50:30.516232,Raw_GL_Export.csv
TXN000450,20-02-2026,19-02-2026,2026-02,AUS01,5320,CC1000,LinkedIn Corp,INV10675,PO4050,NZD,-35112.3,GST,Payment for consulting,Workday,2026-02-20,2026-02-19,-35112.3,True,payment for consulting,2026-02-23 16:50:30.516232,Raw_GL_Export.csv
TXN000451,2025-06-01,2025-05-25,2025-06,AUS01,5500,CC2000,Google,INV10905,,USD,-29505.12,EXPORT,Payment for subscription,Oracle,2025-06-01,2025-05-25,-29505.12,True,payment for subscription,2026-02-23 16:50:30.516232,Raw_GL_Export.csv
TXN000452,16-02-2026,10-02-2026,2026-02,AUS01,5300,CC3000,Telstra Corp,INV24246,PO8198,USD,-23232.27,INPUT,Payment for goods,Oracle,2026-02-16,2026-02-10,-23232.27,True,payment for goods,2026-02-23 16:50:30.516232,Raw_GL_Export.csv
TXN000453,12-12-2025,11-12-2025,2025-12,AUS01,5320,CC2000,Atlassian Pty,INV61713,PO6426,USD,-35783.5,GST-FREE,Payment for services,Oracle,2025-12-12,2025-12-11,-35783.5,True,payment for services,2026-02-23 16:50:30.516232,Raw_GL_Export.csv
TXN000454,22/10/2025,14/10/2025,2025-10,AUS01,5700,CC2100,Atlassian Pty,INV99356,PO6322,GBP,-25595.52,EXPORT,Payment for consulting,API Import,2025-10-22,2025-10-14,-25595.52,True,payment for consulting,2026-02-23 16:50:30.516232,Raw_GL_Export.csv
TXN000455,24-01-2026,21-01-2026,2026-01,AUS01,5100,CC1100,Amazon,INV99710,,USD,-42238.45,GST,Payment for subscription,Manual Entry,2026-01-24,2026-01-21,-42238.45,True,payment for subscription,2026-02-23 16:50:30.516232,Raw_GL_Export.csv
TXN000456,2026-02-20,2026-02-13,2026-02,AUS01,5500,CC2100,KPMG Australia,INV42472,PO9376,GBP,-45877.52,EXPORT,Payment for goods,Oracle,2026-02-20,2026-02-13,-45877.52,True,payment for goods,2026-02-23 16:50:30.516232,Raw_GL_Export.csv
TXN000457,2025-05-09,2025-05-04,2025-05,AUS01,5710,CC2000,Telstra Corp,INV75841,PO4091,USD,-26352.75,GST,Payment for license,Oracle,2025-05-09,2025-05-04,-26352.75,True,payment for license,2026-02-23 16:50:30.516232,Raw_GL_Export.csv
TXN000458,2025-11-08,2025-11-05,2025-11,AUS01,5400,CC1000,PWC,INV12314,PO2489,USD,-3637.99,EXPORT,Payment for services,Manual Entry,2025-11-08,2025-11-05,-3637.99,True,payment for services,2026-02-23 16:50:30.516232,Raw_GL_Export.csv
TXN000459,01/14/2026,01/10/2026,2026-01,AUS01,5210,CC3000,Telstra Corp,INV94393,,GBP,-46938.65,EXPORT,Payment for services,Workday,2026-01-14,2026-10-01,-46938.65,True,payment for services,2026-02-23 16:50:30.516232,Raw_GL_Export.csv
TXN000460,08/12/2025,08/06/2025,2025-08,AUS01,5710,CC3100,Accenture Pty,INV15359,,NZD,-5334.2,GST-FREE,Payment for subscription,Oracle,2025-12-08,2025-06-08,-5334.2,True,payment for subscription,2026-02-23 16:50:30.516232,Raw_GL_Export.csv
TXN000461,10-10-2025,05-10-2025,2025-10,AUS01,5610,CC1100,Telstra Corp,INV57655,PO2827,USD,-37412.07,EXPORT,Payment for services,SAP,2025-10-10,2025-10-05,-37412.07,True,payment for services,2026-02-23 16:50:30.516232,Raw_GL_Export.csv
TXN000462,22/01/2025,16/01/2025,2025-01,AUS01,5320,CC3000,Regus Australia,INV86588,PO2742,USD,-17552.61,GST-FREE,Payment for goods,API Import,2025-01-22,2025-01-16,-17552.61,True,payment for goods,2026-02-23 16:50:30.516232,Raw_GL_Export.csv
TXN000463,2026-01-04,2025-12-25,2026-01,AUS01,5620,CC2000,SAP,INV81641,PO5939,GBP,-3817.52,GST,Payment for consulting,Oracle,2026-01-04,2025-12-25,-3817.52,True,payment for consulting,2026-02-23 16:50:30.516232,Raw_GL_Export.csv
TXN000464,18/02/2026,17/02/2026,2026-02,AUS01,5110,CC2000,AusPost,INV57973,PO2923,NZD,-5509.83,INPUT,Payment for consulting,SAP,2026-02-18,2026-02-17,-5509.83,True,payment for consulting,2026-02-23 16:50:30.516232,Raw_GL_Export.csv
TXN000465,16-04-2025,07-04-2025,2025-04,AUS01,5510,CC1000,Adobe,INV47965,,NZD,-15234.36,GST-FREE,Payment for license,SAP,2025-04-16,2025-04-07,-15234.36,True,payment for license,2026-02-23 16:50:30.516232,Raw_GL_Export.csv
TXN000466,26/01/2026,19/01/2026,2026-01,AUS01,5500,CC4000,Robert Half International,INV83727,PO7567,AUD,-41740.64,EXPORT,Payment for license,Workday,2026-01-26,2026-01-19,-41740.64,True,payment for license,2026-02-23 16:50:30.516232,Raw_GL_Export.csv
TXN000467,07/02/2026,06/02/2026,2026-02,AUS01,5120,CC4100,Workday,INV76036,PO9602,AUD,-6130.16,EXPORT,Payment for subscription,Workday,2026-02-07,2026-02-06,-6130.16,True,payment for subscription,2026-02-23 16:50:30.516232,Raw_GL_Export.csv
TXN000468,28/02/2026,23/02/2026,2026-02,AUS01,5710,CC2100,Atlassian Pty,INV48252,,USD,-38825.92,GST-FREE,Payment for goods,Workday,2026-02-28,2026-02-23,-38825.92,True,payment for goods,2026-02-23 16:50:30.516232,Raw_GL_Export.csv
TXN000469,02/05/2026,02/04/2026,2026-02,AUS01,5620,CC2000,Workday,INV92927,PO7047,AUD,-49930.14,INPUT,Payment for subscription,SAP,2026-05-02,2026-04-02,-49930.14,True,payment for subscription,2026-02-23 16:50:30.516232,Raw_GL_Export.csv
TXN000470,01/23/2026,01/20/2026,2026-01,AUS01,5410,CC4100,KPMG Australia,INV56593,,NZD,-835.46,GST,Payment for subscription,Oracle,2026-01-23,2026-01-20,-835.46,True,payment for subscription,2026-02-23 16:50:30.516232,Raw_GL_Export.csv
TXN000471,2026-01-09,2025-12-31,2026-01,AUS01,5700,CC4100,GCP,INV92081,PO4377,GBP,-2811.75,INPUT,Payment for consulting,Oracle,2026-01-09,2025-12-31,-2811.75,True,payment for consulting,2026-02-23 16:50:30.516232,Raw_GL_Export.csv
TXN000472,02/11/2026,02/07/2026,2026-02,AUS01,5600,CC3100,Zoom,INV58318,,GBP,-38437.02,EXPORT,Payment for consulting,SAP,2026-11-02,2026-07-02,-38437.02,True,payment for consulting,2026-02-23 16:50:30.516232,Raw_GL_Export.csv
TXN000473,16/01/2026,08/01/2026,2026-01,AUS01,5120,CC1200,SAP,INV94877,,GBP,-2926.58,GST-FREE,Payment for subscription,Oracle,2026-01-16,2026-01-08,-2926.58,True,payment for subscription,2026-02-23 16:50:30.516232,Raw_GL_Export.csv
TXN000474,06-10-2025,26-09-2025,2025-10,AUS01,5200,CC1100,Zoom,INV94557,PO2642,AUD,-28722.89,EXPORT,Payment for license,Oracle,2025-10-06,2025-09-26,-28722.89,True,payment for license,2026-02-23 16:50:30.516232,Raw_GL_Export.csv
TXN000475,2026-02-24,2026-02-14,2026-02,AUS01,5100,CC3100,Federal Express,INV94473,PO3165,AUD,-44509.23,GST,Payment for goods,SAP,2026-02-24,2026-02-14,-44509.23,True,payment for goods,2026-02-23 16:50:30.516232,Raw_GL_Export.csv
TXN000476,09/01/2026,30/12/2025,2026-01,AUS01,5000,CC1000,GCP,INV36518,,NZD,-7449.26,GST,Payment for license,Manual Entry,2026-01-09,2025-12-30,-7449.26,True,payment for license,2026-02-23 16:50:30.516232,Raw_GL_Export.csv
TXN000477,27/09/2025,22/09/2025,2025-09,AUS01,5310,CC3200,Zoom,INV92245,PO1347,USD,-47211.81,INPUT,Payment for services,SAP,2025-09-27,2025-09-22,-47211.81,True,payment for services,2026-02-23 16:50:30.516232,Raw_GL_Export.csv
TXN000478,01/18/2025,01/16/2025,2025-01,AUS01,5510,CC3100,Zoom,INV39710,PO3414,AUD,-4482.87,GST,Payment for subscription,Workday,2025-01-18,2025-01-16,-4482.87,True,payment for subscription,2026-02-23 16:50:30.516232,Raw_GL_Export.csv
TXN000479,08-02-2026,06-02-2026,2026-02,AUS01,5500,CC1200,Atlassian Pty,INV56833,,USD,-44923.36,INPUT,Payment for subscription,SAP,2026-02-08,2026-02-06,-44923.36,True,payment for subscription,2026-02-23 16:50:30.516232,Raw_GL_Export.csv
TXN000480,2026-01-12,2026-01-11,2026-01,AUS01,5610,CC1200,Oracle,INV99054,PO5940,GBP,-23529.02,GST-FREE,Payment for license,Workday,2026-01-12,2026-01-11,-23529.02,True,payment for license,2026-02-23 16:50:30.516232,Raw_GL_Export.csv
TXN000481,2026-01-12,2026-01-07,2026-01,AUS01,5500,CC3000,Deloitte Touche,INV95964,,AUD,-10636.08,GST-FREE,Payment for goods,Manual Entry,2026-01-12,2026-01-07,-10636.08,True,payment for goods,2026-02-23 16:50:30.516232,Raw_GL_Export.csv
TXN000482,15-01-2026,13-01-2026,2026-01,AUS01,5100,CC4100,Telstra Corp,INV26716,,NZD,-42781.08,INPUT,Payment for consulting,Workday,2026-01-15,2026-01-13,-42781.08,True,payment for consulting,2026-02-23 16:50:30.516232,Raw_GL_Export.csv
TXN000483,11-01-2026,04-01-2026,2026-01,AUS01,5500,CC3100,BCG,INV60224,PO9144,USD,-9973.17,GST-FREE,Payment for license,API Import,2026-01-11,2026-01-04,-9973.17,True,payment for license,2026-02-23 16:50:30.516232,Raw_GL_Export.csv
TXN000484,16/09/2025,09/09/2025,2025-09,AUS01,5020,CC4100,AusPost,INV57409,,USD,-14915.64,GST-FREE,Payment for services,Workday,2025-09-16,2025-09-09,-14915.64,True,payment for services,2026-02-23 16:50:30.516232,Raw_GL_Export.csv
TXN000485,18-02-2026,15-02-2026,2026-02,AUS01,5100,CC1000,WeWork Australia,INV48626,PO7898,NZD,-7647.3,GST-FREE,Payment for goods,Oracle,2026-02-18,2026-02-15,-7647.3,True,payment for goods,2026-02-23 16:50:30.516232,Raw_GL_Export.csv
TXN000486,27/02/2026,26/02/2026,2026-02,AUS01,5800,CC1200,Atlassian Pty,INV65667,PO2736,USD,-31164.71,GST,Payment for license,SAP,2026-02-27,2026-02-26,-31164.71,True,payment for license,2026-02-23 16:50:30.516232,Raw_GL_Export.csv
TXN000487,16/02/2026,15/02/2026,2026-02,AUS01,5110,CC3000,Zoom,INV84603,PO7823,AUD,-37772.21,GST,Payment for goods,Oracle,2026-02-16,2026-02-15,-37772.21,True,payment for goods,2026-02-23 16:50:30.516232,Raw_GL_Export.csv
TXN000488,16/01/2026,07/01/2026,2026-01,AUS01,5710,CC2100,Seek Limited,INV94521,PO5698,GBP,-13944.38,EXPORT,Payment for services,Oracle,2026-01-16,2026-01-07,-13944.38,True,payment for services,2026-02-23 16:50:30.516232,Raw_GL_Export.csv
TXN000489,2025-04-02,2025-03-23,2025-04,AUS01,5810,CC1200,Robert Half International,INV99116,PO8443,USD,-49457.71,EXPORT,Payment for license,Workday,2025-04-02,2025-03-23,-49457.71,True,payment for license,2026-02-23 16:50:30.516232,Raw_GL_Export.csv
TXN000490,02/19/2026,02/15/2026,2026-02,AUS01,5410,CC1200,PWC,INV37769,PO1917,AUD,-23977.1,GST-FREE,Payment for goods,Manual Entry,2026-02-19,2026-02-15,-23977.1,True,payment for goods,2026-02-23 16:50:30.516232,Raw_GL_Export.csv
TXN000491,2026-01-06,2025-12-29,2026-01,AUS01,5500,CC3000,DHL Express,INV94757,PO5422,GBP,-41775.26,INPUT,Payment for services,SAP,2026-01-06,2025-12-29,-41775.26,True,payment for services,2026-02-23 16:50:30.516232,Raw_GL_Export.csv
TXN000492,02/03/2026,01/24/2026,2026-02,AUS01,5810,CC3000,Amazon,INV18561,,USD,-35917.87,GST,Payment for services,Workday,2026-03-02,2026-01-24,-35917.87,True,payment for services,2026-02-23 16:50:30.516232,Raw_GL_Export.csv
TXN000493,07/01/2026,06/01/2026,2026-01,AUS01,5210,CC2100,Google,INV15987,,AUD,-21869.41,EXPORT,Payment for services,Workday,2026-01-07,2026-01-06,-21869.41,True,payment for services,2026-02-23 16:50:30.516232,Raw_GL_Export.csv
TXN000494,02/01/2026,01/27/2026,2026-02,AUS01,5400,CC4000,SAP,INV26976,PO2595,NZD,-12483.07,INPUT,Payment for subscription,Manual Entry,2026-01-02,2026-01-27,-12483.07,True,payment for subscription,2026-02-23 16:50:30.516232,Raw_GL_Export.csv
TXN000495,2026-01-24,2026-01-15,2026-01,AUS01,5900,CC1200,Amazon,INV48026,,GBP,-26200.04,GST,Payment for consulting,SAP,2026-01-24,2026-01-15,-26200.04,True,payment for consulting,2026-02-23 16:50:30.516232,Raw_GL_Export.csv
TXN000496,2026-01-21,2026-01-17,2026-01,AUS01,5200,CC1200,Adobe,INV54436,,NZD,-27670.74,GST-FREE,Payment for license,Manual Entry,2026-01-21,2026-01-17,-27670.74,True,payment for license,2026-02-23 16:50:30.516232,Raw_GL_Export.csv
TXN000497,02-02-2026,29-01-2026,2026-02,AUS01,5200,CC4100,Salesforce,INV22767,PO3336,USD,-21711.65,EXPORT,Payment for subscription,API Import,2026-02-02,2026-01-29,-21711.65,True,payment for subscription,2026-02-23 16:50:30.516232,Raw_GL_Export.csv
TXN000498,2026-02-28,2026-02-20,2026-02,AUS01,5100,CC3200,McKinsey,INV18934,,USD,-3390.61,GST-FREE,Payment for subscription,Workday,2026-02-28,2026-02-20,-3390.61,True,payment for subscription,2026-02-23 16:50:30.516232,Raw_GL_Export.csv
TXN000499,2025-06-03,2025-05-31,2025-06,AUS01,5710,CC3200,Deloitte Touche,INV95235,PO3031,GBP,-1173.66,EXPORT,Payment for license,Manual Entry,2025-06-03,2025-05-31,-1173.66,True,payment for license,2026-02-23 16:50:30.516232,Raw_GL_Export.csv
TXN000500,01/02/2026,12/28/2025,2026-01,AUS01,5400,CC3100,Slack,INV58979,,GBP,-31700.06,INPUT,Payment for consulting,API Import,2026-02-01,2025-12-28,-31700.06,True,payment for consulting,2026-02-23 16:50:30.516232,Raw_GL_Export.csv
TXN000501,05/15/2025,05/14/2025,2025-05,AUS01,5610,CC1000,Accenture Pty,INV48097,PO7541,AUD,-42287.34,GST,Payment for services,Oracle,2025-05-15,2025-05-14,-42287.34,True,payment for services,2026-02-23 16:50:30.516232,Raw_GL_Export.csv
TXN000502,13-02-2026,11-02-2026,2026-02,AUS01,5320,CC3200,LinkedIn Corp,INV24201,PO7503,GBP,-44554.96,GST-FREE,Payment for consulting,Oracle,2026-02-13,2026-02-11,-44554.96,True,payment for consulting,2026-02-23 16:50:30.516232,Raw_GL_Export.csv
TXN000503,02/13/2026,02/11/2026,2026-02,AUS01,5310,CC3000,Hays,INV24984,,USD,-14955.69,EXPORT,Payment for services,API Import,2026-02-13,2026-11-02,-14955.69,True,payment for services,2026-02-23 16:50:30.516232,Raw_GL_Export.csv
TXN000504,05-07-2025,02-07-2025,2025-07,AUS01,5620,CC2000,McKinsey,INV18178,PO6922,AUD,-708.24,EXPORT,Payment for consulting,Manual Entry,2025-07-05,2025-07-02,-708.24,True,payment for consulting,2026-02-23 16:50:30.516232,Raw_GL_Export.csv
TXN000505,2026-01-07,2026-01-03,2026-01,AUS01,5920,CC1000,Telstra Corp,INV20956,,NZD,-37421.64,GST-FREE,Payment for subscription,Manual Entry,2026-01-07,2026-01-03,-37421.64,True,payment for subscription,2026-02-23 16:50:30.516232,Raw_GL_Export.csv
TXN000506,11/03/2025,10/26/2025,2025-11,AUS01,5920,CC3100,Workday,INV22116,PO8021,NZD,-40814.49,GST,Payment for subscription,Workday,2025-03-11,2025-10-26,-40814.49,True,payment for subscription,2026-02-23 16:50:30.516232,Raw_GL_Export.csv
TXN000507,06/02/2026,31/01/2026,2026-02,AUS01,5410,CC3200,Seek Limited,INV56490,PO7375,USD,-1817.07,EXPORT,Payment for services,API Import,2026-02-06,2026-01-31,-1817.07,True,payment for services,2026-02-23 16:50:30.516232,Raw_GL_Export.csv
TXN000508,26/02/2026,24/02/2026,2026-02,AUS01,5800,CC4100,Zoom,INV11859,,NZD,-16863.26,INPUT,Payment for consulting,Oracle,2026-02-26,2026-02-24,-16863.26,True,payment for consulting,2026-02-23 16:50:30.516232,Raw_GL_Export.csv
TXN000509,11/16/2025,11/14/2025,2025-11,AUS01,5900,CC3100,Deloitte Touche,INV93138,PO2596,AUD,-686.89,GST-FREE,Payment for services,Oracle,2025-11-16,2025-11-14,-686.89,True,payment for services,2026-02-23 16:50:30.516232,Raw_GL_Export.csv
TXN000510,24/01/2025,17/01/2025,2025-01,AUS01,5710,CC4000,Adobe,INV35055,PO1235,GBP,-39214.75,GST-FREE,Payment for subscription,Workday,2025-01-24,2025-01-17,-39214.75,True,payment for subscription,2026-02-23 16:50:30.516232,Raw_GL_Export.csv
TXN000511,01/01/2026,12/27/2025,2026-01,AUS01,5510,CC1100,Hays,INV56165,PO7977,GBP,-29338.72,INPUT,Payment for license,Workday,2026-01-01,2025-12-27,-29338.72,True,payment for license,2026-02-23 16:50:30.516232,Raw_GL_Export.csv
TXN000512,04/09/2025,27/08/2025,2025-09,AUS01,5410,CC3000,Oracle,INV47359,PO8167,USD,-22916.13,EXPORT,Payment for subscription,API Import,2025-09-04,2025-08-27,-22916.13,True,payment for subscription,2026-02-23 16:50:30.516232,Raw_GL_Export.csv
TXN000513,2026-01-28,2026-01-26,2026-01,AUS01,5900,CC1100,Google,INV23588,PO9924,AUD,-19248.61,EXPORT,Payment for services,Manual Entry,2026-01-28,2026-01-26,-19248.61,True,payment for services,2026-02-23 16:50:30.516232,Raw_GL_Export.csv
TXN000514,2025-03-17,2025-03-12,2025-03,AUS01,5920,CC3100,Workday,INV25007,,USD,-11233.68,EXPORT,Payment for consulting,SAP,2025-03-17,2025-03-12,-11233.68,True,payment for consulting,2026-02-23 16:50:30.516232,Raw_GL_Export.csv
TXN000515,12-01-2026,05-01-2026,2026-01,AUS01,5910,CC3100,AWS,INV45076,PO5333,NZD,-10968.42,INPUT,Payment for subscription,Manual Entry,2026-01-12,2026-01-05,-10968.42,True,payment for subscription,2026-02-23 16:50:30.516232,Raw_GL_Export.csv
TXN000516,22/09/2025,21/09/2025,2025-09,AUS01,5410,CC1000,AWS,INV78021,PO6201,AUD,-42346.57,INPUT,Payment for subscription,Oracle,2025-09-22,2025-09-21,-42346.57,True,payment for subscription,2026-02-23 16:50:30.516232,Raw_GL_Export.csv
TXN000517,19-01-2026,15-01-2026,2026-01,AUS01,5520,CC3100,SAP,INV26891,PO7396,GBP,-8655.36,EXPORT,Payment for goods,Manual Entry,2026-01-19,2026-01-15,-8655.36,True,payment for goods,2026-02-23 16:50:30.516232,Raw_GL_Export.csv
TXN000518,11/05/2025,04/05/2025,2025-05,AUS01,5210,CC1100,Slack,INV92223,PO3605,AUD,-18491.09,EXPORT,Payment for subscription,Oracle,2025-05-11,2025-05-04,-18491.09,True,payment for subscription,2026-02-23 16:50:30.516232,Raw_GL_Export.csv
TXN000519,2026-01-03,2026-01-02,2026-01,AUS01,5410,CC1000,Zoom,INV84946,PO3138,AUD,-19156.83,GST,Payment for consulting,Workday,2026-01-03,2026-01-02,-19156.83,True,payment for consulting,2026-02-23 16:50:30.516232,Raw_GL_Export.csv
TXN000520,06/01/2026,02/01/2026,2026-01,AUS01,5300,CC2000,Accenture Pty,INV46040,,GBP,-11557.46,GST,Payment for goods,SAP,2026-01-06,2026-01-02,-11557.46,True,payment for goods,2026-02-23 16:50:30.516232,Raw_GL_Export.csv
TXN000521,2026-02-21,2026-02-19,2026-02,AUS01,5420,CC4100,Atlassian Pty,INV33675,,AUD,-42922.41,INPUT,Payment for consulting,Workday,2026-02-21,2026-02-19,-42922.41,True,payment for consulting,2026-02-23 16:50:30.516232,Raw_GL_Export.csv
TXN000522,27/10/2025,20/10/2025,2025-10,AUS01,5100,CC3200,Amazon,INV37563,PO7148,GBP,-46328.56,GST,Payment for subscription,Manual Entry,2025-10-27,2025-10-20,-46328.56,True,payment for subscription,2026-02-23 16:50:30.516232,Raw_GL_Export.csv
TXN000523,26/01/2026,23/01/2026,2026-01,AUS01,5300,CC1000,Oracle,INV55453,PO9953,AUD,-44151.36,INPUT,Payment for services,Oracle,2026-01-26,2026-01-23,-44151.36,True,payment for services,2026-02-23 16:50:30.516232,Raw_GL_Export.csv
TXN000524,03/17/2025,03/15/2025,2025-03,AUS01,5200,CC4100,Amazon,INV38351,PO2880,AUD,-24152.05,GST-FREE,Payment for goods,SAP,2025-03-17,2025-03-15,-24152.05,True,payment for goods,2026-02-23 16:50:30.516232,Raw_GL_Export.csv
TXN000525,11/02/2026,07/02/2026,2026-02,AUS01,5020,CC1200,PWC,INV55685,PO5822,NZD,-25969.41,GST,Payment for consulting,Manual Entry,2026-02-11,2026-02-07,-25969.41,True,payment for consulting,2026-02-23 16:50:30.516232,Raw_GL_Export.csv
TXN000526,14-08-2025,10-08-2025,2025-08,AUS01,5220,CC1200,SAP,INV86499,PO6105,NZD,-2002.62,GST,Payment for goods,Oracle,2025-08-14,2025-08-10,-2002.62,True,payment for goods,2026-02-23 16:50:30.516232,Raw_GL_Export.csv
TXN000527,24-10-2025,17-10-2025,2025-10,AUS01,5420,CC3100,PWC,INV66270,,NZD,-18916.74,EXPORT,Payment for subscription,Workday,2025-10-24,2025-10-17,-18916.74,True,payment for subscription,2026-02-23 16:50:30.516232,Raw_GL_Export.csv
TXN000528,2026-01-21,2026-01-13,2026-01,AUS01,5120,CC1000,Robert Half International,INV89152,PO9691,NZD,-20715.22,INPUT,Payment for subscription,Manual Entry,2026-01-21,2026-01-13,-20715.22,True,payment for subscription,2026-02-23 16:50:30.516232,Raw_GL_Export.csv
TXN000529,2025-05-01,2025-04-28,2025-05,AUS01,5900,CC3000,Telstra Corp,INV38204,PO7094,USD,-32148.55,GST,Payment for goods,Workday,2025-05-01,2025-04-28,-32148.55,True,payment for goods,2026-02-23 16:50:30.516232,Raw_GL_Export.csv
TXN000530,2025-04-04,2025-03-29,2025-04,AUS01,5710,CC1000,BCG,INV40493,PO7317,USD,-26777.71,INPUT,Payment for subscription,API Import,2025-04-04,2025-03-29,-26777.71,True,payment for subscription,2026-02-23 16:50:30.516232,Raw_GL_Export.csv
TXN000531,07/02/2026,05/02/2026,2026-02,AUS01,5520,CC2100,Salesforce,INV51652,PO4246,GBP,-15961.62,EXPORT,Payment for goods,SAP,2026-02-07,2026-02-05,-15961.62,True,payment for goods,2026-02-23 16:50:30.516232,Raw_GL_Export.csv
TXN000532,26-06-2025,18-06-2025,2025-06,AUS01,5010,CC2100,AusPost,INV88830,PO7272,AUD,-43807.78,GST-FREE,Payment for goods,API Import,2025-06-26,2025-06-18,-43807.78,True,payment for goods,2026-02-23 16:50:30.516232,Raw_GL_Export.csv
TXN000533,02/01/2026,01/31/2026,2026-02,AUS01,5620,CC4100,AWS,INV14850,PO9642,GBP,-35810.15,EXPORT,Payment for services,Workday,2026-01-02,2026-01-31,-35810.15,True,payment for services,2026-02-23 16:50:30.516232,Raw_GL_Export.csv
TXN000534,2026-02-21,2026-02-19,2026-02,AUS01,5500,CC1100,AusPost,INV62473,,NZD,-36293.79,INPUT,Payment for subscription,Manual Entry,2026-02-21,2026-02-19,-36293.79,True,payment for subscription,2026-02-23 16:50:30.516232,Raw_GL_Export.csv
TXN000535,2026-02-20,2026-02-13,2026-02,AUS01,5300,CC3200,Hays,INV13838,,AUD,-7930.53,GST,Payment for services,Oracle,2026-02-20,2026-02-13,-7930.53,True,payment for services,2026-02-23 16:50:30.516232,Raw_GL_Export.csv
TXN000536,07/04/2025,06/27/2025,2025-07,AUS01,5210,CC1200,Google,INV80458,PO1860,USD,-13867.02,INPUT,Payment for subscription,SAP,2025-04-07,2025-06-27,-13867.02,True,payment for subscription,2026-02-23 16:50:30.516232,Raw_GL_Export.csv
TXN000537,2026-02-04,2026-01-30,2026-02,AUS01,5020,CC2100,BCG,INV32326,PO8548,GBP,12219.05,,Payment for services,Oracle,2026-02-04,2026-01-30,12219.05,False,payment for services,2026-02-23 16:50:30.516232,Raw_GL_Export.csv
TXN000538,11/01/2025,01/01/2025,2025-01,AUS01,5920,CC3100,Optus Pty,INV41525,PO9029,AUD,23527.19,,Payment for subscription,Workday,2025-01-11,2025-01-01,23527.19,False,payment for subscription,2026-02-23 16:50:30.516232,Raw_GL_Export.csv
TXN000539,25-02-2026,21-02-2026,2026-02,AUS01,5020,CC2100,KPMG Australia,INV41768,PO4373,AUD,15950.14,,Payment for services,SAP,2026-02-25,2026-02-21,15950.14,False,payment for services,2026-02-23 16:50:30.516232,Raw_GL_Export.csv
TXN000540,2026-01-16,2026-01-12,2026-01,AUS01,5000,CC2000,LinkedIn Corp,INV23701,PO9644,GBP,8537.49,,Payment for license,Workday,2026-01-16,2026-01-12,8537.49,False,payment for license,2026-02-23 16:50:30.516232,Raw_GL_Export.csv
TXN000541,01/25/2026,01/17/2026,2026-01,AUS01,5620,CC1200,Robert Half International,INV38676,PO7317,AUD,41144.22,,Payment for consulting,API Import,2026-01-25,2026-01-17,41144.22,False,payment for consulting,2026-02-23 16:50:30.516232,Raw_GL_Export.csv
TXN000542,17/02/2026,10/02/2026,2026-02,AUS01,5200,CC1100,PWC,INV50258,PO2672,GBP,7472.41,,Payment for goods,Manual Entry,2026-02-17,2026-02-10,7472.41,False,payment for goods,2026-02-23 16:50:30.516232,Raw_GL_Export.csv
TXN000543,2025-08-04,2025-07-31,2025-08,AUS01,5000,CC3200,Oracle,INV96754,PO6766,NZD,1383.52,,Payment for subscription,SAP,2025-08-04,2025-07-31,1383.52,False,payment for subscription,2026-02-23 16:50:30.516232,Raw_GL_Export.csv
TXN000544,2026-02-18,2026-02-12,2026-02,AUS01,5410,CC2000,Zoom,INV76574,PO8230,GBP,22648.35,,Payment for subscription,Workday,2026-02-18,2026-02-12,22648.35,False,payment for subscription,2026-02-23 16:50:30.516232,Raw_GL_Export.csv
TXN000545,2026-01-04,2025-12-28,2026-01,AUS01,5800,CC3100,SAP,INV33153,PO9676,NZD,8606.29,,Payment for license,Manual Entry,2026-01-04,2025-12-28,8606.29,False,payment for license,2026-02-23 16:50:30.516232,Raw_GL_Export.csv
TXN000546,17-02-2026,15-02-2026,2026-02,AUS01,5700,CC1000,Accenture Pty,INV16964,PO5361,AUD,9959.13,,Payment for goods,SAP,2026-02-17,2026-02-15,9959.13,False,payment for goods,2026-02-23 16:50:30.516232,Raw_GL_Export.csv
TXN000547,2026-01-18,2026-01-13,2026-01,AUS01,5210,CC4100,DHL Express,INV38821,PO5395,GBP,17740.56,,Payment for consulting,Oracle,2026-01-18,2026-01-13,17740.56,False,payment for consulting,2026-02-23 16:50:30.516232,Raw_GL_Export.csv
TXN000548,06/01/2026,31/12/2025,2026-01,AUS01,5620,CC2100,KPMG Australia,INV75960,PO8811,AUD,4331.49,,Payment for subscription,Oracle,2026-01-06,2025-12-31,4331.49,False,payment for subscription,2026-02-23 16:50:30.516232,Raw_GL_Export.csv
TXN000549,02/06/2026,02/04/2026,2026-02,AUS01,5120,CC1200,BCG,INV11669,PO8011,GBP,6468.33,,Payment for subscription,SAP,2026-06-02,2026-04-02,6468.33,False,payment for subscription,2026-02-23 16:50:30.516232,Raw_GL_Export.csv
TXN000550,01/06/2026,01/04/2026,2026-01,AUS01,5120,CC1000,WeWork Australia,INV74003,PO8742,GBP,26283.83,,Payment for services,SAP,2026-06-01,2026-04-01,26283.83,False,payment for services,2026-02-23 16:50:30.516232,Raw_GL_Export.csv
TXN000551,2026-01-27,2026-01-17,2026-01,AUS01,5700,CC2100,ServiceNow Inc,INV22308,,USD,33999.16,,Payment for subscription,Manual Entry,2026-01-27,2026-01-17,33999.16,False,payment for subscription,2026-02-23 16:50:30.516232,Raw_GL_Export.csv
TXN000552,01/16/2026,01/07/2026,2026-01,AUS01,5220,CC3200,Deloitte Touche,INV56219,PO6467,NZD,20697.91,,Payment for license,API Import,2026-01-16,2026-07-01,20697.91,False,payment for license,2026-02-23 16:50:30.516232,Raw_GL_Export.csv
TXN000553,2026-02-16,2026-02-11,2026-02,AUS01,5700,CC4000,Amazon,INV38869,PO3320,USD,44040.82,,Payment for subscription,Manual Entry,2026-02-16,2026-02-11,44040.82,False,payment for subscription,2026-02-23 16:50:30.516232,Raw_GL_Export.csv
TXN000554,01/02/2026,22/01/2026,2026-02,AUS01,5800,CC3100,Regus Australia,INV35407,PO7189,USD,33521.99,,Payment for services,Workday,2026-02-01,2026-01-22,33521.99,False,payment for services,2026-02-23 16:50:30.516232,Raw_GL_Export.csv
TXN000555,21-01-2026,12-01-2026,2026-01,AUS01,5120,CC2100,WeWork Australia,INV64695,PO5526,NZD,17657.08,,Payment for subscription,Oracle,2026-01-21,2026-01-12,17657.08,False,payment for subscription,2026-02-23 16:50:30.516232,Raw_GL_Export.csv
TXN000556,06/02/2025,05/23/2025,2025-06,AUS01,5100,CC3100,LinkedIn Corp,INV11092,PO3410,NZD,13049.54,,Payment for consulting,Oracle,2025-02-06,2025-05-23,13049.54,False,payment for consulting,2026-02-23 16:50:30.516232,Raw_GL_Export.csv
TXN000557,02/17/2026,02/07/2026,2026-02,AUS01,5520,CC1200,EY Australia,INV48630,,GBP,13042.87,,Payment for services,Oracle,2026-02-17,2026-07-02,13042.87,False,payment for services,2026-02-23 16:50:30.516232,Raw_GL_Export.csv
TXN000558,2026-02-10,2026-02-09,2026-02,AUS01,5500,CC2100,AWS,INV10084,,GBP,15916.27,,Payment for goods,Workday,2026-02-10,2026-02-09,15916.27,False,payment for goods,2026-02-23 16:50:30.516232,Raw_GL_Export.csv
TXN000559,10/10/2025,08/10/2025,2025-10,AUS01,5710,CC2100,Zoom,INV20579,,USD,19499.08,,Payment for services,Manual Entry,2025-10-10,2025-10-08,19499.08,False,payment for services,2026-02-23 16:50:30.516232,Raw_GL_Export.csv
TXN000560,12/01/2026,05/01/2026,2026-01,AUS01,5410,CC3100,GCP,INV88255,PO8140,NZD,41416.72,,Payment for subscription,API Import,2026-01-12,2026-01-05,41416.72,False,payment for subscription,2026-02-23 16:50:30.516232,Raw_GL_Export.csv
TXN000561,05/01/2026,31/12/2025,2026-01,AUS01,5110,CC3100,SAP,INV48972,PO8555,NZD,13794.32,,Payment for license,Oracle,2026-01-05,2025-12-31,13794.32,False,payment for license,2026-02-23 16:50:30.516232,Raw_GL_Export.csv
TXN000562,13-12-2025,11-12-2025,2025-12,AUS01,5110,CC4000,Optus Pty,INV99805,PO8673,NZD,22721.3,,Payment for subscription,Manual Entry,2025-12-13,2025-12-11,22721.3,False,payment for subscription,2026-02-23 16:50:30.516232,Raw_GL_Export.csv
TXN000563,15-11-2025,08-11-2025,2025-11,AUS01,5420,CC1000,Amazon,INV28426,PO5954,GBP,4070.46,,Payment for goods,API Import,2025-11-15,2025-11-08,4070.46,False,payment for goods,2026-02-23 16:50:30.516232,Raw_GL_Export.csv
TXN000564,01/17/2026,01/14/2026,2026-01,AUS01,5610,CC4000,KPMG Australia,INV61466,,AUD,34014.55,,Payment for services,Manual Entry,2026-01-17,2026-01-14,34014.55,False,payment for services,2026-02-23 16:50:30.516232,Raw_GL_Export.csv
TXN000565,26-01-2026,25-01-2026,2026-01,AUS01,5020,CC1000,PWC,INV22766,PO8888,AUD,15073.41,,Payment for subscription,SAP,2026-01-26,2026-01-25,15073.41,False,payment for subscription,2026-02-23 16:50:30.516232,Raw_GL_Export.csv
TXN000566,2025-02-04,2025-01-31,2025-02,AUS01,5510,CC1200,Hays,INV98562,PO3535,USD,10137.11,,Payment for subscription,Workday,2025-02-04,2025-01-31,10137.11,False,payment for subscription,2026-02-23 16:50:30.516232,Raw_GL_Export.csv
TXN000567,2026-01-24,2026-01-16,2026-01,AUS01,5610,CC2000,Atlassian Pty,INV89140,PO9516,AUD,101.6,,Payment for services,Oracle,2026-01-24,2026-01-16,101.6,False,payment for services,2026-02-23 16:50:30.516232,Raw_GL_Export.csv
TXN000568,2026-02-07,2026-01-30,2026-02,AUS01,5000,CC4000,Optus Pty,INV25966,,GBP,2598.83,,Payment for consulting,Oracle,2026-02-07,2026-01-30,2598.83,False,payment for consulting,2026-02-23 16:50:30.516232,Raw_GL_Export.csv
TXN000569,27/06/2025,18/06/2025,2025-06,AUS01,5220,CC4100,Optus Pty,INV93387,,AUD,19512.68,,Payment for goods,Oracle,2025-06-27,2025-06-18,19512.68,False,payment for goods,2026-02-23 16:50:30.516232,Raw_GL_Export.csv
TXN000570,06/11/2025,29/10/2025,2025-11,AUS01,5500,CC2100,KPMG Australia,INV74613,PO5508,AUD,43163.2,,Payment for consulting,Manual Entry,2025-11-06,2025-10-29,43163.2,False,payment for consulting,2026-02-23 16:50:30.516232,Raw_GL_Export.csv
TXN000571,2025-10-23,2025-10-15,2025-10,AUS01,5410,CC3100,Zoom,INV25745,PO1180,AUD,12825.66,,Payment for license,Workday,2025-10-23,2025-10-15,12825.66,False,payment for license,2026-02-23 16:50:30.516232,Raw_GL_Export.csv
TXN000572,02-01-2026,01-01-2026,2026-01,AUS01,5320,CC1200,LinkedIn Corp,INV30750,PO9244,GBP,12532.99,,Payment for goods,Workday,2026-01-02,2026-01-01,12532.99,False,payment for goods,2026-02-23 16:50:30.516232,Raw_GL_Export.csv
TXN000573,23-01-2026,14-01-2026,2026-01,AUS01,5020,CC1200,Zoom,INV83812,PO3294,NZD,29551.41,,Payment for subscription,Workday,2026-01-23,2026-01-14,29551.41,False,payment for subscription,2026-02-23 16:50:30.516232,Raw_GL_Export.csv
TXN000574,2025-09-13,2025-09-05,2025-09,AUS01,5400,CC3200,Oracle,INV52477,PO6703,NZD,5911.05,,Payment for license,API Import,2025-09-13,2025-09-05,5911.05,False,payment for license,2026-02-23 16:50:30.516232,Raw_GL_Export.csv
TXN000575,27-01-2026,25-01-2026,2026-01,AUS01,5010,CC1000,Adobe,INV23922,PO8805,USD,4434.67,,Payment for subscription,Oracle,2026-01-27,2026-01-25,4434.67,False,payment for subscription,2026-02-23 16:50:30.516232,Raw_GL_Export.csv
TXN000576,25/02/2026,23/02/2026,2026-02,AUS01,5120,CC3100,AusPost,INV42831,,AUD,2880.51,,Payment for services,Manual Entry,2026-02-25,2026-02-23,2880.51,False,payment for services,2026-02-23 16:50:30.516232,Raw_GL_Export.csv
TXN000577,11/25/2025,11/15/2025,2025-11,AUS01,5620,CC1000,Oracle,INV68918,PO4272,NZD,4933.98,,Payment for goods,Workday,2025-11-25,2025-11-15,4933.98,False,payment for goods,2026-02-23 16:50:30.516232,Raw_GL_Export.csv
TXN000578,16-02-2026,11-02-2026,2026-02,AUS01,5210,CC2000,Adobe,INV35204,,GBP,36641.31,,Payment for services,SAP,2026-02-16,2026-02-11,36641.31,False,payment for services,2026-02-23 16:50:30.516232,Raw_GL_Export.csv
TXN000579,2026-01-07,2026-01-04,2026-01,AUS01,5000,CC3000,AusPost,INV99438,PO9653,AUD,15397.94,,Payment for consulting,Oracle,2026-01-07,2026-01-04,15397.94,False,payment for consulting,2026-02-23 16:50:30.516232,Raw_GL_Export.csv
TXN000580,27/02/2026,17/02/2026,2026-02,AUS01,5910,CC3200,Robert Half International,INV83229,PO2100,NZD,16106.19,,Payment for consulting,Manual Entry,2026-02-27,2026-02-17,16106.19,False,payment for consulting,2026-02-23 16:50:30.516232,Raw_GL_Export.csv
TXN000581,21-01-2026,19-01-2026,2026-01,AUS01,5600,CC1100,Slack,INV75367,,NZD,4630.99,,Payment for license,API Import,2026-01-21,2026-01-19,4630.99,False,payment for license,2026-02-23 16:50:30.516232,Raw_GL_Export.csv
TXN000582,2026-02-11,2026-02-07,2026-02,AUS01,5910,CC2100,Deloitte Touche,INV18906,PO3586,GBP,31676.97,,Payment for subscription,SAP,2026-02-11,2026-02-07,31676.97,False,payment for subscription,2026-02-23 16:50:30.516232,Raw_GL_Export.csv
TXN000583,18/01/2026,09/01/2026,2026-01,AUS01,5610,CC4000,EY Australia,INV81557,PO2816,GBP,27877.16,,Payment for license,Manual Entry,2026-01-18,2026-01-09,27877.16,False,payment for license,2026-02-23 16:50:30.516232,Raw_GL_Export.csv
TXN000584,2026-02-09,2026-02-08,2026-02,AUS01,5310,CC3100,Deloitte Touche,INV17784,,USD,15120.9,,Payment for license,Workday,2026-02-09,2026-02-08,15120.9,False,payment for license,2026-02-23 16:50:30.516232,Raw_GL_Export.csv
TXN000585,2026-01-25,2026-01-21,2026-01,AUS01,5500,CC1100,Microsoft,INV64557,PO2320,NZD,44149.42,,Payment for license,Manual Entry,2026-01-25,2026-01-21,44149.42,False,payment for license,2026-02-23 16:50:30.516232,Raw_GL_Export.csv
TXN000586,01/05/2026,01/04/2026,2026-01,AUS01,5100,CC1000,Hays,INV66559,PO4731,USD,29300.13,,Payment for services,SAP,2026-05-01,2026-04-01,29300.13,False,payment for services,2026-02-23 16:50:30.516232,Raw_GL_Export.csv
TXN000587,01/02/2026,23/01/2026,2026-02,AUS01,5610,CC3100,Amazon,INV59444,PO8040,GBP,2441.1,,Payment for consulting,API Import,2026-02-01,2026-01-23,2441.1,False,payment for consulting,2026-02-23 16:50:30.516232,Raw_GL_Export.csv
TXN000588,2026-01-05,2025-12-28,2026-01,AUS01,5100,CC4100,Regus Australia,INV67216,PO4902,NZD,8794.69,,Payment for goods,SAP,2026-01-05,2025-12-28,8794.69,False,payment for goods,2026-02-23 16:50:30.516232,Raw_GL_Export.csv
TXN000589,2025-01-19,2025-01-15,2025-01,AUS01,5410,CC4000,Microsoft,INV42757,PO2255,AUD,39309.19,,Payment for services,Oracle,2025-01-19,2025-01-15,39309.19,False,payment for services,2026-02-23 16:50:30.516232,Raw_GL_Export.csv
TXN000590,15/12/2025,10/12/2025,2025-12,AUS01,5010,CC3000,WeWork Australia,INV27002,PO8843,USD,44914.19,,Payment for services,SAP,2025-12-15,2025-12-10,44914.19,False,payment for services,2026-02-23 16:50:30.516232,Raw_GL_Export.csv
TXN000591,10/03/2025,09/24/2025,2025-10,AUS01,5200,CC3200,WeWork Australia,INV49677,PO5795,USD,20015.03,,Payment for goods,API Import,2025-03-10,2025-09-24,20015.03,False,payment for goods,2026-02-23 16:50:30.516232,Raw_GL_Export.csv
TXN000592,02/09/2026,01/31/2026,2026-02,AUS01,5510,CC1100,MSFT,INV91509,PO2285,NZD,40529.1,,Payment for goods,Oracle,2026-09-02,2026-01-31,40529.1,False,payment for goods,2026-02-23 16:50:30.516232,Raw_GL_Export.csv
TXN000593,27/01/2026,22/01/2026,2026-01,AUS01,5800,CC4000,Workday,INV28607,,AUD,16820.31,,Payment for goods,Manual Entry,2026-01-27,2026-01-22,16820.31,False,payment for goods,2026-02-23 16:50:30.516232,Raw_GL_Export.csv
TXN000594,21-04-2025,19-04-2025,2025-04,AUS01,5000,CC3200,Microsoft,INV60354,PO2384,NZD,12580.73,,Payment for services,Workday,2025-04-21,2025-04-19,12580.73,False,payment for services,2026-02-23 16:50:30.516232,Raw_GL_Export.csv
TXN000595,28-01-2026,20-01-2026,2026-01,AUS01,5000,CC3100,Federal Express,INV36965,PO8062,GBP,2094.26,,Payment for license,SAP,2026-01-28,2026-01-20,2094.26,False,payment for license,2026-02-23 16:50:30.516232,Raw_GL_Export.csv
TXN000596,12/22/2025,12/21/2025,2025-12,AUS01,5520,CC3000,Amazon,INV44410,PO4547,NZD,41529.17,,Payment for services,Workday,2025-12-22,2025-12-21,41529.17,False,payment for services,2026-02-23 16:50:30.516232,Raw_GL_Export.csv
TXN000597,24-10-2025,17-10-2025,2025-10,AUS01,5900,CC1000,GCP,INV98862,,GBP,42866.06,,Payment for license,Manual Entry,2025-10-24,2025-10-17,42866.06,False,payment for license,2026-02-23 16:50:30.516232,Raw_GL_Export.csv
TXN000598,01/14/2026,01/11/2026,2026-01,AUS01,5400,CC3200,Accenture Pty,INV46791,PO5495,USD,40856.3,,Payment for services,Oracle,2026-01-14,2026-11-01,40856.3,False,payment for services,2026-02-23 16:50:30.516232,Raw_GL_Export.csv
TXN000599,01/25/2026,01/19/2026,2026-01,AUS01,5600,CC3100,Microsoft,INV96406,,NZD,16340.1,,Payment for license,SAP,2026-01-25,2026-01-19,16340.1,False,payment for license,2026-02-23 16:50:30.516232,Raw_GL_Export.csv
TXN000600,01/04/2026,12/25/2025,2026-01,AUS01,5700,CC3000,Deloitte Touche,INV12263,PO8642,USD,20027.01,,Payment for services,Workday,2026-04-01,2025-12-25,20027.01,False,payment for services,2026-02-23 16:50:30.516232,Raw_GL_Export.csv
TXN000601,16/01/2026,09/01/2026,2026-01,AUS01,5010,CC4100,Google,INV82279,PO2049,NZD,40377.29,,Payment for consulting,Oracle,2026-01-16,2026-01-09,40377.29,False,payment for consulting,2026-02-23 16:50:30.516232,Raw_GL_Export.csv
TXN000602,02/09/2026,02/04/2026,2026-02,AUS01,5920,CC3200,Slack,INV29254,PO1812,USD,28402.18,,Payment for goods,SAP,2026-09-02,2026-04-02,28402.18,False,payment for goods,2026-02-23 16:50:30.516232,Raw_GL_Export.csv
TXN000603,2026-01-21,2026-01-18,2026-01,AUS01,5700,CC4000,Optus Pty,INV39878,,NZD,1983.81,,Payment for subscription,Workday,2026-01-21,2026-01-18,1983.81,False,payment for subscription,2026-02-23 16:50:30.516232,Raw_GL_Export.csv
TXN000604,01/01/2026,12/23/2025,2026-01,AUS01,5710,CC1000,Accenture Pty,INV76445,PO9372,NZD,5001.44,,Payment for services,Oracle,2026-01-01,2025-12-23,5001.44,False,payment for services,2026-02-23 16:50:30.516232,Raw_GL_Export.csv
TXN000605,01/07/2026,12/28/2025,2026-01,AUS01,5320,CC3100,Salesforce,INV28753,,GBP,39425.81,,Payment for license,Workday,2026-07-01,2025-12-28,39425.81,False,payment for license,2026-02-23 16:50:30.516232,Raw_GL_Export.csv
TXN000606,11-11-2025,05-11-2025,2025-11,AUS01,5500,CC2100,Amazon,INV48125,PO1418,USD,16636.76,,Payment for services,API Import,2025-11-11,2025-11-05,16636.76,False,payment for services,2026-02-23 16:50:30.516232,Raw_GL_Export.csv
TXN000607,07/07/2025,06/28/2025,2025-07,AUS01,5710,CC4000,WeWork Australia,INV86373,,USD,17109.9,,Payment for goods,Manual Entry,2025-07-07,2025-06-28,17109.9,False,payment for goods,2026-02-23 16:50:30.516232,Raw_GL_Export.csv
TXN000608,2026-01-25,2026-01-23,2026-01,AUS01,5210,CC4100,Robert Half International,INV25891,PO9646,GBP,24299.64,,Payment for services,API Import,2026-01-25,2026-01-23,24299.64,False,payment for services,2026-02-23 16:50:30.516232,Raw_GL_Export.csv
TXN000609,16-02-2026,10-02-2026,2026-02,AUS01,5220,CC2000,KPMG Australia,INV57443,,USD,14857.93,,Payment for subscription,SAP,2026-02-16,2026-02-10,14857.93,False,payment for subscription,2026-02-23 16:50:30.516232,Raw_GL_Export.csv
TXN000610,23/05/2025,15/05/2025,2025-05,AUS01,5800,CC3100,Regus Australia,INV76275,,AUD,15904.11,,Payment for subscription,Manual Entry,2025-05-23,2025-05-15,15904.11,False,payment for subscription,2026-02-23 16:50:30.516232,Raw_GL_Export.csv
TXN000611,20/12/2025,12/12/2025,2025-12,AUS01,5900,CC3100,ServiceNow Inc,INV42105,PO7678,USD,41664.69,,Payment for license,Oracle,2025-12-20,2025-12-12,41664.69,False,payment for license,2026-02-23 16:50:30.516232,Raw_GL_Export.csv
TXN000612,01/20/2026,01/15/2026,2026-01,AUS01,5310,CC3000,Atlassian Pty,INV76194,PO9096,AUD,18441.78,,Payment for goods,Oracle,2026-01-20,2026-01-15,18441.78,False,payment for goods,2026-02-23 16:50:30.516232,Raw_GL_Export.csv
TXN000613,2025-04-15,2025-04-12,2025-04,AUS01,5100,CC3100,Deloitte Touche,INV26567,PO8068,GBP,33454.14,,Payment for services,Oracle,2025-04-15,2025-04-12,33454.14,False,payment for services,2026-02-23 16:50:30.516232,Raw_GL_Export.csv
TXN000614,03/02/2026,25/01/2026,2026-02,AUS01,5920,CC4000,Federal Express,INV62732,PO4955,GBP,16011.11,,Payment for subscription,SAP,2026-02-03,2026-01-25,16011.11,False,payment for subscription,2026-02-23 16:50:30.516232,Raw_GL_Export.csv
TXN000615,02/11/2026,02/01/2026,2026-02,AUS01,5610,CC4100,GCP,INV56525,PO7699,AUD,3411.49,,Payment for consulting,Manual Entry,2026-11-02,2026-01-02,3411.49,False,payment for consulting,2026-02-23 16:50:30.516232,Raw_GL_Export.csv
TXN000616,10-01-2026,07-01-2026,2026-01,AUS01,5800,CC1200,Robert Half International,INV11020,PO7060,AUD,6936.31,,Payment for consulting,Manual Entry,2026-01-10,2026-01-07,6936.31,False,payment for consulting,2026-02-23 16:50:30.516232,Raw_GL_Export.csv
TXN000617,11-01-2025,08-01-2025,2025-01,AUS01,5510,CC4100,PWC,INV74656,PO9481,AUD,10528.63,,Payment for license,API Import,2025-01-11,2025-01-08,10528.63,False,payment for license,2026-02-23 16:50:30.516232,Raw_GL_Export.csv
TXN000618,17-02-2025,12-02-2025,2025-02,AUS01,5310,CC3100,McKinsey,INV15496,PO4451,USD,42912.76,,Payment for consulting,API Import,2025-02-17,2025-02-12,42912.76,False,payment for consulting,2026-02-23 16:50:30.516232,Raw_GL_Export.csv
TXN000619,03/09/2025,03/07/2025,2025-03,AUS01,5320,CC2100,Adobe,INV73784,PO3774,AUD,13024.16,,Payment for subscription,Workday,2025-09-03,2025-07-03,13024.16,False,payment for subscription,2026-02-23 16:50:30.516232,Raw_GL_Export.csv
TXN000620,2026-02-20,2026-02-16,2026-02,AUS01,5700,CC2100,Zoom,INV76676,PO1448,AUD,9387.26,,Payment for license,SAP,2026-02-20,2026-02-16,9387.26,False,payment for license,2026-02-23 16:50:30.516232,Raw_GL_Export.csv
TXN000621,18/07/2025,17/07/2025,2025-07,AUS01,5500,CC1000,Regus Australia,INV84863,PO8288,USD,12754.5,,Payment for license,Oracle,2025-07-18,2025-07-17,12754.5,False,payment for license,2026-02-23 16:50:30.516232,Raw_GL_Export.csv
TXN000622,27-01-2026,22-01-2026,2026-01,AUS01,5100,CC1100,Optus Pty,INV21385,PO5562,GBP,22247.17,,Payment for services,Workday,2026-01-27,2026-01-22,22247.17,False,payment for services,2026-02-23 16:50:30.516232,Raw_GL_Export.csv
TXN000623,2026-01-26,2026-01-22,2026-01,AUS01,5800,CC1100,McKinsey,INV46190,PO9402,USD,22867.0,,Payment for services,Workday,2026-01-26,2026-01-22,22867.0,False,payment for services,2026-02-23 16:50:30.516232,Raw_GL_Export.csv
TXN000624,02-01-2026,31-12-2025,2026-01,AUS01,5710,CC4000,McKinsey,INV96655,PO1583,USD,37880.25,,Payment for services,Oracle,2026-01-02,2025-12-31,37880.25,False,payment for services,2026-02-23 16:50:30.516232,Raw_GL_Export.csv
TXN000625,05-02-2026,01-02-2026,2026-02,AUS01,5700,CC2000,Deloitte Touche,INV34524,PO5630,GBP,6899.35,,Payment for goods,Oracle,2026-02-05,2026-02-01,6899.35,False,payment for goods,2026-02-23 16:50:30.516232,Raw_GL_Export.csv
TXN000626,2026-01-21,2026-01-12,2026-01,AUS01,5920,CC2000,AWS,INV83103,PO3918,GBP,3120.03,,Payment for services,Manual Entry,2026-01-21,2026-01-12,3120.03,False,payment for services,2026-02-23 16:50:30.516232,Raw_GL_Export.csv
TXN000627,08/23/2025,08/13/2025,2025-08,AUS01,5400,CC4100,Accenture Pty,INV96106,PO5916,NZD,21842.06,,Payment for goods,Workday,2025-08-23,2025-08-13,21842.06,False,payment for goods,2026-02-23 16:50:30.516232,Raw_GL_Export.csv
TXN000628,22-01-2026,14-01-2026,2026-01,AUS01,5900,CC3100,WeWork Australia,INV38695,,GBP,13364.23,,Payment for subscription,Manual Entry,2026-01-22,2026-01-14,13364.23,False,payment for subscription,2026-02-23 16:50:30.516232,Raw_GL_Export.csv
TXN000629,02/15/2026,02/11/2026,2026-02,AUS01,5700,CC3100,Atlassian Pty,INV51799,PO6694,USD,20966.64,,Payment for consulting,Oracle,2026-02-15,2026-11-02,20966.64,False,payment for consulting,2026-02-23 16:50:30.516232,Raw_GL_Export.csv
TXN000630,25-01-2026,17-01-2026,2026-01,AUS01,5610,CC3100,Accenture Pty,INV76517,,AUD,13162.77,,Payment for consulting,SAP,2026-01-25,2026-01-17,13162.77,False,payment for consulting,2026-02-23 16:50:30.516232,Raw_GL_Export.csv
TXN000631,02/18/2026,02/13/2026,2026-02,AUS01,5700,CC3000,AusPost,INV65731,PO1895,GBP,36425.47,,Payment for subscription,Manual Entry,2026-02-18,2026-02-13,36425.47,False,payment for subscription,2026-02-23 16:50:30.516232,Raw_GL_Export.csv
TXN000632,24/02/2026,18/02/2026,2026-02,AUS01,5620,CC1000,EY Australia,INV85039,PO9782,GBP,18500.54,,Payment for goods,SAP,2026-02-24,2026-02-18,18500.54,False,payment for goods,2026-02-23 16:50:30.516232,Raw_GL_Export.csv
TXN000633,02/20/2026,02/17/2026,2026-02,AUS01,5610,CC4000,Amazon,INV21829,PO6460,AUD,36128.34,,Payment for subscription,API Import,2026-02-20,2026-02-17,36128.34,False,payment for subscription,2026-02-23 16:50:30.516232,Raw_GL_Export.csv
TXN000634,2026-01-03,2025-12-25,2026-01,AUS01,5200,CC3000,SAP,INV61842,PO4757,USD,37732.89,,Payment for subscription,Oracle,2026-01-03,2025-12-25,37732.89,False,payment for subscription,2026-02-23 16:50:30.516232,Raw_GL_Export.csv
TXN000635,01/12/2026,01/05/2026,2026-01,AUS01,5200,CC4000,Accenture Pty,INV12625,PO9627,AUD,1719.77,,Payment for services,API Import,2026-12-01,2026-05-01,1719.77,False,payment for services,2026-02-23 16:50:30.516232,Raw_GL_Export.csv
TXN000636,13-03-2025,12-03-2025,2025-03,AUS01,5120,CC2100,EY Australia,INV42415,,AUD,10427.24,,Payment for services,Manual Entry,2025-03-13,2025-03-12,10427.24,False,payment for services,2026-02-23 16:50:30.516232,Raw_GL_Export.csv
TXN000637,21-01-2026,18-01-2026,2026-01,AUS01,5910,CC2100,Google,INV64444,,AUD,3417.67,,Payment for license,API Import,2026-01-21,2026-01-18,3417.67,False,payment for license,2026-02-23 16:50:30.516232,Raw_GL_Export.csv
TXN000638,2026-02-05,2026-01-26,2026-02,AUS01,5900,CC3100,SAP,INV65725,PO1383,NZD,35336.25,,Payment for subscription,Workday,2026-02-05,2026-01-26,35336.25,False,payment for subscription,2026-02-23 16:50:30.516232,Raw_GL_Export.csv
TXN000639,15/01/2026,13/01/2026,2026-01,AUS01,5220,CC4100,Seek Limited,INV22197,,GBP,13176.62,,Payment for consulting,API Import,2026-01-15,2026-01-13,13176.62,False,payment for consulting,2026-02-23 16:50:30.516232,Raw_GL_Export.csv
TXN000640,09-03-2025,04-03-2025,2025-03,AUS01,5710,CC4000,Robert Half International,INV75147,PO7106,USD,17270.13,,Payment for license,SAP,2025-03-09,2025-03-04,17270.13,False,payment for license,2026-02-23 16:50:30.516232,Raw_GL_Export.csv
TXN000641,15/03/2025,05/03/2025,2025-03,AUS01,5000,CC3100,ServiceNow Inc,INV83813,,GBP,16704.99,,Payment for subscription,Workday,2025-03-15,2025-03-05,16704.99,False,payment for subscription,2026-02-23 16:50:30.516232,Raw_GL_Export.csv
TXN000642,2025-12-05,2025-12-03,2025-12,AUS01,5520,CC1200,Workday,INV20995,,GBP,26744.09,,Payment for license,Manual Entry,2025-12-05,2025-12-03,26744.09,False,payment for license,2026-02-23 16:50:30.516232,Raw_GL_Export.csv
TXN000643,17/12/2025,16/12/2025,2025-12,AUS01,5810,CC3200,Deloitte Touche,INV54285,PO1598,GBP,14084.33,,Payment for subscription,API Import,2025-12-17,2025-12-16,14084.33,False,payment for subscription,2026-02-23 16:50:30.516232,Raw_GL_Export.csv
TXN000644,20-02-2026,19-02-2026,2026-02,AUS01,5220,CC2000,Hays,INV95460,,GBP,14154.43,,Payment for consulting,Manual Entry,2026-02-20,2026-02-19,14154.43,False,payment for consulting,2026-02-23 16:50:30.516232,Raw_GL_Export.csv
TXN000645,2025-07-17,2025-07-15,2025-07,AUS01,5410,CC1100,Federal Express,INV31245,PO2990,USD,34084.21,,Payment for goods,Oracle,2025-07-17,2025-07-15,34084.21,False,payment for goods,2026-02-23 16:50:30.516232,Raw_GL_Export.csv
TXN000646,2026-02-15,2026-02-14,2026-02,AUS01,5410,CC3200,Adobe,INV81707,PO1151,GBP,6379.96,,Payment for subscription,SAP,2026-02-15,2026-02-14,6379.96,False,payment for subscription,2026-02-23 16:50:30.516232,Raw_GL_Export.csv
TXN000647,02/14/2026,02/09/2026,2026-02,AUS01,5510,CC3000,Regus Australia,INV78583,PO7082,USD,6454.14,,Payment for license,API Import,2026-02-14,2026-09-02,6454.14,False,payment for license,2026-02-23 16:50:30.516232,Raw_GL_Export.csv
TXN000648,09-02-2025,01-02-2025,2025-02,AUS01,5200,CC3000,Slack,INV72111,,USD,23644.59,,Payment for consulting,Oracle,2025-02-09,2025-02-01,23644.59,False,payment for consulting,2026-02-23 16:50:30.516232,Raw_GL_Export.csv
TXN000649,05-01-2026,03-01-2026,2026-01,AUS01,5000,CC2100,SAP,INV80481,PO2551,USD,31262.63,,Payment for services,API Import,2026-01-05,2026-01-03,31262.63,False,payment for services,2026-02-23 16:50:30.516232,Raw_GL_Export.csv
TXN000650,15/12/2025,13/12/2025,2025-12,AUS01,5320,CC4000,ServiceNow Inc,INV35249,,NZD,28334.1,,Payment for consulting,API Import,2025-12-15,2025-12-13,28334.1,False,payment for consulting,2026-02-23 16:50:30.516232,Raw_GL_Export.csv
TXN000651,02/24/2026,02/18/2026,2026-02,AUS01,5610,CC3100,Deloitte Touche,INV29978,,USD,3578.68,,Payment for goods,Workday,2026-02-24,2026-02-18,3578.68,False,payment for goods,2026-02-23 16:50:30.516232,Raw_GL_Export.csv
TXN000652,01/06/2025,12/27/2024,2025-01,AUS01,5100,CC1200,Federal Express,INV87616,PO8756,NZD,25946.94,,Payment for goods,Oracle,2025-06-01,2024-12-27,25946.94,False,payment for goods,2026-02-23 16:50:30.516232,Raw_GL_Export.csv
TXN000653,01/12/2025,27/11/2025,2025-12,AUS01,5020,CC4100,Zoom,INV10032,PO1855,USD,7500.35,,Payment for goods,API Import,2025-12-01,2025-11-27,7500.35,False,payment for goods,2026-02-23 16:50:30.516232,Raw_GL_Export.csv
TXN000654,26-01-2026,19-01-2026,2026-01,AUS01,5700,CC3200,McKinsey,INV25374,,NZD,22566.84,,Payment for consulting,Manual Entry,2026-01-26,2026-01-19,22566.84,False,payment for consulting,2026-02-23 16:50:30.516232,Raw_GL_Export.csv
TXN000655,25-03-2025,17-03-2025,2025-03,AUS01,5320,CC2100,McKinsey,INV38036,PO5550,AUD,39759.52,,Payment for goods,Manual Entry,2025-03-25,2025-03-17,39759.52,False,payment for goods,2026-02-23 16:50:30.516232,Raw_GL_Export.csv
TXN000656,18-08-2025,10-08-2025,2025-08,AUS01,5710,CC2100,Atlassian Pty,INV33332,,GBP,29378.94,,Payment for subscription,Manual Entry,2025-08-18,2025-08-10,29378.94,False,payment for subscription,2026-02-23 16:50:30.516232,Raw_GL_Export.csv
TXN000657,02/25/2026,02/18/2026,2026-02,AUS01,5200,CC4100,SAP,INV11398,,GBP,16901.84,,Payment for subscription,API Import,2026-02-25,2026-02-18,16901.84,False,payment for subscription,2026-02-23 16:50:30.516232,Raw_GL_Export.csv
TXN000658,2025-07-07,2025-06-27,2025-07,AUS01,5300,CC3000,GCP,INV75902,PO5473,NZD,41219.74,,Payment for services,Workday,2025-07-07,2025-06-27,41219.74,False,payment for services,2026-02-23 16:50:30.516232,Raw_GL_Export.csv
TXN000659,21-11-2025,14-11-2025,2025-11,AUS01,5010,CC2100,PWC,INV13988,PO8713,AUD,43704.22,,Payment for license,Manual Entry,2025-11-21,2025-11-14,43704.22,False,payment for license,2026-02-23 16:50:30.516232,Raw_GL_Export.csv
TXN000660,16/01/2026,08/01/2026,2026-01,AUS01,5800,CC4000,GCP,INV90336,PO3509,AUD,16692.07,,Payment for goods,Oracle,2026-01-16,2026-01-08,16692.07,False,payment for goods,2026-02-23 16:50:30.516232,Raw_GL_Export.csv
TXN000661,03-02-2026,01-02-2026,2026-02,AUS01,5010,CC3200,MSFT,INV81314,,NZD,4476.65,,Payment for goods,API Import,2026-02-03,2026-02-01,4476.65,False,payment for goods,2026-02-23 16:50:30.516232,Raw_GL_Export.csv
TXN000662,2026-01-24,2026-01-18,2026-01,AUS01,5910,CC3000,Adobe,INV97096,PO2007,NZD,23283.69,,Payment for services,Oracle,2026-01-24,2026-01-18,23283.69,False,payment for services,2026-02-23 16:50:30.516232,Raw_GL_Export.csv
TXN000663,27/02/2026,22/02/2026,2026-02,AUS01,5020,CC1200,Optus Pty,INV36041,PO7705,AUD,12471.09,,Payment for goods,SAP,2026-02-27,2026-02-22,12471.09,False,payment for goods,2026-02-23 16:50:30.516232,Raw_GL_Export.csv
TXN000664,02/10/2026,02/01/2026,2026-02,AUS01,5320,CC1100,BCG,INV21284,PO8585,GBP,25610.98,,Payment for services,SAP,2026-10-02,2026-01-02,25610.98,False,payment for services,2026-02-23 16:50:30.516232,Raw_GL_Export.csv
TXN000665,03/01/2026,01/01/2026,2026-01,AUS01,5120,CC3000,Amazon,INV38511,PO8542,USD,35514.28,,Payment for services,Oracle,2026-01-03,2026-01-01,35514.28,False,payment for services,2026-02-23 16:50:30.516232,Raw_GL_Export.csv
TXN000666,10/09/2025,07/09/2025,2025-09,AUS01,5300,CC1000,Federal Express,INV28405,PO7782,NZD,8092.38,,Payment for goods,Oracle,2025-09-10,2025-09-07,8092.38,False,payment for goods,2026-02-23 16:50:30.516232,Raw_GL_Export.csv
TXN000667,09/01/2026,06/01/2026,2026-01,AUS01,5300,CC2100,Optus Pty,INV56550,PO6715,NZD,4249.3,,Payment for license,Manual Entry,2026-01-09,2026-01-06,4249.3,False,payment for license,2026-02-23 16:50:30.516232,Raw_GL_Export.csv
TXN000668,27/01/2026,26/01/2026,2026-01,AUS01,5910,CC4100,Federal Express,INV37611,PO8108,USD,24253.9,,Payment for subscription,Workday,2026-01-27,2026-01-26,24253.9,False,payment for subscription,2026-02-23 16:50:30.516232,Raw_GL_Export.csv
TXN000669,01/07/2026,12/29/2025,2026-01,AUS01,5520,CC2100,Google,INV71300,,USD,11693.8,,Payment for services,API Import,2026-07-01,2025-12-29,11693.8,False,payment for services,2026-02-23 16:50:30.516232,Raw_GL_Export.csv
TXN000670,22/02/2026,14/02/2026,2026-02,AUS01,5110,CC3200,McKinsey,INV96285,PO1554,NZD,25413.25,,Payment for subscription,SAP,2026-02-22,2026-02-14,25413.25,False,payment for subscription,2026-02-23 16:50:30.516232,Raw_GL_Export.csv
TXN000671,02/21/2026,02/20/2026,2026-02,AUS01,5120,CC3100,Seek Limited,INV23134,,NZD,15216.57,,Payment for subscription,Workday,2026-02-21,2026-02-20,15216.57,False,payment for subscription,2026-02-23 16:50:30.516232,Raw_GL_Export.csv
TXN000672,06-01-2026,28-12-2025,2026-01,AUS01,5120,CC1000,Optus Pty,INV67012,PO8759,GBP,26751.51,,Payment for goods,Workday,2026-01-06,2025-12-28,26751.51,False,payment for goods,2026-02-23 16:50:30.516232,Raw_GL_Export.csv
TXN000673,02/24/2026,02/14/2026,2026-02,AUS01,5310,CC3200,DHL Express,INV40710,PO9306,NZD,1901.79,,Payment for services,Manual Entry,2026-02-24,2026-02-14,1901.79,False,payment for services,2026-02-23 16:50:30.516232,Raw_GL_Export.csv
TXN000674,10/14/2025,10/04/2025,2025-10,AUS01,5400,CC4100,Amazon,INV49397,PO9586,USD,23097.98,,Payment for goods,API Import,2025-10-14,2025-04-10,23097.98,False,payment for goods,2026-02-23 16:50:30.516232,Raw_GL_Export.csv
TXN000675,25/09/2025,22/09/2025,2025-09,AUS01,5700,CC3000,MSFT,INV28541,PO8515,AUD,13986.38,,Payment for consulting,Oracle,2025-09-25,2025-09-22,13986.38,False,payment for consulting,2026-02-23 16:50:30.516232,Raw_GL_Export.csv
TXN000676,2026-01-15,2026-01-12,2026-01,AUS01,5200,CC1200,EY Australia,INV40957,PO8152,NZD,3708.85,,Payment for services,Oracle,2026-01-15,2026-01-12,3708.85,False,payment for services,2026-02-23 16:50:30.516232,Raw_GL_Export.csv
TXN000677,01/05/2026,01/04/2026,2026-01,AUS01,5500,CC1200,WeWork Australia,INV61648,PO8738,AUD,21238.95,,Payment for consulting,Manual Entry,2026-05-01,2026-04-01,21238.95,False,payment for consulting,2026-02-23 16:50:30.516232,Raw_GL_Export.csv
TXN000678,23/01/2026,21/01/2026,2026-01,AUS01,5400,CC1200,McKinsey,INV52875,PO7956,USD,18054.77,,Payment for license,Manual Entry,2026-01-23,2026-01-21,18054.77,False,payment for license,2026-02-23 16:50:30.516232,Raw_GL_Export.csv
TXN000679,2025-04-18,2025-04-12,2025-04,AUS01,5500,CC4100,Amazon,INV33351,PO7047,USD,39862.91,,Payment for subscription,Workday,2025-04-18,2025-04-12,39862.91,False,payment for subscription,2026-02-23 16:50:30.516232,Raw_GL_Export.csv
TXN000680,2026-01-17,2026-01-07,2026-01,AUS01,5610,CC3100,Salesforce,INV34637,,USD,6299.79,,Payment for subscription,Manual Entry,2026-01-17,2026-01-07,6299.79,False,payment for subscription,2026-02-23 16:50:30.516232,Raw_GL_Export.csv
TXN000681,02/03/2026,01/27/2026,2026-02,AUS01,5620,CC1200,Telstra Corp,INV98509,PO1570,USD,78497.13,EXPORT,Payment for subscription,Manual Entry,2026-03-02,2026-01-27,78497.13,False,payment for subscription,2026-02-23 16:50:30.516232,Raw_GL_Export.csv
TXN000682,06/01/2026,30/12/2025,2026-01,AUS01,5700,CC4000,GCP,INV99923,PO7626,GBP,130623.09,INPUT,Payment for services,Oracle,2026-01-06,2025-12-30,130623.09,False,payment for services,2026-02-23 16:50:30.516232,Raw_GL_Export.csv
TXN000683,11/02/2026,01/02/2026,2026-02,AUS01,5510,CC3100,LinkedIn Corp,INV65372,PO5963,AUD,98614.45,EXPORT,Payment for consulting,Workday,2026-02-11,2026-02-01,98614.45,False,payment for consulting,2026-02-23 16:50:30.516232,Raw_GL_Export.csv
TXN000684,2025-06-24,2025-06-14,2025-06,AUS01,5900,CC3200,Robert Half International,INV80126,PO2829,NZD,128100.57,INPUT,Payment for goods,Manual Entry,2025-06-24,2025-06-14,128100.57,False,payment for goods,2026-02-23 16:50:30.516232,Raw_GL_Export.csv
TXN000685,18-10-2025,16-10-2025,2025-10,AUS01,5110,CC1000,BCG,INV67001,,NZD,69762.11,EXPORT,Payment for subscription,SAP,2025-10-18,2025-10-16,69762.11,False,payment for subscription,2026-02-23 16:50:30.516232,Raw_GL_Export.csv
TXN000686,04-02-2026,27-01-2026,2026-02,AUS01,5320,CC1000,Regus Australia,INV13084,PO3928,NZD,92570.83,INPUT,Payment for subscription,Workday,2026-02-04,2026-01-27,92570.83,False,payment for subscription,2026-02-23 16:50:30.516232,Raw_GL_Export.csv
TXN000687,2026-02-14,2026-02-06,2026-02,AUS01,5310,CC2100,Microsoft,INV79634,PO5073,AUD,85725.09,GST,Payment for goods,SAP,2026-02-14,2026-02-06,85725.09,False,payment for goods,2026-02-23 16:50:30.516232,Raw_GL_Export.csv
TXN000688,2025-04-18,2025-04-15,2025-04,AUS01,5800,CC1200,Hays,INV70035,PO4999,GBP,139271.78,INPUT,Payment for license,API Import,2025-04-18,2025-04-15,139271.78,False,payment for license,2026-02-23 16:50:30.516232,Raw_GL_Export.csv
TXN000689,2025-03-15,2025-03-13,2025-03,AUS01,5310,CC3000,Microsoft,INV60058,PO2290,USD,110935.74,GST,Payment for subscription,Workday,2025-03-15,2025-03-13,110935.74,False,payment for subscription,2026-02-23 16:50:30.516232,Raw_GL_Export.csv
TXN000690,14-01-2026,13-01-2026,2026-01,AUS01,5120,CC2100,Google,INV84828,,GBP,146516.04,GST-FREE,Payment for subscription,API Import,2026-01-14,2026-01-13,146516.04,False,payment for subscription,2026-02-23 16:50:30.516232,Raw_GL_Export.csv
TXN000691,17/01/2025,16/01/2025,2025-01,AUS01,5320,CC4100,Seek Limited,INV46016,PO4042,USD,126072.14,EXPORT,Payment for subscription,API Import,2025-01-17,2025-01-16,126072.14,False,payment for subscription,2026-02-23 16:50:30.516232,Raw_GL_Export.csv
TXN000692,2026-02-22,2026-02-12,2026-02,AUS01,5400,CC1200,KPMG Australia,INV12453,PO3126,NZD,50506.1,GST-FREE,Payment for subscription,Workday,2026-02-22,2026-02-12,50506.1,False,payment for subscription,2026-02-23 16:50:30.516232,Raw_GL_Export.csv
TXN000693,01/15/2026,01/13/2026,2026-01,AUS01,5210,CC2000,Amazon,INV89864,PO7893,NZD,72106.55,INPUT,Payment for license,Workday,2026-01-15,2026-01-13,72106.55,False,payment for license,2026-02-23 16:50:30.516232,Raw_GL_Export.csv
TXN000694,18-01-2025,10-01-2025,2025-01,AUS01,5520,CC1000,BCG,INV29893,PO9175,NZD,81964.96,EXPORT,Payment for goods,API Import,2025-01-18,2025-01-10,81964.96,False,payment for goods,2026-02-23 16:50:30.516232,Raw_GL_Export.csv
TXN000695,23/12/2025,16/12/2025,2025-12,AUS01,5220,CC3100,Microsoft,INV20891,,AUD,113138.77,INPUT,Payment for license,Workday,2025-12-23,2025-12-16,113138.77,False,payment for license,2026-02-23 16:50:30.516232,Raw_GL_Export.csv
TXN000696,02/10/2026,02/04/2026,2026-02,AUS01,5420,CC3200,Amazon,INV91823,PO8070,USD,112486.64,GST-FREE,Payment for consulting,SAP,2026-10-02,2026-04-02,112486.64,False,payment for consulting,2026-02-23 16:50:30.516232,Raw_GL_Export.csv
TXN000697,12/25/2025,12/16/2025,2025-12,AUS01,5800,CC3200,Accenture Pty,INV59601,PO3023,GBP,142117.71,GST-FREE,Payment for services,Manual Entry,2025-12-25,2025-12-16,142117.71,False,payment for services,2026-02-23 16:50:30.516232,Raw_GL_Export.csv
TXN000698,07/02/2026,05/02/2026,2026-02,AUS01,5600,CC2100,Oracle,INV82098,PO4567,USD,126687.7,EXPORT,Payment for consulting,API Import,2026-02-07,2026-02-05,126687.7,False,payment for consulting,2026-02-23 16:50:30.516232,Raw_GL_Export.csv
TXN000699,09/09/2025,09/03/2025,2025-09,AUS01,5620,CC1100,McKinsey,INV74858,PO5690,GBP,72510.7,EXPORT,Payment for consulting,Oracle,2025-09-09,2025-03-09,72510.7,False,payment for consulting,2026-02-23 16:50:30.516232,Raw_GL_Export.csv
TXN000700,28/02/2026,21/02/2026,2026-02,AUS01,5300,CC1000,BCG,INV60246,PO7850,GBP,115619.41,GST,Payment for consulting,Manual Entry,2026-02-28,2026-02-21,115619.41,False,payment for consulting,2026-02-23 16:50:30.516232,Raw_GL_Export.csv
TXN000701,2025-04-07,2025-03-28,2025-04,AUS01,5210,CC1200,Robert Half International,INV12992,PO5095,AUD,109957.22,EXPORT,Payment for goods,API Import,2025-04-07,2025-03-28,109957.22,False,payment for goods,2026-02-23 16:50:30.516232,Raw_GL_Export.csv
TXN000702,21-02-2026,19-02-2026,2026-02,AUS01,5320,CC1000,Federal Express,INV70000,PO4920,USD,135031.05,GST-FREE,Payment for goods,Manual Entry,2026-02-21,2026-02-19,135031.05,False,payment for goods,2026-02-23 16:50:30.516232,Raw_GL_Export.csv
TXN000703,23/09/2025,17/09/2025,2025-09,AUS01,5110,CC2100,Salesforce,INV70187,,AUD,70701.52,EXPORT,Payment for license,Manual Entry,2025-09-23,2025-09-17,70701.52,False,payment for license,2026-02-23 16:50:30.516232,Raw_GL_Export.csv
TXN000704,08/02/2026,31/01/2026,2026-02,AUS01,5510,CC1100,BCG,INV10902,PO7657,USD,74487.1,GST,Payment for license,Manual Entry,2026-02-08,2026-01-31,74487.1,False,payment for license,2026-02-23 16:50:30.516232,Raw_GL_Export.csv
TXN000705,28-02-2026,26-02-2026,2026-02,AUS01,5900,CC3100,Deloitte Touche,INV67477,PO1979,AUD,121579.77,GST,Payment for subscription,Manual Entry,2026-02-28,2026-02-26,121579.77,False,payment for subscription,2026-02-23 16:50:30.516232,Raw_GL_Export.csv
TXN000706,2025-04-27,2025-04-21,2025-04,AUS01,5400,CC4000,Optus Pty,INV29134,PO2831,GBP,128742.57,GST,Payment for goods,Workday,2025-04-27,2025-04-21,128742.57,False,payment for goods,2026-02-23 16:50:30.516232,Raw_GL_Export.csv
TXN000707,02/14/2026,02/11/2026,2026-02,AUS01,5210,CC3200,Workday,INV70062,PO9053,NZD,59713.47,GST,Payment for goods,Workday,2026-02-14,2026-11-02,59713.47,False,payment for goods,2026-02-23 16:50:30.516232,Raw_GL_Export.csv
TXN000708,02/11/2026,02/03/2026,2026-02,AUS01,5310,CC3200,Deloitte Touche,INV29401,PO1425,NZD,109443.22,GST-FREE,Payment for goods,Workday,2026-11-02,2026-03-02,109443.22,False,payment for goods,2026-02-23 16:50:30.516232,Raw_GL_Export.csv
TXN000709,01/19/2026,01/14/2026,2026-01,AUS01,5300,CC1200,EY Australia,INV30242,PO3106,GBP,121308.17,INPUT,Payment for goods,API Import,2026-01-19,2026-01-14,121308.17,False,payment for goods,2026-02-23 16:50:30.516232,Raw_GL_Export.csv
TXN000710,10-02-2026,05-02-2026,2026-02,AUS01,5620,CC2000,Amazon,INV86576,,USD,108323.45,GST-FREE,Payment for subscription,API Import,2026-02-10,2026-02-05,108323.45,False,payment for subscription,2026-02-23 16:50:30.516232,Raw_GL_Export.csv
TXN000711,24-02-2026,16-02-2026,2026-02,AUS01,5610,CC1200,WeWork Australia,INV78594,PO8950,USD,108713.96,INPUT,Payment for goods,API Import,2026-02-24,2026-02-16,108713.96,False,payment for goods,2026-02-23 16:50:30.516232,Raw_GL_Export.csv
TXN000712,16/01/2026,08/01/2026,2026-01,AUS01,5400,CC1000,Salesforce,INV39400,,NZD,72483.29,GST-FREE,Payment for license,SAP,2026-01-16,2026-01-08,72483.29,False,payment for license,2026-02-23 16:50:30.516232,Raw_GL_Export.csv
TXN000713,21/02/2026,15/02/2026,2026-02,AUS01,5500,CC3200,AWS,INV97063,,USD,124138.04,INPUT,Payment for services,Workday,2026-02-21,2026-02-15,124138.04,False,payment for services,2026-02-23 16:50:30.516232,Raw_GL_Export.csv
TXN000714,2025-12-17,2025-12-12,2025-12,AUS01,5520,CC4000,Google,INV42072,,AUD,94663.84,GST-FREE,Payment for goods,Oracle,2025-12-17,2025-12-12,94663.84,False,payment for goods,2026-02-23 16:50:30.516232,Raw_GL_Export.csv
TXN000715,08-01-2026,05-01-2026,2026-01,AUS01,5010,CC4100,PWC,INV18345,PO3171,NZD,59136.83,GST-FREE,Payment for license,Workday,2026-01-08,2026-01-05,59136.83,False,payment for license,2026-02-23 16:50:30.516232,Raw_GL_Export.csv
TXN000716,02/01/2026,29/12/2025,2026-01,AUS01,5210,CC4100,Seek Limited,INV51793,PO2196,GBP,59827.93,GST,Payment for goods,Manual Entry,2026-01-02,2025-12-29,59827.93,False,payment for goods,2026-02-23 16:50:30.516232,Raw_GL_Export.csv
TXN000717,04-02-2026,02-02-2026,2026-02,AUS01,5500,CC2000,GCP,INV84623,,USD,109829.78,INPUT,Payment for consulting,SAP,2026-02-04,2026-02-02,109829.78,False,payment for consulting,2026-02-23 16:50:30.516232,Raw_GL_Export.csv
TXN000718,24-02-2026,20-02-2026,2026-02,AUS01,5600,CC4100,LinkedIn Corp,INV88820,,AUD,75175.53,EXPORT,Payment for goods,Workday,2026-02-24,2026-02-20,75175.53,False,payment for goods,2026-02-23 16:50:30.516232,Raw_GL_Export.csv
TXN000719,17-04-2025,08-04-2025,2025-04,AUS01,5300,CC2100,Deloitte Touche,INV92040,PO3984,USD,84114.89,INPUT,Payment for consulting,SAP,2025-04-17,2025-04-08,84114.89,False,payment for consulting,2026-02-23 16:50:30.516232,Raw_GL_Export.csv
TXN000720,11-01-2026,03-01-2026,2026-01,AUS01,5120,CC1200,Salesforce,INV68090,PO9824,GBP,117297.95,GST,Payment for goods,Oracle,2026-01-11,2026-01-03,117297.95,False,payment for goods,2026-02-23 16:50:30.516232,Raw_GL_Export.csv
TXN000721,2026-02-25,2026-02-21,2026-02,AUS01,5200,CC2100,Robert Half International,INV23489,PO4445,NZD,82002.27,EXPORT,Payment for license,Oracle,2026-02-25,2026-02-21,82002.27,False,payment for license,2026-02-23 16:50:30.516232,Raw_GL_Export.csv
TXN000722,11/11/2025,07/11/2025,2025-11,AUS01,5810,CC3100,Adobe,INV52687,PO8762,USD,111012.71,GST-FREE,Payment for license,Manual Entry,2025-11-11,2025-11-07,111012.71,False,payment for license,2026-02-23 16:50:30.516232,Raw_GL_Export.csv
TXN000723,10/25/2025,10/21/2025,2025-10,AUS01,5220,CC3200,EY Australia,INV56390,PO6166,NZD,64499.51,INPUT,Payment for consulting,Workday,2025-10-25,2025-10-21,64499.51,False,payment for consulting,2026-02-23 16:50:30.516232,Raw_GL_Export.csv
TXN000724,14-09-2025,07-09-2025,2025-09,AUS01,5000,CC3100,MSFT,INV69885,PO1319,GBP,85361.84,GST-FREE,Payment for goods,Oracle,2025-09-14,2025-09-07,85361.84,False,payment for goods,2026-02-23 16:50:30.516232,Raw_GL_Export.csv
TXN000725,02/22/2026,02/17/2026,2026-02,AUS01,5910,CC3000,Amazon,INV52688,PO4267,NZD,92750.41,EXPORT,Payment for goods,API Import,2026-02-22,2026-02-17,92750.41,False,payment for goods,2026-02-23 16:50:30.516232,Raw_GL_Export.csv
TXN000726,17-02-2026,12-02-2026,2026-02,AUS01,5100,CC1100,Accenture Pty,INV87717,PO1753,USD,82548.98,EXPORT,Payment for consulting,Manual Entry,2026-02-17,2026-02-12,82548.98,False,payment for consulting,2026-02-23 16:50:30.516232,Raw_GL_Export.csv
TXN000727,01/08/2026,12/29/2025,2026-01,AUS01,5600,CC3100,MSFT,INV46181,PO8178,AUD,55612.4,INPUT,Payment for subscription,SAP,2026-08-01,2025-12-29,55612.4,False,payment for subscription,2026-02-23 16:50:30.516232,Raw_GL_Export.csv
TXN000728,16/01/2026,14/01/2026,2026-01,AUS01,5310,CC3100,Zoom,INV83641,,USD,108981.24,GST-FREE,Payment for goods,Workday,2026-01-16,2026-01-14,108981.24,False,payment for goods,2026-02-23 16:50:30.516232,Raw_GL_Export.csv
TXN000729,99/99/9999,99/99/9999,2025-11,AUS01,5710,CC1000,Slack,INV57347,PO8304,AUD,39195.57,INPUT,Payment for goods,Oracle,,,39195.57,False,payment for goods,2026-02-23 16:50:30.516232,Raw_GL_Export.csv
TXN000730,99/99/9999,INVALID,2025-10,AUS01,5210,CC3200,Regus Australia,INV43470,PO1379,NZD,9034.43,INPUT,Payment for goods,SAP,,,9034.43,False,payment for goods,2026-02-23 16:50:30.516232,Raw_GL_Export.csv
TXN000731,INVALID,INVALID,2026-01,AUS01,5400,CC3200,MSFT,INV12123,PO1525,AUD,41092.9,INPUT,Payment for license,Workday,,,41092.9,False,payment for license,2026-02-23 16:50:30.516232,Raw_GL_Export.csv
TXN000732,INVALID,99/99/9999,2026-01,AUS01,5600,CC3000,Salesforce,INV79699,,AUD,25482.28,GST,Payment for license,SAP,,,25482.28,False,payment for license,2026-02-23 16:50:30.516232,Raw_GL_Export.csv
TXN000733,INVALID,2026-13-45,2025-08,AUS01,5810,CC1100,Telstra Corp,INV95254,PO3976,NZD,21010.61,GST-FREE,Payment for license,Workday,,,21010.61,False,payment for license,2026-02-23 16:50:30.516232,Raw_GL_Export.csv
TXN000734,INVALID,INVALID,2026-02,AUS01,5000,CC3100,KPMG Australia,INV12473,,AUD,28103.67,EXPORT,Payment for subscription,Manual Entry,,,28103.67,False,payment for subscription,2026-02-23 16:50:30.516232,Raw_GL_Export.csv
TXN000735,2026-13-45,99/99/9999,2025-09,AUS01,5920,CC2000,McKinsey,INV85292,PO3500,GBP,29447.21,GST-FREE,Payment for goods,Oracle,,,29447.21,False,payment for goods,2026-02-23 16:50:30.516232,Raw_GL_Export.csv
TXN000736,2026-13-45,99/99/9999,2026-01,AUS01,5120,CC1100,Amazon,INV19078,PO6166,AUD,35097.9,INPUT,Payment for goods,Oracle,,,35097.9,False,payment for goods,2026-02-23 16:50:30.516232,Raw_GL_Export.csv
TXN000737,2026-13-45,99/99/9999,2025-09,AUS01,5120,CC3100,PWC,INV56575,,USD,42139.97,GST-FREE,Payment for consulting,SAP,,,42139.97,False,payment for consulting,2026-02-23 16:50:30.516232,Raw_GL_Export.csv
TXN000738,INVALID,32/13/2026,2026-01,AUS01,5420,CC2000,Federal Express,INV36035,,AUD,20161.88,EXPORT,Payment for consulting,API Import,,,20161.88,False,payment for consulting,2026-02-23 16:50:30.516232,Raw_GL_Export.csv
TXN000739,32/13/2026,32/13/2026,2026-02,AUS01,5120,CC4000,Atlassian Pty,INV74108,PO6871,USD,34071.63,GST,Payment for subscription,Manual Entry,,,34071.63,False,payment for subscription,2026-02-23 16:50:30.516232,Raw_GL_Export.csv
TXN000740,2026-13-45,2026-13-45,2025-03,AUS01,5020,CC4000,Regus Australia,INV69893,,GBP,11562.28,GST,Payment for consulting,Manual Entry,,,11562.28,False,payment for consulting,2026-02-23 16:50:30.516232,Raw_GL_Export.csv
TXN000741,INVALID,32/13/2026,2025-12,AUS01,5320,CC3000,EY Australia,INV40062,PO2383,AUD,19593.28,INPUT,Payment for consulting,Manual Entry,,,19593.28,False,payment for consulting,2026-02-23 16:50:30.516232,Raw_GL_Export.csv
TXN000742,32/13/2026,99/99/9999,2026-02,AUS01,5800,CC3000,Microsoft,INV84000,,USD,38148.92,GST-FREE,Payment for license,Oracle,,,38148.92,False,payment for license,2026-02-23 16:50:30.516232,Raw_GL_Export.csv
TXN000743,2026-13-45,INVALID,2026-02,AUS01,5810,CC1000,MSFT,INV58719,PO3580,USD,38998.89,INPUT,Payment for consulting,Oracle,,,38998.89,False,payment for consulting,2026-02-23 16:50:30.516232,Raw_GL_Export.csv
TXN000744,2026-13-45,2026-13-45,2026-02,AUS01,5800,CC1200,Regus Australia,INV75215,,AUD,35416.4,GST,Payment for consulting,Workday,,,35416.4,False,payment for consulting,2026-02-23 16:50:30.516232,Raw_GL_Export.csv
TXN000745,99/99/9999,99/99/9999,2025-04,AUS01,5000,CC1000,BCG,INV28919,PO1761,AUD,40008.04,GST,Payment for license,Manual Entry,,,40008.04,False,payment for license,2026-02-23 16:50:30.516232,Raw_GL_Export.csv
TXN000746,2026-13-45,2026-13-45,2025-07,AUS01,5100,CC1000,WeWork Australia,INV24733,PO8609,USD,4236.36,GST,Payment for consulting,API Import,,,4236.36,False,payment for consulting,2026-02-23 16:50:30.516232,Raw_GL_Export.csv
TXN000747,INVALID,2026-13-45,2026-01,AUS01,5920,CC4100,AWS,INV26803,PO9847,NZD,21483.33,INPUT,Payment for subscription,API Import,,,21483.33,False,payment for subscription,2026-02-23 16:50:30.516232,Raw_GL_Export.csv
TXN000748,32/13/2026,INVALID,2026-01,AUS01,5500,CC4100,SAP,INV28690,,USD,9947.07,GST-FREE,Payment for services,SAP,,,9947.07,False,payment for services,2026-02-23 16:50:30.516232,Raw_GL_Export.csv
TXN000749,INVALID,99/99/9999,2026-02,AUS01,5610,CC1100,Accenture Pty,INV53073,PO8571,USD,11355.11,INPUT,Payment for license,API Import,,,11355.11,False,payment for license,2026-02-23 16:50:30.516232,Raw_GL_Export.csv
TXN000750,99/99/9999,2026-13-45,2026-02,AUS01,5310,CC3100,Regus Australia,INV60466,PO4242,USD,26113.65,GST,Payment for goods,SAP,,,26113.65,False,payment for goods,2026-02-23 16:50:30.516232,Raw_GL_Export.csv
TXN000751,2026-13-45,32/13/2026,2025-07,AUS01,5910,CC2000,Adobe,INV73418,PO4076,GBP,14581.7,EXPORT,Payment for license,Manual Entry,,,14581.7,False,payment for license,2026-02-23 16:50:30.516232,Raw_GL_Export.csv
TXN000752,INVALID,2026-13-45,2026-02,AUS01,5420,CC4100,Deloitte Touche,INV95912,PO6527,GBP,5390.08,INPUT,Payment for subscription,Oracle,,,5390.08,False,payment for subscription,2026-02-23 16:50:30.516232,Raw_GL_Export.csv
TXN000753,99/99/9999,99/99/9999,2026-02,AUS01,5900,CC3200,LinkedIn Corp,INV78035,,AUD,30093.77,INPUT,Payment for subscription,Manual Entry,,,30093.77,False,payment for subscription,2026-02-23 16:50:30.516232,Raw_GL_Export.csv
TXN000754,32/13/2026,2026-13-45,2025-12,AUS01,5100,CC2000,LinkedIn Corp,INV26554,PO6030,AUD,5500.47,INPUT,Payment for consulting,Manual Entry,,,5500.47,False,payment for consulting,2026-02-23 16:50:30.516232,Raw_GL_Export.csv
TXN000755,32/13/2026,2026-13-45,2026-02,AUS01,5400,CC4000,SAP,INV12191,,USD,37816.58,GST-FREE,Payment for subscription,API Import,,,37816.58,False,payment for subscription,2026-02-23 16:50:30.516232,Raw_GL_Export.csv
TXN000756,2026-13-45,32/13/2026,2025-12,AUS01,5900,CC4000,Regus Australia,INV59082,,USD,31246.89,GST-FREE,Payment for goods,API Import,,,31246.89,False,payment for goods,2026-02-23 16:50:30.516232,Raw_GL_Export.csv
TXN000757,2026-13-45,2026-13-45,2025-09,AUS01,5520,CC4100,Telstra Corp,INV48862,PO9548,USD,12601.12,EXPORT,Payment for consulting,Manual Entry,,,12601.12,False,payment for consulting,2026-02-23 16:50:30.516232,Raw_GL_Export.csv
TXN000758,INVALID,99/99/9999,2026-02,AUS01,5110,CC2100,AWS,INV37361,PO2094,AUD,11384.68,INPUT,Payment for services,Manual Entry,,,11384.68,False,payment for services,2026-02-23 16:50:30.516232,Raw_GL_Export.csv
TXN000759,2026-13-45,2026-13-45,2026-02,AUS01,5500,CC1200,Accenture Pty,INV61249,PO5072,GBP,35405.45,EXPORT,Payment for subscription,SAP,,,35405.45,False,payment for subscription,2026-02-23 16:50:30.516232,Raw_GL_Export.csv
TXN000760,2026-13-45,99/99/9999,2025-06,AUS01,5110,CC3100,Atlassian Pty,INV98111,,USD,9341.82,GST-FREE,Payment for subscription,SAP,,,9341.82,False,payment for subscription,2026-02-23 16:50:30.516232,Raw_GL_Export.csv
TXN000761,32/13/2026,99/99/9999,2026-02,AUS01,5510,CC1100,Seek Limited,INV26366,PO8444,USD,29752.92,INPUT,Payment for goods,SAP,,,29752.92,False,payment for goods,2026-02-23 16:50:30.516232,Raw_GL_Export.csv
TXN000762,99/99/9999,99/99/9999,2025-12,AUS01,5010,CC3100,Deloitte Touche,INV86674,,AUD,28247.74,EXPORT,Payment for consulting,Workday,,,28247.74,False,payment for consulting,2026-02-23 16:50:30.516232,Raw_GL_Export.csv
TXN000763,2026-13-45,32/13/2026,2026-02,AUS01,5020,CC4100,Regus Australia,INV66685,PO2723,USD,39134.32,EXPORT,Payment for subscription,Workday,,,39134.32,False,payment for subscription,2026-02-23 16:50:30.516232,Raw_GL_Export.csv
TXN000764,99/99/9999,99/99/9999,2026-02,AUS01,5410,CC2100,WeWork Australia,INV41816,PO4627,AUD,680.38,EXPORT,Payment for license,Manual Entry,,,680.38,False,payment for license,2026-02-23 16:50:30.516232,Raw_GL_Export.csv
TXN000765,99/99/9999,32/13/2026,2026-02,AUS01,5810,CC3200,Federal Express,INV87377,PO2615,GBP,1990.35,GST,Payment for license,SAP,,,1990.35,False,payment for license,2026-02-23 16:50:30.516232,Raw_GL_Export.csv
TXN000766,32/13/2026,2026-13-45,2026-02,AUS01,5320,CC4100,AusPost,INV55521,PO8212,GBP,32351.18,GST,Payment for consulting,API Import,,,32351.18,False,payment for consulting,2026-02-23 16:50:30.516232,Raw_GL_Export.csv
TXN000767,32/13/2026,INVALID,2025-07,AUS01,5910,CC3100,Amazon,INV92643,PO2618,USD,25555.16,GST,Payment for subscription,Manual Entry,,,25555.16,False,payment for subscription,2026-02-23 16:50:30.516232,Raw_GL_Export.csv
TXN000768,32/13/2026,INVALID,2026-01,AUS01,5920,CC2100,WeWork Australia,INV46258,PO1783,NZD,15921.79,GST-FREE,Payment for subscription,Manual Entry,,,15921.79,False,payment for subscription,2026-02-23 16:50:30.516232,Raw_GL_Export.csv
TXN000769,99/99/9999,2026-13-45,2026-02,AUS01,5200,CC4000,McKinsey,INV75514,PO6468,GBP,33924.03,GST-FREE,Payment for subscription,API Import,,,33924.03,False,payment for subscription,2026-02-23 16:50:30.516232,Raw_GL_Export.csv
TXN000770,2026-13-45,99/99/9999,2026-01,AUS01,5910,CC2100,GCP,INV91500,PO4050,AUD,28811.38,INPUT,Payment for consulting,Oracle,,,28811.38,False,payment for consulting,2026-02-23 16:50:30.516232,Raw_GL_Export.csv
TXN000771,99/99/9999,INVALID,2026-02,AUS01,5320,CC3000,Optus Pty,INV52304,,NZD,33989.21,GST-FREE,Payment for goods,API Import,,,33989.21,False,payment for goods,2026-02-23 16:50:30.516232,Raw_GL_Export.csv
TXN000772,99/99/9999,99/99/9999,2026-02,AUS01,5810,CC4000,Oracle,INV36033,,GBP,27869.35,GST,Payment for license,Manual Entry,,,27869.35,False,payment for license,2026-02-23 16:50:30.516232,Raw_GL_Export.csv
TXN000773,99/99/9999,2026-13-45,2025-07,AUS01,5710,CC3000,WeWork Australia,INV23582,PO5815,GBP,6073.15,EXPORT,Payment for license,API Import,,,6073.15,False,payment for license,2026-02-23 16:50:30.516232,Raw_GL_Export.csv
TXN000774,32/13/2026,99/99/9999,2025-08,AUS01,5210,CC3200,Microsoft,INV13454,PO4587,USD,24704.63,INPUT,Payment for goods,Oracle,,,24704.63,False,payment for goods,2026-02-23 16:50:30.516232,Raw_GL_Export.csv
TXN000775,INVALID,2026-13-45,2025-04,AUS01,5110,CC1000,KPMG Australia,INV67534,PO4149,USD,43410.11,EXPORT,Payment for consulting,Oracle,,,43410.11,False,payment for consulting,2026-02-23 16:50:30.516232,Raw_GL_Export.csv
TXN000776,INVALID,INVALID,2026-01,AUS01,5800,CC2100,Regus Australia,INV40763,PO6850,NZD,19466.03,INPUT,Payment for services,Oracle,,,19466.03,False,payment for services,2026-02-23 16:50:30.516232,Raw_GL_Export.csv
TXN000777,11/02/2026,02/02/2026,2026-02,AUS01,5600,CC1200,GCP,INV80170,PO4732,EUR,44147.4,EXPORT,Payment for subscription,API Import,2026-02-11,2026-02-02,44147.4,False,payment for subscription,2026-02-23 16:50:30.516232,Raw_GL_Export.csv
TXN000778,27/02/2026,19/02/2026,2026-02,AUS01,5220,CC4100,MSFT,INV75160,PO2059,EUR,20764.73,EXPORT,Payment for goods,SAP,2026-02-27,2026-02-19,20764.73,False,payment for goods,2026-02-23 16:50:30.516232,Raw_GL_Export.csv
TXN000779,18-02-2026,09-02-2026,2026-02,AUS01,5620,CC1000,WeWork Australia,INV18359,PO2071,EUR,21500.53,GST-FREE,Payment for subscription,API Import,2026-02-18,2026-02-09,21500.53,False,payment for subscription,2026-02-23 16:50:30.516232,Raw_GL_Export.csv
TXN000780,2025-05-09,2025-04-29,2025-05,AUS01,5500,CC3100,Slack,INV96743,PO9821,EUR,44380.68,GST-FREE,Payment for subscription,Workday,2025-05-09,2025-04-29,44380.68,False,payment for subscription,2026-02-23 16:50:30.516232,Raw_GL_Export.csv
TXN000781,08-04-2025,05-04-2025,2025-04,AUS01,5810,CC4000,McKinsey,INV56969,PO2163,EUR,38836.76,GST,Payment for license,SAP,2025-04-08,2025-04-05,38836.76,False,payment for license,2026-02-23 16:50:30.516232,Raw_GL_Export.csv
TXN000782,17-02-2026,14-02-2026,2026-02,AUS01,5800,CC2000,Accenture Pty,INV33755,,EUR,44092.21,GST-FREE,Payment for consulting,SAP,2026-02-17,2026-02-14,44092.21,False,payment for consulting,2026-02-23 16:50:30.516232,Raw_GL_Export.csv
TXN000783,2025-08-11,2025-08-09,2025-08,AUS01,5400,CC4100,Federal Express,INV72181,,EUR,36240.64,EXPORT,Payment for subscription,Oracle,2025-08-11,2025-08-09,36240.64,False,payment for subscription,2026-02-23 16:50:30.516232,Raw_GL_Export.csv
TXN000784,01/04/2026,12/29/2025,2026-01,AUS01,5120,CC3100,Deloitte Touche,INV44144,PO4713,EUR,22535.71,GST-FREE,Payment for subscription,SAP,2026-04-01,2025-12-29,22535.71,False,payment for subscription,2026-02-23 16:50:30.516232,Raw_GL_Export.csv
TXN000785,11-01-2026,09-01-2026,2026-01,AUS01,5510,CC2100,Amazon,INV83023,,EUR,39580.63,GST,Payment for subscription,SAP,2026-01-11,2026-01-09,39580.63,False,payment for subscription,2026-02-23 16:50:30.516232,Raw_GL_Export.csv
TXN000786,2026-01-06,2025-12-28,2026-01,AUS01,5000,CC1000,McKinsey,INV84459,PO2136,EUR,17375.43,GST,Payment for goods,Oracle,2026-01-06,2025-12-28,17375.43,False,payment for goods,2026-02-23 16:50:30.516232,Raw_GL_Export.csv
TXN000787,21-02-2026,18-02-2026,2026-02,AUS01,5520,CC2000,WeWork Australia,INV88606,PO3898,EUR,4453.76,GST-FREE,Payment for consulting,Oracle,2026-02-21,2026-02-18,4453.76,False,payment for consulting,2026-02-23 16:50:30.516232,Raw_GL_Export.csv
TXN000788,17/07/2025,09/07/2025,2025-07,AUS01,5000,CC4100,Microsoft,INV50850,PO2765,EUR,42094.66,GST,Payment for subscription,Oracle,2025-07-17,2025-07-09,42094.66,False,payment for subscription,2026-02-23 16:50:30.516232,Raw_GL_Export.csv
TXN000789,19/02/2026,17/02/2026,2026-02,AUS01,5500,CC2000,Zoom,INV69594,PO9978,EUR,44880.65,INPUT,Payment for consulting,Manual Entry,2026-02-19,2026-02-17,44880.65,False,payment for consulting,2026-02-23 16:50:30.516232,Raw_GL_Export.csv
TXN000790,2026-02-04,2026-01-29,2026-02,AUS01,5210,CC3000,Zoom,INV34686,PO1681,EUR,10851.37,EXPORT,Payment for subscription,SAP,2026-02-04,2026-01-29,10851.37,False,payment for subscription,2026-02-23 16:50:30.516232,Raw_GL_Export.csv
TXN000791,2025-12-16,2025-12-07,2025-12,AUS01,5020,CC3000,DHL Express,INV47035,PO8338,EUR,34085.86,GST-FREE,Payment for goods,Workday,2025-12-16,2025-12-07,34085.86,False,payment for goods,2026-02-23 16:50:30.516232,Raw_GL_Export.csv
TXN000792,21-07-2025,14-07-2025,2025-07,AUS01,5410,CC3100,Google,INV23673,PO8931,EUR,22121.89,EXPORT,Payment for license,Manual Entry,2025-07-21,2025-07-14,22121.89,False,payment for license,2026-02-23 16:50:30.516232,Raw_GL_Export.csv
TXN000793,10-01-2025,05-01-2025,2025-01,AUS01,5810,CC1000,Microsoft,INV50254,PO9893,EUR,8544.74,GST,Payment for goods,Workday,2025-01-10,2025-01-05,8544.74,False,payment for goods,2026-02-23 16:50:30.516232,Raw_GL_Export.csv
TXN000794,2026-02-24,2026-02-15,2026-02,AUS01,5000,CC1000,EY Australia,INV80485,,EUR,17382.07,INPUT,Payment for consulting,API Import,2026-02-24,2026-02-15,17382.07,False,payment for consulting,2026-02-23 16:50:30.516232,Raw_GL_Export.csv
TXN000795,17/01/2026,08/01/2026,2026-01,AUS01,5320,CC1000,Workday,INV39041,PO2195,EUR,4529.42,GST-FREE,Payment for goods,Manual Entry,2026-01-17,2026-01-08,4529.42,False,payment for goods,2026-02-23 16:50:30.516232,Raw_GL_Export.csv
TXN000796,2025-12-07,2025-12-06,2025-12,AUS01,5400,CC2000,Atlassian Pty,INV41508,PO6419,EUR,41601.62,GST,Payment for goods,Manual Entry,2025-12-07,2025-12-06,41601.62,False,payment for goods,2026-02-23 16:50:30.516232,Raw_GL_Export.csv
TXN000797,27/01/2026,21/01/2026,2026-01,AUS01,5910,CC3100,Microsoft,INV91495,PO7927,EUR,7101.21,GST-FREE,Payment for license,Workday,2026-01-27,2026-01-21,7101.21,False,payment for license,2026-02-23 16:50:30.516232,Raw_GL_Export.csv
TXN000798,02/07/2026,01/31/2026,2026-02,AUS01,5710,CC1000,AusPost,INV46449,PO4104,EUR,37077.62,EXPORT,Payment for consulting,Workday,2026-07-02,2026-01-31,37077.62,False,payment for consulting,2026-02-23 16:50:30.516232,Raw_GL_Export.csv
TXN000799,2026-02-20,2026-02-13,2026-02,AUS01,5010,CC3200,Slack,INV19243,PO2888,EUR,29867.04,GST-FREE,Payment for goods,Manual Entry,2026-02-20,2026-02-13,29867.04,False,payment for goods,2026-02-23 16:50:30.516232,Raw_GL_Export.csv
TXN000800,03/02/2025,25/01/2025,2025-02,AUS01,5310,CC1200,Deloitte Touche,INV47330,PO5664,EUR,42993.74,EXPORT,Payment for license,Workday,2025-02-03,2025-01-25,42993.74,False,payment for license,2026-02-23 16:50:30.516232,Raw_GL_Export.csv
TXN000801,2025-09-04,2025-08-28,2025-09,AUS01,5910,CC2000,Google,INV36317,,EUR,25008.27,EXPORT,Payment for services,Manual Entry,2025-09-04,2025-08-28,25008.27,False,payment for services,2026-02-23 16:50:30.516232,Raw_GL_Export.csv
TXN000802,2025-01-16,2025-01-14,2025-01,AUS01,5210,CC1000,Federal Express,INV41686,PO7076,EUR,8383.08,GST,Payment for consulting,Oracle,2025-01-16,2025-01-14,8383.08,False,payment for consulting,2026-02-23 16:50:30.516232,Raw_GL_Export.csv
TXN000803,2026-01-15,2026-01-06,2026-01,AUS01,5810,CC2000,Workday,INV84553,,EUR,32648.47,GST,Payment for goods,Workday,2026-01-15,2026-01-06,32648.47,False,payment for goods,2026-02-23 16:50:30.516232,Raw_GL_Export.csv
TXN000804,02/28/2026,02/25/2026,2026-02,AUS01,5320,CC3200,SAP,INV61290,PO5780,EUR,40580.17,GST,Payment for license,SAP,2026-02-28,2026-02-25,40580.17,False,payment for license,2026-02-23 16:50:30.516232,Raw_GL_Export.csv
TXN000805,08/02/2026,04/02/2026,2026-02,AUS01,5310,CC3200,Amazon,INV42214,PO5715,EUR,39223.05,GST,Payment for license,Oracle,2026-02-08,2026-02-04,39223.05,False,payment for license,2026-02-23 16:50:30.516232,Raw_GL_Export.csv
TXN000806,12/05/2025,12/04/2025,2025-12,AUS01,5100,CC1100,AusPost,INV91079,PO6270,EUR,23360.32,GST,Payment for subscription,SAP,2025-05-12,2025-04-12,23360.32,False,payment for subscription,2026-02-23 16:50:30.516232,Raw_GL_Export.csv
TXN000807,2026-01-05,2026-01-01,2026-01,AUS01,5000,CC3100,AWS,INV84311,,EUR,25365.75,EXPORT,Payment for goods,SAP,2026-01-05,2026-01-01,25365.75,False,payment for goods,2026-02-23 16:50:30.516232,Raw_GL_Export.csv
TXN000808,2025-05-19,2025-05-18,2025-05,AUS01,5620,CC3200,Federal Express,INV68939,PO4893,EUR,12782.83,EXPORT,Payment for consulting,API Import,2025-05-19,2025-05-18,12782.83,False,payment for consulting,2026-02-23 16:50:30.516232,Raw_GL_Export.csv
TXN000809,02/09/2026,02/01/2026,2026-01,AUS01,5500,CC1200,LinkedIn Corp,INV93505,PO7364,NZD,10150.41,INPUT,Payment for subscription,Oracle,2026-09-02,2026-01-02,10150.41,False,payment for subscription,2026-02-23 16:50:30.516232,Raw_GL_Export.csv
TXN000810,2026-03-12,2026-03-05,2026-02,AUS01,5900,CC2100,Zoom,INV62721,,AUD,20750.95,GST-FREE,Payment for subscription,Oracle,2026-03-12,2026-03-05,20750.95,False,payment for subscription,2026-02-23 16:50:30.516232,Raw_GL_Export.csv
TXN000811,13-02-2025,06-02-2025,2025-01,AUS01,5420,CC3200,Optus Pty,INV52730,PO3180,GBP,20911.92,INPUT,Payment for license,Oracle,2025-02-13,2025-02-06,20911.92,False,payment for license,2026-02-23 16:50:30.516232,Raw_GL_Export.csv
TXN000812,08/03/2026,04/03/2026,2026-02,AUS01,5600,CC2000,Regus Australia,INV59127,PO4498,GBP,24714.43,EXPORT,Payment for consulting,Oracle,2026-03-08,2026-03-04,24714.43,False,payment for consulting,2026-02-23 16:50:30.516232,Raw_GL_Export.csv
TXN000813,2025-05-16,2025-05-07,2025-04,AUS01,5620,CC3200,EY Australia,INV54260,PO3567,GBP,2384.77,GST-FREE,Payment for consulting,API Import,2025-05-16,2025-05-07,2384.77,False,payment for consulting,2026-02-23 16:50:30.516232,Raw_GL_Export.csv
TXN000814,14/03/2026,06/03/2026,2026-02,AUS01,5000,CC2000,Federal Express,INV94048,PO4240,USD,12372.07,GST-FREE,Payment for goods,Manual Entry,2026-03-14,2026-03-06,12372.07,False,payment for goods,2026-02-23 16:50:30.516232,Raw_GL_Export.csv
TXN000815,11-03-2026,07-03-2026,2026-02,AUS01,5920,CC1200,Hays,INV98629,,NZD,27505.08,GST,Payment for services,SAP,2026-03-11,2026-03-07,27505.08,False,payment for services,2026-02-23 16:50:30.516232,Raw_GL_Export.csv
TXN000816,2025-09-01,2025-08-31,2025-08,AUS01,5310,CC1100,McKinsey,INV37919,PO2081,NZD,9215.02,GST-FREE,Payment for subscription,API Import,2025-09-01,2025-08-31,9215.02,False,payment for subscription,2026-02-23 16:50:30.516232,Raw_GL_Export.csv
TXN000817,11-03-2026,03-03-2026,2026-02,AUS01,5310,CC1200,KPMG Australia,INV29925,,NZD,4657.33,GST-FREE,Payment for services,API Import,2026-03-11,2026-03-03,4657.33,False,payment for services,2026-02-23 16:50:30.516232,Raw_GL_Export.csv
TXN000818,20-05-2025,17-05-2025,2025-04,AUS01,5520,CC4000,Seek Limited,INV24858,PO3402,NZD,31079.37,GST-FREE,Payment for consulting,SAP,2025-05-20,2025-05-17,31079.37,False,payment for consulting,2026-02-23 16:50:30.516232,Raw_GL_Export.csv
TXN000819,2026-02-25,2026-02-22,2026-01,AUS01,5400,CC3200,Federal Express,INV86831,PO6937,GBP,7753.56,GST,Payment for consulting,API Import,2026-02-25,2026-02-22,7753.56,False,payment for consulting,2026-02-23 16:50:30.516232,Raw_GL_Export.csv
TXN000820,19/02/2026,11/02/2026,2026-01,AUS01,5000,CC3200,WeWork Australia,INV19029,,NZD,44452.91,INPUT,Payment for license,Workday,2026-02-19,2026-02-11,44452.91,False,payment for license,2026-02-23 16:50:30.516232,Raw_GL_Export.csv
TXN000821,22-08-2025,19-08-2025,2025-07,AUS01,5100,CC2000,McKinsey,INV56492,PO9105,NZD,32042.23,GST,Payment for services,API Import,2025-08-22,2025-08-19,32042.23,False,payment for services,2026-02-23 16:50:30.516232,Raw_GL_Export.csv
TXN000822,19-05-2025,16-05-2025,2025-04,AUS01,5320,CC2100,SAP,INV74174,PO3734,NZD,44193.43,GST,Payment for services,Oracle,2025-05-19,2025-05-16,44193.43,False,payment for services,2026-02-23 16:50:30.516232,Raw_GL_Export.csv
TXN000823,03/23/2026,03/18/2026,2026-02,AUS01,5420,CC3100,BCG,INV96430,,AUD,12350.36,EXPORT,Payment for license,SAP,2026-03-23,2026-03-18,12350.36,False,payment for license,2026-02-23 16:50:30.516232,Raw_GL_Export.csv
TXN000824,2026-03-05,2026-02-23,2026-02,AUS01,5000,CC2100,Federal Express,INV60907,,USD,40713.61,EXPORT,Payment for subscription,Manual Entry,2026-03-05,2026-02-23,40713.61,False,payment for subscription,2026-02-23 16:50:30.516232,Raw_GL_Export.csv
TXN000825,02/11/2026,02/02/2026,2026-01,AUS01,5920,CC3100,AusPost,INV44286,PO9008,NZD,6042.07,INPUT,Payment for subscription,Workday,2026-11-02,2026-02-02,6042.07,False,payment for subscription,2026-02-23 16:50:30.516232,Raw_GL_Export.csv
TXN000826,03-02-2026,01-02-2026,2026-01,AUS01,5900,CC3000,Robert Half International,INV24031,,AUD,1133.03,GST-FREE,Payment for goods,Workday,2026-02-03,2026-02-01,1133.03,False,payment for goods,2026-02-23 16:50:30.516232,Raw_GL_Export.csv
TXN000827,03/02/2026,24/01/2026,2026-01,AUS01,5900,CC2000,Google,INV54713,PO2153,AUD,533.07,GST,Payment for goods,API Import,2026-02-03,2026-01-24,533.07,False,payment for goods,2026-02-23 16:50:30.516232,Raw_GL_Export.csv
TXN000828,21-02-2026,15-02-2026,2026-01,AUS01,5900,CC1100,Atlassian Pty,INV20637,,AUD,31716.23,GST-FREE,Payment for services,SAP,2026-02-21,2026-02-15,31716.23,False,payment for services,2026-02-23 16:50:30.516232,Raw_GL_Export.csv
TXN000829,14/04/2025,10/04/2025,2025-03,AUS01,5010,CC1100,Federal Express,INV72396,PO9115,NZD,28182.78,GST-FREE,Payment for license,Oracle,2025-04-14,2025-04-10,28182.78,False,payment for license,2026-02-23 16:50:30.516232,Raw_GL_Export.csv
TXN000830,03/16/2025,03/06/2025,2025-02,AUS01,5920,CC1000,Optus Pty,INV33049,PO5313,USD,22890.54,GST,Payment for goods,API Import,2025-03-16,2025-06-03,22890.54,False,payment for goods,2026-02-23 16:50:30.516232,Raw_GL_Export.csv
TXN000831,19/04/2025,17/04/2025,2025-03,AUS01,5710,CC1100,SAP,INV31289,PO5861,USD,38202.87,GST-FREE,Payment for license,Manual Entry,2025-04-19,2025-04-17,38202.87,False,payment for license,2026-02-23 16:50:30.516232,Raw_GL_Export.csv
TXN000832,04/17/2025,04/13/2025,2025-03,AUS01,5410,CC2100,WeWork Australia,INV46890,PO2059,USD,23921.73,INPUT,Payment for services,SAP,2025-04-17,2025-04-13,23921.73,False,payment for services,2026-02-23 16:50:30.516232,Raw_GL_Export.csv
TXN000833,03/16/2026,03/15/2026,2026-02,AUS01,5610,CC3100,Google,INV51733,PO6922,GBP,638.75,GST,Payment for license,SAP,2026-03-16,2026-03-15,638.75,False,payment for license,2026-02-23 16:50:30.516232,Raw_GL_Export.csv
TXN000834,03/19/2026,03/13/2026,2026-02,AUS01,5420,CC3000,Seek Limited,INV51087,PO4117,NZD,22536.3,EXPORT,Payment for goods,API Import,2026-03-19,2026-03-13,22536.3,False,payment for goods,2026-02-23 16:50:30.516232,Raw_GL_Export.csv
TXN000835,2026-03-06,2026-02-28,2026-02,AUS01,5410,CC3200,LinkedIn Corp,INV70768,PO8608,NZD,41562.73,EXPORT,Payment for consulting,Oracle,2026-03-06,2026-02-28,41562.73,False,payment for consulting,2026-02-23 16:50:30.516232,Raw_GL_Export.csv
TXN000836,05-03-2026,26-02-2026,2026-02,AUS01,5000,CC1200,McKinsey,INV62352,PO8116,GBP,44540.32,GST-FREE,Payment for goods,Oracle,2026-03-05,2026-02-26,44540.32,False,payment for goods,2026-02-23 16:50:30.516232,Raw_GL_Export.csv
TXN000837,19/02/2026,15/02/2026,2026-01,AUS01,5100,CC1000,DHL Express,INV35920,,GBP,6830.5,INPUT,Payment for consulting,Oracle,2026-02-19,2026-02-15,6830.5,False,payment for consulting,2026-02-23 16:50:30.516232,Raw_GL_Export.csv
TXN000838,02/10/2026,02/06/2026,2026-01,AUS01,5200,CC3200,Hays,INV73876,PO1979,GBP,19636.33,GST-FREE,Payment for subscription,SAP,2026-10-02,2026-06-02,19636.33,False,payment for subscription,2026-02-23 16:50:30.516232,Raw_GL_Export.csv
TXN000839,02/03/2026,01/26/2026,2026-01,AUS01,5610,CC2100,Zoom,INV38364,PO1212,USD,23392.45,EXPORT,Payment for subscription,Oracle,2026-03-02,2026-01-26,23392.45,False,payment for subscription,2026-02-23 16:50:30.516232,Raw_GL_Export.csv
TXN000840,03/11/2026,03/01/2026,2026-02,AUS01,5410,CC4100,Atlassian Pty,INV58936,PO3099,USD,23880.69,INPUT,Payment for subscription,API Import,2026-11-03,2026-01-03,23880.69,False,payment for subscription,2026-02-23 16:50:30.516232,Raw_GL_Export.csv
TXN000841,2026-03-16,2026-03-15,2026-02,AUS01,5420,CC3000,AusPost,INV40597,PO6120,USD,9504.57,INPUT,Payment for consulting,Workday,2026-03-16,2026-03-15,9504.57,False,payment for consulting,2026-02-23 16:50:30.516232,Raw_GL_Export.csv
TXN000842,12/18/2025,12/08/2025,2025-11,AUS01,5900,CC3000,SAP,INV87704,PO5081,USD,43449.78,GST-FREE,Payment for consulting,API Import,2025-12-18,2025-08-12,43449.78,False,payment for consulting,2026-02-23 16:50:30.516232,Raw_GL_Export.csv
TXN000843,2026-03-16,2026-03-10,2026-02,AUS01,5510,CC1100,Federal Express,INV79367,PO5358,USD,28099.95,GST,Payment for services,Manual Entry,2026-03-16,2026-03-10,28099.95,False,payment for services,2026-02-23 16:50:30.516232,Raw_GL_Export.csv
TXN000844,13/06/2025,08/06/2025,2025-05,AUS01,5710,CC1200,Regus Australia,INV92977,,AUD,21371.24,GST-FREE,Payment for subscription,API Import,2025-06-13,2025-06-08,21371.24,False,payment for subscription,2026-02-23 16:50:30.516232,Raw_GL_Export.csv
TXN000845,16/02/2026,11/02/2026,2026-01,AUS01,5310,CC3200,McKinsey,INV88326,PO5843,USD,37103.73,GST-FREE,Payment for services,Oracle,2026-02-16,2026-02-11,37103.73,False,payment for services,2026-02-23 16:50:30.516232,Raw_GL_Export.csv
TXN000846,01/17/2026,01/13/2026,2025-12,AUS01,5900,CC3100,Telstra Corp,INV28882,,AUD,13488.15,GST-FREE,Payment for services,Manual Entry,2026-01-17,2026-01-13,13488.15,False,payment for services,2026-02-23 16:50:30.516232,Raw_GL_Export.csv
TXN000847,02/03/2026,01/26/2026,2026-01,AUS01,5810,CC1200,Optus Pty,INV51168,,GBP,25031.37,EXPORT,Payment for subscription,Manual Entry,2026-03-02,2026-01-26,25031.37,False,payment for subscription,2026-02-23 16:50:30.516232,Raw_GL_Export.csv
TXN000848,09/06/2025,30/05/2025,2025-05,AUS01,5420,CC2100,Adobe,INV26241,,USD,14593.89,GST,Payment for subscription,API Import,2025-06-09,2025-05-30,14593.89,False,payment for subscription,2026-02-23 16:50:30.516232,Raw_GL_Export.csv
TXN000849,02/16/2026,02/13/2026,2026-01,AUS01,5310,CC3100,Amazon,INV33330,PO1565,GBP,29120.14,EXPORT,Payment for subscription,Workday,2026-02-16,2026-02-13,29120.14,False,payment for subscription,2026-02-23 16:50:30.516232,Raw_GL_Export.csv
TXN000850,2025-08-19,2025-08-10,2025-07,AUS01,5010,CC1200,Hays,INV29866,,AUD,41720.0,GST-FREE,Payment for goods,Oracle,2025-08-19,2025-08-10,41720.0,False,payment for goods,2026-02-23 16:50:30.516232,Raw_GL_Export.csv
TXN000851,03/03/2026,02/25/2026,2026-02,AUS01,5310,CC1100,AusPost,INV62502,PO9596,NZD,33813.2,EXPORT,Payment for consulting,Manual Entry,2026-03-03,2026-02-25,33813.2,False,payment for consulting,2026-02-23 16:50:30.516232,Raw_GL_Export.csv
TXN000852,23/11/2025,14/11/2025,2025-10,AUS01,5910,CC1100,Workday,INV39805,,GBP,7241.81,INPUT,Payment for license,SAP,2025-11-23,2025-11-14,7241.81,False,payment for license,2026-02-23 16:50:30.516232,Raw_GL_Export.csv
TXN000853,02/03/2026,22/02/2026,2026-02,AUS01,5010,CC1000,ServiceNow Inc,INV75612,PO7349,USD,42753.47,GST-FREE,Payment for consulting,SAP,2026-03-02,2026-02-22,42753.47,False,payment for consulting,2026-02-23 16:50:30.516232,Raw_GL_Export.csv
TXN000854,11/17/2025,11/09/2025,2025-10,AUS01,5000,CC3100,Salesforce,INV37372,,AUD,9085.59,GST,Payment for consulting,SAP,2025-11-17,2025-09-11,9085.59,False,payment for consulting,2026-02-23 16:50:30.516232,Raw_GL_Export.csv
TXN000855,2026-01-12,2026-01-02,2025-12,AUS01,5320,CC4000,Adobe,INV92271,PO5610,GBP,9653.75,GST,Payment for subscription,API Import,2026-01-12,2026-01-02,9653.75,False,payment for subscription,2026-02-23 16:50:30.516232,Raw_GL_Export.csv
TXN000856,12-03-2026,09-03-2026,2026-02,AUS01,5910,CC2000,Deloitte Touche,INV61463,,NZD,8890.18,INPUT,Payment for subscription,Manual Entry,2026-03-12,2026-03-09,8890.18,False,payment for subscription,2026-02-23 16:50:30.516232,Raw_GL_Export.csv
TXN000857,01-02-2026,22-01-2026,2026-02,AUS01,5620,CC4000,DHL Express,INV60784,PO4368,USD,8398.96,GST,Payment for goods,API Import,2026-02-01,2026-01-22,8398.96,False,payment for goods,2026-02-23 16:50:30.516232,Raw_GL_Export.csv
TXN000858,02/24/2026,02/20/2026,2026-02,AUS01,5600,CC2100,Regus Australia,INV84297,PO5134,GBP,2541.1,GST-FREE,Payment for goods,API Import,2026-02-24,2026-02-20,2541.1,False,payment for goods,2026-02-23 16:50:30.516232,Raw_GL_Export.csv
TXN000859,02/01/2026,01/31/2026,2026-02,AUS01,5200,CC1200,BCG,INV52907,PO7402,USD,22531.71,EXPORT,Payment for license,Oracle,2026-01-02,2026-01-31,22531.71,False,payment for license,2026-02-23 16:50:30.516232,Raw_GL_Export.csv
TXN000860,16-02-2026,07-02-2026,2026-02,AUS01,5610,CC2100,Accenture Pty,INV14089,PO1183,AUD,27775.03,GST,Payment for subscription,SAP,2026-02-16,2026-02-07,27775.03,False,payment for subscription,2026-02-23 16:50:30.516232,Raw_GL_Export.csv
TXN000861,10-01-2026,03-01-2026,2026-01,AUS01,5800,CC4100,Adobe,INV94642,,AUD,2503.85,GST-FREE,Payment for consulting,Workday,2026-01-10,2026-01-03,2503.85,False,payment for consulting,2026-02-23 16:50:30.516232,Raw_GL_Export.csv
TXN000862,02/03/2026,01/27/2026,2026-02,AUS01,5620,CC1000,EY Australia,INV28591,,AUD,40443.62,INPUT,Payment for goods,SAP,2026-03-02,2026-01-27,40443.62,False,payment for goods,2026-02-23 16:50:30.516232,Raw_GL_Export.csv
TXN000863,2025-05-21,2025-05-13,2025-05,AUS01,5120,CC1000,Atlassian Pty,INV85992,PO5475,AUD,32643.93,EXPORT,Payment for subscription,SAP,2025-05-21,2025-05-13,32643.93,False,payment for subscription,2026-02-23 16:50:30.516232,Raw_GL_Export.csv
TXN000864,23-01-2026,21-01-2026,2026-01,AUS01,5800,CC1200,Workday,INV13918,,AUD,17949.5,EXPORT,Payment for consulting,Manual Entry,2026-01-23,2026-01-21,17949.5,False,payment for consulting,2026-02-23 16:50:30.516232,Raw_GL_Export.csv
TXN000865,14/02/2025,13/02/2025,2025-02,AUS01,5600,CC1000,Salesforce,INV36568,PO1399,NZD,31974.59,EXPORT,Payment for subscription,Oracle,2025-02-14,2025-02-13,31974.59,False,payment for subscription,2026-02-23 16:50:30.516232,Raw_GL_Export.csv
TXN000866,08-02-2025,07-02-2025,2025-02,AUS01,5620,CC1000,Telstra Corp,INV47554,PO7017,GBP,35659.17,GST,Payment for consulting,Manual Entry,2025-02-08,2025-02-07,35659.17,False,payment for consulting,2026-02-23 16:50:30.516232,Raw_GL_Export.csv
TXN000867,18/01/2026,12/01/2026,2026-01,AUS01,5700,CC3000,Zoom,INV63346,,NZD,33110.25,INPUT,Payment for consulting,Workday,2026-01-18,2026-01-12,33110.25,False,payment for consulting,2026-02-23 16:50:30.516232,Raw_GL_Export.csv
TXN000868,08/15/2025,08/10/2025,2025-08,AUS01,5110,CC3200,AusPost,INV88925,,NZD,43266.25,GST,Payment for goods,Workday,2025-08-15,2025-10-08,43266.25,False,payment for goods,2026-02-23 16:50:30.516232,Raw_GL_Export.csv
TXN000869,12-01-2026,04-01-2026,2026-01,AUS01,5810,CC4000,Adobe,INV88484,PO3612,AUD,15521.07,GST-FREE,Payment for license,Oracle,2026-01-12,2026-01-04,15521.07,False,payment for license,2026-02-23 16:50:30.516232,Raw_GL_Export.csv
TXN000870,27/08/2025,20/08/2025,2025-08,AUS01,5020,CC3100,Atlassian Pty,INV43386,PO3698,AUD,23428.64,GST,Payment for goods,Workday,2025-08-27,2025-08-20,23428.64,False,payment for goods,2026-02-23 16:50:30.516232,Raw_GL_Export.csv
TXN000871,2025-05-16,2025-05-10,2025-05,AUS01,5800,CC3000,DHL Express,INV63477,PO2743,GBP,9936.31,INPUT,Payment for goods,Manual Entry,2025-05-16,2025-05-10,9936.31,False,payment for goods,2026-02-23 16:50:30.516232,Raw_GL_Export.csv
TXN000872,05/04/2025,04/04/2025,2025-04,AUS01,5900,CC4000,GCP,INV50180,,GBP,6581.56,GST,Payment for consulting,Workday,2025-04-05,2025-04-04,6581.56,False,payment for consulting,2026-02-23 16:50:30.516232,Raw_GL_Export.csv
TXN000873,27/02/2026,18/02/2026,2026-02,AUS01,5620,CC1100,SAP,INV25869,,AUD,828.28,INPUT,Payment for services,SAP,2026-02-27,2026-02-18,828.28,False,payment for services,2026-02-23 16:50:30.516232,Raw_GL_Export.csv
TXN000874,09-01-2026,07-01-2026,2026-01,AUS01,5410,CC3000,DHL Express,INV54979,PO4415,AUD,31432.05,INPUT,Payment for subscription,Manual Entry,2026-01-09,2026-01-07,31432.05,False,payment for subscription,2026-02-23 16:50:30.516232,Raw_GL_Export.csv
TXN000875,20-02-2026,10-02-2026,2026-02,AUS01,5600,CC1000,Hays,INV14068,,AUD,22549.77,INPUT,Payment for consulting,Manual Entry,2026-02-20,2026-02-10,22549.77,False,payment for consulting,2026-02-23 16:50:30.516232,Raw_GL_Export.csv
TXN000876,2026-01-25,2026-01-18,2026-01,AUS01,5710,CC4100,WeWork Australia,INV15068,PO2422,GBP,44759.26,EXPORT,Payment for consulting,Workday,2026-01-25,2026-01-18,44759.26,False,payment for consulting,2026-02-23 16:50:30.516232,Raw_GL_Export.csv
TXN000877,2026-02-18,2026-02-16,2026-02,AUS01,5210,CC1100,LinkedIn Corp,INV89116,PO1562,GBP,33732.44,GST-FREE,Payment for subscription,Workday,2026-02-18,2026-02-16,33732.44,False,payment for subscription,2026-02-23 16:50:30.516232,Raw_GL_Export.csv
TXN000878,18-06-2025,14-06-2025,2025-06,AUS01,5610,CC3100,GCP,INV76361,PO9225,AUD,30803.69,GST,Payment for goods,Manual Entry,2025-06-18,2025-06-14,30803.69,False,payment for goods,2026-02-23 16:50:30.516232,Raw_GL_Export.csv
TXN000879,09-01-2026,31-12-2025,2026-01,AUS01,5620,CC1000,Deloitte Touche,INV32795,PO5806,AUD,31449.92,EXPORT,Payment for goods,SAP,2026-01-09,2025-12-31,31449.92,False,payment for goods,2026-02-23 16:50:30.516232,Raw_GL_Export.csv
TXN000880,01/10/2026,01/03/2026,2026-01,AUS01,5100,CC1200,Salesforce,INV10746,PO3893,USD,21748.36,GST-FREE,Payment for consulting,SAP,2026-10-01,2026-03-01,21748.36,False,payment for consulting,2026-02-23 16:50:30.516232,Raw_GL_Export.csv
TXN000881,10/01/2026,06/01/2026,2026-01,AUS01,5310,CC4100,Hays,INV23308,,USD,32150.87,GST,Payment for goods,API Import,2026-01-10,2026-01-06,32150.87,False,payment for goods,2026-02-23 16:50:30.516232,Raw_GL_Export.csv
TXN000882,2025-03-19,2025-03-11,2025-03,AUS01,5500,CC3000,Telstra Corp,INV93208,PO7858,AUD,31907.56,INPUT,Payment for consulting,SAP,2025-03-19,2025-03-11,31907.56,False,payment for consulting,2026-02-23 16:50:30.516232,Raw_GL_Export.csv
TXN000883,09-03-2025,28-02-2025,2025-03,AUS01,5710,CC3100,Salesforce,INV72210,PO4985,AUD,4017.21,INPUT,Payment for goods,SAP,2025-03-09,2025-02-28,4017.21,False,payment for goods,2026-02-23 16:50:30.516232,Raw_GL_Export.csv
TXN000884,01/03/2025,27/02/2025,2025-03,AUS01,5600,CC1200,SAP,INV83055,,GBP,29727.8,INPUT,Payment for services,Oracle,2025-03-01,2025-02-27,29727.8,False,payment for services,2026-02-23 16:50:30.516232,Raw_GL_Export.csv
TXN000885,19-05-2025,17-05-2025,2025-05,AUS01,5520,CC1000,ServiceNow Inc,INV61211,,USD,6717.69,GST-FREE,Payment for services,API Import,2025-05-19,2025-05-17,6717.69,False,payment for services,2026-02-23 16:50:30.516232,Raw_GL_Export.csv
TXN000886,2026-02-26,2026-02-24,2026-02,AUS01,5510,CC2100,AWS,INV51881,PO8870,NZD,39629.27,GST-FREE,Payment for goods,Oracle,2026-02-26,2026-02-24,39629.27,False,payment for goods,2026-02-23 16:50:30.516232,Raw_GL_Export.csv
TXN000887,22-01-2026,14-01-2026,2026-01,AUS01,5500,CC2000,GCP,INV29151,PO9353,USD,17514.8,GST,Payment for goods,SAP,2026-01-22,2026-01-14,17514.8,False,payment for goods,2026-02-23 16:50:30.516232,Raw_GL_Export.csv
TXN000888,2025-04-16,2025-04-06,2025-04,AUS01,5120,CC2000,AusPost,INV63266,,NZD,42198.62,INPUT,Payment for consulting,SAP,2025-04-16,2025-04-06,42198.62,False,payment for consulting,2026-02-23 16:50:30.516232,Raw_GL_Export.csv
TXN000889,02/28/2026,02/21/2026,2026-02,AUS01,5000,CC2000,Regus Australia,INV26688,PO9348,GBP,20297.29,GST-FREE,Payment for consulting,Oracle,2026-02-28,2026-02-21,20297.29,False,payment for consulting,2026-02-23 16:50:30.516232,Raw_GL_Export.csv
TXN000890,07/08/2025,06/30/2025,2025-07,AUS01,5810,CC1100,Telstra Corp,INV29079,PO1654,AUD,18837.51,GST,Payment for subscription,Workday,2025-08-07,2025-06-30,18837.51,False,payment for subscription,2026-02-23 16:50:30.516232,Raw_GL_Export.csv
TXN000891,02/13/2026,02/05/2026,2026-02,AUS01,5620,CC3000,EY Australia,INV77035,PO3248,NZD,41377.77,EXPORT,Payment for consulting,Workday,2026-02-13,2026-05-02,41377.77,False,payment for consulting,2026-02-23 16:50:30.516232,Raw_GL_Export.csv
TXN000892,03-02-2026,28-01-2026,2026-02,AUS01,5520,CC4000,Salesforce,INV47872,PO4732,NZD,28347.55,INPUT,Payment for subscription,Workday,2026-02-03,2026-01-28,28347.55,False,payment for subscription,2026-02-23 16:50:30.516232,Raw_GL_Export.csv
TXN000893,08/02/2026,02/02/2026,2026-02,AUS01,5300,CC2000,BCG,INV97776,PO3281,GBP,12605.64,EXPORT,Payment for subscription,Oracle,2026-02-08,2026-02-02,12605.64,False,payment for subscription,2026-02-23 16:50:30.516232,Raw_GL_Export.csv
TXN000894,02/22/2026,02/13/2026,2026-02,AUS01,5520,CC3000,Workday,INV25363,PO5775,GBP,26220.53,GST-FREE,Payment for goods,Oracle,2026-02-22,2026-02-13,26220.53,False,payment for goods,2026-02-23 16:50:30.516232,Raw_GL_Export.csv
TXN000895,02/20/2026,02/17/2026,2026-02,AUS01,5620,CC3200,Regus Australia,INV84473,PO6593,USD,17684.2,INPUT,Payment for goods,Workday,2026-02-20,2026-02-17,17684.2,False,payment for goods,2026-02-23 16:50:30.516232,Raw_GL_Export.csv
TXN000896,2026-01-20,2026-01-15,2026-01,AUS01,5100,CC3100,DHL Express,INV74887,PO5539,AUD,3087.93,INPUT,Payment for license,API Import,2026-01-20,2026-01-15,3087.93,False,payment for license,2026-02-23 16:50:30.516232,Raw_GL_Export.csv
TXN000897,14/01/2026,09/01/2026,2026-01,AUS01,5010,CC3100,Hays,INV51044,,AUD,21488.93,EXPORT,Payment for goods,SAP,2026-01-14,2026-01-09,21488.93,False,payment for goods,2026-02-23 16:50:30.516232,Raw_GL_Export.csv
TXN000898,2026-01-12,2026-01-11,2026-01,AUS01,5920,CC1100,PWC,INV26701,PO7934,AUD,24727.23,INPUT,Payment for goods,SAP,2026-01-12,2026-01-11,24727.23,False,payment for goods,2026-02-23 16:50:30.516232,Raw_GL_Export.csv
TXN000899,2025-08-22,2025-08-21,2025-08,AUS01,5100,CC3000,PWC,INV38893,PO5370,NZD,19398.14,GST-FREE,Payment for license,Workday,2025-08-22,2025-08-21,19398.14,False,payment for license,2026-02-23 16:50:30.516232,Raw_GL_Export.csv
TXN000900,27/02/2026,24/02/2026,2026-02,AUS01,5000,CC4000,McKinsey,INV36626,PO1285,USD,7815.72,EXPORT,Payment for goods,SAP,2026-02-27,2026-02-24,7815.72,False,payment for goods,2026-02-23 16:50:30.516232,Raw_GL_Export.csv
TXN000901,01/19/2026,01/11/2026,2026-01,AUS01,5100,CC1100,Accenture Pty,INV89902,,GBP,10021.71,EXPORT,Payment for goods,Oracle,2026-01-19,2026-11-01,10021.71,False,payment for goods,2026-02-23 16:50:30.516232,Raw_GL_Export.csv
TXN000902,2026-01-09,2026-01-08,2026-01,AUS01,5210,CC2100,Telstra Corp,INV23155,PO7693,GBP,20132.82,GST-FREE,Payment for consulting,Manual Entry,2026-01-09,2026-01-08,20132.82,False,payment for consulting,2026-02-23 16:50:30.516232,Raw_GL_Export.csv
TXN000903,05-01-2026,26-12-2025,2026-01,AUS01,5810,CC3100,Amazon,INV67232,PO9584,NZD,9310.28,EXPORT,Payment for subscription,Workday,2026-01-05,2025-12-26,9310.28,False,payment for subscription,2026-02-23 16:50:30.516232,Raw_GL_Export.csv
TXN000904,01-01-2026,23-12-2025,2026-01,AUS01,5610,CC3100,Optus Pty,INV88768,PO7187,USD,16845.95,GST,Payment for goods,Manual Entry,2026-01-01,2025-12-23,16845.95,False,payment for goods,2026-02-23 16:50:30.516232,Raw_GL_Export.csv
TXN000905,07/02/2026,01/02/2026,2026-02,AUS01,5320,CC3100,PWC,INV59734,PO8695,USD,32200.53,GST-FREE,Payment for services,API Import,2026-02-07,2026-02-01,32200.53,False,payment for services,2026-02-23 16:50:30.516232,Raw_GL_Export.csv
TXN000906,2026-01-08,2025-12-31,2026-01,AUS01,5710,CC1000,Federal Express,INV74350,PO8296,NZD,16242.47,GST,Payment for consulting,SAP,2026-01-08,2025-12-31,16242.47,False,payment for consulting,2026-02-23 16:50:30.516232,Raw_GL_Export.csv
TXN000907,02/14/2026,02/08/2026,2026-02,AUS01,5210,CC2100,Regus Australia,INV38722,PO9473,NZD,21586.03,GST-FREE,Payment for license,API Import,2026-02-14,2026-08-02,21586.03,False,payment for license,2026-02-23 16:50:30.516232,Raw_GL_Export.csv
TXN000908,26/08/2025,25/08/2025,2025-08,AUS01,5400,CC3000,MSFT,INV22108,PO1820,USD,4139.77,GST-FREE,Payment for subscription,SAP,2025-08-26,2025-08-25,4139.77,False,payment for subscription,2026-02-23 16:50:30.516232,Raw_GL_Export.csv
TXN000909,01/17/2026,01/09/2026,2026-01,AUS01,5110,CC2100,Zoom,INV40027,PO3730,GBP,12605.25,GST-FREE,Payment for license,SAP,2026-01-17,2026-09-01,12605.25,False,payment for license,2026-02-23 16:50:30.516232,Raw_GL_Export.csv
TXN000910,2026-02-08,2026-01-29,2026-02,AUS01,5010,CC4100,Oracle,INV32010,,NZD,24702.44,EXPORT,Payment for goods,API Import,2026-02-08,2026-01-29,24702.44,False,payment for goods,2026-02-23 16:50:30.516232,Raw_GL_Export.csv
TXN000911,2025-10-23,2025-10-21,2025-10,AUS01,5810,CC1100,PWC,INV82540,PO3931,USD,24074.5,EXPORT,Payment for goods,API Import,2025-10-23,2025-10-21,24074.5,False,payment for goods,2026-02-23 16:50:30.516232,Raw_GL_Export.csv
TXN000912,06/01/2026,05/01/2026,2026-01,AUS01,5310,CC1200,PWC,INV61616,,AUD,22591.0,GST,Payment for services,Manual Entry,2026-01-06,2026-01-05,22591.0,False,payment for services,2026-02-23 16:50:30.516232,Raw_GL_Export.csv
TXN000913,05/02/2026,01/02/2026,2026-02,AUS01,5920,CC4100,Regus Australia,INV32956,PO5066,NZD,20861.99,EXPORT,Payment for goods,API Import,2026-02-05,2026-02-01,20861.99,False,payment for goods,2026-02-23 16:50:30.516232,Raw_GL_Export.csv
TXN000914,2026-02-25,2026-02-23,2026-02,AUS01,5400,CC1200,AWS,INV98804,PO9871,NZD,20788.69,EXPORT,Payment for consulting,API Import,2026-02-25,2026-02-23,20788.69,False,payment for consulting,2026-02-23 16:50:30.516232,Raw_GL_Export.csv
TXN000915,10/15/2025,10/05/2025,2025-10,AUS01,5600,CC3100,Deloitte Touche,INV26546,PO4389,GBP,7593.61,EXPORT,Payment for services,API Import,2025-10-15,2025-05-10,7593.61,False,payment for services,2026-02-23 16:50:30.516232,Raw_GL_Export.csv
TXN000916,01/12/2026,01/10/2026,2026-01,AUS01,5610,CC3100,Federal Express,INV51228,PO1262,GBP,13548.36,GST,Payment for goods,Manual Entry,2026-12-01,2026-10-01,13548.36,False,payment for goods,2026-02-23 16:50:30.516232,Raw_GL_Export.csv
TXN000917,25/02/2026,17/02/2026,2026-02,AUS01,5920,CC4100,Slack,INV12146,PO8193,NZD,17896.6,GST-FREE,Payment for subscription,Manual Entry,2026-02-25,2026-02-17,17896.6,False,payment for subscription,2026-02-23 16:50:30.516232,Raw_GL_Export.csv
TXN000918,13-02-2025,05-02-2025,2025-02,AUS01,5320,CC2000,LinkedIn Corp,INV42160,PO2659,USD,18769.42,GST,Payment for subscription,Workday,2025-02-13,2025-02-05,18769.42,False,payment for subscription,2026-02-23 16:50:30.516232,Raw_GL_Export.csv
TXN000919,02/02/2026,01/25/2026,2026-02,AUS01,5400,CC3100,Salesforce,INV15311,PO8855,NZD,16029.37,EXPORT,Payment for services,Workday,2026-02-02,2026-01-25,16029.37,False,payment for services,2026-02-23 16:50:30.516232,Raw_GL_Export.csv
TXN000920,11/02/2025,06/02/2025,2025-02,AUS01,5510,CC1200,AWS,INV17849,,AUD,6652.66,INPUT,Payment for goods,API Import,2025-02-11,2025-02-06,6652.66,False,payment for goods,2026-02-23 16:50:30.516232,Raw_GL_Export.csv
TXN000921,2026-02-12,2026-02-04,2026-02,AUS01,5400,CC3000,LinkedIn Corp,INV58230,,NZD,28017.59,INPUT,Payment for license,API Import,2026-02-12,2026-02-04,28017.59,False,payment for license,2026-02-23 16:50:30.516232,Raw_GL_Export.csv
TXN000922,04-08-2025,27-07-2025,2025-08,AUS01,5410,CC4000,Microsoft,INV59535,PO8206,AUD,44939.14,GST-FREE,Payment for subscription,Oracle,2025-08-04,2025-07-27,44939.14,False,payment for subscription,2026-02-23 16:50:30.516232,Raw_GL_Export.csv
TXN000923,05/01/2026,03/01/2026,2026-01,AUS01,5610,CC3100,PWC,INV49703,,GBP,9988.67,GST,Payment for goods,Oracle,2026-01-05,2026-01-03,9988.67,False,payment for goods,2026-02-23 16:50:30.516232,Raw_GL_Export.csv
TXN000924,14/01/2026,07/01/2026,2026-01,AUS01,5900,CC1200,Telstra Corp,INV10074,PO3677,NZD,44570.14,GST-FREE,Payment for services,Workday,2026-01-14,2026-01-07,44570.14,False,payment for services,2026-02-23 16:50:30.516232,Raw_GL_Export.csv
TXN000925,24-07-2025,22-07-2025,2025-07,AUS01,5210,CC3200,Adobe,INV54923,PO7096,GBP,5229.24,EXPORT,Payment for consulting,Workday,2025-07-24,2025-07-22,5229.24,False,payment for consulting,2026-02-23 16:50:30.516232,Raw_GL_Export.csv
TXN000926,08/19/2025,08/13/2025,2025-08,AUS01,5510,CC1200,PWC,INV66868,PO6376,USD,10256.33,GST,Payment for license,Workday,2025-08-19,2025-08-13,10256.33,False,payment for license,2026-02-23 16:50:30.516232,Raw_GL_Export.csv
TXN000927,16-01-2026,15-01-2026,2026-01,AUS01,5600,CC2100,Deloitte Touche,INV38698,PO5075,AUD,37100.7,GST-FREE,Payment for consulting,Oracle,2026-01-16,2026-01-15,37100.7,False,payment for consulting,2026-02-23 16:50:30.516232,Raw_GL_Export.csv
TXN000928,01/04/2026,12/28/2025,2026-01,AUS01,5800,CC3100,AusPost,INV31292,PO2086,NZD,13528.9,GST-FREE,Payment for subscription,SAP,2026-04-01,2025-12-28,13528.9,False,payment for subscription,2026-02-23 16:50:30.516232,Raw_GL_Export.csv
TXN000929,14-01-2026,07-01-2026,2026-01,AUS01,5110,CC3100,Seek Limited,INV25496,PO8971,AUD,15086.98,INPUT,Payment for consulting,Manual Entry,2026-01-14,2026-01-07,15086.98,False,payment for consulting,2026-02-23 16:50:30.516232,Raw_GL_Export.csv
TXN000930,19/05/2025,12/05/2025,2025-05,AUS01,5410,CC2000,KPMG Australia,INV54054,,USD,27514.72,GST-FREE,Payment for subscription,API Import,2025-05-19,2025-05-12,27514.72,False,payment for subscription,2026-02-23 16:50:30.516232,Raw_GL_Export.csv
TXN000931,2025-01-13,2025-01-11,2025-01,AUS01,5020,CC1100,AWS,INV22099,PO3488,USD,24362.63,EXPORT,Payment for services,SAP,2025-01-13,2025-01-11,24362.63,False,payment for services,2026-02-23 16:50:30.516232,Raw_GL_Export.csv
TXN000932,16/02/2026,15/02/2026,2026-02,AUS01,5110,CC2100,Regus Australia,INV15299,,NZD,30006.01,GST,Payment for subscription,Workday,2026-02-16,2026-02-15,30006.01,False,payment for subscription,2026-02-23 16:50:30.516232,Raw_GL_Export.csv
TXN000933,2026-01-04,2025-12-25,2026-01,AUS01,5020,CC1000,AWS,INV74272,,USD,35550.47,EXPORT,Payment for license,Workday,2026-01-04,2025-12-25,35550.47,False,payment for license,2026-02-23 16:50:30.516232,Raw_GL_Export.csv
TXN000934,2026-01-20,2026-01-10,2026-01,AUS01,5300,CC1200,Salesforce,INV30629,PO9435,GBP,27316.93,INPUT,Payment for services,Manual Entry,2026-01-20,2026-01-10,27316.93,False,payment for services,2026-02-23 16:50:30.516232,Raw_GL_Export.csv
TXN000935,20/02/2026,15/02/2026,2026-02,AUS01,5010,CC3100,BCG,INV57022,PO6020,USD,31301.4,EXPORT,Payment for subscription,Manual Entry,2026-02-20,2026-02-15,31301.4,False,payment for subscription,2026-02-23 16:50:30.516232,Raw_GL_Export.csv
TXN000936,14/02/2025,09/02/2025,2025-02,AUS01,5700,CC3000,Workday,INV14823,,USD,20811.78,GST-FREE,Payment for license,SAP,2025-02-14,2025-02-09,20811.78,False,payment for license,2026-02-23 16:50:30.516232,Raw_GL_Export.csv
TXN000937,2026-01-05,2025-12-28,2026-01,AUS01,5110,CC1200,Salesforce,INV85926,,NZD,34689.47,INPUT,Payment for consulting,Manual Entry,2026-01-05,2025-12-28,34689.47,False,payment for consulting,2026-02-23 16:50:30.516232,Raw_GL_Export.csv
TXN000938,2026-01-14,2026-01-05,2026-01,AUS01,5800,CC4100,EY Australia,INV57737,,USD,40311.97,GST,Payment for goods,Workday,2026-01-14,2026-01-05,40311.97,False,payment for goods,2026-02-23 16:50:30.516232,Raw_GL_Export.csv
TXN000939,2025-05-03,2025-05-02,2025-05,AUS01,5910,CC2100,Federal Express,INV96288,PO6301,USD,36582.09,EXPORT,Payment for consulting,Oracle,2025-05-03,2025-05-02,36582.09,False,payment for consulting,2026-02-23 16:50:30.516232,Raw_GL_Export.csv
TXN000940,02/27/2026,02/20/2026,2026-02,AUS01,5700,CC3000,Oracle,INV42846,PO8977,AUD,39125.92,GST-FREE,Payment for subscription,Oracle,2026-02-27,2026-02-20,39125.92,False,payment for subscription,2026-02-23 16:50:30.516232,Raw_GL_Export.csv
TXN000941,02/02/2026,29/01/2026,2026-02,AUS01,5510,CC4100,Hays,INV64771,,NZD,40838.08,GST-FREE,Payment for services,Workday,2026-02-02,2026-01-29,40838.08,False,payment for services,2026-02-23 16:50:30.516232,Raw_GL_Export.csv
TXN000942,01/23/2026,01/13/2026,2026-01,AUS01,5320,CC3000,AWS,INV37664,,AUD,21777.65,GST-FREE,Payment for license,Workday,2026-01-23,2026-01-13,21777.65,False,payment for license,2026-02-23 16:50:30.516232,Raw_GL_Export.csv
TXN000943,17-11-2025,08-11-2025,2025-11,AUS01,5600,CC4100,SAP,INV69631,PO9964,GBP,34660.06,GST,Payment for subscription,API Import,2025-11-17,2025-11-08,34660.06,False,payment for subscription,2026-02-23 16:50:30.516232,Raw_GL_Export.csv
TXN000944,25-02-2026,24-02-2026,2026-02,AUS01,5300,CC3000,Amazon,INV72195,PO7836,GBP,26560.48,GST,Payment for consulting,API Import,2026-02-25,2026-02-24,26560.48,False,payment for consulting,2026-02-23 16:50:30.516232,Raw_GL_Export.csv
TXN000945,19/01/2026,13/01/2026,2026-01,AUS01,5910,CC4100,ServiceNow Inc,INV40077,PO5163,GBP,11985.05,GST,Payment for consulting,Workday,2026-01-19,2026-01-13,11985.05,False,payment for consulting,2026-02-23 16:50:30.516232,Raw_GL_Export.csv
TXN000946,01/01/2026,31/12/2025,2026-01,AUS01,5210,CC3200,Accenture Pty,INV19975,PO5483,GBP,201.04,GST,Payment for license,API Import,2026-01-01,2025-12-31,201.04,False,payment for license,2026-02-23 16:50:30.516232,Raw_GL_Export.csv
TXN000947,2025-06-14,2025-06-05,2025-06,AUS01,5920,CC2100,MSFT,INV80004,PO5711,GBP,44500.19,GST-FREE,Payment for services,Oracle,2025-06-14,2025-06-05,44500.19,False,payment for services,2026-02-23 16:50:30.516232,Raw_GL_Export.csv
TXN000948,02/13/2026,02/10/2026,2026-02,AUS01,5520,CC2000,AWS,INV72896,,GBP,3677.49,GST-FREE,Payment for goods,Workday,2026-02-13,2026-10-02,3677.49,False,payment for goods,2026-02-23 16:50:30.516232,Raw_GL_Export.csv
TXN000949,02/06/2026,02/01/2026,2026-02,AUS01,5410,CC1200,Telstra Corp,INV22793,PO5731,USD,32839.36,INPUT,Payment for subscription,API Import,2026-06-02,2026-01-02,32839.36,False,payment for subscription,2026-02-23 16:50:30.516232,Raw_GL_Export.csv
TXN000950,2026-01-23,2026-01-21,2026-01,AUS01,5110,CC1100,AWS,INV33458,,USD,3062.6,INPUT,Payment for consulting,Workday,2026-01-23,2026-01-21,3062.6,False,payment for consulting,2026-02-23 16:50:30.516232,Raw_GL_Export.csv
TXN000951,04-08-2025,26-07-2025,2025-08,AUS01,5100,CC3200,PWC,INV56299,,AUD,16096.03,GST,Payment for goods,API Import,2025-08-04,2025-07-26,16096.03,False,payment for goods,2026-02-23 16:50:30.516232,Raw_GL_Export.csv
TXN000952,2026-02-09,2026-01-30,2026-02,AUS01,5900,CC1100,Salesforce,INV78430,PO9762,USD,6647.0,GST-FREE,Payment for goods,Manual Entry,2026-02-09,2026-01-30,6647.0,False,payment for goods,2026-02-23 16:50:30.516232,Raw_GL_Export.csv
TXN000953,01/25/2026,01/24/2026,2026-01,AUS01,5310,CC3100,Telstra Corp,INV37834,,AUD,36346.65,EXPORT,Payment for license,Manual Entry,2026-01-25,2026-01-24,36346.65,False,payment for license,2026-02-23 16:50:30.516232,Raw_GL_Export.csv
TXN000954,2026-01-25,2026-01-21,2026-01,AUS01,5910,CC3200,LinkedIn Corp,INV36098,PO1596,GBP,14567.41,INPUT,Payment for consulting,Oracle,2026-01-25,2026-01-21,14567.41,False,payment for consulting,2026-02-23 16:50:30.516232,Raw_GL_Export.csv
TXN000955,01/01/2026,12/31/2025,2026-01,AUS01,5700,CC3000,BCG,INV51309,PO2396,GBP,33763.0,GST,Payment for goods,SAP,2026-01-01,2025-12-31,33763.0,False,payment for goods,2026-02-23 16:50:30.516232,Raw_GL_Export.csv
TXN000956,2025-11-20,2025-11-10,2025-11,AUS01,5110,CC3200,Hays,INV93634,PO6112,NZD,5476.91,GST,Payment for license,Manual Entry,2025-11-20,2025-11-10,5476.91,False,payment for license,2026-02-23 16:50:30.516232,Raw_GL_Export.csv
TXN000957,2026-01-10,2026-01-08,2026-01,AUS01,5010,CC2100,Slack,INV46787,PO7750,NZD,36724.63,GST-FREE,Payment for services,API Import,2026-01-10,2026-01-08,36724.63,False,payment for services,2026-02-23 16:50:30.516232,Raw_GL_Export.csv
TXN000958,2026-02-12,2026-02-04,2026-02,AUS01,5300,CC2100,AusPost,INV52959,,AUD,1274.04,INPUT,Payment for services,Oracle,2026-02-12,2026-02-04,1274.04,False,payment for services,2026-02-23 16:50:30.516232,Raw_GL_Export.csv
TXN000959,2025-05-17,2025-05-11,2025-05,AUS01,5100,CC1100,Deloitte Touche,INV33936,PO2291,NZD,14392.2,GST,Payment for goods,SAP,2025-05-17,2025-05-11,14392.2,False,payment for goods,2026-02-23 16:50:30.516232,Raw_GL_Export.csv
TXN000960,02/09/2026,01/31/2026,2026-02,AUS01,5810,CC4000,Google,INV23164,PO1667,NZD,40793.74,INPUT,Payment for subscription,Manual Entry,2026-09-02,2026-01-31,40793.74,False,payment for subscription,2026-02-23 16:50:30.516232,Raw_GL_Export.csv
TXN000961,08/03/2025,07/29/2025,2025-08,AUS01,5800,CC1000,Slack,INV24002,PO1696,AUD,4334.74,GST,Payment for consulting,Workday,2025-03-08,2025-07-29,4334.74,False,payment for consulting,2026-02-23 16:50:30.516232,Raw_GL_Export.csv
TXN000962,2026-02-13,2026-02-08,2026-02,AUS01,5120,CC4100,Accenture Pty,INV94998,PO2701,AUD,15099.42,GST-FREE,Payment for services,Manual Entry,2026-02-13,2026-02-08,15099.42,False,payment for services,2026-02-23 16:50:30.516232,Raw_GL_Export.csv
TXN000963,07/07/2025,04/07/2025,2025-07,AUS01,5800,CC4000,Accenture Pty,INV85588,PO4072,GBP,337.36,INPUT,Payment for consulting,API Import,2025-07-07,2025-07-04,337.36,False,payment for consulting,2026-02-23 16:50:30.516232,Raw_GL_Export.csv
TXN000964,2026-01-08,2026-01-01,2026-01,AUS01,5200,CC4100,Federal Express,INV55123,,USD,37143.64,INPUT,Payment for license,Manual Entry,2026-01-08,2026-01-01,37143.64,False,payment for license,2026-02-23 16:50:30.516232,Raw_GL_Export.csv
TXN000965,05/19/2025,05/14/2025,2025-05,AUS01,5210,CC4100,Atlassian Pty,INV10190,PO7644,GBP,11549.47,EXPORT,Payment for license,Oracle,2025-05-19,2025-05-14,11549.47,False,payment for license,2026-02-23 16:50:30.516232,Raw_GL_Export.csv
TXN000966,01/24/2026,01/21/2026,2026-01,AUS01,5600,CC1200,Atlassian Pty,INV40258,PO1762,USD,6046.94,GST,Payment for services,Manual Entry,2026-01-24,2026-01-21,6046.94,False,payment for services,2026-02-23 16:50:30.516232,Raw_GL_Export.csv
TXN000967,05/02/2026,31/01/2026,2026-02,AUS01,5100,CC4100,AWS,INV64179,,USD,32303.92,GST,Payment for goods,Manual Entry,2026-02-05,2026-01-31,32303.92,False,payment for goods,2026-02-23 16:50:30.516232,Raw_GL_Export.csv
TXN000968,05/02/2026,03/02/2026,2026-02,AUS01,5920,CC3000,McKinsey,INV68118,PO3390,GBP,17104.74,INPUT,Payment for goods,Manual Entry,2026-02-05,2026-02-03,17104.74,False,payment for goods,2026-02-23 16:50:30.516232,Raw_GL_Export.csv
TXN000969,12/08/2025,08/08/2025,2025-08,AUS01,5500,CC3200,PWC,INV66792,PO2006,GBP,2297.11,GST,Payment for services,Manual Entry,2025-08-12,2025-08-08,2297.11,False,payment for services,2026-02-23 16:50:30.516232,Raw_GL_Export.csv
TXN000970,12/17/2025,12/13/2025,2025-12,AUS01,5410,CC1100,KPMG Australia,INV65856,PO8753,USD,12826.73,GST-FREE,Payment for license,SAP,2025-12-17,2025-12-13,12826.73,False,payment for license,2026-02-23 16:50:30.516232,Raw_GL_Export.csv
TXN000971,19-02-2026,13-02-2026,2026-02,AUS01,5300,CC2000,Optus Pty,INV72499,PO5417,USD,31010.55,INPUT,Payment for goods,Manual Entry,2026-02-19,2026-02-13,31010.55,False,payment for goods,2026-02-23 16:50:30.516232,Raw_GL_Export.csv
TXN000972,08-06-2025,05-06-2025,2025-06,AUS01,5000,CC2000,Hays,INV24394,,GBP,9927.39,GST-FREE,Payment for subscription,API Import,2025-06-08,2025-06-05,9927.39,False,payment for subscription,2026-02-23 16:50:30.516232,Raw_GL_Export.csv
TXN000973,2026-02-09,2026-02-04,2026-02,AUS01,5920,CC4000,EY Australia,INV41617,PO5130,GBP,1011.45,GST,Payment for goods,API Import,2026-02-09,2026-02-04,1011.45,False,payment for goods,2026-02-23 16:50:30.516232,Raw_GL_Export.csv
TXN000974,28/02/2026,20/02/2026,2026-02,AUS01,5510,CC1000,Zoom,INV84442,PO8881,AUD,14799.21,EXPORT,Payment for goods,Oracle,2026-02-28,2026-02-20,14799.21,False,payment for goods,2026-02-23 16:50:30.516232,Raw_GL_Export.csv
TXN000975,02/04/2026,01/28/2026,2026-02,AUS01,5220,CC2100,SAP,INV22594,PO4215,GBP,30175.65,INPUT,Payment for goods,Workday,2026-04-02,2026-01-28,30175.65,False,payment for goods,2026-02-23 16:50:30.516232,Raw_GL_Export.csv
TXN000976,02/02/2026,01/27/2026,2026-02,AUS01,5500,CC2000,BCG,INV19996,,GBP,10318.24,GST,Payment for goods,Oracle,2026-02-02,2026-01-27,10318.24,False,payment for goods,2026-02-23 16:50:30.516232,Raw_GL_Export.csv
TXN000977,2026-02-14,2026-02-10,2026-02,AUS01,5420,CC3100,Salesforce,INV27789,,AUD,30675.14,EXPORT,Payment for goods,Oracle,2026-02-14,2026-02-10,30675.14,False,payment for goods,2026-02-23 16:50:30.516232,Raw_GL_Export.csv
TXN000978,2026-01-12,2026-01-11,2026-01,AUS01,5220,CC1000,AusPost,INV37405,,AUD,44610.07,EXPORT,Payment for goods,API Import,2026-01-12,2026-01-11,44610.07,False,payment for goods,2026-02-23 16:50:30.516232,Raw_GL_Export.csv
TXN000979,2026-02-04,2026-01-30,2026-02,AUS01,5900,CC4100,Accenture Pty,INV80919,,AUD,21472.96,INPUT,Payment for services,Manual Entry,2026-02-04,2026-01-30,21472.96,False,payment for services,2026-02-23 16:50:30.516232,Raw_GL_Export.csv
TXN000980,27/12/2025,20/12/2025,2025-12,AUS01,5310,CC1100,Google,INV10012,PO6717,USD,41624.02,INPUT,Payment for subscription,Manual Entry,2025-12-27,2025-12-20,41624.02,False,payment for subscription,2026-02-23 16:50:30.516232,Raw_GL_Export.csv
TXN000981,18/06/2025,17/06/2025,2025-06,AUS01,5800,CC1100,Amazon,INV40699,PO3939,NZD,8745.25,GST-FREE,Payment for goods,Oracle,2025-06-18,2025-06-17,8745.25,False,payment for goods,2026-02-23 16:50:30.516232,Raw_GL_Export.csv
TXN000982,07/02/2026,02/02/2026,2026-02,AUS01,5420,CC1000,Optus Pty,INV25450,PO4345,USD,27877.21,GST,Payment for subscription,Workday,2026-02-07,2026-02-02,27877.21,False,payment for subscription,2026-02-23 16:50:30.516232,Raw_GL_Export.csv
TXN000983,27-02-2025,24-02-2025,2025-02,AUS01,5710,CC1100,Adobe,INV59091,,GBP,17076.07,GST-FREE,Payment for goods,Manual Entry,2025-02-27,2025-02-24,17076.07,False,payment for goods,2026-02-23 16:50:30.516232,Raw_GL_Export.csv
TXN000984,2026-02-04,2026-02-01,2026-02,AUS01,5200,CC1100,Zoom,INV31782,,GBP,4968.94,GST-FREE,Payment for license,API Import,2026-02-04,2026-02-01,4968.94,False,payment for license,2026-02-23 16:50:30.516232,Raw_GL_Export.csv
TXN000985,01/22/2026,01/14/2026,2026-01,AUS01,5120,CC4100,Workday,INV46592,PO4508,GBP,19177.4,EXPORT,Payment for services,Oracle,2026-01-22,2026-01-14,19177.4,False,payment for services,2026-02-23 16:50:30.516232,Raw_GL_Export.csv
TXN000986,02/13/2026,02/06/2026,2026-02,AUS01,5810,CC4000,LinkedIn Corp,INV26617,PO4764,AUD,39375.14,GST,Payment for license,SAP,2026-02-13,2026-06-02,39375.14,False,payment for license,2026-02-23 16:50:30.516232,Raw_GL_Export.csv
TXN000987,18-01-2025,11-01-2025,2025-01,AUS01,5620,CC4100,Slack,INV26571,,AUD,23356.15,GST-FREE,Payment for services,API Import,2025-01-18,2025-01-11,23356.15,False,payment for services,2026-02-23 16:50:30.516232,Raw_GL_Export.csv
TXN000988,2026-01-28,2026-01-24,2026-01,AUS01,5520,CC4000,Google,INV44033,,NZD,23675.91,GST,Payment for license,Oracle,2026-01-28,2026-01-24,23675.91,False,payment for license,2026-02-23 16:50:30.516232,Raw_GL_Export.csv
TXN000989,27/01/2026,26/01/2026,2026-01,AUS01,5410,CC3200,Workday,INV93394,,USD,36148.87,GST-FREE,Payment for goods,API Import,2026-01-27,2026-01-26,36148.87,False,payment for goods,2026-02-23 16:50:30.516232,Raw_GL_Export.csv
TXN000990,2025-02-15,2025-02-08,2025-02,AUS01,5800,CC4000,Google,INV54260,,NZD,20794.37,INPUT,Payment for services,SAP,2025-02-15,2025-02-08,20794.37,False,payment for services,2026-02-23 16:50:30.516232,Raw_GL_Export.csv
TXN000991,2026-01-25,2026-01-24,2026-01,AUS01,5020,CC3000,Adobe,INV73016,PO2609,AUD,3810.2,GST-FREE,Payment for consulting,API Import,2026-01-25,2026-01-24,3810.2,False,payment for consulting,2026-02-23 16:50:30.516232,Raw_GL_Export.csv
TXN000992,01/21/2026,01/20/2026,2026-01,AUS01,5900,CC4100,Amazon,INV59682,PO9257,USD,44479.29,INPUT,Payment for subscription,Workday,2026-01-21,2026-01-20,44479.29,False,payment for subscription,2026-02-23 16:50:30.516232,Raw_GL_Export.csv
TXN000993,09/12/2025,07/12/2025,2025-12,AUS01,5520,CC1200,Seek Limited,INV29736,,NZD,22152.15,GST,Payment for subscription,API Import,2025-12-09,2025-12-07,22152.15,False,payment for subscription,2026-02-23 16:50:30.516232,Raw_GL_Export.csv
TXN000994,2026-02-20,2026-02-14,2026-02,AUS01,5400,CC3200,Microsoft,INV88539,,GBP,21082.34,GST,Payment for subscription,Oracle,2026-02-20,2026-02-14,21082.34,False,payment for subscription,2026-02-23 16:50:30.516232,Raw_GL_Export.csv
TXN000995,01/13/2026,01/07/2026,2026-01,AUS01,5020,CC3000,PWC,INV40907,PO5414,USD,18292.73,GST,Payment for license,Oracle,2026-01-13,2026-07-01,18292.73,False,payment for license,2026-02-23 16:50:30.516232,Raw_GL_Export.csv
TXN000996,02/11/2026,02/10/2026,2026-02,AUS01,5320,CC2100,Adobe,INV91922,PO7663,GBP,32859.03,GST,Payment for goods,Oracle,2026-11-02,2026-10-02,32859.03,False,payment for goods,2026-02-23 16:50:30.516232,Raw_GL_Export.csv
TXN000997,14-02-2026,04-02-2026,2026-02,AUS01,5320,CC1000,Oracle,INV16158,PO7417,USD,2996.7,INPUT,Payment for subscription,API Import,2026-02-14,2026-02-04,2996.7,False,payment for subscription,2026-02-23 16:50:30.516232,Raw_GL_Export.csv
TXN000998,2026-02-04,2026-01-30,2026-02,AUS01,5620,CC2100,Oracle,INV77589,,GBP,22480.28,GST-FREE,Payment for goods,API Import,2026-02-04,2026-01-30,22480.28,False,payment for goods,2026-02-23 16:50:30.516232,Raw_GL_Export.csv
TXN000999,2026-02-21,2026-02-14,2026-02,AUS01,5220,CC2000,Zoom,INV91143,PO3799,AUD,6453.39,EXPORT,Payment for license,API Import,2026-02-21,2026-02-14,6453.39,False,payment for license,2026-02-23 16:50:30.516232,Raw_GL_Export.csv
TXN001000,02/21/2026,02/14/2026,2026-02,AUS01,5300,CC1200,Amazon,INV58268,PO9656,USD,39587.13,GST-FREE,Payment for consulting,Oracle,2026-02-21,2026-02-14,39587.13,False,payment for consulting,2026-02-23 16:50:30.516232,Raw_GL_Export.csv
TXN001001,02/04/2026,01/30/2026,2026-02,AUS01,5020,CC3200,Microsoft,INV30535,PO7122,GBP,13193.98,EXPORT,Payment for subscription,SAP,2026-04-02,2026-01-30,13193.98,False,payment for subscription,2026-02-23 16:50:30.516232,Raw_GL_Export.csv
TXN001002,06-01-2025,02-01-2025,2025-01,AUS01,5800,CC3000,BCG,INV97643,,USD,13293.11,GST,Payment for consulting,Workday,2025-01-06,2025-01-02,13293.11,False,payment for consulting,2026-02-23 16:50:30.516232,Raw_GL_Export.csv
TXN001003,03/14/2025,03/09/2025,2025-03,AUS01,5510,CC4100,Robert Half International,INV58283,,AUD,34764.46,GST,Payment for license,API Import,2025-03-14,2025-09-03,34764.46,False,payment for license,2026-02-23 16:50:30.516232,Raw_GL_Export.csv
TXN001004,02/06/2026,01/31/2026,2026-02,AUS01,5800,CC1200,LinkedIn Corp,INV14920,,AUD,30348.13,INPUT,Payment for services,Workday,2026-06-02,2026-01-31,30348.13,False,payment for services,2026-02-23 16:50:30.516232,Raw_GL_Export.csv
TXN001005,08/05/2025,04/05/2025,2025-05,AUS01,5200,CC3000,SAP,INV61736,PO3316,NZD,26461.76,GST,Payment for services,SAP,2025-05-08,2025-05-04,26461.76,False,payment for services,2026-02-23 16:50:30.516232,Raw_GL_Export.csv
TXN001006,04-02-2026,26-01-2026,2026-02,AUS01,5420,CC1100,MSFT,INV92689,PO9070,USD,10925.22,GST,Payment for goods,Oracle,2026-02-04,2026-01-26,10925.22,False,payment for goods,2026-02-23 16:50:30.516232,Raw_GL_Export.csv
TXN001007,02/13/2026,02/09/2026,2026-02,AUS01,5010,CC3100,Microsoft,INV52918,PO2561,AUD,43033.86,EXPORT,Payment for consulting,API Import,2026-02-13,2026-09-02,43033.86,False,payment for consulting,2026-02-23 16:50:30.516232,Raw_GL_Export.csv
TXN001008,28-01-2026,19-01-2026,2026-01,AUS01,5800,CC4000,AWS,INV13482,PO1481,AUD,41026.84,GST-FREE,Payment for license,SAP,2026-01-28,2026-01-19,41026.84,False,payment for license,2026-02-23 16:50:30.516232,Raw_GL_Export.csv
TXN001009,11-12-2025,09-12-2025,2025-12,AUS01,5520,CC1200,AWS,INV71901,PO9148,USD,31009.01,INPUT,Payment for subscription,Workday,2025-12-11,2025-12-09,31009.01,False,payment for subscription,2026-02-23 16:50:30.516232,Raw_GL_Export.csv
TXN001010,2025-09-27,2025-09-20,2025-09,AUS01,5000,CC4100,Workday,INV27553,PO2249,GBP,16618.93,INPUT,Payment for subscription,API Import,2025-09-27,2025-09-20,16618.93,False,payment for subscription,2026-02-23 16:50:30.516232,Raw_GL_Export.csv
TXN001011,2025-03-03,2025-02-22,2025-03,AUS01,5620,CC4100,KPMG Australia,INV40323,PO8820,AUD,24311.4,GST-FREE,Payment for subscription,SAP,2025-03-03,2025-02-22,24311.4,False,payment for subscription,2026-02-23 16:50:30.516232,Raw_GL_Export.csv
TXN001012,19/01/2026,12/01/2026,2026-01,AUS01,5200,CC1200,Adobe,INV19633,,USD,27334.92,GST-FREE,Payment for subscription,Workday,2026-01-19,2026-01-12,27334.92,False,payment for subscription,2026-02-23 16:50:30.516232,Raw_GL_Export.csv
TXN001013,11-10-2025,09-10-2025,2025-10,AUS01,5020,CC2100,Microsoft,INV15616,PO1348,NZD,5939.36,EXPORT,Payment for subscription,Oracle,2025-10-11,2025-10-09,5939.36,False,payment for subscription,2026-02-23 16:50:30.516232,Raw_GL_Export.csv
TXN001014,16-02-2026,09-02-2026,2026-02,AUS01,5410,CC1000,GCP,INV12355,PO4161,AUD,33610.8,EXPORT,Payment for services,API Import,2026-02-16,2026-02-09,33610.8,False,payment for services,2026-02-23 16:50:30.516232,Raw_GL_Export.csv
TXN001015,02/07/2026,01/31/2026,2026-02,AUS01,5400,CC4100,Google,INV19526,PO4487,AUD,17444.16,EXPORT,Payment for services,Oracle,2026-07-02,2026-01-31,17444.16,False,payment for services,2026-02-23 16:50:30.516232,Raw_GL_Export.csv
TXN001016,25/05/2025,20/05/2025,2025-05,AUS01,5310,CC3000,MSFT,INV67178,PO8952,GBP,22957.5,GST-FREE,Payment for consulting,Manual Entry,2025-05-25,2025-05-20,22957.5,False,payment for consulting,2026-02-23 16:50:30.516232,Raw_GL_Export.csv
TXN001017,25/01/2026,15/01/2026,2026-01,AUS01,5200,CC4000,Deloitte Touche,INV25181,,NZD,33759.88,GST,Payment for license,SAP,2026-01-25,2026-01-15,33759.88,False,payment for license,2026-02-23 16:50:30.516232,Raw_GL_Export.csv
TXN001018,26-01-2026,22-01-2026,2026-01,AUS01,5310,CC2100,Accenture Pty,INV63406,,GBP,38841.23,GST-FREE,Payment for goods,Workday,2026-01-26,2026-01-22,38841.23,False,payment for goods,2026-02-23 16:50:30.516232,Raw_GL_Export.csv
TXN001019,2026-02-20,2026-02-19,2026-02,AUS01,5100,CC3000,Optus Pty,INV76505,PO2062,AUD,27295.12,GST,Payment for subscription,Workday,2026-02-20,2026-02-19,27295.12,False,payment for subscription,2026-02-23 16:50:30.516232,Raw_GL_Export.csv
TXN001020,19/02/2026,18/02/2026,2026-02,AUS01,5710,CC3200,Deloitte Touche,INV91852,PO7158,USD,18188.19,EXPORT,Payment for subscription,API Import,2026-02-19,2026-02-18,18188.19,False,payment for subscription,2026-02-23 16:50:30.516232,Raw_GL_Export.csv
TXN001021,21-09-2025,19-09-2025,2025-09,AUS01,5510,CC2100,Zoom,INV29258,PO2686,NZD,26109.65,GST-FREE,Payment for subscription,SAP,2025-09-21,2025-09-19,26109.65,False,payment for subscription,2026-02-23 16:50:30.516232,Raw_GL_Export.csv
TXN001022,01/25/2026,01/15/2026,2026-01,AUS01,5610,CC2000,Oracle,INV48591,PO8043,USD,4965.13,GST-FREE,Payment for consulting,API Import,2026-01-25,2026-01-15,4965.13,False,payment for consulting,2026-02-23 16:50:30.516232,Raw_GL_Export.csv
TXN001023,2026-01-18,2026-01-11,2026-01,AUS01,5610,CC1000,Seek Limited,INV69923,PO1500,USD,17969.92,GST,Payment for consulting,Oracle,2026-01-18,2026-01-11,17969.92,False,payment for consulting,2026-02-23 16:50:30.516232,Raw_GL_Export.csv
TXN001024,24/01/2026,19/01/2026,2026-01,AUS01,5520,CC2000,ServiceNow Inc,INV95221,,NZD,30189.58,INPUT,Payment for license,Oracle,2026-01-24,2026-01-19,30189.58,False,payment for license,2026-02-23 16:50:30.516232,Raw_GL_Export.csv
TXN001025,2025-02-22,2025-02-17,2025-02,AUS01,5910,CC1000,WeWork Australia,INV28672,PO8113,GBP,39938.99,GST,Payment for subscription,SAP,2025-02-22,2025-02-17,39938.99,False,payment for subscription,2026-02-23 16:50:30.516232,Raw_GL_Export.csv
TXN001026,18/02/2026,11/02/2026,2026-02,AUS01,5600,CC3000,Zoom,INV82170,PO7198,GBP,29775.25,GST,Payment for subscription,Manual Entry,2026-02-18,2026-02-11,29775.25,False,payment for subscription,2026-02-23 16:50:30.516232,Raw_GL_Export.csv
TXN001027,2025-05-21,2025-05-17,2025-05,AUS01,5000,CC4000,Seek Limited,INV34941,PO6139,GBP,4511.55,GST-FREE,Payment for license,Workday,2025-05-21,2025-05-17,4511.55,False,payment for license,2026-02-23 16:50:30.516232,Raw_GL_Export.csv
TXN001028,2025-01-25,2025-01-20,2025-01,AUS01,5910,CC2000,PWC,INV87019,PO6091,GBP,24411.92,GST-FREE,Payment for license,Workday,2025-01-25,2025-01-20,24411.92,False,payment for license,2026-02-23 16:50:30.516232,Raw_GL_Export.csv
TXN001029,2025-03-21,2025-03-20,2025-03,AUS01,5910,CC1200,Seek Limited,INV88694,PO7378,USD,143.92,EXPORT,Payment for services,SAP,2025-03-21,2025-03-20,143.92,False,payment for services,2026-02-23 16:50:30.516232,Raw_GL_Export.csv
TXN001030,04-05-2025,25-04-2025,2025-05,AUS01,5200,CC1100,Google,INV13340,,USD,36662.69,INPUT,Payment for services,Manual Entry,2025-05-04,2025-04-25,36662.69,False,payment for services,2026-02-23 16:50:30.516232,Raw_GL_Export.csv
TXN001031,2026-01-17,2026-01-07,2026-01,AUS01,5620,CC2100,Google,INV52125,,NZD,28380.8,GST,Payment for consulting,Oracle,2026-01-17,2026-01-07,28380.8,False,payment for consulting,2026-02-23 16:50:30.516232,Raw_GL_Export.csv
TXN001032,28/01/2026,18/01/2026,2026-01,AUS01,5420,CC3100,Zoom,INV93558,,AUD,32875.94,GST-FREE,Payment for services,Manual Entry,2026-01-28,2026-01-18,32875.94,False,payment for services,2026-02-23 16:50:30.516232,Raw_GL_Export.csv
TXN001033,15-05-2025,05-05-2025,2025-05,AUS01,5300,CC3100,Adobe,INV28314,PO7744,AUD,32172.76,EXPORT,Payment for goods,API Import,2025-05-15,2025-05-05,32172.76,False,payment for goods,2026-02-23 16:50:30.516232,Raw_GL_Export.csv
TXN001034,01/05/2026,01/04/2026,2026-01,AUS01,5520,CC1100,Hays,INV31098,PO2094,GBP,41535.02,GST,Payment for subscription,SAP,2026-05-01,2026-04-01,41535.02,False,payment for subscription,2026-02-23 16:50:30.516232,Raw_GL_Export.csv
TXN001035,01/13/2026,01/11/2026,2026-01,AUS01,5200,CC2000,SAP,INV51182,PO3805,GBP,10521.88,GST-FREE,Payment for goods,Workday,2026-01-13,2026-11-01,10521.88,False,payment for goods,2026-02-23 16:50:30.516232,Raw_GL_Export.csv
TXN001036,2026-02-13,2026-02-05,2026-02,AUS01,5520,CC1100,LinkedIn Corp,INV98871,,AUD,9300.78,GST-FREE,Payment for license,Oracle,2026-02-13,2026-02-05,9300.78,False,payment for license,2026-02-23 16:50:30.516232,Raw_GL_Export.csv
TXN001037,01-06-2025,30-05-2025,2025-06,AUS01,5210,CC3100,Accenture Pty,INV81580,PO6651,NZD,6042.8,EXPORT,Payment for consulting,SAP,2025-06-01,2025-05-30,6042.8,False,payment for consulting,2026-02-23 16:50:30.516232,Raw_GL_Export.csv
TXN001038,07/01/2026,30/12/2025,2026-01,AUS01,5020,CC4000,KPMG Australia,INV32111,PO6292,NZD,11980.48,GST,Payment for services,Oracle,2026-01-07,2025-12-30,11980.48,False,payment for services,2026-02-23 16:50:30.516232,Raw_GL_Export.csv
TXN001039,28-02-2026,23-02-2026,2026-02,AUS01,5510,CC1000,GCP,INV40999,PO5098,GBP,12465.09,GST,Payment for services,Manual Entry,2026-02-28,2026-02-23,12465.09,False,payment for services,2026-02-23 16:50:30.516232,Raw_GL_Export.csv
TXN001040,2025-11-16,2025-11-13,2025-11,AUS01,5420,CC3200,Robert Half International,INV11836,PO2511,USD,41191.16,GST,Payment for consulting,API Import,2025-11-16,2025-11-13,41191.16,False,payment for consulting,2026-02-23 16:50:30.516232,Raw_GL_Export.csv
TXN001041,18/12/2025,16/12/2025,2025-12,AUS01,5620,CC2000,Deloitte Touche,INV74396,PO8175,GBP,7805.72,INPUT,Payment for goods,Manual Entry,2025-12-18,2025-12-16,7805.72,False,payment for goods,2026-02-23 16:50:30.516232,Raw_GL_Export.csv
TXN001042,28/02/2026,19/02/2026,2026-02,AUS01,5210,CC1100,Robert Half International,INV63533,,USD,24503.68,INPUT,Payment for goods,API Import,2026-02-28,2026-02-19,24503.68,False,payment for goods,2026-02-23 16:50:30.516232,Raw_GL_Export.csv
TXN001043,25-02-2026,24-02-2026,2026-02,AUS01,5500,CC4100,Telstra Corp,INV69450,PO2000,GBP,30665.46,GST,Payment for consulting,Manual Entry,2026-02-25,2026-02-24,30665.46,False,payment for consulting,2026-02-23 16:50:30.516232,Raw_GL_Export.csv
TXN001044,08-03-2025,27-02-2025,2025-03,AUS01,5810,CC1200,AWS,INV80860,,NZD,34427.67,EXPORT,Payment for goods,Oracle,2025-03-08,2025-02-27,34427.67,False,payment for goods,2026-02-23 16:50:30.516232,Raw_GL_Export.csv
TXN001045,02/08/2026,02/02/2026,2026-02,AUS01,5700,CC1200,Google,INV11944,PO9832,GBP,30575.75,INPUT,Payment for consulting,SAP,2026-08-02,2026-02-02,30575.75,False,payment for consulting,2026-02-23 16:50:30.516232,Raw_GL_Export.csv
TXN001046,04/22/2025,04/15/2025,2025-04,AUS01,5600,CC1200,Salesforce,INV52911,PO8482,USD,3366.62,GST-FREE,Payment for license,SAP,2025-04-22,2025-04-15,3366.62,False,payment for license,2026-02-23 16:50:30.516232,Raw_GL_Export.csv
TXN001047,01/18/2026,01/14/2026,2026-01,AUS01,5410,CC4100,KPMG Australia,INV14952,PO1555,AUD,42893.6,GST-FREE,Payment for license,Oracle,2026-01-18,2026-01-14,42893.6,False,payment for license,2026-02-23 16:50:30.516232,Raw_GL_Export.csv
TXN001048,22-02-2026,12-02-2026,2026-02,AUS01,5710,CC2100,Robert Half International,INV89376,PO9391,NZD,29211.84,INPUT,Payment for license,SAP,2026-02-22,2026-02-12,29211.84,False,payment for license,2026-02-23 16:50:30.516232,Raw_GL_Export.csv
TXN001049,2026-02-21,2026-02-16,2026-02,AUS01,5320,CC3200,Robert Half International,INV95830,PO6848,GBP,43313.11,GST,Payment for goods,Oracle,2026-02-21,2026-02-16,43313.11,False,payment for goods,2026-02-23 16:50:30.516232,Raw_GL_Export.csv
TXN001050,18-03-2025,10-03-2025,2025-03,AUS01,5400,CC3200,SAP,INV46031,PO2277,USD,1277.18,EXPORT,Payment for license,SAP,2025-03-18,2025-03-10,1277.18,False,payment for license,2026-02-23 16:50:30.516232,Raw_GL_Export.csv
TXN001051,24-10-2025,16-10-2025,2025-10,AUS01,5610,CC4000,Hays,INV76296,PO3521,GBP,24434.76,EXPORT,Payment for goods,Workday,2025-10-24,2025-10-16,24434.76,False,payment for goods,2026-02-23 16:50:30.516232,Raw_GL_Export.csv
TXN001052,17/02/2026,09/02/2026,2026-02,AUS01,5800,CC1000,McKinsey,INV99435,PO4890,AUD,17996.86,GST-FREE,Payment for subscription,SAP,2026-02-17,2026-02-09,17996.86,False,payment for subscription,2026-02-23 16:50:30.516232,Raw_GL_Export.csv
TXN001053,12/23/2025,12/22/2025,2025-12,AUS01,5700,CC3000,Federal Express,INV99864,PO1627,GBP,32773.22,INPUT,Payment for services,SAP,2025-12-23,2025-12-22,32773.22,False,payment for services,2026-02-23 16:50:30.516232,Raw_GL_Export.csv
TXN001054,02/06/2026,01/28/2026,2026-02,AUS01,5120,CC3000,Regus Australia,INV70383,PO4213,NZD,11379.14,EXPORT,Payment for goods,Workday,2026-06-02,2026-01-28,11379.14,False,payment for goods,2026-02-23 16:50:30.516232,Raw_GL_Export.csv
TXN001055,02/27/2026,02/24/2026,2026-02,AUS01,5620,CC2000,Slack,INV35502,PO2689,NZD,35550.13,GST-FREE,Payment for subscription,Manual Entry,2026-02-27,2026-02-24,35550.13,False,payment for subscription,2026-02-23 16:50:30.516232,Raw_GL_Export.csv
TXN001056,01/06/2026,01/04/2026,2026-01,AUS01,5700,CC3000,Oracle,INV33317,PO6625,NZD,32536.7,EXPORT,Payment for consulting,Oracle,2026-06-01,2026-04-01,32536.7,False,payment for consulting,2026-02-23 16:50:30.516232,Raw_GL_Export.csv
TXN001057,19/01/2026,12/01/2026,2026-01,AUS01,5600,CC2000,ServiceNow Inc,INV23398,,NZD,23885.37,INPUT,Payment for license,SAP,2026-01-19,2026-01-12,23885.37,False,payment for license,2026-02-23 16:50:30.516232,Raw_GL_Export.csv
TXN001058,18-02-2026,12-02-2026,2026-02,AUS01,5320,CC1000,Hays,INV12048,PO8991,NZD,43036.03,INPUT,Payment for subscription,Workday,2026-02-18,2026-02-12,43036.03,False,payment for subscription,2026-02-23 16:50:30.516232,Raw_GL_Export.csv
TXN001059,2026-02-08,2026-02-04,2026-02,AUS01,5300,CC4100,Atlassian Pty,INV73074,PO3700,AUD,41691.71,GST,Payment for services,Oracle,2026-02-08,2026-02-04,41691.71,False,payment for services,2026-02-23 16:50:30.516232,Raw_GL_Export.csv
TXN001060,09/17/2025,09/07/2025,2025-09,AUS01,5210,CC2100,Microsoft,INV61711,PO6328,AUD,37751.47,GST-FREE,Payment for subscription,Manual Entry,2025-09-17,2025-07-09,37751.47,False,payment for subscription,2026-02-23 16:50:30.516232,Raw_GL_Export.csv
TXN001061,01/04/2026,12/29/2025,2026-01,AUS01,5200,CC1100,Workday,INV64982,PO9593,USD,16538.34,GST-FREE,Payment for services,Oracle,2026-04-01,2025-12-29,16538.34,False,payment for services,2026-02-23 16:50:30.516232,Raw_GL_Export.csv
TXN001062,26-01-2026,18-01-2026,2026-01,AUS01,5920,CC3000,Microsoft,INV29619,PO2787,AUD,43195.03,INPUT,Payment for subscription,SAP,2026-01-26,2026-01-18,43195.03,False,payment for subscription,2026-02-23 16:50:30.516232,Raw_GL_Export.csv
TXN001063,02/02/2026,01/30/2026,2026-02,AUS01,5420,CC3100,Atlassian Pty,INV72654,,GBP,25310.7,GST-FREE,Payment for subscription,Oracle,2026-02-02,2026-01-30,25310.7,False,payment for subscription,2026-02-23 16:50:30.516232,Raw_GL_Export.csv
TXN001064,02/08/2026,02/01/2026,2026-02,AUS01,5120,CC1200,BCG,INV86489,PO8369,GBP,18782.13,INPUT,Payment for license,Manual Entry,2026-08-02,2026-01-02,18782.13,False,payment for license,2026-02-23 16:50:30.516232,Raw_GL_Export.csv
TXN001065,01/09/2025,01/06/2025,2025-01,AUS01,5110,CC3200,BCG,INV80955,PO7913,NZD,44243.61,INPUT,Payment for subscription,Workday,2025-09-01,2025-06-01,44243.61,False,payment for subscription,2026-02-23 16:50:30.516232,Raw_GL_Export.csv
TXN001066,02/26/2026,02/23/2026,2026-02,AUS01,5510,CC1200,EY Australia,INV53554,,AUD,43546.78,EXPORT,Payment for services,SAP,2026-02-26,2026-02-23,43546.78,False,payment for services,2026-02-23 16:50:30.516232,Raw_GL_Export.csv
TXN001067,02/01/2026,28/12/2025,2026-01,AUS01,5320,CC2000,ServiceNow Inc,INV94233,PO2896,AUD,43134.91,GST-FREE,Payment for subscription,Workday,2026-01-02,2025-12-28,43134.91,False,payment for subscription,2026-02-23 16:50:30.516232,Raw_GL_Export.csv
TXN001068,03/01/2026,02/01/2026,2026-01,AUS01,5310,CC3000,Seek Limited,INV82816,PO2644,AUD,23528.23,EXPORT,Payment for subscription,Workday,2026-01-03,2026-01-02,23528.23,False,payment for subscription,2026-02-23 16:50:30.516232,Raw_GL_Export.csv
TXN001069,10-02-2026,03-02-2026,2026-02,AUS01,5600,CC4100,Hays,INV65452,PO8226,USD,22531.34,GST-FREE,Payment for subscription,Manual Entry,2026-02-10,2026-02-03,22531.34,False,payment for subscription,2026-02-23 16:50:30.516232,Raw_GL_Export.csv
TXN001070,2026-01-05,2026-01-02,2026-01,AUS01,5320,CC4000,Adobe,INV78921,,NZD,13027.31,GST,Payment for goods,API Import,2026-01-05,2026-01-02,13027.31,False,payment for goods,2026-02-23 16:50:30.516232,Raw_GL_Export.csv
TXN001071,2025-03-26,2025-03-23,2025-03,AUS01,5200,CC1100,Slack,INV92170,PO2517,USD,27335.41,GST,Payment for services,Manual Entry,2025-03-26,2025-03-23,27335.41,False,payment for services,2026-02-23 16:50:30.516232,Raw_GL_Export.csv
TXN001072,2026-01-24,2026-01-22,2026-01,AUS01,5510,CC2000,AusPost,INV82449,PO1396,NZD,22080.25,GST-FREE,Payment for license,Oracle,2026-01-24,2026-01-22,22080.25,False,payment for license,2026-02-23 16:50:30.516232,Raw_GL_Export.csv
TXN001073,25-01-2026,18-01-2026,2026-01,AUS01,5510,CC1100,LinkedIn Corp,INV72924,PO5265,USD,35432.84,INPUT,Payment for subscription,API Import,2026-01-25,2026-01-18,35432.84,False,payment for subscription,2026-02-23 16:50:30.516232,Raw_GL_Export.csv
TXN001074,02/21/2026,02/13/2026,2026-02,AUS01,5110,CC3100,Zoom,INV76968,PO8431,AUD,14712.0,GST,Payment for consulting,API Import,2026-02-21,2026-02-13,14712.0,False,payment for consulting,2026-02-23 16:50:30.516232,Raw_GL_Export.csv
TXN001075,2025-04-08,2025-04-01,2025-04,AUS01,5010,CC4000,Oracle,INV33009,,GBP,43219.74,EXPORT,Payment for goods,Oracle,2025-04-08,2025-04-01,43219.74,False,payment for goods,2026-02-23 16:50:30.516232,Raw_GL_Export.csv
TXN001076,15/02/2026,05/02/2026,2026-02,AUS01,5620,CC4100,Oracle,INV30341,PO4507,AUD,14729.44,GST-FREE,Payment for consulting,Oracle,2026-02-15,2026-02-05,14729.44,False,payment for consulting,2026-02-23 16:50:30.516232,Raw_GL_Export.csv
TXN001077,04-02-2026,29-01-2026,2026-02,AUS01,5700,CC4100,Salesforce,INV40992,PO6326,NZD,10708.62,GST-FREE,Payment for subscription,Oracle,2026-02-04,2026-01-29,10708.62,False,payment for subscription,2026-02-23 16:50:30.516232,Raw_GL_Export.csv
TXN001078,26/02/2026,20/02/2026,2026-02,AUS01,5520,CC2100,PWC,INV74631,,GBP,5584.83,EXPORT,Payment for consulting,Workday,2026-02-26,2026-02-20,5584.83,False,payment for consulting,2026-02-23 16:50:30.516232,Raw_GL_Export.csv
TXN001079,2026-02-08,2026-01-29,2026-02,AUS01,5310,CC2100,Deloitte Touche,INV33653,PO8189,GBP,27543.46,GST,Payment for services,Oracle,2026-02-08,2026-01-29,27543.46,False,payment for services,2026-02-23 16:50:30.516232,Raw_GL_Export.csv
TXN001080,19/01/2026,11/01/2026,2026-01,AUS01,5020,CC1200,MSFT,INV79074,PO2843,NZD,11167.37,EXPORT,Payment for goods,Manual Entry,2026-01-19,2026-01-11,11167.37,False,payment for goods,2026-02-23 16:50:30.516232,Raw_GL_Export.csv
TXN001081,03/23/2025,03/20/2025,2025-03,AUS01,5600,CC4000,Accenture Pty,INV27657,PO7506,USD,6800.86,GST,Payment for services,API Import,2025-03-23,2025-03-20,6800.86,False,payment for services,2026-02-23 16:50:30.516232,Raw_GL_Export.csv
TXN001082,07/01/2026,06/01/2026,2026-01,AUS01,5010,CC2100,Hays,INV55785,PO7098,GBP,23386.22,EXPORT,Payment for license,Workday,2026-01-07,2026-01-06,23386.22,False,payment for license,2026-02-23 16:50:30.516232,Raw_GL_Export.csv
TXN001083,06/11/2025,28/10/2025,2025-11,AUS01,5400,CC1000,Microsoft,INV40970,PO2343,USD,878.43,INPUT,Payment for license,API Import,2025-11-06,2025-10-28,878.43,False,payment for license,2026-02-23 16:50:30.516232,Raw_GL_Export.csv
TXN001084,2026-01-11,2026-01-03,2026-01,AUS01,5020,CC3000,Adobe,INV12993,PO3743,USD,39253.1,GST,Payment for license,Workday,2026-01-11,2026-01-03,39253.1,False,payment for license,2026-02-23 16:50:30.516232,Raw_GL_Export.csv
TXN001085,2026-01-22,2026-01-20,2026-01,AUS01,5300,CC2000,Seek Limited,INV17430,PO4216,NZD,29453.59,GST-FREE,Payment for services,API Import,2026-01-22,2026-01-20,29453.59,False,payment for services,2026-02-23 16:50:30.516232,Raw_GL_Export.csv
TXN001086,14-01-2026,12-01-2026,2026-01,AUS01,5200,CC4100,Hays,INV29029,PO3472,AUD,27430.5,GST,Payment for goods,SAP,2026-01-14,2026-01-12,27430.5,False,payment for goods,2026-02-23 16:50:30.516232,Raw_GL_Export.csv
TXN001087,07/02/2026,05/02/2026,2026-02,AUS01,5920,CC3200,AusPost,INV17012,,GBP,33894.43,GST-FREE,Payment for services,SAP,2026-02-07,2026-02-05,33894.43,False,payment for services,2026-02-23 16:50:30.516232,Raw_GL_Export.csv
TXN001088,04-02-2026,28-01-2026,2026-02,AUS01,5100,CC1200,Oracle,INV68522,,AUD,5530.96,GST,Payment for subscription,API Import,2026-02-04,2026-01-28,5530.96,False,payment for subscription,2026-02-23 16:50:30.516232,Raw_GL_Export.csv
TXN001089,25-06-2025,21-06-2025,2025-06,AUS01,5200,CC4100,Workday,INV66550,PO4414,AUD,13283.19,GST-FREE,Payment for license,SAP,2025-06-25,2025-06-21,13283.19,False,payment for license,2026-02-23 16:50:30.516232,Raw_GL_Export.csv
TXN001090,22/04/2025,14/04/2025,2025-04,AUS01,5620,CC2100,GCP,INV33086,,USD,34419.77,INPUT,Payment for subscription,SAP,2025-04-22,2025-04-14,34419.77,False,payment for subscription,2026-02-23 16:50:30.516232,Raw_GL_Export.csv
TXN001091,26-02-2025,17-02-2025,2025-02,AUS01,5110,CC3000,AWS,INV88161,,NZD,44191.07,GST-FREE,Payment for goods,SAP,2025-02-26,2025-02-17,44191.07,False,payment for goods,2026-02-23 16:50:30.516232,Raw_GL_Export.csv
TXN001092,27/01/2026,21/01/2026,2026-01,AUS01,5320,CC3100,Salesforce,INV97418,PO6656,AUD,36260.76,GST-FREE,Payment for goods,API Import,2026-01-27,2026-01-21,36260.76,False,payment for goods,2026-02-23 16:50:30.516232,Raw_GL_Export.csv
TXN001093,2026-02-16,2026-02-14,2026-02,AUS01,5210,CC3200,Atlassian Pty,INV57056,PO9841,USD,12468.24,EXPORT,Payment for subscription,Manual Entry,2026-02-16,2026-02-14,12468.24,False,payment for subscription,2026-02-23 16:50:30.516232,Raw_GL_Export.csv
TXN001094,10/01/2026,06/01/2026,2026-01,AUS01,5920,CC1000,Deloitte Touche,INV13361,,AUD,39975.79,GST-FREE,Payment for consulting,SAP,2026-01-10,2026-01-06,39975.79,False,payment for consulting,2026-02-23 16:50:30.516232,Raw_GL_Export.csv
TXN001095,2026-01-14,2026-01-08,2026-01,AUS01,5610,CC1200,Seek Limited,INV17904,,USD,25133.03,INPUT,Payment for license,SAP,2026-01-14,2026-01-08,25133.03,False,payment for license,2026-02-23 16:50:30.516232,Raw_GL_Export.csv
TXN001096,2026-01-15,2026-01-08,2026-01,AUS01,5410,CC4100,Amazon,INV46883,PO2753,GBP,10346.24,GST-FREE,Payment for subscription,Workday,2026-01-15,2026-01-08,10346.24,False,payment for subscription,2026-02-23 16:50:30.516232,Raw_GL_Export.csv
TXN001097,09/10/2025,08/10/2025,2025-10,AUS01,5210,CC2100,Microsoft,INV90758,PO7644,USD,2733.29,GST,Payment for consulting,API Import,2025-10-09,2025-10-08,2733.29,False,payment for consulting,2026-02-23 16:50:30.516232,Raw_GL_Export.csv
TXN001098,25-08-2025,19-08-2025,2025-08,AUS01,5410,CC2100,Salesforce,INV58754,,NZD,19982.27,INPUT,Payment for goods,Oracle,2025-08-25,2025-08-19,19982.27,False,payment for goods,2026-02-23 16:50:30.516232,Raw_GL_Export.csv
TXN001099,09-02-2026,07-02-2026,2026-02,AUS01,5110,CC2100,LinkedIn Corp,INV82737,,GBP,222.67,GST,Payment for services,API Import,2026-02-09,2026-02-07,222.67,False,payment for services,2026-02-23 16:50:30.516232,Raw_GL_Export.csv
TXN001100,2025-04-04,2025-03-31,2025-04,AUS01,5000,CC3100,ServiceNow Inc,INV21793,PO7943,AUD,20274.73,INPUT,Payment for license,SAP,2025-04-04,2025-03-31,20274.73,False,payment for license,2026-02-23 16:50:30.516232,Raw_GL_Export.csv
TXN001101,2025-02-18,2025-02-09,2025-02,AUS01,5100,CC3000,Optus Pty,INV24179,PO1996,AUD,6751.13,GST,Payment for consulting,SAP,2025-02-18,2025-02-09,6751.13,False,payment for consulting,2026-02-23 16:50:30.516232,Raw_GL_Export.csv
TXN001102,2025-08-07,2025-07-31,2025-08,AUS01,5420,CC1100,Accenture Pty,INV53534,,AUD,20841.38,GST-FREE,Payment for services,Workday,2025-08-07,2025-07-31,20841.38,False,payment for services,2026-02-23 16:50:30.516232,Raw_GL_Export.csv
TXN001103,09/12/2025,09/04/2025,2025-09,AUS01,5300,CC2000,DHL Express,INV13249,,USD,5227.84,GST-FREE,Payment for consulting,Oracle,2025-12-09,2025-04-09,5227.84,False,payment for consulting,2026-02-23 16:50:30.516232,Raw_GL_Export.csv
TXN001104,01/12/2025,01/04/2025,2025-01,AUS01,5410,CC3100,Deloitte Touche,INV83565,,GBP,1432.81,GST,Payment for goods,Oracle,2025-12-01,2025-04-01,1432.81,False,payment for goods,2026-02-23 16:50:30.516232,Raw_GL_Export.csv
TXN001105,20-03-2025,17-03-2025,2025-03,AUS01,5910,CC3200,Deloitte Touche,INV29518,,GBP,40044.68,EXPORT,Payment for license,SAP,2025-03-20,2025-03-17,40044.68,False,payment for license,2026-02-23 16:50:30.516232,Raw_GL_Export.csv
TXN001106,17/02/2026,14/02/2026,2026-02,AUS01,5710,CC3200,Amazon,INV62819,PO2641,AUD,2685.38,INPUT,Payment for subscription,Workday,2026-02-17,2026-02-14,2685.38,False,payment for subscription,2026-02-23 16:50:30.516232,Raw_GL_Export.csv
TXN001107,2026-02-21,2026-02-19,2026-02,AUS01,5900,CC1100,MSFT,INV26295,PO1611,GBP,26524.29,EXPORT,Payment for services,Workday,2026-02-21,2026-02-19,26524.29,False,payment for services,2026-02-23 16:50:30.516232,Raw_GL_Export.csv
TXN001108,19/02/2026,10/02/2026,2026-02,AUS01,5810,CC4000,Salesforce,INV42675,PO2077,NZD,25880.18,INPUT,Payment for subscription,Oracle,2026-02-19,2026-02-10,25880.18,False,payment for subscription,2026-02-23 16:50:30.516232,Raw_GL_Export.csv
TXN001109,01/02/2026,12/23/2025,2026-01,AUS01,5610,CC4000,Microsoft,INV61773,PO9670,NZD,29131.62,EXPORT,Payment for consulting,Oracle,2026-02-01,2025-12-23,29131.62,False,payment for consulting,2026-02-23 16:50:30.516232,Raw_GL_Export.csv
TXN001110,2025-12-21,2025-12-17,2025-12,AUS01,5420,CC4100,Optus Pty,INV89034,PO5794,AUD,36633.57,EXPORT,Payment for services,Manual Entry,2025-12-21,2025-12-17,36633.57,False,payment for services,2026-02-23 16:50:30.516232,Raw_GL_Export.csv
TXN001111,2026-01-13,2026-01-10,2026-01,AUS01,5200,CC3200,KPMG Australia,INV42537,,AUD,21877.46,INPUT,Payment for goods,Workday,2026-01-13,2026-01-10,21877.46,False,payment for goods,2026-02-23 16:50:30.516232,Raw_GL_Export.csv
TXN001112,14/02/2026,10/02/2026,2026-02,AUS01,5800,CC4000,KPMG Australia,INV11921,,AUD,44805.61,EXPORT,Payment for subscription,Oracle,2026-02-14,2026-02-10,44805.61,False,payment for subscription,2026-02-23 16:50:30.516232,Raw_GL_Export.csv
TXN001113,14/01/2026,13/01/2026,2026-01,AUS01,5200,CC3200,MSFT,INV23853,,GBP,36909.64,GST-FREE,Payment for services,Oracle,2026-01-14,2026-01-13,36909.64,False,payment for services,2026-02-23 16:50:30.516232,Raw_GL_Export.csv
TXN001114,2026-01-22,2026-01-17,2026-01,AUS01,5100,CC4000,Google,INV29215,PO2368,USD,16685.03,EXPORT,Payment for consulting,SAP,2026-01-22,2026-01-17,16685.03,False,payment for consulting,2026-02-23 16:50:30.516232,Raw_GL_Export.csv
TXN001115,12/24/2025,12/15/2025,2025-12,AUS01,5000,CC1100,DHL Express,INV31065,PO8393,NZD,13754.72,GST-FREE,Payment for subscription,API Import,2025-12-24,2025-12-15,13754.72,False,payment for subscription,2026-02-23 16:50:30.516232,Raw_GL_Export.csv
TXN001116,17/02/2026,07/02/2026,2026-02,AUS01,5420,CC4000,Regus Australia,INV18089,PO5251,GBP,41969.56,GST-FREE,Payment for license,SAP,2026-02-17,2026-02-07,41969.56,False,payment for license,2026-02-23 16:50:30.516232,Raw_GL_Export.csv
TXN001117,14-01-2026,08-01-2026,2026-01,AUS01,5500,CC1100,Oracle,INV49263,PO2499,USD,17173.22,GST,Payment for services,Oracle,2026-01-14,2026-01-08,17173.22,False,payment for services,2026-02-23 16:50:30.516232,Raw_GL_Export.csv
TXN001118,17-02-2026,07-02-2026,2026-02,AUS01,5220,CC1200,Telstra Corp,INV85837,PO8817,USD,20904.82,EXPORT,Payment for services,Workday,2026-02-17,2026-02-07,20904.82,False,payment for services,2026-02-23 16:50:30.516232,Raw_GL_Export.csv
TXN001119,02/02/2026,01/29/2026,2026-02,AUS01,5710,CC1100,Deloitte Touche,INV24744,PO1721,AUD,35576.24,EXPORT,Payment for consulting,API Import,2026-02-02,2026-01-29,35576.24,False,payment for consulting,2026-02-23 16:50:30.516232,Raw_GL_Export.csv
TXN001120,21/02/2026,18/02/2026,2026-02,AUS01,5500,CC2100,ServiceNow Inc,INV24025,PO8540,NZD,32556.65,INPUT,Payment for license,Manual Entry,2026-02-21,2026-02-18,32556.65,False,payment for license,2026-02-23 16:50:30.516232,Raw_GL_Export.csv
TXN001121,11/06/2025,11/05/2025,2025-11,AUS01,5610,CC3100,KPMG Australia,INV44711,PO8033,GBP,17329.51,GST-FREE,Payment for services,Workday,2025-06-11,2025-05-11,17329.51,False,payment for services,2026-02-23 16:50:30.516232,Raw_GL_Export.csv
TXN001122,01/15/2026,01/12/2026,2026-01,AUS01,5020,CC3200,AWS,INV60585,,USD,25281.41,GST,Payment for subscription,API Import,2026-01-15,2026-12-01,25281.41,False,payment for subscription,2026-02-23 16:50:30.516232,Raw_GL_Export.csv
TXN001123,25/03/2025,18/03/2025,2025-03,AUS01,5220,CC4000,Slack,INV44854,PO9727,AUD,22663.72,GST-FREE,Payment for license,Oracle,2025-03-25,2025-03-18,22663.72,False,payment for license,2026-02-23 16:50:30.516232,Raw_GL_Export.csv
TXN001124,2026-01-20,2026-01-13,2026-01,AUS01,5110,CC2100,DHL Express,INV88897,PO7961,GBP,6895.11,EXPORT,Payment for services,API Import,2026-01-20,2026-01-13,6895.11,False,payment for services,2026-02-23 16:50:30.516232,Raw_GL_Export.csv
TXN001125,2025-03-27,2025-03-25,2025-03,AUS01,5300,CC1100,Workday,INV56890,PO3674,AUD,26433.76,GST-FREE,Payment for goods,Manual Entry,2025-03-27,2025-03-25,26433.76,False,payment for goods,2026-02-23 16:50:30.516232,Raw_GL_Export.csv
TXN001126,04/01/2026,31/12/2025,2026-01,AUS01,5500,CC3100,AWS,INV15739,PO6262,NZD,8477.46,GST-FREE,Payment for license,API Import,2026-01-04,2025-12-31,8477.46,False,payment for license,2026-02-23 16:50:30.516232,Raw_GL_Export.csv
TXN001127,04-02-2026,29-01-2026,2026-02,AUS01,5810,CC1000,Adobe,INV49595,PO5295,NZD,40798.67,INPUT,Payment for services,API Import,2026-02-04,2026-01-29,40798.67,False,payment for services,2026-02-23 16:50:30.516232,Raw_GL_Export.csv
TXN001128,04-07-2025,28-06-2025,2025-07,AUS01,5620,CC1000,SAP,INV62699,PO8701,NZD,12384.64,EXPORT,Payment for consulting,SAP,2025-07-04,2025-06-28,12384.64,False,payment for consulting,2026-02-23 16:50:30.516232,Raw_GL_Export.csv
TXN001129,25/01/2026,20/01/2026,2026-01,AUS01,5610,CC4000,Microsoft,INV82240,,AUD,38996.81,EXPORT,Payment for subscription,SAP,2026-01-25,2026-01-20,38996.81,False,payment for subscription,2026-02-23 16:50:30.516232,Raw_GL_Export.csv
TXN001130,01/15/2026,01/08/2026,2026-01,AUS01,5510,CC1100,ServiceNow Inc,INV92128,PO5342,NZD,28052.38,EXPORT,Payment for license,Manual Entry,2026-01-15,2026-08-01,28052.38,False,payment for license,2026-02-23 16:50:30.516232,Raw_GL_Export.csv
TXN001131,20/06/2025,10/06/2025,2025-06,AUS01,5400,CC4100,Optus Pty,INV84346,PO2479,NZD,41870.91,EXPORT,Payment for subscription,Workday,2025-06-20,2025-06-10,41870.91,False,payment for subscription,2026-02-23 16:50:30.516232,Raw_GL_Export.csv
TXN001132,02/19/2026,02/13/2026,2026-02,AUS01,5900,CC1000,Atlassian Pty,INV17679,PO8827,AUD,27655.0,GST-FREE,Payment for subscription,Oracle,2026-02-19,2026-02-13,27655.0,False,payment for subscription,2026-02-23 16:50:30.516232,Raw_GL_Export.csv
TXN001133,23-02-2025,22-02-2025,2025-02,AUS01,5320,CC1100,Salesforce,INV39762,PO9811,GBP,3629.42,GST,Payment for license,Manual Entry,2025-02-23,2025-02-22,3629.42,False,payment for license,2026-02-23 16:50:30.516232,Raw_GL_Export.csv
TXN001134,07-10-2025,01-10-2025,2025-10,AUS01,5210,CC3100,Slack,INV52946,PO1914,AUD,23208.58,INPUT,Payment for consulting,Manual Entry,2025-10-07,2025-10-01,23208.58,False,payment for consulting,2026-02-23 16:50:30.516232,Raw_GL_Export.csv
TXN001135,2026-01-01,2025-12-31,2026-01,AUS01,5610,CC4100,EY Australia,INV33452,,USD,13512.23,INPUT,Payment for consulting,Manual Entry,2026-01-01,2025-12-31,13512.23,False,payment for consulting,2026-02-23 16:50:30.516232,Raw_GL_Export.csv
TXN001136,02/22/2026,02/13/2026,2026-02,AUS01,5610,CC3100,Telstra Corp,INV67121,,GBP,18529.67,INPUT,Payment for services,Workday,2026-02-22,2026-02-13,18529.67,False,payment for services,2026-02-23 16:50:30.516232,Raw_GL_Export.csv
TXN001137,11-08-2025,05-08-2025,2025-08,AUS01,5500,CC3200,BCG,INV51803,PO4150,AUD,25747.34,INPUT,Payment for license,API Import,2025-08-11,2025-08-05,25747.34,False,payment for license,2026-02-23 16:50:30.516232,Raw_GL_Export.csv
TXN001138,01-02-2026,29-01-2026,2026-02,AUS01,5210,CC3000,Deloitte Touche,INV93038,,GBP,39427.27,GST-FREE,Payment for consulting,Workday,2026-02-01,2026-01-29,39427.27,False,payment for consulting,2026-02-23 16:50:30.516232,Raw_GL_Export.csv
TXN001139,09/23/2025,09/22/2025,2025-09,AUS01,5100,CC3100,BCG,INV11200,PO7971,NZD,10377.71,GST,Payment for goods,Oracle,2025-09-23,2025-09-22,10377.71,False,payment for goods,2026-02-23 16:50:30.516232,Raw_GL_Export.csv
TXN001140,04/01/2026,01/01/2026,2026-01,AUS01,5300,CC1200,Optus Pty,INV96067,PO7573,GBP,43398.6,EXPORT,Payment for goods,Workday,2026-01-04,2026-01-01,43398.6,False,payment for goods,2026-02-23 16:50:30.516232,Raw_GL_Export.csv
TXN001141,2026-01-20,2026-01-13,2026-01,AUS01,5000,CC1100,Google,INV22097,PO9247,USD,12713.78,GST,Payment for subscription,API Import,2026-01-20,2026-01-13,12713.78,False,payment for subscription,2026-02-23 16:50:30.516232,Raw_GL_Export.csv
TXN001142,26-01-2026,25-01-2026,2026-01,AUS01,5000,CC4000,AWS,INV73071,PO3094,AUD,21408.88,EXPORT,Payment for goods,SAP,2026-01-26,2026-01-25,21408.88,False,payment for goods,2026-02-23 16:50:30.516232,Raw_GL_Export.csv
TXN001143,01/06/2026,12/29/2025,2026-01,AUS01,5900,CC1000,PWC,INV44487,PO7963,GBP,6157.46,EXPORT,Payment for services,Oracle,2026-06-01,2025-12-29,6157.46,False,payment for services,2026-02-23 16:50:30.516232,Raw_GL_Export.csv
TXN001144,2026-01-24,2026-01-21,2026-01,AUS01,5010,CC2000,Deloitte Touche,INV54846,,USD,33120.17,EXPORT,Payment for subscription,API Import,2026-01-24,2026-01-21,33120.17,False,payment for subscription,2026-02-23 16:50:30.516232,Raw_GL_Export.csv
TXN001145,24-01-2026,15-01-2026,2026-01,AUS01,5010,CC3200,WeWork Australia,INV77378,,USD,16645.46,INPUT,Payment for goods,SAP,2026-01-24,2026-01-15,16645.46,False,payment for goods,2026-02-23 16:50:30.516232,Raw_GL_Export.csv
TXN001146,22/02/2026,13/02/2026,2026-02,AUS01,5310,CC2100,Regus Australia,INV43353,PO7019,NZD,2216.99,EXPORT,Payment for subscription,Manual Entry,2026-02-22,2026-02-13,2216.99,False,payment for subscription,2026-02-23 16:50:30.516232,Raw_GL_Export.csv
TXN001147,11/04/2025,07/04/2025,2025-04,AUS01,5920,CC1100,Atlassian Pty,INV68648,,USD,42506.45,GST-FREE,Payment for license,API Import,2025-04-11,2025-04-07,42506.45,False,payment for license,2026-02-23 16:50:30.516232,Raw_GL_Export.csv
TXN001148,25-01-2026,15-01-2026,2026-01,AUS01,5800,CC1100,Optus Pty,INV37037,,GBP,40562.55,EXPORT,Payment for subscription,Oracle,2026-01-25,2026-01-15,40562.55,False,payment for subscription,2026-02-23 16:50:30.516232,Raw_GL_Export.csv
TXN001149,16/02/2026,15/02/2026,2026-02,AUS01,5200,CC4000,Federal Express,INV56351,PO9894,USD,36902.18,EXPORT,Payment for services,SAP,2026-02-16,2026-02-15,36902.18,False,payment for services,2026-02-23 16:50:30.516232,Raw_GL_Export.csv
TXN001150,20-01-2026,16-01-2026,2026-01,AUS01,5910,CC1000,Deloitte Touche,INV14351,PO4760,NZD,32192.64,GST-FREE,Payment for subscription,API Import,2026-01-20,2026-01-16,32192.64,False,payment for subscription,2026-02-23 16:50:30.516232,Raw_GL_Export.csv
TXN001151,17/01/2026,12/01/2026,2026-01,AUS01,5610,CC2000,BCG,INV14687,PO2701,USD,39661.24,GST,Payment for license,SAP,2026-01-17,2026-01-12,39661.24,False,payment for license,2026-02-23 16:50:30.516232,Raw_GL_Export.csv
TXN001152,23-06-2025,15-06-2025,2025-06,AUS01,5500,CC4000,KPMG Australia,INV32577,,AUD,37930.95,INPUT,Payment for subscription,Workday,2025-06-23,2025-06-15,37930.95,False,payment for subscription,2026-02-23 16:50:30.516232,Raw_GL_Export.csv
TXN001153,01/09/2026,01/02/2026,2026-01,AUS01,5010,CC4000,Workday,INV89005,PO8378,NZD,31010.69,EXPORT,Payment for license,SAP,2026-09-01,2026-02-01,31010.69,False,payment for license,2026-02-23 16:50:30.516232,Raw_GL_Export.csv
TXN001154,01/01/2026,12/28/2025,2026-01,AUS01,5620,CC4100,Atlassian Pty,INV80630,PO7972,USD,24194.73,INPUT,Payment for license,API Import,2026-01-01,2025-12-28,24194.73,False,payment for license,2026-02-23 16:50:30.516232,Raw_GL_Export.csv
TXN001155,17/05/2025,07/05/2025,2025-05,AUS01,5010,CC2100,McKinsey,INV72828,,GBP,26087.01,GST-FREE,Payment for consulting,Oracle,2025-05-17,2025-05-07,26087.01,False,payment for consulting,2026-02-23 16:50:30.516232,Raw_GL_Export.csv
TXN001156,09-01-2026,05-01-2026,2026-01,AUS01,5010,CC1100,Federal Express,INV36703,PO4709,NZD,7958.83,GST-FREE,Payment for license,Manual Entry,2026-01-09,2026-01-05,7958.83,False,payment for license,2026-02-23 16:50:30.516232,Raw_GL_Export.csv
TXN001157,06/02/2026,02/02/2026,2026-02,AUS01,5600,CC1100,Zoom,INV13943,PO3574,AUD,44341.34,EXPORT,Payment for license,Oracle,2026-02-06,2026-02-02,44341.34,False,payment for license,2026-02-23 16:50:30.516232,Raw_GL_Export.csv
TXN001158,2026-02-06,2026-01-27,2026-02,AUS01,5520,CC2000,Adobe,INV11953,,USD,5538.58,GST,Payment for goods,SAP,2026-02-06,2026-01-27,5538.58,False,payment for goods,2026-02-23 16:50:30.516232,Raw_GL_Export.csv
TXN001159,2026-01-01,2025-12-23,2026-01,AUS01,5400,CC3200,Telstra Corp,INV76574,PO8878,GBP,5246.18,GST,Payment for consulting,SAP,2026-01-01,2025-12-23,5246.18,False,payment for consulting,2026-02-23 16:50:30.516232,Raw_GL_Export.csv
TXN001160,2025-03-01,2025-02-24,2025-03,AUS01,5200,CC3000,Federal Express,INV82487,,AUD,13065.5,GST-FREE,Payment for subscription,Oracle,2025-03-01,2025-02-24,13065.5,False,payment for subscription,2026-02-23 16:50:30.516232,Raw_GL_Export.csv
TXN001161,2026-02-21,2026-02-11,2026-02,AUS01,5510,CC1000,Seek Limited,INV35557,PO7695,NZD,19009.19,GST-FREE,Payment for license,Workday,2026-02-21,2026-02-11,19009.19,False,payment for license,2026-02-23 16:50:30.516232,Raw_GL_Export.csv
TXN001162,2025-05-27,2025-05-26,2025-05,AUS01,5000,CC2000,Amazon,INV33904,,GBP,37605.02,EXPORT,Payment for subscription,Workday,2025-05-27,2025-05-26,37605.02,False,payment for subscription,2026-02-23 16:50:30.516232,Raw_GL_Export.csv
TXN001163,24-01-2026,16-01-2026,2026-01,AUS01,5910,CC1100,BCG,INV67135,PO7388,AUD,40641.98,GST,Payment for consulting,Workday,2026-01-24,2026-01-16,40641.98,False,payment for consulting,2026-02-23 16:50:30.516232,Raw_GL_Export.csv
TXN001164,2026-02-03,2026-02-02,2026-02,AUS01,5620,CC3100,Regus Australia,INV39464,PO1025,NZD,39050.92,GST,Payment for consulting,API Import,2026-02-03,2026-02-02,39050.92,False,payment for consulting,2026-02-23 16:50:30.516232,Raw_GL_Export.csv
TXN001165,2025-07-11,2025-07-04,2025-07,AUS01,5610,CC4100,PWC,INV58140,PO4189,GBP,1983.9,GST,Payment for consulting,Manual Entry,2025-07-11,2025-07-04,1983.9,False,payment for consulting,2026-02-23 16:50:30.516232,Raw_GL_Export.csv
TXN001166,18/12/2025,13/12/2025,2025-12,AUS01,5520,CC1200,Federal Express,INV12021,PO9846,GBP,7252.82,EXPORT,Payment for consulting,API Import,2025-12-18,2025-12-13,7252.82,False,payment for consulting,2026-02-23 16:50:30.516232,Raw_GL_Export.csv
TXN001167,2026-01-18,2026-01-10,2026-01,AUS01,5510,CC3200,Salesforce,INV33672,PO2270,NZD,1475.51,EXPORT,Payment for license,Manual Entry,2026-01-18,2026-01-10,1475.51,False,payment for license,2026-02-23 16:50:30.516232,Raw_GL_Export.csv
TXN001168,2026-02-13,2026-02-03,2026-02,AUS01,5210,CC1200,Amazon,INV69579,PO9552,AUD,6058.28,INPUT,Payment for license,API Import,2026-02-13,2026-02-03,6058.28,False,payment for license,2026-02-23 16:50:30.516232,Raw_GL_Export.csv
TXN001169,27/01/2026,20/01/2026,2026-01,AUS01,5000,CC2100,Google,INV28245,PO8552,AUD,34271.25,INPUT,Payment for subscription,Workday,2026-01-27,2026-01-20,34271.25,False,payment for subscription,2026-02-23 16:50:30.516232,Raw_GL_Export.csv
TXN001170,04/17/2025,04/15/2025,2025-04,AUS01,5420,CC3200,LinkedIn Corp,INV73999,,NZD,31802.38,GST-FREE,Payment for license,Oracle,2025-04-17,2025-04-15,31802.38,False,payment for license,2026-02-23 16:50:30.516232,Raw_GL_Export.csv
TXN001171,2026-02-26,2026-02-24,2026-02,AUS01,5520,CC4000,Zoom,INV28057,PO3900,NZD,4226.4,EXPORT,Payment for goods,Oracle,2026-02-26,2026-02-24,4226.4,False,payment for goods,2026-02-23 16:50:30.516232,Raw_GL_Export.csv
TXN001172,20-01-2026,14-01-2026,2026-01,AUS01,5510,CC4100,Salesforce,INV58030,,GBP,2497.42,INPUT,Payment for goods,SAP,2026-01-20,2026-01-14,2497.42,False,payment for goods,2026-02-23 16:50:30.516232,Raw_GL_Export.csv
TXN001173,03/27/2025,03/22/2025,2025-03,AUS01,5320,CC3200,Microsoft,INV10378,PO3318,NZD,19636.78,GST-FREE,Payment for goods,Workday,2025-03-27,2025-03-22,19636.78,False,payment for goods,2026-02-23 16:50:30.516232,Raw_GL_Export.csv
TXN001174,2026-01-16,2026-01-06,2026-01,AUS01,5000,CC1000,Salesforce,INV63740,,GBP,9958.12,INPUT,Payment for services,Manual Entry,2026-01-16,2026-01-06,9958.12,False,payment for services,2026-02-23 16:50:30.516232,Raw_GL_Export.csv
TXN001175,06/02/2026,03/02/2026,2026-02,AUS01,5220,CC3200,Oracle,INV46699,,USD,41387.45,INPUT,Payment for services,Manual Entry,2026-02-06,2026-02-03,41387.45,False,payment for services,2026-02-23 16:50:30.516232,Raw_GL_Export.csv
TXN001176,17/02/2026,14/02/2026,2026-02,AUS01,5710,CC2100,Optus Pty,INV19501,PO9884,USD,4145.02,EXPORT,Payment for subscription,SAP,2026-02-17,2026-02-14,4145.02,False,payment for subscription,2026-02-23 16:50:30.516232,Raw_GL_Export.csv
TXN001177,2025-08-16,2025-08-15,2025-08,AUS01,5900,CC3000,MSFT,INV10134,PO8599,AUD,5315.97,INPUT,Payment for services,SAP,2025-08-16,2025-08-15,5315.97,False,payment for services,2026-02-23 16:50:30.516232,Raw_GL_Export.csv
TXN001178,11/02/2026,04/02/2026,2026-02,AUS01,5020,CC1000,Regus Australia,INV16978,PO3230,USD,42620.49,EXPORT,Payment for goods,SAP,2026-02-11,2026-02-04,42620.49,False,payment for goods,2026-02-23 16:50:30.516232,Raw_GL_Export.csv
TXN001179,02-01-2025,31-12-2024,2025-01,AUS01,5900,CC3100,McKinsey,INV43610,PO2419,AUD,306.7,EXPORT,Payment for license,API Import,2025-01-02,2024-12-31,306.7,False,payment for license,2026-02-23 16:50:30.516232,Raw_GL_Export.csv
TXN001180,10/26/2025,10/17/2025,2025-10,AUS01,5710,CC3000,KPMG Australia,INV84381,PO7769,USD,36501.69,GST-FREE,Payment for license,API Import,2025-10-26,2025-10-17,36501.69,False,payment for license,2026-02-23 16:50:30.516232,Raw_GL_Export.csv
TXN001181,19/01/2026,12/01/2026,2026-01,AUS01,5320,CC1200,Deloitte Touche,INV64187,PO2443,NZD,43049.09,GST,Payment for license,API Import,2026-01-19,2026-01-12,43049.09,False,payment for license,2026-02-23 16:50:30.516232,Raw_GL_Export.csv
TXN001182,05-01-2026,01-01-2026,2026-01,AUS01,5900,CC2100,Google,INV14655,,USD,40586.17,GST,Payment for services,Oracle,2026-01-05,2026-01-01,40586.17,False,payment for services,2026-02-23 16:50:30.516232,Raw_GL_Export.csv
TXN001183,12-08-2025,08-08-2025,2025-08,AUS01,5700,CC1200,Salesforce,INV57178,PO9585,GBP,40168.84,GST-FREE,Payment for goods,Workday,2025-08-12,2025-08-08,40168.84,False,payment for goods,2026-02-23 16:50:30.516232,Raw_GL_Export.csv
TXN001184,28/08/2025,21/08/2025,2025-08,AUS01,5510,CC1000,DHL Express,INV15101,PO8336,NZD,44057.71,EXPORT,Payment for goods,API Import,2025-08-28,2025-08-21,44057.71,False,payment for goods,2026-02-23 16:50:30.516232,Raw_GL_Export.csv
TXN001185,18/02/2026,13/02/2026,2026-02,AUS01,5300,CC4000,Robert Half International,INV51670,PO7268,USD,24667.59,GST-FREE,Payment for subscription,Manual Entry,2026-02-18,2026-02-13,24667.59,False,payment for subscription,2026-02-23 16:50:30.516232,Raw_GL_Export.csv
TXN001186,2025-07-05,2025-06-29,2025-07,AUS01,5310,CC1000,Optus Pty,INV61573,PO6497,GBP,41722.84,GST,Payment for subscription,SAP,2025-07-05,2025-06-29,41722.84,False,payment for subscription,2026-02-23 16:50:30.516232,Raw_GL_Export.csv
TXN001187,12-08-2025,09-08-2025,2025-08,AUS01,5200,CC4100,Oracle,INV52539,,AUD,26773.59,INPUT,Payment for consulting,Workday,2025-08-12,2025-08-09,26773.59,False,payment for consulting,2026-02-23 16:50:30.516232,Raw_GL_Export.csv
TXN001188,2025-01-24,2025-01-14,2025-01,AUS01,5100,CC2000,GCP,INV76520,PO2552,AUD,44855.48,EXPORT,Payment for license,SAP,2025-01-24,2025-01-14,44855.48,False,payment for license,2026-02-23 16:50:30.516232,Raw_GL_Export.csv
TXN001189,04/05/2025,03/31/2025,2025-04,AUS01,5710,CC3200,Federal Express,INV32045,PO7653,AUD,30934.52,GST-FREE,Payment for license,Workday,2025-05-04,2025-03-31,30934.52,False,payment for license,2026-02-23 16:50:30.516232,Raw_GL_Export.csv
TXN001190,03/08/2025,03/03/2025,2025-03,AUS01,5710,CC1100,Oracle,INV33886,PO6140,AUD,40194.3,GST-FREE,Payment for license,Workday,2025-08-03,2025-03-03,40194.3,False,payment for license,2026-02-23 16:50:30.516232,Raw_GL_Export.csv
TXN001191,2026-01-28,2026-01-27,2026-01,AUS01,5120,CC3100,MSFT,INV38127,PO3999,AUD,14445.89,INPUT,Payment for subscription,API Import,2026-01-28,2026-01-27,14445.89,False,payment for subscription,2026-02-23 16:50:30.516232,Raw_GL_Export.csv
TXN001192,09-02-2026,30-01-2026,2026-02,AUS01,5310,CC1000,Optus Pty,INV23093,PO4133,NZD,2067.78,EXPORT,Payment for goods,Manual Entry,2026-02-09,2026-01-30,2067.78,False,payment for goods,2026-02-23 16:50:30.516232,Raw_GL_Export.csv
TXN001193,2026-02-20,2026-02-14,2026-02,AUS01,5710,CC4100,Regus Australia,INV16310,,AUD,41114.14,GST,Payment for consulting,Workday,2026-02-20,2026-02-14,41114.14,False,payment for consulting,2026-02-23 16:50:30.516232,Raw_GL_Export.csv
TXN001194,22/01/2026,17/01/2026,2026-01,AUS01,5810,CC1000,Workday,INV26522,PO4514,AUD,234.89,INPUT,Payment for consulting,SAP,2026-01-22,2026-01-17,234.89,False,payment for consulting,2026-02-23 16:50:30.516232,Raw_GL_Export.csv
TXN001195,05/17/2025,05/15/2025,2025-05,AUS01,5020,CC4000,EY Australia,INV90658,PO3855,AUD,42997.99,INPUT,Payment for license,Workday,2025-05-17,2025-05-15,42997.99,False,payment for license,2026-02-23 16:50:30.516232,Raw_GL_Export.csv
TXN001196,12/01/2026,06/01/2026,2026-01,AUS01,5700,CC4100,BCG,INV19261,,USD,2152.14,EXPORT,Payment for consulting,Manual Entry,2026-01-12,2026-01-06,2152.14,False,payment for consulting,2026-02-23 16:50:30.516232,Raw_GL_Export.csv
TXN001197,2026-01-19,2026-01-18,2026-01,AUS01,5400,CC4100,Telstra Corp,INV67571,PO1722,AUD,3408.58,EXPORT,Payment for goods,Manual Entry,2026-01-19,2026-01-18,3408.58,False,payment for goods,2026-02-23 16:50:30.516232,Raw_GL_Export.csv
TXN001198,02/17/2026,02/14/2026,2026-02,AUS01,5710,CC2000,SAP,INV39494,,NZD,13873.38,INPUT,Payment for consulting,Manual Entry,2026-02-17,2026-02-14,13873.38,False,payment for consulting,2026-02-23 16:50:30.516232,Raw_GL_Export.csv
TXN001199,15-01-2026,12-01-2026,2026-01,AUS01,5310,CC3000,AWS,INV11448,,USD,7314.54,INPUT,Payment for goods,Manual Entry,2026-01-15,2026-01-12,7314.54,False,payment for goods,2026-02-23 16:50:30.516232,Raw_GL_Export.csv
TXN001200,02/11/2026,02/08/2026,2026-02,AUS01,5400,CC1200,KPMG Australia,INV34087,PO4060,AUD,20726.09,INPUT,Payment for license,Oracle,2026-11-02,2026-08-02,20726.09,False,payment for license,2026-02-23 16:50:30.516232,Raw_GL_Export.csv
TXN001201,08/02/2026,03/02/2026,2026-02,AUS01,5310,CC1100,Salesforce,INV84883,,AUD,33201.57,GST,Payment for consulting,SAP,2026-02-08,2026-02-03,33201.57,False,payment for consulting,2026-02-23 16:50:30.516232,Raw_GL_Export.csv
TXN001202,12/03/2025,11/03/2025,2025-03,AUS01,5620,CC4000,AusPost,INV25289,,NZD,11009.61,GST-FREE,Payment for consulting,Manual Entry,2025-03-12,2025-03-11,11009.61,False,payment for consulting,2026-02-23 16:50:30.516232,Raw_GL_Export.csv
TXN001203,08/02/2026,29/01/2026,2026-02,AUS01,5000,CC2100,BCG,INV52372,PO4048,GBP,15100.33,EXPORT,Payment for services,Oracle,2026-02-08,2026-01-29,15100.33,False,payment for services,2026-02-23 16:50:30.516232,Raw_GL_Export.csv
TXN001204,19-11-2025,14-11-2025,2025-11,AUS01,5120,CC3100,Microsoft,INV64929,PO3935,USD,42900.98,GST-FREE,Payment for services,Oracle,2025-11-19,2025-11-14,42900.98,False,payment for services,2026-02-23 16:50:30.516232,Raw_GL_Export.csv
TXN001205,05/15/2025,05/09/2025,2025-05,AUS01,5510,CC1200,Salesforce,INV13232,PO3065,NZD,20841.27,EXPORT,Payment for services,Manual Entry,2025-05-15,2025-09-05,20841.27,False,payment for services,2026-02-23 16:50:30.516232,Raw_GL_Export.csv
TXN001206,2026-01-04,2025-12-29,2026-01,AUS01,5910,CC1200,ServiceNow Inc,INV32052,,AUD,8223.87,EXPORT,Payment for license,Oracle,2026-01-04,2025-12-29,8223.87,False,payment for license,2026-02-23 16:50:30.516232,Raw_GL_Export.csv
TXN001207,01/03/2026,12/25/2025,2026-01,AUS01,5900,CC1100,Hays,INV66850,,AUD,30919.16,GST,Payment for services,API Import,2026-03-01,2025-12-25,30919.16,False,payment for services,2026-02-23 16:50:30.516232,Raw_GL_Export.csv
TXN001208,14/01/2025,05/01/2025,2025-01,AUS01,5320,CC3000,Google,INV71662,,NZD,25646.98,EXPORT,Payment for services,Manual Entry,2025-01-14,2025-01-05,25646.98,False,payment for services,2026-02-23 16:50:30.516232,Raw_GL_Export.csv
TXN001209,2026-01-18,2026-01-17,2026-01,AUS01,5810,CC3000,Accenture Pty,INV18803,PO7151,GBP,24120.51,GST-FREE,Payment for license,Oracle,2026-01-18,2026-01-17,24120.51,False,payment for license,2026-02-23 16:50:30.516232,Raw_GL_Export.csv
TXN001210,17-01-2026,14-01-2026,2026-01,AUS01,5900,CC4000,PWC,INV17001,PO9419,NZD,43268.88,INPUT,Payment for goods,Oracle,2026-01-17,2026-01-14,43268.88,False,payment for goods,2026-02-23 16:50:30.516232,Raw_GL_Export.csv
TXN001211,24-02-2026,21-02-2026,2026-02,AUS01,5000,CC1000,Oracle,INV91955,PO4746,USD,27715.38,GST-FREE,Payment for goods,Oracle,2026-02-24,2026-02-21,27715.38,False,payment for goods,2026-02-23 16:50:30.516232,Raw_GL_Export.csv
TXN001212,11/02/2025,10/31/2025,2025-11,AUS01,5220,CC2100,Hays,INV78799,PO2081,NZD,29502.03,GST-FREE,Payment for consulting,Workday,2025-02-11,2025-10-31,29502.03,False,payment for consulting,2026-02-23 16:50:30.516232,Raw_GL_Export.csv
TXN001213,19/01/2026,18/01/2026,2026-01,AUS01,5700,CC1200,AWS,INV16646,,USD,1721.59,GST-FREE,Payment for goods,Oracle,2026-01-19,2026-01-18,1721.59,False,payment for goods,2026-02-23 16:50:30.516232,Raw_GL_Export.csv
TXN001214,28/01/2026,25/01/2026,2026-01,AUS01,5710,CC3200,Hays,INV23531,,NZD,38286.84,GST-FREE,Payment for goods,SAP,2026-01-28,2026-01-25,38286.84,False,payment for goods,2026-02-23 16:50:30.516232,Raw_GL_Export.csv
TXN001215,25/02/2026,16/02/2026,2026-02,AUS01,5020,CC3100,BCG,INV35826,,AUD,18381.39,EXPORT,Payment for services,Workday,2026-02-25,2026-02-16,18381.39,False,payment for services,2026-02-23 16:50:30.516232,Raw_GL_Export.csv
TXN001216,23/01/2026,15/01/2026,2026-01,AUS01,5420,CC3200,WeWork Australia,INV90098,PO3163,GBP,40648.89,GST,Payment for services,SAP,2026-01-23,2026-01-15,40648.89,False,payment for services,2026-02-23 16:50:30.516232,Raw_GL_Export.csv
TXN001217,21/01/2026,11/01/2026,2026-01,AUS01,5020,CC3100,Salesforce,INV30856,PO9698,GBP,13504.35,GST,Payment for goods,SAP,2026-01-21,2026-01-11,13504.35,False,payment for goods,2026-02-23 16:50:30.516232,Raw_GL_Export.csv
TXN001218,2025-11-26,2025-11-21,2025-11,AUS01,5210,CC4000,PWC,INV31260,,AUD,27941.98,EXPORT,Payment for services,Oracle,2025-11-26,2025-11-21,27941.98,False,payment for services,2026-02-23 16:50:30.516232,Raw_GL_Export.csv
TXN001219,04-01-2026,27-12-2025,2026-01,AUS01,5000,CC4000,MSFT,INV64746,PO7443,NZD,18323.24,INPUT,Payment for consulting,SAP,2026-01-04,2025-12-27,18323.24,False,payment for consulting,2026-02-23 16:50:30.516232,Raw_GL_Export.csv
TXN001220,13/02/2026,06/02/2026,2026-02,AUS01,5110,CC1100,Robert Half International,INV49740,PO5173,GBP,16356.08,GST,Payment for subscription,SAP,2026-02-13,2026-02-06,16356.08,False,payment for subscription,2026-02-23 16:50:30.516232,Raw_GL_Export.csv
TXN001221,15-02-2026,08-02-2026,2026-02,AUS01,5200,CC2100,SAP,INV11118,PO7175,USD,25583.12,INPUT,Payment for goods,Manual Entry,2026-02-15,2026-02-08,25583.12,False,payment for goods,2026-02-23 16:50:30.516232,Raw_GL_Export.csv
TXN001222,07/02/2026,04/02/2026,2026-02,AUS01,5400,CC1200,Telstra Corp,INV43518,,AUD,4071.84,GST-FREE,Payment for consulting,Oracle,2026-02-07,2026-02-04,4071.84,False,payment for consulting,2026-02-23 16:50:30.516232,Raw_GL_Export.csv
TXN001223,01/27/2026,01/18/2026,2026-01,AUS01,5710,CC3000,PWC,INV79966,PO2607,USD,4653.39,GST,Payment for license,Manual Entry,2026-01-27,2026-01-18,4653.39,False,payment for license,2026-02-23 16:50:30.516232,Raw_GL_Export.csv
TXN001224,05/01/2026,31/12/2025,2026-01,AUS01,5910,CC1100,Federal Express,INV41381,PO5615,NZD,10005.08,INPUT,Payment for consulting,Oracle,2026-01-05,2025-12-31,10005.08,False,payment for consulting,2026-02-23 16:50:30.516232,Raw_GL_Export.csv
TXN001225,2026-02-12,2026-02-06,2026-02,AUS01,5520,CC2000,ServiceNow Inc,INV14552,PO4946,USD,11807.32,GST-FREE,Payment for services,SAP,2026-02-12,2026-02-06,11807.32,False,payment for services,2026-02-23 16:50:30.516232,Raw_GL_Export.csv
TXN001226,11/23/2025,11/14/2025,2025-11,AUS01,5500,CC3100,Amazon,INV58469,PO7396,NZD,44108.19,INPUT,Payment for license,Workday,2025-11-23,2025-11-14,44108.19,False,payment for license,2026-02-23 16:50:30.516232,Raw_GL_Export.csv
TXN001227,02/16/2026,02/08/2026,2026-02,AUS01,5400,CC4100,PWC,INV41447,PO8736,NZD,42619.83,INPUT,Payment for subscription,Manual Entry,2026-02-16,2026-08-02,42619.83,False,payment for subscription,2026-02-23 16:50:30.516232,Raw_GL_Export.csv
TXN001228,13-01-2026,11-01-2026,2026-01,AUS01,5410,CC2000,PWC,INV47427,PO9773,USD,3650.63,INPUT,Payment for services,API Import,2026-01-13,2026-01-11,3650.63,False,payment for services,2026-02-23 16:50:30.516232,Raw_GL_Export.csv
TXN001229,01/11/2026,01/02/2026,2026-01,AUS01,5020,CC3000,Oracle,INV58655,PO7505,GBP,26857.91,INPUT,Payment for subscription,Manual Entry,2026-11-01,2026-02-01,26857.91,False,payment for subscription,2026-02-23 16:50:30.516232,Raw_GL_Export.csv
TXN001230,2025-05-06,2025-05-02,2025-05,AUS01,5000,CC3200,PWC,INV44825,,USD,10857.92,GST,Payment for services,Workday,2025-05-06,2025-05-02,10857.92,False,payment for services,2026-02-23 16:50:30.516232,Raw_GL_Export.csv
TXN001231,01/02/2026,12/24/2025,2026-01,AUS01,5600,CC2000,Accenture Pty,INV49452,PO6061,USD,42349.04,GST,Payment for goods,SAP,2026-02-01,2025-12-24,42349.04,False,payment for goods,2026-02-23 16:50:30.516232,Raw_GL_Export.csv
TXN001232,15-01-2026,11-01-2026,2026-01,AUS01,5700,CC3200,ServiceNow Inc,INV13930,PO2998,AUD,43251.17,GST,Payment for consulting,API Import,2026-01-15,2026-01-11,43251.17,False,payment for consulting,2026-02-23 16:50:30.516232,Raw_GL_Export.csv
TXN001233,01/27/2026,01/24/2026,2026-01,AUS01,5110,CC1100,Google,INV22108,PO5601,NZD,32872.04,EXPORT,Payment for subscription,Oracle,2026-01-27,2026-01-24,32872.04,False,payment for subscription,2026-02-23 16:50:30.516232,Raw_GL_Export.csv
TXN001234,01/07/2026,01/02/2026,2026-01,AUS01,5800,CC1200,Telstra Corp,INV16371,,GBP,11763.3,EXPORT,Payment for goods,Oracle,2026-07-01,2026-02-01,11763.3,False,payment for goods,2026-02-23 16:50:30.516232,Raw_GL_Export.csv
TXN001235,2025-12-28,2025-12-19,2025-12,AUS01,5410,CC3000,Zoom,INV69371,,USD,40731.68,EXPORT,Payment for consulting,Manual Entry,2025-12-28,2025-12-19,40731.68,False,payment for consulting,2026-02-23 16:50:30.516232,Raw_GL_Export.csv
TXN001236,02/22/2026,02/15/2026,2026-02,AUS01,5200,CC2000,LinkedIn Corp,INV94633,PO6850,AUD,5105.23,GST,Payment for goods,Manual Entry,2026-02-22,2026-02-15,5105.23,False,payment for goods,2026-02-23 16:50:30.516232,Raw_GL_Export.csv
TXN001237,2026-01-18,2026-01-17,2026-01,AUS01,5320,CC3000,Microsoft,INV73418,PO3919,AUD,1236.74,GST-FREE,Payment for goods,SAP,2026-01-18,2026-01-17,1236.74,False,payment for goods,2026-02-23 16:50:30.516232,Raw_GL_Export.csv
TXN001238,10/01/2025,04/01/2025,2025-01,AUS01,5420,CC2000,Atlassian Pty,INV39715,PO3022,GBP,1288.49,INPUT,Payment for goods,Manual Entry,2025-01-10,2025-01-04,1288.49,False,payment for goods,2026-02-23 16:50:30.516232,Raw_GL_Export.csv
TXN001239,2026-01-17,2026-01-09,2026-01,AUS01,5120,CC1000,SAP,INV56014,PO9488,AUD,8995.39,INPUT,Payment for consulting,Oracle,2026-01-17,2026-01-09,8995.39,False,payment for consulting,2026-02-23 16:50:30.516232,Raw_GL_Export.csv
TXN001240,2026-02-24,2026-02-14,2026-02,AUS01,5620,CC1200,Hays,INV90657,PO4493,USD,15544.23,INPUT,Payment for goods,Oracle,2026-02-24,2026-02-14,15544.23,False,payment for goods,2026-02-23 16:50:30.516232,Raw_GL_Export.csv
TXN001241,06/01/2026,29/12/2025,2026-01,AUS01,5210,CC4100,SAP,INV72086,PO4638,USD,163.95,INPUT,Payment for subscription,Oracle,2026-01-06,2025-12-29,163.95,False,payment for subscription,2026-02-23 16:50:30.516232,Raw_GL_Export.csv
TXN001242,05/01/2026,29/12/2025,2026-01,AUS01,5410,CC1100,Robert Half International,INV62048,,NZD,43742.48,EXPORT,Payment for services,API Import,2026-01-05,2025-12-29,43742.48,False,payment for services,2026-02-23 16:50:30.516232,Raw_GL_Export.csv
TXN001243,2026-02-15,2026-02-06,2026-02,AUS01,5120,CC3100,Hays,INV36201,PO2616,AUD,34425.66,GST-FREE,Payment for services,Manual Entry,2026-02-15,2026-02-06,34425.66,False,payment for services,2026-02-23 16:50:30.516232,Raw_GL_Export.csv
TXN001244,04/02/2026,28/01/2026,2026-02,AUS01,5100,CC3000,ServiceNow Inc,INV97322,PO8122,USD,31803.31,EXPORT,Payment for subscription,API Import,2026-02-04,2026-01-28,31803.31,False,payment for subscription,2026-02-23 16:50:30.516232,Raw_GL_Export.csv
TXN001245,01/28/2026,01/21/2026,2026-01,AUS01,5500,CC2000,McKinsey,INV29024,,GBP,33943.45,GST-FREE,Payment for goods,Oracle,2026-01-28,2026-01-21,33943.45,False,payment for goods,2026-02-23 16:50:30.516232,Raw_GL_Export.csv
TXN001246,05/06/2025,27/05/2025,2025-06,AUS01,5000,CC1100,KPMG Australia,INV83428,PO3527,NZD,44871.51,INPUT,Payment for goods,Oracle,2025-06-05,2025-05-27,44871.51,False,payment for goods,2026-02-23 16:50:30.516232,Raw_GL_Export.csv
TXN001247,01/24/2025,01/17/2025,2025-01,AUS01,5010,CC3100,Oracle,INV61067,,NZD,9576.75,GST,Payment for consulting,Oracle,2025-01-24,2025-01-17,9576.75,False,payment for consulting,2026-02-23 16:50:30.516232,Raw_GL_Export.csv
TXN001248,2026-01-03,2025-12-25,2026-01,AUS01,5010,CC2100,DHL Express,INV10827,PO6165,GBP,12482.51,GST-FREE,Payment for goods,API Import,2026-01-03,2025-12-25,12482.51,False,payment for goods,2026-02-23 16:50:30.516232,Raw_GL_Export.csv
TXN001249,2026-01-10,2026-01-01,2026-01,AUS01,5310,CC1200,AWS,INV32874,PO1939,AUD,9966.84,EXPORT,Payment for license,Workday,2026-01-10,2026-01-01,9966.84,False,payment for license,2026-02-23 16:50:30.516232,Raw_GL_Export.csv
TXN001250,22-02-2026,18-02-2026,2026-02,AUS01,5600,CC3200,Regus Australia,INV72409,,GBP,2940.26,INPUT,Payment for subscription,Workday,2026-02-22,2026-02-18,2940.26,False,payment for subscription,2026-02-23 16:50:30.516232,Raw_GL_Export.csv
TXN001251,2026-02-19,2026-02-16,2026-02,AUS01,5620,CC1100,Regus Australia,INV19439,,AUD,19322.55,INPUT,Payment for subscription,Workday,2026-02-19,2026-02-16,19322.55,False,payment for subscription,2026-02-23 16:50:30.516232,Raw_GL_Export.csv
TXN001252,02/14/2026,02/13/2026,2026-02,AUS01,5600,CC1100,Federal Express,INV81712,PO4028,USD,26632.96,EXPORT,Payment for services,Manual Entry,2026-02-14,2026-02-13,26632.96,False,payment for services,2026-02-23 16:50:30.516232,Raw_GL_Export.csv
TXN001253,2026-01-26,2026-01-23,2026-01,AUS01,5000,CC2100,Adobe,INV19321,PO9128,GBP,43940.11,GST,Payment for services,Oracle,2026-01-26,2026-01-23,43940.11,False,payment for services,2026-02-23 16:50:30.516232,Raw_GL_Export.csv
TXN001254,2026-01-24,2026-01-21,2026-01,AUS01,5300,CC1100,SAP,INV91304,PO9715,USD,33860.21,EXPORT,Payment for license,Manual Entry,2026-01-24,2026-01-21,33860.21,False,payment for license,2026-02-23 16:50:30.516232,Raw_GL_Export.csv
TXN001255,2026-02-13,2026-02-03,2026-02,AUS01,5510,CC3200,Workday,INV73422,,AUD,7507.32,EXPORT,Payment for license,Oracle,2026-02-13,2026-02-03,7507.32,False,payment for license,2026-02-23 16:50:30.516232,Raw_GL_Export.csv
TXN001256,05-02-2026,29-01-2026,2026-02,AUS01,5700,CC1000,LinkedIn Corp,INV95032,PO6773,NZD,31325.83,EXPORT,Payment for goods,Oracle,2026-02-05,2026-01-29,31325.83,False,payment for goods,2026-02-23 16:50:30.516232,Raw_GL_Export.csv
TXN001257,01/21/2026,01/17/2026,2026-01,AUS01,5100,CC4100,Google,INV14047,PO6486,GBP,14863.82,GST-FREE,Payment for goods,Oracle,2026-01-21,2026-01-17,14863.82,False,payment for goods,2026-02-23 16:50:30.516232,Raw_GL_Export.csv
TXN001258,04/11/2025,03/11/2025,2025-11,AUS01,5120,CC1100,Salesforce,INV73738,PO5461,NZD,37913.2,INPUT,Payment for subscription,API Import,2025-11-04,2025-11-03,37913.2,False,payment for subscription,2026-02-23 16:50:30.516232,Raw_GL_Export.csv
TXN001259,21-02-2026,16-02-2026,2026-02,AUS01,5500,CC1000,MSFT,INV61857,PO9925,AUD,6398.59,EXPORT,Payment for consulting,Manual Entry,2026-02-21,2026-02-16,6398.59,False,payment for consulting,2026-02-23 16:50:30.516232,Raw_GL_Export.csv
TXN001260,09/13/2025,09/03/2025,2025-09,AUS01,5420,CC4100,Optus Pty,INV65022,PO7318,NZD,39828.13,GST,Payment for subscription,Manual Entry,2025-09-13,2025-03-09,39828.13,False,payment for subscription,2026-02-23 16:50:30.516232,Raw_GL_Export.csv
TXN001261,2026-02-23,2026-02-18,2026-02,AUS01,5920,CC3000,Microsoft,INV51252,PO8704,AUD,18361.1,INPUT,Payment for goods,SAP,2026-02-23,2026-02-18,18361.1,False,payment for goods,2026-02-23 16:50:30.516232,Raw_GL_Export.csv
TXN001262,19-05-2025,14-05-2025,2025-05,AUS01,5600,CC3100,Oracle,INV93229,PO6867,GBP,19917.94,GST,Payment for goods,API Import,2025-05-19,2025-05-14,19917.94,False,payment for goods,2026-02-23 16:50:30.516232,Raw_GL_Export.csv
TXN001263,23-10-2025,19-10-2025,2025-10,AUS01,5310,CC2000,MSFT,INV33494,PO2804,NZD,26751.04,GST,Payment for goods,API Import,2025-10-23,2025-10-19,26751.04,False,payment for goods,2026-02-23 16:50:30.516232,Raw_GL_Export.csv
TXN001264,06-02-2026,30-01-2026,2026-02,AUS01,5700,CC2000,Telstra Corp,INV51158,PO9593,NZD,10641.21,GST,Payment for license,API Import,2026-02-06,2026-01-30,10641.21,False,payment for license,2026-02-23 16:50:30.516232,Raw_GL_Export.csv
TXN001265,09/27/2025,09/17/2025,2025-09,AUS01,5400,CC3000,KPMG Australia,INV49129,PO5288,GBP,29619.91,GST-FREE,Payment for subscription,Oracle,2025-09-27,2025-09-17,29619.91,False,payment for subscription,2026-02-23 16:50:30.516232,Raw_GL_Export.csv
TXN001266,02/10/2026,02/08/2026,2026-02,AUS01,5900,CC2100,Atlassian Pty,INV89621,,GBP,25665.41,GST-FREE,Payment for subscription,Workday,2026-10-02,2026-08-02,25665.41,False,payment for subscription,2026-02-23 16:50:30.516232,Raw_GL_Export.csv
TXN001267,19-11-2025,14-11-2025,2025-11,AUS01,5210,CC4100,PWC,INV29150,,GBP,11944.37,GST-FREE,Payment for license,Workday,2025-11-19,2025-11-14,11944.37,False,payment for license,2026-02-23 16:50:30.516232,Raw_GL_Export.csv
TXN001268,17-02-2026,14-02-2026,2026-02,AUS01,5610,CC3200,Workday,INV23580,PO8299,NZD,4579.18,GST-FREE,Payment for goods,SAP,2026-02-17,2026-02-14,4579.18,False,payment for goods,2026-02-23 16:50:30.516232,Raw_GL_Export.csv
TXN001269,23/01/2026,21/01/2026,2026-01,AUS01,5920,CC3200,Microsoft,INV35259,,GBP,14774.37,INPUT,Payment for consulting,Workday,2026-01-23,2026-01-21,14774.37,False,payment for consulting,2026-02-23 16:50:30.516232,Raw_GL_Export.csv
TXN001270,11-01-2026,01-01-2026,2026-01,AUS01,5110,CC1200,Microsoft,INV46456,PO5987,USD,556.21,INPUT,Payment for consulting,SAP,2026-01-11,2026-01-01,556.21,False,payment for consulting,2026-02-23 16:50:30.516232,Raw_GL_Export.csv
TXN001271,05/01/2026,26/12/2025,2026-01,AUS01,5010,CC1000,Zoom,INV36743,PO8560,NZD,4887.96,GST,Payment for subscription,Manual Entry,2026-01-05,2025-12-26,4887.96,False,payment for subscription,2026-02-23 16:50:30.516232,Raw_GL_Export.csv
TXN001272,02/28/2026,02/19/2026,2026-02,AUS01,5710,CC4100,DHL Express,INV92313,PO8722,USD,14951.45,INPUT,Payment for services,API Import,2026-02-28,2026-02-19,14951.45,False,payment for services,2026-02-23 16:50:30.516232,Raw_GL_Export.csv
TXN001273,2025-11-14,2025-11-04,2025-11,AUS01,5610,CC2000,Salesforce,INV34792,,NZD,31791.15,INPUT,Payment for subscription,Manual Entry,2025-11-14,2025-11-04,31791.15,False,payment for subscription,2026-02-23 16:50:30.516232,Raw_GL_Export.csv
TXN001274,13/01/2026,11/01/2026,2026-01,AUS01,5020,CC2000,Regus Australia,INV34060,,AUD,39837.31,INPUT,Payment for consulting,Oracle,2026-01-13,2026-01-11,39837.31,False,payment for consulting,2026-02-23 16:50:30.516232,Raw_GL_Export.csv
TXN001275,22/02/2026,21/02/2026,2026-02,AUS01,5920,CC2000,SAP,INV44750,PO2765,NZD,20642.62,GST-FREE,Payment for services,Workday,2026-02-22,2026-02-21,20642.62,False,payment for services,2026-02-23 16:50:30.516232,Raw_GL_Export.csv
TXN001276,08-02-2026,29-01-2026,2026-02,AUS01,5410,CC4000,DHL Express,INV28463,PO5597,AUD,1566.86,INPUT,Payment for consulting,API Import,2026-02-08,2026-01-29,1566.86,False,payment for consulting,2026-02-23 16:50:30.516232,Raw_GL_Export.csv
TXN001277,02/02/2026,31/01/2026,2026-02,AUS01,5620,CC3200,Optus Pty,INV34683,PO5949,NZD,2992.07,INPUT,Payment for goods,Workday,2026-02-02,2026-01-31,2992.07,False,payment for goods,2026-02-23 16:50:30.516232,Raw_GL_Export.csv
TXN001278,02/01/2026,29/12/2025,2026-01,AUS01,5520,CC3000,MSFT,INV65328,PO3968,USD,7373.22,INPUT,Payment for consulting,Workday,2026-01-02,2025-12-29,7373.22,False,payment for consulting,2026-02-23 16:50:30.516232,Raw_GL_Export.csv
TXN001279,24/01/2026,20/01/2026,2026-01,AUS01,5200,CC1200,Zoom,INV27621,PO2766,USD,518.44,GST,Payment for goods,Oracle,2026-01-24,2026-01-20,518.44,False,payment for goods,2026-02-23 16:50:30.516232,Raw_GL_Export.csv
TXN001280,01/08/2025,31/07/2025,2025-08,AUS01,5210,CC2000,Deloitte Touche,INV26102,PO8008,GBP,21133.23,GST,Payment for consulting,Workday,2025-08-01,2025-07-31,21133.23,False,payment for consulting,2026-02-23 16:50:30.516232,Raw_GL_Export.csv
TXN001281,2025-03-27,2025-03-19,2025-03,AUS01,5920,CC3100,Zoom,INV51312,,GBP,27474.3,INPUT,Payment for services,Oracle,2025-03-27,2025-03-19,27474.3,False,payment for services,2026-02-23 16:50:30.516232,Raw_GL_Export.csv
TXN001282,02/09/2026,02/05/2026,2026-02,AUS01,5010,CC1100,Oracle,INV73915,,USD,33088.75,INPUT,Payment for services,Oracle,2026-09-02,2026-05-02,33088.75,False,payment for services,2026-02-23 16:50:30.516232,Raw_GL_Export.csv
TXN001283,09/02/2026,08/02/2026,2026-02,AUS01,5110,CC4000,KPMG Australia,INV21910,PO3671,GBP,3157.75,GST,Payment for goods,Oracle,2026-02-09,2026-02-08,3157.75,False,payment for goods,2026-02-23 16:50:30.516232,Raw_GL_Export.csv
TXN001284,2026-01-10,2026-01-04,2026-01,AUS01,5010,CC3200,AusPost,INV23315,PO8803,NZD,29758.87,EXPORT,Payment for consulting,Workday,2026-01-10,2026-01-04,29758.87,False,payment for consulting,2026-02-23 16:50:30.516232,Raw_GL_Export.csv
TXN001285,01/27/2026,01/20/2026,2026-01,AUS01,5100,CC4100,Oracle,INV93862,PO9795,NZD,2347.09,INPUT,Payment for consulting,Oracle,2026-01-27,2026-01-20,2347.09,False,payment for consulting,2026-02-23 16:50:30.516232,Raw_GL_Export.csv
TXN001286,26-06-2025,23-06-2025,2025-06,AUS01,5310,CC4000,Salesforce,INV86668,PO6623,USD,7084.28,GST,Payment for consulting,Manual Entry,2025-06-26,2025-06-23,7084.28,False,payment for consulting,2026-02-23 16:50:30.516232,Raw_GL_Export.csv
TXN001287,02/25/2026,02/20/2026,2026-02,AUS01,5510,CC1200,Accenture Pty,INV69161,PO2250,GBP,11284.76,GST-FREE,Payment for goods,SAP,2026-02-25,2026-02-20,11284.76,False,payment for goods,2026-02-23 16:50:30.516232,Raw_GL_Export.csv
TXN001288,2026-01-05,2026-01-03,2026-01,AUS01,5010,CC1100,LinkedIn Corp,INV82456,PO1819,AUD,10683.21,INPUT,Payment for services,Manual Entry,2026-01-05,2026-01-03,10683.21,False,payment for services,2026-02-23 16:50:30.516232,Raw_GL_Export.csv
TXN001289,2026-01-28,2026-01-20,2026-01,AUS01,5300,CC1000,ServiceNow Inc,INV56525,,USD,15928.23,INPUT,Payment for subscription,SAP,2026-01-28,2026-01-20,15928.23,False,payment for subscription,2026-02-23 16:50:30.516232,Raw_GL_Export.csv
TXN001290,2026-01-16,2026-01-13,2026-01,AUS01,5120,CC1200,Hays,INV38876,PO3978,GBP,33704.88,GST-FREE,Payment for goods,SAP,2026-01-16,2026-01-13,33704.88,False,payment for goods,2026-02-23 16:50:30.516232,Raw_GL_Export.csv
TXN001291,02/12/2026,02/09/2026,2026-02,AUS01,5110,CC1100,Federal Express,INV99797,PO7266,USD,17022.1,INPUT,Payment for goods,Oracle,2026-12-02,2026-09-02,17022.1,False,payment for goods,2026-02-23 16:50:30.516232,Raw_GL_Export.csv
TXN001292,2026-02-24,2026-02-15,2026-02,AUS01,5910,CC2000,SAP,INV12427,PO9496,NZD,13319.8,EXPORT,Payment for consulting,API Import,2026-02-24,2026-02-15,13319.8,False,payment for consulting,2026-02-23 16:50:30.516232,Raw_GL_Export.csv
TXN001293,02/20/2026,02/19/2026,2026-02,AUS01,5220,CC3200,Amazon,INV90458,PO9314,USD,563.57,INPUT,Payment for subscription,SAP,2026-02-20,2026-02-19,563.57,False,payment for subscription,2026-02-23 16:50:30.516232,Raw_GL_Export.csv
TXN001294,01/20/2026,01/16/2026,2026-01,AUS01,5900,CC3200,Hays,INV62069,PO4427,NZD,28113.74,GST-FREE,Payment for goods,API Import,2026-01-20,2026-01-16,28113.74,False,payment for goods,2026-02-23 16:50:30.516232,Raw_GL_Export.csv
TXN001295,02/24/2026,02/17/2026,2026-02,AUS01,5210,CC2100,Oracle,INV51799,PO3621,GBP,41465.56,EXPORT,Payment for subscription,API Import,2026-02-24,2026-02-17,41465.56,False,payment for subscription,2026-02-23 16:50:30.516232,Raw_GL_Export.csv
TXN001296,2026-01-05,2025-12-29,2026-01,AUS01,5020,CC3100,WeWork Australia,INV13640,PO3583,AUD,6465.02,GST-FREE,Payment for goods,API Import,2026-01-05,2025-12-29,6465.02,False,payment for goods,2026-02-23 16:50:30.516232,Raw_GL_Export.csv
TXN001297,2026-01-10,2026-01-08,2026-01,AUS01,5310,CC3100,Workday,INV51393,PO7590,AUD,6908.4,INPUT,Payment for goods,Manual Entry,2026-01-10,2026-01-08,6908.4,False,payment for goods,2026-02-23 16:50:30.516232,Raw_GL_Export.csv
TXN001298,08-02-2026,05-02-2026,2026-02,AUS01,5620,CC3100,Oracle,INV15602,PO2245,NZD,29917.21,GST-FREE,Payment for subscription,Workday,2026-02-08,2026-02-05,29917.21,False,payment for subscription,2026-02-23 16:50:30.516232,Raw_GL_Export.csv
TXN001299,2025-01-20,2025-01-11,2025-01,AUS01,5310,CC1100,SAP,INV95813,PO1662,USD,32600.93,GST-FREE,Payment for services,Workday,2025-01-20,2025-01-11,32600.93,False,payment for services,2026-02-23 16:50:30.516232,Raw_GL_Export.csv
TXN001300,19/01/2026,16/01/2026,2026-01,AUS01,5020,CC1100,Oracle,INV19996,PO5850,USD,4336.82,GST-FREE,Payment for license,SAP,2026-01-19,2026-01-16,4336.82,False,payment for license,2026-02-23 16:50:30.516232,Raw_GL_Export.csv
TXN001301,01/23/2026,01/14/2026,2026-01,AUS01,5110,CC3100,AusPost,INV11105,,GBP,44615.38,INPUT,Payment for license,SAP,2026-01-23,2026-01-14,44615.38,False,payment for license,2026-02-23 16:50:30.516232,Raw_GL_Export.csv
TXN001302,02/17/2026,02/12/2026,2026-02,AUS01,5520,CC4000,MSFT,INV27506,PO1015,GBP,13987.74,INPUT,Payment for services,Manual Entry,2026-02-17,2026-12-02,13987.74,False,payment for services,2026-02-23 16:50:30.516232,Raw_GL_Export.csv
TXN001303,06-01-2026,29-12-2025,2026-01,AUS01,5620,CC4000,Seek Limited,INV60818,PO5616,USD,37452.68,INPUT,Payment for consulting,Workday,2026-01-06,2025-12-29,37452.68,False,payment for consulting,2026-02-23 16:50:30.516232,Raw_GL_Export.csv
TXN001304,2025-08-25,2025-08-15,2025-08,AUS01,5410,CC1200,Workday,INV90021,,NZD,29666.83,GST,Payment for consulting,Oracle,2025-08-25,2025-08-15,29666.83,False,payment for consulting,2026-02-23 16:50:30.516232,Raw_GL_Export.csv
TXN001305,2025-12-06,2025-12-02,2025-12,AUS01,5120,CC1000,EY Australia,INV90181,,AUD,2141.7,GST-FREE,Payment for goods,SAP,2025-12-06,2025-12-02,2141.7,False,payment for goods,2026-02-23 16:50:30.516232,Raw_GL_Export.csv
TXN001306,10-12-2025,01-12-2025,2025-12,AUS01,5600,CC1100,Google,INV30109,PO7656,GBP,38835.27,EXPORT,Payment for license,API Import,2025-12-10,2025-12-01,38835.27,False,payment for license,2026-02-23 16:50:30.516232,Raw_GL_Export.csv
TXN001307,02/20/2026,02/10/2026,2026-02,AUS01,5710,CC4000,GCP,INV24535,PO1326,USD,23164.56,GST-FREE,Payment for services,Oracle,2026-02-20,2026-10-02,23164.56,False,payment for services,2026-02-23 16:50:30.516232,Raw_GL_Export.csv
TXN001308,14-02-2026,07-02-2026,2026-02,AUS01,5000,CC1200,AWS,INV31141,PO4168,AUD,341.68,GST-FREE,Payment for license,Manual Entry,2026-02-14,2026-02-07,341.68,False,payment for license,2026-02-23 16:50:30.516232,Raw_GL_Export.csv
TXN001309,2025-12-07,2025-12-06,2025-12,AUS01,5310,CC1000,McKinsey,INV82067,PO6820,USD,12229.86,GST-FREE,Payment for license,Oracle,2025-12-07,2025-12-06,12229.86,False,payment for license,2026-02-23 16:50:30.516232,Raw_GL_Export.csv
TXN001310,14/02/2026,04/02/2026,2026-02,AUS01,5810,CC4100,MSFT,INV31497,PO8145,AUD,20354.47,EXPORT,Payment for goods,Oracle,2026-02-14,2026-02-04,20354.47,False,payment for goods,2026-02-23 16:50:30.516232,Raw_GL_Export.csv
TXN001311,06/11/2025,28/10/2025,2025-11,AUS01,5610,CC3100,Workday,INV20918,PO2868,USD,36673.63,EXPORT,Payment for license,Manual Entry,2025-11-06,2025-10-28,36673.63,False,payment for license,2026-02-23 16:50:30.516232,Raw_GL_Export.csv
TXN001312,06-01-2026,29-12-2025,2026-01,AUS01,5100,CC2000,Telstra Corp,INV10107,PO4110,NZD,43434.44,GST,Payment for goods,API Import,2026-01-06,2025-12-29,43434.44,False,payment for goods,2026-02-23 16:50:30.516232,Raw_GL_Export.csv
TXN001313,26/01/2026,22/01/2026,2026-01,AUS01,5210,CC4100,Zoom,INV55787,PO8554,AUD,30318.91,GST-FREE,Payment for license,SAP,2026-01-26,2026-01-22,30318.91,False,payment for license,2026-02-23 16:50:30.516232,Raw_GL_Export.csv
TXN001314,17-02-2026,11-02-2026,2026-02,AUS01,5710,CC1000,DHL Express,INV95281,,GBP,22236.07,GST,Payment for subscription,API Import,2026-02-17,2026-02-11,22236.07,False,payment for subscription,2026-02-23 16:50:30.516232,Raw_GL_Export.csv
TXN001315,2026-02-06,2026-01-28,2026-02,AUS01,5510,CC1100,PWC,INV71222,PO7713,USD,34687.57,GST-FREE,Payment for services,Manual Entry,2026-02-06,2026-01-28,34687.57,False,payment for services,2026-02-23 16:50:30.516232,Raw_GL_Export.csv
TXN001316,2025-11-17,2025-11-11,2025-11,AUS01,5600,CC3100,Accenture Pty,INV33356,PO1272,NZD,15812.46,EXPORT,Payment for goods,Manual Entry,2025-11-17,2025-11-11,15812.46,False,payment for goods,2026-02-23 16:50:30.516232,Raw_GL_Export.csv
TXN001317,10/13/2025,10/06/2025,2025-10,AUS01,5520,CC3100,Adobe,INV28135,PO4344,NZD,25906.1,GST,Payment for subscription,API Import,2025-10-13,2025-06-10,25906.1,False,payment for subscription,2026-02-23 16:50:30.516232,Raw_GL_Export.csv
TXN001318,17/01/2025,11/01/2025,2025-01,AUS01,5310,CC2000,PWC,INV68240,PO3236,GBP,28309.53,GST,Payment for license,API Import,2025-01-17,2025-01-11,28309.53,False,payment for license,2026-02-23 16:50:30.516232,Raw_GL_Export.csv
TXN001319,01-01-2026,27-12-2025,2026-01,AUS01,5620,CC3200,Zoom,INV18248,PO7493,GBP,19095.01,INPUT,Payment for consulting,SAP,2026-01-01,2025-12-27,19095.01,False,payment for consulting,2026-02-23 16:50:30.516232,Raw_GL_Export.csv
TXN001320,2026-02-18,2026-02-09,2026-02,AUS01,5900,CC4100,LinkedIn Corp,INV43411,PO5656,NZD,30901.47,EXPORT,Payment for consulting,Workday,2026-02-18,2026-02-09,30901.47,False,payment for consulting,2026-02-23 16:50:30.516232,Raw_GL_Export.csv
TXN001321,03/01/2026,24/12/2025,2026-01,AUS01,5900,CC4000,EY Australia,INV47876,PO9503,AUD,18551.81,GST-FREE,Payment for subscription,Oracle,2026-01-03,2025-12-24,18551.81,False,payment for subscription,2026-02-23 16:50:30.516232,Raw_GL_Export.csv
TXN001322,2026-02-13,2026-02-06,2026-02,AUS01,5300,CC4100,Amazon,INV89289,,NZD,13121.71,GST,Payment for license,Manual Entry,2026-02-13,2026-02-06,13121.71,False,payment for license,2026-02-23 16:50:30.516232,Raw_GL_Export.csv
TXN001323,08/01/2025,07/29/2025,2025-08,AUS01,5100,CC1000,Adobe,INV15122,PO5749,GBP,6365.39,EXPORT,Payment for license,API Import,2025-01-08,2025-07-29,6365.39,False,payment for license,2026-02-23 16:50:30.516232,Raw_GL_Export.csv
TXN001324,2025-10-02,2025-09-23,2025-10,AUS01,5120,CC2100,Deloitte Touche,INV10071,PO9841,NZD,23451.75,GST-FREE,Payment for license,API Import,2025-10-02,2025-09-23,23451.75,False,payment for license,2026-02-23 16:50:30.516232,Raw_GL_Export.csv
TXN001325,2026-02-07,2026-02-01,2026-02,AUS01,5500,CC2100,Accenture Pty,INV82526,PO4875,GBP,11859.83,GST,Payment for services,Oracle,2026-02-07,2026-02-01,11859.83,False,payment for services,2026-02-23 16:50:30.516232,Raw_GL_Export.csv
TXN001326,08/15/2025,08/14/2025,2025-08,AUS01,5010,CC1000,Workday,INV98974,PO6830,AUD,30616.6,EXPORT,Payment for goods,SAP,2025-08-15,2025-08-14,30616.6,False,payment for goods,2026-02-23 16:50:30.516232,Raw_GL_Export.csv
TXN001327,12-08-2025,07-08-2025,2025-08,AUS01,5100,CC4000,Deloitte Touche,INV66622,PO1848,USD,37163.51,INPUT,Payment for license,Manual Entry,2025-08-12,2025-08-07,37163.51,False,payment for license,2026-02-23 16:50:30.516232,Raw_GL_Export.csv
TXN001328,2025-02-24,2025-02-22,2025-02,AUS01,5510,CC3200,Adobe,INV14093,,GBP,39530.59,GST,Payment for goods,Manual Entry,2025-02-24,2025-02-22,39530.59,False,payment for goods,2026-02-23 16:50:30.516232,Raw_GL_Export.csv
TXN001329,2026-02-12,2026-02-11,2026-02,AUS01,5210,CC2100,KPMG Australia,INV27239,PO1708,NZD,42741.26,INPUT,Payment for consulting,Manual Entry,2026-02-12,2026-02-11,42741.26,False,payment for consulting,2026-02-23 16:50:30.516232,Raw_GL_Export.csv
TXN001330,01/09/2026,01/02/2026,2026-01,AUS01,5520,CC3100,Regus Australia,INV59522,,USD,13609.67,GST,Payment for goods,SAP,2026-09-01,2026-02-01,13609.67,False,payment for goods,2026-02-23 16:50:30.516232,Raw_GL_Export.csv
TXN001331,02/11/2026,02/01/2026,2026-02,AUS01,5610,CC3100,Seek Limited,INV33364,,USD,14262.64,EXPORT,Payment for goods,SAP,2026-11-02,2026-01-02,14262.64,False,payment for goods,2026-02-23 16:50:30.516232,Raw_GL_Export.csv
TXN001332,2025-08-20,2025-08-14,2025-08,AUS01,5210,CC2000,KPMG Australia,INV75392,PO7370,GBP,35711.46,INPUT,Payment for subscription,API Import,2025-08-20,2025-08-14,35711.46,False,payment for subscription,2026-02-23 16:50:30.516232,Raw_GL_Export.csv
TXN001333,08/10/2025,08/04/2025,2025-08,AUS01,5610,CC2000,Telstra Corp,INV80041,,NZD,7765.44,GST-FREE,Payment for services,Manual Entry,2025-10-08,2025-04-08,7765.44,False,payment for services,2026-02-23 16:50:30.516232,Raw_GL_Export.csv
TXN001334,2026-02-27,2026-02-24,2026-02,AUS01,5300,CC3000,WeWork Australia,INV10435,PO7461,USD,4663.07,GST,Payment for goods,Oracle,2026-02-27,2026-02-24,4663.07,False,payment for goods,2026-02-23 16:50:30.516232,Raw_GL_Export.csv
TXN001335,2026-01-03,2025-12-26,2026-01,AUS01,5210,CC1200,LinkedIn Corp,INV80263,PO5036,GBP,7151.68,INPUT,Payment for license,Workday,2026-01-03,2025-12-26,7151.68,False,payment for license,2026-02-23 16:50:30.516232,Raw_GL_Export.csv
TXN001336,02/18/2026,02/12/2026,2026-02,AUS01,5520,CC3000,Adobe,INV32323,PO6673,USD,26342.07,INPUT,Payment for goods,Workday,2026-02-18,2026-12-02,26342.07,False,payment for goods,2026-02-23 16:50:30.516232,Raw_GL_Export.csv
TXN001337,04-02-2026,02-02-2026,2026-02,AUS01,5510,CC3000,Hays,INV18724,,NZD,27711.16,EXPORT,Payment for services,API Import,2026-02-04,2026-02-02,27711.16,False,payment for services,2026-02-23 16:50:30.516232,Raw_GL_Export.csv
TXN001338,2026-02-28,2026-02-22,2026-02,AUS01,5300,CC4100,Google,INV45290,PO6998,NZD,20225.83,INPUT,Payment for goods,Workday,2026-02-28,2026-02-22,20225.83,False,payment for goods,2026-02-23 16:50:30.516232,Raw_GL_Export.csv
TXN001339,25/01/2026,20/01/2026,2026-01,AUS01,5420,CC4000,KPMG Australia,INV25608,PO5919,AUD,37513.68,EXPORT,Payment for license,Manual Entry,2026-01-25,2026-01-20,37513.68,False,payment for license,2026-02-23 16:50:30.516232,Raw_GL_Export.csv
TXN001340,02/07/2026,02/02/2026,2026-02,AUS01,5920,CC4100,Workday,INV76918,PO4641,AUD,15068.31,EXPORT,Payment for goods,SAP,2026-07-02,2026-02-02,15068.31,False,payment for goods,2026-02-23 16:50:30.516232,Raw_GL_Export.csv
TXN001341,17/07/2025,10/07/2025,2025-07,AUS01,5020,CC1100,SAP,INV65983,PO9404,USD,37164.87,GST-FREE,Payment for consulting,API Import,2025-07-17,2025-07-10,37164.87,False,payment for consulting,2026-02-23 16:50:30.516232,Raw_GL_Export.csv
TXN001342,18/11/2025,09/11/2025,2025-11,AUS01,5020,CC3000,Oracle,INV11263,,GBP,24494.4,GST-FREE,Payment for license,Manual Entry,2025-11-18,2025-11-09,24494.4,False,payment for license,2026-02-23 16:50:30.516232,Raw_GL_Export.csv
TXN001343,02/06/2026,02/04/2026,2026-02,AUS01,5310,CC1200,Atlassian Pty,INV52823,PO4484,GBP,31148.78,EXPORT,Payment for subscription,Oracle,2026-06-02,2026-04-02,31148.78,False,payment for subscription,2026-02-23 16:50:30.516232,Raw_GL_Export.csv
TXN001344,2026-02-16,2026-02-14,2026-02,AUS01,5510,CC4100,GCP,INV34640,,NZD,19176.02,EXPORT,Payment for consulting,Manual Entry,2026-02-16,2026-02-14,19176.02,False,payment for consulting,2026-02-23 16:50:30.516232,Raw_GL_Export.csv
TXN001345,03-02-2026,26-01-2026,2026-02,AUS01,5800,CC3100,Adobe,INV50683,,GBP,26539.38,GST,Payment for consulting,Oracle,2026-02-03,2026-01-26,26539.38,False,payment for consulting,2026-02-23 16:50:30.516232,Raw_GL_Export.csv
TXN001346,02/19/2026,02/12/2026,2026-02,AUS01,5620,CC3100,Deloitte Touche,INV14840,,NZD,2464.36,GST,Payment for license,API Import,2026-02-19,2026-12-02,2464.36,False,payment for license,2026-02-23 16:50:30.516232,Raw_GL_Export.csv
TXN001347,09/18/2025,09/10/2025,2025-09,AUS01,5210,CC4100,Amazon,INV31459,,USD,37486.45,INPUT,Payment for services,API Import,2025-09-18,2025-10-09,37486.45,False,payment for services,2026-02-23 16:50:30.516232,Raw_GL_Export.csv
TXN001348,20-03-2025,11-03-2025,2025-03,AUS01,5300,CC2100,Adobe,INV91166,PO8500,NZD,17604.82,INPUT,Payment for license,Workday,2025-03-20,2025-03-11,17604.82,False,payment for license,2026-02-23 16:50:30.516232,Raw_GL_Export.csv
TXN001349,15/02/2026,06/02/2026,2026-02,AUS01,5320,CC3200,BCG,INV77936,PO1841,NZD,33965.09,GST-FREE,Payment for goods,Oracle,2026-02-15,2026-02-06,33965.09,False,payment for goods,2026-02-23 16:50:30.516232,Raw_GL_Export.csv
TXN001350,03-02-2026,24-01-2026,2026-02,AUS01,5420,CC4000,Salesforce,INV93794,PO8403,USD,13535.86,GST-FREE,Payment for services,Manual Entry,2026-02-03,2026-01-24,13535.86,False,payment for services,2026-02-23 16:50:30.516232,Raw_GL_Export.csv
TXN001351,06/01/2025,05/22/2025,2025-06,AUS01,5510,CC2100,Deloitte Touche,INV37015,PO3619,NZD,36508.74,INPUT,Payment for license,Manual Entry,2025-01-06,2025-05-22,36508.74,False,payment for license,2026-02-23 16:50:30.516232,Raw_GL_Export.csv
TXN001352,2025-10-17,2025-10-15,2025-10,AUS01,5120,CC2000,Amazon,INV66939,PO2869,USD,23814.52,INPUT,Payment for services,API Import,2025-10-17,2025-10-15,23814.52,False,payment for services,2026-02-23 16:50:30.516232,Raw_GL_Export.csv
TXN001353,08-01-2026,30-12-2025,2026-01,AUS01,5020,CC2100,BCG,INV90897,PO3734,AUD,39949.11,GST,Payment for services,Manual Entry,2026-01-08,2025-12-30,39949.11,False,payment for services,2026-02-23 16:50:30.516232,Raw_GL_Export.csv
TXN001354,2025-07-15,2025-07-09,2025-07,AUS01,5310,CC1200,Telstra Corp,INV58977,,GBP,26375.53,GST-FREE,Payment for subscription,API Import,2025-07-15,2025-07-09,26375.53,False,payment for subscription,2026-02-23 16:50:30.516232,Raw_GL_Export.csv
TXN001355,2026-02-18,2026-02-10,2026-02,AUS01,5800,CC1000,McKinsey,INV12618,PO2991,USD,5781.49,EXPORT,Payment for services,API Import,2026-02-18,2026-02-10,5781.49,False,payment for services,2026-02-23 16:50:30.516232,Raw_GL_Export.csv
TXN001356,2025-07-08,2025-07-07,2025-07,AUS01,5210,CC4000,Slack,INV55817,,GBP,13901.08,INPUT,Payment for consulting,SAP,2025-07-08,2025-07-07,13901.08,False,payment for consulting,2026-02-23 16:50:30.516232,Raw_GL_Export.csv
TXN001357,2026-01-19,2026-01-10,2026-01,AUS01,5310,CC4000,GCP,INV17994,PO5904,AUD,2017.97,INPUT,Payment for goods,Manual Entry,2026-01-19,2026-01-10,2017.97,False,payment for goods,2026-02-23 16:50:30.516232,Raw_GL_Export.csv
TXN001358,07-02-2026,05-02-2026,2026-02,AUS01,5310,CC4000,Hays,INV28331,PO2292,USD,17122.25,EXPORT,Payment for goods,Workday,2026-02-07,2026-02-05,17122.25,False,payment for goods,2026-02-23 16:50:30.516232,Raw_GL_Export.csv
TXN001359,17-01-2026,07-01-2026,2026-01,AUS01,5210,CC2000,WeWork Australia,INV10932,PO9921,USD,35951.71,GST,Payment for subscription,Manual Entry,2026-01-17,2026-01-07,35951.71,False,payment for subscription,2026-02-23 16:50:30.516232,Raw_GL_Export.csv
TXN001360,11/03/2025,10/29/2025,2025-11,AUS01,5420,CC2000,Google,INV41379,PO4046,NZD,38748.76,EXPORT,Payment for subscription,Workday,2025-03-11,2025-10-29,38748.76,False,payment for subscription,2026-02-23 16:50:30.516232,Raw_GL_Export.csv
TXN001361,2026-02-26,2026-02-24,2026-02,AUS01,5400,CC2100,Accenture Pty,INV96510,,GBP,43047.69,GST,Payment for license,Oracle,2026-02-26,2026-02-24,43047.69,False,payment for license,2026-02-23 16:50:30.516232,Raw_GL_Export.csv
TXN001362,16-02-2026,13-02-2026,2026-02,AUS01,5420,CC1000,Adobe,INV63721,,GBP,44854.9,EXPORT,Payment for goods,Workday,2026-02-16,2026-02-13,44854.9,False,payment for goods,2026-02-23 16:50:30.516232,Raw_GL_Export.csv
TXN001363,2026-01-06,2025-12-30,2026-01,AUS01,5900,CC2100,Deloitte Touche,INV20032,,AUD,36783.31,EXPORT,Payment for services,API Import,2026-01-06,2025-12-30,36783.31,False,payment for services,2026-02-23 16:50:30.516232,Raw_GL_Export.csv
TXN001364,23-01-2026,17-01-2026,2026-01,AUS01,5620,CC2000,BCG,INV15616,PO3038,NZD,18490.8,INPUT,Payment for services,Oracle,2026-01-23,2026-01-17,18490.8,False,payment for services,2026-02-23 16:50:30.516232,Raw_GL_Export.csv
TXN001365,2026-02-22,2026-02-19,2026-02,AUS01,5500,CC2000,AWS,INV37332,PO9341,NZD,6507.68,EXPORT,Payment for services,Workday,2026-02-22,2026-02-19,6507.68,False,payment for services,2026-02-23 16:50:30.516232,Raw_GL_Export.csv
TXN001366,02/21/2026,02/16/2026,2026-02,AUS01,5420,CC1100,ServiceNow Inc,INV85411,PO1735,NZD,35761.69,GST,Payment for consulting,Manual Entry,2026-02-21,2026-02-16,35761.69,False,payment for consulting,2026-02-23 16:50:30.516232,Raw_GL_Export.csv
TXN001367,02/13/2025,02/03/2025,2025-02,AUS01,5620,CC1000,Oracle,INV90434,PO5417,USD,22803.97,INPUT,Payment for subscription,Workday,2025-02-13,2025-03-02,22803.97,False,payment for subscription,2026-02-23 16:50:30.516232,Raw_GL_Export.csv
TXN001368,04/12/2025,28/11/2025,2025-12,AUS01,5520,CC3200,Slack,INV35761,,GBP,5635.54,INPUT,Payment for consulting,API Import,2025-12-04,2025-11-28,5635.54,False,payment for consulting,2026-02-23 16:50:30.516232,Raw_GL_Export.csv
TXN001369,2025-12-18,2025-12-16,2025-12,AUS01,5810,CC3100,PWC,INV87417,PO9564,AUD,9218.97,GST-FREE,Payment for services,API Import,2025-12-18,2025-12-16,9218.97,False,payment for services,2026-02-23 16:50:30.516232,Raw_GL_Export.csv
TXN001370,16/06/2025,07/06/2025,2025-06,AUS01,5500,CC3200,WeWork Australia,INV63045,,USD,32980.18,GST-FREE,Payment for consulting,Manual Entry,2025-06-16,2025-06-07,32980.18,False,payment for consulting,2026-02-23 16:50:30.516232,Raw_GL_Export.csv
TXN001371,02/01/2026,01/30/2026,2026-02,AUS01,5210,CC1000,AWS,INV35297,PO7867,AUD,42399.37,INPUT,Payment for services,Oracle,2026-01-02,2026-01-30,42399.37,False,payment for services,2026-02-23 16:50:30.516232,Raw_GL_Export.csv
TXN001372,18/01/2026,11/01/2026,2026-01,AUS01,5110,CC3000,Deloitte Touche,INV18889,PO3791,USD,43647.99,INPUT,Payment for goods,SAP,2026-01-18,2026-01-11,43647.99,False,payment for goods,2026-02-23 16:50:30.516232,Raw_GL_Export.csv
TXN001373,2025-05-20,2025-05-14,2025-05,AUS01,5420,CC3200,Slack,INV18688,,AUD,12157.04,INPUT,Payment for consulting,API Import,2025-05-20,2025-05-14,12157.04,False,payment for consulting,2026-02-23 16:50:30.516232,Raw_GL_Export.csv
TXN001374,01/27/2026,01/25/2026,2026-01,AUS01,5600,CC2000,Adobe,INV82199,PO1974,NZD,16768.29,GST-FREE,Payment for license,Manual Entry,2026-01-27,2026-01-25,16768.29,False,payment for license,2026-02-23 16:50:30.516232,Raw_GL_Export.csv
TXN001375,09/23/2025,09/21/2025,2025-09,AUS01,5620,CC1200,Zoom,INV13691,PO8776,NZD,24524.98,EXPORT,Payment for goods,Manual Entry,2025-09-23,2025-09-21,24524.98,False,payment for goods,2026-02-23 16:50:30.516232,Raw_GL_Export.csv
TXN001376,09-05-2025,05-05-2025,2025-05,AUS01,5120,CC1200,Regus Australia,INV28894,,AUD,44634.32,INPUT,Payment for services,Workday,2025-05-09,2025-05-05,44634.32,False,payment for services,2026-02-23 16:50:30.516232,Raw_GL_Export.csv
TXN001377,27/02/2026,24/02/2026,2026-02,AUS01,5410,CC1100,GCP,INV60144,PO2625,AUD,1691.53,INPUT,Payment for consulting,Oracle,2026-02-27,2026-02-24,1691.53,False,payment for consulting,2026-02-23 16:50:30.516232,Raw_GL_Export.csv
TXN001378,02-01-2026,01-01-2026,2026-01,AUS01,5110,CC4000,DHL Express,INV17351,PO3481,GBP,31281.19,GST-FREE,Payment for services,SAP,2026-01-02,2026-01-01,31281.19,False,payment for services,2026-02-23 16:50:30.516232,Raw_GL_Export.csv
TXN001379,01/20/2026,01/16/2026,2026-01,AUS01,5400,CC3100,Slack,INV63643,PO1510,AUD,25748.73,GST-FREE,Payment for services,Workday,2026-01-20,2026-01-16,25748.73,False,payment for services,2026-02-23 16:50:30.516232,Raw_GL_Export.csv
TXN001380,15-02-2026,05-02-2026,2026-02,AUS01,5310,CC1000,MSFT,INV53717,PO1201,AUD,22322.48,GST-FREE,Payment for services,Manual Entry,2026-02-15,2026-02-05,22322.48,False,payment for services,2026-02-23 16:50:30.516232,Raw_GL_Export.csv
TXN001381,07-02-2026,05-02-2026,2026-02,AUS01,5200,CC1000,Optus Pty,INV36764,PO7236,USD,7295.12,GST,Payment for license,SAP,2026-02-07,2026-02-05,7295.12,False,payment for license,2026-02-23 16:50:30.516232,Raw_GL_Export.csv
TXN001382,24-01-2026,22-01-2026,2026-01,AUS01,5620,CC3100,Hays,INV43277,PO5576,USD,8435.14,GST,Payment for consulting,SAP,2026-01-24,2026-01-22,8435.14,False,payment for consulting,2026-02-23 16:50:30.516232,Raw_GL_Export.csv
TXN001383,2025-10-16,2025-10-06,2025-10,AUS01,5120,CC4000,Salesforce,INV43663,PO7669,GBP,37557.13,EXPORT,Payment for services,Oracle,2025-10-16,2025-10-06,37557.13,False,payment for services,2026-02-23 16:50:30.516232,Raw_GL_Export.csv
TXN001384,27/02/2026,22/02/2026,2026-02,AUS01,5300,CC1200,Oracle,INV12018,,NZD,6575.69,EXPORT,Payment for goods,Oracle,2026-02-27,2026-02-22,6575.69,False,payment for goods,2026-02-23 16:50:30.516232,Raw_GL_Export.csv
TXN001385,04/19/2025,04/17/2025,2025-04,AUS01,5110,CC1000,PWC,INV72188,PO7157,NZD,33411.66,EXPORT,Payment for license,SAP,2025-04-19,2025-04-17,33411.66,False,payment for license,2026-02-23 16:50:30.516232,Raw_GL_Export.csv
TXN001386,07/01/2026,31/12/2025,2026-01,AUS01,5620,CC3000,McKinsey,INV71646,PO8628,AUD,10186.75,GST-FREE,Payment for license,Workday,2026-01-07,2025-12-31,10186.75,False,payment for license,2026-02-23 16:50:30.516232,Raw_GL_Export.csv
TXN001387,2025-08-24,2025-08-21,2025-08,AUS01,5220,CC3000,WeWork Australia,INV27224,,NZD,5126.41,GST,Payment for license,SAP,2025-08-24,2025-08-21,5126.41,False,payment for license,2026-02-23 16:50:30.516232,Raw_GL_Export.csv
TXN001388,2025-07-11,2025-07-08,2025-07,AUS01,5900,CC3100,DHL Express,INV43462,PO8011,NZD,32989.56,EXPORT,Payment for license,Manual Entry,2025-07-11,2025-07-08,32989.56,False,payment for license,2026-02-23 16:50:30.516232,Raw_GL_Export.csv
TXN001389,05/02/2026,28/01/2026,2026-02,AUS01,5400,CC1000,AWS,INV13097,PO4780,NZD,14107.07,INPUT,Payment for consulting,API Import,2026-02-05,2026-01-28,14107.07,False,payment for consulting,2026-02-23 16:50:30.516232,Raw_GL_Export.csv
TXN001390,2026-02-03,2026-01-24,2026-02,AUS01,5010,CC3200,KPMG Australia,INV15716,,USD,3950.36,INPUT,Payment for license,API Import,2026-02-03,2026-01-24,3950.36,False,payment for license,2026-02-23 16:50:30.516232,Raw_GL_Export.csv
TXN001391,27/05/2025,20/05/2025,2025-05,AUS01,5610,CC1200,SAP,INV80822,,NZD,44086.17,INPUT,Payment for consulting,Workday,2025-05-27,2025-05-20,44086.17,False,payment for consulting,2026-02-23 16:50:30.516232,Raw_GL_Export.csv
TXN001392,2026-01-15,2026-01-06,2026-01,AUS01,5120,CC1100,ServiceNow Inc,INV34574,,GBP,14403.39,EXPORT,Payment for services,Oracle,2026-01-15,2026-01-06,14403.39,False,payment for services,2026-02-23 16:50:30.516232,Raw_GL_Export.csv
TXN001393,03/02/2026,30/01/2026,2026-02,AUS01,5800,CC3200,Zoom,INV10195,PO4568,AUD,16231.65,INPUT,Payment for services,SAP,2026-02-03,2026-01-30,16231.65,False,payment for services,2026-02-23 16:50:30.516232,Raw_GL_Export.csv
TXN001394,2026-02-01,2026-01-23,2026-02,AUS01,5510,CC3100,Accenture Pty,INV69432,,NZD,33495.58,EXPORT,Payment for services,API Import,2026-02-01,2026-01-23,33495.58,False,payment for services,2026-02-23 16:50:30.516232,Raw_GL_Export.csv
TXN001395,2026-02-01,2026-01-23,2026-02,AUS01,5510,CC4100,Google,INV10347,,AUD,11420.3,EXPORT,Payment for services,Manual Entry,2026-02-01,2026-01-23,11420.3,False,payment for services,2026-02-23 16:50:30.516232,Raw_GL_Export.csv
TXN001396,19/01/2026,15/01/2026,2026-01,AUS01,5110,CC3200,SAP,INV90973,,GBP,33423.19,EXPORT,Payment for services,API Import,2026-01-19,2026-01-15,33423.19,False,payment for services,2026-02-23 16:50:30.516232,Raw_GL_Export.csv
TXN001397,01/26/2026,01/21/2026,2026-01,AUS01,5520,CC1100,Telstra Corp,INV42105,,GBP,44998.87,EXPORT,Payment for services,API Import,2026-01-26,2026-01-21,44998.87,False,payment for services,2026-02-23 16:50:30.516232,Raw_GL_Export.csv
TXN001398,01/27/2026,01/23/2026,2026-01,AUS01,5210,CC3100,Atlassian Pty,INV68414,,AUD,32563.26,GST-FREE,Payment for services,API Import,2026-01-27,2026-01-23,32563.26,False,payment for services,2026-02-23 16:50:30.516232,Raw_GL_Export.csv
TXN001399,02/03/2026,02/01/2026,2026-02,AUS01,5700,CC4100,Regus Australia,INV85147,PO6063,NZD,14904.7,GST-FREE,Payment for goods,SAP,2026-03-02,2026-01-02,14904.7,False,payment for goods,2026-02-23 16:50:30.516232,Raw_GL_Export.csv
TXN001400,08/07/2025,08/06/2025,2025-08,AUS01,5020,CC3000,Workday,INV64116,PO8315,NZD,34342.5,INPUT,Payment for subscription,Manual Entry,2025-07-08,2025-06-08,34342.5,False,payment for subscription,2026-02-23 16:50:30.516232,Raw_GL_Export.csv
TXN001401,10/19/2025,10/14/2025,2025-10,AUS01,5600,CC2100,DHL Express,INV22516,,GBP,19928.59,GST,Payment for goods,Workday,2025-10-19,2025-10-14,19928.59,False,payment for goods,2026-02-23 16:50:30.516232,Raw_GL_Export.csv
TXN001402,2026-02-21,2026-02-18,2026-02,AUS01,5710,CC4000,Google,INV77284,PO5734,USD,41437.21,GST-FREE,Payment for services,Oracle,2026-02-21,2026-02-18,41437.21,False,payment for services,2026-02-23 16:50:30.516232,Raw_GL_Export.csv
TXN001403,13/04/2025,12/04/2025,2025-04,AUS01,5510,CC3000,Robert Half International,INV27818,PO6873,AUD,22409.94,INPUT,Payment for goods,Manual Entry,2025-04-13,2025-04-12,22409.94,False,payment for goods,2026-02-23 16:50:30.516232,Raw_GL_Export.csv
TXN001404,10/01/2026,06/01/2026,2026-01,AUS01,5320,CC3200,Amazon,INV91232,,AUD,13330.2,GST-FREE,Payment for license,Oracle,2026-01-10,2026-01-06,13330.2,False,payment for license,2026-02-23 16:50:30.516232,Raw_GL_Export.csv
TXN001405,01/18/2026,01/16/2026,2026-01,AUS01,5520,CC1100,AusPost,INV55344,PO5699,AUD,28312.55,INPUT,Payment for consulting,SAP,2026-01-18,2026-01-16,28312.55,False,payment for consulting,2026-02-23 16:50:30.516232,Raw_GL_Export.csv
TXN001406,2025-12-02,2025-11-24,2025-12,AUS01,5610,CC1200,ServiceNow Inc,INV13084,,AUD,11976.15,EXPORT,Payment for goods,API Import,2025-12-02,2025-11-24,11976.15,False,payment for goods,2026-02-23 16:50:30.516232,Raw_GL_Export.csv
TXN001407,08/01/2026,31/12/2025,2026-01,AUS01,5020,CC1000,Google,INV84422,PO7999,USD,9102.62,GST-FREE,Payment for services,Workday,2026-01-08,2025-12-31,9102.62,False,payment for services,2026-02-23 16:50:30.516232,Raw_GL_Export.csv
TXN001408,03/01/2026,02/01/2026,2026-01,AUS01,5620,CC2100,Regus Australia,INV67045,PO4676,AUD,22449.36,EXPORT,Payment for subscription,Workday,2026-01-03,2026-01-02,22449.36,False,payment for subscription,2026-02-23 16:50:30.516232,Raw_GL_Export.csv
TXN001409,2025-04-13,2025-04-08,2025-04,AUS01,5620,CC1200,Zoom,INV93101,,GBP,18911.39,GST-FREE,Payment for services,SAP,2025-04-13,2025-04-08,18911.39,False,payment for services,2026-02-23 16:50:30.516232,Raw_GL_Export.csv
TXN001410,2025-01-20,2025-01-14,2025-01,AUS01,5210,CC1000,Regus Australia,INV50517,PO3439,GBP,32391.11,GST-FREE,Payment for subscription,Oracle,2025-01-20,2025-01-14,32391.11,False,payment for subscription,2026-02-23 16:50:30.516232,Raw_GL_Export.csv
TXN001411,12-03-2025,10-03-2025,2025-03,AUS01,5500,CC3100,Adobe,INV99048,,USD,42315.04,GST,Payment for consulting,Oracle,2025-03-12,2025-03-10,42315.04,False,payment for consulting,2026-02-23 16:50:30.516232,Raw_GL_Export.csv
TXN001412,13-10-2025,12-10-2025,2025-10,AUS01,5510,CC3100,AusPost,INV30007,PO5522,GBP,42079.14,EXPORT,Payment for services,API Import,2025-10-13,2025-10-12,42079.14,False,payment for services,2026-02-23 16:50:30.516232,Raw_GL_Export.csv
TXN001413,15-11-2025,06-11-2025,2025-11,AUS01,5420,CC4000,PWC,INV96820,,NZD,21351.39,GST,Payment for services,Oracle,2025-11-15,2025-11-06,21351.39,False,payment for services,2026-02-23 16:50:30.516232,Raw_GL_Export.csv
TXN001414,2026-02-12,2026-02-11,2026-02,AUS01,5410,CC1100,Robert Half International,INV49496,PO3057,NZD,22576.87,EXPORT,Payment for goods,Workday,2026-02-12,2026-02-11,22576.87,False,payment for goods,2026-02-23 16:50:30.516232,Raw_GL_Export.csv
TXN001415,01/28/2025,01/24/2025,2025-01,AUS01,5300,CC1000,EY Australia,INV81786,,GBP,39553.86,EXPORT,Payment for services,Oracle,2025-01-28,2025-01-24,39553.86,False,payment for services,2026-02-23 16:50:30.516232,Raw_GL_Export.csv
TXN001416,02/03/2026,01/27/2026,2026-02,AUS01,5910,CC2100,WeWork Australia,INV12253,PO5528,USD,16125.58,GST-FREE,Payment for subscription,SAP,2026-03-02,2026-01-27,16125.58,False,payment for subscription,2026-02-23 16:50:30.516232,Raw_GL_Export.csv
TXN001417,2026-01-25,2026-01-23,2026-01,AUS01,5700,CC4100,Hays,INV79624,,USD,24646.92,GST,Payment for goods,SAP,2026-01-25,2026-01-23,24646.92,False,payment for goods,2026-02-23 16:50:30.516232,Raw_GL_Export.csv
TXN001418,28-01-2026,24-01-2026,2026-01,AUS01,5300,CC2000,BCG,INV18489,PO5542,NZD,22569.88,GST-FREE,Payment for license,Manual Entry,2026-01-28,2026-01-24,22569.88,False,payment for license,2026-02-23 16:50:30.516232,Raw_GL_Export.csv
TXN001419,2026-01-18,2026-01-11,2026-01,AUS01,5400,CC2100,Amazon,INV15733,,NZD,38118.73,GST,Payment for goods,Workday,2026-01-18,2026-01-11,38118.73,False,payment for goods,2026-02-23 16:50:30.516232,Raw_GL_Export.csv
TXN001420,10/08/2025,05/08/2025,2025-08,AUS01,5020,CC1200,Accenture Pty,INV16679,PO9648,AUD,5419.03,EXPORT,Payment for consulting,SAP,2025-08-10,2025-08-05,5419.03,False,payment for consulting,2026-02-23 16:50:30.516232,Raw_GL_Export.csv
TXN001421,27/02/2026,19/02/2026,2026-02,AUS01,5110,CC1100,Robert Half International,INV36559,,GBP,2473.93,GST,Payment for goods,SAP,2026-02-27,2026-02-19,2473.93,False,payment for goods,2026-02-23 16:50:30.516232,Raw_GL_Export.csv
TXN001422,20-02-2025,11-02-2025,2025-02,AUS01,5910,CC4100,MSFT,INV14251,PO4438,AUD,4117.0,INPUT,Payment for subscription,Manual Entry,2025-02-20,2025-02-11,4117.0,False,payment for subscription,2026-02-23 16:50:30.516232,Raw_GL_Export.csv
TXN001423,2026-02-27,2026-02-23,2026-02,AUS01,5100,CC3200,GCP,INV15975,PO2719,GBP,34310.55,EXPORT,Payment for consulting,Oracle,2026-02-27,2026-02-23,34310.55,False,payment for consulting,2026-02-23 16:50:30.516232,Raw_GL_Export.csv
TXN001424,02/25/2026,02/15/2026,2026-02,AUS01,5810,CC1000,Robert Half International,INV93379,PO9583,NZD,4523.65,INPUT,Payment for subscription,Workday,2026-02-25,2026-02-15,4523.65,False,payment for subscription,2026-02-23 16:50:30.516232,Raw_GL_Export.csv
TXN001425,2025-06-01,2025-05-30,2025-06,AUS01,5200,CC3200,BCG,INV25647,,USD,15262.6,GST-FREE,Payment for goods,API Import,2025-06-01,2025-05-30,15262.6,False,payment for goods,2026-02-23 16:50:30.516232,Raw_GL_Export.csv
TXN001426,17-01-2026,08-01-2026,2026-01,AUS01,5800,CC1000,Seek Limited,INV39713,PO7807,USD,35094.59,GST,Payment for services,Manual Entry,2026-01-17,2026-01-08,35094.59,False,payment for services,2026-02-23 16:50:30.516232,Raw_GL_Export.csv
TXN001427,2026-01-01,2025-12-22,2026-01,AUS01,5500,CC1200,Slack,INV42940,PO2976,USD,30490.39,EXPORT,Payment for license,Oracle,2026-01-01,2025-12-22,30490.39,False,payment for license,2026-02-23 16:50:30.516232,Raw_GL_Export.csv
TXN001428,07/16/2025,07/12/2025,2025-07,AUS01,5010,CC3200,AusPost,INV33863,PO9962,AUD,40495.2,GST,Payment for services,API Import,2025-07-16,2025-12-07,40495.2,False,payment for services,2026-02-23 16:50:30.516232,Raw_GL_Export.csv
TXN001429,02/12/2026,02/04/2026,2026-02,AUS01,5920,CC4000,Microsoft,INV97704,PO4181,AUD,7720.27,INPUT,Payment for goods,Oracle,2026-12-02,2026-04-02,7720.27,False,payment for goods,2026-02-23 16:50:30.516232,Raw_GL_Export.csv
TXN001430,13/01/2026,10/01/2026,2026-01,AUS01,5910,CC1100,DHL Express,INV88966,PO7265,AUD,35541.46,EXPORT,Payment for license,Workday,2026-01-13,2026-01-10,35541.46,False,payment for license,2026-02-23 16:50:30.516232,Raw_GL_Export.csv
TXN001431,28-02-2026,23-02-2026,2026-02,AUS01,5400,CC3200,Amazon,INV18689,PO2939,GBP,36058.03,INPUT,Payment for goods,API Import,2026-02-28,2026-02-23,36058.03,False,payment for goods,2026-02-23 16:50:30.516232,Raw_GL_Export.csv
TXN001432,01/28/2026,01/25/2026,2026-01,AUS01,5020,CC3000,MSFT,INV29030,PO1072,AUD,37758.96,INPUT,Payment for consulting,SAP,2026-01-28,2026-01-25,37758.96,False,payment for consulting,2026-02-23 16:50:30.516232,Raw_GL_Export.csv
TXN001433,07/02/2026,01/02/2026,2026-02,AUS01,5010,CC4000,Deloitte Touche,INV24746,PO4639,USD,12764.91,GST-FREE,Payment for license,Oracle,2026-02-07,2026-02-01,12764.91,False,payment for license,2026-02-23 16:50:30.516232,Raw_GL_Export.csv
TXN001434,01/10/2026,01/01/2026,2026-01,AUS01,5020,CC2000,Amazon,INV65716,PO2222,AUD,13634.11,GST,Payment for services,Workday,2026-10-01,2026-01-01,13634.11,False,payment for services,2026-02-23 16:50:30.516232,Raw_GL_Export.csv
TXN001435,28/11/2025,27/11/2025,2025-11,AUS01,5110,CC1100,Regus Australia,INV82096,PO5764,AUD,17029.86,INPUT,Payment for consulting,Oracle,2025-11-28,2025-11-27,17029.86,False,payment for consulting,2026-02-23 16:50:30.516232,Raw_GL_Export.csv
TXN001436,06/08/2025,06/04/2025,2025-06,AUS01,5300,CC4000,Google,INV25530,PO5524,AUD,241.0,GST,Payment for consulting,Manual Entry,2025-08-06,2025-04-06,241.0,False,payment for consulting,2026-02-23 16:50:30.516232,Raw_GL_Export.csv
TXN001437,09/02/2026,01/02/2026,2026-02,AUS01,5510,CC4100,Telstra Corp,INV82326,PO2821,AUD,14470.57,GST-FREE,Payment for goods,API Import,2026-02-09,2026-02-01,14470.57,False,payment for goods,2026-02-23 16:50:30.516232,Raw_GL_Export.csv
TXN001438,2025-07-25,2025-07-17,2025-07,AUS01,5500,CC3000,GCP,INV83765,PO2613,USD,10616.04,INPUT,Payment for subscription,Workday,2025-07-25,2025-07-17,10616.04,False,payment for subscription,2026-02-23 16:50:30.516232,Raw_GL_Export.csv
TXN001439,09/01/2026,02/01/2026,2026-01,AUS01,5920,CC1000,LinkedIn Corp,INV12472,,USD,10296.02,EXPORT,Payment for subscription,Manual Entry,2026-01-09,2026-01-02,10296.02,False,payment for subscription,2026-02-23 16:50:30.516232,Raw_GL_Export.csv
TXN001440,01/25/2026,01/20/2026,2026-01,AUS01,5410,CC3200,LinkedIn Corp,INV67873,,USD,1746.86,GST,Payment for consulting,Oracle,2026-01-25,2026-01-20,1746.86,False,payment for consulting,2026-02-23 16:50:30.516232,Raw_GL_Export.csv
TXN001441,02-02-2026,31-01-2026,2026-02,AUS01,5320,CC3100,Deloitte Touche,INV73065,PO2002,GBP,23966.98,GST-FREE,Payment for goods,SAP,2026-02-02,2026-01-31,23966.98,False,payment for goods,2026-02-23 16:50:30.516232,Raw_GL_Export.csv
TXN001442,02/16/2026,02/11/2026,2026-02,AUS01,5210,CC4000,Amazon,INV19554,PO9245,USD,40001.16,INPUT,Payment for subscription,Manual Entry,2026-02-16,2026-11-02,40001.16,False,payment for subscription,2026-02-23 16:50:30.516232,Raw_GL_Export.csv
TXN001443,22/01/2026,15/01/2026,2026-01,AUS01,5010,CC1200,Oracle,INV99817,PO3416,NZD,11754.25,EXPORT,Payment for consulting,Oracle,2026-01-22,2026-01-15,11754.25,False,payment for consulting,2026-02-23 16:50:30.516232,Raw_GL_Export.csv
TXN001444,01/18/2026,01/17/2026,2026-01,AUS01,5420,CC3100,Telstra Corp,INV95551,PO4389,NZD,6211.19,EXPORT,Payment for goods,Manual Entry,2026-01-18,2026-01-17,6211.19,False,payment for goods,2026-02-23 16:50:30.516232,Raw_GL_Export.csv
TXN001445,03/01/2026,28/12/2025,2026-01,AUS01,5200,CC4000,DHL Express,INV56941,PO4569,GBP,18848.85,GST-FREE,Payment for license,Manual Entry,2026-01-03,2025-12-28,18848.85,False,payment for license,2026-02-23 16:50:30.516232,Raw_GL_Export.csv
TXN001446,24-02-2026,14-02-2026,2026-02,AUS01,5010,CC3100,Amazon,INV87505,PO3889,NZD,23313.86,EXPORT,Payment for services,Workday,2026-02-24,2026-02-14,23313.86,False,payment for services,2026-02-23 16:50:30.516232,Raw_GL_Export.csv
TXN001447,02/25/2026,02/21/2026,2026-02,AUS01,5220,CC1000,WeWork Australia,INV72162,,AUD,30959.96,GST-FREE,Payment for consulting,SAP,2026-02-25,2026-02-21,30959.96,False,payment for consulting,2026-02-23 16:50:30.516232,Raw_GL_Export.csv
TXN001448,11-02-2025,04-02-2025,2025-02,AUS01,5220,CC1000,McKinsey,INV63935,PO8760,USD,30713.33,INPUT,Payment for license,API Import,2025-02-11,2025-02-04,30713.33,False,payment for license,2026-02-23 16:50:30.516232,Raw_GL_Export.csv
TXN001449,15-10-2025,09-10-2025,2025-10,AUS01,5320,CC2100,Adobe,INV41619,PO9633,GBP,38289.17,GST,Payment for subscription,Oracle,2025-10-15,2025-10-09,38289.17,False,payment for subscription,2026-02-23 16:50:30.516232,Raw_GL_Export.csv
TXN001450,28/02/2026,20/02/2026,2026-02,AUS01,5200,CC3100,Slack,INV17816,PO3874,GBP,32816.06,GST-FREE,Payment for goods,Manual Entry,2026-02-28,2026-02-20,32816.06,False,payment for goods,2026-02-23 16:50:30.516232,Raw_GL_Export.csv
TXN001451,2026-02-04,2026-02-02,2026-02,AUS01,5910,CC3200,Regus Australia,INV74463,,GBP,19224.09,GST,Payment for goods,SAP,2026-02-04,2026-02-02,19224.09,False,payment for goods,2026-02-23 16:50:30.516232,Raw_GL_Export.csv
TXN001452,01/25/2026,01/22/2026,2026-01,AUS01,5610,CC4000,Regus Australia,INV85644,PO1530,AUD,13073.86,EXPORT,Payment for subscription,Oracle,2026-01-25,2026-01-22,13073.86,False,payment for subscription,2026-02-23 16:50:30.516232,Raw_GL_Export.csv
TXN001453,04-02-2026,25-01-2026,2026-02,AUS01,5000,CC2000,Oracle,INV64160,PO1227,USD,1428.5,GST-FREE,Payment for services,Workday,2026-02-04,2026-01-25,1428.5,False,payment for services,2026-02-23 16:50:30.516232,Raw_GL_Export.csv
TXN001454,06-02-2026,01-02-2026,2026-02,AUS01,5500,CC1100,MSFT,INV69058,PO1316,GBP,24631.89,GST,Payment for goods,SAP,2026-02-06,2026-02-01,24631.89,False,payment for goods,2026-02-23 16:50:30.516232,Raw_GL_Export.csv
TXN001455,13/02/2026,05/02/2026,2026-02,AUS01,5810,CC1000,BCG,INV86454,,AUD,42367.17,INPUT,Payment for goods,Manual Entry,2026-02-13,2026-02-05,42367.17,False,payment for goods,2026-02-23 16:50:30.516232,Raw_GL_Export.csv
TXN001456,27-01-2026,24-01-2026,2026-01,AUS01,5220,CC2100,Federal Express,INV30959,PO8267,USD,38391.24,EXPORT,Payment for consulting,Oracle,2026-01-27,2026-01-24,38391.24,False,payment for consulting,2026-02-23 16:50:30.516232,Raw_GL_Export.csv
TXN001457,2026-02-18,2026-02-09,2026-02,AUS01,5210,CC4100,Microsoft,INV44093,,GBP,34054.82,INPUT,Payment for subscription,API Import,2026-02-18,2026-02-09,34054.82,False,payment for subscription,2026-02-23 16:50:30.516232,Raw_GL_Export.csv
TXN001458,09/24/2025,09/22/2025,2025-09,AUS01,5710,CC4100,ServiceNow Inc,INV74652,,USD,5812.2,GST-FREE,Payment for services,Oracle,2025-09-24,2025-09-22,5812.2,False,payment for services,2026-02-23 16:50:30.516232,Raw_GL_Export.csv
TXN001459,2026-02-19,2026-02-12,2026-02,AUS01,5210,CC3000,MSFT,INV17798,,NZD,43874.82,EXPORT,Payment for consulting,Manual Entry,2026-02-19,2026-02-12,43874.82,False,payment for consulting,2026-02-23 16:50:30.516232,Raw_GL_Export.csv
TXN001460,15-10-2025,09-10-2025,2025-10,AUS01,5910,CC1200,LinkedIn Corp,INV56648,PO9015,USD,24928.12,INPUT,Payment for subscription,API Import,2025-10-15,2025-10-09,24928.12,False,payment for subscription,2026-02-23 16:50:30.516232,Raw_GL_Export.csv
TXN001461,02/24/2026,02/23/2026,2026-02,AUS01,5420,CC1000,Robert Half International,INV64879,PO6953,GBP,13630.73,GST,Payment for consulting,SAP,2026-02-24,2026-02-23,13630.73,False,payment for consulting,2026-02-23 16:50:30.516232,Raw_GL_Export.csv
TXN001462,2025-12-06,2025-11-27,2025-12,AUS01,5000,CC1100,Adobe,INV58680,PO5903,AUD,7549.09,GST,Payment for goods,API Import,2025-12-06,2025-11-27,7549.09,False,payment for goods,2026-02-23 16:50:30.516232,Raw_GL_Export.csv
TXN001463,11/02/2025,10/28/2025,2025-11,AUS01,5520,CC4100,Microsoft,INV55678,PO5051,USD,7883.54,GST-FREE,Payment for goods,Oracle,2025-02-11,2025-10-28,7883.54,False,payment for goods,2026-02-23 16:50:30.516232,Raw_GL_Export.csv
TXN001464,01/02/2026,28/01/2026,2026-02,AUS01,5320,CC1100,Microsoft,INV55095,PO1972,USD,36450.48,INPUT,Payment for services,API Import,2026-02-01,2026-01-28,36450.48,False,payment for services,2026-02-23 16:50:30.516232,Raw_GL_Export.csv
TXN001465,24/06/2025,18/06/2025,2025-06,AUS01,5300,CC3000,Microsoft,INV37282,PO5023,USD,38503.7,INPUT,Payment for goods,Oracle,2025-06-24,2025-06-18,38503.7,False,payment for goods,2026-02-23 16:50:30.516232,Raw_GL_Export.csv
TXN001466,10/02/2026,03/02/2026,2026-02,AUS01,5120,CC4100,Telstra Corp,INV55458,PO9820,USD,425.19,GST,Payment for goods,SAP,2026-02-10,2026-02-03,425.19,False,payment for goods,2026-02-23 16:50:30.516232,Raw_GL_Export.csv
TXN001467,02/05/2026,01/31/2026,2026-02,AUS01,5020,CC1200,MSFT,INV51032,PO3193,GBP,35125.4,EXPORT,Payment for services,SAP,2026-05-02,2026-01-31,35125.4,False,payment for services,2026-02-23 16:50:30.516232,Raw_GL_Export.csv
TXN001468,05/02/2026,28/01/2026,2026-02,AUS01,5400,CC2000,Salesforce,INV46419,,GBP,20744.38,INPUT,Payment for services,Manual Entry,2026-02-05,2026-01-28,20744.38,False,payment for services,2026-02-23 16:50:30.516232,Raw_GL_Export.csv
TXN001469,02/06/2026,02/04/2026,2026-02,AUS01,5600,CC2000,Optus Pty,INV86802,,NZD,28033.82,GST,Payment for consulting,Manual Entry,2026-06-02,2026-04-02,28033.82,False,payment for consulting,2026-02-23 16:50:30.516232,Raw_GL_Export.csv
TXN001470,03/10/2025,01/10/2025,2025-10,AUS01,5500,CC3000,ServiceNow Inc,INV45922,PO3476,GBP,5852.09,EXPORT,Payment for license,Manual Entry,2025-10-03,2025-10-01,5852.09,False,payment for license,2026-02-23 16:50:30.516232,Raw_GL_Export.csv
TXN001471,09-02-2026,07-02-2026,2026-02,AUS01,5110,CC1000,Telstra Corp,INV13466,,AUD,20240.74,GST-FREE,Payment for license,Oracle,2026-02-09,2026-02-07,20240.74,False,payment for license,2026-02-23 16:50:30.516232,Raw_GL_Export.csv
TXN001472,02/22/2026,02/16/2026,2026-02,AUS01,5920,CC1200,PWC,INV18230,PO4772,AUD,8678.23,GST,Payment for subscription,Workday,2026-02-22,2026-02-16,8678.23,False,payment for subscription,2026-02-23 16:50:30.516232,Raw_GL_Export.csv
TXN001473,02/01/2026,01/30/2026,2026-02,AUS01,5220,CC2000,Slack,INV49257,,AUD,26226.71,GST,Payment for services,API Import,2026-01-02,2026-01-30,26226.71,False,payment for services,2026-02-23 16:50:30.516232,Raw_GL_Export.csv
TXN001474,28-11-2025,20-11-2025,2025-11,AUS01,5600,CC3200,Slack,INV59068,PO5117,NZD,21029.59,GST-FREE,Payment for goods,Oracle,2025-11-28,2025-11-20,21029.59,False,payment for goods,2026-02-23 16:50:30.516232,Raw_GL_Export.csv
TXN001475,03/01/2026,29/12/2025,2026-01,AUS01,5620,CC3000,Atlassian Pty,INV49650,PO8915,USD,33144.32,GST,Payment for consulting,SAP,2026-01-03,2025-12-29,33144.32,False,payment for consulting,2026-02-23 16:50:30.516232,Raw_GL_Export.csv
TXN001476,14-02-2025,07-02-2025,2025-02,AUS01,5910,CC4100,SAP,INV87189,PO8045,USD,39640.18,GST-FREE,Payment for subscription,SAP,2025-02-14,2025-02-07,39640.18,False,payment for subscription,2026-02-23 16:50:30.516232,Raw_GL_Export.csv
TXN001477,2026-02-12,2026-02-09,2026-02,AUS01,5310,CC3200,KPMG Australia,INV93432,PO6886,GBP,12444.68,INPUT,Payment for license,API Import,2026-02-12,2026-02-09,12444.68,False,payment for license,2026-02-23 16:50:30.516232,Raw_GL_Export.csv
TXN001478,07/01/2026,01/01/2026,2026-01,AUS01,5710,CC3100,Seek Limited,INV12357,PO5360,USD,18263.43,GST-FREE,Payment for consulting,Manual Entry,2026-01-07,2026-01-01,18263.43,False,payment for consulting,2026-02-23 16:50:30.516232,Raw_GL_Export.csv
TXN001479,05/02/2026,30/01/2026,2026-02,AUS01,5300,CC2000,McKinsey,INV32121,PO3828,NZD,3698.87,EXPORT,Payment for goods,Workday,2026-02-05,2026-01-30,3698.87,False,payment for goods,2026-02-23 16:50:30.516232,Raw_GL_Export.csv
TXN001480,2026-01-01,2025-12-23,2026-01,AUS01,5120,CC3000,DHL Express,INV68618,,USD,34086.29,INPUT,Payment for consulting,Oracle,2026-01-01,2025-12-23,34086.29,False,payment for consulting,2026-02-23 16:50:30.516232,Raw_GL_Export.csv
TXN001481,01/19/2026,01/16/2026,2026-01,AUS01,5620,CC1000,Google,INV45851,,USD,35702.06,GST-FREE,Payment for license,API Import,2026-01-19,2026-01-16,35702.06,False,payment for license,2026-02-23 16:50:30.516232,Raw_GL_Export.csv
TXN001482,2026-02-06,2026-02-05,2026-02,AUS01,5610,CC3100,DHL Express,INV15211,,USD,37433.24,EXPORT,Payment for consulting,SAP,2026-02-06,2026-02-05,37433.24,False,payment for consulting,2026-02-23 16:50:30.516232,Raw_GL_Export.csv
TXN001483,08/09/2025,08/08/2025,2025-08,AUS01,5600,CC3000,Telstra Corp,INV47360,PO1307,USD,8411.51,EXPORT,Payment for goods,API Import,2025-09-08,2025-08-08,8411.51,False,payment for goods,2026-02-23 16:50:30.516232,Raw_GL_Export.csv
TXN001484,2025-10-03,2025-10-01,2025-10,AUS01,5600,CC2000,Accenture Pty,INV27625,,NZD,34359.4,GST-FREE,Payment for consulting,SAP,2025-10-03,2025-10-01,34359.4,False,payment for consulting,2026-02-23 16:50:30.516232,Raw_GL_Export.csv
TXN001485,03/02/2026,27/01/2026,2026-02,AUS01,5920,CC1000,Microsoft,INV70477,PO1610,GBP,43432.57,GST-FREE,Payment for subscription,Manual Entry,2026-02-03,2026-01-27,43432.57,False,payment for subscription,2026-02-23 16:50:30.516232,Raw_GL_Export.csv
TXN001486,09-01-2026,07-01-2026,2026-01,AUS01,5700,CC3100,MSFT,INV61238,,GBP,43905.18,GST-FREE,Payment for license,Workday,2026-01-09,2026-01-07,43905.18,False,payment for license,2026-02-23 16:50:30.516232,Raw_GL_Export.csv
TXN001487,2026-02-01,2026-01-22,2026-02,AUS01,5310,CC2000,LinkedIn Corp,INV21813,PO7973,USD,9074.85,EXPORT,Payment for goods,Oracle,2026-02-01,2026-01-22,9074.85,False,payment for goods,2026-02-23 16:50:30.516232,Raw_GL_Export.csv
TXN001488,2026-01-22,2026-01-18,2026-01,AUS01,5920,CC2000,AusPost,INV47108,PO8131,AUD,658.14,INPUT,Payment for subscription,Oracle,2026-01-22,2026-01-18,658.14,False,payment for subscription,2026-02-23 16:50:30.516232,Raw_GL_Export.csv
TXN001489,2026-01-07,2025-12-31,2026-01,AUS01,5320,CC2100,KPMG Australia,INV70262,,AUD,41201.15,GST-FREE,Payment for consulting,Manual Entry,2026-01-07,2025-12-31,41201.15,False,payment for consulting,2026-02-23 16:50:30.516232,Raw_GL_Export.csv
TXN001490,07/17/2025,07/09/2025,2025-07,AUS01,5410,CC1000,Telstra Corp,INV33600,PO1737,USD,35572.76,INPUT,Payment for subscription,Manual Entry,2025-07-17,2025-09-07,35572.76,False,payment for subscription,2026-02-23 16:50:30.516232,Raw_GL_Export.csv
TXN001491,2025-12-26,2025-12-18,2025-12,AUS01,5310,CC3000,GCP,INV74803,PO4093,GBP,987.8,GST,Payment for goods,Workday,2025-12-26,2025-12-18,987.8,False,payment for goods,2026-02-23 16:50:30.516232,Raw_GL_Export.csv
TXN001492,23/02/2026,22/02/2026,2026-02,AUS01,5120,CC2100,ServiceNow Inc,INV20193,PO3756,GBP,13913.6,INPUT,Payment for goods,Workday,2026-02-23,2026-02-22,13913.6,False,payment for goods,2026-02-23 16:50:30.516232,Raw_GL_Export.csv
TXN001493,12-02-2026,06-02-2026,2026-02,AUS01,5900,CC2000,Robert Half International,INV84746,PO1176,GBP,25809.72,EXPORT,Payment for goods,Workday,2026-02-12,2026-02-06,25809.72,False,payment for goods,2026-02-23 16:50:30.516232,Raw_GL_Export.csv
TXN001494,05/28/2025,05/19/2025,2025-05,AUS01,5320,CC2000,Federal Express,INV46814,PO3833,USD,18869.17,GST,Payment for goods,API Import,2025-05-28,2025-05-19,18869.17,False,payment for goods,2026-02-23 16:50:30.516232,Raw_GL_Export.csv
TXN001495,06/14/2025,06/12/2025,2025-06,AUS01,5620,CC1000,AWS,INV92027,PO8892,NZD,10298.43,INPUT,Payment for subscription,Oracle,2025-06-14,2025-12-06,10298.43,False,payment for subscription,2026-02-23 16:50:30.516232,Raw_GL_Export.csv
TXN001496,03-01-2026,29-12-2025,2026-01,AUS01,5210,CC3000,Amazon,INV72515,PO5290,AUD,26211.64,GST-FREE,Payment for consulting,SAP,2026-01-03,2025-12-29,26211.64,False,payment for consulting,2026-02-23 16:50:30.516232,Raw_GL_Export.csv
TXN001497,10-01-2026,03-01-2026,2026-01,AUS01,5800,CC1100,KPMG Australia,INV46150,,USD,20556.92,INPUT,Payment for services,Manual Entry,2026-01-10,2026-01-03,20556.92,False,payment for services,2026-02-23 16:50:30.516232,Raw_GL_Export.csv
TXN001498,24-01-2026,22-01-2026,2026-01,AUS01,5520,CC3200,WeWork Australia,INV71257,,GBP,11612.68,EXPORT,Payment for consulting,Oracle,2026-01-24,2026-01-22,11612.68,False,payment for consulting,2026-02-23 16:50:30.516232,Raw_GL_Export.csv
TXN001499,2026-01-13,2026-01-07,2026-01,AUS01,5700,CC2100,Google,INV17839,,NZD,36759.79,GST,Payment for consulting,Oracle,2026-01-13,2026-01-07,36759.79,False,payment for consulting,2026-02-23 16:50:30.516232,Raw_GL_Export.csv
TXN001500,2025-03-19,2025-03-18,2025-03,AUS01,5810,CC4000,EY Australia,INV95172,PO7308,NZD,1941.34,EXPORT,Payment for services,Workday,2025-03-19,2025-03-18,1941.34,False,payment for services,2026-02-23 16:50:30.516232,Raw_GL_Export.csv
TXN001501,01/08/2026,01/01/2026,2026-01,AUS01,5810,CC3100,Microsoft,INV42503,PO7960,NZD,40484.19,GST-FREE,Payment for license,API Import,2026-08-01,2026-01-01,40484.19,False,payment for license,2026-02-23 16:50:30.516232,Raw_GL_Export.csv
TXN001502,08/02/2025,07/02/2025,2025-02,AUS01,5400,CC3200,Optus Pty,INV71735,PO2970,USD,1099.17,EXPORT,Payment for license,Oracle,2025-02-08,2025-02-07,1099.17,False,payment for license,2026-02-23 16:50:30.516232,Raw_GL_Export.csv
TXN001503,06/02/2026,30/01/2026,2026-02,AUS01,5410,CC3200,PWC,INV76595,PO8059,AUD,27682.45,EXPORT,Payment for subscription,Oracle,2026-02-06,2026-01-30,27682.45,False,payment for subscription,2026-02-23 16:50:30.516232,Raw_GL_Export.csv
TXN001504,02/17/2026,02/07/2026,2026-02,AUS01,5900,CC1000,Federal Express,INV36784,PO3771,GBP,33839.2,EXPORT,Payment for license,API Import,2026-02-17,2026-07-02,33839.2,False,payment for license,2026-02-23 16:50:30.516232,Raw_GL_Export.csv
TXN001505,28-07-2025,21-07-2025,2025-07,AUS01,5000,CC3000,McKinsey,INV84842,,AUD,37988.53,INPUT,Payment for services,Manual Entry,2025-07-28,2025-07-21,37988.53,False,payment for services,2026-02-23 16:50:30.516232,Raw_GL_Export.csv
TXN001506,12/02/2025,11/23/2025,2025-12,AUS01,5410,CC1100,DHL Express,INV36992,,GBP,1435.31,EXPORT,Payment for services,SAP,2025-02-12,2025-11-23,1435.31,False,payment for services,2026-02-23 16:50:30.516232,Raw_GL_Export.csv
TXN001507,13/06/2025,03/06/2025,2025-06,AUS01,5700,CC1000,Seek Limited,INV76711,PO2312,USD,42463.39,GST-FREE,Payment for license,API Import,2025-06-13,2025-06-03,42463.39,False,payment for license,2026-02-23 16:50:30.516232,Raw_GL_Export.csv
TXN001508,06-01-2026,04-01-2026,2026-01,AUS01,5520,CC1200,AusPost,INV40589,PO8496,NZD,43463.32,GST-FREE,Payment for services,API Import,2026-01-06,2026-01-04,43463.32,False,payment for services,2026-02-23 16:50:30.516232,Raw_GL_Export.csv
TXN001509,03/14/2025,03/04/2025,2025-03,AUS01,5220,CC1200,DHL Express,INV87510,PO4840,NZD,7182.3,GST-FREE,Payment for services,Oracle,2025-03-14,2025-04-03,7182.3,False,payment for services,2026-02-23 16:50:30.516232,Raw_GL_Export.csv
TXN001510,02/11/2026,02/01/2026,2026-02,AUS01,5710,CC1000,Atlassian Pty,INV68935,,NZD,16209.78,EXPORT,Payment for consulting,API Import,2026-11-02,2026-01-02,16209.78,False,payment for consulting,2026-02-23 16:50:30.516232,Raw_GL_Export.csv
TXN001511,2025-04-06,2025-03-27,2025-04,AUS01,5310,CC4000,Optus Pty,INV89594,PO5449,USD,189.43,INPUT,Payment for goods,API Import,2025-04-06,2025-03-27,189.43,False,payment for goods,2026-02-23 16:50:30.516232,Raw_GL_Export.csv
TXN001512,02/17/2025,02/13/2025,2025-02,AUS01,5900,CC1000,Zoom,INV64301,PO1091,AUD,21019.29,GST,Payment for consulting,Manual Entry,2025-02-17,2025-02-13,21019.29,False,payment for consulting,2026-02-23 16:50:30.516232,Raw_GL_Export.csv
TXN001513,02/21/2026,02/17/2026,2026-02,AUS01,5700,CC1100,BCG,INV86142,PO3325,AUD,4722.73,INPUT,Payment for license,SAP,2026-02-21,2026-02-17,4722.73,False,payment for license,2026-02-23 16:50:30.516232,Raw_GL_Export.csv
TXN001514,2026-01-11,2026-01-07,2026-01,AUS01,5420,CC1000,Atlassian Pty,INV64036,PO1696,GBP,2542.52,GST-FREE,Payment for consulting,SAP,2026-01-11,2026-01-07,2542.52,False,payment for consulting,2026-02-23 16:50:30.516232,Raw_GL_Export.csv
TXN001515,2026-01-07,2025-12-29,2026-01,AUS01,5620,CC4000,Microsoft,INV29689,PO7793,AUD,20496.35,EXPORT,Payment for license,Oracle,2026-01-07,2025-12-29,20496.35,False,payment for license,2026-02-23 16:50:30.516232,Raw_GL_Export.csv
TXN001516,02/21/2026,02/16/2026,2026-02,AUS01,5910,CC4000,McKinsey,INV69984,,AUD,29757.05,GST,Payment for license,API Import,2026-02-21,2026-02-16,29757.05,False,payment for license,2026-02-23 16:50:30.516232,Raw_GL_Export.csv
TXN001517,11/02/2025,03/02/2025,2025-02,AUS01,5620,CC2100,Google,INV65441,PO2840,AUD,18910.78,GST,Payment for license,Manual Entry,2025-02-11,2025-02-03,18910.78,False,payment for license,2026-02-23 16:50:30.516232,Raw_GL_Export.csv
TXN001518,2026-01-28,2026-01-25,2026-01,AUS01,5900,CC3200,DHL Express,INV79518,,GBP,6046.18,GST,Payment for services,Oracle,2026-01-28,2026-01-25,6046.18,False,payment for services,2026-02-23 16:50:30.516232,Raw_GL_Export.csv
TXN001519,2026-01-20,2026-01-12,2026-01,AUS01,5010,CC1200,AusPost,INV46780,,USD,30296.05,INPUT,Payment for subscription,API Import,2026-01-20,2026-01-12,30296.05,False,payment for subscription,2026-02-23 16:50:30.516232,Raw_GL_Export.csv
TXN001520,13/01/2026,08/01/2026,2026-01,AUS01,5310,CC4000,Hays,INV48697,PO3336,AUD,3746.91,GST,Payment for subscription,Oracle,2026-01-13,2026-01-08,3746.91,False,payment for subscription,2026-02-23 16:50:30.516232,Raw_GL_Export.csv
TXN001521,01/22/2026,01/18/2026,2026-01,AUS01,5410,CC4100,Amazon,INV39206,PO5073,AUD,42251.58,GST-FREE,Payment for services,Oracle,2026-01-22,2026-01-18,42251.58,False,payment for services,2026-02-23 16:50:30.516232,Raw_GL_Export.csv
TXN001522,01/18/2026,01/08/2026,2026-01,AUS01,5420,CC3100,MSFT,INV10100,,USD,27491.01,EXPORT,Payment for subscription,Oracle,2026-01-18,2026-08-01,27491.01,False,payment for subscription,2026-02-23 16:50:30.516232,Raw_GL_Export.csv
TXN001523,01/13/2026,01/10/2026,2026-01,AUS01,5920,CC2100,Microsoft,INV43533,PO2296,NZD,16033.21,EXPORT,Payment for license,Manual Entry,2026-01-13,2026-10-01,16033.21,False,payment for license,2026-02-23 16:50:30.516232,Raw_GL_Export.csv
TXN001524,01/26/2026,01/21/2026,2026-01,AUS01,5700,CC1000,Accenture Pty,INV76849,PO2947,GBP,37235.4,INPUT,Payment for subscription,API Import,2026-01-26,2026-01-21,37235.4,False,payment for subscription,2026-02-23 16:50:30.516232,Raw_GL_Export.csv
TXN001525,15-02-2026,11-02-2026,2026-02,AUS01,5510,CC3000,PWC,INV26668,,GBP,18559.01,GST-FREE,Payment for services,Manual Entry,2026-02-15,2026-02-11,18559.01,False,payment for services,2026-02-23 16:50:30.516232,Raw_GL_Export.csv
TXN001526,13-02-2026,03-02-2026,2026-02,AUS01,5810,CC4100,AusPost,INV58867,PO8939,NZD,26380.29,GST-FREE,Payment for goods,Oracle,2026-02-13,2026-02-03,26380.29,False,payment for goods,2026-02-23 16:50:30.516232,Raw_GL_Export.csv
TXN001527,2026-01-24,2026-01-19,2026-01,AUS01,5120,CC4100,Federal Express,INV83882,PO1181,USD,7543.77,EXPORT,Payment for consulting,Manual Entry,2026-01-24,2026-01-19,7543.77,False,payment for consulting,2026-02-23 16:50:30.516232,Raw_GL_Export.csv
TXN001528,2025-06-13,2025-06-05,2025-06,AUS01,5600,CC4100,AusPost,INV59408,PO3528,USD,8592.56,INPUT,Payment for license,API Import,2025-06-13,2025-06-05,8592.56,False,payment for license,2026-02-23 16:50:30.516232,Raw_GL_Export.csv
TXN001529,26/08/2025,22/08/2025,2025-08,AUS01,5310,CC4000,Seek Limited,INV74937,PO4068,GBP,25063.41,EXPORT,Payment for subscription,Manual Entry,2025-08-26,2025-08-22,25063.41,False,payment for subscription,2026-02-23 16:50:30.516232,Raw_GL_Export.csv
TXN001530,01/01/2026,12/30/2025,2026-01,AUS01,5210,CC2100,Oracle,INV89692,PO2567,AUD,23594.25,INPUT,Payment for subscription,Oracle,2026-01-01,2025-12-30,23594.25,False,payment for subscription,2026-02-23 16:50:30.516232,Raw_GL_Export.csv
TXN001531,20/01/2026,10/01/2026,2026-01,AUS01,5020,CC1200,Slack,INV18716,,GBP,541.97,GST,Payment for services,Manual Entry,2026-01-20,2026-01-10,541.97,False,payment for services,2026-02-23 16:50:30.516232,Raw_GL_Export.csv
TXN001532,13/02/2026,03/02/2026,2026-02,AUS01,5800,CC1100,EY Australia,INV83927,,USD,38395.53,INPUT,Payment for subscription,SAP,2026-02-13,2026-02-03,38395.53,False,payment for subscription,2026-02-23 16:50:30.516232,Raw_GL_Export.csv
TXN001533,01/02/2026,23/01/2026,2026-02,AUS01,5900,CC4100,Hays,INV27353,,NZD,6938.53,EXPORT,Payment for license,API Import,2026-02-01,2026-01-23,6938.53,False,payment for license,2026-02-23 16:50:30.516232,Raw_GL_Export.csv
TXN001534,01/14/2026,01/07/2026,2026-01,AUS01,5300,CC1200,Slack,INV91406,PO3479,NZD,40895.72,INPUT,Payment for services,API Import,2026-01-14,2026-07-01,40895.72,False,payment for services,2026-02-23 16:50:30.516232,Raw_GL_Export.csv
TXN001535,06/09/2025,31/08/2025,2025-09,AUS01,5910,CC2000,Amazon,INV89774,PO2676,GBP,44700.35,EXPORT,Payment for license,Workday,2025-09-06,2025-08-31,44700.35,False,payment for license,2026-02-23 16:50:30.516232,Raw_GL_Export.csv
TXN001536,18-02-2026,15-02-2026,2026-02,AUS01,5600,CC4000,Microsoft,INV10565,,NZD,18163.19,GST-FREE,Payment for subscription,Oracle,2026-02-18,2026-02-15,18163.19,False,payment for subscription,2026-02-23 16:50:30.516232,Raw_GL_Export.csv
TXN001537,2026-01-21,2026-01-13,2026-01,AUS01,5610,CC3100,AusPost,INV84956,PO8869,AUD,42146.48,EXPORT,Payment for goods,Workday,2026-01-21,2026-01-13,42146.48,False,payment for goods,2026-02-23 16:50:30.516232,Raw_GL_Export.csv
TXN001538,2026-01-28,2026-01-23,2026-01,AUS01,5210,CC2100,Hays,INV51679,,NZD,5511.17,GST-FREE,Payment for services,Oracle,2026-01-28,2026-01-23,5511.17,False,payment for services,2026-02-23 16:50:30.516232,Raw_GL_Export.csv
TXN001539,02/16/2026,02/09/2026,2026-02,AUS01,5100,CC1000,MSFT,INV94195,,GBP,22109.62,GST-FREE,Payment for consulting,Workday,2026-02-16,2026-09-02,22109.62,False,payment for consulting,2026-02-23 16:50:30.516232,Raw_GL_Export.csv
TXN001540,02/01/2026,26/12/2025,2026-01,AUS01,5020,CC4100,Oracle,INV91528,PO2162,AUD,6682.91,INPUT,Payment for license,Oracle,2026-01-02,2025-12-26,6682.91,False,payment for license,2026-02-23 16:50:30.516232,Raw_GL_Export.csv
TXN001541,17-12-2025,13-12-2025,2025-12,AUS01,5200,CC3200,Microsoft,INV48525,PO6087,USD,13492.32,GST-FREE,Payment for subscription,Manual Entry,2025-12-17,2025-12-13,13492.32,False,payment for subscription,2026-02-23 16:50:30.516232,Raw_GL_Export.csv
TXN001542,2025-03-10,2025-03-05,2025-03,AUS01,5500,CC3100,Amazon,INV26865,PO6164,GBP,33765.68,EXPORT,Payment for services,SAP,2025-03-10,2025-03-05,33765.68,False,payment for services,2026-02-23 16:50:30.516232,Raw_GL_Export.csv
TXN001543,23-02-2026,16-02-2026,2026-02,AUS01,5310,CC1100,Salesforce,INV21773,PO4914,GBP,28381.38,INPUT,Payment for goods,API Import,2026-02-23,2026-02-16,28381.38,False,payment for goods,2026-02-23 16:50:30.516232,Raw_GL_Export.csv
TXN001544,02/19/2026,02/17/2026,2026-02,AUS01,5220,CC3000,Federal Express,INV89300,PO6800,USD,43724.86,GST,Payment for license,SAP,2026-02-19,2026-02-17,43724.86,False,payment for license,2026-02-23 16:50:30.516232,Raw_GL_Export.csv
TXN001545,01/12/2026,01/03/2026,2026-01,AUS01,5800,CC1100,GCP,INV44153,,NZD,40294.37,EXPORT,Payment for license,Manual Entry,2026-12-01,2026-03-01,40294.37,False,payment for license,2026-02-23 16:50:30.516232,Raw_GL_Export.csv
TXN001546,08/22/2025,08/18/2025,2025-08,AUS01,5610,CC1100,DHL Express,INV10352,,AUD,29132.9,EXPORT,Payment for services,API Import,2025-08-22,2025-08-18,29132.9,False,payment for services,2026-02-23 16:50:30.516232,Raw_GL_Export.csv
TXN001547,2026-01-08,2026-01-03,2026-01,AUS01,5310,CC2100,Atlassian Pty,INV89194,PO9944,NZD,44313.57,GST-FREE,Payment for goods,Oracle,2026-01-08,2026-01-03,44313.57,False,payment for goods,2026-02-23 16:50:30.516232,Raw_GL_Export.csv
TXN001548,2026-02-03,2026-01-30,2026-02,AUS01,5600,CC3100,DHL Express,INV41266,PO9912,USD,34546.39,GST,Payment for license,Manual Entry,2026-02-03,2026-01-30,34546.39,False,payment for license,2026-02-23 16:50:30.516232,Raw_GL_Export.csv
TXN001549,01/22/2026,01/21/2026,2026-01,AUS01,5700,CC3200,AWS,INV89702,PO2483,USD,17689.22,GST-FREE,Payment for consulting,Workday,2026-01-22,2026-01-21,17689.22,False,payment for consulting,2026-02-23 16:50:30.516232,Raw_GL_Export.csv
TXN001550,23-02-2025,13-02-2025,2025-02,AUS01,5200,CC2000,Accenture Pty,INV36225,,NZD,32465.4,GST-FREE,Payment for goods,API Import,2025-02-23,2025-02-13,32465.4,False,payment for goods,2026-02-23 16:50:30.516232,Raw_GL_Export.csv
TXN001551,01/15/2026,01/10/2026,2026-01,AUS01,5920,CC1000,Robert Half International,INV73882,,AUD,34317.71,EXPORT,Payment for license,API Import,2026-01-15,2026-10-01,34317.71,False,payment for license,2026-02-23 16:50:30.516232,Raw_GL_Export.csv
TXN001552,2026-02-16,2026-02-06,2026-02,AUS01,5120,CC1000,Atlassian Pty,INV39144,,AUD,24384.23,INPUT,Payment for goods,Oracle,2026-02-16,2026-02-06,24384.23,False,payment for goods,2026-02-23 16:50:30.516232,Raw_GL_Export.csv
TXN001553,26-02-2025,19-02-2025,2025-02,AUS01,5100,CC1100,BCG,INV54945,,NZD,24954.16,GST,Payment for consulting,Oracle,2025-02-26,2025-02-19,24954.16,False,payment for consulting,2026-02-23 16:50:30.516232,Raw_GL_Export.csv
TXN001554,2025-09-06,2025-09-04,2025-09,AUS01,5610,CC3100,Microsoft,INV29233,,NZD,44739.36,GST-FREE,Payment for goods,API Import,2025-09-06,2025-09-04,44739.36,False,payment for goods,2026-02-23 16:50:30.516232,Raw_GL_Export.csv
TXN001555,2026-01-16,2026-01-08,2026-01,AUS01,5500,CC2100,Regus Australia,INV79707,PO3254,NZD,13402.34,GST,Payment for goods,SAP,2026-01-16,2026-01-08,13402.34,False,payment for goods,2026-02-23 16:50:30.516232,Raw_GL_Export.csv
TXN001556,2025-08-15,2025-08-10,2025-08,AUS01,5400,CC1100,BCG,INV73690,PO7687,USD,25988.4,EXPORT,Payment for goods,Manual Entry,2025-08-15,2025-08-10,25988.4,False,payment for goods,2026-02-23 16:50:30.516232,Raw_GL_Export.csv
TXN001557,06/02/2026,31/01/2026,2026-02,AUS01,5710,CC4100,Federal Express,INV28070,PO2207,AUD,16412.26,GST,Payment for license,Workday,2026-02-06,2026-01-31,16412.26,False,payment for license,2026-02-23 16:50:30.516232,Raw_GL_Export.csv
TXN001558,01/02/2026,26/01/2026,2026-02,AUS01,5500,CC4000,Optus Pty,INV77755,PO6417,AUD,9802.07,EXPORT,Payment for services,Manual Entry,2026-02-01,2026-01-26,9802.07,False,payment for services,2026-02-23 16:50:30.516232,Raw_GL_Export.csv
TXN001559,2025-12-08,2025-12-01,2025-12,AUS01,5400,CC2000,Telstra Corp,INV79586,PO2437,AUD,16756.31,GST-FREE,Payment for consulting,Workday,2025-12-08,2025-12-01,16756.31,False,payment for consulting,2026-02-23 16:50:30.516232,Raw_GL_Export.csv
TXN001560,2025-10-27,2025-10-17,2025-10,AUS01,5520,CC4100,Atlassian Pty,INV87642,,AUD,38695.19,GST,Payment for goods,SAP,2025-10-27,2025-10-17,38695.19,False,payment for goods,2026-02-23 16:50:30.516232,Raw_GL_Export.csv
TXN001561,26/02/2026,25/02/2026,2026-02,AUS01,5110,CC3000,Slack,INV30719,PO8537,AUD,27413.12,INPUT,Payment for subscription,API Import,2026-02-26,2026-02-25,27413.12,False,payment for subscription,2026-02-23 16:50:30.516232,Raw_GL_Export.csv
TXN001562,02/15/2026,02/11/2026,2026-02,AUS01,5920,CC1100,Oracle,INV15635,,GBP,1970.54,EXPORT,Payment for consulting,Workday,2026-02-15,2026-11-02,1970.54,False,payment for consulting,2026-02-23 16:50:30.516232,Raw_GL_Export.csv
TXN001563,27-11-2025,22-11-2025,2025-11,AUS01,5700,CC3000,Deloitte Touche,INV15746,PO5612,NZD,44168.56,GST-FREE,Payment for subscription,Workday,2025-11-27,2025-11-22,44168.56,False,payment for subscription,2026-02-23 16:50:30.516232,Raw_GL_Export.csv
TXN001564,2026-02-08,2026-02-06,2026-02,AUS01,5520,CC1000,Atlassian Pty,INV79388,,GBP,15718.95,INPUT,Payment for subscription,Workday,2026-02-08,2026-02-06,15718.95,False,payment for subscription,2026-02-23 16:50:30.516232,Raw_GL_Export.csv
TXN001565,13-01-2026,10-01-2026,2026-01,AUS01,5920,CC1200,Regus Australia,INV16859,PO7674,USD,5638.32,EXPORT,Payment for consulting,SAP,2026-01-13,2026-01-10,5638.32,False,payment for consulting,2026-02-23 16:50:30.516232,Raw_GL_Export.csv
TXN001566,08-01-2026,06-01-2026,2026-01,AUS01,5900,CC3100,Slack,INV68673,,NZD,24425.06,GST,Payment for consulting,Oracle,2026-01-08,2026-01-06,24425.06,False,payment for consulting,2026-02-23 16:50:30.516232,Raw_GL_Export.csv
TXN001567,25-01-2026,18-01-2026,2026-01,AUS01,5000,CC1200,SAP,INV57968,PO1445,NZD,36009.99,GST,Payment for services,Workday,2026-01-25,2026-01-18,36009.99,False,payment for services,2026-02-23 16:50:30.516232,Raw_GL_Export.csv
TXN001568,2026-02-07,2026-02-05,2026-02,AUS01,5420,CC2000,Google,INV51423,PO6682,GBP,22417.56,GST,Payment for license,Manual Entry,2026-02-07,2026-02-05,22417.56,False,payment for license,2026-02-23 16:50:30.516232,Raw_GL_Export.csv
TXN001569,2026-02-19,2026-02-13,2026-02,AUS01,5110,CC1200,Deloitte Touche,INV87428,PO8247,NZD,3469.89,GST-FREE,Payment for license,Workday,2026-02-19,2026-02-13,3469.89,False,payment for license,2026-02-23 16:50:30.516232,Raw_GL_Export.csv
TXN001570,02-01-2026,28-12-2025,2026-01,AUS01,5800,CC3000,Workday,INV71281,PO6231,AUD,30632.42,INPUT,Payment for consulting,SAP,2026-01-02,2025-12-28,30632.42,False,payment for consulting,2026-02-23 16:50:30.516232,Raw_GL_Export.csv
TXN001571,2026-02-19,2026-02-10,2026-02,AUS01,5620,CC4100,DHL Express,INV63033,PO8039,GBP,43402.63,INPUT,Payment for subscription,Manual Entry,2026-02-19,2026-02-10,43402.63,False,payment for subscription,2026-02-23 16:50:30.516232,Raw_GL_Export.csv
TXN001572,04/02/2026,31/01/2026,2026-02,AUS01,5310,CC4100,Hays,INV61902,PO1113,NZD,28261.34,EXPORT,Payment for subscription,Manual Entry,2026-02-04,2026-01-31,28261.34,False,payment for subscription,2026-02-23 16:50:30.516232,Raw_GL_Export.csv
TXN001573,02/02/2026,29/01/2026,2026-02,AUS01,5800,CC3200,Seek Limited,INV10783,PO2642,AUD,24438.53,GST-FREE,Payment for license,Oracle,2026-02-02,2026-01-29,24438.53,False,payment for license,2026-02-23 16:50:30.516232,Raw_GL_Export.csv
TXN001574,2026-01-06,2025-12-27,2026-01,AUS01,5320,CC3100,Hays,INV89128,PO4484,USD,9843.92,GST-FREE,Payment for goods,Oracle,2026-01-06,2025-12-27,9843.92,False,payment for goods,2026-02-23 16:50:30.516232,Raw_GL_Export.csv
TXN001575,19-02-2026,14-02-2026,2026-02,AUS01,5220,CC1000,Oracle,INV61745,PO8539,USD,14564.98,GST-FREE,Payment for consulting,API Import,2026-02-19,2026-02-14,14564.98,False,payment for consulting,2026-02-23 16:50:30.516232,Raw_GL_Export.csv
TXN001576,28/01/2026,23/01/2026,2026-01,AUS01,5120,CC3200,Seek Limited,INV39338,PO6540,USD,28025.53,GST-FREE,Payment for goods,SAP,2026-01-28,2026-01-23,28025.53,False,payment for goods,2026-02-23 16:50:30.516232,Raw_GL_Export.csv
TXN001577,05/02/2026,02/02/2026,2026-02,AUS01,5000,CC4100,GCP,INV18553,PO4094,NZD,31024.42,GST,Payment for goods,Oracle,2026-02-05,2026-02-02,31024.42,False,payment for goods,2026-02-23 16:50:30.516232,Raw_GL_Export.csv
TXN001578,02/17/2026,02/12/2026,2026-02,AUS01,5110,CC2000,EY Australia,INV89705,,GBP,29726.95,GST-FREE,Payment for consulting,Workday,2026-02-17,2026-12-02,29726.95,False,payment for consulting,2026-02-23 16:50:30.516232,Raw_GL_Export.csv
TXN001579,01/27/2026,01/25/2026,2026-01,AUS01,5310,CC2100,BCG,INV68007,PO2137,USD,40361.79,GST,Payment for goods,API Import,2026-01-27,2026-01-25,40361.79,False,payment for goods,2026-02-23 16:50:30.516232,Raw_GL_Export.csv
TXN001580,2026-02-08,2026-02-07,2026-02,AUS01,5000,CC3100,KPMG Australia,INV34157,PO8086,USD,9683.64,GST-FREE,Payment for goods,Oracle,2026-02-08,2026-02-07,9683.64,False,payment for goods,2026-02-23 16:50:30.516232,Raw_GL_Export.csv
TXN001581,16-06-2025,08-06-2025,2025-06,AUS01,5420,CC2000,Workday,INV62222,PO5894,AUD,18696.12,GST,Payment for consulting,SAP,2025-06-16,2025-06-08,18696.12,False,payment for consulting,2026-02-23 16:50:30.516232,Raw_GL_Export.csv
TXN001582,26-02-2026,25-02-2026,2026-02,AUS01,5200,CC4000,Regus Australia,INV53916,PO3776,AUD,10788.01,GST,Payment for license,API Import,2026-02-26,2026-02-25,10788.01,False,payment for license,2026-02-23 16:50:30.516232,Raw_GL_Export.csv
TXN001583,01/26/2026,01/23/2026,2026-01,AUS01,5620,CC2100,Google,INV17031,,AUD,28850.06,INPUT,Payment for consulting,Workday,2026-01-26,2026-01-23,28850.06,False,payment for consulting,2026-02-23 16:50:30.516232,Raw_GL_Export.csv
TXN001584,01-05-2025,23-04-2025,2025-05,AUS01,5900,CC3000,Robert Half International,INV28051,PO1039,USD,19318.44,EXPORT,Payment for consulting,Oracle,2025-05-01,2025-04-23,19318.44,False,payment for consulting,2026-02-23 16:50:30.516232,Raw_GL_Export.csv
TXN001585,2025-12-01,2025-11-27,2025-12,AUS01,5710,CC3100,SAP,INV44389,PO2162,NZD,28579.74,EXPORT,Payment for subscription,API Import,2025-12-01,2025-11-27,28579.74,False,payment for subscription,2026-02-23 16:50:30.516232,Raw_GL_Export.csv
TXN001586,01/15/2026,01/09/2026,2026-01,AUS01,5610,CC3200,Workday,INV86949,PO8936,AUD,23570.07,GST-FREE,Payment for license,API Import,2026-01-15,2026-09-01,23570.07,False,payment for license,2026-02-23 16:50:30.516232,Raw_GL_Export.csv
TXN001587,04/23/2025,04/13/2025,2025-04,AUS01,5900,CC1100,Deloitte Touche,INV51101,,GBP,1643.74,INPUT,Payment for subscription,API Import,2025-04-23,2025-04-13,1643.74,False,payment for subscription,2026-02-23 16:50:30.516232,Raw_GL_Export.csv
TXN001588,23/02/2026,20/02/2026,2026-02,AUS01,5910,CC3100,Telstra Corp,INV39154,PO5214,NZD,9819.87,GST-FREE,Payment for consulting,SAP,2026-02-23,2026-02-20,9819.87,False,payment for consulting,2026-02-23 16:50:30.516232,Raw_GL_Export.csv
TXN001589,2025-06-05,2025-06-02,2025-06,AUS01,5710,CC4000,Salesforce,INV83712,PO4735,AUD,14896.54,INPUT,Payment for subscription,SAP,2025-06-05,2025-06-02,14896.54,False,payment for subscription,2026-02-23 16:50:30.516232,Raw_GL_Export.csv
TXN001590,2025-12-01,2025-11-28,2025-12,AUS01,5700,CC3200,Telstra Corp,INV87539,PO5983,USD,6272.43,GST-FREE,Payment for consulting,Workday,2025-12-01,2025-11-28,6272.43,False,payment for consulting,2026-02-23 16:50:30.516232,Raw_GL_Export.csv
TXN001591,06/02/2026,31/01/2026,2026-02,AUS01,5400,CC3200,Robert Half International,INV26877,,GBP,2983.21,GST-FREE,Payment for license,API Import,2026-02-06,2026-01-31,2983.21,False,payment for license,2026-02-23 16:50:30.516232,Raw_GL_Export.csv
TXN001592,21-02-2026,20-02-2026,2026-02,AUS01,5310,CC4000,KPMG Australia,INV60386,PO4275,AUD,17518.18,GST,Payment for subscription,API Import,2026-02-21,2026-02-20,17518.18,False,payment for subscription,2026-02-23 16:50:30.516232,Raw_GL_Export.csv
TXN001593,01/21/2026,01/14/2026,2026-01,AUS01,5300,CC3200,PWC,INV77543,PO8271,GBP,1200.11,INPUT,Payment for license,Workday,2026-01-21,2026-01-14,1200.11,False,payment for license,2026-02-23 16:50:30.516232,Raw_GL_Export.csv
TXN001594,19-01-2026,15-01-2026,2026-01,AUS01,5700,CC4000,Accenture Pty,INV30206,,AUD,38548.59,EXPORT,Payment for services,SAP,2026-01-19,2026-01-15,38548.59,False,payment for services,2026-02-23 16:50:30.516232,Raw_GL_Export.csv
TXN001595,2026-02-27,2026-02-17,2026-02,AUS01,5110,CC3100,Google,INV22970,PO6838,GBP,18094.85,GST,Payment for subscription,Manual Entry,2026-02-27,2026-02-17,18094.85,False,payment for subscription,2026-02-23 16:50:30.516232,Raw_GL_Export.csv
TXN001596,22-01-2026,17-01-2026,2026-01,AUS01,5310,CC3200,DHL Express,INV74688,PO3820,NZD,14817.24,INPUT,Payment for subscription,Manual Entry,2026-01-22,2026-01-17,14817.24,False,payment for subscription,2026-02-23 16:50:30.516232,Raw_GL_Export.csv
TXN001597,08/14/2025,08/13/2025,2025-08,AUS01,5000,CC1000,Federal Express,INV79593,PO5770,GBP,15257.27,EXPORT,Payment for services,Workday,2025-08-14,2025-08-13,15257.27,False,payment for services,2026-02-23 16:50:30.516232,Raw_GL_Export.csv
TXN001598,03-02-2026,27-01-2026,2026-02,AUS01,5320,CC2100,McKinsey,INV49654,,AUD,7010.39,INPUT,Payment for license,API Import,2026-02-03,2026-01-27,7010.39,False,payment for license,2026-02-23 16:50:30.516232,Raw_GL_Export.csv
TXN001599,20-01-2026,15-01-2026,2026-01,AUS01,5000,CC1200,SAP,INV12226,PO4823,USD,23864.84,EXPORT,Payment for subscription,Manual Entry,2026-01-20,2026-01-15,23864.84,False,payment for subscription,2026-02-23 16:50:30.516232,Raw_GL_Export.csv
TXN001600,2025-02-28,2025-02-26,2025-02,AUS01,5420,CC1000,Accenture Pty,INV45098,,GBP,8809.97,INPUT,Payment for goods,API Import,2025-02-28,2025-02-26,8809.97,False,payment for goods,2026-02-23 16:50:30.516232,Raw_GL_Export.csv
TXN001601,21-02-2025,20-02-2025,2025-02,AUS01,5120,CC1000,BCG,INV13984,PO5554,AUD,24371.02,GST-FREE,Payment for services,Oracle,2025-02-21,2025-02-20,24371.02,False,payment for services,2026-02-23 16:50:30.516232,Raw_GL_Export.csv
TXN001602,2026-01-09,2025-12-30,2026-01,AUS01,5810,CC3100,Salesforce,INV27685,PO6515,GBP,26877.31,EXPORT,Payment for goods,API Import,2026-01-09,2025-12-30,26877.31,False,payment for goods,2026-02-23 16:50:30.516232,Raw_GL_Export.csv
TXN001603,2025-09-09,2025-09-05,2025-09,AUS01,5320,CC3100,PWC,INV70822,,AUD,13517.2,GST,Payment for consulting,Manual Entry,2025-09-09,2025-09-05,13517.2,False,payment for consulting,2026-02-23 16:50:30.516232,Raw_GL_Export.csv
TXN001604,2026-01-10,2025-12-31,2026-01,AUS01,5310,CC3200,ServiceNow Inc,INV86608,PO9986,NZD,30489.69,INPUT,Payment for services,Oracle,2026-01-10,2025-12-31,30489.69,False,payment for services,2026-02-23 16:50:30.516232,Raw_GL_Export.csv
TXN001605,22-01-2026,21-01-2026,2026-01,AUS01,5120,CC4100,Deloitte Touche,INV40574,PO6796,NZD,6706.54,GST,Payment for license,API Import,2026-01-22,2026-01-21,6706.54,False,payment for license,2026-02-23 16:50:30.516232,Raw_GL_Export.csv
TXN001606,25/02/2026,19/02/2026,2026-02,AUS01,5510,CC2100,Amazon,INV30128,,GBP,8685.32,INPUT,Payment for services,API Import,2026-02-25,2026-02-19,8685.32,False,payment for services,2026-02-23 16:50:30.516232,Raw_GL_Export.csv
TXN001607,24-02-2026,16-02-2026,2026-02,AUS01,5500,CC2100,Telstra Corp,INV24900,PO2092,GBP,16379.58,INPUT,Payment for license,Manual Entry,2026-02-24,2026-02-16,16379.58,False,payment for license,2026-02-23 16:50:30.516232,Raw_GL_Export.csv
TXN001608,02/24/2026,02/15/2026,2026-02,AUS01,5800,CC1200,SAP,INV89478,PO9519,AUD,22588.63,GST-FREE,Payment for consulting,API Import,2026-02-24,2026-02-15,22588.63,False,payment for consulting,2026-02-23 16:50:30.516232,Raw_GL_Export.csv
TXN001609,02/26/2026,02/24/2026,2026-02,AUS01,5600,CC3100,Adobe,INV32061,PO8034,USD,29136.96,GST-FREE,Payment for services,Workday,2026-02-26,2026-02-24,29136.96,False,payment for services,2026-02-23 16:50:30.516232,Raw_GL_Export.csv
TXN001610,24-01-2026,14-01-2026,2026-01,AUS01,5810,CC2100,Adobe,INV48343,PO4437,GBP,18957.55,EXPORT,Payment for services,Manual Entry,2026-01-24,2026-01-14,18957.55,False,payment for services,2026-02-23 16:50:30.516232,Raw_GL_Export.csv
TXN001611,2026-02-07,2026-01-31,2026-02,AUS01,5400,CC1200,Workday,INV71438,PO3450,AUD,16781.72,GST,Payment for subscription,Oracle,2026-02-07,2026-01-31,16781.72,False,payment for subscription,2026-02-23 16:50:30.516232,Raw_GL_Export.csv
TXN001612,01/13/2026,01/07/2026,2026-01,AUS01,5600,CC2100,AusPost,INV40876,,AUD,42017.03,GST-FREE,Payment for goods,Oracle,2026-01-13,2026-07-01,42017.03,False,payment for goods,2026-02-23 16:50:30.516232,Raw_GL_Export.csv
TXN001613,21-02-2026,19-02-2026,2026-02,AUS01,5420,CC4100,Robert Half International,INV39884,PO1927,AUD,44133.25,GST-FREE,Payment for services,Manual Entry,2026-02-21,2026-02-19,44133.25,False,payment for services,2026-02-23 16:50:30.516232,Raw_GL_Export.csv
TXN001614,07/11/2025,07/02/2025,2025-07,AUS01,5620,CC3200,MSFT,INV86142,PO5251,NZD,36465.4,EXPORT,Payment for services,Manual Entry,2025-11-07,2025-02-07,36465.4,False,payment for services,2026-02-23 16:50:30.516232,Raw_GL_Export.csv
TXN001615,14-02-2026,08-02-2026,2026-02,AUS01,5310,CC2000,Salesforce,INV70656,PO6779,AUD,37950.38,GST-FREE,Payment for license,SAP,2026-02-14,2026-02-08,37950.38,False,payment for license,2026-02-23 16:50:30.516232,Raw_GL_Export.csv
TXN001616,11-02-2026,01-02-2026,2026-02,AUS01,5010,CC4000,EY Australia,INV31973,PO4442,NZD,22995.76,EXPORT,Payment for license,Workday,2026-02-11,2026-02-01,22995.76,False,payment for license,2026-02-23 16:50:30.516232,Raw_GL_Export.csv
TXN001617,18-02-2026,11-02-2026,2026-02,AUS01,5200,CC4000,Amazon,INV62244,,USD,43180.87,EXPORT,Payment for goods,API Import,2026-02-18,2026-02-11,43180.87,False,payment for goods,2026-02-23 16:50:30.516232,Raw_GL_Export.csv
TXN001618,2026-02-13,2026-02-10,2026-02,AUS01,5100,CC4100,Amazon,INV30275,PO9847,NZD,33246.43,GST,Payment for license,Manual Entry,2026-02-13,2026-02-10,33246.43,False,payment for license,2026-02-23 16:50:30.516232,Raw_GL_Export.csv
TXN001619,2025-10-28,2025-10-19,2025-10,AUS01,5810,CC1200,Amazon,INV60859,PO1600,GBP,416.22,EXPORT,Payment for services,SAP,2025-10-28,2025-10-19,416.22,False,payment for services,2026-02-23 16:50:30.516232,Raw_GL_Export.csv
TXN001620,15/06/2025,11/06/2025,2025-06,AUS01,5500,CC1200,Zoom,INV39347,,GBP,24942.24,GST-FREE,Payment for license,Manual Entry,2025-06-15,2025-06-11,24942.24,False,payment for license,2026-02-23 16:50:30.516232,Raw_GL_Export.csv
TXN001621,08/22/2025,08/12/2025,2025-08,AUS01,5420,CC1000,Accenture Pty,INV52978,PO7779,NZD,2086.32,EXPORT,Payment for license,Oracle,2025-08-22,2025-12-08,2086.32,False,payment for license,2026-02-23 16:50:30.516232,Raw_GL_Export.csv
TXN001622,01/07/2026,01/01/2026,2026-01,AUS01,5710,CC3200,AWS,INV32388,PO4572,GBP,19957.44,GST,Payment for services,Workday,2026-07-01,2026-01-01,19957.44,False,payment for services,2026-02-23 16:50:30.516232,Raw_GL_Export.csv
TXN001623,01/11/2026,01/10/2026,2026-01,AUS01,5700,CC3000,Optus Pty,INV78786,PO4647,AUD,16150.69,GST,Payment for license,Workday,2026-11-01,2026-10-01,16150.69,False,payment for license,2026-02-23 16:50:30.516232,Raw_GL_Export.csv
TXN001624,09/23/2025,09/18/2025,2025-09,AUS01,5010,CC2100,Regus Australia,INV50811,,USD,4799.71,GST,Payment for consulting,SAP,2025-09-23,2025-09-18,4799.71,False,payment for consulting,2026-02-23 16:50:30.516232,Raw_GL_Export.csv
TXN001625,2026-01-21,2026-01-18,2026-01,AUS01,5210,CC3000,MSFT,INV24920,PO7447,USD,18086.78,EXPORT,Payment for license,API Import,2026-01-21,2026-01-18,18086.78,False,payment for license,2026-02-23 16:50:30.516232,Raw_GL_Export.csv
TXN001626,2025-06-03,2025-05-24,2025-06,AUS01,5620,CC3200,Optus Pty,INV40424,PO5957,GBP,24243.94,GST-FREE,Payment for subscription,Workday,2025-06-03,2025-05-24,24243.94,False,payment for subscription,2026-02-23 16:50:30.516232,Raw_GL_Export.csv
TXN001627,02/14/2026,02/09/2026,2026-02,AUS01,5410,CC3200,KPMG Australia,INV65477,PO8000,AUD,41182.58,GST-FREE,Payment for subscription,SAP,2026-02-14,2026-09-02,41182.58,False,payment for subscription,2026-02-23 16:50:30.516232,Raw_GL_Export.csv
TXN001628,03-01-2025,30-12-2024,2025-01,AUS01,5110,CC4100,McKinsey,INV76326,PO2950,GBP,9916.48,EXPORT,Payment for subscription,API Import,2025-01-03,2024-12-30,9916.48,False,payment for subscription,2026-02-23 16:50:30.516232,Raw_GL_Export.csv
TXN001629,01/16/2025,01/08/2025,2025-01,AUS01,5710,CC1200,Zoom,INV83342,PO4414,GBP,10585.11,EXPORT,Payment for services,Oracle,2025-01-16,2025-08-01,10585.11,False,payment for services,2026-02-23 16:50:30.516232,Raw_GL_Export.csv
TXN001630,2025-05-19,2025-05-13,2025-05,AUS01,5520,CC3000,EY Australia,INV39706,,USD,44817.25,GST-FREE,Payment for services,Manual Entry,2025-05-19,2025-05-13,44817.25,False,payment for services,2026-02-23 16:50:30.516232,Raw_GL_Export.csv
TXN001631,02/28/2026,02/26/2026,2026-02,AUS01,5520,CC3000,Deloitte Touche,INV13141,PO4396,USD,26280.2,EXPORT,Payment for subscription,Workday,2026-02-28,2026-02-26,26280.2,False,payment for subscription,2026-02-23 16:50:30.516232,Raw_GL_Export.csv
TXN001632,26-11-2025,18-11-2025,2025-11,AUS01,5710,CC2100,Federal Express,INV92862,PO9925,USD,32749.28,INPUT,Payment for subscription,SAP,2025-11-26,2025-11-18,32749.28,False,payment for subscription,2026-02-23 16:50:30.516232,Raw_GL_Export.csv
TXN001633,21-02-2026,16-02-2026,2026-02,AUS01,5800,CC4100,Atlassian Pty,INV54128,,GBP,2957.53,GST,Payment for goods,Oracle,2026-02-21,2026-02-16,2957.53,False,payment for goods,2026-02-23 16:50:30.516232,Raw_GL_Export.csv
TXN001634,2025-10-03,2025-09-26,2025-10,AUS01,5600,CC4000,Salesforce,INV39874,PO5912,NZD,40116.69,GST,Payment for subscription,Manual Entry,2025-10-03,2025-09-26,40116.69,False,payment for subscription,2026-02-23 16:50:30.516232,Raw_GL_Export.csv
TXN001635,2026-01-13,2026-01-03,2026-01,AUS01,5220,CC4000,Workday,INV13385,PO3104,GBP,36507.67,INPUT,Payment for license,Oracle,2026-01-13,2026-01-03,36507.67,False,payment for license,2026-02-23 16:50:30.516232,Raw_GL_Export.csv
TXN001636,18-02-2026,13-02-2026,2026-02,AUS01,5700,CC2000,SAP,INV93154,PO1484,AUD,36554.66,EXPORT,Payment for license,API Import,2026-02-18,2026-02-13,36554.66,False,payment for license,2026-02-23 16:50:30.516232,Raw_GL_Export.csv
TXN001637,13/02/2026,11/02/2026,2026-02,AUS01,5520,CC2000,AusPost,INV88614,PO7807,GBP,20413.65,GST,Payment for consulting,Manual Entry,2026-02-13,2026-02-11,20413.65,False,payment for consulting,2026-02-23 16:50:30.516232,Raw_GL_Export.csv
TXN001638,2026-02-03,2026-01-31,2026-02,AUS01,5310,CC3100,Accenture Pty,INV27619,PO3097,NZD,7907.93,GST,Payment for goods,Oracle,2026-02-03,2026-01-31,7907.93,False,payment for goods,2026-02-23 16:50:30.516232,Raw_GL_Export.csv
TXN001639,2026-01-09,2026-01-07,2026-01,AUS01,5200,CC3200,Telstra Corp,INV56934,PO1264,USD,40110.54,EXPORT,Payment for services,Manual Entry,2026-01-09,2026-01-07,40110.54,False,payment for services,2026-02-23 16:50:30.516232,Raw_GL_Export.csv
TXN001640,28-02-2026,18-02-2026,2026-02,AUS01,5020,CC3000,Zoom,INV25767,,NZD,12495.91,EXPORT,Payment for services,API Import,2026-02-28,2026-02-18,12495.91,False,payment for services,2026-02-23 16:50:30.516232,Raw_GL_Export.csv
TXN001641,06/04/2025,02/04/2025,2025-04,AUS01,5810,CC3000,Salesforce,INV57250,PO6032,GBP,13751.64,EXPORT,Payment for goods,Manual Entry,2025-04-06,2025-04-02,13751.64,False,payment for goods,2026-02-23 16:50:30.516232,Raw_GL_Export.csv
TXN001642,2026-01-27,2026-01-25,2026-01,AUS01,5520,CC3100,Accenture Pty,INV38597,,GBP,33847.19,EXPORT,Payment for license,Workday,2026-01-27,2026-01-25,33847.19,False,payment for license,2026-02-23 16:50:30.516232,Raw_GL_Export.csv
TXN001643,24-12-2025,14-12-2025,2025-12,AUS01,5620,CC3000,WeWork Australia,INV99824,PO5304,USD,28807.21,EXPORT,Payment for services,Workday,2025-12-24,2025-12-14,28807.21,False,payment for services,2026-02-23 16:50:30.516232,Raw_GL_Export.csv
TXN001644,2025-04-20,2025-04-19,2025-04,AUS01,5200,CC4000,McKinsey,INV54993,,AUD,43778.84,INPUT,Payment for goods,Workday,2025-04-20,2025-04-19,43778.84,False,payment for goods,2026-02-23 16:50:30.516232,Raw_GL_Export.csv
TXN001645,02/25/2026,02/20/2026,2026-02,AUS01,5520,CC3100,Seek Limited,INV85060,,USD,8207.5,GST-FREE,Payment for consulting,Oracle,2026-02-25,2026-02-20,8207.5,False,payment for consulting,2026-02-23 16:50:30.516232,Raw_GL_Export.csv
TXN001646,2026-01-08,2026-01-03,2026-01,AUS01,5320,CC2100,Federal Express,INV48326,PO4243,AUD,16883.23,EXPORT,Payment for goods,Workday,2026-01-08,2026-01-03,16883.23,False,payment for goods,2026-02-23 16:50:30.516232,Raw_GL_Export.csv
TXN001647,2026-02-03,2026-01-29,2026-02,AUS01,5710,CC4100,LinkedIn Corp,INV38004,,GBP,26575.08,INPUT,Payment for services,Workday,2026-02-03,2026-01-29,26575.08,False,payment for services,2026-02-23 16:50:30.516232,Raw_GL_Export.csv
TXN001648,01/01/2026,12/27/2025,2026-01,AUS01,5210,CC3200,Hays,INV16785,PO7127,GBP,19179.17,GST-FREE,Payment for license,SAP,2026-01-01,2025-12-27,19179.17,False,payment for license,2026-02-23 16:50:30.516232,Raw_GL_Export.csv
TXN001649,2026-01-02,2025-12-24,2026-01,AUS01,5500,CC2000,Google,INV52542,,NZD,9355.26,GST,Payment for services,Workday,2026-01-02,2025-12-24,9355.26,False,payment for services,2026-02-23 16:50:30.516232,Raw_GL_Export.csv
TXN001650,08-01-2026,31-12-2025,2026-01,AUS01,5520,CC3100,Adobe,INV73685,PO2271,AUD,42543.46,GST,Payment for license,Manual Entry,2026-01-08,2025-12-31,42543.46,False,payment for license,2026-02-23 16:50:30.516232,Raw_GL_Export.csv
TXN001651,2025-08-04,2025-07-25,2025-08,AUS01,5700,CC3100,McKinsey,INV69525,PO7660,GBP,13623.53,INPUT,Payment for license,SAP,2025-08-04,2025-07-25,13623.53,False,payment for license,2026-02-23 16:50:30.516232,Raw_GL_Export.csv
TXN001652,05-02-2026,26-01-2026,2026-02,AUS01,5700,CC2000,Accenture Pty,INV33488,PO4214,AUD,16815.72,INPUT,Payment for services,Manual Entry,2026-02-05,2026-01-26,16815.72,False,payment for services,2026-02-23 16:50:30.516232,Raw_GL_Export.csv
TXN001653,2025-07-02,2025-06-29,2025-07,AUS01,5200,CC1000,Oracle,INV12472,PO3262,GBP,39355.11,INPUT,Payment for goods,Workday,2025-07-02,2025-06-29,39355.11,False,payment for goods,2026-02-23 16:50:30.516232,Raw_GL_Export.csv
TXN001654,2025-07-24,2025-07-22,2025-07,AUS01,5300,CC1200,Amazon,INV23513,PO5195,GBP,18457.71,GST,Payment for subscription,API Import,2025-07-24,2025-07-22,18457.71,False,payment for subscription,2026-02-23 16:50:30.516232,Raw_GL_Export.csv
TXN001655,19/05/2025,18/05/2025,2025-05,AUS01,5100,CC3100,Telstra Corp,INV26872,,USD,9340.72,GST-FREE,Payment for goods,Workday,2025-05-19,2025-05-18,9340.72,False,payment for goods,2026-02-23 16:50:30.516232,Raw_GL_Export.csv
TXN001656,2025-01-02,2024-12-27,2025-01,AUS01,5210,CC4100,Slack,INV58816,PO1451,USD,29951.28,GST,Payment for services,API Import,2025-01-02,2024-12-27,29951.28,False,payment for services,2026-02-23 16:50:30.516232,Raw_GL_Export.csv
TXN001657,2025-06-25,2025-06-23,2025-06,AUS01,5100,CC2000,Deloitte Touche,INV35223,,NZD,9487.51,GST,Payment for goods,Workday,2025-06-25,2025-06-23,9487.51,False,payment for goods,2026-02-23 16:50:30.516232,Raw_GL_Export.csv
TXN001658,06-02-2026,04-02-2026,2026-02,AUS01,5900,CC2000,Adobe,INV53979,PO7745,USD,33008.89,INPUT,Payment for subscription,Workday,2026-02-06,2026-02-04,33008.89,False,payment for subscription,2026-02-23 16:50:30.516232,Raw_GL_Export.csv
TXN001659,05/01/2026,31/12/2025,2026-01,AUS01,5120,CC4000,DHL Express,INV89876,PO1081,NZD,34785.93,INPUT,Payment for goods,Workday,2026-01-05,2025-12-31,34785.93,False,payment for goods,2026-02-23 16:50:30.516232,Raw_GL_Export.csv
TXN001660,19-01-2026,12-01-2026,2026-01,AUS01,5200,CC2100,Oracle,INV42442,PO8435,AUD,32862.74,INPUT,Payment for consulting,Oracle,2026-01-19,2026-01-12,32862.74,False,payment for consulting,2026-02-23 16:50:30.516232,Raw_GL_Export.csv
TXN001661,08/09/2025,08/06/2025,2025-08,AUS01,5610,CC3200,ServiceNow Inc,INV53857,PO7285,NZD,18273.99,GST,Payment for consulting,Workday,2025-09-08,2025-06-08,18273.99,False,payment for consulting,2026-02-23 16:50:30.516232,Raw_GL_Export.csv
TXN001662,01/27/2026,01/17/2026,2026-01,AUS01,5920,CC1100,PWC,INV30670,PO5035,GBP,34404.97,EXPORT,Payment for license,SAP,2026-01-27,2026-01-17,34404.97,False,payment for license,2026-02-23 16:50:30.516232,Raw_GL_Export.csv
TXN001663,20-04-2025,13-04-2025,2025-04,AUS01,5300,CC1100,PWC,INV38727,,GBP,35245.76,INPUT,Payment for license,Workday,2025-04-20,2025-04-13,35245.76,False,payment for license,2026-02-23 16:50:30.516232,Raw_GL_Export.csv
TXN001664,02/06/2026,01/29/2026,2026-02,AUS01,5810,CC2100,DHL Express,INV54310,,GBP,32413.6,GST-FREE,Payment for license,Manual Entry,2026-06-02,2026-01-29,32413.6,False,payment for license,2026-02-23 16:50:30.516232,Raw_GL_Export.csv
TXN001665,01/05/2026,01/01/2026,2026-01,AUS01,5110,CC2100,SAP,INV49034,,GBP,22274.05,GST-FREE,Payment for consulting,SAP,2026-05-01,2026-01-01,22274.05,False,payment for consulting,2026-02-23 16:50:30.516232,Raw_GL_Export.csv
TXN001666,06-02-2026,30-01-2026,2026-02,AUS01,5200,CC4000,ServiceNow Inc,INV63847,PO9195,NZD,12288.26,INPUT,Payment for consulting,Oracle,2026-02-06,2026-01-30,12288.26,False,payment for consulting,2026-02-23 16:50:30.516232,Raw_GL_Export.csv
TXN001667,2026-01-22,2026-01-15,2026-01,AUS01,5900,CC1100,DHL Express,INV87363,PO9951,USD,13391.98,EXPORT,Payment for services,Manual Entry,2026-01-22,2026-01-15,13391.98,False,payment for services,2026-02-23 16:50:30.516232,Raw_GL_Export.csv
TXN001668,02/04/2026,01/31/2026,2026-02,AUS01,5700,CC4000,Google,INV70542,,AUD,17774.95,GST-FREE,Payment for goods,SAP,2026-04-02,2026-01-31,17774.95,False,payment for goods,2026-02-23 16:50:30.516232,Raw_GL_Export.csv
TXN001669,16/01/2026,08/01/2026,2026-01,AUS01,5110,CC3100,MSFT,INV22506,,GBP,31131.89,GST,Payment for license,Manual Entry,2026-01-16,2026-01-08,31131.89,False,payment for license,2026-02-23 16:50:30.516232,Raw_GL_Export.csv
TXN001670,27-02-2026,18-02-2026,2026-02,AUS01,5710,CC1000,Slack,INV25443,,GBP,32963.01,GST-FREE,Payment for services,Workday,2026-02-27,2026-02-18,32963.01,False,payment for services,2026-02-23 16:50:30.516232,Raw_GL_Export.csv
TXN001671,13/01/2026,03/01/2026,2026-01,AUS01,5810,CC2100,Optus Pty,INV28894,PO3694,GBP,8359.06,INPUT,Payment for consulting,Workday,2026-01-13,2026-01-03,8359.06,False,payment for consulting,2026-02-23 16:50:30.516232,Raw_GL_Export.csv
TXN001672,12-01-2026,08-01-2026,2026-01,AUS01,5910,CC2000,GCP,INV11487,,GBP,6327.39,INPUT,Payment for license,Workday,2026-01-12,2026-01-08,6327.39,False,payment for license,2026-02-23 16:50:30.516232,Raw_GL_Export.csv
TXN001673,2026-02-17,2026-02-15,2026-02,AUS01,5120,CC3100,Federal Express,INV91319,PO1419,NZD,25565.35,GST,Payment for consulting,API Import,2026-02-17,2026-02-15,25565.35,False,payment for consulting,2026-02-23 16:50:30.516232,Raw_GL_Export.csv
TXN001674,08/06/2025,02/06/2025,2025-06,AUS01,5210,CC4100,Atlassian Pty,INV24081,,AUD,4809.08,EXPORT,Payment for license,SAP,2025-06-08,2025-06-02,4809.08,False,payment for license,2026-02-23 16:50:30.516232,Raw_GL_Export.csv
TXN001675,04-01-2025,31-12-2024,2025-01,AUS01,5600,CC4100,PWC,INV35518,,AUD,34287.7,GST,Payment for subscription,Workday,2025-01-04,2024-12-31,34287.7,False,payment for subscription,2026-02-23 16:50:30.516232,Raw_GL_Export.csv
TXN001676,07-03-2025,28-02-2025,2025-03,AUS01,5910,CC3200,Workday,INV46889,,NZD,24053.21,GST,Payment for license,API Import,2025-03-07,2025-02-28,24053.21,False,payment for license,2026-02-23 16:50:30.516232,Raw_GL_Export.csv
TXN001677,01/26/2026,01/24/2026,2026-01,AUS01,5800,CC1000,Salesforce,INV14941,,GBP,22263.71,GST-FREE,Payment for subscription,API Import,2026-01-26,2026-01-24,22263.71,False,payment for subscription,2026-02-23 16:50:30.516232,Raw_GL_Export.csv
TXN001678,2026-01-03,2025-12-27,2026-01,AUS01,5000,CC2100,Google,INV96003,PO3646,AUD,2235.47,INPUT,Payment for services,Oracle,2026-01-03,2025-12-27,2235.47,False,payment for services,2026-02-23 16:50:30.516232,Raw_GL_Export.csv
TXN001679,17-09-2025,10-09-2025,2025-09,AUS01,5100,CC3100,Microsoft,INV42302,,AUD,39440.08,GST,Payment for services,Oracle,2025-09-17,2025-09-10,39440.08,False,payment for services,2026-02-23 16:50:30.516232,Raw_GL_Export.csv
TXN001680,02/09/2026,02/04/2026,2026-02,AUS01,5520,CC2100,Zoom,INV19789,PO8832,AUD,9507.89,GST-FREE,Payment for license,SAP,2026-09-02,2026-04-02,9507.89,False,payment for license,2026-02-23 16:50:30.516232,Raw_GL_Export.csv
TXN001681,2025-09-16,2025-09-12,2025-09,AUS01,5520,CC3100,MSFT,INV22960,PO2415,AUD,14644.25,EXPORT,Payment for consulting,SAP,2025-09-16,2025-09-12,14644.25,False,payment for consulting,2026-02-23 16:50:30.516232,Raw_GL_Export.csv
TXN001682,07/02/2026,05/02/2026,2026-02,AUS01,5600,CC2100,Amazon,INV97688,PO3647,USD,13725.13,EXPORT,Payment for license,API Import,2026-02-07,2026-02-05,13725.13,False,payment for license,2026-02-23 16:50:30.516232,Raw_GL_Export.csv
TXN001683,2025-08-26,2025-08-21,2025-08,AUS01,5020,CC1100,Slack,INV51564,,GBP,38313.69,INPUT,Payment for consulting,SAP,2025-08-26,2025-08-21,38313.69,False,payment for consulting,2026-02-23 16:50:30.516232,Raw_GL_Export.csv
TXN001684,25/04/2025,18/04/2025,2025-04,AUS01,5500,CC4000,Regus Australia,INV34578,PO4913,GBP,17187.34,EXPORT,Payment for license,SAP,2025-04-25,2025-04-18,17187.34,False,payment for license,2026-02-23 16:50:30.516232,Raw_GL_Export.csv
TXN001685,02-01-2026,28-12-2025,2026-01,AUS01,5610,CC1100,Federal Express,INV32193,,AUD,35232.34,INPUT,Payment for goods,SAP,2026-01-02,2025-12-28,35232.34,False,payment for goods,2026-02-23 16:50:30.516232,Raw_GL_Export.csv
TXN001686,01/12/2026,01/11/2026,2026-01,AUS01,5020,CC2000,Google,INV63865,PO8099,NZD,9878.99,GST,Payment for goods,Manual Entry,2026-12-01,2026-11-01,9878.99,False,payment for goods,2026-02-23 16:50:30.516232,Raw_GL_Export.csv
TXN001687,03-01-2026,25-12-2025,2026-01,AUS01,5220,CC3000,BCG,INV95981,PO6109,USD,44925.48,GST-FREE,Payment for services,SAP,2026-01-03,2025-12-25,44925.48,False,payment for services,2026-02-23 16:50:30.516232,Raw_GL_Export.csv
TXN001688,01/05/2026,12/31/2025,2026-01,AUS01,5500,CC1100,LinkedIn Corp,INV65826,PO5625,NZD,23474.78,INPUT,Payment for license,API Import,2026-05-01,2025-12-31,23474.78,False,payment for license,2026-02-23 16:50:30.516232,Raw_GL_Export.csv
TXN001689,20/07/2025,19/07/2025,2025-07,AUS01,5000,CC3000,GCP,INV96954,PO4411,NZD,19527.6,INPUT,Payment for subscription,Workday,2025-07-20,2025-07-19,19527.6,False,payment for subscription,2026-02-23 16:50:30.516232,Raw_GL_Export.csv
TXN001690,01/25/2026,01/22/2026,2026-01,AUS01,5920,CC1200,Optus Pty,INV62980,,AUD,20560.24,EXPORT,Payment for subscription,Manual Entry,2026-01-25,2026-01-22,20560.24,False,payment for subscription,2026-02-23 16:50:30.516232,Raw_GL_Export.csv
TXN001691,2026-01-12,2026-01-07,2026-01,AUS01,5400,CC1000,Seek Limited,INV48543,PO5496,AUD,29883.82,GST,Payment for services,Oracle,2026-01-12,2026-01-07,29883.82,False,payment for services,2026-02-23 16:50:30.516232,Raw_GL_Export.csv
TXN001692,01-02-2026,23-01-2026,2026-02,AUS01,5620,CC3100,Oracle,INV23448,PO1056,NZD,1919.58,EXPORT,Payment for consulting,Manual Entry,2026-02-01,2026-01-23,1919.58,False,payment for consulting,2026-02-23 16:50:30.516232,Raw_GL_Export.csv
TXN001693,2025-12-18,2025-12-13,2025-12,AUS01,5900,CC1100,Hays,INV71828,PO4148,USD,24179.81,GST,Payment for license,SAP,2025-12-18,2025-12-13,24179.81,False,payment for license,2026-02-23 16:50:30.516232,Raw_GL_Export.csv
TXN001694,11/04/2025,11/01/2025,2025-11,AUS01,5110,CC2000,Zoom,INV47212,,USD,8226.06,GST-FREE,Payment for subscription,Manual Entry,2025-04-11,2025-01-11,8226.06,False,payment for subscription,2026-02-23 16:50:30.516232,Raw_GL_Export.csv
TXN001695,11/01/2026,02/01/2026,2026-01,AUS01,5200,CC3000,EY Australia,INV15113,PO5390,AUD,157.87,GST,Payment for consulting,API Import,2026-01-11,2026-01-02,157.87,False,payment for consulting,2026-02-23 16:50:30.516232,Raw_GL_Export.csv
TXN001696,2026-01-26,2026-01-22,2026-01,AUS01,5320,CC1100,Atlassian Pty,INV51211,,USD,15681.61,GST,Payment for consulting,Oracle,2026-01-26,2026-01-22,15681.61,False,payment for consulting,2026-02-23 16:50:30.516232,Raw_GL_Export.csv
TXN001697,06/02/2026,05/02/2026,2026-02,AUS01,5900,CC3100,KPMG Australia,INV74143,PO1670,AUD,28816.09,INPUT,Payment for license,Manual Entry,2026-02-06,2026-02-05,28816.09,False,payment for license,2026-02-23 16:50:30.516232,Raw_GL_Export.csv
TXN001698,17/01/2026,16/01/2026,2026-01,AUS01,5110,CC4000,Amazon,INV23412,PO6397,AUD,1165.46,INPUT,Payment for goods,Workday,2026-01-17,2026-01-16,1165.46,False,payment for goods,2026-02-23 16:50:30.516232,Raw_GL_Export.csv
TXN001699,02/03/2026,01/31/2026,2026-02,AUS01,5900,CC4000,GCP,INV69524,,NZD,13027.21,EXPORT,Payment for goods,API Import,2026-03-02,2026-01-31,13027.21,False,payment for goods,2026-02-23 16:50:30.516232,Raw_GL_Export.csv
TXN001700,02/01/2026,31/12/2025,2026-01,AUS01,5620,CC4000,ServiceNow Inc,INV75237,PO1408,AUD,17410.11,INPUT,Payment for goods,Manual Entry,2026-01-02,2025-12-31,17410.11,False,payment for goods,2026-02-23 16:50:30.516232,Raw_GL_Export.csv
TXN001701,2025-11-18,2025-11-15,2025-11,AUS01,5100,CC2000,Optus Pty,INV62756,PO1225,NZD,41909.22,GST-FREE,Payment for subscription,Workday,2025-11-18,2025-11-15,41909.22,False,payment for subscription,2026-02-23 16:50:30.516232,Raw_GL_Export.csv
TXN001702,01/18/2026,01/12/2026,2026-01,AUS01,5500,CC3000,EY Australia,INV34454,PO1010,AUD,24558.43,INPUT,Payment for consulting,API Import,2026-01-18,2026-12-01,24558.43,False,payment for consulting,2026-02-23 16:50:30.516232,Raw_GL_Export.csv
TXN001703,2026-02-14,2026-02-09,2026-02,AUS01,5320,CC1200,Telstra Corp,INV60922,PO8531,AUD,17039.07,GST,Payment for goods,Oracle,2026-02-14,2026-02-09,17039.07,False,payment for goods,2026-02-23 16:50:30.516232,Raw_GL_Export.csv
TXN001704,02/15/2026,02/09/2026,2026-02,AUS01,5420,CC1000,Google,INV64312,,GBP,14393.8,EXPORT,Payment for goods,Manual Entry,2026-02-15,2026-09-02,14393.8,False,payment for goods,2026-02-23 16:50:30.516232,Raw_GL_Export.csv
TXN001705,2026-01-22,2026-01-17,2026-01,AUS01,5600,CC4000,MSFT,INV77112,,USD,16161.37,GST,Payment for consulting,Manual Entry,2026-01-22,2026-01-17,16161.37,False,payment for consulting,2026-02-23 16:50:30.516232,Raw_GL_Export.csv
TXN001706,20/01/2026,10/01/2026,2026-01,AUS01,5920,CC3100,KPMG Australia,INV33638,PO1149,NZD,13628.1,EXPORT,Payment for license,Workday,2026-01-20,2026-01-10,13628.1,False,payment for license,2026-02-23 16:50:30.516232,Raw_GL_Export.csv
TXN001707,22/01/2026,18/01/2026,2026-01,AUS01,5800,CC1200,Deloitte Touche,INV14182,,USD,9645.37,GST,Payment for consulting,Oracle,2026-01-22,2026-01-18,9645.37,False,payment for consulting,2026-02-23 16:50:30.516232,Raw_GL_Export.csv
TXN001708,2025-12-10,2025-12-04,2025-12,AUS01,5310,CC2000,DHL Express,INV51330,PO1471,AUD,14810.5,INPUT,Payment for consulting,Oracle,2025-12-10,2025-12-04,14810.5,False,payment for consulting,2026-02-23 16:50:30.516232,Raw_GL_Export.csv
TXN001709,27-03-2025,17-03-2025,2025-03,AUS01,5900,CC3100,AWS,INV69267,,USD,12562.01,INPUT,Payment for goods,Oracle,2025-03-27,2025-03-17,12562.01,False,payment for goods,2026-02-23 16:50:30.516232,Raw_GL_Export.csv
TXN001710,22/01/2026,12/01/2026,2026-01,AUS01,5900,CC3000,KPMG Australia,INV20822,PO9811,NZD,8239.61,GST-FREE,Payment for goods,API Import,2026-01-22,2026-01-12,8239.61,False,payment for goods,2026-02-23 16:50:30.516232,Raw_GL_Export.csv
TXN001711,13/02/2026,12/02/2026,2026-02,AUS01,5220,CC1000,Slack,INV68015,,GBP,17714.72,GST,Payment for consulting,Workday,2026-02-13,2026-02-12,17714.72,False,payment for consulting,2026-02-23 16:50:30.516232,Raw_GL_Export.csv
TXN001712,06/02/2026,03/02/2026,2026-02,AUS01,5000,CC2100,Google,INV25626,PO4944,GBP,20934.08,GST-FREE,Payment for license,Oracle,2026-02-06,2026-02-03,20934.08,False,payment for license,2026-02-23 16:50:30.516232,Raw_GL_Export.csv
TXN001713,13-01-2025,03-01-2025,2025-01,AUS01,5200,CC3200,AWS,INV56524,PO4529,GBP,10035.96,GST-FREE,Payment for services,Oracle,2025-01-13,2025-01-03,10035.96,False,payment for services,2026-02-23 16:50:30.516232,Raw_GL_Export.csv
TXN001714,19/12/2025,10/12/2025,2025-12,AUS01,5010,CC2100,WeWork Australia,INV64786,,AUD,8404.1,GST,Payment for license,SAP,2025-12-19,2025-12-10,8404.1,False,payment for license,2026-02-23 16:50:30.516232,Raw_GL_Export.csv
TXN001715,04/01/2026,31/12/2025,2026-01,AUS01,5200,CC3000,ServiceNow Inc,INV89128,,GBP,27228.37,GST,Payment for services,SAP,2026-01-04,2025-12-31,27228.37,False,payment for services,2026-02-23 16:50:30.516232,Raw_GL_Export.csv
TXN001716,01/06/2026,12/30/2025,2026-01,AUS01,5100,CC3100,Zoom,INV98737,,USD,37891.72,EXPORT,Payment for consulting,SAP,2026-06-01,2025-12-30,37891.72,False,payment for consulting,2026-02-23 16:50:30.516232,Raw_GL_Export.csv
TXN001717,10/17/2025,10/11/2025,2025-10,AUS01,5610,CC2100,AWS,INV39740,,GBP,26113.58,GST-FREE,Payment for subscription,Oracle,2025-10-17,2025-11-10,26113.58,False,payment for subscription,2026-02-23 16:50:30.516232,Raw_GL_Export.csv
TXN001718,05/02/2026,03/02/2026,2026-02,AUS01,5400,CC3200,LinkedIn Corp,INV47961,PO5717,AUD,12890.39,EXPORT,Payment for goods,Manual Entry,2026-02-05,2026-02-03,12890.39,False,payment for goods,2026-02-23 16:50:30.516232,Raw_GL_Export.csv
TXN001719,2026-02-01,2026-01-22,2026-02,AUS01,5300,CC3000,SAP,INV75398,PO7893,AUD,41407.85,EXPORT,Payment for consulting,Workday,2026-02-01,2026-01-22,41407.85,False,payment for consulting,2026-02-23 16:50:30.516232,Raw_GL_Export.csv
TXN001720,02/02/2026,01/30/2026,2026-02,AUS01,5700,CC3200,AusPost,INV82584,,AUD,5713.47,GST-FREE,Payment for subscription,Manual Entry,2026-02-02,2026-01-30,5713.47,False,payment for subscription,2026-02-23 16:50:30.516232,Raw_GL_Export.csv
TXN001721,2026-02-18,2026-02-11,2026-02,AUS01,5700,CC1100,MSFT,INV98496,,USD,6028.84,GST,Payment for consulting,API Import,2026-02-18,2026-02-11,6028.84,False,payment for consulting,2026-02-23 16:50:30.516232,Raw_GL_Export.csv
TXN001722,22-12-2025,21-12-2025,2025-12,AUS01,5400,CC3200,Telstra Corp,INV29813,,USD,15154.95,GST-FREE,Payment for consulting,SAP,2025-12-22,2025-12-21,15154.95,False,payment for consulting,2026-02-23 16:50:30.516232,Raw_GL_Export.csv
TXN001723,01/18/2026,01/08/2026,2026-01,AUS01,5110,CC1100,Slack,INV94819,PO7784,GBP,36861.22,INPUT,Payment for goods,Manual Entry,2026-01-18,2026-08-01,36861.22,False,payment for goods,2026-02-23 16:50:30.516232,Raw_GL_Export.csv
TXN001724,2025-09-03,2025-08-29,2025-09,AUS01,5920,CC1200,EY Australia,INV42091,PO6515,USD,1068.65,GST,Payment for goods,API Import,2025-09-03,2025-08-29,1068.65,False,payment for goods,2026-02-23 16:50:30.516232,Raw_GL_Export.csv
TXN001725,25/01/2026,21/01/2026,2026-01,AUS01,5710,CC1100,Workday,INV88569,PO9228,USD,11758.42,INPUT,Payment for consulting,Manual Entry,2026-01-25,2026-01-21,11758.42,False,payment for consulting,2026-02-23 16:50:30.516232,Raw_GL_Export.csv
TXN001726,20/01/2026,17/01/2026,2026-01,AUS01,5500,CC4000,Deloitte Touche,INV99523,PO6611,AUD,22140.91,GST-FREE,Payment for license,SAP,2026-01-20,2026-01-17,22140.91,False,payment for license,2026-02-23 16:50:30.516232,Raw_GL_Export.csv
TXN001727,11/06/2025,02/06/2025,2025-06,AUS01,5110,CC1000,GCP,INV60834,PO3681,AUD,35074.55,GST,Payment for consulting,Manual Entry,2025-06-11,2025-06-02,35074.55,False,payment for consulting,2026-02-23 16:50:30.516232,Raw_GL_Export.csv
TXN001728,10/01/2026,03/01/2026,2026-01,AUS01,5420,CC2000,Regus Australia,INV33996,PO6176,AUD,36266.15,EXPORT,Payment for subscription,Oracle,2026-01-10,2026-01-03,36266.15,False,payment for subscription,2026-02-23 16:50:30.516232,Raw_GL_Export.csv
TXN001729,26/02/2026,18/02/2026,2026-02,AUS01,5910,CC3000,DHL Express,INV90425,PO7729,NZD,41872.82,EXPORT,Payment for subscription,API Import,2026-02-26,2026-02-18,41872.82,False,payment for subscription,2026-02-23 16:50:30.516232,Raw_GL_Export.csv
TXN001730,01/15/2026,01/05/2026,2026-01,AUS01,5410,CC1200,Adobe,INV58183,PO1355,NZD,36655.15,INPUT,Payment for subscription,Manual Entry,2026-01-15,2026-05-01,36655.15,False,payment for subscription,2026-02-23 16:50:30.516232,Raw_GL_Export.csv
TXN001731,21/09/2025,15/09/2025,2025-09,AUS01,5000,CC3100,Slack,INV24399,,GBP,14781.9,INPUT,Payment for services,Manual Entry,2025-09-21,2025-09-15,14781.9,False,payment for services,2026-02-23 16:50:30.516232,Raw_GL_Export.csv
TXN001732,25/02/2026,17/02/2026,2026-02,AUS01,5410,CC3200,Oracle,INV90463,PO4530,USD,33312.31,GST,Payment for subscription,Workday,2026-02-25,2026-02-17,33312.31,False,payment for subscription,2026-02-23 16:50:30.516232,Raw_GL_Export.csv
TXN001733,28/02/2026,26/02/2026,2026-02,AUS01,5110,CC4100,Atlassian Pty,INV10572,,NZD,19725.17,INPUT,Payment for goods,Workday,2026-02-28,2026-02-26,19725.17,False,payment for goods,2026-02-23 16:50:30.516232,Raw_GL_Export.csv
TXN001734,16-07-2025,07-07-2025,2025-07,AUS01,5920,CC1000,KPMG Australia,INV27949,PO9515,NZD,43763.71,EXPORT,Payment for subscription,SAP,2025-07-16,2025-07-07,43763.71,False,payment for subscription,2026-02-23 16:50:30.516232,Raw_GL_Export.csv
TXN001735,2025-03-15,2025-03-11,2025-03,AUS01,5210,CC4100,Slack,INV41852,,AUD,13237.96,GST-FREE,Payment for goods,SAP,2025-03-15,2025-03-11,13237.96,False,payment for goods,2026-02-23 16:50:30.516232,Raw_GL_Export.csv
TXN001736,01/19/2025,01/13/2025,2025-01,AUS01,5020,CC3100,Hays,INV11540,PO7668,GBP,34490.58,EXPORT,Payment for goods,Oracle,2025-01-19,2025-01-13,34490.58,False,payment for goods,2026-02-23 16:50:30.516232,Raw_GL_Export.csv
TXN001737,28-02-2026,24-02-2026,2026-02,AUS01,5000,CC1100,Salesforce,INV13547,PO1802,USD,39759.31,GST-FREE,Payment for license,Workday,2026-02-28,2026-02-24,39759.31,False,payment for license,2026-02-23 16:50:30.516232,Raw_GL_Export.csv
TXN001738,01/17/2026,01/14/2026,2026-01,AUS01,5400,CC2100,Workday,INV65425,PO7242,USD,44679.02,GST-FREE,Payment for services,API Import,2026-01-17,2026-01-14,44679.02,False,payment for services,2026-02-23 16:50:30.516232,Raw_GL_Export.csv
TXN001739,06-02-2026,29-01-2026,2026-02,AUS01,5800,CC1100,Workday,INV93901,PO5686,GBP,491.85,INPUT,Payment for consulting,API Import,2026-02-06,2026-01-29,491.85,False,payment for consulting,2026-02-23 16:50:30.516232,Raw_GL_Export.csv
TXN001740,2026-01-05,2025-12-27,2026-01,AUS01,5320,CC3100,PWC,INV29080,,AUD,5206.24,GST-FREE,Payment for subscription,SAP,2026-01-05,2025-12-27,5206.24,False,payment for subscription,2026-02-23 16:50:30.516232,Raw_GL_Export.csv
TXN001741,19/02/2026,13/02/2026,2026-02,AUS01,5010,CC1000,Salesforce,INV61315,,AUD,40461.6,INPUT,Payment for subscription,API Import,2026-02-19,2026-02-13,40461.6,False,payment for subscription,2026-02-23 16:50:30.516232,Raw_GL_Export.csv
TXN001742,2026-01-23,2026-01-14,2026-01,AUS01,5010,CC2000,Robert Half International,INV18028,,AUD,12934.27,GST,Payment for subscription,Oracle,2026-01-23,2026-01-14,12934.27,False,payment for subscription,2026-02-23 16:50:30.516232,Raw_GL_Export.csv
TXN001743,06/03/2025,05/27/2025,2025-06,AUS01,5400,CC4000,BCG,INV35025,PO2688,AUD,30950.95,INPUT,Payment for subscription,API Import,2025-03-06,2025-05-27,30950.95,False,payment for subscription,2026-02-23 16:50:30.516232,Raw_GL_Export.csv
TXN001744,21/02/2026,13/02/2026,2026-02,AUS01,5300,CC3200,McKinsey,INV15513,PO1196,NZD,22805.29,GST-FREE,Payment for services,Manual Entry,2026-02-21,2026-02-13,22805.29,False,payment for services,2026-02-23 16:50:30.516232,Raw_GL_Export.csv
TXN001745,01/17/2026,01/10/2026,2026-01,AUS01,5300,CC3200,Atlassian Pty,INV81947,,GBP,37851.69,EXPORT,Payment for services,API Import,2026-01-17,2026-10-01,37851.69,False,payment for services,2026-02-23 16:50:30.516232,Raw_GL_Export.csv
TXN001746,02/01/2026,25/12/2025,2026-01,AUS01,5900,CC1100,DHL Express,INV67138,,USD,21819.6,GST,Payment for subscription,API Import,2026-01-02,2025-12-25,21819.6,False,payment for subscription,2026-02-23 16:50:30.516232,Raw_GL_Export.csv
TXN001747,13-01-2026,04-01-2026,2026-01,AUS01,5410,CC1100,Google,INV67480,PO9541,GBP,37214.42,EXPORT,Payment for goods,Oracle,2026-01-13,2026-01-04,37214.42,False,payment for goods,2026-02-23 16:50:30.516232,Raw_GL_Export.csv
TXN001748,06-07-2025,04-07-2025,2025-07,AUS01,5500,CC1000,McKinsey,INV59142,,AUD,15044.49,GST-FREE,Payment for subscription,API Import,2025-07-06,2025-07-04,15044.49,False,payment for subscription,2026-02-23 16:50:30.516232,Raw_GL_Export.csv
TXN001749,01/03/2026,12/27/2025,2026-01,AUS01,5310,CC3200,Zoom,INV42435,PO9342,NZD,11186.43,GST-FREE,Payment for goods,Workday,2026-03-01,2025-12-27,11186.43,False,payment for goods,2026-02-23 16:50:30.516232,Raw_GL_Export.csv
TXN001750,06-08-2025,30-07-2025,2025-08,AUS01,5700,CC1200,GCP,INV53928,PO2090,GBP,40753.43,EXPORT,Payment for subscription,API Import,2025-08-06,2025-07-30,40753.43,False,payment for subscription,2026-02-23 16:50:30.516232,Raw_GL_Export.csv
TXN001751,01/27/2026,01/20/2026,2026-01,AUS01,5410,CC4000,Hays,INV10846,,USD,293.09,GST-FREE,Payment for license,Workday,2026-01-27,2026-01-20,293.09,False,payment for license,2026-02-23 16:50:30.516232,Raw_GL_Export.csv
TXN001752,07/10/2025,29/09/2025,2025-10,AUS01,5120,CC3200,Federal Express,INV43429,PO7078,GBP,26704.46,GST-FREE,Payment for services,Oracle,2025-10-07,2025-09-29,26704.46,False,payment for services,2026-02-23 16:50:30.516232,Raw_GL_Export.csv
TXN001753,11/02/2026,02/02/2026,2026-02,AUS01,5320,CC2100,Telstra Corp,INV81351,PO4120,AUD,43575.81,GST,Payment for services,API Import,2026-02-11,2026-02-02,43575.81,False,payment for services,2026-02-23 16:50:30.516232,Raw_GL_Export.csv
TXN001754,19-01-2026,16-01-2026,2026-01,AUS01,5800,CC1000,LinkedIn Corp,INV73410,PO8686,USD,25045.09,GST-FREE,Payment for consulting,SAP,2026-01-19,2026-01-16,25045.09,False,payment for consulting,2026-02-23 16:50:30.516232,Raw_GL_Export.csv
TXN001755,02/04/2025,02/01/2025,2025-02,AUS01,5310,CC1200,Seek Limited,INV11129,PO2358,GBP,9009.04,GST,Payment for goods,SAP,2025-04-02,2025-01-02,9009.04,False,payment for goods,2026-02-23 16:50:30.516232,Raw_GL_Export.csv
TXN001756,02/01/2026,28/12/2025,2026-01,AUS01,5110,CC2000,KPMG Australia,INV55717,PO8920,NZD,22049.81,GST,Payment for consulting,Manual Entry,2026-01-02,2025-12-28,22049.81,False,payment for consulting,2026-02-23 16:50:30.516232,Raw_GL_Export.csv
TXN001757,04-02-2026,02-02-2026,2026-02,AUS01,5700,CC4100,Seek Limited,INV55857,PO7596,AUD,16991.3,EXPORT,Payment for consulting,Manual Entry,2026-02-04,2026-02-02,16991.3,False,payment for consulting,2026-02-23 16:50:30.516232,Raw_GL_Export.csv
TXN001758,2025-12-10,2025-11-30,2025-12,AUS01,5610,CC3100,Accenture Pty,INV12107,,USD,13011.99,INPUT,Payment for subscription,Oracle,2025-12-10,2025-11-30,13011.99,False,payment for subscription,2026-02-23 16:50:30.516232,Raw_GL_Export.csv
TXN001759,01/06/2026,01/03/2026,2026-01,AUS01,5700,CC3100,Regus Australia,INV33894,,USD,35136.88,GST-FREE,Payment for services,API Import,2026-06-01,2026-03-01,35136.88,False,payment for services,2026-02-23 16:50:30.516232,Raw_GL_Export.csv
TXN001760,08/03/2025,07/30/2025,2025-08,AUS01,5610,CC1000,LinkedIn Corp,INV72683,PO7903,AUD,16346.88,INPUT,Payment for services,SAP,2025-03-08,2025-07-30,16346.88,False,payment for services,2026-02-23 16:50:30.516232,Raw_GL_Export.csv
TXN001761,11-01-2026,01-01-2026,2026-01,AUS01,5100,CC1100,BCG,INV15748,,AUD,33560.45,GST,Payment for goods,Manual Entry,2026-01-11,2026-01-01,33560.45,False,payment for goods,2026-02-23 16:50:30.516232,Raw_GL_Export.csv
TXN001762,2026-01-01,2025-12-23,2026-01,AUS01,5010,CC1200,DHL Express,INV97742,,NZD,25267.57,GST-FREE,Payment for consulting,Workday,2026-01-01,2025-12-23,25267.57,False,payment for consulting,2026-02-23 16:50:30.516232,Raw_GL_Export.csv
TXN001763,20-01-2026,11-01-2026,2026-01,AUS01,5920,CC2000,ServiceNow Inc,INV56944,PO2462,NZD,13077.1,GST-FREE,Payment for license,Oracle,2026-01-20,2026-01-11,13077.1,False,payment for license,2026-02-23 16:50:30.516232,Raw_GL_Export.csv
TXN001764,08/04/2025,07/25/2025,2025-08,AUS01,5400,CC3200,Google,INV93043,PO5647,NZD,17359.74,EXPORT,Payment for goods,Oracle,2025-04-08,2025-07-25,17359.74,False,payment for goods,2026-02-23 16:50:30.516232,Raw_GL_Export.csv
TXN001765,01/02/2026,30/01/2026,2026-02,AUS01,5500,CC1200,AusPost,INV50681,PO6457,GBP,16482.54,GST-FREE,Payment for subscription,API Import,2026-02-01,2026-01-30,16482.54,False,payment for subscription,2026-02-23 16:50:30.516232,Raw_GL_Export.csv
TXN001766,06-10-2025,03-10-2025,2025-10,AUS01,5300,CC1000,Microsoft,INV12725,PO1813,AUD,31045.35,GST-FREE,Payment for services,Workday,2025-10-06,2025-10-03,31045.35,False,payment for services,2026-02-23 16:50:30.516232,Raw_GL_Export.csv
TXN001767,22-01-2026,21-01-2026,2026-01,AUS01,5310,CC1100,Amazon,INV74947,PO7564,NZD,12663.17,GST-FREE,Payment for goods,SAP,2026-01-22,2026-01-21,12663.17,False,payment for goods,2026-02-23 16:50:30.516232,Raw_GL_Export.csv
TXN001768,21/02/2026,17/02/2026,2026-02,AUS01,5310,CC3100,Workday,INV11686,,GBP,26962.44,GST-FREE,Payment for services,SAP,2026-02-21,2026-02-17,26962.44,False,payment for services,2026-02-23 16:50:30.516232,Raw_GL_Export.csv
TXN001769,2026-01-24,2026-01-14,2026-01,AUS01,5010,CC4000,Accenture Pty,INV10465,PO6074,AUD,24931.69,GST,Payment for license,SAP,2026-01-24,2026-01-14,24931.69,False,payment for license,2026-02-23 16:50:30.516232,Raw_GL_Export.csv
TXN001770,06/02/2026,31/01/2026,2026-02,AUS01,5710,CC2100,Salesforce,INV91919,PO4770,NZD,24514.61,GST-FREE,Payment for services,Workday,2026-02-06,2026-01-31,24514.61,False,payment for services,2026-02-23 16:50:30.516232,Raw_GL_Export.csv
TXN001771,23/02/2026,15/02/2026,2026-02,AUS01,5410,CC3100,Google,INV32333,PO1405,USD,34687.12,EXPORT,Payment for license,SAP,2026-02-23,2026-02-15,34687.12,False,payment for license,2026-02-23 16:50:30.516232,Raw_GL_Export.csv
TXN001772,05/01/2026,29/12/2025,2026-01,AUS01,5510,CC1100,WeWork Australia,INV70030,PO6693,NZD,35113.46,INPUT,Payment for goods,SAP,2026-01-05,2025-12-29,35113.46,False,payment for goods,2026-02-23 16:50:30.516232,Raw_GL_Export.csv
TXN001773,2025-04-27,2025-04-26,2025-04,AUS01,5320,CC4000,Workday,INV75168,PO8337,USD,475.68,EXPORT,Payment for license,API Import,2025-04-27,2025-04-26,475.68,False,payment for license,2026-02-23 16:50:30.516232,Raw_GL_Export.csv
TXN001774,10/07/2025,08/07/2025,2025-07,AUS01,5520,CC4100,Atlassian Pty,INV89482,,NZD,6382.89,EXPORT,Payment for consulting,Workday,2025-07-10,2025-07-08,6382.89,False,payment for consulting,2026-02-23 16:50:30.516232,Raw_GL_Export.csv
TXN001775,2025-05-21,2025-05-19,2025-05,AUS01,5400,CC3200,Telstra Corp,INV76727,PO7522,GBP,31084.55,GST,Payment for goods,API Import,2025-05-21,2025-05-19,31084.55,False,payment for goods,2026-02-23 16:50:30.516232,Raw_GL_Export.csv
TXN001776,18/01/2025,11/01/2025,2025-01,AUS01,5210,CC3100,WeWork Australia,INV93870,,AUD,4041.39,EXPORT,Payment for consulting,Oracle,2025-01-18,2025-01-11,4041.39,False,payment for consulting,2026-02-23 16:50:30.516232,Raw_GL_Export.csv
TXN001777,19/02/2026,16/02/2026,2026-02,AUS01,5410,CC3100,Telstra Corp,INV84694,PO4190,GBP,23211.07,GST,Payment for consulting,Manual Entry,2026-02-19,2026-02-16,23211.07,False,payment for consulting,2026-02-23 16:50:30.516232,Raw_GL_Export.csv
TXN001778,03-03-2025,25-02-2025,2025-03,AUS01,5120,CC1200,AWS,INV51679,PO2739,GBP,13185.38,GST-FREE,Payment for goods,Workday,2025-03-03,2025-02-25,13185.38,False,payment for goods,2026-02-23 16:50:30.516232,Raw_GL_Export.csv
TXN001779,11-01-2026,03-01-2026,2026-01,AUS01,5420,CC1200,Telstra Corp,INV59831,,NZD,43856.46,EXPORT,Payment for license,Oracle,2026-01-11,2026-01-03,43856.46,False,payment for license,2026-02-23 16:50:30.516232,Raw_GL_Export.csv
TXN001780,01/18/2026,01/09/2026,2026-01,AUS01,5000,CC3000,Amazon,INV26357,PO2791,AUD,41338.68,INPUT,Payment for consulting,Workday,2026-01-18,2026-09-01,41338.68,False,payment for consulting,2026-02-23 16:50:30.516232,Raw_GL_Export.csv
TXN001781,16/01/2026,06/01/2026,2026-01,AUS01,5020,CC1200,WeWork Australia,INV80042,PO2315,GBP,15856.26,GST,Payment for services,Workday,2026-01-16,2026-01-06,15856.26,False,payment for services,2026-02-23 16:50:30.516232,Raw_GL_Export.csv
TXN001782,17-01-2026,16-01-2026,2026-01,AUS01,5010,CC3000,Microsoft,INV44326,,AUD,32356.13,GST-FREE,Payment for goods,API Import,2026-01-17,2026-01-16,32356.13,False,payment for goods,2026-02-23 16:50:30.516232,Raw_GL_Export.csv
TXN001783,15-01-2026,09-01-2026,2026-01,AUS01,5620,CC3200,MSFT,INV87286,,USD,28950.96,GST-FREE,Payment for services,SAP,2026-01-15,2026-01-09,28950.96,False,payment for services,2026-02-23 16:50:30.516232,Raw_GL_Export.csv
TXN001784,24/04/2025,18/04/2025,2025-04,AUS01,5620,CC1000,Salesforce,INV74671,,GBP,37619.03,GST,Payment for license,SAP,2025-04-24,2025-04-18,37619.03,False,payment for license,2026-02-23 16:50:30.516232,Raw_GL_Export.csv
TXN001785,02/13/2026,02/10/2026,2026-02,AUS01,5120,CC1200,ServiceNow Inc,INV25606,PO1256,USD,18422.54,GST-FREE,Payment for consulting,Oracle,2026-02-13,2026-10-02,18422.54,False,payment for consulting,2026-02-23 16:50:30.516232,Raw_GL_Export.csv
TXN001786,2026-02-02,2026-01-25,2026-02,AUS01,5620,CC2000,Amazon,INV60448,PO7938,USD,36576.14,GST-FREE,Payment for goods,Workday,2026-02-02,2026-01-25,36576.14,False,payment for goods,2026-02-23 16:50:30.516232,Raw_GL_Export.csv
TXN001787,23-11-2025,17-11-2025,2025-11,AUS01,5210,CC3200,KPMG Australia,INV74856,PO2507,AUD,31408.15,INPUT,Payment for subscription,Workday,2025-11-23,2025-11-17,31408.15,False,payment for subscription,2026-02-23 16:50:30.516232,Raw_GL_Export.csv
TXN001788,01/13/2026,01/06/2026,2026-01,AUS01,5700,CC3200,Deloitte Touche,INV37299,PO5979,AUD,32444.21,EXPORT,Payment for subscription,Workday,2026-01-13,2026-06-01,32444.21,False,payment for subscription,2026-02-23 16:50:30.516232,Raw_GL_Export.csv
TXN001789,02/08/2026,02/02/2026,2026-02,AUS01,5800,CC1100,PWC,INV56391,PO9423,GBP,29523.71,EXPORT,Payment for goods,Workday,2026-08-02,2026-02-02,29523.71,False,payment for goods,2026-02-23 16:50:30.516232,Raw_GL_Export.csv
TXN001790,17/04/2025,12/04/2025,2025-04,AUS01,5520,CC2000,WeWork Australia,INV74818,,GBP,28386.15,EXPORT,Payment for consulting,Workday,2025-04-17,2025-04-12,28386.15,False,payment for consulting,2026-02-23 16:50:30.516232,Raw_GL_Export.csv
TXN001791,12/17/2025,12/13/2025,2025-12,AUS01,5110,CC1000,LinkedIn Corp,INV10599,PO5763,GBP,16484.84,EXPORT,Payment for goods,Oracle,2025-12-17,2025-12-13,16484.84,False,payment for goods,2026-02-23 16:50:30.516232,Raw_GL_Export.csv
TXN001792,25-02-2026,15-02-2026,2026-02,AUS01,5520,CC2000,Deloitte Touche,INV88258,PO9774,NZD,11049.09,EXPORT,Payment for services,Workday,2026-02-25,2026-02-15,11049.09,False,payment for services,2026-02-23 16:50:30.516232,Raw_GL_Export.csv
TXN001793,01/01/2026,12/26/2025,2026-01,AUS01,5900,CC1000,Regus Australia,INV62545,PO1134,AUD,26855.04,INPUT,Payment for services,Manual Entry,2026-01-01,2025-12-26,26855.04,False,payment for services,2026-02-23 16:50:30.516232,Raw_GL_Export.csv
TXN001794,01/07/2026,01/04/2026,2026-01,AUS01,5810,CC4100,SAP,INV39789,PO9028,AUD,31392.74,EXPORT,Payment for goods,API Import,2026-07-01,2026-04-01,31392.74,False,payment for goods,2026-02-23 16:50:30.516232,Raw_GL_Export.csv
TXN001795,07/11/2025,07/05/2025,2025-07,AUS01,5700,CC1000,Accenture Pty,INV53919,PO6753,AUD,2948.26,GST-FREE,Payment for services,Workday,2025-11-07,2025-05-07,2948.26,False,payment for services,2026-02-23 16:50:30.516232,Raw_GL_Export.csv
TXN001796,02/01/2026,01/01/2026,2026-01,AUS01,5300,CC3000,Amazon,INV50848,,USD,43178.02,GST,Payment for goods,SAP,2026-01-02,2026-01-01,43178.02,False,payment for goods,2026-02-23 16:50:30.516232,Raw_GL_Export.csv
TXN001797,05-09-2025,26-08-2025,2025-09,AUS01,5220,CC2000,ServiceNow Inc,INV34653,,GBP,27957.78,INPUT,Payment for services,SAP,2025-09-05,2025-08-26,27957.78,False,payment for services,2026-02-23 16:50:30.516232,Raw_GL_Export.csv
TXN001798,05/01/2026,30/12/2025,2026-01,AUS01,5600,CC1000,PWC,INV70387,PO3441,USD,18109.61,GST-FREE,Payment for license,Manual Entry,2026-01-05,2025-12-30,18109.61,False,payment for license,2026-02-23 16:50:30.516232,Raw_GL_Export.csv
TXN001799,27-01-2025,24-01-2025,2025-01,AUS01,5900,CC3000,Atlassian Pty,INV39287,PO6735,AUD,23608.41,EXPORT,Payment for subscription,Workday,2025-01-27,2025-01-24,23608.41,False,payment for subscription,2026-02-23 16:50:30.516232,Raw_GL_Export.csv
TXN001800,2026-01-11,2026-01-06,2026-01,AUS01,5620,CC3100,Microsoft,INV22290,,AUD,26348.55,INPUT,Payment for subscription,Workday,2026-01-11,2026-01-06,26348.55,False,payment for subscription,2026-02-23 16:50:30.516232,Raw_GL_Export.csv
TXN001801,01/27/2025,01/21/2025,2025-01,AUS01,5810,CC2000,LinkedIn Corp,INV27788,PO9909,AUD,41578.9,EXPORT,Payment for services,Manual Entry,2025-01-27,2025-01-21,41578.9,False,payment for services,2026-02-23 16:50:30.516232,Raw_GL_Export.csv
TXN001802,15/02/2026,11/02/2026,2026-02,AUS01,5420,CC2100,Federal Express,INV21386,PO8792,AUD,44896.17,GST-FREE,Payment for subscription,Manual Entry,2026-02-15,2026-02-11,44896.17,False,payment for subscription,2026-02-23 16:50:30.516232,Raw_GL_Export.csv
TXN001803,24/02/2026,17/02/2026,2026-02,AUS01,5220,CC1100,Oracle,INV78907,,GBP,1390.76,INPUT,Payment for consulting,Manual Entry,2026-02-24,2026-02-17,1390.76,False,payment for consulting,2026-02-23 16:50:30.516232,Raw_GL_Export.csv
TXN001804,2026-02-06,2026-01-27,2026-02,AUS01,5610,CC1000,Telstra Corp,INV41522,,USD,3864.25,EXPORT,Payment for goods,API Import,2026-02-06,2026-01-27,3864.25,False,payment for goods,2026-02-23 16:50:30.516232,Raw_GL_Export.csv
TXN001805,02/20/2026,02/18/2026,2026-02,AUS01,5410,CC3200,MSFT,INV90680,PO9844,NZD,15167.85,INPUT,Payment for goods,Oracle,2026-02-20,2026-02-18,15167.85,False,payment for goods,2026-02-23 16:50:30.516232,Raw_GL_Export.csv
TXN001806,22-11-2025,14-11-2025,2025-11,AUS01,5210,CC1100,Oracle,INV79601,PO9693,USD,12689.83,GST-FREE,Payment for services,Workday,2025-11-22,2025-11-14,12689.83,False,payment for services,2026-02-23 16:50:30.516232,Raw_GL_Export.csv
TXN001807,02/17/2026,02/15/2026,2026-02,AUS01,5700,CC2100,Zoom,INV62525,,AUD,6621.71,GST-FREE,Payment for services,Oracle,2026-02-17,2026-02-15,6621.71,False,payment for services,2026-02-23 16:50:30.516232,Raw_GL_Export.csv
TXN001808,18/01/2026,14/01/2026,2026-01,AUS01,5100,CC2000,Deloitte Touche,INV67876,PO4027,USD,21264.99,INPUT,Payment for license,API Import,2026-01-18,2026-01-14,21264.99,False,payment for license,2026-02-23 16:50:30.516232,Raw_GL_Export.csv
TXN001809,2026-01-03,2025-12-28,2026-01,AUS01,5300,CC4100,Amazon,INV21151,PO4327,NZD,28329.11,GST-FREE,Payment for subscription,Oracle,2026-01-03,2025-12-28,28329.11,False,payment for subscription,2026-02-23 16:50:30.516232,Raw_GL_Export.csv
TXN001810,01/14/2026,01/10/2026,2026-01,AUS01,5900,CC1100,Microsoft,INV73392,,USD,29934.81,EXPORT,Payment for services,Workday,2026-01-14,2026-10-01,29934.81,False,payment for services,2026-02-23 16:50:30.516232,Raw_GL_Export.csv
TXN001811,01-07-2025,28-06-2025,2025-07,AUS01,5700,CC4100,Atlassian Pty,INV54529,PO8404,GBP,27262.55,EXPORT,Payment for goods,Oracle,2025-07-01,2025-06-28,27262.55,False,payment for goods,2026-02-23 16:50:30.516232,Raw_GL_Export.csv
TXN001812,2026-02-17,2026-02-10,2026-02,AUS01,5110,CC4100,Google,INV39961,PO3549,AUD,32928.83,EXPORT,Payment for goods,SAP,2026-02-17,2026-02-10,32928.83,False,payment for goods,2026-02-23 16:50:30.516232,Raw_GL_Export.csv
TXN001813,19/06/2025,12/06/2025,2025-06,AUS01,5600,CC1100,McKinsey,INV67035,PO2866,GBP,9880.62,EXPORT,Payment for services,Workday,2025-06-19,2025-06-12,9880.62,False,payment for services,2026-02-23 16:50:30.516232,Raw_GL_Export.csv
TXN001814,05-02-2026,28-01-2026,2026-02,AUS01,5000,CC3200,KPMG Australia,INV58910,PO1925,NZD,38284.88,GST,Payment for subscription,Workday,2026-02-05,2026-01-28,38284.88,False,payment for subscription,2026-02-23 16:50:30.516232,Raw_GL_Export.csv
TXN001815,2025-04-11,2025-04-10,2025-04,AUS01,5900,CC1200,AWS,INV78254,,USD,34947.51,EXPORT,Payment for consulting,API Import,2025-04-11,2025-04-10,34947.51,False,payment for consulting,2026-02-23 16:50:30.516232,Raw_GL_Export.csv
TXN001816,2026-02-20,2026-02-16,2026-02,AUS01,5800,CC2100,WeWork Australia,INV75929,PO7497,AUD,7737.54,INPUT,Payment for services,Oracle,2026-02-20,2026-02-16,7737.54,False,payment for services,2026-02-23 16:50:30.516232,Raw_GL_Export.csv
TXN001817,2025-07-21,2025-07-16,2025-07,AUS01,5000,CC4100,Workday,INV99052,PO2127,NZD,18423.1,EXPORT,Payment for license,Oracle,2025-07-21,2025-07-16,18423.1,False,payment for license,2026-02-23 16:50:30.516232,Raw_GL_Export.csv
TXN001818,08-01-2025,30-12-2024,2025-01,AUS01,5510,CC1100,Microsoft,INV68511,,AUD,40001.1,GST-FREE,Payment for services,Workday,2025-01-08,2024-12-30,40001.1,False,payment for services,2026-02-23 16:50:30.516232,Raw_GL_Export.csv
TXN001819,04/01/2026,31/12/2025,2026-01,AUS01,5220,CC3100,MSFT,INV29516,,AUD,24592.59,GST-FREE,Payment for goods,API Import,2026-01-04,2025-12-31,24592.59,False,payment for goods,2026-02-23 16:50:30.516232,Raw_GL_Export.csv
TXN001820,22/01/2026,16/01/2026,2026-01,AUS01,5900,CC2000,Oracle,INV99802,PO7336,AUD,34715.58,GST-FREE,Payment for license,SAP,2026-01-22,2026-01-16,34715.58,False,payment for license,2026-02-23 16:50:30.516232,Raw_GL_Export.csv
TXN001821,24-01-2026,20-01-2026,2026-01,AUS01,5410,CC1000,Accenture Pty,INV42182,PO1206,AUD,29218.23,EXPORT,Payment for consulting,API Import,2026-01-24,2026-01-20,29218.23,False,payment for consulting,2026-02-23 16:50:30.516232,Raw_GL_Export.csv
TXN001822,02/19/2026,02/11/2026,2026-02,AUS01,5410,CC3200,Oracle,INV26960,,AUD,2019.1,INPUT,Payment for services,SAP,2026-02-19,2026-11-02,2019.1,False,payment for services,2026-02-23 16:50:30.516232,Raw_GL_Export.csv
TXN001823,2026-01-16,2026-01-08,2026-01,AUS01,5100,CC3100,Accenture Pty,INV95748,PO6253,NZD,25272.22,GST,Payment for services,Oracle,2026-01-16,2026-01-08,25272.22,False,payment for services,2026-02-23 16:50:30.516232,Raw_GL_Export.csv
TXN001824,07-01-2025,06-01-2025,2025-01,AUS01,5510,CC3000,Google,INV91555,,AUD,39708.65,GST,Payment for subscription,Workday,2025-01-07,2025-01-06,39708.65,False,payment for subscription,2026-02-23 16:50:30.516232,Raw_GL_Export.csv
TXN001825,10/09/2025,10/02/2025,2025-10,AUS01,5610,CC3200,Zoom,INV25058,PO8430,GBP,15550.86,EXPORT,Payment for consulting,Manual Entry,2025-09-10,2025-02-10,15550.86,False,payment for consulting,2026-02-23 16:50:30.516232,Raw_GL_Export.csv
TXN001826,03/01/2026,26/12/2025,2026-01,AUS01,5420,CC1100,Robert Half International,INV41525,PO7566,GBP,33778.75,EXPORT,Payment for services,Oracle,2026-01-03,2025-12-26,33778.75,False,payment for services,2026-02-23 16:50:30.516232,Raw_GL_Export.csv
TXN001827,24-01-2026,17-01-2026,2026-01,AUS01,5810,CC3200,ServiceNow Inc,INV37193,PO4204,AUD,16814.26,EXPORT,Payment for license,API Import,2026-01-24,2026-01-17,16814.26,False,payment for license,2026-02-23 16:50:30.516232,Raw_GL_Export.csv
TXN001828,02/16/2026,02/15/2026,2026-02,AUS01,5120,CC1200,Workday,INV49574,,NZD,30058.04,GST,Payment for consulting,Manual Entry,2026-02-16,2026-02-15,30058.04,False,payment for consulting,2026-02-23 16:50:30.516232,Raw_GL_Export.csv
TXN001829,06-02-2026,30-01-2026,2026-02,AUS01,5200,CC2000,AWS,INV19387,PO7817,NZD,42819.12,GST,Payment for services,Workday,2026-02-06,2026-01-30,42819.12,False,payment for services,2026-02-23 16:50:30.516232,Raw_GL_Export.csv
TXN001830,2025-01-06,2024-12-31,2025-01,AUS01,5120,CC2100,Robert Half International,INV79712,PO4394,USD,5159.99,EXPORT,Payment for consulting,Workday,2025-01-06,2024-12-31,5159.99,False,payment for consulting,2026-02-23 16:50:30.516232,Raw_GL_Export.csv
TXN001831,2025-01-16,2025-01-11,2025-01,AUS01,5400,CC3000,Federal Express,INV12863,,GBP,26732.67,EXPORT,Payment for license,API Import,2025-01-16,2025-01-11,26732.67,False,payment for license,2026-02-23 16:50:30.516232,Raw_GL_Export.csv
TXN001832,25/02/2026,24/02/2026,2026-02,AUS01,5000,CC2100,ServiceNow Inc,INV62633,PO2290,GBP,30762.72,GST-FREE,Payment for subscription,API Import,2026-02-25,2026-02-24,30762.72,False,payment for subscription,2026-02-23 16:50:30.516232,Raw_GL_Export.csv
TXN001833,06/02/2026,27/01/2026,2026-02,AUS01,5100,CC1200,Seek Limited,INV46721,,AUD,17310.25,GST-FREE,Payment for subscription,SAP,2026-02-06,2026-01-27,17310.25,False,payment for subscription,2026-02-23 16:50:30.516232,Raw_GL_Export.csv
TXN001834,13/01/2026,03/01/2026,2026-01,AUS01,5100,CC1100,Optus Pty,INV46800,PO9496,USD,5859.88,GST-FREE,Payment for goods,SAP,2026-01-13,2026-01-03,5859.88,False,payment for goods,2026-02-23 16:50:30.516232,Raw_GL_Export.csv
TXN001835,2026-02-03,2026-01-26,2026-02,AUS01,5710,CC4100,DHL Express,INV53865,PO9615,AUD,38174.41,EXPORT,Payment for license,API Import,2026-02-03,2026-01-26,38174.41,False,payment for license,2026-02-23 16:50:30.516232,Raw_GL_Export.csv
TXN001836,01/21/2025,01/11/2025,2025-01,AUS01,5500,CC2100,Optus Pty,INV23953,PO2808,AUD,14276.0,GST-FREE,Payment for subscription,API Import,2025-01-21,2025-11-01,14276.0,False,payment for subscription,2026-02-23 16:50:30.516232,Raw_GL_Export.csv
TXN001837,28-01-2026,22-01-2026,2026-01,AUS01,5410,CC3000,GCP,INV66710,,AUD,44771.05,GST,Payment for goods,Workday,2026-01-28,2026-01-22,44771.05,False,payment for goods,2026-02-23 16:50:30.516232,Raw_GL_Export.csv
TXN001838,14/02/2026,12/02/2026,2026-02,AUS01,5410,CC2000,GCP,INV56189,PO3916,USD,26877.36,INPUT,Payment for consulting,SAP,2026-02-14,2026-02-12,26877.36,False,payment for consulting,2026-02-23 16:50:30.516232,Raw_GL_Export.csv
TXN001839,01/14/2026,01/04/2026,2026-01,AUS01,5410,CC2000,Hays,INV78885,PO1877,AUD,4081.73,GST-FREE,Payment for consulting,API Import,2026-01-14,2026-04-01,4081.73,False,payment for consulting,2026-02-23 16:50:30.516232,Raw_GL_Export.csv
TXN001840,2025-11-06,2025-11-04,2025-11,AUS01,5810,CC2000,AWS,INV55620,,GBP,3551.0,EXPORT,Payment for goods,SAP,2025-11-06,2025-11-04,3551.0,False,payment for goods,2026-02-23 16:50:30.516232,Raw_GL_Export.csv
TXN001841,13/10/2025,09/10/2025,2025-10,AUS01,5410,CC1100,Accenture Pty,INV45095,PO1743,AUD,21212.27,INPUT,Payment for subscription,API Import,2025-10-13,2025-10-09,21212.27,False,payment for subscription,2026-02-23 16:50:30.516232,Raw_GL_Export.csv
TXN001842,2026-01-27,2026-01-23,2026-01,AUS01,5500,CC1200,WeWork Australia,INV75997,,NZD,16783.56,INPUT,Payment for consulting,Oracle,2026-01-27,2026-01-23,16783.56,False,payment for consulting,2026-02-23 16:50:30.516232,Raw_GL_Export.csv
TXN001843,2025-09-22,2025-09-19,2025-09,AUS01,5500,CC2100,Workday,INV54829,,USD,6632.95,INPUT,Payment for subscription,SAP,2025-09-22,2025-09-19,6632.95,False,payment for subscription,2026-02-23 16:50:30.516232,Raw_GL_Export.csv
TXN001844,27/03/2025,21/03/2025,2025-03,AUS01,5520,CC1100,Deloitte Touche,INV23932,PO3985,GBP,39057.32,GST-FREE,Payment for goods,Manual Entry,2025-03-27,2025-03-21,39057.32,False,payment for goods,2026-02-23 16:50:30.516232,Raw_GL_Export.csv
TXN001845,2026-02-26,2026-02-24,2026-02,AUS01,5710,CC4000,DHL Express,INV56924,,USD,25758.03,INPUT,Payment for goods,API Import,2026-02-26,2026-02-24,25758.03,False,payment for goods,2026-02-23 16:50:30.516232,Raw_GL_Export.csv
TXN001846,01/09/2026,01/05/2026,2026-01,AUS01,5100,CC3000,Federal Express,INV11137,PO8705,USD,34941.54,GST-FREE,Payment for license,Manual Entry,2026-09-01,2026-05-01,34941.54,False,payment for license,2026-02-23 16:50:30.516232,Raw_GL_Export.csv
TXN001847,01/17/2026,01/07/2026,2026-01,AUS01,5010,CC4100,Telstra Corp,INV27774,PO1526,NZD,16370.07,EXPORT,Payment for license,API Import,2026-01-17,2026-07-01,16370.07,False,payment for license,2026-02-23 16:50:30.516232,Raw_GL_Export.csv
TXN001848,20/03/2025,18/03/2025,2025-03,AUS01,5420,CC3200,SAP,INV64858,PO2054,NZD,29323.19,GST,Payment for services,Oracle,2025-03-20,2025-03-18,29323.19,False,payment for services,2026-02-23 16:50:30.516232,Raw_GL_Export.csv
TXN001849,07-01-2025,03-01-2025,2025-01,AUS01,5410,CC3200,Amazon,INV72760,PO5812,GBP,31189.24,GST,Payment for services,Oracle,2025-01-07,2025-01-03,31189.24,False,payment for services,2026-02-23 16:50:30.516232,Raw_GL_Export.csv
TXN001850,10/06/2025,07/06/2025,2025-06,AUS01,5620,CC1200,PWC,INV18038,PO5024,AUD,31006.71,GST-FREE,Payment for goods,Oracle,2025-06-10,2025-06-07,31006.71,False,payment for goods,2026-02-23 16:50:30.516232,Raw_GL_Export.csv
TXN001851,01/14/2026,01/09/2026,2026-01,AUS01,5000,CC1100,GCP,INV48866,PO5435,NZD,13129.5,GST-FREE,Payment for goods,SAP,2026-01-14,2026-09-01,13129.5,False,payment for goods,2026-02-23 16:50:30.516232,Raw_GL_Export.csv
TXN001852,03/06/2025,03/02/2025,2025-03,AUS01,5900,CC3000,AWS,INV21909,,NZD,19820.9,INPUT,Payment for license,Manual Entry,2025-06-03,2025-02-03,19820.9,False,payment for license,2026-02-23 16:50:30.516232,Raw_GL_Export.csv
TXN001853,2025-09-22,2025-09-16,2025-09,AUS01,5410,CC2100,AWS,INV56078,,NZD,4726.95,EXPORT,Payment for license,API Import,2025-09-22,2025-09-16,4726.95,False,payment for license,2026-02-23 16:50:30.516232,Raw_GL_Export.csv
TXN001854,2026-01-23,2026-01-19,2026-01,AUS01,5420,CC1000,McKinsey,INV49332,PO2529,NZD,37403.73,GST-FREE,Payment for license,SAP,2026-01-23,2026-01-19,37403.73,False,payment for license,2026-02-23 16:50:30.516232,Raw_GL_Export.csv
TXN001855,17/02/2026,10/02/2026,2026-02,AUS01,5920,CC1100,Salesforce,INV60243,PO5377,AUD,28970.89,INPUT,Payment for goods,API Import,2026-02-17,2026-02-10,28970.89,False,payment for goods,2026-02-23 16:50:30.516232,Raw_GL_Export.csv
TXN001856,19/01/2026,18/01/2026,2026-01,AUS01,5620,CC1200,Accenture Pty,INV66725,PO7937,GBP,17262.17,EXPORT,Payment for license,Oracle,2026-01-19,2026-01-18,17262.17,False,payment for license,2026-02-23 16:50:30.516232,Raw_GL_Export.csv
TXN001857,25/02/2026,15/02/2026,2026-02,AUS01,5320,CC2000,ServiceNow Inc,INV22172,PO9876,GBP,4287.85,INPUT,Payment for goods,API Import,2026-02-25,2026-02-15,4287.85,False,payment for goods,2026-02-23 16:50:30.516232,Raw_GL_Export.csv
TXN001858,2026-02-22,2026-02-12,2026-02,AUS01,5900,CC2000,EY Australia,INV48542,,USD,12691.88,GST-FREE,Payment for consulting,Oracle,2026-02-22,2026-02-12,12691.88,False,payment for consulting,2026-02-23 16:50:30.516232,Raw_GL_Export.csv
TXN001859,17/02/2026,12/02/2026,2026-02,AUS01,5410,CC2000,SAP,INV41212,,NZD,30387.11,GST-FREE,Payment for consulting,Workday,2026-02-17,2026-02-12,30387.11,False,payment for consulting,2026-02-23 16:50:30.516232,Raw_GL_Export.csv
TXN001860,04-02-2025,28-01-2025,2025-02,AUS01,5610,CC2100,Microsoft,INV47744,,GBP,34944.47,INPUT,Payment for goods,API Import,2025-02-04,2025-01-28,34944.47,False,payment for goods,2026-02-23 16:50:30.516232,Raw_GL_Export.csv
TXN001861,06-01-2026,27-12-2025,2026-01,AUS01,5110,CC4000,BCG,INV36765,PO1355,NZD,1034.98,INPUT,Payment for license,Workday,2026-01-06,2025-12-27,1034.98,False,payment for license,2026-02-23 16:50:30.516232,Raw_GL_Export.csv
TXN001862,02/06/2026,01/27/2026,2026-02,AUS01,5220,CC3200,AWS,INV47143,PO6287,USD,25662.39,EXPORT,Payment for license,SAP,2026-06-02,2026-01-27,25662.39,False,payment for license,2026-02-23 16:50:30.516232,Raw_GL_Export.csv
TXN001863,27-02-2026,20-02-2026,2026-02,AUS01,5310,CC1000,Deloitte Touche,INV10593,,GBP,5694.58,GST-FREE,Payment for license,API Import,2026-02-27,2026-02-20,5694.58,False,payment for license,2026-02-23 16:50:30.516232,Raw_GL_Export.csv
TXN001864,02/11/2026,02/08/2026,2026-02,AUS01,5520,CC4000,LinkedIn Corp,INV90022,PO7181,USD,42061.81,INPUT,Payment for license,Manual Entry,2026-11-02,2026-08-02,42061.81,False,payment for license,2026-02-23 16:50:30.516232,Raw_GL_Export.csv
TXN001865,14-02-2026,04-02-2026,2026-02,AUS01,5520,CC4100,Deloitte Touche,INV69975,PO1364,GBP,836.41,GST,Payment for consulting,API Import,2026-02-14,2026-02-04,836.41,False,payment for consulting,2026-02-23 16:50:30.516232,Raw_GL_Export.csv
TXN001866,2025-02-02,2025-01-28,2025-02,AUS01,5610,CC3200,Google,INV78629,,AUD,1281.63,GST-FREE,Payment for consulting,SAP,2025-02-02,2025-01-28,1281.63,False,payment for consulting,2026-02-23 16:50:30.516232,Raw_GL_Export.csv
TXN001867,11-01-2026,03-01-2026,2026-01,AUS01,5910,CC3000,AusPost,INV95540,PO9893,GBP,32782.51,GST,Payment for license,Manual Entry,2026-01-11,2026-01-03,32782.51,False,payment for license,2026-02-23 16:50:30.516232,Raw_GL_Export.csv
TXN001868,2026-02-01,2026-01-25,2026-02,AUS01,5500,CC2100,Deloitte Touche,INV58226,PO8126,USD,9278.02,GST-FREE,Payment for license,API Import,2026-02-01,2026-01-25,9278.02,False,payment for license,2026-02-23 16:50:30.516232,Raw_GL_Export.csv
TXN001869,2025-11-11,2025-11-06,2025-11,AUS01,5310,CC1000,BCG,INV73500,PO1746,GBP,18442.93,GST-FREE,Payment for goods,Workday,2025-11-11,2025-11-06,18442.93,False,payment for goods,2026-02-23 16:50:30.516232,Raw_GL_Export.csv
TXN001870,06-02-2026,04-02-2026,2026-02,AUS01,5500,CC4000,Adobe,INV49408,PO3130,NZD,36089.02,GST,Payment for subscription,SAP,2026-02-06,2026-02-04,36089.02,False,payment for subscription,2026-02-23 16:50:30.516232,Raw_GL_Export.csv
TXN001871,28/01/2026,19/01/2026,2026-01,AUS01,5310,CC3200,Telstra Corp,INV77392,PO2168,USD,34025.09,INPUT,Payment for consulting,Oracle,2026-01-28,2026-01-19,34025.09,False,payment for consulting,2026-02-23 16:50:30.516232,Raw_GL_Export.csv
TXN001872,02/17/2026,02/07/2026,2026-02,AUS01,5210,CC3100,MSFT,INV38932,,GBP,8894.22,INPUT,Payment for services,SAP,2026-02-17,2026-07-02,8894.22,False,payment for services,2026-02-23 16:50:30.516232,Raw_GL_Export.csv
TXN001873,2026-01-25,2026-01-22,2026-01,AUS01,5420,CC4000,Federal Express,INV10201,PO9252,NZD,3874.26,GST-FREE,Payment for subscription,Oracle,2026-01-25,2026-01-22,3874.26,False,payment for subscription,2026-02-23 16:50:30.516232,Raw_GL_Export.csv
TXN001874,28-06-2025,20-06-2025,2025-06,AUS01,5320,CC4000,Federal Express,INV60763,PO3403,GBP,2289.89,GST-FREE,Payment for services,Oracle,2025-06-28,2025-06-20,2289.89,False,payment for services,2026-02-23 16:50:30.516232,Raw_GL_Export.csv
TXN001875,24-01-2026,20-01-2026,2026-01,AUS01,5220,CC2100,KPMG Australia,INV62817,PO7185,USD,28336.17,INPUT,Payment for goods,Oracle,2026-01-24,2026-01-20,28336.17,False,payment for goods,2026-02-23 16:50:30.516232,Raw_GL_Export.csv
TXN001876,2025-06-04,2025-06-01,2025-06,AUS01,5200,CC2000,Regus Australia,INV72492,PO1783,GBP,30615.28,GST,Payment for consulting,Oracle,2025-06-04,2025-06-01,30615.28,False,payment for consulting,2026-02-23 16:50:30.516232,Raw_GL_Export.csv
TXN001877,2025-07-27,2025-07-19,2025-07,AUS01,5300,CC2100,WeWork Australia,INV32683,PO3226,GBP,20823.63,EXPORT,Payment for consulting,Oracle,2025-07-27,2025-07-19,20823.63,False,payment for consulting,2026-02-23 16:50:30.516232,Raw_GL_Export.csv
TXN001878,13-12-2025,04-12-2025,2025-12,AUS01,5310,CC1000,Robert Half International,INV74984,PO7133,GBP,36635.91,INPUT,Payment for license,Workday,2025-12-13,2025-12-04,36635.91,False,payment for license,2026-02-23 16:50:30.516232,Raw_GL_Export.csv
TXN001879,01/22/2026,01/18/2026,2026-01,AUS01,5300,CC4000,BCG,INV68474,PO5157,USD,26475.75,GST-FREE,Payment for services,Oracle,2026-01-22,2026-01-18,26475.75,False,payment for services,2026-02-23 16:50:30.516232,Raw_GL_Export.csv
TXN001880,16-05-2025,08-05-2025,2025-05,AUS01,5410,CC4000,Seek Limited,INV12952,PO8864,NZD,1223.5,GST-FREE,Payment for consulting,Manual Entry,2025-05-16,2025-05-08,1223.5,False,payment for consulting,2026-02-23 16:50:30.516232,Raw_GL_Export.csv
TXN001881,2025-07-12,2025-07-07,2025-07,AUS01,5610,CC3200,WeWork Australia,INV51561,PO4402,USD,13482.34,GST,Payment for goods,SAP,2025-07-12,2025-07-07,13482.34,False,payment for goods,2026-02-23 16:50:30.516232,Raw_GL_Export.csv
TXN001882,2026-01-20,2026-01-19,2026-01,AUS01,5620,CC1000,PWC,INV62222,PO9294,AUD,35854.26,INPUT,Payment for goods,Oracle,2026-01-20,2026-01-19,35854.26,False,payment for goods,2026-02-23 16:50:30.516232,Raw_GL_Export.csv
TXN001883,01/24/2026,01/19/2026,2026-01,AUS01,5310,CC2000,BCG,INV33631,PO3132,GBP,16509.02,INPUT,Payment for consulting,Manual Entry,2026-01-24,2026-01-19,16509.02,False,payment for consulting,2026-02-23 16:50:30.516232,Raw_GL_Export.csv
TXN001884,2026-01-02,2026-01-01,2026-01,AUS01,5220,CC3200,Amazon,INV50326,PO6925,AUD,3249.27,GST-FREE,Payment for consulting,SAP,2026-01-02,2026-01-01,3249.27,False,payment for consulting,2026-02-23 16:50:30.516232,Raw_GL_Export.csv
TXN001885,03-01-2026,28-12-2025,2026-01,AUS01,5020,CC1100,GCP,INV46265,PO2253,NZD,22656.97,EXPORT,Payment for subscription,Workday,2026-01-03,2025-12-28,22656.97,False,payment for subscription,2026-02-23 16:50:30.516232,Raw_GL_Export.csv
TXN001886,16-02-2026,09-02-2026,2026-02,AUS01,5020,CC4000,AusPost,INV70497,PO7743,GBP,30134.94,INPUT,Payment for consulting,Manual Entry,2026-02-16,2026-02-09,30134.94,False,payment for consulting,2026-02-23 16:50:30.516232,Raw_GL_Export.csv
TXN001887,18/01/2026,08/01/2026,2026-01,AUS01,5000,CC3000,Slack,INV12198,PO2110,NZD,18244.81,INPUT,Payment for subscription,Oracle,2026-01-18,2026-01-08,18244.81,False,payment for subscription,2026-02-23 16:50:30.516232,Raw_GL_Export.csv
TXN001888,23/01/2026,19/01/2026,2026-01,AUS01,5000,CC1200,Oracle,INV12273,PO8883,GBP,19084.31,INPUT,Payment for goods,API Import,2026-01-23,2026-01-19,19084.31,False,payment for goods,2026-02-23 16:50:30.516232,Raw_GL_Export.csv
TXN001889,18-02-2026,15-02-2026,2026-02,AUS01,5110,CC1100,Deloitte Touche,INV21565,PO7161,AUD,16019.44,GST-FREE,Payment for services,Workday,2026-02-18,2026-02-15,16019.44,False,payment for services,2026-02-23 16:50:30.516232,Raw_GL_Export.csv
TXN001890,10/16/2025,10/08/2025,2025-10,AUS01,5920,CC2000,Workday,INV31975,,AUD,11474.54,INPUT,Payment for subscription,Workday,2025-10-16,2025-08-10,11474.54,False,payment for subscription,2026-02-23 16:50:30.516232,Raw_GL_Export.csv
TXN001891,27/12/2025,26/12/2025,2025-12,AUS01,5200,CC3000,Deloitte Touche,INV39613,PO8878,NZD,4729.71,GST-FREE,Payment for goods,Workday,2025-12-27,2025-12-26,4729.71,False,payment for goods,2026-02-23 16:50:30.516232,Raw_GL_Export.csv
TXN001892,03-02-2026,27-01-2026,2026-02,AUS01,5300,CC3200,Seek Limited,INV36680,PO2250,NZD,4388.49,GST,Payment for license,Oracle,2026-02-03,2026-01-27,4388.49,False,payment for license,2026-02-23 16:50:30.516232,Raw_GL_Export.csv
TXN001893,01/01/2026,26/12/2025,2026-01,AUS01,5510,CC3000,SAP,INV51717,PO2286,NZD,40541.52,EXPORT,Payment for subscription,Oracle,2026-01-01,2025-12-26,40541.52,False,payment for subscription,2026-02-23 16:50:30.516232,Raw_GL_Export.csv
TXN001894,01/20/2026,01/17/2026,2026-01,AUS01,5710,CC1100,Hays,INV85672,PO2244,NZD,15533.35,GST,Payment for goods,API Import,2026-01-20,2026-01-17,15533.35,False,payment for goods,2026-02-23 16:50:30.516232,Raw_GL_Export.csv
TXN001895,02/13/2026,02/07/2026,2026-02,AUS01,5900,CC4000,Atlassian Pty,INV38197,PO2590,GBP,20786.13,GST-FREE,Payment for license,Oracle,2026-02-13,2026-07-02,20786.13,False,payment for license,2026-02-23 16:50:30.516232,Raw_GL_Export.csv
TXN001896,2025-09-10,2025-09-01,2025-09,AUS01,5710,CC1000,MSFT,INV43842,PO4097,USD,43227.23,GST,Payment for subscription,Oracle,2025-09-10,2025-09-01,43227.23,False,payment for subscription,2026-02-23 16:50:30.516232,Raw_GL_Export.csv
TXN001897,23/01/2026,18/01/2026,2026-01,AUS01,5120,CC1100,Regus Australia,INV16818,PO2664,GBP,33530.87,GST-FREE,Payment for goods,SAP,2026-01-23,2026-01-18,33530.87,False,payment for goods,2026-02-23 16:50:30.516232,Raw_GL_Export.csv
TXN001898,01/17/2026,01/14/2026,2026-01,AUS01,5500,CC2000,KPMG Australia,INV62635,,AUD,44557.57,INPUT,Payment for goods,SAP,2026-01-17,2026-01-14,44557.57,False,payment for goods,2026-02-23 16:50:30.516232,Raw_GL_Export.csv
TXN001899,02/11/2025,02/05/2025,2025-02,AUS01,5200,CC1000,Salesforce,INV17718,PO5863,NZD,10133.22,GST-FREE,Payment for services,Manual Entry,2025-11-02,2025-05-02,10133.22,False,payment for services,2026-02-23 16:50:30.516232,Raw_GL_Export.csv
TXN001900,2026-01-15,2026-01-13,2026-01,AUS01,5010,CC4100,AusPost,INV96985,PO6239,NZD,27664.62,INPUT,Payment for consulting,Manual Entry,2026-01-15,2026-01-13,27664.62,False,payment for consulting,2026-02-23 16:50:30.516232,Raw_GL_Export.csv
TXN001901,24-11-2025,20-11-2025,2025-11,AUS01,5800,CC2100,McKinsey,INV88333,PO3316,NZD,5473.6,GST-FREE,Payment for consulting,API Import,2025-11-24,2025-11-20,5473.6,False,payment for consulting,2026-02-23 16:50:30.516232,Raw_GL_Export.csv
TXN001902,08/28/2025,08/22/2025,2025-08,AUS01,5110,CC1000,AusPost,INV13002,PO2714,NZD,30831.17,GST,Payment for consulting,Manual Entry,2025-08-28,2025-08-22,30831.17,False,payment for consulting,2026-02-23 16:50:30.516232,Raw_GL_Export.csv
TXN001903,2025-11-23,2025-11-22,2025-11,AUS01,5010,CC4000,Slack,INV26187,PO3316,USD,29920.51,GST-FREE,Payment for consulting,API Import,2025-11-23,2025-11-22,29920.51,False,payment for consulting,2026-02-23 16:50:30.516232,Raw_GL_Export.csv
TXN001904,05/11/2025,03/11/2025,2025-11,AUS01,5620,CC3200,WeWork Australia,INV91039,PO7249,GBP,7755.41,EXPORT,Payment for goods,SAP,2025-11-05,2025-11-03,7755.41,False,payment for goods,2026-02-23 16:50:30.516232,Raw_GL_Export.csv
TXN001905,17/01/2026,12/01/2026,2026-01,AUS01,5500,CC4100,Google,INV28238,PO6762,AUD,599.4,GST-FREE,Payment for consulting,Oracle,2026-01-17,2026-01-12,599.4,False,payment for consulting,2026-02-23 16:50:30.516232,Raw_GL_Export.csv
TXN001906,25/01/2026,16/01/2026,2026-01,AUS01,5620,CC3200,MSFT,INV16111,PO8590,USD,7189.74,GST,Payment for subscription,API Import,2026-01-25,2026-01-16,7189.74,False,payment for subscription,2026-02-23 16:50:30.516232,Raw_GL_Export.csv
TXN001907,11-03-2025,08-03-2025,2025-03,AUS01,5220,CC2000,LinkedIn Corp,INV21583,,AUD,6599.19,INPUT,Payment for goods,SAP,2025-03-11,2025-03-08,6599.19,False,payment for goods,2026-02-23 16:50:30.516232,Raw_GL_Export.csv
TXN001908,2026-02-11,2026-02-08,2026-02,AUS01,5620,CC4000,DHL Express,INV47753,PO3842,AUD,36290.01,GST,Payment for goods,Workday,2026-02-11,2026-02-08,36290.01,False,payment for goods,2026-02-23 16:50:30.516232,Raw_GL_Export.csv
TXN001909,01-02-2026,26-01-2026,2026-02,AUS01,5920,CC2100,Seek Limited,INV89559,PO1682,NZD,20356.87,EXPORT,Payment for license,SAP,2026-02-01,2026-01-26,20356.87,False,payment for license,2026-02-23 16:50:30.516232,Raw_GL_Export.csv
TXN001910,2025-09-09,2025-08-31,2025-09,AUS01,5800,CC4100,Robert Half International,INV36769,,NZD,19660.76,INPUT,Payment for consulting,Workday,2025-09-09,2025-08-31,19660.76,False,payment for consulting,2026-02-23 16:50:30.516232,Raw_GL_Export.csv
TXN001911,01/21/2026,01/14/2026,2026-01,AUS01,5900,CC1200,ServiceNow Inc,INV59927,PO4893,GBP,23934.86,EXPORT,Payment for services,Oracle,2026-01-21,2026-01-14,23934.86,False,payment for services,2026-02-23 16:50:30.516232,Raw_GL_Export.csv
TXN001912,2025-03-13,2025-03-06,2025-03,AUS01,5620,CC1200,Slack,INV35366,PO1149,AUD,39823.97,GST,Payment for subscription,Manual Entry,2025-03-13,2025-03-06,39823.97,False,payment for subscription,2026-02-23 16:50:30.516232,Raw_GL_Export.csv
TXN001913,02/27/2026,02/19/2026,2026-02,AUS01,5020,CC4100,AWS,INV53158,,USD,22951.39,GST-FREE,Payment for subscription,API Import,2026-02-27,2026-02-19,22951.39,False,payment for subscription,2026-02-23 16:50:30.516232,Raw_GL_Export.csv
TXN001914,08/19/2025,08/15/2025,2025-08,AUS01,5520,CC1200,KPMG Australia,INV44028,PO1782,NZD,3396.46,GST,Payment for subscription,Oracle,2025-08-19,2025-08-15,3396.46,False,payment for subscription,2026-02-23 16:50:30.516232,Raw_GL_Export.csv
TXN001915,10-01-2026,07-01-2026,2026-01,AUS01,5520,CC2000,WeWork Australia,INV72158,,AUD,43083.34,EXPORT,Payment for services,API Import,2026-01-10,2026-01-07,43083.34,False,payment for services,2026-02-23 16:50:30.516232,Raw_GL_Export.csv
TXN001916,11/01/2026,08/01/2026,2026-01,AUS01,5700,CC3100,Hays,INV76916,PO7619,AUD,36371.49,INPUT,Payment for license,Manual Entry,2026-01-11,2026-01-08,36371.49,False,payment for license,2026-02-23 16:50:30.516232,Raw_GL_Export.csv
TXN001917,02/27/2026,02/20/2026,2026-02,AUS01,5710,CC1200,Adobe,INV30820,PO3699,NZD,34866.0,GST-FREE,Payment for license,SAP,2026-02-27,2026-02-20,34866.0,False,payment for license,2026-02-23 16:50:30.516232,Raw_GL_Export.csv
TXN001918,2026-01-25,2026-01-16,2026-01,AUS01,5200,CC1200,Accenture Pty,INV76840,PO7997,NZD,9514.12,EXPORT,Payment for license,Workday,2026-01-25,2026-01-16,9514.12,False,payment for license,2026-02-23 16:50:30.516232,Raw_GL_Export.csv
TXN001919,22-11-2025,14-11-2025,2025-11,AUS01,5410,CC3200,Robert Half International,INV46509,PO4584,AUD,27525.45,EXPORT,Payment for consulting,Workday,2025-11-22,2025-11-14,27525.45,False,payment for consulting,2026-02-23 16:50:30.516232,Raw_GL_Export.csv
TXN001920,01/24/2026,01/14/2026,2026-01,AUS01,5310,CC4100,Seek Limited,INV56846,PO2329,NZD,6680.51,GST-FREE,Payment for consulting,Workday,2026-01-24,2026-01-14,6680.51,False,payment for consulting,2026-02-23 16:50:30.516232,Raw_GL_Export.csv
TXN001921,02/12/2026,02/02/2026,2026-02,AUS01,5620,CC1200,Robert Half International,INV46232,,GBP,12426.76,EXPORT,Payment for services,Workday,2026-12-02,2026-02-02,12426.76,False,payment for services,2026-02-23 16:50:30.516232,Raw_GL_Export.csv
TXN001922,17-02-2026,14-02-2026,2026-02,AUS01,5410,CC3200,McKinsey,INV90884,PO7953,AUD,37772.47,GST,Payment for subscription,Workday,2026-02-17,2026-02-14,37772.47,False,payment for subscription,2026-02-23 16:50:30.516232,Raw_GL_Export.csv
TXN001923,05/08/2025,04/28/2025,2025-05,AUS01,5410,CC3000,McKinsey,INV50721,PO7607,AUD,34560.89,EXPORT,Payment for consulting,API Import,2025-08-05,2025-04-28,34560.89,False,payment for consulting,2026-02-23 16:50:30.516232,Raw_GL_Export.csv
TXN001924,20-09-2025,16-09-2025,2025-09,AUS01,5800,CC1000,MSFT,INV17998,PO7488,USD,15858.21,GST-FREE,Payment for goods,SAP,2025-09-20,2025-09-16,15858.21,False,payment for goods,2026-02-23 16:50:30.516232,Raw_GL_Export.csv
TXN001925,01/03/2026,12/24/2025,2026-01,AUS01,5500,CC1200,Oracle,INV80968,PO4522,NZD,6591.8,INPUT,Payment for subscription,API Import,2026-03-01,2025-12-24,6591.8,False,payment for subscription,2026-02-23 16:50:30.516232,Raw_GL_Export.csv
TXN001926,06-01-2026,30-12-2025,2026-01,AUS01,5410,CC4000,MSFT,INV20854,PO9292,NZD,19671.64,GST,Payment for services,Workday,2026-01-06,2025-12-30,19671.64,False,payment for services,2026-02-23 16:50:30.516232,Raw_GL_Export.csv
TXN001927,01/01/2026,28/12/2025,2026-01,AUS01,5300,CC4000,AWS,INV38727,PO4965,AUD,37748.89,INPUT,Payment for subscription,API Import,2026-01-01,2025-12-28,37748.89,False,payment for subscription,2026-02-23 16:50:30.516232,Raw_GL_Export.csv
TXN001928,13-01-2026,05-01-2026,2026-01,AUS01,5100,CC3000,McKinsey,INV55226,,NZD,12338.2,GST,Payment for goods,Manual Entry,2026-01-13,2026-01-05,12338.2,False,payment for goods,2026-02-23 16:50:30.516232,Raw_GL_Export.csv
TXN001929,02-04-2025,25-03-2025,2025-04,AUS01,5920,CC2100,DHL Express,INV92460,PO4378,USD,22360.19,GST,Payment for consulting,Workday,2025-04-02,2025-03-25,22360.19,False,payment for consulting,2026-02-23 16:50:30.516232,Raw_GL_Export.csv
TXN001930,2025-10-20,2025-10-18,2025-10,AUS01,5610,CC1200,WeWork Australia,INV75707,PO1697,GBP,20055.69,GST-FREE,Payment for goods,SAP,2025-10-20,2025-10-18,20055.69,False,payment for goods,2026-02-23 16:50:30.516232,Raw_GL_Export.csv
TXN001931,01/12/2026,01/08/2026,2026-01,AUS01,5520,CC2000,Amazon,INV81961,,GBP,20484.09,INPUT,Payment for goods,Manual Entry,2026-12-01,2026-08-01,20484.09,False,payment for goods,2026-02-23 16:50:30.516232,Raw_GL_Export.csv
TXN001932,06-02-2026,01-02-2026,2026-02,AUS01,5200,CC4100,Regus Australia,INV47823,PO1041,GBP,21548.39,INPUT,Payment for consulting,API Import,2026-02-06,2026-02-01,21548.39,False,payment for consulting,2026-02-23 16:50:30.516232,Raw_GL_Export.csv
TXN001933,2025-10-20,2025-10-12,2025-10,AUS01,5910,CC3000,Google,INV69779,PO7067,AUD,27361.03,GST,Payment for services,Oracle,2025-10-20,2025-10-12,27361.03,False,payment for services,2026-02-23 16:50:30.516232,Raw_GL_Export.csv
TXN001934,12/19/2025,12/14/2025,2025-12,AUS01,5100,CC2100,Adobe,INV66288,PO9871,NZD,9349.79,GST,Payment for goods,API Import,2025-12-19,2025-12-14,9349.79,False,payment for goods,2026-02-23 16:50:30.516232,Raw_GL_Export.csv
TXN001935,25/10/2025,16/10/2025,2025-10,AUS01,5810,CC3000,Seek Limited,INV55941,PO6230,NZD,19854.87,EXPORT,Payment for license,SAP,2025-10-25,2025-10-16,19854.87,False,payment for license,2026-02-23 16:50:30.516232,Raw_GL_Export.csv
TXN001936,2026-02-16,2026-02-10,2026-02,AUS01,5310,CC2100,Deloitte Touche,INV39183,PO8076,USD,28775.25,INPUT,Payment for license,Manual Entry,2026-02-16,2026-02-10,28775.25,False,payment for license,2026-02-23 16:50:30.516232,Raw_GL_Export.csv
TXN001937,22-12-2025,20-12-2025,2025-12,AUS01,5310,CC3100,Oracle,INV90280,PO1880,USD,32693.99,INPUT,Payment for consulting,Manual Entry,2025-12-22,2025-12-20,32693.99,False,payment for consulting,2026-02-23 16:50:30.516232,Raw_GL_Export.csv
TXN001938,23/02/2026,18/02/2026,2026-02,AUS01,5920,CC1100,WeWork Australia,INV71160,,USD,16261.4,EXPORT,Payment for services,SAP,2026-02-23,2026-02-18,16261.4,False,payment for services,2026-02-23 16:50:30.516232,Raw_GL_Export.csv
TXN001939,2026-01-04,2025-12-29,2026-01,AUS01,5620,CC2100,LinkedIn Corp,INV90551,PO4938,GBP,38660.49,INPUT,Payment for services,Workday,2026-01-04,2025-12-29,38660.49,False,payment for services,2026-02-23 16:50:30.516232,Raw_GL_Export.csv
TXN001940,23-02-2026,20-02-2026,2026-02,AUS01,5120,CC3000,Regus Australia,INV62597,,GBP,43290.4,INPUT,Payment for goods,Workday,2026-02-23,2026-02-20,43290.4,False,payment for goods,2026-02-23 16:50:30.516232,Raw_GL_Export.csv
TXN001941,09-01-2026,04-01-2026,2026-01,AUS01,5100,CC3100,BCG,INV29876,,NZD,21094.93,INPUT,Payment for goods,API Import,2026-01-09,2026-01-04,21094.93,False,payment for goods,2026-02-23 16:50:30.516232,Raw_GL_Export.csv
TXN001942,09/12/2025,09/06/2025,2025-09,AUS01,5520,CC1000,WeWork Australia,INV73936,PO9217,GBP,33633.0,INPUT,Payment for services,Manual Entry,2025-12-09,2025-06-09,33633.0,False,payment for services,2026-02-23 16:50:30.516232,Raw_GL_Export.csv
TXN001943,2026-02-13,2026-02-10,2026-02,AUS01,5900,CC4000,Deloitte Touche,INV31973,,AUD,34973.59,EXPORT,Payment for subscription,Manual Entry,2026-02-13,2026-02-10,34973.59,False,payment for subscription,2026-02-23 16:50:30.516232,Raw_GL_Export.csv
TXN001944,01/01/2026,12/31/2025,2026-01,AUS01,5420,CC1100,Deloitte Touche,INV93047,PO5169,GBP,36328.18,EXPORT,Payment for consulting,API Import,2026-01-01,2025-12-31,36328.18,False,payment for consulting,2026-02-23 16:50:30.516232,Raw_GL_Export.csv
TXN001945,16/01/2026,11/01/2026,2026-01,AUS01,5100,CC4000,WeWork Australia,INV77921,PO9180,NZD,25778.56,GST,Payment for subscription,Workday,2026-01-16,2026-01-11,25778.56,False,payment for subscription,2026-02-23 16:50:30.516232,Raw_GL_Export.csv
TXN001946,23-09-2025,22-09-2025,2025-09,AUS01,5100,CC3200,Amazon,INV23208,,USD,27420.89,EXPORT,Payment for consulting,Workday,2025-09-23,2025-09-22,27420.89,False,payment for consulting,2026-02-23 16:50:30.516232,Raw_GL_Export.csv
TXN001947,2026-01-20,2026-01-19,2026-01,AUS01,5810,CC1100,Optus Pty,INV85075,PO5418,AUD,42311.26,EXPORT,Payment for license,SAP,2026-01-20,2026-01-19,42311.26,False,payment for license,2026-02-23 16:50:30.516232,Raw_GL_Export.csv
TXN001948,16-01-2026,06-01-2026,2026-01,AUS01,5120,CC4000,McKinsey,INV30459,,NZD,30627.69,EXPORT,Payment for subscription,API Import,2026-01-16,2026-01-06,30627.69,False,payment for subscription,2026-02-23 16:50:30.516232,Raw_GL_Export.csv
TXN001949,26/08/2025,17/08/2025,2025-08,AUS01,5810,CC4100,Telstra Corp,INV56260,PO8019,GBP,18141.01,GST-FREE,Payment for consulting,Oracle,2025-08-26,2025-08-17,18141.01,False,payment for consulting,2026-02-23 16:50:30.516232,Raw_GL_Export.csv
TXN001950,10/12/2025,10/03/2025,2025-10,AUS01,5610,CC3100,Microsoft,INV27411,PO4512,GBP,2694.9,GST-FREE,Payment for subscription,SAP,2025-12-10,2025-03-10,2694.9,False,payment for subscription,2026-02-23 16:50:30.516232,Raw_GL_Export.csv
TXN001951,07/05/2025,01/05/2025,2025-05,AUS01,5910,CC1100,SAP,INV16177,PO6077,AUD,3441.04,GST-FREE,Payment for goods,Manual Entry,2025-05-07,2025-05-01,3441.04,False,payment for goods,2026-02-23 16:50:30.516232,Raw_GL_Export.csv
TXN001952,02/21/2026,02/11/2026,2026-02,AUS01,5210,CC3100,DHL Express,INV67885,PO2024,USD,14182.81,EXPORT,Payment for subscription,API Import,2026-02-21,2026-11-02,14182.81,False,payment for subscription,2026-02-23 16:50:30.516232,Raw_GL_Export.csv
TXN001953,01/02/2026,31/01/2026,2026-02,AUS01,5700,CC1000,LinkedIn Corp,INV57809,PO3512,USD,36226.21,EXPORT,Payment for consulting,SAP,2026-02-01,2026-01-31,36226.21,False,payment for consulting,2026-02-23 16:50:30.516232,Raw_GL_Export.csv
TXN001954,17/02/2025,11/02/2025,2025-02,AUS01,5120,CC3100,Accenture Pty,INV18953,,GBP,36459.04,INPUT,Payment for license,API Import,2025-02-17,2025-02-11,36459.04,False,payment for license,2026-02-23 16:50:30.516232,Raw_GL_Export.csv
TXN001955,13-01-2026,03-01-2026,2026-01,AUS01,5100,CC1100,Slack,INV19903,,USD,43065.44,GST-FREE,Payment for goods,Workday,2026-01-13,2026-01-03,43065.44,False,payment for goods,2026-02-23 16:50:30.516232,Raw_GL_Export.csv
TXN001956,28/01/2026,21/01/2026,2026-01,AUS01,5020,CC1100,Hays,INV61683,PO6217,USD,37946.29,INPUT,Payment for consulting,Workday,2026-01-28,2026-01-21,37946.29,False,payment for consulting,2026-02-23 16:50:30.516232,Raw_GL_Export.csv
TXN001957,02/21/2026,02/14/2026,2026-02,AUS01,5320,CC2000,Oracle,INV46721,,NZD,30921.19,INPUT,Payment for services,SAP,2026-02-21,2026-02-14,30921.19,False,payment for services,2026-02-23 16:50:30.516232,Raw_GL_Export.csv
TXN001958,2025-05-17,2025-05-08,2025-05,AUS01,5700,CC3000,Google,INV34586,PO1299,USD,17253.89,EXPORT,Payment for subscription,Oracle,2025-05-17,2025-05-08,17253.89,False,payment for subscription,2026-02-23 16:50:30.516232,Raw_GL_Export.csv
TXN001959,02/01/2026,24/12/2025,2026-01,AUS01,5910,CC4000,GCP,INV77238,PO2633,USD,20060.71,EXPORT,Payment for license,Workday,2026-01-02,2025-12-24,20060.71,False,payment for license,2026-02-23 16:50:30.516232,Raw_GL_Export.csv
TXN001960,28-01-2026,26-01-2026,2026-01,AUS01,5220,CC3100,Slack,INV44214,PO4994,USD,1352.77,GST,Payment for goods,Oracle,2026-01-28,2026-01-26,1352.77,False,payment for goods,2026-02-23 16:50:30.516232,Raw_GL_Export.csv
TXN001961,01/11/2026,01/10/2026,2026-01,AUS01,5100,CC1100,Oracle,INV61008,,GBP,7687.38,GST-FREE,Payment for services,API Import,2026-11-01,2026-10-01,7687.38,False,payment for services,2026-02-23 16:50:30.516232,Raw_GL_Export.csv
TXN001962,16-11-2025,11-11-2025,2025-11,AUS01,5420,CC3200,Microsoft,INV67080,,AUD,44613.17,EXPORT,Payment for license,Oracle,2025-11-16,2025-11-11,44613.17,False,payment for license,2026-02-23 16:50:30.516232,Raw_GL_Export.csv
TXN001963,25-12-2025,18-12-2025,2025-12,AUS01,5110,CC4100,Regus Australia,INV18608,PO4039,AUD,21794.91,EXPORT,Payment for services,Manual Entry,2025-12-25,2025-12-18,21794.91,False,payment for services,2026-02-23 16:50:30.516232,Raw_GL_Export.csv
TXN001964,2026-01-05,2025-12-31,2026-01,AUS01,5520,CC4000,DHL Express,INV75667,PO4643,AUD,29589.0,GST,Payment for services,Oracle,2026-01-05,2025-12-31,29589.0,False,payment for services,2026-02-23 16:50:30.516232,Raw_GL_Export.csv
TXN001965,27/04/2025,20/04/2025,2025-04,AUS01,5920,CC2100,BCG,INV71245,,GBP,11625.95,EXPORT,Payment for license,API Import,2025-04-27,2025-04-20,11625.95,False,payment for license,2026-02-23 16:50:30.516232,Raw_GL_Export.csv
TXN001966,03-02-2026,02-02-2026,2026-02,AUS01,5310,CC2000,Amazon,INV84596,,GBP,35329.77,INPUT,Payment for license,Manual Entry,2026-02-03,2026-02-02,35329.77,False,payment for license,2026-02-23 16:50:30.516232,Raw_GL_Export.csv
TXN001967,2026-02-21,2026-02-17,2026-02,AUS01,5300,CC1200,BCG,INV99479,,AUD,31762.02,EXPORT,Payment for license,SAP,2026-02-21,2026-02-17,31762.02,False,payment for license,2026-02-23 16:50:30.516232,Raw_GL_Export.csv
TXN001968,02/24/2026,02/15/2026,2026-02,AUS01,5600,CC1100,SAP,INV85966,PO1176,GBP,44706.81,GST-FREE,Payment for consulting,Workday,2026-02-24,2026-02-15,44706.81,False,payment for consulting,2026-02-23 16:50:30.516232,Raw_GL_Export.csv
TXN001969,2026-02-06,2026-01-31,2026-02,AUS01,5210,CC1100,Accenture Pty,INV32527,PO1056,GBP,32815.28,INPUT,Payment for goods,Oracle,2026-02-06,2026-01-31,32815.28,False,payment for goods,2026-02-23 16:50:30.516232,Raw_GL_Export.csv
TXN001970,04-08-2025,25-07-2025,2025-08,AUS01,5800,CC1000,Robert Half International,INV77423,,GBP,16571.04,INPUT,Payment for license,Oracle,2025-08-04,2025-07-25,16571.04,False,payment for license,2026-02-23 16:50:30.516232,Raw_GL_Export.csv
TXN001971,01/07/2026,12/29/2025,2026-01,AUS01,5210,CC4000,EY Australia,INV10558,PO8350,USD,30741.69,GST,Payment for goods,Workday,2026-07-01,2025-12-29,30741.69,False,payment for goods,2026-02-23 16:50:30.516232,Raw_GL_Export.csv
TXN001972,2025-08-28,2025-08-20,2025-08,AUS01,5300,CC3000,Deloitte Touche,INV26006,,GBP,25868.57,INPUT,Payment for goods,SAP,2025-08-28,2025-08-20,25868.57,False,payment for goods,2026-02-23 16:50:30.516232,Raw_GL_Export.csv
TXN001973,2026-01-10,2026-01-08,2026-01,AUS01,5110,CC4000,Accenture Pty,INV58187,PO8900,USD,3996.45,INPUT,Payment for license,API Import,2026-01-10,2026-01-08,3996.45,False,payment for license,2026-02-23 16:50:30.516232,Raw_GL_Export.csv
TXN001974,01/01/2026,26/12/2025,2026-01,AUS01,5900,CC4100,LinkedIn Corp,INV20675,PO1439,AUD,22225.91,EXPORT,Payment for goods,SAP,2026-01-01,2025-12-26,22225.91,False,payment for goods,2026-02-23 16:50:30.516232,Raw_GL_Export.csv
TXN001975,12-02-2026,03-02-2026,2026-02,AUS01,5420,CC1000,EY Australia,INV10630,PO7425,AUD,5917.67,EXPORT,Payment for subscription,API Import,2026-02-12,2026-02-03,5917.67,False,payment for subscription,2026-02-23 16:50:30.516232,Raw_GL_Export.csv
TXN001976,26/02/2026,17/02/2026,2026-02,AUS01,5600,CC3000,Workday,INV25113,PO8430,USD,20224.99,INPUT,Payment for consulting,Manual Entry,2026-02-26,2026-02-17,20224.99,False,payment for consulting,2026-02-23 16:50:30.516232,Raw_GL_Export.csv
TXN001977,15-02-2026,14-02-2026,2026-02,AUS01,5000,CC3100,PWC,INV98646,PO4820,USD,14026.36,EXPORT,Payment for services,Manual Entry,2026-02-15,2026-02-14,14026.36,False,payment for services,2026-02-23 16:50:30.516232,Raw_GL_Export.csv
TXN001978,25/01/2026,24/01/2026,2026-01,AUS01,5210,CC2000,Oracle,INV69138,PO9189,NZD,26148.47,EXPORT,Payment for subscription,Workday,2026-01-25,2026-01-24,26148.47,False,payment for subscription,2026-02-23 16:50:30.516232,Raw_GL_Export.csv
TXN001979,2026-02-04,2026-01-30,2026-02,AUS01,5520,CC2100,Microsoft,INV38471,PO9870,NZD,31570.84,EXPORT,Payment for services,Workday,2026-02-04,2026-01-30,31570.84,False,payment for services,2026-02-23 16:50:30.516232,Raw_GL_Export.csv
TXN001980,2025-06-13,2025-06-07,2025-06,AUS01,5920,CC2100,Adobe,INV85985,PO5897,GBP,2410.75,INPUT,Payment for consulting,Manual Entry,2025-06-13,2025-06-07,2410.75,False,payment for consulting,2026-02-23 16:50:30.516232,Raw_GL_Export.csv
TXN001981,2025-06-27,2025-06-25,2025-06,AUS01,5100,CC1000,Seek Limited,INV57455,,GBP,17709.99,EXPORT,Payment for subscription,Manual Entry,2025-06-27,2025-06-25,17709.99,False,payment for subscription,2026-02-23 16:50:30.516232,Raw_GL_Export.csv
TXN001982,11-02-2025,08-02-2025,2025-02,AUS01,5510,CC4100,LinkedIn Corp,INV48802,PO5396,USD,7572.23,GST-FREE,Payment for services,Oracle,2025-02-11,2025-02-08,7572.23,False,payment for services,2026-02-23 16:50:30.516232,Raw_GL_Export.csv
TXN001983,2025-12-19,2025-12-09,2025-12,AUS01,5510,CC2100,Federal Express,INV66868,PO3981,NZD,33399.77,GST,Payment for consulting,SAP,2025-12-19,2025-12-09,33399.77,False,payment for consulting,2026-02-23 16:50:30.516232,Raw_GL_Export.csv
TXN001984,07/02/2026,31/01/2026,2026-02,AUS01,5900,CC4000,Seek Limited,INV67764,PO8193,AUD,28153.33,EXPORT,Payment for license,Workday,2026-02-07,2026-01-31,28153.33,False,payment for license,2026-02-23 16:50:30.516232,Raw_GL_Export.csv
TXN001985,2025-09-15,2025-09-11,2025-09,AUS01,5600,CC4100,AusPost,INV71398,PO8275,USD,16993.56,EXPORT,Payment for services,SAP,2025-09-15,2025-09-11,16993.56,False,payment for services,2026-02-23 16:50:30.516232,Raw_GL_Export.csv
TXN001986,02-01-2026,29-12-2025,2026-01,AUS01,5320,CC1100,Slack,INV63328,PO3751,GBP,7840.37,GST,Payment for subscription,Oracle,2026-01-02,2025-12-29,7840.37,False,payment for subscription,2026-02-23 16:50:30.516232,Raw_GL_Export.csv
TXN001987,06/02/2026,02/02/2026,2026-02,AUS01,5700,CC2000,MSFT,INV43060,,USD,9783.81,GST-FREE,Payment for services,Manual Entry,2026-02-06,2026-02-02,9783.81,False,payment for services,2026-02-23 16:50:30.516232,Raw_GL_Export.csv
TXN001988,2026-01-27,2026-01-20,2026-01,AUS01,5600,CC2100,ServiceNow Inc,INV95769,,AUD,18007.32,INPUT,Payment for subscription,Manual Entry,2026-01-27,2026-01-20,18007.32,False,payment for subscription,2026-02-23 16:50:30.516232,Raw_GL_Export.csv
TXN001989,18-02-2026,12-02-2026,2026-02,AUS01,5810,CC1200,EY Australia,INV41777,PO1795,AUD,6230.65,INPUT,Payment for services,Manual Entry,2026-02-18,2026-02-12,6230.65,False,payment for services,2026-02-23 16:50:30.516232,Raw_GL_Export.csv
TXN001990,02/28/2026,02/23/2026,2026-02,AUS01,5510,CC4000,BCG,INV42166,,NZD,23973.69,INPUT,Payment for license,API Import,2026-02-28,2026-02-23,23973.69,False,payment for license,2026-02-23 16:50:30.516232,Raw_GL_Export.csv
TXN001991,2026-01-26,2026-01-21,2026-01,AUS01,5120,CC3000,WeWork Australia,INV52465,,NZD,40712.69,GST,Payment for consulting,Manual Entry,2026-01-26,2026-01-21,40712.69,False,payment for consulting,2026-02-23 16:50:30.516232,Raw_GL_Export.csv
TXN001992,01/25/2026,01/22/2026,2026-01,AUS01,5320,CC3000,Amazon,INV82174,PO8317,GBP,25115.17,EXPORT,Payment for license,Manual Entry,2026-01-25,2026-01-22,25115.17,False,payment for license,2026-02-23 16:50:30.516232,Raw_GL_Export.csv
TXN001993,01/04/2025,31/03/2025,2025-04,AUS01,5210,CC4100,Slack,INV72984,,USD,5593.21,GST,Payment for services,API Import,2025-04-01,2025-03-31,5593.21,False,payment for services,2026-02-23 16:50:30.516232,Raw_GL_Export.csv
TXN001994,02/23/2026,02/14/2026,2026-02,AUS01,5400,CC3100,Workday,INV84168,PO8930,USD,24343.56,EXPORT,Payment for goods,API Import,2026-02-23,2026-02-14,24343.56,False,payment for goods,2026-02-23 16:50:30.516232,Raw_GL_Export.csv
TXN001995,16/02/2026,14/02/2026,2026-02,AUS01,5220,CC1200,EY Australia,INV85533,PO8764,NZD,35894.44,GST-FREE,Payment for license,Manual Entry,2026-02-16,2026-02-14,35894.44,False,payment for license,2026-02-23 16:50:30.516232,Raw_GL_Export.csv
TXN001996,12/10/2025,12/08/2025,2025-12,AUS01,5410,CC1000,Accenture Pty,INV71735,,USD,34234.85,GST,Payment for subscription,SAP,2025-10-12,2025-08-12,34234.85,False,payment for subscription,2026-02-23 16:50:30.516232,Raw_GL_Export.csv
TXN001997,2026-02-23,2026-02-20,2026-02,AUS01,5510,CC3200,EY Australia,INV12779,,NZD,30846.39,GST-FREE,Payment for goods,SAP,2026-02-23,2026-02-20,30846.39,False,payment for goods,2026-02-23 16:50:30.516232,Raw_GL_Export.csv
TXN001998,03-01-2026,28-12-2025,2026-01,AUS01,5300,CC3000,PWC,INV91200,,AUD,17985.86,EXPORT,Payment for services,SAP,2026-01-03,2025-12-28,17985.86,False,payment for services,2026-02-23 16:50:30.516232,Raw_GL_Export.csv
TXN001999,01/28/2026,01/21/2026,2026-01,AUS01,5410,CC1200,LinkedIn Corp,INV22802,PO7647,NZD,29295.5,GST,Payment for license,Manual Entry,2026-01-28,2026-01-21,29295.5,False,payment for license,2026-02-23 16:50:30.516232,Raw_GL_Export.csv
TXN002000,11/09/2025,11/06/2025,2025-11,AUS01,5910,CC1000,ServiceNow Inc,INV48319,PO4090,GBP,2587.56,INPUT,Payment for goods,SAP,2025-09-11,2025-06-11,2587.56,False,payment for goods,2026-02-23 16:50:30.516232,Raw_GL_Export.csv
TXN002001,02/19/2026,02/10/2026,2026-02,AUS01,5500,CC1200,Accenture Pty,INV65868,,USD,17965.55,GST,Payment for services,Workday,2026-02-19,2026-10-02,17965.55,False,payment for services,2026-02-23 16:50:30.516232,Raw_GL_Export.csv
TXN002002,11-09-2025,01-09-2025,2025-09,AUS01,5110,CC2000,Slack,INV96987,PO9194,GBP,21895.65,INPUT,Payment for services,API Import,2025-09-11,2025-09-01,21895.65,False,payment for services,2026-02-23 16:50:30.516232,Raw_GL_Export.csv
TXN002003,21-04-2025,20-04-2025,2025-04,AUS01,5100,CC3000,Microsoft,INV89862,PO8919,AUD,25490.78,EXPORT,Payment for goods,SAP,2025-04-21,2025-04-20,25490.78,False,payment for goods,2026-02-23 16:50:30.516232,Raw_GL_Export.csv
TXN002004,20/02/2026,14/02/2026,2026-02,AUS01,5020,CC4100,Slack,INV82051,PO6780,AUD,5450.2,GST-FREE,Payment for goods,Oracle,2026-02-20,2026-02-14,5450.2,False,payment for goods,2026-02-23 16:50:30.516232,Raw_GL_Export.csv
TXN002005,08/01/2026,29/12/2025,2026-01,AUS01,5420,CC1000,PWC,INV76259,,USD,33952.39,INPUT,Payment for services,Workday,2026-01-08,2025-12-29,33952.39,False,payment for services,2026-02-23 16:50:30.516232,Raw_GL_Export.csv
TXN002006,01/18/2026,01/12/2026,2026-01,AUS01,5900,CC1100,Salesforce,INV20915,,GBP,37920.07,EXPORT,Payment for goods,SAP,2026-01-18,2026-12-01,37920.07,False,payment for goods,2026-02-23 16:50:30.516232,Raw_GL_Export.csv
TXN002007,26-11-2025,20-11-2025,2025-11,AUS01,5910,CC3200,EY Australia,INV34054,,AUD,44771.86,INPUT,Payment for consulting,Oracle,2025-11-26,2025-11-20,44771.86,False,payment for consulting,2026-02-23 16:50:30.516232,Raw_GL_Export.csv
TXN002008,19-01-2026,16-01-2026,2026-01,AUS01,5400,CC1200,WeWork Australia,INV19186,,AUD,23319.2,GST-FREE,Payment for license,Manual Entry,2026-01-19,2026-01-16,23319.2,False,payment for license,2026-02-23 16:50:30.516232,Raw_GL_Export.csv
TXN002009,24-02-2026,20-02-2026,2026-02,AUS01,5810,CC3100,LinkedIn Corp,INV48937,,GBP,7816.11,INPUT,Payment for subscription,Oracle,2026-02-24,2026-02-20,7816.11,False,payment for subscription,2026-02-23 16:50:30.516232,Raw_GL_Export.csv
TXN002010,01/21/2026,01/16/2026,2026-01,AUS01,5610,CC3200,Hays,INV57435,PO6530,USD,27201.7,EXPORT,Payment for consulting,Workday,2026-01-21,2026-01-16,27201.7,False,payment for consulting,2026-02-23 16:50:30.516232,Raw_GL_Export.csv
TXN002011,2026-01-08,2026-01-05,2026-01,AUS01,5610,CC4100,MSFT,INV93978,,USD,12232.46,GST,Payment for subscription,Manual Entry,2026-01-08,2026-01-05,12232.46,False,payment for subscription,2026-02-23 16:50:30.516232,Raw_GL_Export.csv
TXN002012,19-02-2026,18-02-2026,2026-02,AUS01,5620,CC1000,MSFT,INV64912,PO8912,NZD,525.82,GST,Payment for goods,Manual Entry,2026-02-19,2026-02-18,525.82,False,payment for goods,2026-02-23 16:50:30.516232,Raw_GL_Export.csv
TXN002013,14/02/2026,09/02/2026,2026-02,AUS01,5120,CC3100,Federal Express,INV87843,,USD,5752.49,INPUT,Payment for services,Oracle,2026-02-14,2026-02-09,5752.49,False,payment for services,2026-02-23 16:50:30.516232,Raw_GL_Export.csv
TXN002014,14/01/2026,13/01/2026,2026-01,AUS01,5610,CC1100,PWC,INV29439,PO2781,AUD,41065.45,INPUT,Payment for services,Manual Entry,2026-01-14,2026-01-13,41065.45,False,payment for services,2026-02-23 16:50:30.516232,Raw_GL_Export.csv
TXN002015,06/02/2026,30/01/2026,2026-02,AUS01,5300,CC1100,Deloitte Touche,INV65194,PO1208,GBP,43204.07,INPUT,Payment for services,SAP,2026-02-06,2026-01-30,43204.07,False,payment for services,2026-02-23 16:50:30.516232,Raw_GL_Export.csv
TXN002016,01/17/2026,01/14/2026,2026-01,AUS01,5610,CC2000,Workday,INV68769,PO3680,NZD,27525.79,INPUT,Payment for goods,API Import,2026-01-17,2026-01-14,27525.79,False,payment for goods,2026-02-23 16:50:30.516232,Raw_GL_Export.csv
TXN002017,18/01/2026,12/01/2026,2026-01,AUS01,5610,CC3100,AusPost,INV56256,,GBP,35459.5,GST,Payment for license,SAP,2026-01-18,2026-01-12,35459.5,False,payment for license,2026-02-23 16:50:30.516232,Raw_GL_Export.csv
TXN002018,26/02/2026,23/02/2026,2026-02,AUS01,5410,CC1200,EY Australia,INV62780,PO1699,GBP,32813.87,GST-FREE,Payment for goods,Oracle,2026-02-26,2026-02-23,32813.87,False,payment for goods,2026-02-23 16:50:30.516232,Raw_GL_Export.csv
TXN002019,2025-10-20,2025-10-10,2025-10,AUS01,5010,CC1000,Telstra Corp,INV18854,PO6107,NZD,37924.97,EXPORT,Payment for subscription,Oracle,2025-10-20,2025-10-10,37924.97,False,payment for subscription,2026-02-23 16:50:30.516232,Raw_GL_Export.csv
TXN002020,15-02-2026,11-02-2026,2026-02,AUS01,5910,CC3000,McKinsey,INV47242,,NZD,29673.78,GST,Payment for goods,SAP,2026-02-15,2026-02-11,29673.78,False,payment for goods,2026-02-23 16:50:30.516232,Raw_GL_Export.csv
TXN002021,13-02-2026,03-02-2026,2026-02,AUS01,5110,CC1000,Telstra Corp,INV84829,,GBP,42771.37,INPUT,Payment for goods,Workday,2026-02-13,2026-02-03,42771.37,False,payment for goods,2026-02-23 16:50:30.516232,Raw_GL_Export.csv
TXN002022,08-09-2025,29-08-2025,2025-09,AUS01,5000,CC2100,McKinsey,INV55450,,USD,33296.44,GST-FREE,Payment for consulting,API Import,2025-09-08,2025-08-29,33296.44,False,payment for consulting,2026-02-23 16:50:30.516232,Raw_GL_Export.csv
TXN002023,23/01/2026,17/01/2026,2026-01,AUS01,5420,CC2000,Accenture Pty,INV12581,PO4808,AUD,40147.96,GST-FREE,Payment for subscription,Workday,2026-01-23,2026-01-17,40147.96,False,payment for subscription,2026-02-23 16:50:30.516232,Raw_GL_Export.csv
TXN002024,08/01/2026,07/01/2026,2026-01,AUS01,5120,CC2000,Telstra Corp,INV29992,,NZD,4656.04,GST-FREE,Payment for consulting,Workday,2026-01-08,2026-01-07,4656.04,False,payment for consulting,2026-02-23 16:50:30.516232,Raw_GL_Export.csv
TXN002025,01/01/2026,12/28/2025,2026-01,AUS01,5710,CC3200,Adobe,INV15874,PO2189,AUD,10953.57,INPUT,Payment for consulting,SAP,2026-01-01,2025-12-28,10953.57,False,payment for consulting,2026-02-23 16:50:30.516232,Raw_GL_Export.csv
TXN002026,05/07/2025,02/07/2025,2025-07,AUS01,5310,CC1100,Amazon,INV56726,PO9169,GBP,31920.71,INPUT,Payment for services,API Import,2025-07-05,2025-07-02,31920.71,False,payment for services,2026-02-23 16:50:30.516232,Raw_GL_Export.csv
TXN002027,2026-01-09,2026-01-04,2026-01,AUS01,5110,CC1200,EY Australia,INV20314,PO3560,NZD,17757.83,GST,Payment for subscription,Workday,2026-01-09,2026-01-04,17757.83,False,payment for subscription,2026-02-23 16:50:30.516232,Raw_GL_Export.csv
TXN002028,2025-11-28,2025-11-25,2025-11,AUS01,5310,CC2000,Robert Half International,INV86858,,AUD,42367.98,GST,Payment for goods,Workday,2025-11-28,2025-11-25,42367.98,False,payment for goods,2026-02-23 16:50:30.516232,Raw_GL_Export.csv
TXN002029,06/01/2025,05/28/2025,2025-06,AUS01,5800,CC2100,Deloitte Touche,INV24427,PO9146,AUD,27779.52,EXPORT,Payment for subscription,Workday,2025-01-06,2025-05-28,27779.52,False,payment for subscription,2026-02-23 16:50:30.516232,Raw_GL_Export.csv
TXN002030,2026-01-16,2026-01-09,2026-01,AUS01,5410,CC2000,Oracle,INV42247,,USD,44131.7,EXPORT,Payment for consulting,SAP,2026-01-16,2026-01-09,44131.7,False,payment for consulting,2026-02-23 16:50:30.516232,Raw_GL_Export.csv
TXN002031,24-01-2026,21-01-2026,2026-01,AUS01,5920,CC1100,Regus Australia,INV11213,PO1012,GBP,10761.35,GST-FREE,Payment for consulting,Manual Entry,2026-01-24,2026-01-21,10761.35,False,payment for consulting,2026-02-23 16:50:30.516232,Raw_GL_Export.csv
TXN002032,01/03/2026,01/02/2026,2026-01,AUS01,5300,CC1200,MSFT,INV75663,PO7881,NZD,27359.39,EXPORT,Payment for license,Manual Entry,2026-03-01,2026-02-01,27359.39,False,payment for license,2026-02-23 16:50:30.516232,Raw_GL_Export.csv
TXN002033,2025-05-15,2025-05-10,2025-05,AUS01,5200,CC2000,Telstra Corp,INV87707,,AUD,41089.39,GST,Payment for services,SAP,2025-05-15,2025-05-10,41089.39,False,payment for services,2026-02-23 16:50:30.516232,Raw_GL_Export.csv
TXN002034,10-01-2026,08-01-2026,2026-01,AUS01,5920,CC1000,Workday,INV80509,PO1626,USD,21903.09,GST,Payment for subscription,Manual Entry,2026-01-10,2026-01-08,21903.09,False,payment for subscription,2026-02-23 16:50:30.516232,Raw_GL_Export.csv
TXN002035,2026-02-22,2026-02-15,2026-02,AUS01,5210,CC4000,Atlassian Pty,INV80209,PO2451,GBP,43513.15,EXPORT,Payment for license,Workday,2026-02-22,2026-02-15,43513.15,False,payment for license,2026-02-23 16:50:30.516232,Raw_GL_Export.csv
TXN002036,2026-01-14,2026-01-08,2026-01,AUS01,5620,CC1000,Federal Express,INV59832,PO9585,NZD,44697.42,GST-FREE,Payment for services,SAP,2026-01-14,2026-01-08,44697.42,False,payment for services,2026-02-23 16:50:30.516232,Raw_GL_Export.csv
TXN002037,16/02/2026,08/02/2026,2026-02,AUS01,5120,CC1000,Atlassian Pty,INV70044,,NZD,20189.54,GST-FREE,Payment for consulting,Workday,2026-02-16,2026-02-08,20189.54,False,payment for consulting,2026-02-23 16:50:30.516232,Raw_GL_Export.csv
TXN002038,01-01-2026,23-12-2025,2026-01,AUS01,5210,CC1000,ServiceNow Inc,INV78213,PO7082,AUD,34612.23,EXPORT,Payment for services,Workday,2026-01-01,2025-12-23,34612.23,False,payment for services,2026-02-23 16:50:30.516232,Raw_GL_Export.csv
TXN002039,07/12/2025,07/02/2025,2025-07,AUS01,5520,CC2000,AusPost,INV60794,PO1578,GBP,40137.27,INPUT,Payment for consulting,Manual Entry,2025-12-07,2025-02-07,40137.27,False,payment for consulting,2026-02-23 16:50:30.516232,Raw_GL_Export.csv
TXN002040,17-12-2025,09-12-2025,2025-12,AUS01,5320,CC1100,BCG,INV65703,PO8063,GBP,40205.37,GST,Payment for services,Workday,2025-12-17,2025-12-09,40205.37,False,payment for services,2026-02-23 16:50:30.516232,Raw_GL_Export.csv
TXN002041,09/22/2025,09/15/2025,2025-09,AUS01,5200,CC2100,Accenture Pty,INV37460,PO3401,AUD,22719.75,EXPORT,Payment for services,SAP,2025-09-22,2025-09-15,22719.75,False,payment for services,2026-02-23 16:50:30.516232,Raw_GL_Export.csv
TXN002042,02/05/2025,01/27/2025,2025-02,AUS01,5910,CC3000,Telstra Corp,INV41486,PO8812,NZD,34153.14,GST-FREE,Payment for consulting,Oracle,2025-05-02,2025-01-27,34153.14,False,payment for consulting,2026-02-23 16:50:30.516232,Raw_GL_Export.csv
TXN002043,01/09/2025,30/08/2025,2025-09,AUS01,5400,CC3200,Seek Limited,INV64484,,AUD,26676.43,GST-FREE,Payment for subscription,API Import,2025-09-01,2025-08-30,26676.43,False,payment for subscription,2026-02-23 16:50:30.516232,Raw_GL_Export.csv
TXN002044,16/01/2026,15/01/2026,2026-01,AUS01,5920,CC1100,Zoom,INV59145,PO5752,NZD,29948.91,GST-FREE,Payment for subscription,Workday,2026-01-16,2026-01-15,29948.91,False,payment for subscription,2026-02-23 16:50:30.516232,Raw_GL_Export.csv
TXN002045,2026-01-01,2025-12-26,2026-01,AUS01,5300,CC4100,Microsoft,INV84452,PO7577,AUD,29994.78,GST-FREE,Payment for consulting,Oracle,2026-01-01,2025-12-26,29994.78,False,payment for consulting,2026-02-23 16:50:30.516232,Raw_GL_Export.csv
TXN002046,17-11-2025,14-11-2025,2025-11,AUS01,5300,CC3100,GCP,INV46975,,GBP,9733.52,GST-FREE,Payment for goods,SAP,2025-11-17,2025-11-14,9733.52,False,payment for goods,2026-02-23 16:50:30.516232,Raw_GL_Export.csv
TXN002047,2026-01-01,2025-12-22,2026-01,AUS01,5020,CC2100,ServiceNow Inc,INV91062,PO1290,NZD,7166.74,INPUT,Payment for consulting,Workday,2026-01-01,2025-12-22,7166.74,False,payment for consulting,2026-02-23 16:50:30.516232,Raw_GL_Export.csv
TXN002048,04-01-2026,25-12-2025,2026-01,AUS01,5600,CC3100,McKinsey,INV30002,PO9135,NZD,18657.72,EXPORT,Payment for goods,Workday,2026-01-04,2025-12-25,18657.72,False,payment for goods,2026-02-23 16:50:30.516232,Raw_GL_Export.csv
TXN002049,04-01-2026,01-01-2026,2026-01,AUS01,5110,CC3000,Zoom,INV17298,,GBP,35031.71,EXPORT,Payment for goods,Oracle,2026-01-04,2026-01-01,35031.71,False,payment for goods,2026-02-23 16:50:30.516232,Raw_GL_Export.csv
TXN002050,02/01/2026,29/12/2025,2026-01,AUS01,5300,CC1000,Regus Australia,INV23380,,GBP,33485.76,EXPORT,Payment for services,Workday,2026-01-02,2025-12-29,33485.76,False,payment for services,2026-02-23 16:50:30.516232,Raw_GL_Export.csv
TXN002051,2026-01-17,2026-01-12,2026-01,AUS01,5100,CC4000,Adobe,INV62762,PO9884,AUD,15222.96,EXPORT,Payment for services,Oracle,2026-01-17,2026-01-12,15222.96,False,payment for services,2026-02-23 16:50:30.516232,Raw_GL_Export.csv
TXN002052,07/02/2026,30/01/2026,2026-02,AUS01,5510,CC4000,KPMG Australia,INV86507,PO4173,NZD,21917.55,GST,Payment for consulting,SAP,2026-02-07,2026-01-30,21917.55,False,payment for consulting,2026-02-23 16:50:30.516232,Raw_GL_Export.csv
TXN002053,11/01/2026,03/01/2026,2026-01,AUS01,5400,CC4100,McKinsey,INV11941,,NZD,13693.3,GST-FREE,Payment for subscription,API Import,2026-01-11,2026-01-03,13693.3,False,payment for subscription,2026-02-23 16:50:30.516232,Raw_GL_Export.csv
TXN002054,01/05/2026,12/27/2025,2026-01,AUS01,5520,CC3100,SAP,INV40763,PO5918,AUD,11069.8,EXPORT,Payment for subscription,SAP,2026-05-01,2025-12-27,11069.8,False,payment for subscription,2026-02-23 16:50:30.516232,Raw_GL_Export.csv
TXN002055,2026-02-08,2026-02-06,2026-02,AUS01,5520,CC1000,Zoom,INV44546,PO5072,GBP,30588.89,GST,Payment for license,Manual Entry,2026-02-08,2026-02-06,30588.89,False,payment for license,2026-02-23 16:50:30.516232,Raw_GL_Export.csv
TXN002056,01-01-2026,30-12-2025,2026-01,AUS01,5000,CC2100,LinkedIn Corp,INV23360,PO3051,AUD,39313.75,GST,Payment for subscription,Manual Entry,2026-01-01,2025-12-30,39313.75,False,payment for subscription,2026-02-23 16:50:30.516232,Raw_GL_Export.csv
TXN002057,22/01/2026,17/01/2026,2026-01,AUS01,5800,CC3200,AusPost,INV38894,,USD,13097.02,GST,Payment for subscription,SAP,2026-01-22,2026-01-17,13097.02,False,payment for subscription,2026-02-23 16:50:30.516232,Raw_GL_Export.csv
TXN002058,2026-01-07,2025-12-29,2026-01,AUS01,5100,CC1100,GCP,INV21262,PO4792,NZD,535.87,INPUT,Payment for goods,Workday,2026-01-07,2025-12-29,535.87,False,payment for goods,2026-02-23 16:50:30.516232,Raw_GL_Export.csv
TXN002059,2026-01-21,2026-01-13,2026-01,AUS01,5920,CC4100,AWS,INV75841,PO1022,NZD,14100.68,GST,Payment for license,Workday,2026-01-21,2026-01-13,14100.68,False,payment for license,2026-02-23 16:50:30.516232,Raw_GL_Export.csv
TXN002060,2026-01-26,2026-01-19,2026-01,AUS01,5420,CC1100,KPMG Australia,INV12854,,GBP,23742.86,GST,Payment for subscription,Workday,2026-01-26,2026-01-19,23742.86,False,payment for subscription,2026-02-23 16:50:30.516232,Raw_GL_Export.csv
TXN002061,25-02-2026,20-02-2026,2026-02,AUS01,5310,CC3200,Slack,INV88596,,USD,20651.84,EXPORT,Payment for services,Manual Entry,2026-02-25,2026-02-20,20651.84,False,payment for services,2026-02-23 16:50:30.516232,Raw_GL_Export.csv
TXN002062,05/24/2025,05/23/2025,2025-05,AUS01,5210,CC2000,Optus Pty,INV10486,PO4762,NZD,11696.38,EXPORT,Payment for goods,API Import,2025-05-24,2025-05-23,11696.38,False,payment for goods,2026-02-23 16:50:30.516232,Raw_GL_Export.csv
TXN002063,04/01/2026,28/12/2025,2026-01,AUS01,5800,CC4100,KPMG Australia,INV49381,,AUD,8443.41,EXPORT,Payment for consulting,SAP,2026-01-04,2025-12-28,8443.41,False,payment for consulting,2026-02-23 16:50:30.516232,Raw_GL_Export.csv
TXN002064,08/01/2026,01/01/2026,2026-01,AUS01,5810,CC3200,WeWork Australia,INV55571,PO7497,USD,42319.61,GST,Payment for goods,SAP,2026-01-08,2026-01-01,42319.61,False,payment for goods,2026-02-23 16:50:30.516232,Raw_GL_Export.csv
TXN002065,2026-02-22,2026-02-20,2026-02,AUS01,5000,CC4000,DHL Express,INV31724,PO7490,NZD,13359.99,GST,Payment for services,Manual Entry,2026-02-22,2026-02-20,13359.99,False,payment for services,2026-02-23 16:50:30.516232,Raw_GL_Export.csv
TXN002066,2026-02-10,2026-02-09,2026-02,AUS01,5220,CC3200,KPMG Australia,INV83587,PO9500,GBP,20928.17,INPUT,Payment for license,Workday,2026-02-10,2026-02-09,20928.17,False,payment for license,2026-02-23 16:50:30.516232,Raw_GL_Export.csv
TXN002067,01/17/2026,01/08/2026,2026-01,AUS01,5020,CC3200,AWS,INV13323,PO8471,USD,18297.41,GST,Payment for consulting,SAP,2026-01-17,2026-08-01,18297.41,False,payment for consulting,2026-02-23 16:50:30.516232,Raw_GL_Export.csv
TXN002068,2026-01-25,2026-01-17,2026-01,AUS01,5500,CC2000,Seek Limited,INV88055,,NZD,25878.08,INPUT,Payment for goods,SAP,2026-01-25,2026-01-17,25878.08,False,payment for goods,2026-02-23 16:50:30.516232,Raw_GL_Export.csv
TXN002069,2025-01-15,2025-01-13,2025-01,AUS01,5020,CC3200,GCP,INV46442,PO3788,GBP,37463.42,GST,Payment for services,Workday,2025-01-15,2025-01-13,37463.42,False,payment for services,2026-02-23 16:50:30.516232,Raw_GL_Export.csv
TXN002070,02/10/2026,02/08/2026,2026-02,AUS01,5900,CC3000,BCG,INV40456,,GBP,20203.48,GST-FREE,Payment for license,Workday,2026-10-02,2026-08-02,20203.48,False,payment for license,2026-02-23 16:50:30.516232,Raw_GL_Export.csv
TXN002071,22-03-2025,16-03-2025,2025-03,AUS01,5320,CC1200,ServiceNow Inc,INV37671,PO6901,AUD,21654.02,GST,Payment for goods,SAP,2025-03-22,2025-03-16,21654.02,False,payment for goods,2026-02-23 16:50:30.516232,Raw_GL_Export.csv
TXN002072,2025-08-25,2025-08-20,2025-08,AUS01,5610,CC4100,Oracle,INV38107,PO2829,GBP,28230.2,INPUT,Payment for license,Manual Entry,2025-08-25,2025-08-20,28230.2,False,payment for license,2026-02-23 16:50:30.516232,Raw_GL_Export.csv
TXN002073,21-05-2025,17-05-2025,2025-05,AUS01,5100,CC3200,Workday,INV45788,PO3494,NZD,34374.36,GST-FREE,Payment for goods,API Import,2025-05-21,2025-05-17,34374.36,False,payment for goods,2026-02-23 16:50:30.516232,Raw_GL_Export.csv
TXN002074,01/27/2026,01/18/2026,2026-01,AUS01,5400,CC3000,Accenture Pty,INV82536,PO2515,USD,38972.48,EXPORT,Payment for subscription,SAP,2026-01-27,2026-01-18,38972.48,False,payment for subscription,2026-02-23 16:50:30.516232,Raw_GL_Export.csv
TXN002075,07/08/2025,06/28/2025,2025-07,AUS01,5200,CC1100,Seek Limited,INV66416,,GBP,19870.3,GST,Payment for subscription,API Import,2025-08-07,2025-06-28,19870.3,False,payment for subscription,2026-02-23 16:50:30.516232,Raw_GL_Export.csv
TXN002076,2026-01-21,2026-01-13,2026-01,AUS01,5920,CC2000,McKinsey,INV25916,PO6554,GBP,27377.87,GST,Payment for services,Manual Entry,2026-01-21,2026-01-13,27377.87,False,payment for services,2026-02-23 16:50:30.516232,Raw_GL_Export.csv
TXN002077,23/02/2026,17/02/2026,2026-02,AUS01,5810,CC2100,DHL Express,INV12041,,NZD,18088.92,EXPORT,Payment for subscription,Workday,2026-02-23,2026-02-17,18088.92,False,payment for subscription,2026-02-23 16:50:30.516232,Raw_GL_Export.csv
TXN002078,12-03-2025,11-03-2025,2025-03,AUS01,5920,CC2000,Accenture Pty,INV22983,PO7473,NZD,29797.4,EXPORT,Payment for consulting,API Import,2025-03-12,2025-03-11,29797.4,False,payment for consulting,2026-02-23 16:50:30.516232,Raw_GL_Export.csv
TXN002079,08/05/2025,07/30/2025,2025-08,AUS01,5110,CC4100,MSFT,INV61043,PO1116,NZD,1171.03,GST-FREE,Payment for services,SAP,2025-05-08,2025-07-30,1171.03,False,payment for services,2026-02-23 16:50:30.516232,Raw_GL_Export.csv
TXN002080,2026-01-26,2026-01-25,2026-01,AUS01,5020,CC3000,Telstra Corp,INV35234,PO5134,AUD,18745.99,EXPORT,Payment for license,API Import,2026-01-26,2026-01-25,18745.99,False,payment for license,2026-02-23 16:50:30.516232,Raw_GL_Export.csv
TXN002081,03/01/2026,01/01/2026,2026-01,AUS01,5920,CC2000,AWS,INV95871,PO9697,AUD,30299.11,GST-FREE,Payment for subscription,Manual Entry,2026-01-03,2026-01-01,30299.11,False,payment for subscription,2026-02-23 16:50:30.516232,Raw_GL_Export.csv
TXN002082,2025-11-27,2025-11-18,2025-11,AUS01,5920,CC3100,Seek Limited,INV19643,,USD,8929.23,GST-FREE,Payment for subscription,API Import,2025-11-27,2025-11-18,8929.23,False,payment for subscription,2026-02-23 16:50:30.516232,Raw_GL_Export.csv
TXN002083,04-03-2025,24-02-2025,2025-03,AUS01,5620,CC2000,AusPost,INV19202,PO3071,NZD,43627.28,EXPORT,Payment for services,API Import,2025-03-04,2025-02-24,43627.28,False,payment for services,2026-02-23 16:50:30.516232,Raw_GL_Export.csv
TXN002084,18/02/2026,15/02/2026,2026-02,AUS01,5000,CC3100,Workday,INV47673,,AUD,23729.49,EXPORT,Payment for consulting,SAP,2026-02-18,2026-02-15,23729.49,False,payment for consulting,2026-02-23 16:50:30.516232,Raw_GL_Export.csv
TXN002085,21/02/2026,20/02/2026,2026-02,AUS01,5110,CC2000,AusPost,INV89632,,NZD,34429.51,EXPORT,Payment for license,Oracle,2026-02-21,2026-02-20,34429.51,False,payment for license,2026-02-23 16:50:30.516232,Raw_GL_Export.csv
TXN002086,2026-01-11,2026-01-04,2026-01,AUS01,5920,CC3200,Telstra Corp,INV29312,,NZD,771.28,GST-FREE,Payment for license,SAP,2026-01-11,2026-01-04,771.28,False,payment for license,2026-02-23 16:50:30.516232,Raw_GL_Export.csv
TXN002087,23/01/2026,20/01/2026,2026-01,AUS01,5310,CC1200,Zoom,INV32912,PO4938,GBP,36246.44,GST,Payment for consulting,API Import,2026-01-23,2026-01-20,36246.44,False,payment for consulting,2026-02-23 16:50:30.516232,Raw_GL_Export.csv
TXN002088,01/09/2026,01/06/2026,2026-01,AUS01,5120,CC3000,Oracle,INV49489,PO5561,GBP,34296.3,INPUT,Payment for goods,Manual Entry,2026-09-01,2026-06-01,34296.3,False,payment for goods,2026-02-23 16:50:30.516232,Raw_GL_Export.csv
TXN002089,25-02-2026,16-02-2026,2026-02,AUS01,5100,CC1100,Salesforce,INV38938,,NZD,35263.6,GST-FREE,Payment for subscription,SAP,2026-02-25,2026-02-16,35263.6,False,payment for subscription,2026-02-23 16:50:30.516232,Raw_GL_Export.csv
TXN002090,2026-01-20,2026-01-14,2026-01,AUS01,5520,CC3200,Seek Limited,INV55576,PO1914,AUD,37856.91,INPUT,Payment for consulting,Oracle,2026-01-20,2026-01-14,37856.91,False,payment for consulting,2026-02-23 16:50:30.516232,Raw_GL_Export.csv
TXN002091,25-02-2025,16-02-2025,2025-02,AUS01,5500,CC4100,MSFT,INV29915,,USD,41511.02,GST,Payment for subscription,Manual Entry,2025-02-25,2025-02-16,41511.02,False,payment for subscription,2026-02-23 16:50:30.516232,Raw_GL_Export.csv
TXN002092,08-01-2025,05-01-2025,2025-01,AUS01,5100,CC3100,Oracle,INV38359,,GBP,17847.61,GST,Payment for subscription,API Import,2025-01-08,2025-01-05,17847.61,False,payment for subscription,2026-02-23 16:50:30.516232,Raw_GL_Export.csv
TXN002093,2026-02-10,2026-02-01,2026-02,AUS01,5900,CC1000,Oracle,INV71395,PO8460,NZD,15577.05,EXPORT,Payment for license,Oracle,2026-02-10,2026-02-01,15577.05,False,payment for license,2026-02-23 16:50:30.516232,Raw_GL_Export.csv
TXN002094,09/20/2025,09/12/2025,2025-09,AUS01,5920,CC4100,McKinsey,INV43404,PO5414,NZD,3128.42,GST-FREE,Payment for services,SAP,2025-09-20,2025-12-09,3128.42,False,payment for services,2026-02-23 16:50:30.516232,Raw_GL_Export.csv
TXN002095,03-01-2026,30-12-2025,2026-01,AUS01,5400,CC3200,AWS,INV29453,PO7438,USD,32000.73,EXPORT,Payment for consulting,Manual Entry,2026-01-03,2025-12-30,32000.73,False,payment for consulting,2026-02-23 16:50:30.516232,Raw_GL_Export.csv
TXN002096,2025-12-04,2025-12-01,2025-12,AUS01,5320,CC4000,KPMG Australia,INV11889,PO6922,USD,9317.35,GST,Payment for consulting,Oracle,2025-12-04,2025-12-01,9317.35,False,payment for consulting,2026-02-23 16:50:30.516232,Raw_GL_Export.csv
TXN002097,02/02/2026,23/01/2026,2026-02,AUS01,5120,CC2100,Slack,INV24500,,GBP,10120.41,GST-FREE,Payment for consulting,API Import,2026-02-02,2026-01-23,10120.41,False,payment for consulting,2026-02-23 16:50:30.516232,Raw_GL_Export.csv
TXN002098,17/01/2026,15/01/2026,2026-01,AUS01,5120,CC3200,ServiceNow Inc,INV81403,PO4012,GBP,44173.39,INPUT,Payment for services,Manual Entry,2026-01-17,2026-01-15,44173.39,False,payment for services,2026-02-23 16:50:30.516232,Raw_GL_Export.csv
TXN002099,2025-10-05,2025-10-03,2025-10,AUS01,5610,CC3200,Amazon,INV43211,PO2136,NZD,6283.93,EXPORT,Payment for consulting,Oracle,2025-10-05,2025-10-03,6283.93,False,payment for consulting,2026-02-23 16:50:30.516232,Raw_GL_Export.csv
TXN002100,16-02-2026,12-02-2026,2026-02,AUS01,5620,CC3100,McKinsey,INV56331,PO1319,AUD,7149.76,INPUT,Payment for services,Workday,2026-02-16,2026-02-12,7149.76,False,payment for services,2026-02-23 16:50:30.516232,Raw_GL_Export.csv
TXN002101,2026-01-03,2025-12-25,2026-01,AUS01,5100,CC4100,EY Australia,INV66265,PO4407,NZD,31979.24,GST-FREE,Payment for services,SAP,2026-01-03,2025-12-25,31979.24,False,payment for services,2026-02-23 16:50:30.516232,Raw_GL_Export.csv
TXN002102,07-01-2026,06-01-2026,2026-01,AUS01,5420,CC1200,Slack,INV95746,PO1046,USD,14568.52,GST-FREE,Payment for goods,Workday,2026-01-07,2026-01-06,14568.52,False,payment for goods,2026-02-23 16:50:30.516232,Raw_GL_Export.csv
TXN002103,22/08/2025,17/08/2025,2025-08,AUS01,5200,CC3200,BCG,INV85120,,USD,25886.77,EXPORT,Payment for license,SAP,2025-08-22,2025-08-17,25886.77,False,payment for license,2026-02-23 16:50:30.516232,Raw_GL_Export.csv
TXN002104,2026-01-28,2026-01-21,2026-01,AUS01,5710,CC3100,ServiceNow Inc,INV90244,PO8720,AUD,19049.01,EXPORT,Payment for subscription,SAP,2026-01-28,2026-01-21,19049.01,False,payment for subscription,2026-02-23 16:50:30.516232,Raw_GL_Export.csv
TXN002105,08/01/2026,07/01/2026,2026-01,AUS01,5220,CC3000,PWC,INV61057,,NZD,2986.06,GST,Payment for consulting,Workday,2026-01-08,2026-01-07,2986.06,False,payment for consulting,2026-02-23 16:50:30.516232,Raw_GL_Export.csv
TXN002106,19-02-2026,18-02-2026,2026-02,AUS01,5000,CC4000,KPMG Australia,INV82393,,NZD,35516.17,INPUT,Payment for subscription,SAP,2026-02-19,2026-02-18,35516.17,False,payment for subscription,2026-02-23 16:50:30.516232,Raw_GL_Export.csv
TXN002107,16-10-2025,11-10-2025,2025-10,AUS01,5110,CC4100,AusPost,INV48760,,USD,23256.02,GST-FREE,Payment for subscription,SAP,2025-10-16,2025-10-11,23256.02,False,payment for subscription,2026-02-23 16:50:30.516232,Raw_GL_Export.csv
TXN002108,2026-02-11,2026-02-01,2026-02,AUS01,5900,CC3100,AusPost,INV26012,PO3661,AUD,32913.27,GST-FREE,Payment for subscription,Workday,2026-02-11,2026-02-01,32913.27,False,payment for subscription,2026-02-23 16:50:30.516232,Raw_GL_Export.csv
TXN002109,06/01/2026,03/01/2026,2026-01,AUS01,5110,CC4000,MSFT,INV69772,PO5983,NZD,22694.32,GST-FREE,Payment for goods,Workday,2026-01-06,2026-01-03,22694.32,False,payment for goods,2026-02-23 16:50:30.516232,Raw_GL_Export.csv
TXN002110,2026-02-09,2026-02-04,2026-02,AUS01,5500,CC3100,Oracle,INV88094,PO2745,NZD,33602.23,GST-FREE,Payment for services,SAP,2026-02-09,2026-02-04,33602.23,False,payment for services,2026-02-23 16:50:30.516232,Raw_GL_Export.csv
TXN002111,11/01/2026,05/01/2026,2026-01,AUS01,5310,CC4000,Telstra Corp,INV62673,,USD,20889.01,GST-FREE,Payment for services,Manual Entry,2026-01-11,2026-01-05,20889.01,False,payment for services,2026-02-23 16:50:30.516232,Raw_GL_Export.csv
TXN002112,2026-02-09,2026-02-05,2026-02,AUS01,5000,CC2100,WeWork Australia,INV25431,PO8074,AUD,31830.77,EXPORT,Payment for services,Workday,2026-02-09,2026-02-05,31830.77,False,payment for services,2026-02-23 16:50:30.516232,Raw_GL_Export.csv
TXN002113,27/06/2025,24/06/2025,2025-06,AUS01,5610,CC2000,Regus Australia,INV96605,PO3966,NZD,43187.13,INPUT,Payment for services,Workday,2025-06-27,2025-06-24,43187.13,False,payment for services,2026-02-23 16:50:30.516232,Raw_GL_Export.csv
TXN002114,02/24/2026,02/14/2026,2026-02,AUS01,5410,CC3200,McKinsey,INV24021,PO8359,GBP,22367.05,GST,Payment for license,API Import,2026-02-24,2026-02-14,22367.05,False,payment for license,2026-02-23 16:50:30.516232,Raw_GL_Export.csv
TXN002115,2025-05-08,2025-05-03,2025-05,AUS01,5810,CC3000,LinkedIn Corp,INV42782,PO2705,GBP,43723.31,EXPORT,Payment for services,Manual Entry,2025-05-08,2025-05-03,43723.31,False,payment for services,2026-02-23 16:50:30.516232,Raw_GL_Export.csv
TXN002116,10/01/2025,09/22/2025,2025-10,AUS01,5600,CC3200,Microsoft,INV33794,,AUD,39530.93,GST-FREE,Payment for goods,Oracle,2025-01-10,2025-09-22,39530.93,False,payment for goods,2026-02-23 16:50:30.516232,Raw_GL_Export.csv
TXN002117,13-02-2026,12-02-2026,2026-02,AUS01,5000,CC4000,SAP,INV27026,PO9457,NZD,20686.94,GST,Payment for license,API Import,2026-02-13,2026-02-12,20686.94,False,payment for license,2026-02-23 16:50:30.516232,Raw_GL_Export.csv
TXN002118,24/01/2025,23/01/2025,2025-01,AUS01,5700,CC3200,PWC,INV42298,PO8850,GBP,40622.42,GST,Payment for license,API Import,2025-01-24,2025-01-23,40622.42,False,payment for license,2026-02-23 16:50:30.516232,Raw_GL_Export.csv
TXN002119,05-06-2025,03-06-2025,2025-06,AUS01,5620,CC3000,DHL Express,INV37688,PO8958,AUD,41065.2,GST-FREE,Payment for license,API Import,2025-06-05,2025-06-03,41065.2,False,payment for license,2026-02-23 16:50:30.516232,Raw_GL_Export.csv
TXN002120,01/22/2026,01/19/2026,2026-01,AUS01,5510,CC3000,Robert Half International,INV81578,PO5230,GBP,23112.58,GST,Payment for goods,API Import,2026-01-22,2026-01-19,23112.58,False,payment for goods,2026-02-23 16:50:30.516232,Raw_GL_Export.csv
TXN002121,15-01-2025,11-01-2025,2025-01,AUS01,5010,CC4100,AWS,INV86989,,AUD,21214.85,EXPORT,Payment for license,API Import,2025-01-15,2025-01-11,21214.85,False,payment for license,2026-02-23 16:50:30.516232,Raw_GL_Export.csv
TXN002122,02/28/2026,02/23/2026,2026-02,AUS01,5310,CC3200,Deloitte Touche,INV69231,PO3791,NZD,12541.96,GST,Payment for consulting,Oracle,2026-02-28,2026-02-23,12541.96,False,payment for consulting,2026-02-23 16:50:30.516232,Raw_GL_Export.csv
TXN002123,11/13/2025,11/08/2025,2025-11,AUS01,5620,CC2000,EY Australia,INV61249,,GBP,37382.47,GST,Payment for subscription,Oracle,2025-11-13,2025-08-11,37382.47,False,payment for subscription,2026-02-23 16:50:30.516232,Raw_GL_Export.csv
TXN002124,11/01/2026,01/01/2026,2026-01,AUS01,5510,CC3000,MSFT,INV57693,PO6148,GBP,36575.64,EXPORT,Payment for consulting,API Import,2026-01-11,2026-01-01,36575.64,False,payment for consulting,2026-02-23 16:50:30.516232,Raw_GL_Export.csv
TXN002125,25/01/2026,17/01/2026,2026-01,AUS01,5310,CC3100,Salesforce,INV38584,PO1638,GBP,21515.12,INPUT,Payment for consulting,Oracle,2026-01-25,2026-01-17,21515.12,False,payment for consulting,2026-02-23 16:50:30.516232,Raw_GL_Export.csv
TXN002126,02-02-2026,31-01-2026,2026-02,AUS01,5900,CC3200,LinkedIn Corp,INV51458,PO1042,GBP,4316.98,GST-FREE,Payment for consulting,API Import,2026-02-02,2026-01-31,4316.98,False,payment for consulting,2026-02-23 16:50:30.516232,Raw_GL_Export.csv
TXN002127,18/05/2025,11/05/2025,2025-05,AUS01,5600,CC1200,Zoom,INV47030,,USD,8961.97,INPUT,Payment for goods,Manual Entry,2025-05-18,2025-05-11,8961.97,False,payment for goods,2026-02-23 16:50:30.516232,Raw_GL_Export.csv
TXN002128,12/19/2025,12/16/2025,2025-12,AUS01,5520,CC3000,Microsoft,INV99571,PO6161,USD,10166.95,GST-FREE,Payment for goods,Oracle,2025-12-19,2025-12-16,10166.95,False,payment for goods,2026-02-23 16:50:30.516232,Raw_GL_Export.csv
TXN002129,15/01/2026,09/01/2026,2026-01,AUS01,5710,CC3000,Atlassian Pty,INV44404,PO1878,NZD,28075.8,GST-FREE,Payment for goods,Oracle,2026-01-15,2026-01-09,28075.8,False,payment for goods,2026-02-23 16:50:30.516232,Raw_GL_Export.csv
TXN002130,05/02/2026,31/01/2026,2026-02,AUS01,5500,CC3200,Salesforce,INV14375,PO6848,NZD,19132.25,INPUT,Payment for subscription,Workday,2026-02-05,2026-01-31,19132.25,False,payment for subscription,2026-02-23 16:50:30.516232,Raw_GL_Export.csv
TXN002131,12-10-2025,11-10-2025,2025-10,AUS01,5110,CC1000,Microsoft,INV19652,,GBP,5198.22,INPUT,Payment for subscription,Workday,2025-10-12,2025-10-11,5198.22,False,payment for subscription,2026-02-23 16:50:30.516232,Raw_GL_Export.csv
TXN002132,03/26/2025,03/16/2025,2025-03,AUS01,5220,CC3200,DHL Express,INV82222,PO2527,AUD,34492.11,GST,Payment for goods,Manual Entry,2025-03-26,2025-03-16,34492.11,False,payment for goods,2026-02-23 16:50:30.516232,Raw_GL_Export.csv
TXN002133,2025-05-22,2025-05-15,2025-05,AUS01,5310,CC1000,Optus Pty,INV32132,PO9864,GBP,4741.22,GST-FREE,Payment for goods,SAP,2025-05-22,2025-05-15,4741.22,False,payment for goods,2026-02-23 16:50:30.516232,Raw_GL_Export.csv
TXN002134,12-02-2026,07-02-2026,2026-02,AUS01,5300,CC3100,WeWork Australia,INV58624,PO6572,USD,30236.73,INPUT,Payment for license,Workday,2026-02-12,2026-02-07,30236.73,False,payment for license,2026-02-23 16:50:30.516232,Raw_GL_Export.csv
TXN002135,02/11/2025,26/10/2025,2025-11,AUS01,5200,CC3000,Telstra Corp,INV80639,PO6105,AUD,22537.54,EXPORT,Payment for goods,Oracle,2025-11-02,2025-10-26,22537.54,False,payment for goods,2026-02-23 16:50:30.516232,Raw_GL_Export.csv
TXN002136,21/07/2025,13/07/2025,2025-07,AUS01,5410,CC2000,MSFT,INV14635,,NZD,30559.0,EXPORT,Payment for goods,Oracle,2025-07-21,2025-07-13,30559.0,False,payment for goods,2026-02-23 16:50:30.516232,Raw_GL_Export.csv
TXN002137,13-01-2025,10-01-2025,2025-01,AUS01,5410,CC4100,Amazon,INV29617,,USD,42617.88,GST-FREE,Payment for consulting,Workday,2025-01-13,2025-01-10,42617.88,False,payment for consulting,2026-02-23 16:50:30.516232,Raw_GL_Export.csv
