transaction_id,posting_date_raw,invoice_date_raw,fiscal_period,entity_code,account_code_raw,cost_center_raw,vendor_name_raw,invoice_number,po_number,currency_code,amount_raw,tax_code,narrative,source_system,posting_date,invoice_date,fiscal_year,fiscal_month,amount,amount_is_negative,narrative_lower,processing_timestamp,source_file,data_quality_score,anomaly_count,entity_valid,entity_code_mapped,account_code_clean,account_valid,account_code_mapped,account_description,cost_center_present,cost_center_valid,cost_center_mapped,vendor_canonical,vendor_resolution_status,fx_key,fx_rate,amount_aud,conversion_status,mean_amount,std_amount,txn_count,is_outlier,posting_hour,posting_day,posting_weekend,suspicious_hour,has_exception,exception_rules
TXN000001,23-01-2026,16-01-2026,2026-01,AUS01,5620,,Adobe,INV30892,,AUD,6049.77,GST,Payment for license,Manual Entry,2026-01-23,2026-01-16,2026,01,6049.77,False,payment for license,2026-02-22 23:27:14.356841,Raw_GL_Export.csv,83.92156862745098,0,True,AUS01,5620,True,5620,Insurance,False,False,,Adobe Systems,MAPPED,2026-01_AUD,1.0,6049.77,DOMESTIC,32410.971605588227,27490.799177232966,170.0,False,0.0,Friday,False,True,True,EX001;EX002
TXN000002,26-02-2026,23-02-2026,2026-02,AUS01,5610,,Federal Express,INV73318,PO2850,NZD,27549.99,GST-FREE,Payment for consulting,Manual Entry,2026-02-26,2026-02-23,2026,02,27549.99,False,payment for consulting,2026-02-22 23:27:14.356841,Raw_GL_Export.csv,83.92156862745098,0,True,AUS01,5610,True,5610,Postage and Courier,False,False,,FedEx,MAPPED,2026-02_NZD,0.932,25676.59068,CONVERTED,29081.766845273953,25872.32663648796,146.0,False,0.0,Thursday,False,True,True,EX002
TXN000003,2025-08-02,2025-07-28,2025-08,AUS01,5620,,McKinsey,INV97797,PO9504,AUD,31735.11,GST-FREE,Payment for license,API Import,2025-08-02,2025-07-28,2025,08,31735.11,False,payment for license,2026-02-22 23:27:14.356841,Raw_GL_Export.csv,83.92156862745098,0,True,AUS01,5620,True,5620,Insurance,False,False,,McKinsey & Company,MAPPED,2025-08_AUD,1.0,31735.11,DOMESTIC,32410.971605588227,27490.799177232966,170.0,False,0.0,Saturday,True,True,True,EX002
TXN000004,04-10-2025,30-09-2025,2025-10,AUS01,5500,,WeWork Australia,INV11526,PO3571,GBP,6774.58,GST,Payment for license,Manual Entry,2025-10-04,2025-09-30,2025,10,6774.58,False,payment for license,2026-02-22 23:27:14.356841,Raw_GL_Export.csv,83.92156862745098,0,True,AUS01,5500,True,5500,Marketing,False,False,,WeWork,MAPPED,2025-10_GBP,1.951,13217.20558,CONVERTED,28972.634359125877,32785.70497360227,143.0,False,0.0,Saturday,True,True,True,EX002
TXN000005,28-01-2026,25-01-2026,2026-01,AUS01,5020,,Hays,INV16599,PO7203,NZD,10916.04,INPUT,Payment for consulting,Oracle,2026-01-28,2026-01-25,2026,01,10916.04,False,payment for consulting,2026-02-22 23:27:14.356841,Raw_GL_Export.csv,83.92156862745098,0,True,AUS01,5020,True,5020,Contractor Fees,False,False,,Hays Recruitment,MAPPED,2026-01_NZD,0.9335,10190.12334,CONVERTED,28445.577844280295,21241.721119146277,132.0,False,0.0,Wednesday,False,True,True,EX002
TXN000006,03-01-2026,26-12-2025,2026-01,AUS01,5900,,Optus Pty,INV51426,,AUD,38560.86,EXPORT,Payment for consulting,SAP,2026-01-03,2025-12-26,2026,01,38560.86,False,payment for consulting,2026-02-22 23:27:14.356841,Raw_GL_Export.csv,83.92156862745098,0,True,AUS01,5900,True,5900,Bank Charges,False,False,,Optus,MAPPED,2026-01_AUD,1.0,38560.86,DOMESTIC,31670.032329854675,24882.231532617723,172.0,False,0.0,Saturday,True,True,True,EX001;EX002
TXN000007,04-01-2026,28-12-2025,2026-01,AUS01,5010,,AWS,INV76628,PO8474,AUD,35651.07,INPUT,Payment for subscription,Workday,2026-01-04,2025-12-28,2026,01,35651.07,False,payment for subscription,2026-02-22 23:27:14.356841,Raw_GL_Export.csv,83.92156862745098,0,True,AUS01,5010,True,5010,Employee Benefits,False,False,,Amazon Web Services,MAPPED,2026-01_AUD,1.0,35651.07,DOMESTIC,27923.213086278203,19430.63083039902,133.0,False,0.0,Sunday,True,True,True,EX002
TXN000008,2026-01-27,2026-01-23,2026-01,AUS01,5920,,LinkedIn Corp,INV96136,PO8414,NZD,25250.77,EXPORT,Payment for services,SAP,2026-01-27,2026-01-23,2026,01,25250.77,False,payment for services,2026-02-22 23:27:14.356841,Raw_GL_Export.csv,83.92156862745098,0,True,AUS01,5920,True,5920,FX Loss,False,False,,LinkedIn,MAPPED,2026-01_NZD,0.9335,23571.593795,CONVERTED,27533.92400565971,21784.021192347693,144.0,False,0.0,Tuesday,False,True,True,EX002
TXN000009,25/10/2025,24/10/2025,2025-10,AUS01,5310,,WeWork Australia,INV23935,,NZD,24691.31,INPUT,Payment for goods,Manual Entry,2025-10-25,2025-10-24,2025,10,24691.31,False,payment for goods,2026-02-22 23:27:14.356841,Raw_GL_Export.csv,83.92156862745098,0,True,AUS01,5310,True,5310,Legal Fees,False,False,,WeWork,MAPPED,2025-10_NZD,0.929,22938.226990000003,CONVERTED,33139.04129260232,28423.631835285127,171.0,False,0.0,Saturday,True,True,True,EX001;EX002
TXN000010,05-10-2025,03-10-2025,2025-10,AUS01,5220,,SAP,INV38257,PO4122,USD,5521.49,EXPORT,Payment for subscription,SAP,2025-10-05,2025-10-03,2025,10,5521.49,False,payment for subscription,2026-02-22 23:27:14.356841,Raw_GL_Export.csv,83.92156862745098,0,True,AUS01,5220,True,5220,IT Support,False,False,,SAP SE,MAPPED,2025-10_USD,1.521,8398.18629,CONVERTED,29540.94372533058,19404.169897416657,121.0,False,0.0,Sunday,True,True,True,EX002
TXN000011,25-02-2026,24-02-2026,2026-02,AUS01,5620,,Atlassian Pty,INV75382,,GBP,20636.72,GST-FREE,Payment for services,API Import,2026-02-25,2026-02-24,2026,02,20636.72,False,payment for services,2026-02-22 23:27:14.356841,Raw_GL_Export.csv,83.92156862745098,0,True,AUS01,5620,True,5620,Insurance,False,False,,Atlassian,MAPPED,2026-02_GBP,1.955,40344.7876,CONVERTED,32410.971605588227,27490.799177232966,170.0,False,0.0,Wednesday,False,True,True,EX001;EX002
TXN000012,14-02-2026,05-02-2026,2026-02,AUS01,5810,,Oracle,INV23573,PO6273,USD,32899.21,GST-FREE,Payment for license,Manual Entry,2026-02-14,2026-02-05,2026,02,32899.21,False,payment for license,2026-02-22 23:27:14.356841,Raw_GL_Export.csv,83.92156862745098,0,True,AUS01,5810,True,5810,Amortization,False,False,,Oracle Corporation,MAPPED,2026-02_USD,1.525,50171.295249999996,CONVERTED,31768.91314562501,27328.351394475325,120.0,False,0.0,Saturday,True,True,True,EX002;EX004
TXN000013,14/02/2026,09/02/2026,2026-02,AUS01,5400,,BCG,INV28111,PO9393,NZD,20432.77,GST-FREE,Payment for subscription,API Import,2026-02-14,2026-02-09,2026,02,20432.77,False,payment for subscription,2026-02-22 23:27:14.356841,Raw_GL_Export.csv,83.92156862745098,0,True,AUS01,5400,True,5400,Travel,False,False,,Boston Consulting Group,MAPPED,2026-02_NZD,0.932,19043.341640000002,CONVERTED,31663.682660000006,30146.476988256833,133.0,False,0.0,Saturday,True,True,True,EX002
TXN000014,11/28/2025,11/19/2025,2025-11,AUS01,5620,,Workday,INV99995,PO3173,USD,9516.1,INPUT,Payment for goods,API Import,2025-11-28,2025-11-19,2025,11,9516.1,False,payment for goods,2026-02-22 23:27:14.356841,Raw_GL_Export.csv,83.92156862745098,0,True,AUS01,5620,True,5620,Insurance,False,False,,Workday Inc,MAPPED,2025-11_USD,1.526,14521.5686,CONVERTED,32410.971605588227,27490.799177232966,170.0,False,0.0,Friday,False,True,True,EX002
TXN000015,01/18/2026,01/16/2026,2026-01,AUS01,5810,,WeWork Australia,INV98374,PO9747,GBP,26268.0,EXPORT,Payment for subscription,Manual Entry,2026-01-18,2026-01-16,2026,01,26268.0,False,payment for subscription,2026-02-22 23:27:14.356841,Raw_GL_Export.csv,83.92156862745098,0,True,AUS01,5810,True,5810,Amortization,False,False,,WeWork,MAPPED,2026-01_GBP,1.957,51406.476,CONVERTED,31768.91314562501,27328.351394475325,120.0,False,0.0,Sunday,True,True,True,EX002;EX004
TXN000016,2026-01-26,2026-01-17,2026-01,AUS01,5100,,Amazon,INV36201,,GBP,6625.17,GST,Payment for goods,Workday,2026-01-26,2026-01-17,2026,01,6625.17,False,payment for goods,2026-02-22 23:27:14.356841,Raw_GL_Export.csv,83.92156862745098,0,True,AUS01,5100,True,5100,Office Rent,False,False,,Amazon Web Services,MAPPED,2026-01_GBP,1.957,12965.457690000001,CONVERTED,29138.02959753333,27547.65120166844,150.0,False,0.0,Monday,False,True,True,EX001;EX002
TXN000017,01/22/2026,01/19/2026,2026-01,AUS01,5910,,MSFT,INV57013,PO2679,NZD,9259.64,GST,Payment for license,API Import,2026-01-22,2026-01-19,2026,01,9259.64,False,payment for license,2026-02-22 23:27:14.356841,Raw_GL_Export.csv,83.92156862745098,0,True,AUS01,5910,True,5910,Interest Expense,False,False,,Microsoft Corporation,MAPPED,2026-01_NZD,0.9335,8643.87394,CONVERTED,33774.54824600841,21661.31598456901,119.0,False,0.0,Thursday,False,True,True,EX002
TXN000018,28/01/2026,19/01/2026,2026-01,AUS01,5400,,Accenture Pty,INV60014,PO6122,NZD,31212.83,GST,Payment for license,SAP,2026-01-28,2026-01-19,2026,01,31212.83,False,payment for license,2026-02-22 23:27:14.356841,Raw_GL_Export.csv,83.92156862745098,0,True,AUS01,5400,True,5400,Travel,False,False,,Accenture,MAPPED,2026-01_NZD,0.9335,29137.176805000003,CONVERTED,31663.682660000006,30146.476988256833,133.0,False,0.0,Wednesday,False,True,True,EX002
TXN000019,05/01/2025,04/27/2025,2025-05,AUS01,5610,,Optus Pty,INV87120,PO4218,USD,41025.74,INPUT,Payment for goods,Workday,2025-01-05,2025-04-27,2025,05,41025.74,False,payment for goods,2026-02-22 23:27:14.356841,Raw_GL_Export.csv,83.92156862745098,1,True,AUS01,5610,True,5610,Postage and Courier,False,False,,Optus,MAPPED,2025-05_USD,1.518,62277.073319999996,CONVERTED,29081.766845273953,25872.32663648796,146.0,False,0.0,Sunday,True,True,True,EX002;EX004
TXN000020,15/01/2026,13/01/2026,2026-01,AUS01,5120,,Oracle,INV46583,PO3131,AUD,17036.2,EXPORT,Payment for goods,API Import,2026-01-15,2026-01-13,2026,01,17036.2,False,payment for goods,2026-02-22 23:27:14.356841,Raw_GL_Export.csv,83.92156862745098,0,True,AUS01,5120,True,5120,Office Supplies,False,False,,Oracle Corporation,MAPPED,2026-01_AUD,1.0,17036.2,DOMESTIC,34269.00595485611,35424.20705021751,139.0,False,0.0,Thursday,False,True,True,EX002
TXN000021,01/28/2026,01/27/2026,2026-01,AUS01,5310,,LinkedIn Corp,INV88234,,USD,1893.33,INPUT,Payment for license,Workday,2026-01-28,2026-01-27,2026,01,1893.33,False,payment for license,2026-02-22 23:27:14.356841,Raw_GL_Export.csv,83.92156862745098,0,True,AUS01,5310,True,5310,Legal Fees,False,False,,LinkedIn,MAPPED,2026-01_USD,1.527,2891.11491,CONVERTED,33139.04129260232,28423.631835285127,171.0,False,0.0,Wednesday,False,True,True,EX001;EX002
TXN000022,01/16/2026,01/14/2026,2026-01,AUS01,5900,,McKinsey,INV76209,,USD,43068.75,GST,Payment for license,API Import,2026-01-16,2026-01-14,2026,01,43068.75,False,payment for license,2026-02-22 23:27:14.356841,Raw_GL_Export.csv,83.92156862745098,0,True,AUS01,5900,True,5900,Bank Charges,False,False,,McKinsey & Company,MAPPED,2026-01_USD,1.527,65765.98125,CONVERTED,31670.032329854675,24882.231532617723,172.0,False,0.0,Friday,False,True,True,EX001;EX002;EX004
TXN000023,2026-02-13,2026-02-07,2026-02,AUS01,5210,,Workday,INV38632,PO9691,NZD,14964.89,INPUT,Payment for consulting,API Import,2026-02-13,2026-02-07,2026,02,14964.89,False,payment for consulting,2026-02-22 23:27:14.356841,Raw_GL_Export.csv,83.92156862745098,0,True,AUS01,5210,True,5210,Cloud Services,False,False,,Workday Inc,MAPPED,2026-02_NZD,0.932,13947.27748,CONVERTED,31620.56664919015,27460.393400888206,142.0,False,0.0,Friday,False,True,True,EX002
TXN000024,2026-01-27,2026-01-25,2026-01,AUS01,5700,,WeWork Australia,INV15226,PO6258,GBP,10891.62,GST-FREE,Payment for consulting,SAP,2026-01-27,2026-01-25,2026,01,10891.62,False,payment for consulting,2026-02-22 23:27:14.356841,Raw_GL_Export.csv,83.92156862745098,0,True,AUS01,5700,True,5700,Training,False,False,,WeWork,MAPPED,2026-01_GBP,1.957,21314.900340000004,CONVERTED,31110.431902446802,30160.111495086097,141.0,False,0.0,Tuesday,False,True,True,EX002
TXN000025,02/13/2026,02/04/2026,2026-02,AUS01,5800,,KPMG Australia,INV77411,PO8300,AUD,41018.98,INPUT,Payment for consulting,SAP,2026-02-13,2026-04-02,2026,02,41018.98,False,payment for consulting,2026-02-22 23:27:14.356841,Raw_GL_Export.csv,83.92156862745098,0,True,AUS01,5800,True,5800,Depreciation,False,False,,KPMG,MAPPED,2026-02_AUD,1.0,41018.98,DOMESTIC,30184.39373025477,34245.09535020032,157.0,False,0.0,Friday,False,True,True,EX002
TXN000026,10/05/2025,04/05/2025,2025-05,AUS01,5510,,Google,INV92173,,AUD,7616.03,GST,Payment for goods,Manual Entry,2025-05-10,2025-05-04,2025,05,7616.03,False,payment for goods,2026-02-22 23:27:14.356841,Raw_GL_Export.csv,83.92156862745098,0,True,AUS01,5510,True,5510,Advertising,False,False,,Google Cloud,MAPPED,2025-05_AUD,1.0,7616.03,DOMESTIC,28498.583342781956,23667.16979723599,133.0,False,0.0,Saturday,True,True,True,EX001;EX002
TXN000027,2025-12-27,2025-12-23,2025-12,AUS01,5520,,Telstra Corp,INV13113,PO6434,AUD,33635.4,GST-FREE,Payment for services,SAP,2025-12-27,2025-12-23,2025,12,33635.4,False,payment for services,2026-02-22 23:27:14.356841,Raw_GL_Export.csv,83.92156862745098,0,True,AUS01,5520,True,5520,Events,False,False,,Telstra,MAPPED,2025-12_AUD,1.0,33635.4,DOMESTIC,30860.276023483882,21900.267908653983,155.0,False,0.0,Saturday,True,True,True,EX002
TXN000028,2026-01-03,2025-12-31,2026-01,AUS01,5900,,Deloitte Touche,INV43901,PO8391,AUD,25915.81,GST-FREE,Payment for consulting,Manual Entry,2026-01-03,2025-12-31,2026,01,25915.81,False,payment for consulting,2026-02-22 23:27:14.356841,Raw_GL_Export.csv,83.92156862745098,0,True,AUS01,5900,True,5900,Bank Charges,False,False,,Deloitte,MAPPED,2026-01_AUD,1.0,25915.81,DOMESTIC,31670.032329854675,24882.231532617723,172.0,False,0.0,Saturday,True,True,True,EX002
TXN000029,2026-01-11,2026-01-04,2026-01,AUS01,5700,,Atlassian Pty,INV86756,,AUD,28899.88,GST,Payment for services,Workday,2026-01-11,2026-01-04,2026,01,28899.88,False,payment for services,2026-02-22 23:27:14.356841,Raw_GL_Export.csv,83.92156862745098,0,True,AUS01,5700,True,5700,Training,False,False,,Atlassian,MAPPED,2026-01_AUD,1.0,28899.88,DOMESTIC,31110.431902446802,30160.111495086097,141.0,False,0.0,Sunday,True,True,True,EX001;EX002
TXN000030,2026-01-17,2026-01-12,2026-01,AUS01,5900,,EY Australia,INV59992,PO1504,AUD,12740.13,EXPORT,Payment for consulting,Oracle,2026-01-17,2026-01-12,2026,01,12740.13,False,payment for consulting,2026-02-22 23:27:14.356841,Raw_GL_Export.csv,83.92156862745098,0,True,AUS01,5900,True,5900,Bank Charges,False,False,,EY,MAPPED,2026-01_AUD,1.0,12740.13,DOMESTIC,31670.032329854675,24882.231532617723,172.0,False,0.0,Saturday,True,True,True,EX002
TXN000031,18/01/2026,15/01/2026,2026-01,AUS01,5800,,DHL Express,INV49066,PO7113,NZD,43210.03,GST-FREE,Payment for services,API Import,2026-01-18,2026-01-15,2026,01,43210.03,False,payment for services,2026-02-22 23:27:14.356841,Raw_GL_Export.csv,83.92156862745098,0,True,AUS01,5800,True,5800,Depreciation,False,False,,DHL,MAPPED,2026-01_NZD,0.9335,40336.563004999996,CONVERTED,30184.39373025477,34245.09535020032,157.0,False,0.0,Sunday,True,True,True,EX002
TXN000032,28/01/2026,26/01/2026,2026-01,AUS01,5010,,AWS,INV49936,,GBP,24218.13,GST,Payment for subscription,Oracle,2026-01-28,2026-01-26,2026,01,24218.13,False,payment for subscription,2026-02-22 23:27:14.356841,Raw_GL_Export.csv,83.92156862745098,0,True,AUS01,5010,True,5010,Employee Benefits,False,False,,Amazon Web Services,MAPPED,2026-01_GBP,1.957,47394.880410000005,CONVERTED,27923.213086278203,19430.63083039902,133.0,False,0.0,Wednesday,False,True,True,EX001;EX002
TXN000033,14/04/2025,11/04/2025,2025-04,AUS01,5120,,ServiceNow Inc,INV97946,PO1891,NZD,8825.25,GST-FREE,Payment for license,Manual Entry,2025-04-14,2025-04-11,2025,04,8825.25,False,payment for license,2026-02-22 23:27:14.356841,Raw_GL_Export.csv,83.92156862745098,0,True,AUS01,5120,True,5120,Office Supplies,False,False,,ServiceNow,MAPPED,2025-04_NZD,0.932,8225.133,CONVERTED,34269.00595485611,35424.20705021751,139.0,False,0.0,Monday,False,True,True,EX002
TXN000034,2026-02-21,2026-02-16,2026-02,AUS01,5700,,Salesforce,INV53365,PO4842,NZD,4509.29,EXPORT,Payment for services,Workday,2026-02-21,2026-02-16,2026,02,4509.29,False,payment for services,2026-02-22 23:27:14.356841,Raw_GL_Export.csv,83.92156862745098,0,True,AUS01,5700,True,5700,Training,False,False,,Salesforce Inc,MAPPED,2026-02_NZD,0.932,4202.658280000001,CONVERTED,31110.431902446802,30160.111495086097,141.0,False,0.0,Saturday,True,True,True,EX002
TXN000035,2026-02-20,2026-02-16,2026-02,AUS01,5310,,Hays,INV86568,,GBP,14842.74,INPUT,Payment for license,Workday,2026-02-20,2026-02-16,2026,02,14842.74,False,payment for license,2026-02-22 23:27:14.356841,Raw_GL_Export.csv,83.92156862745098,0,True,AUS01,5310,True,5310,Legal Fees,False,False,,Hays Recruitment,MAPPED,2026-02_GBP,1.955,29017.5567,CONVERTED,33139.04129260232,28423.631835285127,171.0,False,0.0,Friday,False,True,True,EX001;EX002
TXN000036,01/26/2025,01/19/2025,2025-01,AUS01,5120,,AWS,INV93995,PO6889,NZD,11153.26,GST-FREE,Payment for goods,Workday,2025-01-26,2025-01-19,2025,01,11153.26,False,payment for goods,2026-02-22 23:27:14.356841,Raw_GL_Export.csv,83.92156862745098,0,True,AUS01,5120,True,5120,Office Supplies,False,False,,Amazon Web Services,MAPPED,2025-01_NZD,0.93,10372.5318,CONVERTED,34269.00595485611,35424.20705021751,139.0,False,0.0,Sunday,True,True,True,EX002
TXN000037,16-11-2025,08-11-2025,2025-11,AUS01,5320,,EY Australia,INV94613,PO5597,GBP,24870.06,GST-FREE,Payment for goods,API Import,2025-11-16,2025-11-08,2025,11,24870.06,False,payment for goods,2026-02-22 23:27:14.356841,Raw_GL_Export.csv,83.92156862745098,0,True,AUS01,5320,True,5320,Audit Fees,False,False,,EY,MAPPED,2025-11_GBP,1.956,48645.837360000005,CONVERTED,31658.610713475173,32284.527206153973,141.0,False,0.0,Sunday,True,True,True,EX002
TXN000038,02/07/2026,02/05/2026,2026-02,AUS01,5800,,Salesforce,INV86269,PO4485,AUD,38246.47,GST,Payment for services,API Import,2026-07-02,2026-05-02,2026,02,38246.47,False,payment for services,2026-02-22 23:27:14.356841,Raw_GL_Export.csv,83.92156862745098,1,True,AUS01,5800,True,5800,Depreciation,False,False,,Salesforce Inc,MAPPED,2026-02_AUD,1.0,38246.47,DOMESTIC,30184.39373025477,34245.09535020032,157.0,False,0.0,Thursday,False,True,True,EX002;EX007
TXN000039,09-12-2025,06-12-2025,2025-12,AUS01,5320,,DHL Express,INV27548,PO9362,USD,40125.55,INPUT,Payment for services,Manual Entry,2025-12-09,2025-12-06,2025,12,40125.55,False,payment for services,2026-02-22 23:27:14.356841,Raw_GL_Export.csv,83.92156862745098,0,True,AUS01,5320,True,5320,Audit Fees,False,False,,DHL,MAPPED,2025-12_USD,1.523,61111.21265,CONVERTED,31658.610713475173,32284.527206153973,141.0,False,0.0,Tuesday,False,True,True,EX002;EX004
TXN000040,2025-11-12,2025-11-08,2025-11,AUS01,5920,,Adobe,INV84233,PO3395,USD,20135.3,GST-FREE,Payment for consulting,Workday,2025-11-12,2025-11-08,2025,11,20135.3,False,payment for consulting,2026-02-22 23:27:14.356841,Raw_GL_Export.csv,83.92156862745098,0,True,AUS01,5920,True,5920,FX Loss,False,False,,Adobe Systems,MAPPED,2025-11_USD,1.526,30726.4678,CONVERTED,27533.92400565971,21784.021192347693,144.0,False,0.0,Wednesday,False,True,True,EX002
TXN000041,02/02/2026,25/01/2026,2026-02,AUS01,5210,,Salesforce,INV97632,,NZD,16687.64,GST,Payment for subscription,Manual Entry,2026-02-02,2026-01-25,2026,02,16687.64,False,payment for subscription,2026-02-22 23:27:14.356841,Raw_GL_Export.csv,83.92156862745098,0,True,AUS01,5210,True,5210,Cloud Services,False,False,,Salesforce Inc,MAPPED,2026-02_NZD,0.932,15552.88048,CONVERTED,31620.56664919015,27460.393400888206,142.0,False,0.0,Monday,False,True,True,EX001;EX002
TXN000042,16-06-2025,15-06-2025,2025-06,AUS01,5010,,McKinsey,INV44513,PO3848,AUD,31697.76,INPUT,Payment for consulting,Manual Entry,2025-06-16,2025-06-15,2025,06,31697.76,False,payment for consulting,2026-02-22 23:27:14.356841,Raw_GL_Export.csv,83.92156862745098,0,True,AUS01,5010,True,5010,Employee Benefits,False,False,,McKinsey & Company,MAPPED,2025-06_AUD,1.0,31697.76,DOMESTIC,27923.213086278203,19430.63083039902,133.0,False,0.0,Monday,False,True,True,EX002
TXN000043,2026-01-12,2026-01-03,2026-01,AUS01,5220,,Federal Express,INV55224,PO8898,USD,23285.09,INPUT,Payment for license,SAP,2026-01-12,2026-01-03,2026,01,23285.09,False,payment for license,2026-02-22 23:27:14.356841,Raw_GL_Export.csv,83.92156862745098,0,True,AUS01,5220,True,5220,IT Support,False,False,,FedEx,MAPPED,2026-01_USD,1.527,35556.332429999995,CONVERTED,29540.94372533058,19404.169897416657,121.0,False,0.0,Monday,False,True,True,EX002
TXN000044,17/11/2025,09/11/2025,2025-11,AUS01,5120,,ServiceNow Inc,INV37723,,AUD,23202.9,INPUT,Payment for goods,Workday,2025-11-17,2025-11-09,2025,11,23202.9,False,payment for goods,2026-02-22 23:27:14.356841,Raw_GL_Export.csv,83.92156862745098,0,True,AUS01,5120,True,5120,Office Supplies,False,False,,ServiceNow,MAPPED,2025-11_AUD,1.0,23202.9,DOMESTIC,34269.00595485611,35424.20705021751,139.0,False,0.0,Monday,False,True,True,EX001;EX002
TXN000045,2026-02-20,2026-02-16,2026-02,AUS01,5410,,BCG,INV72786,,AUD,21720.1,EXPORT,Payment for goods,Manual Entry,2026-02-20,2026-02-16,2026,02,21720.1,False,payment for goods,2026-02-22 23:27:14.356841,Raw_GL_Export.csv,83.92156862745098,0,True,AUS01,5410,True,5410,Accommodation,False,False,,Boston Consulting Group,MAPPED,2026-02_AUD,1.0,21720.1,DOMESTIC,29277.518810999987,22143.12829502557,155.0,False,0.0,Friday,False,True,True,EX001;EX002
TXN000046,01/02/2026,31/01/2026,2026-02,AUS01,5110,,Adobe,INV85008,,USD,28366.37,GST,Payment for goods,Workday,2026-02-01,2026-01-31,2026,02,28366.37,False,payment for goods,2026-02-22 23:27:14.356841,Raw_GL_Export.csv,83.92156862745098,0,True,AUS01,5110,True,5110,Utilities,False,False,,Adobe Systems,MAPPED,2026-02_USD,1.525,43258.71425,CONVERTED,27865.288293732876,21409.69928933269,146.0,False,0.0,Sunday,True,True,True,EX001;EX002
TXN000047,06-12-2025,26-11-2025,2025-12,AUS01,5600,,Amazon,INV68877,PO8723,NZD,42631.7,GST-FREE,Payment for consulting,Oracle,2025-12-06,2025-11-26,2025,12,42631.7,False,payment for consulting,2026-02-22 23:27:14.356841,Raw_GL_Export.csv,83.92156862745098,0,True,AUS01,5600,True,5600,Telecommunications,False,False,,Amazon Web Services,MAPPED,2025-12_NZD,0.9305,39668.79685,CONVERTED,32190.120230168057,26805.910450208805,119.0,False,0.0,Saturday,True,True,True,EX002
TXN000048,08-01-2026,29-12-2025,2026-01,AUS01,5110,,Oracle,INV69437,PO2127,NZD,7630.7,INPUT,Payment for goods,Manual Entry,2026-01-08,2025-12-29,2026,01,7630.7,False,payment for goods,2026-02-22 23:27:14.356841,Raw_GL_Export.csv,83.92156862745098,0,True,AUS01,5110,True,5110,Utilities,False,False,,Oracle Corporation,MAPPED,2026-01_NZD,0.9335,7123.258449999999,CONVERTED,27865.288293732876,21409.69928933269,146.0,False,0.0,Thursday,False,True,True,EX002
TXN000049,13/01/2025,11/01/2025,2025-01,AUS01,5000,,SAP,INV33255,PO1639,GBP,37210.49,GST,Payment for license,API Import,2025-01-13,2025-01-11,2025,01,37210.49,False,payment for license,2026-02-22 23:27:14.356841,Raw_GL_Export.csv,83.92156862745098,0,True,AUS01,5000,True,5000,Salaries and Wages,False,False,,SAP SE,MAPPED,2025-01_GBP,1.95,72560.4555,CONVERTED,30471.385558248177,22939.768434623154,137.0,False,0.0,Monday,False,True,True,EX002;EX004
TXN000050,2026-02-25,2026-02-23,2026-02,AUS01,5500,,Slack,INV78425,PO1711,AUD,40373.91,EXPORT,Payment for license,Manual Entry,2026-02-25,2026-02-23,2026,02,40373.91,False,payment for license,2026-02-22 23:27:14.356841,Raw_GL_Export.csv,83.92156862745098,0,True,AUS01,5500,True,5500,Marketing,False,False,,Slack Technologies,MAPPED,2026-02_AUD,1.0,40373.91,DOMESTIC,28972.634359125877,32785.70497360227,143.0,False,0.0,Wednesday,False,True,True,EX002
TXN000051,08-01-2026,01-01-2026,2026-01,AUS01,5320,,GCP,INV40475,PO2373,GBP,6111.35,EXPORT,Payment for subscription,API Import,2026-01-08,2026-01-01,2026,01,6111.35,False,payment for subscription,2026-02-22 23:27:14.356841,Raw_GL_Export.csv,83.92156862745098,0,True,AUS01,5320,True,5320,Audit Fees,False,False,,Google Cloud,MAPPED,2026-01_GBP,1.957,11959.911950000002,CONVERTED,31658.610713475173,32284.527206153973,141.0,False,0.0,Thursday,False,True,True,EX002
TXN000052,18-01-2026,13-01-2026,2026-01,AUS01,5200,,AWS,INV78126,,AUD,26051.62,GST,Payment for goods,Workday,2026-01-18,2026-01-13,2026,01,26051.62,False,payment for goods,2026-02-22 23:27:14.356841,Raw_GL_Export.csv,83.92156862745098,0,True,AUS01,5200,True,5200,Software Licenses,False,False,,Amazon Web Services,MAPPED,2026-01_AUD,1.0,26051.62,DOMESTIC,30196.543712413786,22166.314759696765,145.0,False,0.0,Sunday,True,True,True,EX001;EX002
TXN000053,02/14/2026,02/12/2026,2026-02,AUS01,5110,,Telstra Corp,INV84012,PO5514,NZD,11832.5,EXPORT,Payment for consulting,Oracle,2026-02-14,2026-12-02,2026,02,11832.5,False,payment for consulting,2026-02-22 23:27:14.356841,Raw_GL_Export.csv,83.92156862745098,0,True,AUS01,5110,True,5110,Utilities,False,False,,Telstra,MAPPED,2026-02_NZD,0.932,11027.890000000001,CONVERTED,27865.288293732876,21409.69928933269,146.0,False,0.0,Saturday,True,True,True,EX002
TXN000054,14-08-2025,11-08-2025,2025-08,AUS01,5320,,Seek Limited,INV62183,PO2951,NZD,44484.02,INPUT,Payment for goods,Manual Entry,2025-08-14,2025-08-11,2025,08,44484.02,False,payment for goods,2026-02-22 23:27:14.356841,Raw_GL_Export.csv,83.92156862745098,0,True,AUS01,5320,True,5320,Audit Fees,False,False,,Seek,MAPPED,2025-08_NZD,0.93,41370.1386,CONVERTED,31658.610713475173,32284.527206153973,141.0,False,0.0,Thursday,False,True,True,EX002
TXN000055,26/03/2025,24/03/2025,2025-03,AUS01,5200,,Robert Half International,INV31068,PO1086,GBP,35395.04,GST,Payment for services,Oracle,2025-03-26,2025-03-24,2025,03,35395.04,False,payment for services,2026-02-22 23:27:14.356841,Raw_GL_Export.csv,83.92156862745098,0,True,AUS01,5200,True,5200,Software Licenses,False,False,,Robert Half,MAPPED,2025-03_GBP,1.96,69374.2784,CONVERTED,30196.543712413786,22166.314759696765,145.0,False,0.0,Wednesday,False,True,True,EX002;EX004
TXN000056,16-02-2026,14-02-2026,2026-02,AUS01,5020,,Deloitte Touche,INV60374,PO7564,USD,16750.5,GST,Payment for license,API Import,2026-02-16,2026-02-14,2026,02,16750.5,False,payment for license,2026-02-22 23:27:14.356841,Raw_GL_Export.csv,83.92156862745098,0,True,AUS01,5020,True,5020,Contractor Fees,False,False,,Deloitte,MAPPED,2026-02_USD,1.525,25544.512499999997,CONVERTED,28445.577844280295,21241.721119146277,132.0,False,0.0,Monday,False,True,True,EX002
TXN000057,2026-01-10,2026-01-07,2026-01,AUS01,5620,,Hays,INV35525,,GBP,580.9,INPUT,Payment for license,API Import,2026-01-10,2026-01-07,2026,01,580.9,False,payment for license,2026-02-22 23:27:14.356841,Raw_GL_Export.csv,83.92156862745098,0,True,AUS01,5620,True,5620,Insurance,False,False,,Hays Recruitment,MAPPED,2026-01_GBP,1.957,1136.8213,CONVERTED,32410.971605588227,27490.799177232966,170.0,False,0.0,Saturday,True,True,True,EX001;EX002
TXN000058,17/05/2025,07/05/2025,2025-05,AUS01,5120,,Microsoft,INV30636,,NZD,10842.62,GST,Payment for subscription,Manual Entry,2025-05-17,2025-05-07,2025,05,10842.62,False,payment for subscription,2026-02-22 23:27:14.356841,Raw_GL_Export.csv,83.92156862745098,0,True,AUS01,5120,True,5120,Office Supplies,False,False,,Microsoft Corporation,MAPPED,2025-05_NZD,0.928,10061.951360000001,CONVERTED,34269.00595485611,35424.20705021751,139.0,False,0.0,Saturday,True,True,True,EX001;EX002
TXN000059,12-01-2026,05-01-2026,2026-01,AUS01,5600,,SAP,INV21818,PO6703,AUD,33187.96,GST,Payment for subscription,Workday,2026-01-12,2026-01-05,2026,01,33187.96,False,payment for subscription,2026-02-22 23:27:14.356841,Raw_GL_Export.csv,83.92156862745098,0,True,AUS01,5600,True,5600,Telecommunications,False,False,,SAP SE,MAPPED,2026-01_AUD,1.0,33187.96,DOMESTIC,32190.120230168057,26805.910450208805,119.0,False,0.0,Monday,False,True,True,EX002
TXN000060,08/01/2026,31/12/2025,2026-01,AUS01,5400,,AWS,INV83220,,NZD,7959.06,GST,Payment for subscription,Workday,2026-01-08,2025-12-31,2026,01,7959.06,False,payment for subscription,2026-02-22 23:27:14.356841,Raw_GL_Export.csv,83.92156862745098,0,True,AUS01,5400,True,5400,Travel,False,False,,Amazon Web Services,MAPPED,2026-01_NZD,0.9335,7429.78251,CONVERTED,31663.682660000006,30146.476988256833,133.0,False,0.0,Thursday,False,True,True,EX001;EX002
TXN000061,03/04/2025,02/23/2025,2025-03,AUS01,5910,,Deloitte Touche,INV41886,PO8517,GBP,43475.89,EXPORT,Payment for consulting,API Import,2025-04-03,2025-02-23,2025,03,43475.89,False,payment for consulting,2026-02-22 23:27:14.356841,Raw_GL_Export.csv,83.92156862745098,1,True,AUS01,5910,True,5910,Interest Expense,False,False,,Deloitte,MAPPED,2025-03_GBP,1.96,85212.7444,CONVERTED,33774.54824600841,21661.31598456901,119.0,False,0.0,Thursday,False,True,True,EX002;EX004
TXN000062,2026-01-28,2026-01-20,2026-01,AUS01,5100,,Deloitte Touche,INV98724,PO6172,AUD,17282.03,GST-FREE,Payment for consulting,Workday,2026-01-28,2026-01-20,2026,01,17282.03,False,payment for consulting,2026-02-22 23:27:14.356841,Raw_GL_Export.csv,83.92156862745098,0,True,AUS01,5100,True,5100,Office Rent,False,False,,Deloitte,MAPPED,2026-01_AUD,1.0,17282.03,DOMESTIC,29138.02959753333,27547.65120166844,150.0,False,0.0,Wednesday,False,True,True,EX002
TXN000063,2025-08-17,2025-08-12,2025-08,AUS01,5210,,KPMG Australia,INV19965,PO3924,AUD,18011.99,INPUT,Payment for consulting,Workday,2025-08-17,2025-08-12,2025,08,18011.99,False,payment for consulting,2026-02-22 23:27:14.356841,Raw_GL_Export.csv,83.92156862745098,0,True,AUS01,5210,True,5210,Cloud Services,False,False,,KPMG,MAPPED,2025-08_AUD,1.0,18011.99,DOMESTIC,31620.56664919015,27460.393400888206,142.0,False,0.0,Sunday,True,True,True,EX002
TXN000064,12/02/2026,02/02/2026,2026-02,AUS01,5220,,Oracle,INV40783,PO5348,USD,22505.07,GST-FREE,Payment for goods,Oracle,2026-02-12,2026-02-02,2026,02,22505.07,False,payment for goods,2026-02-22 23:27:14.356841,Raw_GL_Export.csv,83.92156862745098,0,True,AUS01,5220,True,5220,IT Support,False,False,,Oracle Corporation,MAPPED,2026-02_USD,1.525,34320.23175,CONVERTED,29540.94372533058,19404.169897416657,121.0,False,0.0,Thursday,False,True,True,EX002
TXN000065,07/07/2025,27/06/2025,2025-07,AUS01,5320,,Zoom,INV98580,PO9071,AUD,5482.54,GST,Payment for license,SAP,2025-07-07,2025-06-27,2025,07,5482.54,False,payment for license,2026-02-22 23:27:14.356841,Raw_GL_Export.csv,83.92156862745098,0,True,AUS01,5320,True,5320,Audit Fees,False,False,,Zoom Video Communications,MAPPED,2025-07_AUD,1.0,5482.54,DOMESTIC,31658.610713475173,32284.527206153973,141.0,False,0.0,Monday,False,True,True,EX002
TXN000066,2026-02-25,2026-02-17,2026-02,AUS01,5320,,McKinsey,INV74330,,GBP,40425.64,INPUT,Payment for license,Workday,2026-02-25,2026-02-17,2026,02,40425.64,False,payment for license,2026-02-22 23:27:14.356841,Raw_GL_Export.csv,83.92156862745098,0,True,AUS01,5320,True,5320,Audit Fees,False,False,,McKinsey & Company,MAPPED,2026-02_GBP,1.955,79032.1262,CONVERTED,31658.610713475173,32284.527206153973,141.0,False,0.0,Wednesday,False,True,True,EX001;EX002;EX004
TXN000067,13/02/2026,03/02/2026,2026-02,AUS01,5110,,MSFT,INV75860,PO3863,GBP,21576.57,GST,Payment for consulting,SAP,2026-02-13,2026-02-03,2026,02,21576.57,False,payment for consulting,2026-02-22 23:27:14.356841,Raw_GL_Export.csv,83.92156862745098,0,True,AUS01,5110,True,5110,Utilities,False,False,,Microsoft Corporation,MAPPED,2026-02_GBP,1.955,42182.19435,CONVERTED,27865.288293732876,21409.69928933269,146.0,False,0.0,Friday,False,True,True,EX002
TXN000068,23-09-2025,17-09-2025,2025-09,AUS01,5710,,AWS,INV86153,,AUD,30367.23,EXPORT,Payment for subscription,API Import,2025-09-23,2025-09-17,2025,09,30367.23,False,payment for subscription,2026-02-22 23:27:14.356841,Raw_GL_Export.csv,83.92156862745098,0,True,AUS01,5710,True,5710,Recruitment,False,False,,Amazon Web Services,MAPPED,2025-09_AUD,1.0,30367.23,DOMESTIC,29496.09592285716,24753.031499859637,133.0,False,0.0,Tuesday,False,True,True,EX001;EX002
TXN000069,10/28/2025,10/25/2025,2025-10,AUS01,5520,,Deloitte Touche,INV57962,,USD,12196.43,INPUT,Payment for consulting,Oracle,2025-10-28,2025-10-25,2025,10,12196.43,False,payment for consulting,2026-02-22 23:27:14.356841,Raw_GL_Export.csv,83.92156862745098,0,True,AUS01,5520,True,5520,Events,False,False,,Deloitte,MAPPED,2025-10_USD,1.521,18550.77003,CONVERTED,30860.276023483882,21900.267908653983,155.0,False,0.0,Tuesday,False,True,True,EX001;EX002
TXN000070,08/14/2025,08/08/2025,2025-08,AUS01,5920,,DHL Express,INV85483,PO2636,NZD,20337.73,GST-FREE,Payment for subscription,Oracle,2025-08-14,2025-08-08,2025,08,20337.73,False,payment for subscription,2026-02-22 23:27:14.356841,Raw_GL_Export.csv,83.92156862745098,0,True,AUS01,5920,True,5920,FX Loss,False,False,,DHL,MAPPED,2025-08_NZD,0.93,18914.0889,CONVERTED,27533.92400565971,21784.021192347693,144.0,False,0.0,Thursday,False,True,True,EX002
TXN000071,18-01-2026,11-01-2026,2026-01,AUS01,5200,,Zoom,INV33148,PO3203,USD,21337.12,GST,Payment for license,API Import,2026-01-18,2026-01-11,2026,01,21337.12,False,payment for license,2026-02-22 23:27:14.356841,Raw_GL_Export.csv,83.92156862745098,0,True,AUS01,5200,True,5200,Software Licenses,False,False,,Zoom Video Communications,MAPPED,2026-01_USD,1.527,32581.782239999997,CONVERTED,30196.543712413786,22166.314759696765,145.0,False,0.0,Sunday,True,True,True,EX002
TXN000072,01/24/2026,01/16/2026,2026-01,AUS01,5300,,Deloitte Touche,INV17869,,AUD,17988.25,GST-FREE,Payment for subscription,Manual Entry,2026-01-24,2026-01-16,2026,01,17988.25,False,payment for subscription,2026-02-22 23:27:14.356841,Raw_GL_Export.csv,83.92156862745098,0,True,AUS01,5300,True,5300,Professional Services,False,False,,Deloitte,MAPPED,2026-01_AUD,1.0,17988.25,DOMESTIC,33232.533450429684,35951.49997313202,128.0,False,0.0,Saturday,True,True,True,EX001;EX002
TXN000073,2026-02-27,2026-02-19,2026-02,AUS01,5800,,BCG,INV55107,,NZD,16307.19,INPUT,Payment for services,Workday,2026-02-27,2026-02-19,2026,02,16307.19,False,payment for services,2026-02-22 23:27:14.356841,Raw_GL_Export.csv,83.92156862745098,0,True,AUS01,5800,True,5800,Depreciation,False,False,,Boston Consulting Group,MAPPED,2026-02_NZD,0.932,15198.301080000001,CONVERTED,30184.39373025477,34245.09535020032,157.0,False,0.0,Friday,False,True,True,EX001;EX002
TXN000074,28/02/2026,18/02/2026,2026-02,AUS01,5600,,Oracle,INV68580,PO7243,NZD,16044.4,EXPORT,Payment for license,Workday,2026-02-28,2026-02-18,2026,02,16044.4,False,payment for license,2026-02-22 23:27:14.356841,Raw_GL_Export.csv,83.92156862745098,0,True,AUS01,5600,True,5600,Telecommunications,False,False,,Oracle Corporation,MAPPED,2026-02_NZD,0.932,14953.3808,CONVERTED,32190.120230168057,26805.910450208805,119.0,False,0.0,Saturday,True,True,True,EX002
TXN000075,15/02/2025,12/02/2025,2025-02,AUS01,5620,,BCG,INV19351,,GBP,28444.18,EXPORT,Payment for subscription,Oracle,2025-02-15,2025-02-12,2025,02,28444.18,False,payment for subscription,2026-02-22 23:27:14.356841,Raw_GL_Export.csv,83.92156862745098,0,True,AUS01,5620,True,5620,Insurance,False,False,,Boston Consulting Group,MAPPED,2025-02_GBP,1.94,55181.7092,CONVERTED,32410.971605588227,27490.799177232966,170.0,False,0.0,Saturday,True,True,True,EX001;EX002;EX004
TXN000076,01/11/2026,01/06/2026,2026-01,AUS01,5710,,PWC,INV57600,PO9535,GBP,12279.04,EXPORT,Payment for consulting,Manual Entry,2026-11-01,2026-06-01,2026,01,12279.04,False,payment for consulting,2026-02-22 23:27:14.356841,Raw_GL_Export.csv,83.92156862745098,1,True,AUS01,5710,True,5710,Recruitment,False,False,,PwC,MAPPED,2026-01_GBP,1.957,24030.081280000002,CONVERTED,29496.09592285716,24753.031499859637,133.0,False,0.0,Sunday,True,True,True,EX002
TXN000077,06/01/2026,05/01/2026,2026-01,AUS01,5110,,Accenture Pty,INV37600,,NZD,42325.64,GST,Payment for services,SAP,2026-01-06,2026-01-05,2026,01,42325.64,False,payment for services,2026-02-22 23:27:14.356841,Raw_GL_Export.csv,83.92156862745098,0,True,AUS01,5110,True,5110,Utilities,False,False,,Accenture,MAPPED,2026-01_NZD,0.9335,39510.98494,CONVERTED,27865.288293732876,21409.69928933269,146.0,False,0.0,Tuesday,False,True,True,EX001;EX002
TXN000078,03-02-2026,25-01-2026,2026-02,AUS01,5010,,Amazon,INV23622,,GBP,23626.83,GST,Payment for goods,SAP,2026-02-03,2026-01-25,2026,02,23626.83,False,payment for goods,2026-02-22 23:27:14.356841,Raw_GL_Export.csv,83.92156862745098,0,True,AUS01,5010,True,5010,Employee Benefits,False,False,,Amazon Web Services,MAPPED,2026-02_GBP,1.955,46190.45265000001,CONVERTED,27923.213086278203,19430.63083039902,133.0,False,0.0,Tuesday,False,True,True,EX001;EX002
TXN000079,21-02-2026,16-02-2026,2026-02,AUS01,5210,,Accenture Pty,INV27206,PO3795,NZD,19997.9,GST-FREE,Payment for services,SAP,2026-02-21,2026-02-16,2026,02,19997.9,False,payment for services,2026-02-22 23:27:14.356841,Raw_GL_Export.csv,83.92156862745098,0,True,AUS01,5210,True,5210,Cloud Services,False,False,,Accenture,MAPPED,2026-02_NZD,0.932,18638.042800000003,CONVERTED,31620.56664919015,27460.393400888206,142.0,False,0.0,Saturday,True,True,True,EX002
TXN000080,02/22/2026,02/16/2026,2026-02,AUS01,5920,,Seek Limited,INV81898,PO9835,GBP,43876.67,INPUT,Payment for goods,API Import,2026-02-22,2026-02-16,2026,02,43876.67,False,payment for goods,2026-02-22 23:27:14.356841,Raw_GL_Export.csv,83.92156862745098,0,True,AUS01,5920,True,5920,FX Loss,False,False,,Seek,MAPPED,2026-02_GBP,1.955,85778.88985,CONVERTED,27533.92400565971,21784.021192347693,144.0,False,0.0,Sunday,True,True,True,EX002;EX004
TXN000081,20-02-2026,10-02-2026,2026-02,AUS01,5410,,EY Australia,INV21738,PO6992,NZD,21726.16,GST-FREE,Payment for consulting,Workday,2026-02-20,2026-02-10,2026,02,21726.16,False,payment for consulting,2026-02-22 23:27:14.356841,Raw_GL_Export.csv,83.92156862745098,0,True,AUS01,5410,True,5410,Accommodation,False,False,,EY,MAPPED,2026-02_NZD,0.932,20248.78112,CONVERTED,29277.518810999987,22143.12829502557,155.0,False,0.0,Friday,False,True,True,EX002
TXN000082,02/05/2026,02/04/2026,2026-02,AUS01,5000,,Slack,INV74478,PO8816,NZD,12975.62,GST,Payment for subscription,SAP,2026-05-02,2026-04-02,2026,02,12975.62,False,payment for subscription,2026-02-22 23:27:14.356841,Raw_GL_Export.csv,83.92156862745098,1,True,AUS01,5000,True,5000,Salaries and Wages,False,False,,Slack Technologies,MAPPED,2026-02_NZD,0.932,12093.27784,CONVERTED,30471.385558248177,22939.768434623154,137.0,False,0.0,Saturday,True,True,True,EX002;EX007
TXN000083,25-03-2025,20-03-2025,2025-03,AUS01,5610,,ServiceNow Inc,INV63967,PO8161,AUD,24714.73,GST-FREE,Payment for consulting,Oracle,2025-03-25,2025-03-20,2025,03,24714.73,False,payment for consulting,2026-02-22 23:27:14.356841,Raw_GL_Export.csv,83.92156862745098,0,True,AUS01,5610,True,5610,Postage and Courier,False,False,,ServiceNow,MAPPED,2025-03_AUD,1.0,24714.73,DOMESTIC,29081.766845273953,25872.32663648796,146.0,False,0.0,Tuesday,False,True,True,EX002
TXN000084,06-02-2025,30-01-2025,2025-02,AUS01,5210,,Deloitte Touche,INV77713,PO5454,AUD,19058.55,GST-FREE,Payment for subscription,API Import,2025-02-06,2025-01-30,2025,02,19058.55,False,payment for subscription,2026-02-22 23:27:14.356841,Raw_GL_Export.csv,83.92156862745098,0,True,AUS01,5210,True,5210,Cloud Services,False,False,,Deloitte,MAPPED,2025-02_AUD,1.0,19058.55,DOMESTIC,31620.56664919015,27460.393400888206,142.0,False,0.0,Thursday,False,True,True,EX002
TXN000085,06/26/2025,06/19/2025,2025-06,AUS01,5200,,Salesforce,INV93478,PO8418,USD,6234.42,GST,Payment for subscription,API Import,2025-06-26,2025-06-19,2025,06,6234.42,False,payment for subscription,2026-02-22 23:27:14.356841,Raw_GL_Export.csv,83.92156862745098,0,True,AUS01,5200,True,5200,Software Licenses,False,False,,Salesforce Inc,MAPPED,2025-06_USD,1.522,9488.78724,CONVERTED,30196.543712413786,22166.314759696765,145.0,False,0.0,Thursday,False,True,True,EX002
TXN000086,16/08/2025,10/08/2025,2025-08,AUS01,5000,,Zoom,INV34371,PO5622,AUD,43640.26,GST,Payment for subscription,Oracle,2025-08-16,2025-08-10,2025,08,43640.26,False,payment for subscription,2026-02-22 23:27:14.356841,Raw_GL_Export.csv,83.92156862745098,0,True,AUS01,5000,True,5000,Salaries and Wages,False,False,,Zoom Video Communications,MAPPED,2025-08_AUD,1.0,43640.26,DOMESTIC,30471.385558248177,22939.768434623154,137.0,False,0.0,Saturday,True,True,True,EX002
TXN000087,23-02-2026,22-02-2026,2026-02,AUS01,5210,,Google,INV54815,PO9165,USD,761.15,GST-FREE,Payment for subscription,Manual Entry,2026-02-23,2026-02-22,2026,02,761.15,False,payment for subscription,2026-02-22 23:27:14.356841,Raw_GL_Export.csv,83.92156862745098,0,True,AUS01,5210,True,5210,Cloud Services,False,False,,Google Cloud,MAPPED,2026-02_USD,1.525,1160.7537499999999,CONVERTED,31620.56664919015,27460.393400888206,142.0,False,0.0,Monday,False,True,True,EX002
TXN000088,2026-02-23,2026-02-17,2026-02,AUS01,5020,,Zoom,INV19356,PO3975,AUD,12066.01,EXPORT,Payment for goods,Workday,2026-02-23,2026-02-17,2026,02,12066.01,False,payment for goods,2026-02-22 23:27:14.356841,Raw_GL_Export.csv,83.92156862745098,0,True,AUS01,5020,True,5020,Contractor Fees,False,False,,Zoom Video Communications,MAPPED,2026-02_AUD,1.0,12066.01,DOMESTIC,28445.577844280295,21241.721119146277,132.0,False,0.0,Monday,False,True,True,EX002
TXN000089,27-02-2026,26-02-2026,2026-02,AUS01,5100,,Accenture Pty,INV42396,PO1549,GBP,34728.02,EXPORT,Payment for goods,Manual Entry,2026-02-27,2026-02-26,2026,02,34728.02,False,payment for goods,2026-02-22 23:27:14.356841,Raw_GL_Export.csv,83.92156862745098,0,True,AUS01,5100,True,5100,Office Rent,False,False,,Accenture,MAPPED,2026-02_GBP,1.955,67893.2791,CONVERTED,29138.02959753333,27547.65120166844,150.0,False,0.0,Friday,False,True,True,EX002;EX004
TXN000090,2026-01-24,2026-01-15,2026-01,AUS01,5700,,Workday,INV52344,,GBP,17571.62,INPUT,Payment for services,API Import,2026-01-24,2026-01-15,2026,01,17571.62,False,payment for services,2026-02-22 23:27:14.356841,Raw_GL_Export.csv,83.92156862745098,0,True,AUS01,5700,True,5700,Training,False,False,,Workday Inc,MAPPED,2026-01_GBP,1.957,34387.66034,CONVERTED,31110.431902446802,30160.111495086097,141.0,False,0.0,Saturday,True,True,True,EX001;EX002
TXN000091,2025-05-17,2025-05-12,2025-05,AUS01,5500,,EY Australia,INV97385,,USD,16283.16,GST,Payment for services,Oracle,2025-05-17,2025-05-12,2025,05,16283.16,False,payment for services,2026-02-22 23:27:14.356841,Raw_GL_Export.csv,83.92156862745098,0,True,AUS01,5500,True,5500,Marketing,False,False,,EY,MAPPED,2025-05_USD,1.518,24717.83688,CONVERTED,28972.634359125877,32785.70497360227,143.0,False,0.0,Saturday,True,True,True,EX001;EX002
TXN000092,21-01-2026,15-01-2026,2026-01,AUS01,5000,,Adobe,INV41862,,NZD,26352.89,EXPORT,Payment for services,API Import,2026-01-21,2026-01-15,2026,01,26352.89,False,payment for services,2026-02-22 23:27:14.356841,Raw_GL_Export.csv,83.92156862745098,0,True,AUS01,5000,True,5000,Salaries and Wages,False,False,,Adobe Systems,MAPPED,2026-01_NZD,0.9335,24600.422814999998,CONVERTED,30471.385558248177,22939.768434623154,137.0,False,0.0,Wednesday,False,True,True,EX001;EX002
TXN000093,26-06-2025,16-06-2025,2025-06,AUS01,5110,,Regus Australia,INV21980,PO6544,AUD,11267.63,EXPORT,Payment for services,SAP,2025-06-26,2025-06-16,2025,06,11267.63,False,payment for services,2026-02-22 23:27:14.356841,Raw_GL_Export.csv,83.92156862745098,0,True,AUS01,5110,True,5110,Utilities,False,False,,Regus,MAPPED,2025-06_AUD,1.0,11267.63,DOMESTIC,27865.288293732876,21409.69928933269,146.0,False,0.0,Thursday,False,True,True,EX002
TXN000094,12/03/2025,03/03/2025,2025-03,AUS01,5900,,GCP,INV83184,PO6690,USD,22004.15,INPUT,Payment for consulting,Oracle,2025-03-12,2025-03-03,2025,03,22004.15,False,payment for consulting,2026-02-22 23:27:14.356841,Raw_GL_Export.csv,83.92156862745098,0,True,AUS01,5900,True,5900,Bank Charges,False,False,,Google Cloud,MAPPED,2025-03_USD,1.53,33666.349500000004,CONVERTED,31670.032329854675,24882.231532617723,172.0,False,0.0,Wednesday,False,True,True,EX002
TXN000095,01-01-2026,26-12-2025,2026-01,AUS01,5800,,Slack,INV67344,PO9892,NZD,40449.97,EXPORT,Payment for consulting,Oracle,2026-01-01,2025-12-26,2026,01,40449.97,False,payment for consulting,2026-02-22 23:27:14.356841,Raw_GL_Export.csv,83.92156862745098,0,True,AUS01,5800,True,5800,Depreciation,False,False,,Slack Technologies,MAPPED,2026-01_NZD,0.9335,37760.046995000004,CONVERTED,30184.39373025477,34245.09535020032,157.0,False,0.0,Thursday,False,True,True,EX002
TXN000096,19/02/2026,10/02/2026,2026-02,AUS01,5320,,McKinsey,INV19027,PO8362,GBP,12462.07,GST-FREE,Payment for subscription,Workday,2026-02-19,2026-02-10,2026,02,12462.07,False,payment for subscription,2026-02-22 23:27:14.356841,Raw_GL_Export.csv,83.92156862745098,0,True,AUS01,5320,True,5320,Audit Fees,False,False,,McKinsey & Company,MAPPED,2026-02_GBP,1.955,24363.34685,CONVERTED,31658.610713475173,32284.527206153973,141.0,False,0.0,Thursday,False,True,True,EX002
TXN000097,11/18/2025,11/10/2025,2025-11,AUS01,5000,,Robert Half International,INV91229,PO4912,GBP,33041.23,GST,Payment for subscription,SAP,2025-11-18,2025-10-11,2025,11,33041.23,False,payment for subscription,2026-02-22 23:27:14.356841,Raw_GL_Export.csv,83.92156862745098,0,True,AUS01,5000,True,5000,Salaries and Wages,False,False,,Robert Half,MAPPED,2025-11_GBP,1.956,64628.645880000004,CONVERTED,30471.385558248177,22939.768434623154,137.0,False,0.0,Tuesday,False,True,True,EX002;EX004
TXN000098,22-02-2025,18-02-2025,2025-02,AUS01,5510,,Hays,INV63713,PO2809,USD,27625.46,INPUT,Payment for services,API Import,2025-02-22,2025-02-18,2025,02,27625.46,False,payment for services,2026-02-22 23:27:14.356841,Raw_GL_Export.csv,83.92156862745098,0,True,AUS01,5510,True,5510,Advertising,False,False,,Hays Recruitment,MAPPED,2025-02_USD,1.51,41714.4446,CONVERTED,28498.583342781956,23667.16979723599,133.0,False,0.0,Saturday,True,True,True,EX002
TXN000099,2026-02-22,2026-02-21,2026-02,AUS01,5910,,Slack,INV24031,PO2617,USD,39319.83,GST-FREE,Payment for services,API Import,2026-02-22,2026-02-21,2026,02,39319.83,False,payment for services,2026-02-22 23:27:14.356841,Raw_GL_Export.csv,83.92156862745098,0,True,AUS01,5910,True,5910,Interest Expense,False,False,,Slack Technologies,MAPPED,2026-02_USD,1.525,59962.74075,CONVERTED,33774.54824600841,21661.31598456901,119.0,False,0.0,Sunday,True,True,True,EX002;EX004
TXN000100,21-01-2026,13-01-2026,2026-01,AUS01,5510,,Deloitte Touche,INV11715,PO4419,AUD,16549.3,GST,Payment for consulting,SAP,2026-01-21,2026-01-13,2026,01,16549.3,False,payment for consulting,2026-02-22 23:27:14.356841,Raw_GL_Export.csv,83.92156862745098,0,True,AUS01,5510,True,5510,Advertising,False,False,,Deloitte,MAPPED,2026-01_AUD,1.0,16549.3,DOMESTIC,28498.583342781956,23667.16979723599,133.0,False,0.0,Wednesday,False,True,True,EX002
TXN000101,2026-01-15,2026-01-09,2026-01,AUS01,5520,,AusPost,INV90862,,NZD,35761.81,GST,Payment for services,SAP,2026-01-15,2026-01-09,2026,01,35761.81,False,payment for services,2026-02-22 23:27:14.356841,Raw_GL_Export.csv,83.92156862745098,0,True,AUS01,5520,True,5520,Events,False,False,,Australia Post,MAPPED,2026-01_NZD,0.9335,33383.649634999994,CONVERTED,30860.276023483882,21900.267908653983,155.0,False,0.0,Thursday,False,True,True,EX001;EX002
TXN000102,02/27/2026,02/25/2026,2026-02,AUS01,5200,,GCP,INV34832,,AUD,32660.22,EXPORT,Payment for goods,API Import,2026-02-27,2026-02-25,2026,02,32660.22,False,payment for goods,2026-02-22 23:27:14.356841,Raw_GL_Export.csv,83.92156862745098,0,True,AUS01,5200,True,5200,Software Licenses,False,False,,Google Cloud,MAPPED,2026-02_AUD,1.0,32660.22,DOMESTIC,30196.543712413786,22166.314759696765,145.0,False,0.0,Friday,False,True,True,EX001;EX002
TXN000103,21/12/2025,12/12/2025,2025-12,AUS01,5800,,AusPost,INV98407,PO7997,AUD,34506.13,INPUT,Payment for services,Oracle,2025-12-21,2025-12-12,2025,12,34506.13,False,payment for services,2026-02-22 23:27:14.356841,Raw_GL_Export.csv,83.92156862745098,0,True,AUS01,5800,True,5800,Depreciation,False,False,,Australia Post,MAPPED,2025-12_AUD,1.0,34506.13,DOMESTIC,30184.39373025477,34245.09535020032,157.0,False,0.0,Sunday,True,True,True,EX002
TXN000104,26/01/2026,17/01/2026,2026-01,AUS01,5400,,Robert Half International,INV56179,PO6319,NZD,29623.18,EXPORT,Payment for subscription,Manual Entry,2026-01-26,2026-01-17,2026,01,29623.18,False,payment for subscription,2026-02-22 23:27:14.356841,Raw_GL_Export.csv,83.92156862745098,0,True,AUS01,5400,True,5400,Travel,False,False,,Robert Half,MAPPED,2026-01_NZD,0.9335,27653.23853,CONVERTED,31663.682660000006,30146.476988256833,133.0,False,0.0,Monday,False,True,True,EX002
TXN000105,25-01-2026,19-01-2026,2026-01,AUS01,5610,,Accenture Pty,INV57187,PO8331,USD,16940.33,INPUT,Payment for consulting,SAP,2026-01-25,2026-01-19,2026,01,16940.33,False,payment for consulting,2026-02-22 23:27:14.356841,Raw_GL_Export.csv,83.92156862745098,0,True,AUS01,5610,True,5610,Postage and Courier,False,False,,Accenture,MAPPED,2026-01_USD,1.527,25867.88391,CONVERTED,29081.766845273953,25872.32663648796,146.0,False,0.0,Sunday,True,True,True,EX002
TXN000106,2025-05-24,2025-05-19,2025-05,AUS01,5610,,Amazon,INV10860,PO4635,USD,44704.2,INPUT,Payment for goods,Workday,2025-05-24,2025-05-19,2025,05,44704.2,False,payment for goods,2026-02-22 23:27:14.356841,Raw_GL_Export.csv,83.92156862745098,0,True,AUS01,5610,True,5610,Postage and Courier,False,False,,Amazon Web Services,MAPPED,2025-05_USD,1.518,67860.97559999999,CONVERTED,29081.766845273953,25872.32663648796,146.0,False,0.0,Saturday,True,True,True,EX002;EX004
TXN000107,02/01/2026,01/23/2026,2026-02,AUS01,5510,,Zoom,INV30461,,AUD,1794.36,INPUT,Payment for subscription,API Import,2026-01-02,2026-01-23,2026,02,1794.36,False,payment for subscription,2026-02-22 23:27:14.356841,Raw_GL_Export.csv,83.92156862745098,1,True,AUS01,5510,True,5510,Advertising,False,False,,Zoom Video Communications,MAPPED,2026-02_AUD,1.0,1794.36,DOMESTIC,28498.583342781956,23667.16979723599,133.0,False,0.0,Friday,False,True,True,EX001;EX002
TXN000108,08/09/2025,03/09/2025,2025-09,AUS01,5900,,EY Australia,INV20118,PO8905,AUD,25714.87,GST-FREE,Payment for goods,Manual Entry,2025-09-08,2025-09-03,2025,09,25714.87,False,payment for goods,2026-02-22 23:27:14.356841,Raw_GL_Export.csv,83.92156862745098,0,True,AUS01,5900,True,5900,Bank Charges,False,False,,EY,MAPPED,2025-09_AUD,1.0,25714.87,DOMESTIC,31670.032329854675,24882.231532617723,172.0,False,0.0,Monday,False,True,True,EX002
TXN000109,2026-02-27,2026-02-17,2026-02,AUS01,5620,,EY Australia,INV20286,PO6478,AUD,32912.44,EXPORT,Payment for subscription,Manual Entry,2026-02-27,2026-02-17,2026,02,32912.44,False,payment for subscription,2026-02-22 23:27:14.356841,Raw_GL_Export.csv,83.92156862745098,0,True,AUS01,5620,True,5620,Insurance,False,False,,EY,MAPPED,2026-02_AUD,1.0,32912.44,DOMESTIC,32410.971605588227,27490.799177232966,170.0,False,0.0,Friday,False,True,True,EX002
TXN000110,2026-02-14,2026-02-10,2026-02,AUS01,5800,,AWS,INV51853,PO3450,GBP,2530.34,GST,Payment for subscription,API Import,2026-02-14,2026-02-10,2026,02,2530.34,False,payment for subscription,2026-02-22 23:27:14.356841,Raw_GL_Export.csv,83.92156862745098,0,True,AUS01,5800,True,5800,Depreciation,False,False,,Amazon Web Services,MAPPED,2026-02_GBP,1.955,4946.814700000001,CONVERTED,30184.39373025477,34245.09535020032,157.0,False,0.0,Saturday,True,True,True,EX002
TXN000111,23/02/2026,20/02/2026,2026-02,AUS01,5010,,DHL Express,INV39109,PO7460,GBP,33902.53,GST,Payment for goods,Oracle,2026-02-23,2026-02-20,2026,02,33902.53,False,payment for goods,2026-02-22 23:27:14.356841,Raw_GL_Export.csv,83.92156862745098,0,True,AUS01,5010,True,5010,Employee Benefits,False,False,,DHL,MAPPED,2026-02_GBP,1.955,66279.44615,CONVERTED,27923.213086278203,19430.63083039902,133.0,False,0.0,Monday,False,True,True,EX002;EX004
TXN000112,2025-07-11,2025-07-03,2025-07,AUS01,5600,,MSFT,INV75774,PO3136,GBP,11888.85,EXPORT,Payment for goods,Manual Entry,2025-07-11,2025-07-03,2025,07,11888.85,False,payment for goods,2026-02-22 23:27:14.356841,Raw_GL_Export.csv,83.92156862745098,0,True,AUS01,5600,True,5600,Telecommunications,False,False,,Microsoft Corporation,MAPPED,2025-07_GBP,1.958,23278.368300000002,CONVERTED,32190.120230168057,26805.910450208805,119.0,False,0.0,Friday,False,True,True,EX002
TXN000113,18/02/2026,10/02/2026,2026-02,AUS01,5400,,SAP,INV66369,PO2467,USD,10979.95,INPUT,Payment for services,Manual Entry,2026-02-18,2026-02-10,2026,02,10979.95,False,payment for services,2026-02-22 23:27:14.356841,Raw_GL_Export.csv,83.92156862745098,0,True,AUS01,5400,True,5400,Travel,False,False,,SAP SE,MAPPED,2026-02_USD,1.525,16744.42375,CONVERTED,31663.682660000006,30146.476988256833,133.0,False,0.0,Wednesday,False,True,True,EX002
TXN000114,09/14/2025,09/08/2025,2025-09,AUS01,5200,,McKinsey,INV49953,,NZD,26765.08,GST,Payment for subscription,API Import,2025-09-14,2025-08-09,2025,09,26765.08,False,payment for subscription,2026-02-22 23:27:14.356841,Raw_GL_Export.csv,83.92156862745098,0,True,AUS01,5200,True,5200,Software Licenses,False,False,,McKinsey & Company,MAPPED,2025-09_NZD,0.927,24811.229160000003,CONVERTED,30196.543712413786,22166.314759696765,145.0,False,0.0,Sunday,True,True,True,EX001;EX002
TXN000115,27-01-2026,17-01-2026,2026-01,AUS01,5110,,Optus Pty,INV36173,PO3555,AUD,41597.17,GST-FREE,Payment for services,SAP,2026-01-27,2026-01-17,2026,01,41597.17,False,payment for services,2026-02-22 23:27:14.356841,Raw_GL_Export.csv,83.92156862745098,0,True,AUS01,5110,True,5110,Utilities,False,False,,Optus,MAPPED,2026-01_AUD,1.0,41597.17,DOMESTIC,27865.288293732876,21409.69928933269,146.0,False,0.0,Tuesday,False,True,True,EX002
TXN000116,2026-02-24,2026-02-20,2026-02,AUS01,5610,,Zoom,INV49992,PO1372,NZD,716.62,GST,Payment for subscription,Oracle,2026-02-24,2026-02-20,2026,02,716.62,False,payment for subscription,2026-02-22 23:27:14.356841,Raw_GL_Export.csv,83.92156862745098,0,True,AUS01,5610,True,5610,Postage and Courier,False,False,,Zoom Video Communications,MAPPED,2026-02_NZD,0.932,667.88984,CONVERTED,29081.766845273953,25872.32663648796,146.0,False,0.0,Tuesday,False,True,True,EX002
TXN000117,24/02/2026,20/02/2026,2026-02,AUS01,5520,,Deloitte Touche,INV97590,,GBP,28074.59,GST-FREE,Payment for license,API Import,2026-02-24,2026-02-20,2026,02,28074.59,False,payment for license,2026-02-22 23:27:14.356841,Raw_GL_Export.csv,83.92156862745098,0,True,AUS01,5520,True,5520,Events,False,False,,Deloitte,MAPPED,2026-02_GBP,1.955,54885.82345,CONVERTED,30860.276023483882,21900.267908653983,155.0,False,0.0,Tuesday,False,True,True,EX001;EX002;EX004
TXN000118,02/02/2026,01/30/2026,2026-02,AUS01,5010,,KPMG Australia,INV16957,PO1136,USD,35534.56,INPUT,Payment for services,Manual Entry,2026-02-02,2026-01-30,2026,02,35534.56,False,payment for services,2026-02-22 23:27:14.356841,Raw_GL_Export.csv,83.92156862745098,0,True,AUS01,5010,True,5010,Employee Benefits,False,False,,KPMG,MAPPED,2026-02_USD,1.525,54190.20399999999,CONVERTED,27923.213086278203,19430.63083039902,133.0,False,0.0,Monday,False,True,True,EX002;EX004
TXN000119,02/22/2026,02/16/2026,2026-02,AUS01,5920,,GCP,INV40299,PO9331,AUD,13233.05,EXPORT,Payment for services,Workday,2026-02-22,2026-02-16,2026,02,13233.05,False,payment for services,2026-02-22 23:27:14.356841,Raw_GL_Export.csv,83.92156862745098,0,True,AUS01,5920,True,5920,FX Loss,False,False,,Google Cloud,MAPPED,2026-02_AUD,1.0,13233.05,DOMESTIC,27533.92400565971,21784.021192347693,144.0,False,0.0,Sunday,True,True,True,EX002
TXN000120,2026-01-16,2026-01-13,2026-01,AUS01,5200,,Robert Half International,INV15210,,GBP,25274.87,GST,Payment for license,Workday,2026-01-16,2026-01-13,2026,01,25274.87,False,payment for license,2026-02-22 23:27:14.356841,Raw_GL_Export.csv,83.92156862745098,0,True,AUS01,5200,True,5200,Software Licenses,False,False,,Robert Half,MAPPED,2026-01_GBP,1.957,49462.92059,CONVERTED,30196.543712413786,22166.314759696765,145.0,False,0.0,Friday,False,True,True,EX001;EX002
TXN000121,11-10-2025,04-10-2025,2025-10,AUS01,5800,,Adobe,INV56580,PO4869,AUD,15670.42,INPUT,Payment for license,Workday,2025-10-11,2025-10-04,2025,10,15670.42,False,payment for license,2026-02-22 23:27:14.356841,Raw_GL_Export.csv,83.92156862745098,0,True,AUS01,5800,True,5800,Depreciation,False,False,,Adobe Systems,MAPPED,2025-10_AUD,1.0,15670.42,DOMESTIC,30184.39373025477,34245.09535020032,157.0,False,0.0,Saturday,True,True,True,EX002
TXN000122,2026-02-26,2026-02-21,2026-02,AUS01,5400,,Amazon,INV61491,PO2438,NZD,10228.66,INPUT,Payment for consulting,API Import,2026-02-26,2026-02-21,2026,02,10228.66,False,payment for consulting,2026-02-22 23:27:14.356841,Raw_GL_Export.csv,83.92156862745098,0,True,AUS01,5400,True,5400,Travel,False,False,,Amazon Web Services,MAPPED,2026-02_NZD,0.932,9533.11112,CONVERTED,31663.682660000006,30146.476988256833,133.0,False,0.0,Thursday,False,True,True,EX002
TXN000123,22/01/2026,15/01/2026,2026-01,AUS01,5210,,Zoom,INV68873,PO4387,GBP,43677.12,INPUT,Payment for goods,API Import,2026-01-22,2026-01-15,2026,01,43677.12,False,payment for goods,2026-02-22 23:27:14.356841,Raw_GL_Export.csv,83.92156862745098,0,True,AUS01,5210,True,5210,Cloud Services,False,False,,Zoom Video Communications,MAPPED,2026-01_GBP,1.957,85476.12384000001,CONVERTED,31620.56664919015,27460.393400888206,142.0,False,0.0,Thursday,False,True,True,EX002;EX004
TXN000124,18/03/2025,15/03/2025,2025-03,AUS01,5300,,Slack,INV96013,PO3589,GBP,44806.29,GST-FREE,Payment for subscription,SAP,2025-03-18,2025-03-15,2025,03,44806.29,False,payment for subscription,2026-02-22 23:27:14.356841,Raw_GL_Export.csv,83.92156862745098,0,True,AUS01,5300,True,5300,Professional Services,False,False,,Slack Technologies,MAPPED,2025-03_GBP,1.96,87820.3284,CONVERTED,33232.533450429684,35951.49997313202,128.0,False,0.0,Tuesday,False,True,True,EX002;EX004
TXN000125,2025-03-18,2025-03-15,2025-03,AUS01,5310,,Zoom,INV63903,PO5485,AUD,34468.03,EXPORT,Payment for goods,Oracle,2025-03-18,2025-03-15,2025,03,34468.03,False,payment for goods,2026-02-22 23:27:14.356841,Raw_GL_Export.csv,83.92156862745098,0,True,AUS01,5310,True,5310,Legal Fees,False,False,,Zoom Video Communications,MAPPED,2025-03_AUD,1.0,34468.03,DOMESTIC,33139.04129260232,28423.631835285127,171.0,False,0.0,Tuesday,False,True,True,EX002
TXN000126,04/02/2026,01/02/2026,2026-02,AUS01,5000,,PWC,INV13418,PO8808,USD,26876.6,GST-FREE,Payment for goods,API Import,2026-02-04,2026-02-01,2026,02,26876.6,False,payment for goods,2026-02-22 23:27:14.356841,Raw_GL_Export.csv,83.92156862745098,0,True,AUS01,5000,True,5000,Salaries and Wages,False,False,,PwC,MAPPED,2026-02_USD,1.525,40986.814999999995,CONVERTED,30471.385558248177,22939.768434623154,137.0,False,0.0,Wednesday,False,True,True,EX002
TXN000127,28-02-2026,22-02-2026,2026-02,AUS01,5120,,Federal Express,INV35330,,GBP,21375.73,GST-FREE,Payment for consulting,SAP,2026-02-28,2026-02-22,2026,02,21375.73,False,payment for consulting,2026-02-22 23:27:14.356841,Raw_GL_Export.csv,83.92156862745098,0,True,AUS01,5120,True,5120,Office Supplies,False,False,,FedEx,MAPPED,2026-02_GBP,1.955,41789.55215,CONVERTED,34269.00595485611,35424.20705021751,139.0,False,0.0,Saturday,True,True,True,EX001;EX002
TXN000128,09-01-2025,05-01-2025,2025-01,AUS01,5800,,SAP,INV90879,PO6323,USD,3069.52,EXPORT,Payment for consulting,Oracle,2025-01-09,2025-01-05,2025,01,3069.52,False,payment for consulting,2026-02-22 23:27:14.356841,Raw_GL_Export.csv,83.92156862745098,0,True,AUS01,5800,True,5800,Depreciation,False,False,,SAP SE,MAPPED,2025-01_USD,1.52,4665.6704,CONVERTED,30184.39373025477,34245.09535020032,157.0,False,0.0,Thursday,False,True,True,EX002
TXN000129,14-02-2026,13-02-2026,2026-02,AUS01,5610,,Federal Express,INV78242,,NZD,17797.37,GST,Payment for consulting,SAP,2026-02-14,2026-02-13,2026,02,17797.37,False,payment for consulting,2026-02-22 23:27:14.356841,Raw_GL_Export.csv,83.92156862745098,0,True,AUS01,5610,True,5610,Postage and Courier,False,False,,FedEx,MAPPED,2026-02_NZD,0.932,16587.14884,CONVERTED,29081.766845273953,25872.32663648796,146.0,False,0.0,Saturday,True,True,True,EX001;EX002
TXN000130,08-02-2026,07-02-2026,2026-02,AUS01,5520,,Federal Express,INV62171,PO5684,AUD,8624.28,EXPORT,Payment for consulting,Oracle,2026-02-08,2026-02-07,2026,02,8624.28,False,payment for consulting,2026-02-22 23:27:14.356841,Raw_GL_Export.csv,83.92156862745098,0,True,AUS01,5520,True,5520,Events,False,False,,FedEx,MAPPED,2026-02_AUD,1.0,8624.28,DOMESTIC,30860.276023483882,21900.267908653983,155.0,False,0.0,Sunday,True,True,True,EX002
TXN000131,02/14/2026,02/04/2026,2026-02,AUS01,5010,,Zoom,INV21854,PO2854,GBP,37362.22,EXPORT,Payment for goods,API Import,2026-02-14,2026-04-02,2026,02,37362.22,False,payment for goods,2026-02-22 23:27:14.356841,Raw_GL_Export.csv,83.92156862745098,0,True,AUS01,5010,True,5010,Employee Benefits,False,False,,Zoom Video Communications,MAPPED,2026-02_GBP,1.955,73043.1401,CONVERTED,27923.213086278203,19430.63083039902,133.0,False,0.0,Saturday,True,True,True,EX002;EX004
TXN000132,23/02/2026,16/02/2026,2026-02,AUS01,5410,,McKinsey,INV87373,PO4308,GBP,1218.55,EXPORT,Payment for consulting,SAP,2026-02-23,2026-02-16,2026,02,1218.55,False,payment for consulting,2026-02-22 23:27:14.356841,Raw_GL_Export.csv,83.92156862745098,0,True,AUS01,5410,True,5410,Accommodation,False,False,,McKinsey & Company,MAPPED,2026-02_GBP,1.955,2382.26525,CONVERTED,29277.518810999987,22143.12829502557,155.0,False,0.0,Monday,False,True,True,EX002
TXN000133,02/09/2026,02/06/2026,2026-02,AUS01,5710,,Atlassian Pty,INV93109,PO9582,AUD,5226.01,EXPORT,Payment for consulting,API Import,2026-09-02,2026-06-02,2026,02,5226.01,False,payment for consulting,2026-02-22 23:27:14.356841,Raw_GL_Export.csv,83.92156862745098,1,True,AUS01,5710,True,5710,Recruitment,False,False,,Atlassian,MAPPED,2026-02_AUD,1.0,5226.01,DOMESTIC,29496.09592285716,24753.031499859637,133.0,False,0.0,Wednesday,False,True,True,EX002;EX007
TXN000134,20/01/2026,13/01/2026,2026-01,AUS01,5520,,Federal Express,INV84120,PO3459,AUD,34594.89,INPUT,Payment for goods,Oracle,2026-01-20,2026-01-13,2026,01,34594.89,False,payment for goods,2026-02-22 23:27:14.356841,Raw_GL_Export.csv,83.92156862745098,0,True,AUS01,5520,True,5520,Events,False,False,,FedEx,MAPPED,2026-01_AUD,1.0,34594.89,DOMESTIC,30860.276023483882,21900.267908653983,155.0,False,0.0,Tuesday,False,True,True,EX002
TXN000135,2026-01-06,2025-12-30,2026-01,AUS01,5300,,EY Australia,INV25408,PO4323,GBP,13066.25,GST-FREE,Payment for services,API Import,2026-01-06,2025-12-30,2026,01,13066.25,False,payment for services,2026-02-22 23:27:14.356841,Raw_GL_Export.csv,83.92156862745098,0,True,AUS01,5300,True,5300,Professional Services,False,False,,EY,MAPPED,2026-01_GBP,1.957,25570.651250000003,CONVERTED,33232.533450429684,35951.49997313202,128.0,False,0.0,Tuesday,False,True,True,EX002
TXN000136,02/25/2026,02/24/2026,2026-02,AUS01,5420,,Hays,INV89689,PO4897,GBP,24503.2,GST,Payment for goods,API Import,2026-02-25,2026-02-24,2026,02,24503.2,False,payment for goods,2026-02-22 23:27:14.356841,Raw_GL_Export.csv,83.92156862745098,0,True,AUS01,5420,True,5420,Meals and Entertainment,False,False,,Hays Recruitment,MAPPED,2026-02_GBP,1.955,47903.756,CONVERTED,30119.54810314684,25344.73848974119,143.0,False,0.0,Wednesday,False,True,True,EX002
TXN000137,22-12-2025,14-12-2025,2025-12,AUS01,5410,,Optus Pty,INV42075,PO5556,AUD,27094.62,GST,Payment for license,API Import,2025-12-22,2025-12-14,2025,12,27094.62,False,payment for license,2026-02-22 23:27:14.356841,Raw_GL_Export.csv,83.92156862745098,0,True,AUS01,5410,True,5410,Accommodation,False,False,,Optus,MAPPED,2025-12_AUD,1.0,27094.62,DOMESTIC,29277.518810999987,22143.12829502557,155.0,False,0.0,Monday,False,True,True,EX002
TXN000138,27/01/2026,26/01/2026,2026-01,AUS01,5120,,Zoom,INV29054,PO5889,AUD,29432.13,GST,Payment for subscription,SAP,2026-01-27,2026-01-26,2026,01,29432.13,False,payment for subscription,2026-02-22 23:27:14.356841,Raw_GL_Export.csv,83.92156862745098,0,True,AUS01,5120,True,5120,Office Supplies,False,False,,Zoom Video Communications,MAPPED,2026-01_AUD,1.0,29432.13,DOMESTIC,34269.00595485611,35424.20705021751,139.0,False,0.0,Tuesday,False,True,True,EX002
TXN000139,2025-08-02,2025-07-26,2025-08,AUS01,5120,,Adobe,INV69682,PO6901,NZD,27537.93,GST-FREE,Payment for services,SAP,2025-08-02,2025-07-26,2025,08,27537.93,False,payment for services,2026-02-22 23:27:14.356841,Raw_GL_Export.csv,83.92156862745098,0,True,AUS01,5120,True,5120,Office Supplies,False,False,,Adobe Systems,MAPPED,2025-08_NZD,0.93,25610.2749,CONVERTED,34269.00595485611,35424.20705021751,139.0,False,0.0,Saturday,True,True,True,EX002
TXN000140,02/25/2026,02/19/2026,2026-02,AUS01,5320,,Federal Express,INV48382,PO2999,AUD,34154.05,GST,Payment for subscription,Workday,2026-02-25,2026-02-19,2026,02,34154.05,False,payment for subscription,2026-02-22 23:27:14.356841,Raw_GL_Export.csv,83.92156862745098,0,True,AUS01,5320,True,5320,Audit Fees,False,False,,FedEx,MAPPED,2026-02_AUD,1.0,34154.05,DOMESTIC,31658.610713475173,32284.527206153973,141.0,False,0.0,Wednesday,False,True,True,EX002
TXN000141,17-01-2026,08-01-2026,2026-01,AUS01,5200,,Workday,INV73394,PO5705,AUD,5007.67,GST,Payment for consulting,API Import,2026-01-17,2026-01-08,2026,01,5007.67,False,payment for consulting,2026-02-22 23:27:14.356841,Raw_GL_Export.csv,83.92156862745098,0,True,AUS01,5200,True,5200,Software Licenses,False,False,,Workday Inc,MAPPED,2026-01_AUD,1.0,5007.67,DOMESTIC,30196.543712413786,22166.314759696765,145.0,False,0.0,Saturday,True,True,True,EX002
TXN000142,02/28/2026,02/23/2026,2026-02,AUS01,5510,,WeWork Australia,INV78118,PO9154,USD,27681.62,EXPORT,Payment for consulting,Oracle,2026-02-28,2026-02-23,2026,02,27681.62,False,payment for consulting,2026-02-22 23:27:14.356841,Raw_GL_Export.csv,83.92156862745098,0,True,AUS01,5510,True,5510,Advertising,False,False,,WeWork,MAPPED,2026-02_USD,1.525,42214.470499999996,CONVERTED,28498.583342781956,23667.16979723599,133.0,False,0.0,Saturday,True,True,True,EX002
TXN000143,20/10/2025,15/10/2025,2025-10,AUS01,5200,,AWS,INV37175,PO7793,AUD,1177.01,GST,Payment for consulting,SAP,2025-10-20,2025-10-15,2025,10,1177.01,False,payment for consulting,2026-02-22 23:27:14.356841,Raw_GL_Export.csv,83.92156862745098,0,True,AUS01,5200,True,5200,Software Licenses,False,False,,Amazon Web Services,MAPPED,2025-10_AUD,1.0,1177.01,DOMESTIC,30196.543712413786,22166.314759696765,145.0,False,0.0,Monday,False,True,True,EX002
TXN000144,02/11/2026,02/02/2026,2026-02,AUS01,5900,,Workday,INV43347,PO6042,AUD,28863.76,INPUT,Payment for subscription,API Import,2026-11-02,2026-02-02,2026,02,28863.76,False,payment for subscription,2026-02-22 23:27:14.356841,Raw_GL_Export.csv,83.92156862745098,1,True,AUS01,5900,True,5900,Bank Charges,False,False,,Workday Inc,MAPPED,2026-02_AUD,1.0,28863.76,DOMESTIC,31670.032329854675,24882.231532617723,172.0,False,0.0,Monday,False,True,True,EX002;EX007
TXN000145,01/18/2026,01/17/2026,2026-01,AUS01,5100,,BCG,INV33020,,NZD,17882.61,GST,Payment for subscription,Manual Entry,2026-01-18,2026-01-17,2026,01,17882.61,False,payment for subscription,2026-02-22 23:27:14.356841,Raw_GL_Export.csv,83.92156862745098,0,True,AUS01,5100,True,5100,Office Rent,False,False,,Boston Consulting Group,MAPPED,2026-01_NZD,0.9335,16693.416435,CONVERTED,29138.02959753333,27547.65120166844,150.0,False,0.0,Sunday,True,True,True,EX001;EX002
TXN000146,2026-02-16,2026-02-13,2026-02,AUS01,5500,,Zoom,INV70616,PO7782,GBP,40153.42,INPUT,Payment for services,API Import,2026-02-16,2026-02-13,2026,02,40153.42,False,payment for services,2026-02-22 23:27:14.356841,Raw_GL_Export.csv,83.92156862745098,0,True,AUS01,5500,True,5500,Marketing,False,False,,Zoom Video Communications,MAPPED,2026-02_GBP,1.955,78499.9361,CONVERTED,28972.634359125877,32785.70497360227,143.0,False,0.0,Monday,False,True,True,EX002;EX004
TXN000147,01/10/2025,01/01/2025,2025-01,AUS01,5520,,Amazon,INV56346,,USD,26025.15,INPUT,Payment for goods,Workday,2025-10-01,2025-01-01,2025,01,26025.15,False,payment for goods,2026-02-22 23:27:14.356841,Raw_GL_Export.csv,83.92156862745098,1,True,AUS01,5520,True,5520,Events,False,False,,Amazon Web Services,MAPPED,2025-01_USD,1.52,39558.228,CONVERTED,30860.276023483882,21900.267908653983,155.0,False,0.0,Wednesday,False,True,True,EX001;EX002
TXN000148,2026-02-27,2026-02-21,2026-02,AUS01,5400,,Adobe,INV50407,PO6152,GBP,8513.31,GST,Payment for services,Workday,2026-02-27,2026-02-21,2026,02,8513.31,False,payment for services,2026-02-22 23:27:14.356841,Raw_GL_Export.csv,83.92156862745098,0,True,AUS01,5400,True,5400,Travel,False,False,,Adobe Systems,MAPPED,2026-02_GBP,1.955,16643.52105,CONVERTED,31663.682660000006,30146.476988256833,133.0,False,0.0,Friday,False,True,True,EX002
TXN000149,2026-01-14,2026-01-06,2026-01,AUS01,5210,,Regus Australia,INV38329,PO3867,GBP,37342.64,INPUT,Payment for services,Workday,2026-01-14,2026-01-06,2026,01,37342.64,False,payment for services,2026-02-22 23:27:14.356841,Raw_GL_Export.csv,83.92156862745098,0,True,AUS01,5210,True,5210,Cloud Services,False,False,,Regus,MAPPED,2026-01_GBP,1.957,73079.54648,CONVERTED,31620.56664919015,27460.393400888206,142.0,False,0.0,Wednesday,False,True,True,EX002;EX004
TXN000150,2026-02-26,2026-02-22,2026-02,AUS01,5020,,Optus Pty,INV34931,PO8921,AUD,35976.24,GST-FREE,Payment for license,Workday,2026-02-26,2026-02-22,2026,02,35976.24,False,payment for license,2026-02-22 23:27:14.356841,Raw_GL_Export.csv,83.92156862745098,0,True,AUS01,5020,True,5020,Contractor Fees,False,False,,Optus,MAPPED,2026-02_AUD,1.0,35976.24,DOMESTIC,28445.577844280295,21241.721119146277,132.0,False,0.0,Thursday,False,True,True,EX002
TXN000151,02/25/2026,02/22/2026,2026-02,AUS01,5810,,GCP,INV70210,PO9558,USD,9312.9,GST,Payment for services,SAP,2026-02-25,2026-02-22,2026,02,9312.9,False,payment for services,2026-02-22 23:27:14.356841,Raw_GL_Export.csv,83.92156862745098,0,True,AUS01,5810,True,5810,Amortization,False,False,,Google Cloud,MAPPED,2026-02_USD,1.525,14202.172499999999,CONVERTED,31768.91314562501,27328.351394475325,120.0,False,0.0,Wednesday,False,True,True,EX002
TXN000152,2026-01-10,2025-12-31,2026-01,AUS01,5920,,Google,INV23513,PO6119,NZD,21062.73,GST,Payment for services,API Import,2026-01-10,2025-12-31,2026,01,21062.73,False,payment for services,2026-02-22 23:27:14.356841,Raw_GL_Export.csv,83.92156862745098,0,True,AUS01,5920,True,5920,FX Loss,False,False,,Google Cloud,MAPPED,2026-01_NZD,0.9335,19662.058455,CONVERTED,27533.92400565971,21784.021192347693,144.0,False,0.0,Saturday,True,True,True,EX002
TXN000153,01/25/2026,01/21/2026,2026-01,AUS01,5310,,SAP,INV67817,PO5467,USD,12966.88,INPUT,Payment for goods,Oracle,2026-01-25,2026-01-21,2026,01,12966.88,False,payment for goods,2026-02-22 23:27:14.356841,Raw_GL_Export.csv,83.92156862745098,0,True,AUS01,5310,True,5310,Legal Fees,False,False,,SAP SE,MAPPED,2026-01_USD,1.527,19800.42576,CONVERTED,33139.04129260232,28423.631835285127,171.0,False,0.0,Sunday,True,True,True,EX002
TXN000154,2026-01-09,2026-01-08,2026-01,AUS01,5610,,Robert Half International,INV82006,PO3319,AUD,9375.32,INPUT,Payment for subscription,API Import,2026-01-09,2026-01-08,2026,01,9375.32,False,payment for subscription,2026-02-22 23:27:14.356841,Raw_GL_Export.csv,83.92156862745098,0,True,AUS01,5610,True,5610,Postage and Courier,False,False,,Robert Half,MAPPED,2026-01_AUD,1.0,9375.32,DOMESTIC,29081.766845273953,25872.32663648796,146.0,False,0.0,Friday,False,True,True,EX002
TXN000155,08/01/2026,06/01/2026,2026-01,AUS01,5300,,BCG,INV71700,PO1826,GBP,2377.61,GST,Payment for services,Manual Entry,2026-01-08,2026-01-06,2026,01,2377.61,False,payment for services,2026-02-22 23:27:14.356841,Raw_GL_Export.csv,83.92156862745098,0,True,AUS01,5300,True,5300,Professional Services,False,False,,Boston Consulting Group,MAPPED,2026-01_GBP,1.957,4652.9827700000005,CONVERTED,33232.533450429684,35951.49997313202,128.0,False,0.0,Thursday,False,True,True,EX002
TXN000156,2025-10-02,2025-09-25,2025-10,AUS01,5400,,Oracle,INV53559,PO9740,GBP,27772.56,INPUT,Payment for services,Manual Entry,2025-10-02,2025-09-25,2025,10,27772.56,False,payment for services,2026-02-22 23:27:14.356841,Raw_GL_Export.csv,83.92156862745098,0,True,AUS01,5400,True,5400,Travel,False,False,,Oracle Corporation,MAPPED,2025-10_GBP,1.951,54184.26456,CONVERTED,31663.682660000006,30146.476988256833,133.0,False,0.0,Thursday,False,True,True,EX002;EX004
TXN000157,19/06/2025,17/06/2025,2025-06,AUS01,5910,,LinkedIn Corp,INV71675,,AUD,20555.73,EXPORT,Payment for goods,Oracle,2025-06-19,2025-06-17,2025,06,20555.73,False,payment for goods,2026-02-22 23:27:14.356841,Raw_GL_Export.csv,83.92156862745098,0,True,AUS01,5910,True,5910,Interest Expense,False,False,,LinkedIn,MAPPED,2025-06_AUD,1.0,20555.73,DOMESTIC,33774.54824600841,21661.31598456901,119.0,False,0.0,Thursday,False,True,True,EX001;EX002
TXN000158,02/28/2026,02/22/2026,2026-02,AUS01,5400,,Oracle,INV69412,PO2070,NZD,35516.16,INPUT,Payment for consulting,SAP,2026-02-28,2026-02-22,2026,02,35516.16,False,payment for consulting,2026-02-22 23:27:14.356841,Raw_GL_Export.csv,83.92156862745098,0,True,AUS01,5400,True,5400,Travel,False,False,,Oracle Corporation,MAPPED,2026-02_NZD,0.932,33101.061120000006,CONVERTED,31663.682660000006,30146.476988256833,133.0,False,0.0,Saturday,True,True,True,EX002
TXN000159,12-02-2026,04-02-2026,2026-02,AUS01,5920,,Adobe,INV76577,,NZD,34580.57,GST-FREE,Payment for services,Workday,2026-02-12,2026-02-04,2026,02,34580.57,False,payment for services,2026-02-22 23:27:14.356841,Raw_GL_Export.csv,83.92156862745098,0,True,AUS01,5920,True,5920,FX Loss,False,False,,Adobe Systems,MAPPED,2026-02_NZD,0.932,32229.09124,CONVERTED,27533.92400565971,21784.021192347693,144.0,False,0.0,Thursday,False,True,True,EX001;EX002
TXN000160,2025-06-18,2025-06-13,2025-06,AUS01,5520,,LinkedIn Corp,INV91379,,GBP,26615.06,GST-FREE,Payment for goods,Manual Entry,2025-06-18,2025-06-13,2025,06,26615.06,False,payment for goods,2026-02-22 23:27:14.356841,Raw_GL_Export.csv,83.92156862745098,0,True,AUS01,5520,True,5520,Events,False,False,,LinkedIn,MAPPED,2025-06_GBP,1.952,51952.59712,CONVERTED,30860.276023483882,21900.267908653983,155.0,False,0.0,Wednesday,False,True,True,EX001;EX002;EX004
TXN000161,2025-02-13,2025-02-07,2025-02,AUS01,5200,,Telstra Corp,INV81372,PO3835,GBP,25567.78,INPUT,Payment for services,API Import,2025-02-13,2025-02-07,2025,02,25567.78,False,payment for services,2026-02-22 23:27:14.356841,Raw_GL_Export.csv,83.92156862745098,0,True,AUS01,5200,True,5200,Software Licenses,False,False,,Telstra,MAPPED,2025-02_GBP,1.94,49601.4932,CONVERTED,30196.543712413786,22166.314759696765,145.0,False,0.0,Thursday,False,True,True,EX002
TXN000162,27-06-2025,25-06-2025,2025-06,AUS01,5600,,LinkedIn Corp,INV33091,PO7648,NZD,25023.44,EXPORT,Payment for services,API Import,2025-06-27,2025-06-25,2025,06,25023.44,False,payment for services,2026-02-22 23:27:14.356841,Raw_GL_Export.csv,83.92156862745098,0,True,AUS01,5600,True,5600,Telecommunications,False,False,,LinkedIn,MAPPED,2025-06_NZD,0.931,23296.82264,CONVERTED,32190.120230168057,26805.910450208805,119.0,False,0.0,Friday,False,True,True,EX002
TXN000163,04-02-2026,29-01-2026,2026-02,AUS01,5500,,MSFT,INV86122,PO1003,AUD,9870.77,GST-FREE,Payment for goods,Oracle,2026-02-04,2026-01-29,2026,02,9870.77,False,payment for goods,2026-02-22 23:27:14.356841,Raw_GL_Export.csv,83.92156862745098,0,True,AUS01,5500,True,5500,Marketing,False,False,,Microsoft Corporation,MAPPED,2026-02_AUD,1.0,9870.77,DOMESTIC,28972.634359125877,32785.70497360227,143.0,False,0.0,Wednesday,False,True,True,EX002
TXN000164,01/15/2026,01/08/2026,2026-01,AUS01,5610,,Optus Pty,INV49286,PO5989,USD,9334.21,INPUT,Payment for consulting,Workday,2026-01-15,2026-08-01,2026,01,9334.21,False,payment for consulting,2026-02-22 23:27:14.356841,Raw_GL_Export.csv,83.92156862745098,0,True,AUS01,5610,True,5610,Postage and Courier,False,False,,Optus,MAPPED,2026-01_USD,1.527,14253.338669999997,CONVERTED,29081.766845273953,25872.32663648796,146.0,False,0.0,Thursday,False,True,True,EX002
TXN000165,2026-01-03,2025-12-24,2026-01,AUS01,5510,,DHL Express,INV58394,PO1870,USD,38377.48,GST,Payment for services,API Import,2026-01-03,2025-12-24,2026,01,38377.48,False,payment for services,2026-02-22 23:27:14.356841,Raw_GL_Export.csv,83.92156862745098,0,True,AUS01,5510,True,5510,Advertising,False,False,,DHL,MAPPED,2026-01_USD,1.527,58602.411960000005,CONVERTED,28498.583342781956,23667.16979723599,133.0,False,0.0,Saturday,True,True,True,EX002;EX004
TXN000166,02/27/2026,02/25/2026,2026-02,AUS01,5920,,KPMG Australia,INV91948,PO7271,AUD,10662.33,EXPORT,Payment for consulting,Manual Entry,2026-02-27,2026-02-25,2026,02,10662.33,False,payment for consulting,2026-02-22 23:27:14.356841,Raw_GL_Export.csv,83.92156862745098,0,True,AUS01,5920,True,5920,FX Loss,False,False,,KPMG,MAPPED,2026-02_AUD,1.0,10662.33,DOMESTIC,27533.92400565971,21784.021192347693,144.0,False,0.0,Friday,False,True,True,EX002
TXN000167,14/01/2026,11/01/2026,2026-01,AUS01,5500,,Slack,INV64687,,USD,25038.43,INPUT,Payment for goods,Oracle,2026-01-14,2026-01-11,2026,01,25038.43,False,payment for goods,2026-02-22 23:27:14.356841,Raw_GL_Export.csv,83.92156862745098,0,True,AUS01,5500,True,5500,Marketing,False,False,,Slack Technologies,MAPPED,2026-01_USD,1.527,38233.682609999996,CONVERTED,28972.634359125877,32785.70497360227,143.0,False,0.0,Wednesday,False,True,True,EX001;EX002
TXN000168,2025-01-01,2024-12-31,2025-01,AUS01,5110,,Hays,INV21097,,GBP,43876.38,GST-FREE,Payment for consulting,Manual Entry,2025-01-01,2024-12-31,2025,01,43876.38,False,payment for consulting,2026-02-22 23:27:14.356841,Raw_GL_Export.csv,83.92156862745098,0,True,AUS01,5110,True,5110,Utilities,False,False,,Hays Recruitment,MAPPED,2025-01_GBP,1.95,85558.94099999999,CONVERTED,27865.288293732876,21409.69928933269,146.0,False,0.0,Wednesday,False,True,True,EX001;EX002;EX004
TXN000169,26-02-2026,16-02-2026,2026-02,AUS01,5120,,LinkedIn Corp,INV60425,PO4044,GBP,24887.05,EXPORT,Payment for consulting,API Import,2026-02-26,2026-02-16,2026,02,24887.05,False,payment for consulting,2026-02-22 23:27:14.356841,Raw_GL_Export.csv,83.92156862745098,0,True,AUS01,5120,True,5120,Office Supplies,False,False,,LinkedIn,MAPPED,2026-02_GBP,1.955,48654.18275,CONVERTED,34269.00595485611,35424.20705021751,139.0,False,0.0,Thursday,False,True,True,EX002
TXN000170,01-11-2025,28-10-2025,2025-11,AUS01,5710,,Robert Half International,INV14385,PO8917,NZD,18546.62,INPUT,Payment for subscription,SAP,2025-11-01,2025-10-28,2025,11,18546.62,False,payment for subscription,2026-02-22 23:27:14.356841,Raw_GL_Export.csv,83.92156862745098,0,True,AUS01,5710,True,5710,Recruitment,False,False,,Robert Half,MAPPED,2025-11_NZD,0.933,17303.99646,CONVERTED,29496.09592285716,24753.031499859637,133.0,False,0.0,Saturday,True,True,True,EX002
TXN000171,19-09-2025,17-09-2025,2025-09,AUS01,5110,,PWC,INV42142,PO2279,GBP,23311.03,GST,Payment for license,API Import,2025-09-19,2025-09-17,2025,09,23311.03,False,payment for license,2026-02-22 23:27:14.356841,Raw_GL_Export.csv,83.92156862745098,0,True,AUS01,5110,True,5110,Utilities,False,False,,PwC,MAPPED,2025-09_GBP,1.949,45433.19747,CONVERTED,27865.288293732876,21409.69928933269,146.0,False,0.0,Friday,False,True,True,EX002
TXN000172,2025-05-10,2025-05-04,2025-05,AUS01,5520,,AWS,INV85230,PO7897,GBP,20486.16,EXPORT,Payment for subscription,Workday,2025-05-10,2025-05-04,2025,05,20486.16,False,payment for subscription,2026-02-22 23:27:14.356841,Raw_GL_Export.csv,83.92156862745098,0,True,AUS01,5520,True,5520,Events,False,False,,Amazon Web Services,MAPPED,2025-05_GBP,1.948,39907.03968,CONVERTED,30860.276023483882,21900.267908653983,155.0,False,0.0,Saturday,True,True,True,EX002
TXN000173,10/01/2026,09/01/2026,2026-01,AUS01,5710,,EY Australia,INV85778,,NZD,2857.66,EXPORT,Payment for services,Workday,2026-01-10,2026-01-09,2026,01,2857.66,False,payment for services,2026-02-22 23:27:14.356841,Raw_GL_Export.csv,83.92156862745098,0,True,AUS01,5710,True,5710,Recruitment,False,False,,EY,MAPPED,2026-01_NZD,0.9335,2667.62561,CONVERTED,29496.09592285716,24753.031499859637,133.0,False,0.0,Saturday,True,True,True,EX001;EX002
TXN000174,2026-01-26,2026-01-21,2026-01,AUS01,5500,,Google,INV43036,,USD,22801.27,INPUT,Payment for subscription,Workday,2026-01-26,2026-01-21,2026,01,22801.27,False,payment for subscription,2026-02-22 23:27:14.356841,Raw_GL_Export.csv,83.92156862745098,0,True,AUS01,5500,True,5500,Marketing,False,False,,Google Cloud,MAPPED,2026-01_USD,1.527,34817.53929,CONVERTED,28972.634359125877,32785.70497360227,143.0,False,0.0,Monday,False,True,True,EX001;EX002
TXN000175,02/28/2026,02/27/2026,2026-02,AUS01,5800,,Atlassian Pty,INV96396,PO3873,USD,40964.9,GST-FREE,Payment for subscription,Oracle,2026-02-28,2026-02-27,2026,02,40964.9,False,payment for subscription,2026-02-22 23:27:14.356841,Raw_GL_Export.csv,83.92156862745098,0,True,AUS01,5800,True,5800,Depreciation,False,False,,Atlassian,MAPPED,2026-02_USD,1.525,62471.472499999996,CONVERTED,30184.39373025477,34245.09535020032,157.0,False,0.0,Saturday,True,True,True,EX002;EX004
TXN000176,16/01/2026,07/01/2026,2026-01,AUS01,5920,,Microsoft,INV88059,PO3525,NZD,44284.82,GST-FREE,Payment for consulting,Manual Entry,2026-01-16,2026-01-07,2026,01,44284.82,False,payment for consulting,2026-02-22 23:27:14.356841,Raw_GL_Export.csv,83.92156862745098,0,True,AUS01,5920,True,5920,FX Loss,False,False,,Microsoft Corporation,MAPPED,2026-01_NZD,0.9335,41339.87947,CONVERTED,27533.92400565971,21784.021192347693,144.0,False,0.0,Friday,False,True,True,EX002
TXN000177,25-01-2026,21-01-2026,2026-01,AUS01,5700,,Optus Pty,INV17120,PO2900,USD,9567.47,INPUT,Payment for services,Oracle,2026-01-25,2026-01-21,2026,01,9567.47,False,payment for services,2026-02-22 23:27:14.356841,Raw_GL_Export.csv,83.92156862745098,0,True,AUS01,5700,True,5700,Training,False,False,,Optus,MAPPED,2026-01_USD,1.527,14609.526689999999,CONVERTED,31110.431902446802,30160.111495086097,141.0,False,0.0,Sunday,True,True,True,EX002
TXN000178,15-01-2026,07-01-2026,2026-01,AUS01,5300,,Seek Limited,INV72205,,USD,17153.06,EXPORT,Payment for license,Manual Entry,2026-01-15,2026-01-07,2026,01,17153.06,False,payment for license,2026-02-22 23:27:14.356841,Raw_GL_Export.csv,83.92156862745098,0,True,AUS01,5300,True,5300,Professional Services,False,False,,Seek,MAPPED,2026-01_USD,1.527,26192.72262,CONVERTED,33232.533450429684,35951.49997313202,128.0,False,0.0,Thursday,False,True,True,EX001;EX002
TXN000179,01/01/2026,12/24/2025,2026-01,AUS01,5400,,McKinsey,INV66595,PO5466,AUD,4471.66,INPUT,Payment for subscription,Workday,2026-01-01,2025-12-24,2026,01,4471.66,False,payment for subscription,2026-02-22 23:27:14.356841,Raw_GL_Export.csv,83.92156862745098,0,True,AUS01,5400,True,5400,Travel,False,False,,McKinsey & Company,MAPPED,2026-01_AUD,1.0,4471.66,DOMESTIC,31663.682660000006,30146.476988256833,133.0,False,0.0,Thursday,False,True,True,EX002
TXN000180,2026-01-09,2026-01-04,2026-01,AUS01,5620,,DHL Express,INV98065,PO4193,GBP,34814.48,GST-FREE,Payment for license,Workday,2026-01-09,2026-01-04,2026,01,34814.48,False,payment for license,2026-02-22 23:27:14.356841,Raw_GL_Export.csv,83.92156862745098,0,True,AUS01,5620,True,5620,Insurance,False,False,,DHL,MAPPED,2026-01_GBP,1.957,68131.93736000001,CONVERTED,32410.971605588227,27490.799177232966,170.0,False,0.0,Friday,False,True,True,EX002;EX004
TXN000181,22/04/2025,16/04/2025,2025-04,AUS01,5520,,AWS,INV63903,,AUD,37442.86,GST,Payment for services,Manual Entry,2025-04-22,2025-04-16,2025,04,37442.86,False,payment for services,2026-02-22 23:27:14.356841,Raw_GL_Export.csv,83.92156862745098,0,True,AUS01,5520,True,5520,Events,False,False,,Amazon Web Services,MAPPED,2025-04_AUD,1.0,37442.86,DOMESTIC,30860.276023483882,21900.267908653983,155.0,False,0.0,Tuesday,False,True,True,EX001;EX002
TXN000182,12/01/2026,07/01/2026,2026-01,AUS01,5220,,SAP,INV17455,PO4552,AUD,1164.15,GST,Payment for license,SAP,2026-01-12,2026-01-07,2026,01,1164.15,False,payment for license,2026-02-22 23:27:14.356841,Raw_GL_Export.csv,83.92156862745098,0,True,AUS01,5220,True,5220,IT Support,False,False,,SAP SE,MAPPED,2026-01_AUD,1.0,1164.15,DOMESTIC,29540.94372533058,19404.169897416657,121.0,False,0.0,Monday,False,True,True,EX002
TXN000183,2026-02-23,2026-02-21,2026-02,AUS01,5920,,Slack,INV24528,PO5150,GBP,29572.12,GST-FREE,Payment for subscription,Manual Entry,2026-02-23,2026-02-21,2026,02,29572.12,False,payment for subscription,2026-02-22 23:27:14.356841,Raw_GL_Export.csv,83.92156862745098,0,True,AUS01,5920,True,5920,FX Loss,False,False,,Slack Technologies,MAPPED,2026-02_GBP,1.955,57813.4946,CONVERTED,27533.92400565971,21784.021192347693,144.0,False,0.0,Monday,False,True,True,EX002;EX004
TXN000184,2026-02-22,2026-02-14,2026-02,AUS01,5220,,Telstra Corp,INV46344,PO7271,NZD,11654.41,GST,Payment for consulting,Workday,2026-02-22,2026-02-14,2026,02,11654.41,False,payment for consulting,2026-02-22 23:27:14.356841,Raw_GL_Export.csv,83.92156862745098,0,True,AUS01,5220,True,5220,IT Support,False,False,,Telstra,MAPPED,2026-02_NZD,0.932,10861.91012,CONVERTED,29540.94372533058,19404.169897416657,121.0,False,0.0,Sunday,True,True,True,EX002
TXN000185,01/02/2026,12/28/2025,2026-01,AUS01,5120,,Optus Pty,INV89993,PO9061,AUD,22178.31,GST-FREE,Payment for services,Oracle,2026-02-01,2025-12-28,2026,01,22178.31,False,payment for services,2026-02-22 23:27:14.356841,Raw_GL_Export.csv,83.92156862745098,1,True,AUS01,5120,True,5120,Office Supplies,False,False,,Optus,MAPPED,2026-01_AUD,1.0,22178.31,DOMESTIC,34269.00595485611,35424.20705021751,139.0,False,0.0,Sunday,True,True,True,EX002
TXN000186,18-02-2026,14-02-2026,2026-02,AUS01,5610,,GCP,INV14569,,GBP,32221.47,GST,Payment for license,Workday,2026-02-18,2026-02-14,2026,02,32221.47,False,payment for license,2026-02-22 23:27:14.356841,Raw_GL_Export.csv,83.92156862745098,0,True,AUS01,5610,True,5610,Postage and Courier,False,False,,Google Cloud,MAPPED,2026-02_GBP,1.955,62992.97385,CONVERTED,29081.766845273953,25872.32663648796,146.0,False,0.0,Wednesday,False,True,True,EX001;EX002;EX004
TXN000187,25-02-2026,24-02-2026,2026-02,AUS01,5500,,Zoom,INV44922,,AUD,41986.93,EXPORT,Payment for subscription,Manual Entry,2026-02-25,2026-02-24,2026,02,41986.93,False,payment for subscription,2026-02-22 23:27:14.356841,Raw_GL_Export.csv,83.92156862745098,0,True,AUS01,5500,True,5500,Marketing,False,False,,Zoom Video Communications,MAPPED,2026-02_AUD,1.0,41986.93,DOMESTIC,28972.634359125877,32785.70497360227,143.0,False,0.0,Wednesday,False,True,True,EX001;EX002
TXN000188,2026-01-19,2026-01-10,2026-01,AUS01,5710,,Hays,INV80795,,GBP,19678.99,GST,Payment for consulting,Manual Entry,2026-01-19,2026-01-10,2026,01,19678.99,False,payment for consulting,2026-02-22 23:27:14.356841,Raw_GL_Export.csv,83.92156862745098,0,True,AUS01,5710,True,5710,Recruitment,False,False,,Hays Recruitment,MAPPED,2026-01_GBP,1.957,38511.78343,CONVERTED,29496.09592285716,24753.031499859637,133.0,False,0.0,Monday,False,True,True,EX001;EX002
TXN000189,01/04/2026,12/29/2025,2026-01,AUS01,5700,,EY Australia,INV57887,PO6571,GBP,2578.24,GST,Payment for services,Manual Entry,2026-04-01,2025-12-29,2026,01,2578.24,False,payment for services,2026-02-22 23:27:14.356841,Raw_GL_Export.csv,83.92156862745098,1,True,AUS01,5700,True,5700,Training,False,False,,EY,MAPPED,2026-01_GBP,1.957,5045.61568,CONVERTED,31110.431902446802,30160.111495086097,141.0,False,0.0,Wednesday,False,True,True,EX002
TXN000190,01/25/2026,01/21/2026,2026-01,AUS01,5120,,Microsoft,INV61131,PO6886,GBP,29766.96,INPUT,Payment for consulting,SAP,2026-01-25,2026-01-21,2026,01,29766.96,False,payment for consulting,2026-02-22 23:27:14.356841,Raw_GL_Export.csv,83.92156862745098,0,True,AUS01,5120,True,5120,Office Supplies,False,False,,Microsoft Corporation,MAPPED,2026-01_GBP,1.957,58253.94072,CONVERTED,34269.00595485611,35424.20705021751,139.0,False,0.0,Sunday,True,True,True,EX002;EX004
TXN000191,21-06-2025,17-06-2025,2025-06,AUS01,5110,,Microsoft,INV74124,PO9856,USD,1238.87,GST-FREE,Payment for subscription,Manual Entry,2025-06-21,2025-06-17,2025,06,1238.87,False,payment for subscription,2026-02-22 23:27:14.356841,Raw_GL_Export.csv,83.92156862745098,0,True,AUS01,5110,True,5110,Utilities,False,False,,Microsoft Corporation,MAPPED,2025-06_USD,1.522,1885.5601399999998,CONVERTED,27865.288293732876,21409.69928933269,146.0,False,0.0,Saturday,True,True,True,EX002
TXN000192,18-02-2026,17-02-2026,2026-02,AUS01,5010,,BCG,INV63150,,AUD,15263.57,GST,Payment for license,Manual Entry,2026-02-18,2026-02-17,2026,02,15263.57,False,payment for license,2026-02-22 23:27:14.356841,Raw_GL_Export.csv,83.92156862745098,0,True,AUS01,5010,True,5010,Employee Benefits,False,False,,Boston Consulting Group,MAPPED,2026-02_AUD,1.0,15263.57,DOMESTIC,27923.213086278203,19430.63083039902,133.0,False,0.0,Wednesday,False,True,True,EX001;EX002
TXN000193,22/01/2026,12/01/2026,2026-01,AUS01,5210,,Salesforce,INV95699,,AUD,33122.14,EXPORT,Payment for license,SAP,2026-01-22,2026-01-12,2026,01,33122.14,False,payment for license,2026-02-22 23:27:14.356841,Raw_GL_Export.csv,83.92156862745098,0,True,AUS01,5210,True,5210,Cloud Services,False,False,,Salesforce Inc,MAPPED,2026-01_AUD,1.0,33122.14,DOMESTIC,31620.56664919015,27460.393400888206,142.0,False,0.0,Thursday,False,True,True,EX001;EX002
TXN000194,08/01/2026,07/01/2026,2026-01,AUS01,5120,,MSFT,INV69793,PO2047,NZD,36951.19,GST,Payment for services,SAP,2026-01-08,2026-01-07,2026,01,36951.19,False,payment for services,2026-02-22 23:27:14.356841,Raw_GL_Export.csv,83.92156862745098,0,True,AUS01,5120,True,5120,Office Supplies,False,False,,Microsoft Corporation,MAPPED,2026-01_NZD,0.9335,34493.935865,CONVERTED,34269.00595485611,35424.20705021751,139.0,False,0.0,Thursday,False,True,True,EX002
TXN000195,16/02/2026,14/02/2026,2026-02,AUS01,5900,,SAP,INV52498,,GBP,15246.71,EXPORT,Payment for license,API Import,2026-02-16,2026-02-14,2026,02,15246.71,False,payment for license,2026-02-22 23:27:14.356841,Raw_GL_Export.csv,83.92156862745098,0,True,AUS01,5900,True,5900,Bank Charges,False,False,,SAP SE,MAPPED,2026-02_GBP,1.955,29807.318049999998,CONVERTED,31670.032329854675,24882.231532617723,172.0,False,0.0,Monday,False,True,True,EX001;EX002
TXN000196,02/05/2026,02/01/2026,2026-02,AUS01,5810,,Microsoft,INV45899,,USD,15164.12,GST,Payment for consulting,Oracle,2026-05-02,2026-01-02,2026,02,15164.12,False,payment for consulting,2026-02-22 23:27:14.356841,Raw_GL_Export.csv,83.92156862745098,1,True,AUS01,5810,True,5810,Amortization,False,False,,Microsoft Corporation,MAPPED,2026-02_USD,1.525,23125.283,CONVERTED,31768.91314562501,27328.351394475325,120.0,False,0.0,Saturday,True,True,True,EX001;EX002;EX007
TXN000197,01/23/2025,01/14/2025,2025-01,AUS01,5120,,Optus Pty,INV27481,,USD,41662.83,GST,Payment for license,Manual Entry,2025-01-23,2025-01-14,2025,01,41662.83,False,payment for license,2026-02-22 23:27:14.356841,Raw_GL_Export.csv,83.92156862745098,0,True,AUS01,5120,True,5120,Office Supplies,False,False,,Optus,MAPPED,2025-01_USD,1.52,63327.5016,CONVERTED,34269.00595485611,35424.20705021751,139.0,False,0.0,Thursday,False,True,True,EX001;EX002;EX004
TXN000198,25/03/2025,24/03/2025,2025-03,AUS01,5500,,Google,INV95426,PO5648,AUD,424.36,GST,Payment for consulting,Manual Entry,2025-03-25,2025-03-24,2025,03,424.36,False,payment for consulting,2026-02-22 23:27:14.356841,Raw_GL_Export.csv,83.92156862745098,0,True,AUS01,5500,True,5500,Marketing,False,False,,Google Cloud,MAPPED,2025-03_AUD,1.0,424.36,DOMESTIC,28972.634359125877,32785.70497360227,143.0,False,0.0,Tuesday,False,True,True,EX002
TXN000199,23/02/2026,19/02/2026,2026-02,AUS01,5110,,PWC,INV90024,PO3949,GBP,18600.21,GST-FREE,Payment for consulting,API Import,2026-02-23,2026-02-19,2026,02,18600.21,False,payment for consulting,2026-02-22 23:27:14.356841,Raw_GL_Export.csv,83.92156862745098,0,True,AUS01,5110,True,5110,Utilities,False,False,,PwC,MAPPED,2026-02_GBP,1.955,36363.41055,CONVERTED,27865.288293732876,21409.69928933269,146.0,False,0.0,Monday,False,True,True,EX002
TXN000200,10/03/2025,09/27/2025,2025-10,AUS01,5410,,AWS,INV91123,PO9842,USD,8716.44,GST,Payment for license,Oracle,2025-03-10,2025-09-27,2025,10,8716.44,False,payment for license,2026-02-22 23:27:14.356841,Raw_GL_Export.csv,83.92156862745098,1,True,AUS01,5410,True,5410,Accommodation,False,False,,Amazon Web Services,MAPPED,2025-10_USD,1.521,13257.70524,CONVERTED,29277.518810999987,22143.12829502557,155.0,False,0.0,Monday,False,True,True,EX002
TXN000201,15/01/2026,10/01/2026,2026-01,AUS01,5010,CC9198,Atlassian Pty,INV75210,,USD,30867.44,EXPORT,Payment for services,SAP,2026-01-15,2026-01-10,2026,01,30867.44,False,payment for services,2026-02-22 23:27:14.356841,Raw_GL_Export.csv,83.92156862745098,0,True,AUS01,5010,True,5010,Employee Benefits,True,False,,Atlassian,MAPPED,2026-01_USD,1.527,47134.580879999994,CONVERTED,27923.213086278203,19430.63083039902,133.0,False,0.0,Thursday,False,True,True,EX001;EX002
TXN000202,07/21/2025,07/16/2025,2025-07,AUS01,5200,CC9445,Deloitte Touche,INV15677,,NZD,27795.19,EXPORT,Payment for services,API Import,2025-07-21,2025-07-16,2025,07,27795.19,False,payment for services,2026-02-22 23:27:14.356841,Raw_GL_Export.csv,83.92156862745098,0,True,AUS01,5200,True,5200,Software Licenses,True,False,,Deloitte,MAPPED,2025-07_NZD,0.934,25960.70746,CONVERTED,30196.543712413786,22166.314759696765,145.0,False,0.0,Monday,False,True,True,EX001;EX002
TXN000203,06/02/2026,05/02/2026,2026-02,AUS01,5500,CC9527,Atlassian Pty,INV87687,PO7865,AUD,40289.05,EXPORT,Payment for goods,Workday,2026-02-06,2026-02-05,2026,02,40289.05,False,payment for goods,2026-02-22 23:27:14.356841,Raw_GL_Export.csv,83.92156862745098,0,True,AUS01,5500,True,5500,Marketing,True,False,,Atlassian,MAPPED,2026-02_AUD,1.0,40289.05,DOMESTIC,28972.634359125877,32785.70497360227,143.0,False,0.0,Friday,False,True,True,EX002
TXN000204,2026-01-08,2026-01-02,2026-01,AUS01,5210,CC9100,Accenture Pty,INV38922,,GBP,39157.9,EXPORT,Payment for license,Manual Entry,2026-01-08,2026-01-02,2026,01,39157.9,False,payment for license,2026-02-22 23:27:14.356841,Raw_GL_Export.csv,83.92156862745098,0,True,AUS01,5210,True,5210,Cloud Services,True,False,,Accenture,MAPPED,2026-01_GBP,1.957,76632.01030000001,CONVERTED,31620.56664919015,27460.393400888206,142.0,False,0.0,Thursday,False,True,True,EX001;EX002;EX004
TXN000205,02-02-2026,30-01-2026,2026-02,AUS01,5200,CC9950,LinkedIn Corp,INV69996,PO6875,USD,17491.13,GST-FREE,Payment for subscription,Oracle,2026-02-02,2026-01-30,2026,02,17491.13,False,payment for subscription,2026-02-22 23:27:14.356841,Raw_GL_Export.csv,83.92156862745098,0,True,AUS01,5200,True,5200,Software Licenses,True,False,,LinkedIn,MAPPED,2026-02_USD,1.525,26673.97325,CONVERTED,30196.543712413786,22166.314759696765,145.0,False,0.0,Monday,False,True,True,EX002
TXN000206,11/06/2025,10/06/2025,2025-06,AUS01,5710,CC9582,MSFT,INV70106,PO6629,NZD,6228.92,EXPORT,Payment for goods,Workday,2025-06-11,2025-06-10,2025,06,6228.92,False,payment for goods,2026-02-22 23:27:14.356841,Raw_GL_Export.csv,83.92156862745098,0,True,AUS01,5710,True,5710,Recruitment,True,False,,Microsoft Corporation,MAPPED,2025-06_NZD,0.931,5799.12452,CONVERTED,29496.09592285716,24753.031499859637,133.0,False,0.0,Wednesday,False,True,True,EX002
TXN000207,20/01/2026,10/01/2026,2026-01,AUS01,5120,CC9591,ServiceNow Inc,INV38369,PO8581,AUD,18585.16,EXPORT,Payment for subscription,SAP,2026-01-20,2026-01-10,2026,01,18585.16,False,payment for subscription,2026-02-22 23:27:14.356841,Raw_GL_Export.csv,83.92156862745098,0,True,AUS01,5120,True,5120,Office Supplies,True,False,,ServiceNow,MAPPED,2026-01_AUD,1.0,18585.16,DOMESTIC,34269.00595485611,35424.20705021751,139.0,False,0.0,Tuesday,False,True,True,EX002
TXN000208,24-02-2026,20-02-2026,2026-02,AUS01,5210,CC9335,Telstra Corp,INV85196,PO7844,USD,40142.84,GST-FREE,Payment for services,SAP,2026-02-24,2026-02-20,2026,02,40142.84,False,payment for services,2026-02-22 23:27:14.356841,Raw_GL_Export.csv,83.92156862745098,0,True,AUS01,5210,True,5210,Cloud Services,True,False,,Telstra,MAPPED,2026-02_USD,1.525,61217.83099999999,CONVERTED,31620.56664919015,27460.393400888206,142.0,False,0.0,Tuesday,False,True,True,EX002;EX004
TXN000209,2026-01-16,2026-01-09,2026-01,AUS01,5510,CC9403,Seek Limited,INV20890,PO1203,AUD,20414.62,GST-FREE,Payment for consulting,Oracle,2026-01-16,2026-01-09,2026,01,20414.62,False,payment for consulting,2026-02-22 23:27:14.356841,Raw_GL_Export.csv,83.92156862745098,0,True,AUS01,5510,True,5510,Advertising,True,False,,Seek,MAPPED,2026-01_AUD,1.0,20414.62,DOMESTIC,28498.583342781956,23667.16979723599,133.0,False,0.0,Friday,False,True,True,EX002
TXN000210,01/05/2026,12/31/2025,2026-01,AUS01,5210,CC9663,Google,INV31207,PO1399,AUD,21642.25,INPUT,Payment for consulting,Manual Entry,2026-05-01,2025-12-31,2026,01,21642.25,False,payment for consulting,2026-02-22 23:27:14.356841,Raw_GL_Export.csv,83.92156862745098,1,True,AUS01,5210,True,5210,Cloud Services,True,False,,Google Cloud,MAPPED,2026-01_AUD,1.0,21642.25,DOMESTIC,31620.56664919015,27460.393400888206,142.0,False,0.0,Friday,False,True,True,EX002
TXN000211,25/05/2025,18/05/2025,2025-05,AUS01,5120,CC9808,Regus Australia,INV92222,,GBP,31705.2,GST,Payment for subscription,API Import,2025-05-25,2025-05-18,2025,05,31705.2,False,payment for subscription,2026-02-22 23:27:14.356841,Raw_GL_Export.csv,83.92156862745098,0,True,AUS01,5120,True,5120,Office Supplies,True,False,,Regus,MAPPED,2025-05_GBP,1.948,61761.7296,CONVERTED,34269.00595485611,35424.20705021751,139.0,False,0.0,Sunday,True,True,True,EX001;EX002;EX004
TXN000212,01/02/2026,12/26/2025,2026-01,AUS01,5810,CC9276,Workday,INV17184,PO6963,AUD,27958.44,INPUT,Payment for services,SAP,2026-02-01,2025-12-26,2026,01,27958.44,False,payment for services,2026-02-22 23:27:14.356841,Raw_GL_Export.csv,83.92156862745098,1,True,AUS01,5810,True,5810,Amortization,True,False,,Workday Inc,MAPPED,2026-01_AUD,1.0,27958.44,DOMESTIC,31768.91314562501,27328.351394475325,120.0,False,0.0,Sunday,True,True,True,EX002
TXN000213,11/13/2025,11/05/2025,2025-11,AUS01,5610,CC9041,Regus Australia,INV83499,PO4354,NZD,7969.51,GST,Payment for goods,Workday,2025-11-13,2025-05-11,2025,11,7969.51,False,payment for goods,2026-02-22 23:27:14.356841,Raw_GL_Export.csv,83.92156862745098,0,True,AUS01,5610,True,5610,Postage and Courier,True,False,,Regus,MAPPED,2025-11_NZD,0.933,7435.5528300000005,CONVERTED,29081.766845273953,25872.32663648796,146.0,False,0.0,Thursday,False,True,True,EX002
TXN000214,2026-02-08,2026-01-31,2026-02,AUS01,5800,CC9961,Workday,INV76003,PO5540,USD,14488.83,INPUT,Payment for services,SAP,2026-02-08,2026-01-31,2026,02,14488.83,False,payment for services,2026-02-22 23:27:14.356841,Raw_GL_Export.csv,83.92156862745098,0,True,AUS01,5800,True,5800,Depreciation,True,False,,Workday Inc,MAPPED,2026-02_USD,1.525,22095.46575,CONVERTED,30184.39373025477,34245.09535020032,157.0,False,0.0,Sunday,True,True,True,EX002
TXN000215,09/12/2025,09/04/2025,2025-09,AUS01,5500,CC9513,Atlassian Pty,INV69241,PO2075,GBP,31971.16,INPUT,Payment for goods,Manual Entry,2025-12-09,2025-04-09,2025,09,31971.16,False,payment for goods,2026-02-22 23:27:14.356841,Raw_GL_Export.csv,83.92156862745098,1,True,AUS01,5500,True,5500,Marketing,True,False,,Atlassian,MAPPED,2025-09_GBP,1.949,62311.79084,CONVERTED,28972.634359125877,32785.70497360227,143.0,False,0.0,Tuesday,False,True,True,EX002;EX004
TXN000216,2026-02-03,2026-01-27,2026-02,AUS01,5120,CC9295,Salesforce,INV29392,PO4346,AUD,7498.0,GST,Payment for license,SAP,2026-02-03,2026-01-27,2026,02,7498.0,False,payment for license,2026-02-22 23:27:14.356841,Raw_GL_Export.csv,83.92156862745098,0,True,AUS01,5120,True,5120,Office Supplies,True,False,,Salesforce Inc,MAPPED,2026-02_AUD,1.0,7498.0,DOMESTIC,34269.00595485611,35424.20705021751,139.0,False,0.0,Tuesday,False,True,True,EX002
TXN000217,10-02-2026,01-02-2026,2026-02,AUS01,5110,CC9485,WeWork Australia,INV48209,,GBP,20029.32,GST,Payment for services,Oracle,2026-02-10,2026-02-01,2026,02,20029.32,False,payment for services,2026-02-22 23:27:14.356841,Raw_GL_Export.csv,83.92156862745098,0,True,AUS01,5110,True,5110,Utilities,True,False,,WeWork,MAPPED,2026-02_GBP,1.955,39157.3206,CONVERTED,27865.288293732876,21409.69928933269,146.0,False,0.0,Tuesday,False,True,True,EX001;EX002
TXN000218,05/27/2025,05/20/2025,2025-05,AUS01,5600,CC9351,McKinsey,INV70031,PO3161,GBP,26741.74,EXPORT,Payment for subscription,Oracle,2025-05-27,2025-05-20,2025,05,26741.74,False,payment for subscription,2026-02-22 23:27:14.356841,Raw_GL_Export.csv,83.92156862745098,0,True,AUS01,5600,True,5600,Telecommunications,True,False,,McKinsey & Company,MAPPED,2025-05_GBP,1.948,52092.90952,CONVERTED,32190.120230168057,26805.910450208805,119.0,False,0.0,Tuesday,False,True,True,EX002;EX004
TXN000219,04/26/2025,04/22/2025,2025-04,AUS01,5500,CC9380,KPMG Australia,INV69759,PO3634,AUD,6760.39,INPUT,Payment for license,Workday,2025-04-26,2025-04-22,2025,04,6760.39,False,payment for license,2026-02-22 23:27:14.356841,Raw_GL_Export.csv,83.92156862745098,0,True,AUS01,5500,True,5500,Marketing,True,False,,KPMG,MAPPED,2025-04_AUD,1.0,6760.39,DOMESTIC,28972.634359125877,32785.70497360227,143.0,False,0.0,Saturday,True,True,True,EX002
TXN000220,06/12/2025,03/12/2025,2025-12,AUS01,5120,CC9243,Atlassian Pty,INV67788,,AUD,44720.41,GST-FREE,Payment for goods,Oracle,2025-12-06,2025-12-03,2025,12,44720.41,False,payment for goods,2026-02-22 23:27:14.356841,Raw_GL_Export.csv,83.92156862745098,0,True,AUS01,5120,True,5120,Office Supplies,True,False,,Atlassian,MAPPED,2025-12_AUD,1.0,44720.41,DOMESTIC,34269.00595485611,35424.20705021751,139.0,False,0.0,Saturday,True,True,True,EX001;EX002
TXN000221,2025-12-18,2025-12-12,2025-12,AUS01,5320,CC9151,Regus Australia,INV79945,PO1408,GBP,24340.01,GST-FREE,Payment for consulting,Manual Entry,2025-12-18,2025-12-12,2025,12,24340.01,False,payment for consulting,2026-02-22 23:27:14.356841,Raw_GL_Export.csv,83.92156862745098,0,True,AUS01,5320,True,5320,Audit Fees,True,False,,Regus,MAPPED,2025-12_GBP,1.953,47536.03953,CONVERTED,31658.610713475173,32284.527206153973,141.0,False,0.0,Thursday,False,True,True,EX002
TXN000222,25/12/2025,17/12/2025,2025-12,AUS01,5310,CC9159,AWS,INV72116,PO3409,NZD,29161.25,INPUT,Payment for license,Manual Entry,2025-12-25,2025-12-17,2025,12,29161.25,False,payment for license,2026-02-22 23:27:14.356841,Raw_GL_Export.csv,83.92156862745098,0,True,AUS01,5310,True,5310,Legal Fees,True,False,,Amazon Web Services,MAPPED,2025-12_NZD,0.9305,27134.543125,CONVERTED,33139.04129260232,28423.631835285127,171.0,False,0.0,Thursday,False,True,True,EX002
TXN000223,2026-02-11,2026-02-03,2026-02,AUS01,5010,CC9142,Atlassian Pty,INV68454,PO6347,NZD,1213.32,GST-FREE,Payment for services,API Import,2026-02-11,2026-02-03,2026,02,1213.32,False,payment for services,2026-02-22 23:27:14.356841,Raw_GL_Export.csv,83.92156862745098,0,True,AUS01,5010,True,5010,Employee Benefits,True,False,,Atlassian,MAPPED,2026-02_NZD,0.932,1130.81424,CONVERTED,27923.213086278203,19430.63083039902,133.0,False,0.0,Wednesday,False,True,True,EX002
TXN000224,21/01/2026,11/01/2026,2026-01,AUS01,5510,CC9227,PWC,INV98744,PO2431,USD,1112.43,EXPORT,Payment for license,Manual Entry,2026-01-21,2026-01-11,2026,01,1112.43,False,payment for license,2026-02-22 23:27:14.356841,Raw_GL_Export.csv,83.92156862745098,0,True,AUS01,5510,True,5510,Advertising,True,False,,PwC,MAPPED,2026-01_USD,1.527,1698.68061,CONVERTED,28498.583342781956,23667.16979723599,133.0,False,0.0,Wednesday,False,True,True,EX002
TXN000225,07-01-2026,01-01-2026,2026-01,AUS01,5610,CC9619,Robert Half International,INV62108,,AUD,40889.27,INPUT,Payment for consulting,Workday,2026-01-07,2026-01-01,2026,01,40889.27,False,payment for consulting,2026-02-22 23:27:14.356841,Raw_GL_Export.csv,83.92156862745098,0,True,AUS01,5610,True,5610,Postage and Courier,True,False,,Robert Half,MAPPED,2026-01_AUD,1.0,40889.27,DOMESTIC,29081.766845273953,25872.32663648796,146.0,False,0.0,Wednesday,False,True,True,EX001;EX002
TXN000226,01/13/2026,01/12/2026,2026-01,AUS01,5300,CC9353,WeWork Australia,INV38271,PO8278,NZD,43990.81,GST,Payment for consulting,Manual Entry,2026-01-13,2026-12-01,2026,01,43990.81,False,payment for consulting,2026-02-22 23:27:14.356841,Raw_GL_Export.csv,83.92156862745098,0,True,AUS01,5300,True,5300,Professional Services,True,False,,WeWork,MAPPED,2026-01_NZD,0.9335,41065.421135,CONVERTED,33232.533450429684,35951.49997313202,128.0,False,0.0,Tuesday,False,True,True,EX002
TXN000227,10/01/2026,03/01/2026,2026-01,AUS01,5800,CC9917,AusPost,INV28827,,USD,37614.47,GST,Payment for consulting,API Import,2026-01-10,2026-01-03,2026,01,37614.47,False,payment for consulting,2026-02-22 23:27:14.356841,Raw_GL_Export.csv,83.92156862745098,0,True,AUS01,5800,True,5800,Depreciation,True,False,,Australia Post,MAPPED,2026-01_USD,1.527,57437.29569,CONVERTED,30184.39373025477,34245.09535020032,157.0,False,0.0,Saturday,True,True,True,EX001;EX002;EX004
TXN000228,2026-01-11,2026-01-01,2026-01,AUS01,5810,CC9384,Google,INV64331,,AUD,18484.78,INPUT,Payment for consulting,API Import,2026-01-11,2026-01-01,2026,01,18484.78,False,payment for consulting,2026-02-22 23:27:14.356841,Raw_GL_Export.csv,83.92156862745098,0,True,AUS01,5810,True,5810,Amortization,True,False,,Google Cloud,MAPPED,2026-01_AUD,1.0,18484.78,DOMESTIC,31768.91314562501,27328.351394475325,120.0,False,0.0,Sunday,True,True,True,EX001;EX002
TXN000229,25/01/2026,21/01/2026,2026-01,AUS01,5120,CC9852,Federal Express,INV49582,PO5979,NZD,24968.63,GST,Payment for consulting,API Import,2026-01-25,2026-01-21,2026,01,24968.63,False,payment for consulting,2026-02-22 23:27:14.356841,Raw_GL_Export.csv,83.92156862745098,0,True,AUS01,5120,True,5120,Office Supplies,True,False,,FedEx,MAPPED,2026-01_NZD,0.9335,23308.216105,CONVERTED,34269.00595485611,35424.20705021751,139.0,False,0.0,Sunday,True,True,True,EX002
TXN000230,24-02-2026,20-02-2026,2026-02,AUS01,5000,CC9810,AWS,INV26276,PO5713,USD,11894.2,EXPORT,Payment for consulting,Oracle,2026-02-24,2026-02-20,2026,02,11894.2,False,payment for consulting,2026-02-22 23:27:14.356841,Raw_GL_Export.csv,83.92156862745098,0,True,AUS01,5000,True,5000,Salaries and Wages,True,False,,Amazon Web Services,MAPPED,2026-02_USD,1.525,18138.655,CONVERTED,30471.385558248177,22939.768434623154,137.0,False,0.0,Tuesday,False,True,True,EX002
TXN000231,16/01/2026,15/01/2026,2026-01,AUS01,5100,CC9783,PWC,INV88497,PO8872,GBP,44745.55,GST,Payment for license,Manual Entry,2026-01-16,2026-01-15,2026,01,44745.55,False,payment for license,2026-02-22 23:27:14.356841,Raw_GL_Export.csv,83.92156862745098,0,True,AUS01,5100,True,5100,Office Rent,True,False,,PwC,MAPPED,2026-01_GBP,1.957,87567.04135000001,CONVERTED,29138.02959753333,27547.65120166844,150.0,False,0.0,Friday,False,True,True,EX002;EX004
TXN000232,10/28/2025,10/20/2025,2025-10,AUS01,5710,CC9837,Atlassian Pty,INV44018,,NZD,23112.41,GST,Payment for services,Oracle,2025-10-28,2025-10-20,2025,10,23112.41,False,payment for services,2026-02-22 23:27:14.356841,Raw_GL_Export.csv,83.92156862745098,0,True,AUS01,5710,True,5710,Recruitment,True,False,,Atlassian,MAPPED,2025-10_NZD,0.929,21471.42889,CONVERTED,29496.09592285716,24753.031499859637,133.0,False,0.0,Tuesday,False,True,True,EX001;EX002
TXN000233,11-02-2025,08-02-2025,2025-02,AUS01,5320,CC9167,MSFT,INV16385,,NZD,16316.24,INPUT,Payment for license,SAP,2025-02-11,2025-02-08,2025,02,16316.24,False,payment for license,2026-02-22 23:27:14.356841,Raw_GL_Export.csv,83.92156862745098,0,True,AUS01,5320,True,5320,Audit Fees,True,False,,Microsoft Corporation,MAPPED,2025-02_NZD,0.925,15092.522,CONVERTED,31658.610713475173,32284.527206153973,141.0,False,0.0,Tuesday,False,True,True,EX001;EX002
TXN000234,17/02/2026,14/02/2026,2026-02,AUS01,5810,CC9096,Adobe,INV45580,PO6939,NZD,39272.7,INPUT,Payment for services,API Import,2026-02-17,2026-02-14,2026,02,39272.7,False,payment for services,2026-02-22 23:27:14.356841,Raw_GL_Export.csv,83.92156862745098,0,True,AUS01,5810,True,5810,Amortization,True,False,,Adobe Systems,MAPPED,2026-02_NZD,0.932,36602.1564,CONVERTED,31768.91314562501,27328.351394475325,120.0,False,0.0,Tuesday,False,True,True,EX002
TXN000235,12/19/2025,12/16/2025,2025-12,AUS01,5000,CC9140,KPMG Australia,INV54605,PO3671,NZD,35068.47,EXPORT,Payment for services,Oracle,2025-12-19,2025-12-16,2025,12,35068.47,False,payment for services,2026-02-22 23:27:14.356841,Raw_GL_Export.csv,83.92156862745098,0,True,AUS01,5000,True,5000,Salaries and Wages,True,False,,KPMG,MAPPED,2025-12_NZD,0.9305,32631.211335,CONVERTED,30471.385558248177,22939.768434623154,137.0,False,0.0,Friday,False,True,True,EX002
TXN000236,05/02/2026,01/02/2026,2026-02,AUS01,5900,CC9918,Atlassian Pty,INV25278,PO1284,GBP,20776.06,GST,Payment for consulting,Workday,2026-02-05,2026-02-01,2026,02,20776.06,False,payment for consulting,2026-02-22 23:27:14.356841,Raw_GL_Export.csv,83.92156862745098,0,True,AUS01,5900,True,5900,Bank Charges,True,False,,Atlassian,MAPPED,2026-02_GBP,1.955,40617.19730000001,CONVERTED,31670.032329854675,24882.231532617723,172.0,False,0.0,Thursday,False,True,True,EX002
TXN000237,01/10/2026,01/07/2026,2026-01,AUS01,5910,CC9452,BCG,INV25544,,USD,31974.28,GST,Payment for goods,Oracle,2026-10-01,2026-07-01,2026,01,31974.28,False,payment for goods,2026-02-22 23:27:14.356841,Raw_GL_Export.csv,83.92156862745098,1,True,AUS01,5910,True,5910,Interest Expense,True,False,,Boston Consulting Group,MAPPED,2026-01_USD,1.527,48824.72556,CONVERTED,33774.54824600841,21661.31598456901,119.0,False,0.0,Thursday,False,True,True,EX001;EX002
TXN000238,10/01/2026,06/01/2026,2026-01,AUS01,5110,CC9080,Telstra Corp,INV66524,,AUD,3590.31,EXPORT,Payment for services,SAP,2026-01-10,2026-01-06,2026,01,3590.31,False,payment for services,2026-02-22 23:27:14.356841,Raw_GL_Export.csv,83.92156862745098,0,True,AUS01,5110,True,5110,Utilities,True,False,,Telstra,MAPPED,2026-01_AUD,1.0,3590.31,DOMESTIC,27865.288293732876,21409.69928933269,146.0,False,0.0,Saturday,True,True,True,EX001;EX002
TXN000239,2026-02-26,2026-02-18,2026-02,AUS01,5100,CC9930,Deloitte Touche,INV22648,PO4365,AUD,3074.51,GST,Payment for license,Oracle,2026-02-26,2026-02-18,2026,02,3074.51,False,payment for license,2026-02-22 23:27:14.356841,Raw_GL_Export.csv,83.92156862745098,0,True,AUS01,5100,True,5100,Office Rent,True,False,,Deloitte,MAPPED,2026-02_AUD,1.0,3074.51,DOMESTIC,29138.02959753333,27547.65120166844,150.0,False,0.0,Thursday,False,True,True,EX002
TXN000240,04/06/2025,04/05/2025,2025-04,AUS01,5020,CC9149,PWC,INV76179,PO2623,NZD,15913.93,GST-FREE,Payment for license,SAP,2025-06-04,2025-05-04,2025,04,15913.93,False,payment for license,2026-02-22 23:27:14.356841,Raw_GL_Export.csv,83.92156862745098,1,True,AUS01,5020,True,5020,Contractor Fees,True,False,,PwC,MAPPED,2025-04_NZD,0.932,14831.782760000002,CONVERTED,28445.577844280295,21241.721119146277,132.0,False,0.0,Wednesday,False,True,True,EX002
TXN000241,17/01/2026,13/01/2026,2026-01,AUS01,5300,CC9175,AWS,INV58033,PO4033,AUD,41598.02,EXPORT,Payment for consulting,SAP,2026-01-17,2026-01-13,2026,01,41598.02,False,payment for consulting,2026-02-22 23:27:14.356841,Raw_GL_Export.csv,83.92156862745098,0,True,AUS01,5300,True,5300,Professional Services,True,False,,Amazon Web Services,MAPPED,2026-01_AUD,1.0,41598.02,DOMESTIC,33232.533450429684,35951.49997313202,128.0,False,0.0,Saturday,True,True,True,EX002
TXN000242,10/06/2025,09/29/2025,2025-10,AUS01,5410,CC9219,Robert Half International,INV26202,PO9515,USD,18400.25,INPUT,Payment for goods,Manual Entry,2025-06-10,2025-09-29,2025,10,18400.25,False,payment for goods,2026-02-22 23:27:14.356841,Raw_GL_Export.csv,83.92156862745098,1,True,AUS01,5410,True,5410,Accommodation,True,False,,Robert Half,MAPPED,2025-10_USD,1.521,27986.78025,CONVERTED,29277.518810999987,22143.12829502557,155.0,False,0.0,Tuesday,False,True,True,EX002
TXN000243,05/25/2025,05/20/2025,2025-05,AUS01,5520,CC9739,Microsoft,INV60434,,AUD,14832.38,GST,Payment for license,Workday,2025-05-25,2025-05-20,2025,05,14832.38,False,payment for license,2026-02-22 23:27:14.356841,Raw_GL_Export.csv,83.92156862745098,0,True,AUS01,5520,True,5520,Events,True,False,,Microsoft Corporation,MAPPED,2025-05_AUD,1.0,14832.38,DOMESTIC,30860.276023483882,21900.267908653983,155.0,False,0.0,Sunday,True,True,True,EX001;EX002
TXN000244,22-01-2026,18-01-2026,2026-01,AUS01,5520,CC9417,KPMG Australia,INV72347,PO7020,GBP,8576.45,GST,Payment for goods,SAP,2026-01-22,2026-01-18,2026,01,8576.45,False,payment for goods,2026-02-22 23:27:14.356841,Raw_GL_Export.csv,83.92156862745098,0,True,AUS01,5520,True,5520,Events,True,False,,KPMG,MAPPED,2026-01_GBP,1.957,16784.112650000003,CONVERTED,30860.276023483882,21900.267908653983,155.0,False,0.0,Thursday,False,True,True,EX002
TXN000245,22-02-2026,20-02-2026,2026-02,AUS01,5400,CC9448,Google,INV87405,PO3764,AUD,6537.2,EXPORT,Payment for services,Workday,2026-02-22,2026-02-20,2026,02,6537.2,False,payment for services,2026-02-22 23:27:14.356841,Raw_GL_Export.csv,83.92156862745098,0,True,AUS01,5400,True,5400,Travel,True,False,,Google Cloud,MAPPED,2026-02_AUD,1.0,6537.2,DOMESTIC,31663.682660000006,30146.476988256833,133.0,False,0.0,Sunday,True,True,True,EX002
TXN000246,01/07/2026,01/03/2026,2026-01,AUS01,5610,CC9864,DHL Express,INV75419,,AUD,10555.85,EXPORT,Payment for license,API Import,2026-07-01,2026-03-01,2026,01,10555.85,False,payment for license,2026-02-22 23:27:14.356841,Raw_GL_Export.csv,83.92156862745098,1,True,AUS01,5610,True,5610,Postage and Courier,True,False,,DHL,MAPPED,2026-01_AUD,1.0,10555.85,DOMESTIC,29081.766845273953,25872.32663648796,146.0,False,0.0,Wednesday,False,True,True,EX001;EX002
TXN000247,09-02-2026,03-02-2026,2026-02,AUS01,5500,CC9682,DHL Express,INV69589,,GBP,23062.51,GST-FREE,Payment for subscription,Manual Entry,2026-02-09,2026-02-03,2026,02,23062.51,False,payment for subscription,2026-02-22 23:27:14.356841,Raw_GL_Export.csv,83.92156862745098,0,True,AUS01,5500,True,5500,Marketing,True,False,,DHL,MAPPED,2026-02_GBP,1.955,45087.20705,CONVERTED,28972.634359125877,32785.70497360227,143.0,False,0.0,Monday,False,True,True,EX001;EX002
TXN000248,16/02/2026,13/02/2026,2026-02,AUS01,5000,CC9101,MSFT,INV33474,PO6356,AUD,22466.26,GST,Payment for goods,Workday,2026-02-16,2026-02-13,2026,02,22466.26,False,payment for goods,2026-02-22 23:27:14.356841,Raw_GL_Export.csv,83.92156862745098,0,True,AUS01,5000,True,5000,Salaries and Wages,True,False,,Microsoft Corporation,MAPPED,2026-02_AUD,1.0,22466.26,DOMESTIC,30471.385558248177,22939.768434623154,137.0,False,0.0,Monday,False,True,True,EX002
TXN000249,2025-08-20,2025-08-18,2025-08,AUS01,5700,CC9769,Hays,INV74258,PO9887,GBP,9166.74,EXPORT,Payment for subscription,API Import,2025-08-20,2025-08-18,2025,08,9166.74,False,payment for subscription,2026-02-22 23:27:14.356841,Raw_GL_Export.csv,83.92156862745098,0,True,AUS01,5700,True,5700,Training,True,False,,Hays Recruitment,MAPPED,2025-08_GBP,1.954,17911.80996,CONVERTED,31110.431902446802,30160.111495086097,141.0,False,0.0,Wednesday,False,True,True,EX002
TXN000250,2026-02-18,2026-02-17,2026-02,AUS01,5410,CC9901,Atlassian Pty,INV68006,PO1538,GBP,20310.19,EXPORT,Payment for goods,API Import,2026-02-18,2026-02-17,2026,02,20310.19,False,payment for goods,2026-02-22 23:27:14.356841,Raw_GL_Export.csv,83.92156862745098,0,True,AUS01,5410,True,5410,Accommodation,True,False,,Atlassian,MAPPED,2026-02_GBP,1.955,39706.42145,CONVERTED,29277.518810999987,22143.12829502557,155.0,False,0.0,Wednesday,False,True,True,EX002
TXN000251,01/22/2026,01/19/2026,2026-01,AUS01,5500,CC9441,Slack,INV24336,PO9037,NZD,32235.97,EXPORT,Payment for license,API Import,2026-01-22,2026-01-19,2026,01,32235.97,False,payment for license,2026-02-22 23:27:14.356841,Raw_GL_Export.csv,83.92156862745098,0,True,AUS01,5500,True,5500,Marketing,True,False,,Slack Technologies,MAPPED,2026-01_NZD,0.9335,30092.277995,CONVERTED,28972.634359125877,32785.70497360227,143.0,False,0.0,Thursday,False,True,True,EX002
TXN000252,19-01-2026,11-01-2026,2026-01,AUS01,5520,CC9874,Adobe,INV87469,PO6779,AUD,17673.18,EXPORT,Payment for subscription,Workday,2026-01-19,2026-01-11,2026,01,17673.18,False,payment for subscription,2026-02-22 23:27:14.356841,Raw_GL_Export.csv,83.92156862745098,0,True,AUS01,5520,True,5520,Events,True,False,,Adobe Systems,MAPPED,2026-01_AUD,1.0,17673.18,DOMESTIC,30860.276023483882,21900.267908653983,155.0,False,0.0,Monday,False,True,True,EX002
TXN000253,2025-07-02,2025-06-22,2025-07,AUS01,5010,CC9131,Regus Australia,INV91940,PO2594,NZD,36448.95,GST,Payment for consulting,Workday,2025-07-02,2025-06-22,2025,07,36448.95,False,payment for consulting,2026-02-22 23:27:14.356841,Raw_GL_Export.csv,83.92156862745098,0,True,AUS01,5010,True,5010,Employee Benefits,True,False,,Regus,MAPPED,2025-07_NZD,0.934,34043.319299999996,CONVERTED,27923.213086278203,19430.63083039902,133.0,False,0.0,Wednesday,False,True,True,EX002
TXN000254,12-02-2026,06-02-2026,2026-02,AUS01,5010,CC9677,Accenture Pty,INV87664,,USD,10634.53,INPUT,Payment for services,Workday,2026-02-12,2026-02-06,2026,02,10634.53,False,payment for services,2026-02-22 23:27:14.356841,Raw_GL_Export.csv,83.92156862745098,0,True,AUS01,5010,True,5010,Employee Benefits,True,False,,Accenture,MAPPED,2026-02_USD,1.525,16217.65825,CONVERTED,27923.213086278203,19430.63083039902,133.0,False,0.0,Thursday,False,True,True,EX001;EX002
TXN000255,02/04/2026,02/01/2026,2026-02,AUS01,5000,CC9551,McKinsey,INV84455,PO7900,AUD,20794.83,EXPORT,Payment for subscription,SAP,2026-04-02,2026-01-02,2026,02,20794.83,False,payment for subscription,2026-02-22 23:27:14.356841,Raw_GL_Export.csv,83.92156862745098,1,True,AUS01,5000,True,5000,Salaries and Wages,True,False,,McKinsey & Company,MAPPED,2026-02_AUD,1.0,20794.83,DOMESTIC,30471.385558248177,22939.768434623154,137.0,False,0.0,Thursday,False,True,True,EX002;EX007
TXN000256,23-02-2026,13-02-2026,2026-02,AUS01,5000,CC9324,Federal Express,INV74010,,GBP,14576.72,GST,Payment for goods,Workday,2026-02-23,2026-02-13,2026,02,14576.72,False,payment for goods,2026-02-22 23:27:14.356841,Raw_GL_Export.csv,83.92156862745098,0,True,AUS01,5000,True,5000,Salaries and Wages,True,False,,FedEx,MAPPED,2026-02_GBP,1.955,28497.4876,CONVERTED,30471.385558248177,22939.768434623154,137.0,False,0.0,Monday,False,True,True,EX001;EX002
TXN000257,02/16/2026,02/13/2026,2026-02,AUS01,5610,CC9306,Regus Australia,INV80232,,GBP,9158.96,GST,Payment for subscription,SAP,2026-02-16,2026-02-13,2026,02,9158.96,False,payment for subscription,2026-02-22 23:27:14.356841,Raw_GL_Export.csv,83.92156862745098,0,True,AUS01,5610,True,5610,Postage and Courier,True,False,,Regus,MAPPED,2026-02_GBP,1.955,17905.766799999998,CONVERTED,29081.766845273953,25872.32663648796,146.0,False,0.0,Monday,False,True,True,EX001;EX002
TXN000258,10-02-2026,06-02-2026,2026-02,AUS01,5610,CC9760,Google,INV18817,PO9700,AUD,26674.72,INPUT,Payment for consulting,Manual Entry,2026-02-10,2026-02-06,2026,02,26674.72,False,payment for consulting,2026-02-22 23:27:14.356841,Raw_GL_Export.csv,83.92156862745098,0,True,AUS01,5610,True,5610,Postage and Courier,True,False,,Google Cloud,MAPPED,2026-02_AUD,1.0,26674.72,DOMESTIC,29081.766845273953,25872.32663648796,146.0,False,0.0,Tuesday,False,True,True,EX002
TXN000259,02/07/2026,02/05/2026,2026-02,AUS01,5620,CC9843,EY Australia,INV36224,PO5116,NZD,19537.68,INPUT,Payment for license,API Import,2026-07-02,2026-05-02,2026,02,19537.68,False,payment for license,2026-02-22 23:27:14.356841,Raw_GL_Export.csv,83.92156862745098,1,True,AUS01,5620,True,5620,Insurance,True,False,,EY,MAPPED,2026-02_NZD,0.932,18209.11776,CONVERTED,32410.971605588227,27490.799177232966,170.0,False,0.0,Thursday,False,True,True,EX002;EX007
TXN000260,15/01/2026,14/01/2026,2026-01,AUS01,5620,CC9720,Oracle,INV45118,PO9728,GBP,9661.58,EXPORT,Payment for license,Manual Entry,2026-01-15,2026-01-14,2026,01,9661.58,False,payment for license,2026-02-22 23:27:14.356841,Raw_GL_Export.csv,83.92156862745098,0,True,AUS01,5620,True,5620,Insurance,True,False,,Oracle Corporation,MAPPED,2026-01_GBP,1.957,18907.71206,CONVERTED,32410.971605588227,27490.799177232966,170.0,False,0.0,Thursday,False,True,True,EX002
TXN000261,2026-01-19,2026-01-10,2026-01,AUS01,5200,CC9373,LinkedIn Corp,INV67067,PO2055,USD,10892.79,INPUT,Payment for goods,Manual Entry,2026-01-19,2026-01-10,2026,01,10892.79,False,payment for goods,2026-02-22 23:27:14.356841,Raw_GL_Export.csv,83.92156862745098,0,True,AUS01,5200,True,5200,Software Licenses,True,False,,LinkedIn,MAPPED,2026-01_USD,1.527,16633.29033,CONVERTED,30196.543712413786,22166.314759696765,145.0,False,0.0,Monday,False,True,True,EX002
TXN000262,01/09/2026,01/06/2026,2026-01,AUS01,5220,CC9703,Accenture Pty,INV35154,,GBP,10807.91,GST-FREE,Payment for subscription,Manual Entry,2026-09-01,2026-06-01,2026,01,10807.91,False,payment for subscription,2026-02-22 23:27:14.356841,Raw_GL_Export.csv,83.92156862745098,1,True,AUS01,5220,True,5220,IT Support,True,False,,Accenture,MAPPED,2026-01_GBP,1.957,21151.07987,CONVERTED,29540.94372533058,19404.169897416657,121.0,False,0.0,Tuesday,False,True,True,EX001;EX002
TXN000263,16-01-2026,09-01-2026,2026-01,AUS01,5620,CC9927,Microsoft,INV13819,,USD,7255.2,GST-FREE,Payment for subscription,API Import,2026-01-16,2026-01-09,2026,01,7255.2,False,payment for subscription,2026-02-22 23:27:14.356841,Raw_GL_Export.csv,83.92156862745098,0,True,AUS01,5620,True,5620,Insurance,True,False,,Microsoft Corporation,MAPPED,2026-01_USD,1.527,11078.6904,CONVERTED,32410.971605588227,27490.799177232966,170.0,False,0.0,Friday,False,True,True,EX001;EX002
TXN000264,2026-01-06,2025-12-29,2026-01,AUS01,5900,CC9020,MSFT,INV18333,PO7668,AUD,14194.32,INPUT,Payment for subscription,SAP,2026-01-06,2025-12-29,2026,01,14194.32,False,payment for subscription,2026-02-22 23:27:14.356841,Raw_GL_Export.csv,83.92156862745098,0,True,AUS01,5900,True,5900,Bank Charges,True,False,,Microsoft Corporation,MAPPED,2026-01_AUD,1.0,14194.32,DOMESTIC,31670.032329854675,24882.231532617723,172.0,False,0.0,Tuesday,False,True,True,EX002
TXN000265,13/02/2026,09/02/2026,2026-02,AUS01,5100,CC9584,Robert Half International,INV75070,PO4900,AUD,23535.89,INPUT,Payment for license,SAP,2026-02-13,2026-02-09,2026,02,23535.89,False,payment for license,2026-02-22 23:27:14.356841,Raw_GL_Export.csv,83.92156862745098,0,True,AUS01,5100,True,5100,Office Rent,True,False,,Robert Half,MAPPED,2026-02_AUD,1.0,23535.89,DOMESTIC,29138.02959753333,27547.65120166844,150.0,False,0.0,Friday,False,True,True,EX002
TXN000266,10/25/2025,10/19/2025,2025-10,AUS01,5910,CC9598,Federal Express,INV28910,,USD,42103.95,GST-FREE,Payment for goods,Workday,2025-10-25,2025-10-19,2025,10,42103.95,False,payment for goods,2026-02-22 23:27:14.356841,Raw_GL_Export.csv,83.92156862745098,0,True,AUS01,5910,True,5910,Interest Expense,True,False,,FedEx,MAPPED,2025-10_USD,1.521,64040.10794999999,CONVERTED,33774.54824600841,21661.31598456901,119.0,False,0.0,Saturday,True,True,True,EX001;EX002;EX004
TXN000267,15-04-2025,10-04-2025,2025-04,AUS01,5920,CC9603,MSFT,INV51482,PO8780,GBP,24052.8,GST,Payment for goods,Workday,2025-04-15,2025-04-10,2025,04,24052.8,False,payment for goods,2026-02-22 23:27:14.356841,Raw_GL_Export.csv,83.92156862745098,0,True,AUS01,5920,True,5920,FX Loss,True,False,,Microsoft Corporation,MAPPED,2025-04_GBP,1.955,47023.224,CONVERTED,27533.92400565971,21784.021192347693,144.0,False,0.0,Tuesday,False,True,True,EX002
TXN000268,26/01/2026,20/01/2026,2026-01,AUS01,5500,CC9732,Regus Australia,INV96798,PO1895,NZD,1046.23,GST,Payment for goods,Workday,2026-01-26,2026-01-20,2026,01,1046.23,False,payment for goods,2026-02-22 23:27:14.356841,Raw_GL_Export.csv,83.92156862745098,0,True,AUS01,5500,True,5500,Marketing,True,False,,Regus,MAPPED,2026-01_NZD,0.9335,976.655705,CONVERTED,28972.634359125877,32785.70497360227,143.0,False,0.0,Monday,False,True,True,EX002
TXN000269,18-12-2025,13-12-2025,2025-12,AUS01,5620,CC9981,Regus Australia,INV67986,PO7438,AUD,24117.49,GST-FREE,Payment for subscription,Workday,2025-12-18,2025-12-13,2025,12,24117.49,False,payment for subscription,2026-02-22 23:27:14.356841,Raw_GL_Export.csv,83.92156862745098,0,True,AUS01,5620,True,5620,Insurance,True,False,,Regus,MAPPED,2025-12_AUD,1.0,24117.49,DOMESTIC,32410.971605588227,27490.799177232966,170.0,False,0.0,Thursday,False,True,True,EX002
TXN000270,03/02/2026,29/01/2026,2026-02,AUS01,5200,CC9880,Adobe,INV14440,,GBP,28447.74,EXPORT,Payment for services,Manual Entry,2026-02-03,2026-01-29,2026,02,28447.74,False,payment for services,2026-02-22 23:27:14.356841,Raw_GL_Export.csv,83.92156862745098,0,True,AUS01,5200,True,5200,Software Licenses,True,False,,Adobe Systems,MAPPED,2026-02_GBP,1.955,55615.3317,CONVERTED,30196.543712413786,22166.314759696765,145.0,False,0.0,Tuesday,False,True,True,EX001;EX002;EX004
TXN000271,16-01-2026,10-01-2026,2026-01,AUS01,5710,CC9432,GCP,INV56118,PO9973,USD,31461.85,GST,Payment for subscription,Manual Entry,2026-01-16,2026-01-10,2026,01,31461.85,False,payment for subscription,2026-02-22 23:27:14.356841,Raw_GL_Export.csv,83.92156862745098,0,True,AUS01,5710,True,5710,Recruitment,True,False,,Google Cloud,MAPPED,2026-01_USD,1.527,48042.24494999999,CONVERTED,29496.09592285716,24753.031499859637,133.0,False,0.0,Friday,False,True,True,EX002
TXN000272,2026-01-23,2026-01-22,2026-01,AUS01,5620,CC9656,Oracle,INV10403,PO6006,GBP,35616.77,GST-FREE,Payment for subscription,API Import,2026-01-23,2026-01-22,2026,01,35616.77,False,payment for subscription,2026-02-22 23:27:14.356841,Raw_GL_Export.csv,83.92156862745098,0,True,AUS01,5620,True,5620,Insurance,True,False,,Oracle Corporation,MAPPED,2026-01_GBP,1.957,69702.01888999999,CONVERTED,32410.971605588227,27490.799177232966,170.0,False,0.0,Friday,False,True,True,EX002;EX004
TXN000273,2025-02-03,2025-01-31,2025-02,AUS01,5210,CC9528,Slack,INV69177,PO3187,GBP,35689.64,INPUT,Payment for subscription,Oracle,2025-02-03,2025-01-31,2025,02,35689.64,False,payment for subscription,2026-02-22 23:27:14.356841,Raw_GL_Export.csv,83.92156862745098,0,True,AUS01,5210,True,5210,Cloud Services,True,False,,Slack Technologies,MAPPED,2025-02_GBP,1.94,69237.9016,CONVERTED,31620.56664919015,27460.393400888206,142.0,False,0.0,Monday,False,True,True,EX002;EX004
TXN000274,02/22/2026,02/17/2026,2026-02,AUS01,5200,CC9086,AusPost,INV84762,,NZD,8266.83,EXPORT,Payment for services,API Import,2026-02-22,2026-02-17,2026,02,8266.83,False,payment for services,2026-02-22 23:27:14.356841,Raw_GL_Export.csv,83.92156862745098,0,True,AUS01,5200,True,5200,Software Licenses,True,False,,Australia Post,MAPPED,2026-02_NZD,0.932,7704.685560000001,CONVERTED,30196.543712413786,22166.314759696765,145.0,False,0.0,Sunday,True,True,True,EX001;EX002
TXN000275,21/02/2026,19/02/2026,2026-02,AUS01,5420,CC9203,Deloitte Touche,INV88694,,USD,2335.26,EXPORT,Payment for services,Workday,2026-02-21,2026-02-19,2026,02,2335.26,False,payment for services,2026-02-22 23:27:14.356841,Raw_GL_Export.csv,83.92156862745098,0,True,AUS01,5420,True,5420,Meals and Entertainment,True,False,,Deloitte,MAPPED,2026-02_USD,1.525,3561.2715000000003,CONVERTED,30119.54810314684,25344.73848974119,143.0,False,0.0,Saturday,True,True,True,EX001;EX002
TXN000276,2025-09-06,2025-09-05,2025-09,AUS01,5710,CC9538,Telstra Corp,INV25533,,GBP,37243.86,EXPORT,Payment for goods,Oracle,2025-09-06,2025-09-05,2025,09,37243.86,False,payment for goods,2026-02-22 23:27:14.356841,Raw_GL_Export.csv,83.92156862745098,0,True,AUS01,5710,True,5710,Recruitment,True,False,,Telstra,MAPPED,2025-09_GBP,1.949,72588.28314,CONVERTED,29496.09592285716,24753.031499859637,133.0,False,0.0,Saturday,True,True,True,EX001;EX002;EX004
TXN000277,12/28/2025,12/23/2025,2025-12,AUS01,5800,CC9506,Federal Express,INV88654,,USD,19465.76,GST-FREE,Payment for subscription,Oracle,2025-12-28,2025-12-23,2025,12,19465.76,False,payment for subscription,2026-02-22 23:27:14.356841,Raw_GL_Export.csv,83.92156862745098,0,True,AUS01,5800,True,5800,Depreciation,True,False,,FedEx,MAPPED,2025-12_USD,1.523,29646.352479999994,CONVERTED,30184.39373025477,34245.09535020032,157.0,False,0.0,Sunday,True,True,True,EX001;EX002
TXN000278,14/02/2026,07/02/2026,2026-02,AUS01,5900,CC9149,Amazon,INV90960,PO5068,NZD,43928.15,GST-FREE,Payment for subscription,API Import,2026-02-14,2026-02-07,2026,02,43928.15,False,payment for subscription,2026-02-22 23:27:14.356841,Raw_GL_Export.csv,83.92156862745098,0,True,AUS01,5900,True,5900,Bank Charges,True,False,,Amazon Web Services,MAPPED,2026-02_NZD,0.932,40941.035800000005,CONVERTED,31670.032329854675,24882.231532617723,172.0,False,0.0,Saturday,True,True,True,EX002
TXN000279,22-06-2025,20-06-2025,2025-06,AUS01,5000,CC9480,Slack,INV37815,PO7935,NZD,43850.52,EXPORT,Payment for license,Workday,2025-06-22,2025-06-20,2025,06,43850.52,False,payment for license,2026-02-22 23:27:14.356841,Raw_GL_Export.csv,83.92156862745098,0,True,AUS01,5000,True,5000,Salaries and Wages,True,False,,Slack Technologies,MAPPED,2025-06_NZD,0.931,40824.83412,CONVERTED,30471.385558248177,22939.768434623154,137.0,False,0.0,Sunday,True,True,True,EX002
TXN000280,2026-02-03,2026-01-25,2026-02,AUS01,5010,CC9053,BCG,INV89478,PO1745,USD,21244.87,INPUT,Payment for services,Workday,2026-02-03,2026-01-25,2026,02,21244.87,False,payment for services,2026-02-22 23:27:14.356841,Raw_GL_Export.csv,83.92156862745098,0,True,AUS01,5010,True,5010,Employee Benefits,True,False,,Boston Consulting Group,MAPPED,2026-02_USD,1.525,32398.426749999995,CONVERTED,27923.213086278203,19430.63083039902,133.0,False,0.0,Tuesday,False,True,True,EX002
TXN000281,17-02-2026,12-02-2026,2026-02,AUS01,5400,CC9687,Regus Australia,INV86085,,USD,43565.8,GST,Payment for goods,API Import,2026-02-17,2026-02-12,2026,02,43565.8,False,payment for goods,2026-02-22 23:27:14.356841,Raw_GL_Export.csv,83.92156862745098,0,True,AUS01,5400,True,5400,Travel,True,False,,Regus,MAPPED,2026-02_USD,1.525,66437.845,CONVERTED,31663.682660000006,30146.476988256833,133.0,False,0.0,Tuesday,False,True,True,EX001;EX002;EX004
TXN000282,01/16/2026,01/08/2026,2026-01,AUS01,5110,CC9091,McKinsey,INV51060,,GBP,6466.63,GST,Payment for goods,Manual Entry,2026-01-16,2026-08-01,2026,01,6466.63,False,payment for goods,2026-02-22 23:27:14.356841,Raw_GL_Export.csv,83.92156862745098,0,True,AUS01,5110,True,5110,Utilities,True,False,,McKinsey & Company,MAPPED,2026-01_GBP,1.957,12655.19491,CONVERTED,27865.288293732876,21409.69928933269,146.0,False,0.0,Friday,False,True,True,EX001;EX002
TXN000283,01/28/2026,01/22/2026,2026-01,AUS01,5410,CC9289,Deloitte Touche,INV31624,PO9049,NZD,23312.07,EXPORT,Payment for goods,API Import,2026-01-28,2026-01-22,2026,01,23312.07,False,payment for goods,2026-02-22 23:27:14.356841,Raw_GL_Export.csv,83.92156862745098,0,True,AUS01,5410,True,5410,Accommodation,True,False,,Deloitte,MAPPED,2026-01_NZD,0.9335,21761.817345,CONVERTED,29277.518810999987,22143.12829502557,155.0,False,0.0,Wednesday,False,True,True,EX002
TXN000284,28-02-2026,27-02-2026,2026-02,AUS01,5200,CC9152,MSFT,INV44108,,USD,8323.05,EXPORT,Payment for consulting,Manual Entry,2026-02-28,2026-02-27,2026,02,8323.05,False,payment for consulting,2026-02-22 23:27:14.356841,Raw_GL_Export.csv,83.92156862745098,0,True,AUS01,5200,True,5200,Software Licenses,True,False,,Microsoft Corporation,MAPPED,2026-02_USD,1.525,12692.651249999999,CONVERTED,30196.543712413786,22166.314759696765,145.0,False,0.0,Saturday,True,True,True,EX001;EX002
TXN000285,04-07-2025,03-07-2025,2025-07,AUS01,5420,CC9365,Hays,INV26207,PO4337,GBP,22235.19,GST-FREE,Payment for subscription,Oracle,2025-07-04,2025-07-03,2025,07,22235.19,False,payment for subscription,2026-02-22 23:27:14.356841,Raw_GL_Export.csv,83.92156862745098,0,True,AUS01,5420,True,5420,Meals and Entertainment,True,False,,Hays Recruitment,MAPPED,2025-07_GBP,1.958,43536.50202,CONVERTED,30119.54810314684,25344.73848974119,143.0,False,0.0,Friday,False,True,True,EX002
TXN000286,27/02/2026,18/02/2026,2026-02,AUS01,5910,CC9279,Workday,INV64580,PO5033,AUD,23718.09,GST-FREE,Payment for consulting,SAP,2026-02-27,2026-02-18,2026,02,23718.09,False,payment for consulting,2026-02-22 23:27:14.356841,Raw_GL_Export.csv,83.92156862745098,0,True,AUS01,5910,True,5910,Interest Expense,True,False,,Workday Inc,MAPPED,2026-02_AUD,1.0,23718.09,DOMESTIC,33774.54824600841,21661.31598456901,119.0,False,0.0,Friday,False,True,True,EX002
TXN000287,2026-02-11,2026-02-06,2026-02,AUS01,5700,CC9696,Atlassian Pty,INV52406,,GBP,16872.77,GST,Payment for services,Manual Entry,2026-02-11,2026-02-06,2026,02,16872.77,False,payment for services,2026-02-22 23:27:14.356841,Raw_GL_Export.csv,83.92156862745098,0,True,AUS01,5700,True,5700,Training,True,False,,Atlassian,MAPPED,2026-02_GBP,1.955,32986.26535,CONVERTED,31110.431902446802,30160.111495086097,141.0,False,0.0,Wednesday,False,True,True,EX001;EX002
TXN000288,27-11-2025,19-11-2025,2025-11,AUS01,5620,CC9978,PWC,INV96005,PO8423,AUD,14891.27,GST,Payment for subscription,API Import,2025-11-27,2025-11-19,2025,11,14891.27,False,payment for subscription,2026-02-22 23:27:14.356841,Raw_GL_Export.csv,83.92156862745098,0,True,AUS01,5620,True,5620,Insurance,True,False,,PwC,MAPPED,2025-11_AUD,1.0,14891.27,DOMESTIC,32410.971605588227,27490.799177232966,170.0,False,0.0,Thursday,False,True,True,EX002
TXN000289,05/01/2026,04/01/2026,2026-01,AUS01,5900,CC9659,KPMG Australia,INV81716,PO7248,NZD,35936.8,GST,Payment for services,Manual Entry,2026-01-05,2026-01-04,2026,01,35936.8,False,payment for services,2026-02-22 23:27:14.356841,Raw_GL_Export.csv,83.92156862745098,0,True,AUS01,5900,True,5900,Bank Charges,True,False,,KPMG,MAPPED,2026-01_NZD,0.9335,33547.0028,CONVERTED,31670.032329854675,24882.231532617723,172.0,False,0.0,Monday,False,True,True,EX002
TXN000290,09/02/2026,05/02/2026,2026-02,AUS01,5810,CC9886,DHL Express,INV31356,PO7592,AUD,1020.99,GST-FREE,Payment for subscription,Oracle,2026-02-09,2026-02-05,2026,02,1020.99,False,payment for subscription,2026-02-22 23:27:14.356841,Raw_GL_Export.csv,83.92156862745098,0,True,AUS01,5810,True,5810,Amortization,True,False,,DHL,MAPPED,2026-02_AUD,1.0,1020.99,DOMESTIC,31768.91314562501,27328.351394475325,120.0,False,0.0,Monday,False,True,True,EX002
TXN000291,01/04/2026,12/27/2025,2026-01,AUS01,5900,CC9442,EY Australia,INV58163,PO9021,USD,16221.09,GST,Payment for consulting,Manual Entry,2026-04-01,2025-12-27,2026,01,16221.09,False,payment for consulting,2026-02-22 23:27:14.356841,Raw_GL_Export.csv,83.92156862745098,1,True,AUS01,5900,True,5900,Bank Charges,True,False,,EY,MAPPED,2026-01_USD,1.527,24769.60443,CONVERTED,31670.032329854675,24882.231532617723,172.0,False,0.0,Wednesday,False,True,True,EX002
TXN000292,01/16/2026,01/06/2026,2026-01,AUS01,5610,CC9433,Google,INV66899,PO2522,GBP,36513.65,GST-FREE,Payment for services,API Import,2026-01-16,2026-06-01,2026,01,36513.65,False,payment for services,2026-02-22 23:27:14.356841,Raw_GL_Export.csv,83.92156862745098,0,True,AUS01,5610,True,5610,Postage and Courier,True,False,,Google Cloud,MAPPED,2026-01_GBP,1.957,71457.21305,CONVERTED,29081.766845273953,25872.32663648796,146.0,False,0.0,Friday,False,True,True,EX002;EX004
TXN000293,11-01-2026,07-01-2026,2026-01,AUS01,5620,CC9702,Zoom,INV48103,PO2297,GBP,23774.81,GST,Payment for consulting,Workday,2026-01-11,2026-01-07,2026,01,23774.81,False,payment for consulting,2026-02-22 23:27:14.356841,Raw_GL_Export.csv,83.92156862745098,0,True,AUS01,5620,True,5620,Insurance,True,False,,Zoom Video Communications,MAPPED,2026-01_GBP,1.957,46527.30317000001,CONVERTED,32410.971605588227,27490.799177232966,170.0,False,0.0,Sunday,True,True,True,EX002
TXN000294,05/02/2026,31/01/2026,2026-02,AUS01,5910,CC9254,Telstra Corp,INV15910,PO9366,NZD,25627.25,GST,Payment for consulting,Manual Entry,2026-02-05,2026-01-31,2026,02,25627.25,False,payment for consulting,2026-02-22 23:27:14.356841,Raw_GL_Export.csv,83.92156862745098,0,True,AUS01,5910,True,5910,Interest Expense,True,False,,Telstra,MAPPED,2026-02_NZD,0.932,23884.597,CONVERTED,33774.54824600841,21661.31598456901,119.0,False,0.0,Thursday,False,True,True,EX002
TXN000295,04-02-2026,25-01-2026,2026-02,AUS01,5910,CC9259,WeWork Australia,INV24933,PO8583,NZD,26392.0,GST,Payment for goods,Oracle,2026-02-04,2026-01-25,2026,02,26392.0,False,payment for goods,2026-02-22 23:27:14.356841,Raw_GL_Export.csv,83.92156862745098,0,True,AUS01,5910,True,5910,Interest Expense,True,False,,WeWork,MAPPED,2026-02_NZD,0.932,24597.344,CONVERTED,33774.54824600841,21661.31598456901,119.0,False,0.0,Wednesday,False,True,True,EX002
TXN000296,27-02-2025,26-02-2025,2025-02,AUS01,5020,CC9426,EY Australia,INV97852,PO5342,NZD,26465.66,EXPORT,Payment for subscription,Oracle,2025-02-27,2025-02-26,2025,02,26465.66,False,payment for subscription,2026-02-22 23:27:14.356841,Raw_GL_Export.csv,83.92156862745098,0,True,AUS01,5020,True,5020,Contractor Fees,True,False,,EY,MAPPED,2025-02_NZD,0.925,24480.735500000003,CONVERTED,28445.577844280295,21241.721119146277,132.0,False,0.0,Thursday,False,True,True,EX002
TXN000297,07/02/2026,05/02/2026,2026-02,AUS01,INVALID_ACCT,CC4100,Deloitte Touche,INV10766,PO1217,AUD,19577.57,GST,Payment for goods,Manual Entry,2026-02-07,2026-02-05,2026,02,19577.57,False,payment for goods,2026-02-22 23:27:14.356841,Raw_GL_Export.csv,83.92156862745098,0,True,AUS01,INVALID_ACCT,False,,,True,True,CC4100,Deloitte,MAPPED,2026-02_AUD,1.0,19577.57,DOMESTIC,,,,False,0.0,Saturday,True,True,True,EX003
TXN000298,15-01-2026,05-01-2026,2026-01,AUS01,INVALID_ACCT,CC3200,EY Australia,INV49669,,NZD,31110.74,EXPORT,Payment for goods,SAP,2026-01-15,2026-01-05,2026,01,31110.74,False,payment for goods,2026-02-22 23:27:14.356841,Raw_GL_Export.csv,83.92156862745098,0,True,AUS01,INVALID_ACCT,False,,,True,True,CC3200,EY,MAPPED,2026-01_NZD,0.9335,29041.875790000002,CONVERTED,,,,False,0.0,Thursday,False,True,True,EX001;EX003
TXN000299,2026-01-07,2026-01-06,2026-01,AUS01,INVALID_ACCT,CC2000,Amazon,INV95162,,USD,21702.16,GST-FREE,Payment for license,Oracle,2026-01-07,2026-01-06,2026,01,21702.16,False,payment for license,2026-02-22 23:27:14.356841,Raw_GL_Export.csv,83.92156862745098,0,True,AUS01,INVALID_ACCT,False,,,True,True,CC2000,Amazon Web Services,MAPPED,2026-01_USD,1.527,33139.198319999996,CONVERTED,,,,False,0.0,Wednesday,False,True,True,EX001;EX003
TXN000300,01/03/2026,12/26/2025,2026-01,AUS01,INVALID_ACCT,CC1200,Seek Limited,INV29978,PO8295,GBP,1079.58,GST-FREE,Payment for consulting,Manual Entry,2026-03-01,2025-12-26,2026,01,1079.58,False,payment for consulting,2026-02-22 23:27:14.356841,Raw_GL_Export.csv,83.92156862745098,1,True,AUS01,INVALID_ACCT,False,,,True,True,CC1200,Seek,MAPPED,2026-01_GBP,1.957,2112.73806,CONVERTED,,,,False,0.0,Sunday,True,True,True,EX003
TXN000301,01-07-2025,21-06-2025,2025-07,AUS01,INVALID_ACCT,CC2000,SAP,INV16674,PO2682,NZD,25667.43,EXPORT,Payment for consulting,Manual Entry,2025-07-01,2025-06-21,2025,07,25667.43,False,payment for consulting,2026-02-22 23:27:14.356841,Raw_GL_Export.csv,83.92156862745098,0,True,AUS01,INVALID_ACCT,False,,,True,True,CC2000,SAP SE,MAPPED,2025-07_NZD,0.934,23973.379620000003,CONVERTED,,,,False,0.0,Tuesday,False,True,True,EX003
TXN000302,28-01-2026,18-01-2026,2026-01,AUS01,INVALID_ACCT,CC4100,KPMG Australia,INV77286,PO8993,AUD,21988.59,EXPORT,Payment for goods,SAP,2026-01-28,2026-01-18,2026,01,21988.59,False,payment for goods,2026-02-22 23:27:14.356841,Raw_GL_Export.csv,83.92156862745098,0,True,AUS01,INVALID_ACCT,False,,,True,True,CC4100,KPMG,MAPPED,2026-01_AUD,1.0,21988.59,DOMESTIC,,,,False,0.0,Wednesday,False,True,True,EX003
TXN000303,2026-01-17,2026-01-10,2026-01,AUS01,INVALID_ACCT,CC4100,McKinsey,INV72041,,AUD,12126.41,EXPORT,Payment for license,Workday,2026-01-17,2026-01-10,2026,01,12126.41,False,payment for license,2026-02-22 23:27:14.356841,Raw_GL_Export.csv,83.92156862745098,0,True,AUS01,INVALID_ACCT,False,,,True,True,CC4100,McKinsey & Company,MAPPED,2026-01_AUD,1.0,12126.41,DOMESTIC,,,,False,0.0,Saturday,True,True,True,EX001;EX003
TXN000304,15-02-2026,14-02-2026,2026-02,AUS01,INVALID_ACCT,CC1200,KPMG Australia,INV40422,PO6556,USD,21168.9,EXPORT,Payment for license,Manual Entry,2026-02-15,2026-02-14,2026,02,21168.9,False,payment for license,2026-02-22 23:27:14.356841,Raw_GL_Export.csv,83.92156862745098,0,True,AUS01,INVALID_ACCT,False,,,True,True,CC1200,KPMG,MAPPED,2026-02_USD,1.525,32282.572500000002,CONVERTED,,,,False,0.0,Sunday,True,True,True,EX003
TXN000305,03/05/2025,02/26/2025,2025-03,AUS01,INVALID_ACCT,CC3100,Regus Australia,INV91506,,GBP,36009.0,GST-FREE,Payment for services,Manual Entry,2025-05-03,2025-02-26,2025,03,36009.0,False,payment for services,2026-02-22 23:27:14.356841,Raw_GL_Export.csv,83.92156862745098,1,True,AUS01,INVALID_ACCT,False,,,True,True,CC3100,Regus,MAPPED,2025-03_GBP,1.96,70577.64,CONVERTED,,,,False,0.0,Saturday,True,True,True,EX001;EX003;EX004
TXN000306,05/01/2026,01/01/2026,2026-01,AUS01,INVALID_ACCT,CC1200,Hays,INV49800,,AUD,35727.36,EXPORT,Payment for license,SAP,2026-01-05,2026-01-01,2026,01,35727.36,False,payment for license,2026-02-22 23:27:14.356841,Raw_GL_Export.csv,83.92156862745098,0,True,AUS01,INVALID_ACCT,False,,,True,True,CC1200,Hays Recruitment,MAPPED,2026-01_AUD,1.0,35727.36,DOMESTIC,,,,False,0.0,Monday,False,True,True,EX001;EX003
TXN000307,07/01/2025,06/26/2025,2025-07,AUS01,INVALID_ACCT,CC3000,Adobe,INV18344,PO2867,USD,37274.9,GST,Payment for license,Oracle,2025-01-07,2025-06-26,2025,07,37274.9,False,payment for license,2026-02-22 23:27:14.356841,Raw_GL_Export.csv,83.92156862745098,1,True,AUS01,INVALID_ACCT,False,,,True,True,CC3000,Adobe Systems,MAPPED,2025-07_USD,1.528,56956.0472,CONVERTED,,,,False,0.0,Tuesday,False,True,True,EX003;EX004
TXN000308,04/09/2025,27/08/2025,2025-09,AUS01,INVALID_ACCT,CC2100,BCG,INV29815,PO9444,NZD,34644.89,INPUT,Payment for license,SAP,2025-09-04,2025-08-27,2025,09,34644.89,False,payment for license,2026-02-22 23:27:14.356841,Raw_GL_Export.csv,83.92156862745098,0,True,AUS01,INVALID_ACCT,False,,,True,True,CC2100,Boston Consulting Group,MAPPED,2025-09_NZD,0.927,32115.81303,CONVERTED,,,,False,0.0,Thursday,False,True,True,EX003
TXN000309,2025-07-23,2025-07-15,2025-07,AUS01,INVALID_ACCT,CC3200,Atlassian Pty,INV83724,,AUD,35196.19,GST,Payment for services,Oracle,2025-07-23,2025-07-15,2025,07,35196.19,False,payment for services,2026-02-22 23:27:14.356841,Raw_GL_Export.csv,83.92156862745098,0,True,AUS01,INVALID_ACCT,False,,,True,True,CC3200,Atlassian,MAPPED,2025-07_AUD,1.0,35196.19,DOMESTIC,,,,False,0.0,Wednesday,False,True,True,EX001;EX003
TXN000310,2026-01-21,2026-01-17,2026-01,AUS01,INVALID_ACCT,CC3000,Adobe,INV23014,,NZD,31896.53,EXPORT,Payment for subscription,Workday,2026-01-21,2026-01-17,2026,01,31896.53,False,payment for subscription,2026-02-22 23:27:14.356841,Raw_GL_Export.csv,83.92156862745098,0,True,AUS01,INVALID_ACCT,False,,,True,True,CC3000,Adobe Systems,MAPPED,2026-01_NZD,0.9335,29775.410754999997,CONVERTED,,,,False,0.0,Wednesday,False,True,True,EX001;EX003
TXN000311,27/10/2025,25/10/2025,2025-10,AUS01,INVALID_ACCT,CC2000,Optus Pty,INV42154,PO8760,GBP,34637.95,GST,Payment for subscription,Workday,2025-10-27,2025-10-25,2025,10,34637.95,False,payment for subscription,2026-02-22 23:27:14.356841,Raw_GL_Export.csv,83.92156862745098,0,True,AUS01,INVALID_ACCT,False,,,True,True,CC2000,Optus,MAPPED,2025-10_GBP,1.951,67578.64044999999,CONVERTED,,,,False,0.0,Monday,False,True,True,EX003;EX004
TXN000312,17/02/2025,15/02/2025,2025-02,AUS01,INVALID_ACCT,CC2100,Regus Australia,INV29871,PO9677,GBP,16292.89,GST-FREE,Payment for consulting,Oracle,2025-02-17,2025-02-15,2025,02,16292.89,False,payment for consulting,2026-02-22 23:27:14.356841,Raw_GL_Export.csv,83.92156862745098,0,True,AUS01,INVALID_ACCT,False,,,True,True,CC2100,Regus,MAPPED,2025-02_GBP,1.94,31608.206599999998,CONVERTED,,,,False,0.0,Monday,False,True,True,EX003
TXN000313,05-02-2026,29-01-2026,2026-02,AUS01,INVALID_ACCT,CC3100,LinkedIn Corp,INV29082,PO9476,NZD,42473.94,EXPORT,Payment for services,SAP,2026-02-05,2026-01-29,2026,02,42473.94,False,payment for services,2026-02-22 23:27:14.356841,Raw_GL_Export.csv,83.92156862745098,0,True,AUS01,INVALID_ACCT,False,,,True,True,CC3100,LinkedIn,MAPPED,2026-02_NZD,0.932,39585.712080000005,CONVERTED,,,,False,0.0,Thursday,False,True,True,EX003
TXN000314,02/11/2026,02/04/2026,2026-02,AUS01,INVALID_ACCT,CC1200,Telstra Corp,INV96530,PO3473,AUD,17757.66,GST,Payment for license,SAP,2026-11-02,2026-04-02,2026,02,17757.66,False,payment for license,2026-02-22 23:27:14.356841,Raw_GL_Export.csv,83.92156862745098,1,True,AUS01,INVALID_ACCT,False,,,True,True,CC1200,Telstra,MAPPED,2026-02_AUD,1.0,17757.66,DOMESTIC,,,,False,0.0,Monday,False,True,True,EX003;EX007
TXN000315,06/21/2025,06/14/2025,2025-06,AUS01,INVALID_ACCT,CC3100,EY Australia,INV46671,PO3406,NZD,40924.47,GST,Payment for consulting,Manual Entry,2025-06-21,2025-06-14,2025,06,40924.47,False,payment for consulting,2026-02-22 23:27:14.356841,Raw_GL_Export.csv,83.92156862745098,0,True,AUS01,INVALID_ACCT,False,,,True,True,CC3100,EY,MAPPED,2025-06_NZD,0.931,38100.68157,CONVERTED,,,,False,0.0,Saturday,True,True,True,EX003
TXN000316,21/01/2026,12/01/2026,2026-01,AUS01,INVALID_ACCT,CC4100,Optus Pty,INV35859,PO2380,NZD,39956.6,EXPORT,Payment for services,API Import,2026-01-21,2026-01-12,2026,01,39956.6,False,payment for services,2026-02-22 23:27:14.356841,Raw_GL_Export.csv,83.92156862745098,0,True,AUS01,INVALID_ACCT,False,,,True,True,CC4100,Optus,MAPPED,2026-01_NZD,0.9335,37299.4861,CONVERTED,,,,False,0.0,Wednesday,False,True,True,EX003
TXN000317,11-01-2026,08-01-2026,2026-01,AUS01,INVALID_ACCT,CC4000,KPMG Australia,INV78332,PO3621,USD,4267.6,INPUT,Payment for services,SAP,2026-01-11,2026-01-08,2026,01,4267.6,False,payment for services,2026-02-22 23:27:14.356841,Raw_GL_Export.csv,83.92156862745098,0,True,AUS01,INVALID_ACCT,False,,,True,True,CC4000,KPMG,MAPPED,2026-01_USD,1.527,6516.6252,CONVERTED,,,,False,0.0,Sunday,True,True,True,EX003
TXN000318,11/26/2025,11/22/2025,2025-11,AUS01,INVALID_ACCT,CC2100,Telstra Corp,INV44046,PO6807,AUD,32966.18,INPUT,Payment for services,SAP,2025-11-26,2025-11-22,2025,11,32966.18,False,payment for services,2026-02-22 23:27:14.356841,Raw_GL_Export.csv,83.92156862745098,0,True,AUS01,INVALID_ACCT,False,,,True,True,CC2100,Telstra,MAPPED,2025-11_AUD,1.0,32966.18,DOMESTIC,,,,False,0.0,Wednesday,False,True,True,EX003
TXN000319,2026-01-25,2026-01-17,2026-01,AUS01,INVALID_ACCT,CC2100,AWS,INV86230,PO9737,GBP,15320.22,GST-FREE,Payment for license,Oracle,2026-01-25,2026-01-17,2026,01,15320.22,False,payment for license,2026-02-22 23:27:14.356841,Raw_GL_Export.csv,83.92156862745098,0,True,AUS01,INVALID_ACCT,False,,,True,True,CC2100,Amazon Web Services,MAPPED,2026-01_GBP,1.957,29981.67054,CONVERTED,,,,False,0.0,Sunday,True,True,True,EX003
TXN000320,03/12/2025,03/07/2025,2025-03,AUS01,INVALID_ACCT,CC4100,Slack,INV23792,PO4154,GBP,23433.03,GST-FREE,Payment for subscription,Manual Entry,2025-12-03,2025-07-03,2025,03,23433.03,False,payment for subscription,2026-02-22 23:27:14.356841,Raw_GL_Export.csv,83.92156862745098,1,True,AUS01,INVALID_ACCT,False,,,True,True,CC4100,Slack Technologies,MAPPED,2025-03_GBP,1.96,45928.7388,CONVERTED,,,,False,0.0,Wednesday,False,True,True,EX003
TXN000321,04/02/2026,28/01/2026,2026-02,AUS01,INVALID_ACCT,CC3100,Google,INV72423,,AUD,2892.5,GST-FREE,Payment for services,Workday,2026-02-04,2026-01-28,2026,02,2892.5,False,payment for services,2026-02-22 23:27:14.356841,Raw_GL_Export.csv,83.92156862745098,0,True,AUS01,INVALID_ACCT,False,,,True,True,CC3100,Google Cloud,MAPPED,2026-02_AUD,1.0,2892.5,DOMESTIC,,,,False,0.0,Wednesday,False,True,True,EX001;EX003
TXN000322,22-12-2025,12-12-2025,2025-12,AUS01,INVALID_ACCT,CC4000,DHL Express,INV67682,PO9020,NZD,26335.24,EXPORT,Payment for consulting,Oracle,2025-12-22,2025-12-12,2025,12,26335.24,False,payment for consulting,2026-02-22 23:27:14.356841,Raw_GL_Export.csv,83.92156862745098,0,True,AUS01,INVALID_ACCT,False,,,True,True,CC4000,DHL,MAPPED,2025-12_NZD,0.9305,24504.94082,CONVERTED,,,,False,0.0,Monday,False,True,True,EX003
TXN000323,05/01/2026,28/12/2025,2026-01,AUS01,INVALID_ACCT,CC3200,Slack,INV72043,,AUD,31281.73,EXPORT,Payment for goods,API Import,2026-01-05,2025-12-28,2026,01,31281.73,False,payment for goods,2026-02-22 23:27:14.356841,Raw_GL_Export.csv,83.92156862745098,0,True,AUS01,INVALID_ACCT,False,,,True,True,CC3200,Slack Technologies,MAPPED,2026-01_AUD,1.0,31281.73,DOMESTIC,,,,False,0.0,Monday,False,True,True,EX001;EX003
TXN000324,2025-09-12,2025-09-02,2025-09,AUS01,INVALID_ACCT,CC3100,Atlassian Pty,INV15279,PO2929,AUD,16694.41,INPUT,Payment for subscription,Workday,2025-09-12,2025-09-02,2025,09,16694.41,False,payment for subscription,2026-02-22 23:27:14.356841,Raw_GL_Export.csv,83.92156862745098,0,True,AUS01,INVALID_ACCT,False,,,True,True,CC3100,Atlassian,MAPPED,2025-09_AUD,1.0,16694.41,DOMESTIC,,,,False,0.0,Friday,False,True,True,EX003
TXN000325,02/12/2026,02/07/2026,2026-02,AUS01,INVALID_ACCT,CC3200,Amazon,INV16376,PO5999,USD,6482.08,EXPORT,Payment for subscription,Oracle,2026-12-02,2026-07-02,2026,02,6482.08,False,payment for subscription,2026-02-22 23:27:14.356841,Raw_GL_Export.csv,83.92156862745098,1,True,AUS01,INVALID_ACCT,False,,,True,True,CC3200,Amazon Web Services,MAPPED,2026-02_USD,1.525,9885.171999999999,CONVERTED,,,,False,0.0,Wednesday,False,True,True,EX003;EX007
TXN000326,06-01-2026,05-01-2026,2026-01,AUS01,INVALID_ACCT,CC1100,WeWork Australia,INV73068,PO8411,AUD,39182.15,EXPORT,Payment for subscription,Manual Entry,2026-01-06,2026-01-05,2026,01,39182.15,False,payment for subscription,2026-02-22 23:27:14.356841,Raw_GL_Export.csv,83.92156862745098,0,True,AUS01,INVALID_ACCT,False,,,True,True,CC1100,WeWork,MAPPED,2026-01_AUD,1.0,39182.15,DOMESTIC,,,,False,0.0,Tuesday,False,True,True,EX003
TXN000327,16/01/2026,13/01/2026,2026-01,AUS01,INVALID_ACCT,CC4000,LinkedIn Corp,INV52626,,GBP,30058.21,GST-FREE,Payment for license,API Import,2026-01-16,2026-01-13,2026,01,30058.21,False,payment for license,2026-02-22 23:27:14.356841,Raw_GL_Export.csv,83.92156862745098,0,True,AUS01,INVALID_ACCT,False,,,True,True,CC4000,LinkedIn,MAPPED,2026-01_GBP,1.957,58823.91697,CONVERTED,,,,False,0.0,Friday,False,True,True,EX001;EX003;EX004
TXN000328,14-02-2026,10-02-2026,2026-02,AUS01,INVALID_ACCT,CC3100,BCG,INV46356,PO3713,AUD,43117.77,EXPORT,Payment for services,API Import,2026-02-14,2026-02-10,2026,02,43117.77,False,payment for services,2026-02-22 23:27:14.356841,Raw_GL_Export.csv,83.92156862745098,0,True,AUS01,INVALID_ACCT,False,,,True,True,CC3100,Boston Consulting Group,MAPPED,2026-02_AUD,1.0,43117.77,DOMESTIC,,,,False,0.0,Saturday,True,True,True,EX003
TXN000329,02/21/2026,02/12/2026,2026-02,AUS01,INVALID_ACCT,CC1100,Google,INV84743,PO8796,USD,42987.06,GST,Payment for license,SAP,2026-02-21,2026-12-02,2026,02,42987.06,False,payment for license,2026-02-22 23:27:14.356841,Raw_GL_Export.csv,83.92156862745098,0,True,AUS01,INVALID_ACCT,False,,,True,True,CC1100,Google Cloud,MAPPED,2026-02_USD,1.525,65555.2665,CONVERTED,,,,False,0.0,Saturday,True,True,True,EX003;EX004
TXN000330,04/01/2026,03/01/2026,2026-01,AUS01,INVALID_ACCT,CC2100,Workday,INV21094,PO6249,USD,37353.11,EXPORT,Payment for consulting,API Import,2026-01-04,2026-01-03,2026,01,37353.11,False,payment for consulting,2026-02-22 23:27:14.356841,Raw_GL_Export.csv,83.92156862745098,0,True,AUS01,INVALID_ACCT,False,,,True,True,CC2100,Workday Inc,MAPPED,2026-01_USD,1.527,57038.19897,CONVERTED,,,,False,0.0,Sunday,True,True,True,EX003;EX004
TXN000331,02-01-2025,01-01-2025,2025-01,AUS01,INVALID_ACCT,CC3000,Telstra Corp,INV60070,,USD,18730.65,INPUT,Payment for services,SAP,2025-01-02,2025-01-01,2025,01,18730.65,False,payment for services,2026-02-22 23:27:14.356841,Raw_GL_Export.csv,83.92156862745098,0,True,AUS01,INVALID_ACCT,False,,,True,True,CC3000,Telstra,MAPPED,2025-01_USD,1.52,28470.588000000003,CONVERTED,,,,False,0.0,Thursday,False,True,True,EX001;EX003
TXN000332,18/02/2026,13/02/2026,2026-02,AUS01,INVALID_ACCT,CC1200,Oracle,INV50212,PO3772,NZD,34596.88,GST-FREE,Payment for services,API Import,2026-02-18,2026-02-13,2026,02,34596.88,False,payment for services,2026-02-22 23:27:14.356841,Raw_GL_Export.csv,83.92156862745098,0,True,AUS01,INVALID_ACCT,False,,,True,True,CC1200,Oracle Corporation,MAPPED,2026-02_NZD,0.932,32244.29216,CONVERTED,,,,False,0.0,Wednesday,False,True,True,EX003
TXN000333,11/01/2026,10/01/2026,2026-01,AUS01,INVALID_ACCT,CC1000,EY Australia,INV64109,PO5225,GBP,4533.62,GST-FREE,Payment for consulting,SAP,2026-01-11,2026-01-10,2026,01,4533.62,False,payment for consulting,2026-02-22 23:27:14.356841,Raw_GL_Export.csv,83.92156862745098,0,True,AUS01,INVALID_ACCT,False,,,True,True,CC1000,EY,MAPPED,2026-01_GBP,1.957,8872.29434,CONVERTED,,,,False,0.0,Sunday,True,True,True,EX003
TXN000334,02/08/2025,29/07/2025,2025-08,AUS01,INVALID_ACCT,CC4100,Accenture Pty,INV25083,,GBP,22937.1,EXPORT,Payment for subscription,Manual Entry,2025-08-02,2025-07-29,2025,08,22937.1,False,payment for subscription,2026-02-22 23:27:14.356841,Raw_GL_Export.csv,83.92156862745098,0,True,AUS01,INVALID_ACCT,False,,,True,True,CC4100,Accenture,MAPPED,2025-08_GBP,1.954,44819.0934,CONVERTED,,,,False,0.0,Saturday,True,True,True,EX001;EX003
TXN000335,18-03-2025,16-03-2025,2025-03,AUS01,INVALID_ACCT,CC3200,Amazon,INV45279,PO2663,GBP,28546.0,GST,Payment for goods,API Import,2025-03-18,2025-03-16,2025,03,28546.0,False,payment for goods,2026-02-22 23:27:14.356841,Raw_GL_Export.csv,83.92156862745098,0,True,AUS01,INVALID_ACCT,False,,,True,True,CC3200,Amazon Web Services,MAPPED,2025-03_GBP,1.96,55950.159999999996,CONVERTED,,,,False,0.0,Tuesday,False,True,True,EX003;EX004
TXN000336,21/02/2025,16/02/2025,2025-02,AUS01,INVALID_ACCT,CC4100,AusPost,INV28660,PO3755,GBP,3867.49,GST-FREE,Payment for goods,API Import,2025-02-21,2025-02-16,2025,02,3867.49,False,payment for goods,2026-02-22 23:27:14.356841,Raw_GL_Export.csv,83.92156862745098,0,True,AUS01,INVALID_ACCT,False,,,True,True,CC4100,Australia Post,MAPPED,2025-02_GBP,1.94,7502.9306,CONVERTED,,,,False,0.0,Friday,False,True,True,EX003
TXN000337,14-01-2026,13-01-2026,2026-01,AUS01,INVALID_ACCT,CC1000,LinkedIn Corp,INV10071,,NZD,29422.34,GST-FREE,Payment for consulting,Workday,2026-01-14,2026-01-13,2026,01,29422.34,False,payment for consulting,2026-02-22 23:27:14.356841,Raw_GL_Export.csv,83.92156862745098,0,True,AUS01,INVALID_ACCT,False,,,True,True,CC1000,LinkedIn,MAPPED,2026-01_NZD,0.9335,27465.75439,CONVERTED,,,,False,0.0,Wednesday,False,True,True,EX001;EX003
TXN000338,02/20/2026,02/13/2026,2026-02,AUS01,INVALID_ACCT,CC3000,Workday,INV49405,,NZD,2142.26,GST,Payment for services,Oracle,2026-02-20,2026-02-13,2026,02,2142.26,False,payment for services,2026-02-22 23:27:14.356841,Raw_GL_Export.csv,83.92156862745098,0,True,AUS01,INVALID_ACCT,False,,,True,True,CC3000,Workday Inc,MAPPED,2026-02_NZD,0.932,1996.5863200000003,CONVERTED,,,,False,0.0,Friday,False,True,True,EX001;EX003
TXN000339,02/24/2026,02/17/2026,2026-02,AUS01,INVALID_ACCT,CC2000,Robert Half International,INV93252,,NZD,39788.53,INPUT,Payment for consulting,Workday,2026-02-24,2026-02-17,2026,02,39788.53,False,payment for consulting,2026-02-22 23:27:14.356841,Raw_GL_Export.csv,83.92156862745098,0,True,AUS01,INVALID_ACCT,False,,,True,True,CC2000,Robert Half,MAPPED,2026-02_NZD,0.932,37082.909960000005,CONVERTED,,,,False,0.0,Tuesday,False,True,True,EX001;EX003
TXN000340,02/08/2026,02/02/2026,2026-02,AUS01,INVALID_ACCT,CC2000,LinkedIn Corp,INV94730,PO8807,NZD,812.77,GST-FREE,Payment for services,SAP,2026-08-02,2026-02-02,2026,02,812.77,False,payment for services,2026-02-22 23:27:14.356841,Raw_GL_Export.csv,83.92156862745098,1,True,AUS01,INVALID_ACCT,False,,,True,True,CC2000,LinkedIn,MAPPED,2026-02_NZD,0.932,757.5016400000001,CONVERTED,,,,False,0.0,Sunday,True,True,True,EX003;EX007
TXN000341,22/01/2026,15/01/2026,2026-01,AUS01,INVALID_ACCT,CC4000,Hays,INV80601,,GBP,24262.1,GST,Payment for consulting,SAP,2026-01-22,2026-01-15,2026,01,24262.1,False,payment for consulting,2026-02-22 23:27:14.356841,Raw_GL_Export.csv,83.92156862745098,0,True,AUS01,INVALID_ACCT,False,,,True,True,CC4000,Hays Recruitment,MAPPED,2026-01_GBP,1.957,47480.9297,CONVERTED,,,,False,0.0,Thursday,False,True,True,EX001;EX003
TXN000342,12-05-2025,02-05-2025,2025-05,AUS01,INVALID_ACCT,CC3000,Federal Express,INV26353,PO4161,USD,37777.65,GST,Payment for consulting,SAP,2025-05-12,2025-05-02,2025,05,37777.65,False,payment for consulting,2026-02-22 23:27:14.356841,Raw_GL_Export.csv,83.92156862745098,0,True,AUS01,INVALID_ACCT,False,,,True,True,CC3000,FedEx,MAPPED,2025-05_USD,1.518,57346.472700000006,CONVERTED,,,,False,0.0,Monday,False,True,True,EX003;EX004
TXN000343,2026-02-08,2026-02-03,2026-02,AUS01,INVALID_ACCT,CC3000,SAP,INV38986,,AUD,36751.01,INPUT,Payment for consulting,Workday,2026-02-08,2026-02-03,2026,02,36751.01,False,payment for consulting,2026-02-22 23:27:14.356841,Raw_GL_Export.csv,83.92156862745098,0,True,AUS01,INVALID_ACCT,False,,,True,True,CC3000,SAP SE,MAPPED,2026-02_AUD,1.0,36751.01,DOMESTIC,,,,False,0.0,Sunday,True,True,True,EX001;EX003
TXN000344,01/02/2026,12/25/2025,2026-01,AUS01,INVALID_ACCT,CC4100,Workday,INV24541,PO9197,AUD,8904.3,EXPORT,Payment for consulting,Oracle,2026-02-01,2025-12-25,2026,01,8904.3,False,payment for consulting,2026-02-22 23:27:14.356841,Raw_GL_Export.csv,83.92156862745098,1,True,AUS01,INVALID_ACCT,False,,,True,True,CC4100,Workday Inc,MAPPED,2026-01_AUD,1.0,8904.3,DOMESTIC,,,,False,0.0,Sunday,True,True,True,EX003
TXN000345,18/01/2025,08/01/2025,2025-01,AUS01,INVALID_ACCT,CC4100,Oracle,INV26702,,AUD,26508.59,GST,Payment for license,Oracle,2025-01-18,2025-01-08,2025,01,26508.59,False,payment for license,2026-02-22 23:27:14.356841,Raw_GL_Export.csv,83.92156862745098,0,True,AUS01,INVALID_ACCT,False,,,True,True,CC4100,Oracle Corporation,MAPPED,2025-01_AUD,1.0,26508.59,DOMESTIC,,,,False,0.0,Saturday,True,True,True,EX001;EX003
TXN000346,01/17/2026,01/13/2026,2026-01,AUS01,INVALID_ACCT,CC1000,Deloitte Touche,INV94012,PO1849,GBP,187.78,EXPORT,Payment for subscription,Manual Entry,2026-01-17,2026-01-13,2026,01,187.78,False,payment for subscription,2026-02-22 23:27:14.356841,Raw_GL_Export.csv,83.92156862745098,0,True,AUS01,INVALID_ACCT,False,,,True,True,CC1000,Deloitte,MAPPED,2026-01_GBP,1.957,367.48546,CONVERTED,,,,False,0.0,Saturday,True,True,True,EX003
TXN000347,28-02-2026,23-02-2026,2026-02,AUS01,INVALID_ACCT,CC1100,LinkedIn Corp,INV39431,,GBP,16330.09,GST,Payment for consulting,API Import,2026-02-28,2026-02-23,2026,02,16330.09,False,payment for consulting,2026-02-22 23:27:14.356841,Raw_GL_Export.csv,83.92156862745098,0,True,AUS01,INVALID_ACCT,False,,,True,True,CC1100,LinkedIn,MAPPED,2026-02_GBP,1.955,31925.325950000002,CONVERTED,,,,False,0.0,Saturday,True,True,True,EX001;EX003
TXN000348,02/15/2026,02/14/2026,2026-02,AUS01,INVALID_ACCT,CC3100,SAP,INV39573,PO7943,NZD,3773.22,GST,Payment for services,Oracle,2026-02-15,2026-02-14,2026,02,3773.22,False,payment for services,2026-02-22 23:27:14.356841,Raw_GL_Export.csv,83.92156862745098,0,True,AUS01,INVALID_ACCT,False,,,True,True,CC3100,SAP SE,MAPPED,2026-02_NZD,0.932,3516.64104,CONVERTED,,,,False,0.0,Sunday,True,True,True,EX003
TXN000349,07/01/2026,01/01/2026,2026-01,AUS01,INVALID_ACCT,CC2100,Salesforce,INV13148,PO6477,AUD,1351.49,EXPORT,Payment for subscription,Oracle,2026-01-07,2026-01-01,2026,01,1351.49,False,payment for subscription,2026-02-22 23:27:14.356841,Raw_GL_Export.csv,83.92156862745098,0,True,AUS01,INVALID_ACCT,False,,,True,True,CC2100,Salesforce Inc,MAPPED,2026-01_AUD,1.0,1351.49,DOMESTIC,,,,False,0.0,Wednesday,False,True,True,EX003
TXN000350,04-01-2026,31-12-2025,2026-01,AUS01,INVALID_ACCT,CC3000,MSFT,INV19556,PO8184,NZD,23433.41,GST-FREE,Payment for services,Manual Entry,2026-01-04,2025-12-31,2026,01,23433.41,False,payment for services,2026-02-22 23:27:14.356841,Raw_GL_Export.csv,83.92156862745098,0,True,AUS01,INVALID_ACCT,False,,,True,True,CC3000,Microsoft Corporation,MAPPED,2026-01_NZD,0.9335,21875.088235,CONVERTED,,,,False,0.0,Sunday,True,True,True,EX003
TXN000351,2026-01-19,2026-01-17,2026-01,AUS01,INVALID_ACCT,CC1000,Microsoft,INV26716,,GBP,14166.25,GST,Payment for consulting,SAP,2026-01-19,2026-01-17,2026,01,14166.25,False,payment for consulting,2026-02-22 23:27:14.356841,Raw_GL_Export.csv,83.92156862745098,0,True,AUS01,INVALID_ACCT,False,,,True,True,CC1000,Microsoft Corporation,MAPPED,2026-01_GBP,1.957,27723.35125,CONVERTED,,,,False,0.0,Monday,False,True,True,EX001;EX003
TXN000352,10-02-2026,08-02-2026,2026-02,AUS01,INVALID_ACCT,CC1100,MSFT,INV62649,,AUD,13341.76,EXPORT,Payment for consulting,Oracle,2026-02-10,2026-02-08,2026,02,13341.76,False,payment for consulting,2026-02-22 23:27:14.356841,Raw_GL_Export.csv,83.92156862745098,0,True,AUS01,INVALID_ACCT,False,,,True,True,CC1100,Microsoft Corporation,MAPPED,2026-02_AUD,1.0,13341.76,DOMESTIC,,,,False,0.0,Tuesday,False,True,True,EX001;EX003
TXN000353,2025-03-28,2025-03-20,2025-03,AUS01,INVALID_ACCT,CC3100,LinkedIn Corp,INV54514,PO1425,GBP,39609.22,GST,Payment for consulting,API Import,2025-03-28,2025-03-20,2025,03,39609.22,False,payment for consulting,2026-02-22 23:27:14.356841,Raw_GL_Export.csv,83.92156862745098,0,True,AUS01,INVALID_ACCT,False,,,True,True,CC3100,LinkedIn,MAPPED,2025-03_GBP,1.96,77634.0712,CONVERTED,,,,False,0.0,Friday,False,True,True,EX003;EX004
TXN000354,11/02/2026,09/02/2026,2026-02,AUS01,INVALID_ACCT,CC1100,AWS,INV85132,,AUD,26720.6,GST-FREE,Payment for license,Workday,2026-02-11,2026-02-09,2026,02,26720.6,False,payment for license,2026-02-22 23:27:14.356841,Raw_GL_Export.csv,83.92156862745098,0,True,AUS01,INVALID_ACCT,False,,,True,True,CC1100,Amazon Web Services,MAPPED,2026-02_AUD,1.0,26720.6,DOMESTIC,,,,False,0.0,Wednesday,False,True,True,EX001;EX003
TXN000355,12-01-2026,04-01-2026,2026-01,AUS01,INVALID_ACCT,CC4100,Optus Pty,INV17928,,USD,11017.55,GST,Payment for license,Manual Entry,2026-01-12,2026-01-04,2026,01,11017.55,False,payment for license,2026-02-22 23:27:14.356841,Raw_GL_Export.csv,83.92156862745098,0,True,AUS01,INVALID_ACCT,False,,,True,True,CC4100,Optus,MAPPED,2026-01_USD,1.527,16823.79885,CONVERTED,,,,False,0.0,Monday,False,True,True,EX001;EX003
TXN000356,02/17/2026,02/12/2026,2026-02,AUS01,INVALID_ACCT,CC4100,Zoom,INV48150,PO1132,USD,21181.62,INPUT,Payment for license,API Import,2026-02-17,2026-12-02,2026,02,21181.62,False,payment for license,2026-02-22 23:27:14.356841,Raw_GL_Export.csv,83.92156862745098,0,True,AUS01,INVALID_ACCT,False,,,True,True,CC4100,Zoom Video Communications,MAPPED,2026-02_USD,1.525,32301.970499999996,CONVERTED,,,,False,0.0,Tuesday,False,True,True,EX003
TXN000357,22/02/2026,21/02/2026,2026-02,AUS01,INVALID_ACCT,CC2000,Robert Half International,INV36263,PO4297,AUD,19050.55,GST-FREE,Payment for services,Workday,2026-02-22,2026-02-21,2026,02,19050.55,False,payment for services,2026-02-22 23:27:14.356841,Raw_GL_Export.csv,83.92156862745098,0,True,AUS01,INVALID_ACCT,False,,,True,True,CC2000,Robert Half,MAPPED,2026-02_AUD,1.0,19050.55,DOMESTIC,,,,False,0.0,Sunday,True,True,True,EX003
TXN000358,07-01-2026,30-12-2025,2026-01,AUS01,INVALID_ACCT,CC4100,BCG,INV53072,,NZD,27763.03,EXPORT,Payment for consulting,SAP,2026-01-07,2025-12-30,2026,01,27763.03,False,payment for consulting,2026-02-22 23:27:14.356841,Raw_GL_Export.csv,83.92156862745098,0,True,AUS01,INVALID_ACCT,False,,,True,True,CC4100,Boston Consulting Group,MAPPED,2026-01_NZD,0.9335,25916.788505,CONVERTED,,,,False,0.0,Wednesday,False,True,True,EX001;EX003
TXN000359,16/02/2026,15/02/2026,2026-02,AUS01,INVALID_ACCT,CC2000,ServiceNow Inc,INV73012,PO6431,GBP,28114.01,GST-FREE,Payment for consulting,Oracle,2026-02-16,2026-02-15,2026,02,28114.01,False,payment for consulting,2026-02-22 23:27:14.356841,Raw_GL_Export.csv,83.92156862745098,0,True,AUS01,INVALID_ACCT,False,,,True,True,CC2000,ServiceNow,MAPPED,2026-02_GBP,1.955,54962.88955,CONVERTED,,,,False,0.0,Monday,False,True,True,EX003;EX004
TXN000360,13/02/2026,12/02/2026,2026-02,AUS01,INVALID_ACCT,CC3000,AWS,INV28664,,AUD,16169.11,GST,Payment for goods,API Import,2026-02-13,2026-02-12,2026,02,16169.11,False,payment for goods,2026-02-22 23:27:14.356841,Raw_GL_Export.csv,83.92156862745098,0,True,AUS01,INVALID_ACCT,False,,,True,True,CC3000,Amazon Web Services,MAPPED,2026-02_AUD,1.0,16169.11,DOMESTIC,,,,False,0.0,Friday,False,True,True,EX001;EX003
TXN000361,01/25/2026,01/24/2026,2026-01,AUS01,INVALID_ACCT,CC1000,SAP,INV44340,PO6567,USD,12856.13,GST-FREE,Payment for license,Oracle,2026-01-25,2026-01-24,2026,01,12856.13,False,payment for license,2026-02-22 23:27:14.356841,Raw_GL_Export.csv,83.92156862745098,0,True,AUS01,INVALID_ACCT,False,,,True,True,CC1000,SAP SE,MAPPED,2026-01_USD,1.527,19631.31051,CONVERTED,,,,False,0.0,Sunday,True,True,True,EX003
TXN000362,06/02/2026,05/02/2026,2026-02,AUS01,INVALID_ACCT,CC1200,Deloitte Touche,INV59666,PO2818,AUD,1042.62,GST-FREE,Payment for subscription,Oracle,2026-02-06,2026-02-05,2026,02,1042.62,False,payment for subscription,2026-02-22 23:27:14.356841,Raw_GL_Export.csv,83.92156862745098,0,True,AUS01,INVALID_ACCT,False,,,True,True,CC1200,Deloitte,MAPPED,2026-02_AUD,1.0,1042.62,DOMESTIC,,,,False,0.0,Friday,False,True,True,EX003
TXN000363,10-02-2026,06-02-2026,2026-02,AUS01,INVALID_ACCT,CC3000,Regus Australia,INV18569,,USD,42358.16,EXPORT,Payment for goods,Oracle,2026-02-10,2026-02-06,2026,02,42358.16,False,payment for goods,2026-02-22 23:27:14.356841,Raw_GL_Export.csv,83.92156862745098,0,True,AUS01,INVALID_ACCT,False,,,True,True,CC3000,Regus,MAPPED,2026-02_USD,1.525,64596.194,CONVERTED,,,,False,0.0,Tuesday,False,True,True,EX001;EX003;EX004
TXN000364,07-02-2026,01-02-2026,2026-02,AUS01,INVALID_ACCT,CC3000,Telstra Corp,INV80184,,USD,41453.51,GST-FREE,Payment for goods,Workday,2026-02-07,2026-02-01,2026,02,41453.51,False,payment for goods,2026-02-22 23:27:14.356841,Raw_GL_Export.csv,83.92156862745098,0,True,AUS01,INVALID_ACCT,False,,,True,True,CC3000,Telstra,MAPPED,2026-02_USD,1.525,63216.60275,CONVERTED,,,,False,0.0,Saturday,True,True,True,EX001;EX003;EX004
TXN000365,2025-05-08,2025-05-03,2025-05,AUS01,INVALID_ACCT,CC1200,Robert Half International,INV71691,PO2062,GBP,9494.77,GST,Payment for goods,API Import,2025-05-08,2025-05-03,2025,05,9494.77,False,payment for goods,2026-02-22 23:27:14.356841,Raw_GL_Export.csv,83.92156862745098,0,True,AUS01,INVALID_ACCT,False,,,True,True,CC1200,Robert Half,MAPPED,2025-05_GBP,1.948,18495.81196,CONVERTED,,,,False,0.0,Thursday,False,True,True,EX003
TXN000366,02/13/2026,02/05/2026,2026-02,AUS01,INVALID_ACCT,CC4000,LinkedIn Corp,INV78875,PO9106,USD,14549.86,INPUT,Payment for consulting,Workday,2026-02-13,2026-05-02,2026,02,14549.86,False,payment for consulting,2026-02-22 23:27:14.356841,Raw_GL_Export.csv,83.92156862745098,0,True,AUS01,INVALID_ACCT,False,,,True,True,CC4000,LinkedIn,MAPPED,2026-02_USD,1.525,22188.5365,CONVERTED,,,,False,0.0,Friday,False,True,True,EX003
TXN000367,19-02-2026,09-02-2026,2026-02,AUS01,INVALID_ACCT,CC1000,Workday,INV40721,PO6013,USD,40280.32,EXPORT,Payment for consulting,Manual Entry,2026-02-19,2026-02-09,2026,02,40280.32,False,payment for consulting,2026-02-22 23:27:14.356841,Raw_GL_Export.csv,83.92156862745098,0,True,AUS01,INVALID_ACCT,False,,,True,True,CC1000,Workday Inc,MAPPED,2026-02_USD,1.525,61427.488,CONVERTED,,,,False,0.0,Thursday,False,True,True,EX003;EX004
TXN000368,19/01/2026,13/01/2026,2026-01,AUS01,INVALID_ACCT,CC2100,Google,INV68262,PO4771,USD,33847.86,INPUT,Payment for license,SAP,2026-01-19,2026-01-13,2026,01,33847.86,False,payment for license,2026-02-22 23:27:14.356841,Raw_GL_Export.csv,83.92156862745098,0,True,AUS01,INVALID_ACCT,False,,,True,True,CC2100,Google Cloud,MAPPED,2026-01_USD,1.527,51685.682219999995,CONVERTED,,,,False,0.0,Monday,False,True,True,EX003;EX004
TXN000369,01/15/2026,01/08/2026,2026-01,AUS01,INVALID_ACCT,CC3200,LinkedIn Corp,INV51552,,GBP,18461.98,EXPORT,Payment for services,Oracle,2026-01-15,2026-08-01,2026,01,18461.98,False,payment for services,2026-02-22 23:27:14.356841,Raw_GL_Export.csv,83.92156862745098,0,True,AUS01,INVALID_ACCT,False,,,True,True,CC3200,LinkedIn,MAPPED,2026-01_GBP,1.957,36130.09486,CONVERTED,,,,False,0.0,Thursday,False,True,True,EX001;EX003
TXN000370,15/01/2026,10/01/2026,2026-01,AUS01,INVALID_ACCT,CC1100,WeWork Australia,INV46231,PO2612,AUD,13323.85,GST,Payment for services,SAP,2026-01-15,2026-01-10,2026,01,13323.85,False,payment for services,2026-02-22 23:27:14.356841,Raw_GL_Export.csv,83.92156862745098,0,True,AUS01,INVALID_ACCT,False,,,True,True,CC1100,WeWork,MAPPED,2026-01_AUD,1.0,13323.85,DOMESTIC,,,,False,0.0,Thursday,False,True,True,EX003
TXN000371,2026-02-12,2026-02-03,2026-02,AUS01,INVALID_ACCT,CC2000,BCG,INV49677,PO5496,USD,30412.32,INPUT,Payment for goods,API Import,2026-02-12,2026-02-03,2026,02,30412.32,False,payment for goods,2026-02-22 23:27:14.356841,Raw_GL_Export.csv,83.92156862745098,0,True,AUS01,INVALID_ACCT,False,,,True,True,CC2000,Boston Consulting Group,MAPPED,2026-02_USD,1.525,46378.788,CONVERTED,,,,False,0.0,Thursday,False,True,True,EX003
TXN000372,01/05/2026,01/04/2026,2026-01,AUS01,INVALID_ACCT,CC2100,KPMG Australia,INV63183,PO1194,NZD,35262.46,EXPORT,Payment for consulting,API Import,2026-05-01,2026-04-01,2026,01,35262.46,False,payment for consulting,2026-02-22 23:27:14.356841,Raw_GL_Export.csv,83.92156862745098,1,True,AUS01,INVALID_ACCT,False,,,True,True,CC2100,KPMG,MAPPED,2026-01_NZD,0.9335,32917.50641,CONVERTED,,,,False,0.0,Friday,False,True,True,EX003
TXN000373,25/05/2025,18/05/2025,2025-05,AUS01,INVALID_ACCT,CC2000,ServiceNow Inc,INV70476,PO2406,USD,21402.28,EXPORT,Payment for subscription,Oracle,2025-05-25,2025-05-18,2025,05,21402.28,False,payment for subscription,2026-02-22 23:27:14.356841,Raw_GL_Export.csv,83.92156862745098,0,True,AUS01,INVALID_ACCT,False,,,True,True,CC2000,ServiceNow,MAPPED,2025-05_USD,1.518,32488.66104,CONVERTED,,,,False,0.0,Sunday,True,True,True,EX003
TXN000374,14-01-2026,10-01-2026,2026-01,AUS01,INVALID_ACCT,CC3200,Optus Pty,INV50051,PO1158,AUD,16924.04,GST-FREE,Payment for consulting,Workday,2026-01-14,2026-01-10,2026,01,16924.04,False,payment for consulting,2026-02-22 23:27:14.356841,Raw_GL_Export.csv,83.92156862745098,0,True,AUS01,INVALID_ACCT,False,,,True,True,CC3200,Optus,MAPPED,2026-01_AUD,1.0,16924.04,DOMESTIC,,,,False,0.0,Wednesday,False,True,True,EX003
TXN000375,11/02/2026,04/02/2026,2026-02,AUS01,INVALID_ACCT,CC3100,DHL Express,INV84393,PO3279,NZD,14740.97,GST,Payment for goods,Workday,2026-02-11,2026-02-04,2026,02,14740.97,False,payment for goods,2026-02-22 23:27:14.356841,Raw_GL_Export.csv,83.92156862745098,0,True,AUS01,INVALID_ACCT,False,,,True,True,CC3100,DHL,MAPPED,2026-02_NZD,0.932,13738.58404,CONVERTED,,,,False,0.0,Wednesday,False,True,True,EX003
TXN000376,19-02-2026,12-02-2026,2026-02,AUS01,INVALID_ACCT,CC2000,DHL Express,INV72230,,AUD,24098.63,GST-FREE,Payment for license,Manual Entry,2026-02-19,2026-02-12,2026,02,24098.63,False,payment for license,2026-02-22 23:27:14.356841,Raw_GL_Export.csv,83.92156862745098,0,True,AUS01,INVALID_ACCT,False,,,True,True,CC2000,DHL,MAPPED,2026-02_AUD,1.0,24098.63,DOMESTIC,,,,False,0.0,Thursday,False,True,True,EX001;EX003
TXN000377,08/21/2025,08/19/2025,2025-08,AUS01,5120,CC1100,Unlisted Company,INV13517,,USD,1539.46,EXPORT,Payment for services,Manual Entry,2025-08-21,2025-08-19,2025,08,1539.46,False,payment for services,2026-02-22 23:27:14.356841,Raw_GL_Export.csv,83.92156862745098,1,True,AUS01,5120,True,5120,Office Supplies,True,True,CC1100,,UNMAPPED,2025-08_USD,1.524,2346.13704,CONVERTED,34269.00595485611,35424.20705021751,139.0,False,0.0,Thursday,False,True,True,EX001;EX006
TXN000378,10/01/2026,06/01/2026,2026-01,AUS01,5300,CC4000,Unknown Vendor LLC,INV32521,PO7731,GBP,2679.65,GST,Payment for consulting,Oracle,2026-01-10,2026-01-06,2026,01,2679.65,False,payment for consulting,2026-02-22 23:27:14.356841,Raw_GL_Export.csv,83.92156862745098,1,True,AUS01,5300,True,5300,Professional Services,True,True,CC4000,,UNMAPPED,2026-01_GBP,1.957,5244.07505,CONVERTED,33232.533450429684,35951.49997313202,128.0,False,0.0,Saturday,True,True,True,EX006
TXN000379,04/01/2026,26/12/2025,2026-01,AUS01,5410,CC3200,Unknown Vendor LLC,INV27030,PO6075,GBP,42983.84,GST-FREE,Payment for consulting,Manual Entry,2026-01-04,2025-12-26,2026,01,42983.84,False,payment for consulting,2026-02-22 23:27:14.356841,Raw_GL_Export.csv,83.92156862745098,1,True,AUS01,5410,True,5410,Accommodation,True,True,CC3200,,UNMAPPED,2026-01_GBP,1.957,84119.37488,CONVERTED,29277.518810999987,22143.12829502557,155.0,False,0.0,Sunday,True,True,True,EX004;EX006
TXN000380,02/06/2026,01/27/2026,2026-02,AUS01,5200,CC4000,New Vendor XYZ,INV68422,,NZD,9156.45,GST-FREE,Payment for consulting,API Import,2026-06-02,2026-01-27,2026,02,9156.45,False,payment for consulting,2026-02-22 23:27:14.356841,Raw_GL_Export.csv,83.92156862745098,2,True,AUS01,5200,True,5200,Software Licenses,True,True,CC4000,,UNMAPPED,2026-02_NZD,0.932,8533.8114,CONVERTED,30196.543712413786,22166.314759696765,145.0,False,0.0,Tuesday,False,True,True,EX001;EX006;EX007
TXN000381,26/01/2026,17/01/2026,2026-01,AUS01,5310,CC4100,New Vendor XYZ,INV21941,,GBP,20875.03,GST,Payment for consulting,Workday,2026-01-26,2026-01-17,2026,01,20875.03,False,payment for consulting,2026-02-22 23:27:14.356841,Raw_GL_Export.csv,83.92156862745098,1,True,AUS01,5310,True,5310,Legal Fees,True,True,CC4100,,UNMAPPED,2026-01_GBP,1.957,40852.43371,CONVERTED,33139.04129260232,28423.631835285127,171.0,False,0.0,Monday,False,True,True,EX001;EX006
TXN000382,02/23/2026,02/16/2026,2026-02,AUS01,5610,CC1200,New Vendor XYZ,INV70008,PO4005,USD,8163.06,EXPORT,Payment for license,SAP,2026-02-23,2026-02-16,2026,02,8163.06,False,payment for license,2026-02-22 23:27:14.356841,Raw_GL_Export.csv,83.92156862745098,1,True,AUS01,5610,True,5610,Postage and Courier,True,True,CC1200,,UNMAPPED,2026-02_USD,1.525,12448.6665,CONVERTED,29081.766845273953,25872.32663648796,146.0,False,0.0,Monday,False,True,True,EX006
TXN000383,2026-01-13,2026-01-09,2026-01,AUS01,5920,CC1200,Unregistered Supplier,INV38476,PO7738,NZD,30032.9,GST,Payment for license,SAP,2026-01-13,2026-01-09,2026,01,30032.9,False,payment for license,2026-02-22 23:27:14.356841,Raw_GL_Export.csv,83.92156862745098,1,True,AUS01,5920,True,5920,FX Loss,True,True,CC1200,,UNMAPPED,2026-01_NZD,0.9335,28035.712150000003,CONVERTED,27533.92400565971,21784.021192347693,144.0,False,0.0,Tuesday,False,True,True,EX006
TXN000384,2026-02-12,2026-02-10,2026-02,AUS01,5510,CC3000,New Vendor XYZ,INV76330,,GBP,7501.28,GST-FREE,Payment for services,SAP,2026-02-12,2026-02-10,2026,02,7501.28,False,payment for services,2026-02-22 23:27:14.356841,Raw_GL_Export.csv,83.92156862745098,1,True,AUS01,5510,True,5510,Advertising,True,True,CC3000,,UNMAPPED,2026-02_GBP,1.955,14665.0024,CONVERTED,28498.583342781956,23667.16979723599,133.0,False,0.0,Thursday,False,True,True,EX001;EX006
TXN000385,21-01-2026,14-01-2026,2026-01,AUS01,5310,CC3100,Mystery Corp,INV25031,PO3236,GBP,1796.08,INPUT,Payment for subscription,Manual Entry,2026-01-21,2026-01-14,2026,01,1796.08,False,payment for subscription,2026-02-22 23:27:14.356841,Raw_GL_Export.csv,83.92156862745098,1,True,AUS01,5310,True,5310,Legal Fees,True,True,CC3100,,UNMAPPED,2026-01_GBP,1.957,3514.92856,CONVERTED,33139.04129260232,28423.631835285127,171.0,False,0.0,Wednesday,False,True,True,EX006
TXN000386,16-11-2025,14-11-2025,2025-11,AUS01,5020,CC4000,Mystery Corp,INV31150,,GBP,6397.48,INPUT,Payment for services,API Import,2025-11-16,2025-11-14,2025,11,6397.48,False,payment for services,2026-02-22 23:27:14.356841,Raw_GL_Export.csv,83.92156862745098,1,True,AUS01,5020,True,5020,Contractor Fees,True,True,CC4000,,UNMAPPED,2025-11_GBP,1.956,12513.470879999999,CONVERTED,28445.577844280295,21241.721119146277,132.0,False,0.0,Sunday,True,True,True,EX001;EX006
TXN000387,04/02/2026,30/01/2026,2026-02,AUS01,5100,CC4000,New Vendor XYZ,INV98785,,USD,3583.58,GST,Payment for consulting,Workday,2026-02-04,2026-01-30,2026,02,3583.58,False,payment for consulting,2026-02-22 23:27:14.356841,Raw_GL_Export.csv,83.92156862745098,1,True,AUS01,5100,True,5100,Office Rent,True,True,CC4000,,UNMAPPED,2026-02_USD,1.525,5464.9595,CONVERTED,29138.02959753333,27547.65120166844,150.0,False,0.0,Wednesday,False,True,True,EX001;EX006
TXN000388,06/02/2025,05/02/2025,2025-02,AUS01,5700,CC4000,Mystery Corp,INV61199,PO8274,GBP,31383.73,GST,Payment for services,API Import,2025-02-06,2025-02-05,2025,02,31383.73,False,payment for services,2026-02-22 23:27:14.356841,Raw_GL_Export.csv,83.92156862745098,1,True,AUS01,5700,True,5700,Training,True,True,CC4000,,UNMAPPED,2025-02_GBP,1.94,60884.4362,CONVERTED,31110.431902446802,30160.111495086097,141.0,False,0.0,Thursday,False,True,True,EX004;EX006
TXN000389,2025-11-01,2025-10-25,2025-11,AUS01,5810,CC2000,Mystery Corp,INV21978,,NZD,40903.16,GST-FREE,Payment for services,SAP,2025-11-01,2025-10-25,2025,11,40903.16,False,payment for services,2026-02-22 23:27:14.356841,Raw_GL_Export.csv,83.92156862745098,1,True,AUS01,5810,True,5810,Amortization,True,True,CC2000,,UNMAPPED,2025-11_NZD,0.933,38162.64828000001,CONVERTED,31768.91314562501,27328.351394475325,120.0,False,0.0,Saturday,True,True,True,EX001;EX006
TXN000390,11/01/2026,09/01/2026,2026-01,AUS01,5210,CC1100,Mystery Corp,INV52879,PO4105,USD,2076.16,GST,Payment for license,Oracle,2026-01-11,2026-01-09,2026,01,2076.16,False,payment for license,2026-02-22 23:27:14.356841,Raw_GL_Export.csv,83.92156862745098,1,True,AUS01,5210,True,5210,Cloud Services,True,True,CC1100,,UNMAPPED,2026-01_USD,1.527,3170.2963199999995,CONVERTED,31620.56664919015,27460.393400888206,142.0,False,0.0,Sunday,True,True,True,EX006
TXN000391,18-01-2026,11-01-2026,2026-01,AUS01,5100,CC2000,Mystery Corp,INV11965,PO6181,AUD,16110.28,GST-FREE,Payment for services,Manual Entry,2026-01-18,2026-01-11,2026,01,16110.28,False,payment for services,2026-02-22 23:27:14.356841,Raw_GL_Export.csv,83.92156862745098,1,True,AUS01,5100,True,5100,Office Rent,True,True,CC2000,,UNMAPPED,2026-01_AUD,1.0,16110.28,DOMESTIC,29138.02959753333,27547.65120166844,150.0,False,0.0,Sunday,True,True,True,EX006
TXN000392,07-10-2025,03-10-2025,2025-10,AUS01,5020,CC2100,Unlisted Company,INV63883,PO9185,NZD,2072.86,GST-FREE,Payment for services,API Import,2025-10-07,2025-10-03,2025,10,2072.86,False,payment for services,2026-02-22 23:27:14.356841,Raw_GL_Export.csv,83.92156862745098,1,True,AUS01,5020,True,5020,Contractor Fees,True,True,CC2100,,UNMAPPED,2025-10_NZD,0.929,1925.6869400000003,CONVERTED,28445.577844280295,21241.721119146277,132.0,False,0.0,Tuesday,False,True,True,EX006
TXN000393,26/03/2025,21/03/2025,2025-03,AUS01,5100,CC4100,Unregistered Supplier,INV53522,,GBP,30537.73,GST-FREE,Payment for subscription,Manual Entry,2025-03-26,2025-03-21,2025,03,30537.73,False,payment for subscription,2026-02-22 23:27:14.356841,Raw_GL_Export.csv,83.92156862745098,1,True,AUS01,5100,True,5100,Office Rent,True,True,CC4100,,UNMAPPED,2025-03_GBP,1.96,59853.9508,CONVERTED,29138.02959753333,27547.65120166844,150.0,False,0.0,Wednesday,False,True,True,EX001;EX004;EX006
TXN000394,02/03/2026,02/02/2026,2026-02,AUS01,5610,CC4100,New Vendor XYZ,INV75984,PO1217,GBP,23045.07,GST-FREE,Payment for goods,SAP,2026-03-02,2026-02-02,2026,02,23045.07,False,payment for goods,2026-02-22 23:27:14.356841,Raw_GL_Export.csv,83.92156862745098,2,True,AUS01,5610,True,5610,Postage and Courier,True,True,CC4100,,UNMAPPED,2026-02_GBP,1.955,45053.11185,CONVERTED,29081.766845273953,25872.32663648796,146.0,False,0.0,Monday,False,True,True,EX006;EX007
TXN000395,2026-02-20,2026-02-15,2026-02,AUS01,5210,CC3100,Mystery Corp,INV75369,,AUD,2790.54,INPUT,Payment for goods,Manual Entry,2026-02-20,2026-02-15,2026,02,2790.54,False,payment for goods,2026-02-22 23:27:14.356841,Raw_GL_Export.csv,83.92156862745098,1,True,AUS01,5210,True,5210,Cloud Services,True,True,CC3100,,UNMAPPED,2026-02_AUD,1.0,2790.54,DOMESTIC,31620.56664919015,27460.393400888206,142.0,False,0.0,Friday,False,True,True,EX001;EX006
TXN000396,2025-07-07,2025-07-03,2025-07,AUS01,5800,CC4100,New Vendor XYZ,INV94358,PO1648,NZD,6128.59,INPUT,Payment for license,Manual Entry,2025-07-07,2025-07-03,2025,07,6128.59,False,payment for license,2026-02-22 23:27:14.356841,Raw_GL_Export.csv,83.92156862745098,1,True,AUS01,5800,True,5800,Depreciation,True,True,CC4100,,UNMAPPED,2025-07_NZD,0.934,5724.10306,CONVERTED,30184.39373025477,34245.09535020032,157.0,False,0.0,Monday,False,True,True,EX006
TXN000397,01/21/2026,01/20/2026,2026-01,AUS01,5210,CC3000,Unregistered Supplier,INV97163,PO4644,USD,9341.2,GST,Payment for license,Manual Entry,2026-01-21,2026-01-20,2026,01,9341.2,False,payment for license,2026-02-22 23:27:14.356841,Raw_GL_Export.csv,83.92156862745098,1,True,AUS01,5210,True,5210,Cloud Services,True,True,CC3000,,UNMAPPED,2026-01_USD,1.527,14264.0124,CONVERTED,31620.56664919015,27460.393400888206,142.0,False,0.0,Wednesday,False,True,True,EX006
TXN000398,07/17/2025,07/14/2025,2025-07,AUS01,5420,CC1000,Unknown Vendor LLC,INV16829,PO3318,GBP,3242.32,GST-FREE,Payment for goods,Oracle,2025-07-17,2025-07-14,2025,07,3242.32,False,payment for goods,2026-02-22 23:27:14.356841,Raw_GL_Export.csv,83.92156862745098,1,True,AUS01,5420,True,5420,Meals and Entertainment,True,True,CC1000,,UNMAPPED,2025-07_GBP,1.958,6348.46256,CONVERTED,30119.54810314684,25344.73848974119,143.0,False,0.0,Thursday,False,True,True,EX006
TXN000399,03/01/2026,24/12/2025,2026-01,AUS01,5520,CC2000,Mystery Corp,INV50824,,AUD,19238.17,EXPORT,Payment for goods,Oracle,2026-01-03,2025-12-24,2026,01,19238.17,False,payment for goods,2026-02-22 23:27:14.356841,Raw_GL_Export.csv,83.92156862745098,1,True,AUS01,5520,True,5520,Events,True,True,CC2000,,UNMAPPED,2026-01_AUD,1.0,19238.17,DOMESTIC,30860.276023483882,21900.267908653983,155.0,False,0.0,Saturday,True,True,True,EX001;EX006
TXN000400,14/02/2026,04/02/2026,2026-02,AUS01,5210,CC2100,Unregistered Supplier,INV45633,PO8883,GBP,43550.89,GST-FREE,Payment for services,Workday,2026-02-14,2026-02-04,2026,02,43550.89,False,payment for services,2026-02-22 23:27:14.356841,Raw_GL_Export.csv,83.92156862745098,1,True,AUS01,5210,True,5210,Cloud Services,True,True,CC2100,,UNMAPPED,2026-02_GBP,1.955,85141.98995,CONVERTED,31620.56664919015,27460.393400888206,142.0,False,0.0,Saturday,True,True,True,EX004;EX006
TXN000401,13-01-2026,10-01-2026,2026-01,AUS01,5500,CC3200,New Vendor XYZ,INV12596,PO8002,GBP,34238.57,EXPORT,Payment for services,Workday,2026-01-13,2026-01-10,2026,01,34238.57,False,payment for services,2026-02-22 23:27:14.356841,Raw_GL_Export.csv,83.92156862745098,1,True,AUS01,5500,True,5500,Marketing,True,True,CC3200,,UNMAPPED,2026-01_GBP,1.957,67004.88149,CONVERTED,28972.634359125877,32785.70497360227,143.0,False,0.0,Tuesday,False,True,True,EX004;EX006
TXN000402,20/02/2026,11/02/2026,2026-02,AUS01,5800,CC1200,Unregistered Supplier,INV47122,PO8878,GBP,20917.94,EXPORT,Payment for services,Workday,2026-02-20,2026-02-11,2026,02,20917.94,False,payment for services,2026-02-22 23:27:14.356841,Raw_GL_Export.csv,83.92156862745098,1,True,AUS01,5800,True,5800,Depreciation,True,True,CC1200,,UNMAPPED,2026-02_GBP,1.955,40894.5727,CONVERTED,30184.39373025477,34245.09535020032,157.0,False,0.0,Friday,False,True,True,EX006
TXN000403,05-02-2026,01-02-2026,2026-02,AUS01,5110,CC2000,Unknown Vendor LLC,INV74415,PO7812,AUD,38788.32,INPUT,Payment for consulting,Workday,2026-02-05,2026-02-01,2026,02,38788.32,False,payment for consulting,2026-02-22 23:27:14.356841,Raw_GL_Export.csv,83.92156862745098,1,True,AUS01,5110,True,5110,Utilities,True,True,CC2000,,UNMAPPED,2026-02_AUD,1.0,38788.32,DOMESTIC,27865.288293732876,21409.69928933269,146.0,False,0.0,Thursday,False,True,True,EX006
TXN000404,13-02-2026,08-02-2026,2026-02,AUS01,5620,CC4100,Unknown Vendor LLC,INV60439,PO3660,GBP,39836.48,GST,Payment for goods,Manual Entry,2026-02-13,2026-02-08,2026,02,39836.48,False,payment for goods,2026-02-22 23:27:14.356841,Raw_GL_Export.csv,83.92156862745098,1,True,AUS01,5620,True,5620,Insurance,True,True,CC4100,,UNMAPPED,2026-02_GBP,1.955,77880.3184,CONVERTED,32410.971605588227,27490.799177232966,170.0,False,0.0,Friday,False,True,True,EX004;EX006
TXN000405,01/09/2026,12/31/2025,2026-01,AUS01,5710,CC3200,Unregistered Supplier,INV42347,,AUD,29325.69,EXPORT,Payment for services,Workday,2026-09-01,2025-12-31,2026,01,29325.69,False,payment for services,2026-02-22 23:27:14.356841,Raw_GL_Export.csv,83.92156862745098,2,True,AUS01,5710,True,5710,Recruitment,True,True,CC3200,,UNMAPPED,2026-01_AUD,1.0,29325.69,DOMESTIC,29496.09592285716,24753.031499859637,133.0,False,0.0,Tuesday,False,True,True,EX001;EX006
TXN000406,2025-11-21,2025-11-18,2025-11,AUS01,5220,CC4100,New Vendor XYZ,INV11617,,USD,11517.53,GST-FREE,Payment for services,Manual Entry,2025-11-21,2025-11-18,2025,11,11517.53,False,payment for services,2026-02-22 23:27:14.356841,Raw_GL_Export.csv,83.92156862745098,1,True,AUS01,5220,True,5220,IT Support,True,True,CC4100,,UNMAPPED,2025-11_USD,1.526,17575.750780000002,CONVERTED,29540.94372533058,19404.169897416657,121.0,False,0.0,Friday,False,True,True,EX001;EX006
TXN000407,2026-02-13,2026-02-04,2026-02,AUS01,5200,CC3100,Mystery Corp,INV75620,PO7271,GBP,11453.92,INPUT,Payment for license,Workday,2026-02-13,2026-02-04,2026,02,11453.92,False,payment for license,2026-02-22 23:27:14.356841,Raw_GL_Export.csv,83.92156862745098,1,True,AUS01,5200,True,5200,Software Licenses,True,True,CC3100,,UNMAPPED,2026-02_GBP,1.955,22392.4136,CONVERTED,30196.543712413786,22166.314759696765,145.0,False,0.0,Friday,False,True,True,EX006
TXN000408,24-02-2025,22-02-2025,2025-02,AUS01,5100,CC4100,Unregistered Supplier,INV62162,PO1105,USD,12179.06,GST-FREE,Payment for goods,Manual Entry,2025-02-24,2025-02-22,2025,02,12179.06,False,payment for goods,2026-02-22 23:27:14.356841,Raw_GL_Export.csv,83.92156862745098,1,True,AUS01,5100,True,5100,Office Rent,True,True,CC4100,,UNMAPPED,2025-02_USD,1.51,18390.3806,CONVERTED,29138.02959753333,27547.65120166844,150.0,False,0.0,Monday,False,True,True,EX006
TXN000409,2026-01-01,2025-12-30,2026-01,AUS01,5810,CC3100,Unlisted Company,INV32365,,GBP,29488.0,EXPORT,Payment for goods,Oracle,2026-01-01,2025-12-30,2026,01,29488.0,False,payment for goods,2026-02-22 23:27:14.356841,Raw_GL_Export.csv,83.92156862745098,1,True,AUS01,5810,True,5810,Amortization,True,True,CC3100,,UNMAPPED,2026-01_GBP,1.957,57708.016,CONVERTED,31768.91314562501,27328.351394475325,120.0,False,0.0,Thursday,False,True,True,EX001;EX004;EX006
TXN000410,07-01-2026,04-01-2026,2026-01,AUS01,5510,CC1100,New Vendor XYZ,INV33950,PO4143,USD,8435.15,GST,Payment for subscription,Manual Entry,2026-01-07,2026-01-04,2026,01,8435.15,False,payment for subscription,2026-02-22 23:27:14.356841,Raw_GL_Export.csv,83.92156862745098,1,True,AUS01,5510,True,5510,Advertising,True,True,CC1100,,UNMAPPED,2026-01_USD,1.527,12880.474049999999,CONVERTED,28498.583342781956,23667.16979723599,133.0,False,0.0,Wednesday,False,True,True,EX006
TXN000411,2025-11-15,2025-11-12,2025-11,AUS01,5020,CC2100,Unknown Vendor LLC,INV54846,,GBP,5698.2,GST,Payment for goods,Manual Entry,2025-11-15,2025-11-12,2025,11,5698.2,False,payment for goods,2026-02-22 23:27:14.356841,Raw_GL_Export.csv,83.92156862745098,1,True,AUS01,5020,True,5020,Contractor Fees,True,True,CC2100,,UNMAPPED,2025-11_GBP,1.956,11145.679199999999,CONVERTED,28445.577844280295,21241.721119146277,132.0,False,0.0,Saturday,True,True,True,EX001;EX006
TXN000412,2026-01-16,2026-01-15,2026-01,AUS01,5010,CC2100,Unknown Vendor LLC,INV59239,PO5355,AUD,4448.2,GST,Payment for consulting,Manual Entry,2026-01-16,2026-01-15,2026,01,4448.2,False,payment for consulting,2026-02-22 23:27:14.356841,Raw_GL_Export.csv,83.92156862745098,1,True,AUS01,5010,True,5010,Employee Benefits,True,True,CC2100,,UNMAPPED,2026-01_AUD,1.0,4448.2,DOMESTIC,27923.213086278203,19430.63083039902,133.0,False,0.0,Friday,False,True,True,EX006
TXN000413,02/25/2026,02/15/2026,2026-02,AUS01,5410,CC3000,Unregistered Supplier,INV57344,PO7200,NZD,44975.09,GST-FREE,Payment for license,SAP,2026-02-25,2026-02-15,2026,02,44975.09,False,payment for license,2026-02-22 23:27:14.356841,Raw_GL_Export.csv,83.92156862745098,1,True,AUS01,5410,True,5410,Accommodation,True,True,CC3000,,UNMAPPED,2026-02_NZD,0.932,41916.783879999995,CONVERTED,29277.518810999987,22143.12829502557,155.0,False,0.0,Wednesday,False,True,True,EX006
TXN000414,01/12/2026,01/10/2026,2026-01,AUS01,5000,CC3200,New Vendor XYZ,INV79550,,USD,1253.05,GST,Payment for goods,Workday,2026-12-01,2026-10-01,2026,01,1253.05,False,payment for goods,2026-02-22 23:27:14.356841,Raw_GL_Export.csv,83.92156862745098,2,True,AUS01,5000,True,5000,Salaries and Wages,True,True,CC3200,,UNMAPPED,2026-01_USD,1.527,1913.4073499999997,CONVERTED,30471.385558248177,22939.768434623154,137.0,False,0.0,Tuesday,False,True,True,EX001;EX006
TXN000415,15-02-2026,06-02-2026,2026-02,AUS01,5410,CC2000,Unknown Vendor LLC,INV15997,PO6333,NZD,846.7,INPUT,Payment for consulting,Oracle,2026-02-15,2026-02-06,2026,02,846.7,False,payment for consulting,2026-02-22 23:27:14.356841,Raw_GL_Export.csv,83.92156862745098,1,True,AUS01,5410,True,5410,Accommodation,True,True,CC2000,,UNMAPPED,2026-02_NZD,0.932,789.1244,CONVERTED,29277.518810999987,22143.12829502557,155.0,False,0.0,Sunday,True,True,True,EX006
TXN000416,20-02-2026,13-02-2026,2026-02,AUS01,5800,CC4100,Unknown Vendor LLC,INV96289,PO2645,NZD,19313.44,EXPORT,Payment for consulting,Workday,2026-02-20,2026-02-13,2026,02,19313.44,False,payment for consulting,2026-02-22 23:27:14.356841,Raw_GL_Export.csv,83.92156862745098,1,True,AUS01,5800,True,5800,Depreciation,True,True,CC4100,,UNMAPPED,2026-02_NZD,0.932,18000.12608,CONVERTED,30184.39373025477,34245.09535020032,157.0,False,0.0,Friday,False,True,True,EX006
TXN000417,20/01/2026,17/01/2026,2026-01,AUS01,5920,CC4000,Unlisted Company,INV49498,PO9990,AUD,5840.97,GST,Payment for consulting,Oracle,2026-01-20,2026-01-17,2026,01,5840.97,False,payment for consulting,2026-02-22 23:27:14.356841,Raw_GL_Export.csv,83.92156862745098,1,True,AUS01,5920,True,5920,FX Loss,True,True,CC4000,,UNMAPPED,2026-01_AUD,1.0,5840.97,DOMESTIC,27533.92400565971,21784.021192347693,144.0,False,0.0,Tuesday,False,True,True,EX006
TXN000418,2025-02-15,2025-02-07,2025-02,AUS01,5700,CC4000,Mystery Corp,INV23824,PO1478,USD,9602.67,GST,Payment for goods,Workday,2025-02-15,2025-02-07,2025,02,9602.67,False,payment for goods,2026-02-22 23:27:14.356841,Raw_GL_Export.csv,83.92156862745098,1,True,AUS01,5700,True,5700,Training,True,True,CC4000,,UNMAPPED,2025-02_USD,1.51,14500.0317,CONVERTED,31110.431902446802,30160.111495086097,141.0,False,0.0,Saturday,True,True,True,EX006
TXN000419,02/13/2026,02/09/2026,2026-02,AUS01,5800,CC2100,New Vendor XYZ,INV21854,PO6452,AUD,29979.89,EXPORT,Payment for goods,API Import,2026-02-13,2026-09-02,2026,02,29979.89,False,payment for goods,2026-02-22 23:27:14.356841,Raw_GL_Export.csv,83.92156862745098,1,True,AUS01,5800,True,5800,Depreciation,True,True,CC2100,,UNMAPPED,2026-02_AUD,1.0,29979.89,DOMESTIC,30184.39373025477,34245.09535020032,157.0,False,0.0,Friday,False,True,True,EX006
TXN000420,2026-02-25,2026-02-19,2026-02,AUS01,5400,CC3100,Unlisted Company,INV43959,,GBP,36399.29,GST-FREE,Payment for services,SAP,2026-02-25,2026-02-19,2026,02,36399.29,False,payment for services,2026-02-22 23:27:14.356841,Raw_GL_Export.csv,83.92156862745098,1,True,AUS01,5400,True,5400,Travel,True,True,CC3100,,UNMAPPED,2026-02_GBP,1.955,71160.61195,CONVERTED,31663.682660000006,30146.476988256833,133.0,False,0.0,Wednesday,False,True,True,EX001;EX004;EX006
TXN000421,02/03/2026,01/24/2026,2026-02,AUS01,5200,CC1100,Unlisted Company,INV59832,PO1027,NZD,5821.04,INPUT,Payment for subscription,SAP,2026-03-02,2026-01-24,2026,02,5821.04,False,payment for subscription,2026-02-22 23:27:14.356841,Raw_GL_Export.csv,83.92156862745098,2,True,AUS01,5200,True,5200,Software Licenses,True,True,CC1100,,UNMAPPED,2026-02_NZD,0.932,5425.20928,CONVERTED,30196.543712413786,22166.314759696765,145.0,False,0.0,Monday,False,True,True,EX006;EX007
TXN000422,19/01/2026,12/01/2026,2026-01,AUS01,5410,CC3000,Unregistered Supplier,INV23970,PO9819,USD,23436.84,GST-FREE,Payment for consulting,Workday,2026-01-19,2026-01-12,2026,01,23436.84,False,payment for consulting,2026-02-22 23:27:14.356841,Raw_GL_Export.csv,83.92156862745098,1,True,AUS01,5410,True,5410,Accommodation,True,True,CC3000,,UNMAPPED,2026-01_USD,1.527,35788.05468,CONVERTED,29277.518810999987,22143.12829502557,155.0,False,0.0,Monday,False,True,True,EX006
TXN000423,02/05/2026,02/01/2026,2026-02,AUS01,5500,CC3200,Mystery Corp,INV88496,PO9230,NZD,6649.59,GST,Payment for services,Workday,2026-05-02,2026-01-02,2026,02,6649.59,False,payment for services,2026-02-22 23:27:14.356841,Raw_GL_Export.csv,83.92156862745098,2,True,AUS01,5500,True,5500,Marketing,True,True,CC3200,,UNMAPPED,2026-02_NZD,0.932,6197.417880000001,CONVERTED,28972.634359125877,32785.70497360227,143.0,False,0.0,Saturday,True,True,True,EX006;EX007
TXN000424,28-02-2025,24-02-2025,2025-02,AUS01,5500,CC2100,New Vendor XYZ,INV30014,PO4450,AUD,44153.31,INPUT,Payment for goods,SAP,2025-02-28,2025-02-24,2025,02,44153.31,False,payment for goods,2026-02-22 23:27:14.356841,Raw_GL_Export.csv,83.92156862745098,1,True,AUS01,5500,True,5500,Marketing,True,True,CC2100,,UNMAPPED,2025-02_AUD,1.0,44153.31,DOMESTIC,28972.634359125877,32785.70497360227,143.0,False,0.0,Friday,False,True,True,EX006
TXN000425,28/01/2026,20/01/2026,2026-01,AUS01,5800,CC3100,Unregistered Supplier,INV54225,PO8756,USD,44598.74,EXPORT,Payment for subscription,Manual Entry,2026-01-28,2026-01-20,2026,01,44598.74,False,payment for subscription,2026-02-22 23:27:14.356841,Raw_GL_Export.csv,83.92156862745098,1,True,AUS01,5800,True,5800,Depreciation,True,True,CC3100,,UNMAPPED,2026-01_USD,1.527,68102.27597999999,CONVERTED,30184.39373025477,34245.09535020032,157.0,False,0.0,Wednesday,False,True,True,EX004;EX006
TXN000426,2026-01-13,2026-01-04,2026-01,AUS01,5800,CC2100,Unregistered Supplier,INV22755,,USD,31579.78,EXPORT,Payment for license,SAP,2026-01-13,2026-01-04,2026,01,31579.78,False,payment for license,2026-02-22 23:27:14.356841,Raw_GL_Export.csv,83.92156862745098,1,True,AUS01,5800,True,5800,Depreciation,True,True,CC2100,,UNMAPPED,2026-01_USD,1.527,48222.32406,CONVERTED,30184.39373025477,34245.09535020032,157.0,False,0.0,Tuesday,False,True,True,EX001;EX006
TXN000427,01/28/2026,01/20/2026,2026-01,AUS01,5620,CC1200,Unlisted Company,INV48152,PO4436,USD,19940.58,EXPORT,Payment for goods,Oracle,2026-01-28,2026-01-20,2026,01,19940.58,False,payment for goods,2026-02-22 23:27:14.356841,Raw_GL_Export.csv,83.92156862745098,1,True,AUS01,5620,True,5620,Insurance,True,True,CC1200,,UNMAPPED,2026-01_USD,1.527,30449.26566,CONVERTED,32410.971605588227,27490.799177232966,170.0,False,0.0,Wednesday,False,True,True,EX006
TXN000428,2025-04-24,2025-04-18,2025-04,AUS01,5800,CC4100,Unknown Vendor LLC,INV99056,PO1922,USD,17007.36,EXPORT,Payment for services,Workday,2025-04-24,2025-04-18,2025,04,17007.36,False,payment for services,2026-02-22 23:27:14.356841,Raw_GL_Export.csv,83.92156862745098,1,True,AUS01,5800,True,5800,Depreciation,True,True,CC4100,,UNMAPPED,2025-04_USD,1.525,25936.224,CONVERTED,30184.39373025477,34245.09535020032,157.0,False,0.0,Thursday,False,True,True,EX006
TXN000429,16/01/2026,15/01/2026,2026-01,AUS01,5100,CC4000,Unregistered Supplier,INV42112,,GBP,43640.74,EXPORT,Payment for goods,Manual Entry,2026-01-16,2026-01-15,2026,01,43640.74,False,payment for goods,2026-02-22 23:27:14.356841,Raw_GL_Export.csv,83.92156862745098,1,True,AUS01,5100,True,5100,Office Rent,True,True,CC4000,,UNMAPPED,2026-01_GBP,1.957,85404.92818,CONVERTED,29138.02959753333,27547.65120166844,150.0,False,0.0,Friday,False,True,True,EX001;EX004;EX006
TXN000430,02/16/2026,02/06/2026,2026-02,AUS01,5120,CC3100,Unknown Vendor LLC,INV46073,PO8292,GBP,38933.82,EXPORT,Payment for subscription,SAP,2026-02-16,2026-06-02,2026,02,38933.82,False,payment for subscription,2026-02-22 23:27:14.356841,Raw_GL_Export.csv,83.92156862745098,1,True,AUS01,5120,True,5120,Office Supplies,True,True,CC3100,,UNMAPPED,2026-02_GBP,1.955,76115.6181,CONVERTED,34269.00595485611,35424.20705021751,139.0,False,0.0,Monday,False,True,True,EX004;EX006
TXN000431,2026-01-04,2026-01-02,2026-01,AUS01,5100,CC3200,Unlisted Company,INV45877,PO2549,USD,1133.9,EXPORT,Payment for license,Oracle,2026-01-04,2026-01-02,2026,01,1133.9,False,payment for license,2026-02-22 23:27:14.356841,Raw_GL_Export.csv,83.92156862745098,1,True,AUS01,5100,True,5100,Office Rent,True,True,CC3200,,UNMAPPED,2026-01_USD,1.527,1731.4653,CONVERTED,29138.02959753333,27547.65120166844,150.0,False,0.0,Sunday,True,True,True,EX006
TXN000432,13-02-2026,06-02-2026,2026-02,AUS01,5300,CC4100,Mystery Corp,INV63127,PO1323,AUD,14702.78,GST-FREE,Payment for consulting,API Import,2026-02-13,2026-02-06,2026,02,14702.78,False,payment for consulting,2026-02-22 23:27:14.356841,Raw_GL_Export.csv,83.92156862745098,1,True,AUS01,5300,True,5300,Professional Services,True,True,CC4100,,UNMAPPED,2026-02_AUD,1.0,14702.78,DOMESTIC,33232.533450429684,35951.49997313202,128.0,False,0.0,Friday,False,True,True,EX006
TXN000433,27-03-2025,25-03-2025,2025-03,AUS01,5510,CC4100,Unlisted Company,INV96321,PO3960,AUD,33932.52,GST-FREE,Payment for license,Oracle,2025-03-27,2025-03-25,2025,03,33932.52,False,payment for license,2026-02-22 23:27:14.356841,Raw_GL_Export.csv,83.92156862745098,1,True,AUS01,5510,True,5510,Advertising,True,True,CC4100,,UNMAPPED,2025-03_AUD,1.0,33932.52,DOMESTIC,28498.583342781956,23667.16979723599,133.0,False,0.0,Thursday,False,True,True,EX006
TXN000434,01-02-2026,26-01-2026,2026-02,AUS01,5100,CC1000,Mystery Corp,INV83727,,USD,29403.56,GST,Payment for services,SAP,2026-02-01,2026-01-26,2026,02,29403.56,False,payment for services,2026-02-22 23:27:14.356841,Raw_GL_Export.csv,83.92156862745098,1,True,AUS01,5100,True,5100,Office Rent,True,True,CC1000,,UNMAPPED,2026-02_USD,1.525,44840.429,CONVERTED,29138.02959753333,27547.65120166844,150.0,False,0.0,Sunday,True,True,True,EX001;EX006
TXN000435,02/04/2026,01/29/2026,2026-02,AUS01,5520,CC1200,New Vendor XYZ,INV78084,PO5807,AUD,11250.34,GST,Payment for license,Manual Entry,2026-04-02,2026-01-29,2026,02,11250.34,False,payment for license,2026-02-22 23:27:14.356841,Raw_GL_Export.csv,83.92156862745098,2,True,AUS01,5520,True,5520,Events,True,True,CC1200,,UNMAPPED,2026-02_AUD,1.0,11250.34,DOMESTIC,30860.276023483882,21900.267908653983,155.0,False,0.0,Thursday,False,True,True,EX006;EX007
TXN000436,05-01-2026,30-12-2025,2026-01,AUS01,5510,CC3000,Unlisted Company,INV41077,,USD,30988.07,GST,Payment for goods,Workday,2026-01-05,2025-12-30,2026,01,30988.07,False,payment for goods,2026-02-22 23:27:14.356841,Raw_GL_Export.csv,83.92156862745098,1,True,AUS01,5510,True,5510,Advertising,True,True,CC3000,,UNMAPPED,2026-01_USD,1.527,47318.782889999995,CONVERTED,28498.583342781956,23667.16979723599,133.0,False,0.0,Monday,False,True,True,EX001;EX006
TXN000437,28/02/2026,25/02/2026,2026-02,AUS01,5610,CC4000,Mystery Corp,INV19746,PO5270,NZD,12555.07,EXPORT,Payment for consulting,Oracle,2026-02-28,2026-02-25,2026,02,12555.07,False,payment for consulting,2026-02-22 23:27:14.356841,Raw_GL_Export.csv,83.92156862745098,1,True,AUS01,5610,True,5610,Postage and Courier,True,True,CC4000,,UNMAPPED,2026-02_NZD,0.932,11701.32524,CONVERTED,29081.766845273953,25872.32663648796,146.0,False,0.0,Saturday,True,True,True,EX006
TXN000438,13-02-2026,11-02-2026,2026-02,AUS01,5220,CC3100,Mystery Corp,INV92984,PO4156,USD,3268.06,INPUT,Payment for subscription,API Import,2026-02-13,2026-02-11,2026,02,3268.06,False,payment for subscription,2026-02-22 23:27:14.356841,Raw_GL_Export.csv,83.92156862745098,1,True,AUS01,5220,True,5220,IT Support,True,True,CC3100,,UNMAPPED,2026-02_USD,1.525,4983.791499999999,CONVERTED,29540.94372533058,19404.169897416657,121.0,False,0.0,Friday,False,True,True,EX006
TXN000439,22/01/2026,15/01/2026,2026-01,AUS01,5910,CC1200,Unregistered Supplier,INV20161,,GBP,17114.49,GST-FREE,Payment for license,SAP,2026-01-22,2026-01-15,2026,01,17114.49,False,payment for license,2026-02-22 23:27:14.356841,Raw_GL_Export.csv,83.92156862745098,1,True,AUS01,5910,True,5910,Interest Expense,True,True,CC1200,,UNMAPPED,2026-01_GBP,1.957,33493.056930000006,CONVERTED,33774.54824600841,21661.31598456901,119.0,False,0.0,Thursday,False,True,True,EX001;EX006
TXN000440,22-07-2025,20-07-2025,2025-07,AUS01,5310,CC1100,Unregistered Supplier,INV39591,,NZD,35035.39,GST-FREE,Payment for services,Manual Entry,2025-07-22,2025-07-20,2025,07,35035.39,False,payment for services,2026-02-22 23:27:14.356841,Raw_GL_Export.csv,83.92156862745098,1,True,AUS01,5310,True,5310,Legal Fees,True,True,CC1100,,UNMAPPED,2025-07_NZD,0.934,32723.05426,CONVERTED,33139.04129260232,28423.631835285127,171.0,False,0.0,Tuesday,False,True,True,EX001;EX006
TXN000441,08-02-2026,06-02-2026,2026-02,AUS01,5900,CC1100,Oracle,INV22522,PO5620,NZD,-20617.53,EXPORT,Payment for license,Workday,2026-02-08,2026-02-06,2026,02,-20617.53,True,payment for license,2026-02-22 23:27:14.356841,Raw_GL_Export.csv,83.92156862745098,1,True,AUS01,5900,True,5900,Bank Charges,True,True,CC1100,Oracle Corporation,MAPPED,2026-02_NZD,0.932,-19215.53796,CONVERTED,31670.032329854675,24882.231532617723,172.0,False,0.0,Sunday,True,True,True,EX005
TXN000442,2026-01-20,2026-01-19,2026-01,AUS01,5120,CC3000,Federal Express,INV72503,PO5244,USD,-32775.87,EXPORT,Payment for services,API Import,2026-01-20,2026-01-19,2026,01,-32775.87,True,payment for services,2026-02-22 23:27:14.356841,Raw_GL_Export.csv,83.92156862745098,1,True,AUS01,5120,True,5120,Office Supplies,True,True,CC3000,FedEx,MAPPED,2026-01_USD,1.527,-50048.75349,CONVERTED,34269.00595485611,35424.20705021751,139.0,False,0.0,Tuesday,False,True,True,EX005
TXN000443,23/09/2025,20/09/2025,2025-09,AUS01,5110,CC3100,PWC,INV42651,PO7852,AUD,-4169.76,INPUT,Payment for consulting,Oracle,2025-09-23,2025-09-20,2025,09,-4169.76,True,payment for consulting,2026-02-22 23:27:14.356841,Raw_GL_Export.csv,83.92156862745098,1,True,AUS01,5110,True,5110,Utilities,True,True,CC3100,PwC,MAPPED,2025-09_AUD,1.0,-4169.76,DOMESTIC,27865.288293732876,21409.69928933269,146.0,False,0.0,Tuesday,False,True,True,EX005
TXN000444,02/15/2026,02/07/2026,2026-02,AUS01,5510,CC2100,PWC,INV50001,PO2424,GBP,-24022.33,GST-FREE,Payment for subscription,Manual Entry,2026-02-15,2026-07-02,2026,02,-24022.33,True,payment for subscription,2026-02-22 23:27:14.356841,Raw_GL_Export.csv,83.92156862745098,1,True,AUS01,5510,True,5510,Advertising,True,True,CC2100,PwC,MAPPED,2026-02_GBP,1.955,-46963.655150000006,CONVERTED,28498.583342781956,23667.16979723599,133.0,False,0.0,Sunday,True,True,True,EX005
TXN000445,02/25/2026,02/23/2026,2026-02,AUS01,5620,CC1100,Salesforce,INV85407,,USD,-2851.14,GST-FREE,Payment for subscription,API Import,2026-02-25,2026-02-23,2026,02,-2851.14,True,payment for subscription,2026-02-22 23:27:14.356841,Raw_GL_Export.csv,83.92156862745098,1,True,AUS01,5620,True,5620,Insurance,True,True,CC1100,Salesforce Inc,MAPPED,2026-02_USD,1.525,-4347.9884999999995,CONVERTED,32410.971605588227,27490.799177232966,170.0,False,0.0,Wednesday,False,True,True,EX001;EX005
TXN000446,2026-01-16,2026-01-09,2026-01,AUS01,5700,CC4000,Slack,INV63145,,GBP,-25159.52,GST,Payment for goods,SAP,2026-01-16,2026-01-09,2026,01,-25159.52,True,payment for goods,2026-02-22 23:27:14.356841,Raw_GL_Export.csv,83.92156862745098,1,True,AUS01,5700,True,5700,Training,True,True,CC4000,Slack Technologies,MAPPED,2026-01_GBP,1.957,-49237.180640000006,CONVERTED,31110.431902446802,30160.111495086097,141.0,False,0.0,Friday,False,True,True,EX001;EX005
TXN000447,23-02-2026,14-02-2026,2026-02,AUS01,5800,CC3000,Accenture Pty,INV98410,PO9577,AUD,-19692.06,GST-FREE,Payment for goods,Oracle,2026-02-23,2026-02-14,2026,02,-19692.06,True,payment for goods,2026-02-22 23:27:14.356841,Raw_GL_Export.csv,83.92156862745098,1,True,AUS01,5800,True,5800,Depreciation,True,True,CC3000,Accenture,MAPPED,2026-02_AUD,1.0,-19692.06,DOMESTIC,30184.39373025477,34245.09535020032,157.0,False,0.0,Monday,False,True,True,EX005
TXN000448,02/03/2026,01/31/2026,2026-02,AUS01,5510,CC3000,MSFT,INV58927,PO6537,GBP,-25274.16,GST-FREE,Payment for goods,API Import,2026-03-02,2026-01-31,2026,02,-25274.16,True,payment for goods,2026-02-22 23:27:14.356841,Raw_GL_Export.csv,83.92156862745098,2,True,AUS01,5510,True,5510,Advertising,True,True,CC3000,Microsoft Corporation,MAPPED,2026-02_GBP,1.955,-49410.9828,CONVERTED,28498.583342781956,23667.16979723599,133.0,False,0.0,Monday,False,True,True,EX005;EX007
TXN000449,2026-02-28,2026-02-23,2026-02,AUS01,5300,CC3200,KPMG Australia,INV38503,PO9446,NZD,-39368.01,EXPORT,Payment for services,Manual Entry,2026-02-28,2026-02-23,2026,02,-39368.01,True,payment for services,2026-02-22 23:27:14.356841,Raw_GL_Export.csv,83.92156862745098,1,True,AUS01,5300,True,5300,Professional Services,True,True,CC3200,KPMG,MAPPED,2026-02_NZD,0.932,-36690.98532000001,CONVERTED,33232.533450429684,35951.49997313202,128.0,False,0.0,Saturday,True,True,True,EX005
TXN000450,20-02-2026,19-02-2026,2026-02,AUS01,5320,CC1000,LinkedIn Corp,INV10675,PO4050,NZD,-35112.3,GST,Payment for consulting,Workday,2026-02-20,2026-02-19,2026,02,-35112.3,True,payment for consulting,2026-02-22 23:27:14.356841,Raw_GL_Export.csv,83.92156862745098,1,True,AUS01,5320,True,5320,Audit Fees,True,True,CC1000,LinkedIn,MAPPED,2026-02_NZD,0.932,-32724.663600000003,CONVERTED,31658.610713475173,32284.527206153973,141.0,False,0.0,Friday,False,True,True,EX005
TXN000451,2025-06-01,2025-05-25,2025-06,AUS01,5500,CC2000,Google,INV10905,,USD,-29505.12,EXPORT,Payment for subscription,Oracle,2025-06-01,2025-05-25,2025,06,-29505.12,True,payment for subscription,2026-02-22 23:27:14.356841,Raw_GL_Export.csv,83.92156862745098,1,True,AUS01,5500,True,5500,Marketing,True,True,CC2000,Google Cloud,MAPPED,2025-06_USD,1.522,-44906.79264,CONVERTED,28972.634359125877,32785.70497360227,143.0,False,0.0,Sunday,True,True,True,EX001;EX005
TXN000452,16-02-2026,10-02-2026,2026-02,AUS01,5300,CC3000,Telstra Corp,INV24246,PO8198,USD,-23232.27,INPUT,Payment for goods,Oracle,2026-02-16,2026-02-10,2026,02,-23232.27,True,payment for goods,2026-02-22 23:27:14.356841,Raw_GL_Export.csv,83.92156862745098,1,True,AUS01,5300,True,5300,Professional Services,True,True,CC3000,Telstra,MAPPED,2026-02_USD,1.525,-35429.21175,CONVERTED,33232.533450429684,35951.49997313202,128.0,False,0.0,Monday,False,True,True,EX005
TXN000453,12-12-2025,11-12-2025,2025-12,AUS01,5320,CC2000,Atlassian Pty,INV61713,PO6426,USD,-35783.5,GST-FREE,Payment for services,Oracle,2025-12-12,2025-12-11,2025,12,-35783.5,True,payment for services,2026-02-22 23:27:14.356841,Raw_GL_Export.csv,83.92156862745098,1,True,AUS01,5320,True,5320,Audit Fees,True,True,CC2000,Atlassian,MAPPED,2025-12_USD,1.523,-54498.2705,CONVERTED,31658.610713475173,32284.527206153973,141.0,False,0.0,Friday,False,True,True,EX005
TXN000454,22/10/2025,14/10/2025,2025-10,AUS01,5700,CC2100,Atlassian Pty,INV99356,PO6322,GBP,-25595.52,EXPORT,Payment for consulting,API Import,2025-10-22,2025-10-14,2025,10,-25595.52,True,payment for consulting,2026-02-22 23:27:14.356841,Raw_GL_Export.csv,83.92156862745098,1,True,AUS01,5700,True,5700,Training,True,True,CC2100,Atlassian,MAPPED,2025-10_GBP,1.951,-49936.859520000005,CONVERTED,31110.431902446802,30160.111495086097,141.0,False,0.0,Wednesday,False,True,True,EX005
TXN000455,24-01-2026,21-01-2026,2026-01,AUS01,5100,CC1100,Amazon,INV99710,,USD,-42238.45,GST,Payment for subscription,Manual Entry,2026-01-24,2026-01-21,2026,01,-42238.45,True,payment for subscription,2026-02-22 23:27:14.356841,Raw_GL_Export.csv,83.92156862745098,1,True,AUS01,5100,True,5100,Office Rent,True,True,CC1100,Amazon Web Services,MAPPED,2026-01_USD,1.527,-64498.11314999999,CONVERTED,29138.02959753333,27547.65120166844,150.0,False,0.0,Saturday,True,True,True,EX001;EX005
TXN000456,2026-02-20,2026-02-13,2026-02,AUS01,5500,CC2100,KPMG Australia,INV42472,PO9376,GBP,-45877.52,EXPORT,Payment for goods,Oracle,2026-02-20,2026-02-13,2026,02,-45877.52,True,payment for goods,2026-02-22 23:27:14.356841,Raw_GL_Export.csv,83.92156862745098,1,True,AUS01,5500,True,5500,Marketing,True,True,CC2100,KPMG,MAPPED,2026-02_GBP,1.955,-89690.55159999999,CONVERTED,28972.634359125877,32785.70497360227,143.0,False,0.0,Friday,False,True,True,EX005
TXN000457,2025-05-09,2025-05-04,2025-05,AUS01,5710,CC2000,Telstra Corp,INV75841,PO4091,USD,-26352.75,GST,Payment for license,Oracle,2025-05-09,2025-05-04,2025,05,-26352.75,True,payment for license,2026-02-22 23:27:14.356841,Raw_GL_Export.csv,83.92156862745098,1,True,AUS01,5710,True,5710,Recruitment,True,True,CC2000,Telstra,MAPPED,2025-05_USD,1.518,-40003.474500000004,CONVERTED,29496.09592285716,24753.031499859637,133.0,False,0.0,Friday,False,True,True,EX005
TXN000458,2025-11-08,2025-11-05,2025-11,AUS01,5400,CC1000,PWC,INV12314,PO2489,USD,-3637.99,EXPORT,Payment for services,Manual Entry,2025-11-08,2025-11-05,2025,11,-3637.99,True,payment for services,2026-02-22 23:27:14.356841,Raw_GL_Export.csv,83.92156862745098,1,True,AUS01,5400,True,5400,Travel,True,True,CC1000,PwC,MAPPED,2025-11_USD,1.526,-5551.57274,CONVERTED,31663.682660000006,30146.476988256833,133.0,False,0.0,Saturday,True,True,True,EX005
TXN000459,01/14/2026,01/10/2026,2026-01,AUS01,5210,CC3000,Telstra Corp,INV94393,,GBP,-46938.65,EXPORT,Payment for services,Workday,2026-01-14,2026-10-01,2026,01,-46938.65,True,payment for services,2026-02-22 23:27:14.356841,Raw_GL_Export.csv,83.92156862745098,1,True,AUS01,5210,True,5210,Cloud Services,True,True,CC3000,Telstra,MAPPED,2026-01_GBP,1.957,-91858.93805000001,CONVERTED,31620.56664919015,27460.393400888206,142.0,False,0.0,Wednesday,False,True,True,EX001;EX005
TXN000460,08/12/2025,08/06/2025,2025-08,AUS01,5710,CC3100,Accenture Pty,INV15359,,NZD,-5334.2,GST-FREE,Payment for subscription,Oracle,2025-12-08,2025-06-08,2025,08,-5334.2,True,payment for subscription,2026-02-22 23:27:14.356841,Raw_GL_Export.csv,83.92156862745098,2,True,AUS01,5710,True,5710,Recruitment,True,True,CC3100,Accenture,MAPPED,2025-08_NZD,0.93,-4960.8060000000005,CONVERTED,29496.09592285716,24753.031499859637,133.0,False,0.0,Monday,False,True,True,EX001;EX005
TXN000461,10-10-2025,05-10-2025,2025-10,AUS01,5610,CC1100,Telstra Corp,INV57655,PO2827,USD,-37412.07,EXPORT,Payment for services,SAP,2025-10-10,2025-10-05,2025,10,-37412.07,True,payment for services,2026-02-22 23:27:14.356841,Raw_GL_Export.csv,83.92156862745098,1,True,AUS01,5610,True,5610,Postage and Courier,True,True,CC1100,Telstra,MAPPED,2025-10_USD,1.521,-56903.75846999999,CONVERTED,29081.766845273953,25872.32663648796,146.0,False,0.0,Friday,False,True,True,EX005
TXN000462,22/01/2025,16/01/2025,2025-01,AUS01,5320,CC3000,Regus Australia,INV86588,PO2742,USD,-17552.61,GST-FREE,Payment for goods,API Import,2025-01-22,2025-01-16,2025,01,-17552.61,True,payment for goods,2026-02-22 23:27:14.356841,Raw_GL_Export.csv,83.92156862745098,1,True,AUS01,5320,True,5320,Audit Fees,True,True,CC3000,Regus,MAPPED,2025-01_USD,1.52,-26679.967200000003,CONVERTED,31658.610713475173,32284.527206153973,141.0,False,0.0,Wednesday,False,True,True,EX005
TXN000463,2026-01-04,2025-12-25,2026-01,AUS01,5620,CC2000,SAP,INV81641,PO5939,GBP,-3817.52,GST,Payment for consulting,Oracle,2026-01-04,2025-12-25,2026,01,-3817.52,True,payment for consulting,2026-02-22 23:27:14.356841,Raw_GL_Export.csv,83.92156862745098,1,True,AUS01,5620,True,5620,Insurance,True,True,CC2000,SAP SE,MAPPED,2026-01_GBP,1.957,-7470.886640000001,CONVERTED,32410.971605588227,27490.799177232966,170.0,False,0.0,Sunday,True,True,True,EX005
TXN000464,18/02/2026,17/02/2026,2026-02,AUS01,5110,CC2000,AusPost,INV57973,PO2923,NZD,-5509.83,INPUT,Payment for consulting,SAP,2026-02-18,2026-02-17,2026,02,-5509.83,True,payment for consulting,2026-02-22 23:27:14.356841,Raw_GL_Export.csv,83.92156862745098,1,True,AUS01,5110,True,5110,Utilities,True,True,CC2000,Australia Post,MAPPED,2026-02_NZD,0.932,-5135.1615600000005,CONVERTED,27865.288293732876,21409.69928933269,146.0,False,0.0,Wednesday,False,True,True,EX005
TXN000465,16-04-2025,07-04-2025,2025-04,AUS01,5510,CC1000,Adobe,INV47965,,NZD,-15234.36,GST-FREE,Payment for license,SAP,2025-04-16,2025-04-07,2025,04,-15234.36,True,payment for license,2026-02-22 23:27:14.356841,Raw_GL_Export.csv,83.92156862745098,1,True,AUS01,5510,True,5510,Advertising,True,True,CC1000,Adobe Systems,MAPPED,2025-04_NZD,0.932,-14198.423520000002,CONVERTED,28498.583342781956,23667.16979723599,133.0,False,0.0,Wednesday,False,True,True,EX001;EX005
TXN000466,26/01/2026,19/01/2026,2026-01,AUS01,5500,CC4000,Robert Half International,INV83727,PO7567,AUD,-41740.64,EXPORT,Payment for license,Workday,2026-01-26,2026-01-19,2026,01,-41740.64,True,payment for license,2026-02-22 23:27:14.356841,Raw_GL_Export.csv,83.92156862745098,1,True,AUS01,5500,True,5500,Marketing,True,True,CC4000,Robert Half,MAPPED,2026-01_AUD,1.0,-41740.64,DOMESTIC,28972.634359125877,32785.70497360227,143.0,False,0.0,Monday,False,True,True,EX005
TXN000467,07/02/2026,06/02/2026,2026-02,AUS01,5120,CC4100,Workday,INV76036,PO9602,AUD,-6130.16,EXPORT,Payment for subscription,Workday,2026-02-07,2026-02-06,2026,02,-6130.16,True,payment for subscription,2026-02-22 23:27:14.356841,Raw_GL_Export.csv,83.92156862745098,1,True,AUS01,5120,True,5120,Office Supplies,True,True,CC4100,Workday Inc,MAPPED,2026-02_AUD,1.0,-6130.16,DOMESTIC,34269.00595485611,35424.20705021751,139.0,False,0.0,Saturday,True,True,True,EX005
TXN000468,28/02/2026,23/02/2026,2026-02,AUS01,5710,CC2100,Atlassian Pty,INV48252,,USD,-38825.92,GST-FREE,Payment for goods,Workday,2026-02-28,2026-02-23,2026,02,-38825.92,True,payment for goods,2026-02-22 23:27:14.356841,Raw_GL_Export.csv,83.92156862745098,1,True,AUS01,5710,True,5710,Recruitment,True,True,CC2100,Atlassian,MAPPED,2026-02_USD,1.525,-59209.52799999999,CONVERTED,29496.09592285716,24753.031499859637,133.0,False,0.0,Saturday,True,True,True,EX001;EX005
TXN000469,02/05/2026,02/04/2026,2026-02,AUS01,5620,CC2000,Workday,INV92927,PO7047,AUD,-49930.14,INPUT,Payment for subscription,SAP,2026-05-02,2026-04-02,2026,02,-49930.14,True,payment for subscription,2026-02-22 23:27:14.356841,Raw_GL_Export.csv,83.92156862745098,2,True,AUS01,5620,True,5620,Insurance,True,True,CC2000,Workday Inc,MAPPED,2026-02_AUD,1.0,-49930.14,DOMESTIC,32410.971605588227,27490.799177232966,170.0,False,0.0,Saturday,True,True,True,EX005;EX007
TXN000470,01/23/2026,01/20/2026,2026-01,AUS01,5410,CC4100,KPMG Australia,INV56593,,NZD,-835.46,GST,Payment for subscription,Oracle,2026-01-23,2026-01-20,2026,01,-835.46,True,payment for subscription,2026-02-22 23:27:14.356841,Raw_GL_Export.csv,83.92156862745098,1,True,AUS01,5410,True,5410,Accommodation,True,True,CC4100,KPMG,MAPPED,2026-01_NZD,0.9335,-779.90191,CONVERTED,29277.518810999987,22143.12829502557,155.0,False,0.0,Friday,False,True,True,EX001;EX005
TXN000471,2026-01-09,2025-12-31,2026-01,AUS01,5700,CC4100,GCP,INV92081,PO4377,GBP,-2811.75,INPUT,Payment for consulting,Oracle,2026-01-09,2025-12-31,2026,01,-2811.75,True,payment for consulting,2026-02-22 23:27:14.356841,Raw_GL_Export.csv,83.92156862745098,1,True,AUS01,5700,True,5700,Training,True,True,CC4100,Google Cloud,MAPPED,2026-01_GBP,1.957,-5502.59475,CONVERTED,31110.431902446802,30160.111495086097,141.0,False,0.0,Friday,False,True,True,EX005
TXN000472,02/11/2026,02/07/2026,2026-02,AUS01,5600,CC3100,Zoom,INV58318,,GBP,-38437.02,EXPORT,Payment for consulting,SAP,2026-11-02,2026-07-02,2026,02,-38437.02,True,payment for consulting,2026-02-22 23:27:14.356841,Raw_GL_Export.csv,83.92156862745098,2,True,AUS01,5600,True,5600,Telecommunications,True,True,CC3100,Zoom Video Communications,MAPPED,2026-02_GBP,1.955,-75144.3741,CONVERTED,32190.120230168057,26805.910450208805,119.0,False,0.0,Monday,False,True,True,EX001;EX005;EX007
TXN000473,16/01/2026,08/01/2026,2026-01,AUS01,5120,CC1200,SAP,INV94877,,GBP,-2926.58,GST-FREE,Payment for subscription,Oracle,2026-01-16,2026-01-08,2026,01,-2926.58,True,payment for subscription,2026-02-22 23:27:14.356841,Raw_GL_Export.csv,83.92156862745098,1,True,AUS01,5120,True,5120,Office Supplies,True,True,CC1200,SAP SE,MAPPED,2026-01_GBP,1.957,-5727.31706,CONVERTED,34269.00595485611,35424.20705021751,139.0,False,0.0,Friday,False,True,True,EX001;EX005
TXN000474,06-10-2025,26-09-2025,2025-10,AUS01,5200,CC1100,Zoom,INV94557,PO2642,AUD,-28722.89,EXPORT,Payment for license,Oracle,2025-10-06,2025-09-26,2025,10,-28722.89,True,payment for license,2026-02-22 23:27:14.356841,Raw_GL_Export.csv,83.92156862745098,1,True,AUS01,5200,True,5200,Software Licenses,True,True,CC1100,Zoom Video Communications,MAPPED,2025-10_AUD,1.0,-28722.89,DOMESTIC,30196.543712413786,22166.314759696765,145.0,False,0.0,Monday,False,True,True,EX005
TXN000475,2026-02-24,2026-02-14,2026-02,AUS01,5100,CC3100,Federal Express,INV94473,PO3165,AUD,-44509.23,GST,Payment for goods,SAP,2026-02-24,2026-02-14,2026,02,-44509.23,True,payment for goods,2026-02-22 23:27:14.356841,Raw_GL_Export.csv,83.92156862745098,1,True,AUS01,5100,True,5100,Office Rent,True,True,CC3100,FedEx,MAPPED,2026-02_AUD,1.0,-44509.23,DOMESTIC,29138.02959753333,27547.65120166844,150.0,False,0.0,Tuesday,False,True,True,EX005
TXN000476,09/01/2026,30/12/2025,2026-01,AUS01,5000,CC1000,GCP,INV36518,,NZD,-7449.26,GST,Payment for license,Manual Entry,2026-01-09,2025-12-30,2026,01,-7449.26,True,payment for license,2026-02-22 23:27:14.356841,Raw_GL_Export.csv,83.92156862745098,1,True,AUS01,5000,True,5000,Salaries and Wages,True,True,CC1000,Google Cloud,MAPPED,2026-01_NZD,0.9335,-6953.88421,CONVERTED,30471.385558248177,22939.768434623154,137.0,False,0.0,Friday,False,True,True,EX001;EX005
TXN000477,27/09/2025,22/09/2025,2025-09,AUS01,5310,CC3200,Zoom,INV92245,PO1347,USD,-47211.81,INPUT,Payment for services,SAP,2025-09-27,2025-09-22,2025,09,-47211.81,True,payment for services,2026-02-22 23:27:14.356841,Raw_GL_Export.csv,83.92156862745098,1,True,AUS01,5310,True,5310,Legal Fees,True,True,CC3200,Zoom Video Communications,MAPPED,2025-09_USD,1.519,-71714.73938999999,CONVERTED,33139.04129260232,28423.631835285127,171.0,False,0.0,Saturday,True,True,True,EX005
TXN000478,01/18/2025,01/16/2025,2025-01,AUS01,5510,CC3100,Zoom,INV39710,PO3414,AUD,-4482.87,GST,Payment for subscription,Workday,2025-01-18,2025-01-16,2025,01,-4482.87,True,payment for subscription,2026-02-22 23:27:14.356841,Raw_GL_Export.csv,83.92156862745098,1,True,AUS01,5510,True,5510,Advertising,True,True,CC3100,Zoom Video Communications,MAPPED,2025-01_AUD,1.0,-4482.87,DOMESTIC,28498.583342781956,23667.16979723599,133.0,False,0.0,Saturday,True,True,True,EX005
TXN000479,08-02-2026,06-02-2026,2026-02,AUS01,5500,CC1200,Atlassian Pty,INV56833,,USD,-44923.36,INPUT,Payment for subscription,SAP,2026-02-08,2026-02-06,2026,02,-44923.36,True,payment for subscription,2026-02-22 23:27:14.356841,Raw_GL_Export.csv,83.92156862745098,1,True,AUS01,5500,True,5500,Marketing,True,True,CC1200,Atlassian,MAPPED,2026-02_USD,1.525,-68508.124,CONVERTED,28972.634359125877,32785.70497360227,143.0,False,0.0,Sunday,True,True,True,EX001;EX005
TXN000480,2026-01-12,2026-01-11,2026-01,AUS01,5610,CC1200,Oracle,INV99054,PO5940,GBP,-23529.02,GST-FREE,Payment for license,Workday,2026-01-12,2026-01-11,2026,01,-23529.02,True,payment for license,2026-02-22 23:27:14.356841,Raw_GL_Export.csv,83.92156862745098,1,True,AUS01,5610,True,5610,Postage and Courier,True,True,CC1200,Oracle Corporation,MAPPED,2026-01_GBP,1.957,-46046.292140000005,CONVERTED,29081.766845273953,25872.32663648796,146.0,False,0.0,Monday,False,True,True,EX005
TXN000481,2026-01-12,2026-01-07,2026-01,AUS01,5500,CC3000,Deloitte Touche,INV95964,,AUD,-10636.08,GST-FREE,Payment for goods,Manual Entry,2026-01-12,2026-01-07,2026,01,-10636.08,True,payment for goods,2026-02-22 23:27:14.356841,Raw_GL_Export.csv,83.92156862745098,1,True,AUS01,5500,True,5500,Marketing,True,True,CC3000,Deloitte,MAPPED,2026-01_AUD,1.0,-10636.08,DOMESTIC,28972.634359125877,32785.70497360227,143.0,False,0.0,Monday,False,True,True,EX001;EX005
TXN000482,15-01-2026,13-01-2026,2026-01,AUS01,5100,CC4100,Telstra Corp,INV26716,,NZD,-42781.08,INPUT,Payment for consulting,Workday,2026-01-15,2026-01-13,2026,01,-42781.08,True,payment for consulting,2026-02-22 23:27:14.356841,Raw_GL_Export.csv,83.92156862745098,1,True,AUS01,5100,True,5100,Office Rent,True,True,CC4100,Telstra,MAPPED,2026-01_NZD,0.9335,-39936.13818,CONVERTED,29138.02959753333,27547.65120166844,150.0,False,0.0,Thursday,False,True,True,EX001;EX005
TXN000483,11-01-2026,04-01-2026,2026-01,AUS01,5500,CC3100,BCG,INV60224,PO9144,USD,-9973.17,GST-FREE,Payment for license,API Import,2026-01-11,2026-01-04,2026,01,-9973.17,True,payment for license,2026-02-22 23:27:14.356841,Raw_GL_Export.csv,83.92156862745098,1,True,AUS01,5500,True,5500,Marketing,True,True,CC3100,Boston Consulting Group,MAPPED,2026-01_USD,1.527,-15229.030589999998,CONVERTED,28972.634359125877,32785.70497360227,143.0,False,0.0,Sunday,True,True,True,EX005
TXN000484,16/09/2025,09/09/2025,2025-09,AUS01,5020,CC4100,AusPost,INV57409,,USD,-14915.64,GST-FREE,Payment for services,Workday,2025-09-16,2025-09-09,2025,09,-14915.64,True,payment for services,2026-02-22 23:27:14.356841,Raw_GL_Export.csv,83.92156862745098,1,True,AUS01,5020,True,5020,Contractor Fees,True,True,CC4100,Australia Post,MAPPED,2025-09_USD,1.519,-22656.857159999996,CONVERTED,28445.577844280295,21241.721119146277,132.0,False,0.0,Tuesday,False,True,True,EX001;EX005
TXN000485,18-02-2026,15-02-2026,2026-02,AUS01,5100,CC1000,WeWork Australia,INV48626,PO7898,NZD,-7647.3,GST-FREE,Payment for goods,Oracle,2026-02-18,2026-02-15,2026,02,-7647.3,True,payment for goods,2026-02-22 23:27:14.356841,Raw_GL_Export.csv,83.92156862745098,1,True,AUS01,5100,True,5100,Office Rent,True,True,CC1000,WeWork,MAPPED,2026-02_NZD,0.932,-7127.283600000001,CONVERTED,29138.02959753333,27547.65120166844,150.0,False,0.0,Wednesday,False,True,True,EX005
TXN000486,27/02/2026,26/02/2026,2026-02,AUS01,5800,CC1200,Atlassian Pty,INV65667,PO2736,USD,-31164.71,GST,Payment for license,SAP,2026-02-27,2026-02-26,2026,02,-31164.71,True,payment for license,2026-02-22 23:27:14.356841,Raw_GL_Export.csv,83.92156862745098,1,True,AUS01,5800,True,5800,Depreciation,True,True,CC1200,Atlassian,MAPPED,2026-02_USD,1.525,-47526.18274999999,CONVERTED,30184.39373025477,34245.09535020032,157.0,False,0.0,Friday,False,True,True,EX005
TXN000487,16/02/2026,15/02/2026,2026-02,AUS01,5110,CC3000,Zoom,INV84603,PO7823,AUD,-37772.21,GST,Payment for goods,Oracle,2026-02-16,2026-02-15,2026,02,-37772.21,True,payment for goods,2026-02-22 23:27:14.356841,Raw_GL_Export.csv,83.92156862745098,1,True,AUS01,5110,True,5110,Utilities,True,True,CC3000,Zoom Video Communications,MAPPED,2026-02_AUD,1.0,-37772.21,DOMESTIC,27865.288293732876,21409.69928933269,146.0,False,0.0,Monday,False,True,True,EX005
TXN000488,16/01/2026,07/01/2026,2026-01,AUS01,5710,CC2100,Seek Limited,INV94521,PO5698,GBP,-13944.38,EXPORT,Payment for services,Oracle,2026-01-16,2026-01-07,2026,01,-13944.38,True,payment for services,2026-02-22 23:27:14.356841,Raw_GL_Export.csv,83.92156862745098,1,True,AUS01,5710,True,5710,Recruitment,True,True,CC2100,Seek,MAPPED,2026-01_GBP,1.957,-27289.15166,CONVERTED,29496.09592285716,24753.031499859637,133.0,False,0.0,Friday,False,True,True,EX005
TXN000489,2025-04-02,2025-03-23,2025-04,AUS01,5810,CC1200,Robert Half International,INV99116,PO8443,USD,-49457.71,EXPORT,Payment for license,Workday,2025-04-02,2025-03-23,2025,04,-49457.71,True,payment for license,2026-02-22 23:27:14.356841,Raw_GL_Export.csv,83.92156862745098,1,True,AUS01,5810,True,5810,Amortization,True,True,CC1200,Robert Half,MAPPED,2025-04_USD,1.525,-75423.00774999999,CONVERTED,31768.91314562501,27328.351394475325,120.0,False,0.0,Wednesday,False,True,True,EX005
TXN000490,02/19/2026,02/15/2026,2026-02,AUS01,5410,CC1200,PWC,INV37769,PO1917,AUD,-23977.1,GST-FREE,Payment for goods,Manual Entry,2026-02-19,2026-02-15,2026,02,-23977.1,True,payment for goods,2026-02-22 23:27:14.356841,Raw_GL_Export.csv,83.92156862745098,1,True,AUS01,5410,True,5410,Accommodation,True,True,CC1200,PwC,MAPPED,2026-02_AUD,1.0,-23977.1,DOMESTIC,29277.518810999987,22143.12829502557,155.0,False,0.0,Thursday,False,True,True,EX005
TXN000491,2026-01-06,2025-12-29,2026-01,AUS01,5500,CC3000,DHL Express,INV94757,PO5422,GBP,-41775.26,INPUT,Payment for services,SAP,2026-01-06,2025-12-29,2026,01,-41775.26,True,payment for services,2026-02-22 23:27:14.356841,Raw_GL_Export.csv,83.92156862745098,1,True,AUS01,5500,True,5500,Marketing,True,True,CC3000,DHL,MAPPED,2026-01_GBP,1.957,-81754.18382,CONVERTED,28972.634359125877,32785.70497360227,143.0,False,0.0,Tuesday,False,True,True,EX005
TXN000492,02/03/2026,01/24/2026,2026-02,AUS01,5810,CC3000,Amazon,INV18561,,USD,-35917.87,GST,Payment for services,Workday,2026-03-02,2026-01-24,2026,02,-35917.87,True,payment for services,2026-02-22 23:27:14.356841,Raw_GL_Export.csv,83.92156862745098,2,True,AUS01,5810,True,5810,Amortization,True,True,CC3000,Amazon Web Services,MAPPED,2026-02_USD,1.525,-54774.75175,CONVERTED,31768.91314562501,27328.351394475325,120.0,False,0.0,Monday,False,True,True,EX001;EX005;EX007
TXN000493,07/01/2026,06/01/2026,2026-01,AUS01,5210,CC2100,Google,INV15987,,AUD,-21869.41,EXPORT,Payment for services,Workday,2026-01-07,2026-01-06,2026,01,-21869.41,True,payment for services,2026-02-22 23:27:14.356841,Raw_GL_Export.csv,83.92156862745098,1,True,AUS01,5210,True,5210,Cloud Services,True,True,CC2100,Google Cloud,MAPPED,2026-01_AUD,1.0,-21869.41,DOMESTIC,31620.56664919015,27460.393400888206,142.0,False,0.0,Wednesday,False,True,True,EX001;EX005
TXN000494,02/01/2026,01/27/2026,2026-02,AUS01,5400,CC4000,SAP,INV26976,PO2595,NZD,-12483.07,INPUT,Payment for subscription,Manual Entry,2026-01-02,2026-01-27,2026,02,-12483.07,True,payment for subscription,2026-02-22 23:27:14.356841,Raw_GL_Export.csv,83.92156862745098,2,True,AUS01,5400,True,5400,Travel,True,True,CC4000,SAP SE,MAPPED,2026-02_NZD,0.932,-11634.22124,CONVERTED,31663.682660000006,30146.476988256833,133.0,False,0.0,Friday,False,True,True,EX005
TXN000495,2026-01-24,2026-01-15,2026-01,AUS01,5900,CC1200,Amazon,INV48026,,GBP,-26200.04,GST,Payment for consulting,SAP,2026-01-24,2026-01-15,2026,01,-26200.04,True,payment for consulting,2026-02-22 23:27:14.356841,Raw_GL_Export.csv,83.92156862745098,1,True,AUS01,5900,True,5900,Bank Charges,True,True,CC1200,Amazon Web Services,MAPPED,2026-01_GBP,1.957,-51273.47828,CONVERTED,31670.032329854675,24882.231532617723,172.0,False,0.0,Saturday,True,True,True,EX001;EX005
TXN000496,2026-01-21,2026-01-17,2026-01,AUS01,5200,CC1200,Adobe,INV54436,,NZD,-27670.74,GST-FREE,Payment for license,Manual Entry,2026-01-21,2026-01-17,2026,01,-27670.74,True,payment for license,2026-02-22 23:27:14.356841,Raw_GL_Export.csv,83.92156862745098,1,True,AUS01,5200,True,5200,Software Licenses,True,True,CC1200,Adobe Systems,MAPPED,2026-01_NZD,0.9335,-25830.63579,CONVERTED,30196.543712413786,22166.314759696765,145.0,False,0.0,Wednesday,False,True,True,EX001;EX005
TXN000497,02-02-2026,29-01-2026,2026-02,AUS01,5200,CC4100,Salesforce,INV22767,PO3336,USD,-21711.65,EXPORT,Payment for subscription,API Import,2026-02-02,2026-01-29,2026,02,-21711.65,True,payment for subscription,2026-02-22 23:27:14.356841,Raw_GL_Export.csv,83.92156862745098,1,True,AUS01,5200,True,5200,Software Licenses,True,True,CC4100,Salesforce Inc,MAPPED,2026-02_USD,1.525,-33110.26625,CONVERTED,30196.543712413786,22166.314759696765,145.0,False,0.0,Monday,False,True,True,EX005
TXN000498,2026-02-28,2026-02-20,2026-02,AUS01,5100,CC3200,McKinsey,INV18934,,USD,-3390.61,GST-FREE,Payment for subscription,Workday,2026-02-28,2026-02-20,2026,02,-3390.61,True,payment for subscription,2026-02-22 23:27:14.356841,Raw_GL_Export.csv,83.92156862745098,1,True,AUS01,5100,True,5100,Office Rent,True,True,CC3200,McKinsey & Company,MAPPED,2026-02_USD,1.525,-5170.68025,CONVERTED,29138.02959753333,27547.65120166844,150.0,False,0.0,Saturday,True,True,True,EX001;EX005
TXN000499,2025-06-03,2025-05-31,2025-06,AUS01,5710,CC3200,Deloitte Touche,INV95235,PO3031,GBP,-1173.66,EXPORT,Payment for license,Manual Entry,2025-06-03,2025-05-31,2025,06,-1173.66,True,payment for license,2026-02-22 23:27:14.356841,Raw_GL_Export.csv,83.92156862745098,1,True,AUS01,5710,True,5710,Recruitment,True,True,CC3200,Deloitte,MAPPED,2025-06_GBP,1.952,-2290.98432,CONVERTED,29496.09592285716,24753.031499859637,133.0,False,0.0,Tuesday,False,True,True,EX005
TXN000500,01/02/2026,12/28/2025,2026-01,AUS01,5400,CC3100,Slack,INV58979,,GBP,-31700.06,INPUT,Payment for consulting,API Import,2026-02-01,2025-12-28,2026,01,-31700.06,True,payment for consulting,2026-02-22 23:27:14.356841,Raw_GL_Export.csv,83.92156862745098,2,True,AUS01,5400,True,5400,Travel,True,True,CC3100,Slack Technologies,MAPPED,2026-01_GBP,1.957,-62037.017420000004,CONVERTED,31663.682660000006,30146.476988256833,133.0,False,0.0,Sunday,True,True,True,EX001;EX005
TXN000501,05/15/2025,05/14/2025,2025-05,AUS01,5610,CC1000,Accenture Pty,INV48097,PO7541,AUD,-42287.34,GST,Payment for services,Oracle,2025-05-15,2025-05-14,2025,05,-42287.34,True,payment for services,2026-02-22 23:27:14.356841,Raw_GL_Export.csv,83.92156862745098,1,True,AUS01,5610,True,5610,Postage and Courier,True,True,CC1000,Accenture,MAPPED,2025-05_AUD,1.0,-42287.34,DOMESTIC,29081.766845273953,25872.32663648796,146.0,False,0.0,Thursday,False,True,True,EX005
TXN000502,13-02-2026,11-02-2026,2026-02,AUS01,5320,CC3200,LinkedIn Corp,INV24201,PO7503,GBP,-44554.96,GST-FREE,Payment for consulting,Oracle,2026-02-13,2026-02-11,2026,02,-44554.96,True,payment for consulting,2026-02-22 23:27:14.356841,Raw_GL_Export.csv,83.92156862745098,1,True,AUS01,5320,True,5320,Audit Fees,True,True,CC3200,LinkedIn,MAPPED,2026-02_GBP,1.955,-87104.9468,CONVERTED,31658.610713475173,32284.527206153973,141.0,False,0.0,Friday,False,True,True,EX005
TXN000503,02/13/2026,02/11/2026,2026-02,AUS01,5310,CC3000,Hays,INV24984,,USD,-14955.69,EXPORT,Payment for services,API Import,2026-02-13,2026-11-02,2026,02,-14955.69,True,payment for services,2026-02-22 23:27:14.356841,Raw_GL_Export.csv,83.92156862745098,1,True,AUS01,5310,True,5310,Legal Fees,True,True,CC3000,Hays Recruitment,MAPPED,2026-02_USD,1.525,-22807.42725,CONVERTED,33139.04129260232,28423.631835285127,171.0,False,0.0,Friday,False,True,True,EX001;EX005
TXN000504,05-07-2025,02-07-2025,2025-07,AUS01,5620,CC2000,McKinsey,INV18178,PO6922,AUD,-708.24,EXPORT,Payment for consulting,Manual Entry,2025-07-05,2025-07-02,2025,07,-708.24,True,payment for consulting,2026-02-22 23:27:14.356841,Raw_GL_Export.csv,83.92156862745098,1,True,AUS01,5620,True,5620,Insurance,True,True,CC2000,McKinsey & Company,MAPPED,2025-07_AUD,1.0,-708.24,DOMESTIC,32410.971605588227,27490.799177232966,170.0,False,0.0,Saturday,True,True,True,EX005
TXN000505,2026-01-07,2026-01-03,2026-01,AUS01,5920,CC1000,Telstra Corp,INV20956,,NZD,-37421.64,GST-FREE,Payment for subscription,Manual Entry,2026-01-07,2026-01-03,2026,01,-37421.64,True,payment for subscription,2026-02-22 23:27:14.356841,Raw_GL_Export.csv,83.92156862745098,1,True,AUS01,5920,True,5920,FX Loss,True,True,CC1000,Telstra,MAPPED,2026-01_NZD,0.9335,-34933.10094,CONVERTED,27533.92400565971,21784.021192347693,144.0,False,0.0,Wednesday,False,True,True,EX001;EX005
TXN000506,11/03/2025,10/26/2025,2025-11,AUS01,5920,CC3100,Workday,INV22116,PO8021,NZD,-40814.49,GST,Payment for subscription,Workday,2025-03-11,2025-10-26,2025,11,-40814.49,True,payment for subscription,2026-02-22 23:27:14.356841,Raw_GL_Export.csv,83.92156862745098,2,True,AUS01,5920,True,5920,FX Loss,True,True,CC3100,Workday Inc,MAPPED,2025-11_NZD,0.933,-38079.91917,CONVERTED,27533.92400565971,21784.021192347693,144.0,False,0.0,Tuesday,False,True,True,EX005
TXN000507,06/02/2026,31/01/2026,2026-02,AUS01,5410,CC3200,Seek Limited,INV56490,PO7375,USD,-1817.07,EXPORT,Payment for services,API Import,2026-02-06,2026-01-31,2026,02,-1817.07,True,payment for services,2026-02-22 23:27:14.356841,Raw_GL_Export.csv,83.92156862745098,1,True,AUS01,5410,True,5410,Accommodation,True,True,CC3200,Seek,MAPPED,2026-02_USD,1.525,-2771.0317499999996,CONVERTED,29277.518810999987,22143.12829502557,155.0,False,0.0,Friday,False,True,True,EX005
TXN000508,26/02/2026,24/02/2026,2026-02,AUS01,5800,CC4100,Zoom,INV11859,,NZD,-16863.26,INPUT,Payment for consulting,Oracle,2026-02-26,2026-02-24,2026,02,-16863.26,True,payment for consulting,2026-02-22 23:27:14.356841,Raw_GL_Export.csv,83.92156862745098,1,True,AUS01,5800,True,5800,Depreciation,True,True,CC4100,Zoom Video Communications,MAPPED,2026-02_NZD,0.932,-15716.55832,CONVERTED,30184.39373025477,34245.09535020032,157.0,False,0.0,Thursday,False,True,True,EX001;EX005
TXN000509,11/16/2025,11/14/2025,2025-11,AUS01,5900,CC3100,Deloitte Touche,INV93138,PO2596,AUD,-686.89,GST-FREE,Payment for services,Oracle,2025-11-16,2025-11-14,2025,11,-686.89,True,payment for services,2026-02-22 23:27:14.356841,Raw_GL_Export.csv,83.92156862745098,1,True,AUS01,5900,True,5900,Bank Charges,True,True,CC3100,Deloitte,MAPPED,2025-11_AUD,1.0,-686.89,DOMESTIC,31670.032329854675,24882.231532617723,172.0,False,0.0,Sunday,True,True,True,EX005
TXN000510,24/01/2025,17/01/2025,2025-01,AUS01,5710,CC4000,Adobe,INV35055,PO1235,GBP,-39214.75,GST-FREE,Payment for subscription,Workday,2025-01-24,2025-01-17,2025,01,-39214.75,True,payment for subscription,2026-02-22 23:27:14.356841,Raw_GL_Export.csv,83.92156862745098,1,True,AUS01,5710,True,5710,Recruitment,True,True,CC4000,Adobe Systems,MAPPED,2025-01_GBP,1.95,-76468.7625,CONVERTED,29496.09592285716,24753.031499859637,133.0,False,0.0,Friday,False,True,True,EX005
TXN000511,01/01/2026,12/27/2025,2026-01,AUS01,5510,CC1100,Hays,INV56165,PO7977,GBP,-29338.72,INPUT,Payment for license,Workday,2026-01-01,2025-12-27,2026,01,-29338.72,True,payment for license,2026-02-22 23:27:14.356841,Raw_GL_Export.csv,83.92156862745098,1,True,AUS01,5510,True,5510,Advertising,True,True,CC1100,Hays Recruitment,MAPPED,2026-01_GBP,1.957,-57415.875040000006,CONVERTED,28498.583342781956,23667.16979723599,133.0,False,0.0,Thursday,False,True,True,EX005
TXN000512,04/09/2025,27/08/2025,2025-09,AUS01,5410,CC3000,Oracle,INV47359,PO8167,USD,-22916.13,EXPORT,Payment for subscription,API Import,2025-09-04,2025-08-27,2025,09,-22916.13,True,payment for subscription,2026-02-22 23:27:14.356841,Raw_GL_Export.csv,83.92156862745098,1,True,AUS01,5410,True,5410,Accommodation,True,True,CC3000,Oracle Corporation,MAPPED,2025-09_USD,1.519,-34809.60147,CONVERTED,29277.518810999987,22143.12829502557,155.0,False,0.0,Thursday,False,True,True,EX005
TXN000513,2026-01-28,2026-01-26,2026-01,AUS01,5900,CC1100,Google,INV23588,PO9924,AUD,-19248.61,EXPORT,Payment for services,Manual Entry,2026-01-28,2026-01-26,2026,01,-19248.61,True,payment for services,2026-02-22 23:27:14.356841,Raw_GL_Export.csv,83.92156862745098,1,True,AUS01,5900,True,5900,Bank Charges,True,True,CC1100,Google Cloud,MAPPED,2026-01_AUD,1.0,-19248.61,DOMESTIC,31670.032329854675,24882.231532617723,172.0,False,0.0,Wednesday,False,True,True,EX005
TXN000514,2025-03-17,2025-03-12,2025-03,AUS01,5920,CC3100,Workday,INV25007,,USD,-11233.68,EXPORT,Payment for consulting,SAP,2025-03-17,2025-03-12,2025,03,-11233.68,True,payment for consulting,2026-02-22 23:27:14.356841,Raw_GL_Export.csv,83.92156862745098,1,True,AUS01,5920,True,5920,FX Loss,True,True,CC3100,Workday Inc,MAPPED,2025-03_USD,1.53,-17187.5304,CONVERTED,27533.92400565971,21784.021192347693,144.0,False,0.0,Monday,False,True,True,EX001;EX005
TXN000515,12-01-2026,05-01-2026,2026-01,AUS01,5910,CC3100,AWS,INV45076,PO5333,NZD,-10968.42,INPUT,Payment for subscription,Manual Entry,2026-01-12,2026-01-05,2026,01,-10968.42,True,payment for subscription,2026-02-22 23:27:14.356841,Raw_GL_Export.csv,83.92156862745098,1,True,AUS01,5910,True,5910,Interest Expense,True,True,CC3100,Amazon Web Services,MAPPED,2026-01_NZD,0.9335,-10239.02007,CONVERTED,33774.54824600841,21661.31598456901,119.0,False,0.0,Monday,False,True,True,EX005
TXN000516,22/09/2025,21/09/2025,2025-09,AUS01,5410,CC1000,AWS,INV78021,PO6201,AUD,-42346.57,INPUT,Payment for subscription,Oracle,2025-09-22,2025-09-21,2025,09,-42346.57,True,payment for subscription,2026-02-22 23:27:14.356841,Raw_GL_Export.csv,83.92156862745098,1,True,AUS01,5410,True,5410,Accommodation,True,True,CC1000,Amazon Web Services,MAPPED,2025-09_AUD,1.0,-42346.57,DOMESTIC,29277.518810999987,22143.12829502557,155.0,False,0.0,Monday,False,True,True,EX005
TXN000517,19-01-2026,15-01-2026,2026-01,AUS01,5520,CC3100,SAP,INV26891,PO7396,GBP,-8655.36,EXPORT,Payment for goods,Manual Entry,2026-01-19,2026-01-15,2026,01,-8655.36,True,payment for goods,2026-02-22 23:27:14.356841,Raw_GL_Export.csv,83.92156862745098,1,True,AUS01,5520,True,5520,Events,True,True,CC3100,SAP SE,MAPPED,2026-01_GBP,1.957,-16938.539520000002,CONVERTED,30860.276023483882,21900.267908653983,155.0,False,0.0,Monday,False,True,True,EX005
TXN000518,11/05/2025,04/05/2025,2025-05,AUS01,5210,CC1100,Slack,INV92223,PO3605,AUD,-18491.09,EXPORT,Payment for subscription,Oracle,2025-05-11,2025-05-04,2025,05,-18491.09,True,payment for subscription,2026-02-22 23:27:14.356841,Raw_GL_Export.csv,83.92156862745098,1,True,AUS01,5210,True,5210,Cloud Services,True,True,CC1100,Slack Technologies,MAPPED,2025-05_AUD,1.0,-18491.09,DOMESTIC,31620.56664919015,27460.393400888206,142.0,False,0.0,Sunday,True,True,True,EX005
TXN000519,2026-01-03,2026-01-02,2026-01,AUS01,5410,CC1000,Zoom,INV84946,PO3138,AUD,-19156.83,GST,Payment for consulting,Workday,2026-01-03,2026-01-02,2026,01,-19156.83,True,payment for consulting,2026-02-22 23:27:14.356841,Raw_GL_Export.csv,83.92156862745098,1,True,AUS01,5410,True,5410,Accommodation,True,True,CC1000,Zoom Video Communications,MAPPED,2026-01_AUD,1.0,-19156.83,DOMESTIC,29277.518810999987,22143.12829502557,155.0,False,0.0,Saturday,True,True,True,EX005
TXN000520,06/01/2026,02/01/2026,2026-01,AUS01,5300,CC2000,Accenture Pty,INV46040,,GBP,-11557.46,GST,Payment for goods,SAP,2026-01-06,2026-01-02,2026,01,-11557.46,True,payment for goods,2026-02-22 23:27:14.356841,Raw_GL_Export.csv,83.92156862745098,1,True,AUS01,5300,True,5300,Professional Services,True,True,CC2000,Accenture,MAPPED,2026-01_GBP,1.957,-22617.94922,CONVERTED,33232.533450429684,35951.49997313202,128.0,False,0.0,Tuesday,False,True,True,EX001;EX005
TXN000521,2026-02-21,2026-02-19,2026-02,AUS01,5420,CC4100,Atlassian Pty,INV33675,,AUD,-42922.41,INPUT,Payment for consulting,Workday,2026-02-21,2026-02-19,2026,02,-42922.41,True,payment for consulting,2026-02-22 23:27:14.356841,Raw_GL_Export.csv,83.92156862745098,1,True,AUS01,5420,True,5420,Meals and Entertainment,True,True,CC4100,Atlassian,MAPPED,2026-02_AUD,1.0,-42922.41,DOMESTIC,30119.54810314684,25344.73848974119,143.0,False,0.0,Saturday,True,True,True,EX001;EX005
TXN000522,27/10/2025,20/10/2025,2025-10,AUS01,5100,CC3200,Amazon,INV37563,PO7148,GBP,-46328.56,GST,Payment for subscription,Manual Entry,2025-10-27,2025-10-20,2025,10,-46328.56,True,payment for subscription,2026-02-22 23:27:14.356841,Raw_GL_Export.csv,83.92156862745098,1,True,AUS01,5100,True,5100,Office Rent,True,True,CC3200,Amazon Web Services,MAPPED,2025-10_GBP,1.951,-90387.02056,CONVERTED,29138.02959753333,27547.65120166844,150.0,False,0.0,Monday,False,True,True,EX005
TXN000523,26/01/2026,23/01/2026,2026-01,AUS01,5300,CC1000,Oracle,INV55453,PO9953,AUD,-44151.36,INPUT,Payment for services,Oracle,2026-01-26,2026-01-23,2026,01,-44151.36,True,payment for services,2026-02-22 23:27:14.356841,Raw_GL_Export.csv,83.92156862745098,1,True,AUS01,5300,True,5300,Professional Services,True,True,CC1000,Oracle Corporation,MAPPED,2026-01_AUD,1.0,-44151.36,DOMESTIC,33232.533450429684,35951.49997313202,128.0,False,0.0,Monday,False,True,True,EX005
TXN000524,03/17/2025,03/15/2025,2025-03,AUS01,5200,CC4100,Amazon,INV38351,PO2880,AUD,-24152.05,GST-FREE,Payment for goods,SAP,2025-03-17,2025-03-15,2025,03,-24152.05,True,payment for goods,2026-02-22 23:27:14.356841,Raw_GL_Export.csv,83.92156862745098,1,True,AUS01,5200,True,5200,Software Licenses,True,True,CC4100,Amazon Web Services,MAPPED,2025-03_AUD,1.0,-24152.05,DOMESTIC,30196.543712413786,22166.314759696765,145.0,False,0.0,Monday,False,True,True,EX005
TXN000525,11/02/2026,07/02/2026,2026-02,AUS01,5020,CC1200,PWC,INV55685,PO5822,NZD,-25969.41,GST,Payment for consulting,Manual Entry,2026-02-11,2026-02-07,2026,02,-25969.41,True,payment for consulting,2026-02-22 23:27:14.356841,Raw_GL_Export.csv,83.92156862745098,1,True,AUS01,5020,True,5020,Contractor Fees,True,True,CC1200,PwC,MAPPED,2026-02_NZD,0.932,-24203.490120000002,CONVERTED,28445.577844280295,21241.721119146277,132.0,False,0.0,Wednesday,False,True,True,EX005
TXN000526,14-08-2025,10-08-2025,2025-08,AUS01,5220,CC1200,SAP,INV86499,PO6105,NZD,-2002.62,GST,Payment for goods,Oracle,2025-08-14,2025-08-10,2025,08,-2002.62,True,payment for goods,2026-02-22 23:27:14.356841,Raw_GL_Export.csv,83.92156862745098,1,True,AUS01,5220,True,5220,IT Support,True,True,CC1200,SAP SE,MAPPED,2025-08_NZD,0.93,-1862.4366,CONVERTED,29540.94372533058,19404.169897416657,121.0,False,0.0,Thursday,False,True,True,EX005
TXN000527,24-10-2025,17-10-2025,2025-10,AUS01,5420,CC3100,PWC,INV66270,,NZD,-18916.74,EXPORT,Payment for subscription,Workday,2025-10-24,2025-10-17,2025,10,-18916.74,True,payment for subscription,2026-02-22 23:27:14.356841,Raw_GL_Export.csv,83.92156862745098,1,True,AUS01,5420,True,5420,Meals and Entertainment,True,True,CC3100,PwC,MAPPED,2025-10_NZD,0.929,-17573.65146,CONVERTED,30119.54810314684,25344.73848974119,143.0,False,0.0,Friday,False,True,True,EX001;EX005
TXN000528,2026-01-21,2026-01-13,2026-01,AUS01,5120,CC1000,Robert Half International,INV89152,PO9691,NZD,-20715.22,INPUT,Payment for subscription,Manual Entry,2026-01-21,2026-01-13,2026,01,-20715.22,True,payment for subscription,2026-02-22 23:27:14.356841,Raw_GL_Export.csv,83.92156862745098,1,True,AUS01,5120,True,5120,Office Supplies,True,True,CC1000,Robert Half,MAPPED,2026-01_NZD,0.9335,-19337.657870000003,CONVERTED,34269.00595485611,35424.20705021751,139.0,False,0.0,Wednesday,False,True,True,EX005
TXN000529,2025-05-01,2025-04-28,2025-05,AUS01,5900,CC3000,Telstra Corp,INV38204,PO7094,USD,-32148.55,GST,Payment for goods,Workday,2025-05-01,2025-04-28,2025,05,-32148.55,True,payment for goods,2026-02-22 23:27:14.356841,Raw_GL_Export.csv,83.92156862745098,1,True,AUS01,5900,True,5900,Bank Charges,True,True,CC3000,Telstra,MAPPED,2025-05_USD,1.518,-48801.4989,CONVERTED,31670.032329854675,24882.231532617723,172.0,False,0.0,Thursday,False,True,True,EX005
TXN000530,2025-04-04,2025-03-29,2025-04,AUS01,5710,CC1000,BCG,INV40493,PO7317,USD,-26777.71,INPUT,Payment for subscription,API Import,2025-04-04,2025-03-29,2025,04,-26777.71,True,payment for subscription,2026-02-22 23:27:14.356841,Raw_GL_Export.csv,83.92156862745098,1,True,AUS01,5710,True,5710,Recruitment,True,True,CC1000,Boston Consulting Group,MAPPED,2025-04_USD,1.525,-40836.00775,CONVERTED,29496.09592285716,24753.031499859637,133.0,False,0.0,Friday,False,True,True,EX005
TXN000531,07/02/2026,05/02/2026,2026-02,AUS01,5520,CC2100,Salesforce,INV51652,PO4246,GBP,-15961.62,EXPORT,Payment for goods,SAP,2026-02-07,2026-02-05,2026,02,-15961.62,True,payment for goods,2026-02-22 23:27:14.356841,Raw_GL_Export.csv,83.92156862745098,1,True,AUS01,5520,True,5520,Events,True,True,CC2100,Salesforce Inc,MAPPED,2026-02_GBP,1.955,-31204.9671,CONVERTED,30860.276023483882,21900.267908653983,155.0,False,0.0,Saturday,True,True,True,EX005
TXN000532,26-06-2025,18-06-2025,2025-06,AUS01,5010,CC2100,AusPost,INV88830,PO7272,AUD,-43807.78,GST-FREE,Payment for goods,API Import,2025-06-26,2025-06-18,2025,06,-43807.78,True,payment for goods,2026-02-22 23:27:14.356841,Raw_GL_Export.csv,83.92156862745098,1,True,AUS01,5010,True,5010,Employee Benefits,True,True,CC2100,Australia Post,MAPPED,2025-06_AUD,1.0,-43807.78,DOMESTIC,27923.213086278203,19430.63083039902,133.0,False,0.0,Thursday,False,True,True,EX005
TXN000533,02/01/2026,01/31/2026,2026-02,AUS01,5620,CC4100,AWS,INV14850,PO9642,GBP,-35810.15,EXPORT,Payment for services,Workday,2026-01-02,2026-01-31,2026,02,-35810.15,True,payment for services,2026-02-22 23:27:14.356841,Raw_GL_Export.csv,83.92156862745098,2,True,AUS01,5620,True,5620,Insurance,True,True,CC4100,Amazon Web Services,MAPPED,2026-02_GBP,1.955,-70008.84325,CONVERTED,32410.971605588227,27490.799177232966,170.0,False,0.0,Friday,False,True,True,EX005
TXN000534,2026-02-21,2026-02-19,2026-02,AUS01,5500,CC1100,AusPost,INV62473,,NZD,-36293.79,INPUT,Payment for subscription,Manual Entry,2026-02-21,2026-02-19,2026,02,-36293.79,True,payment for subscription,2026-02-22 23:27:14.356841,Raw_GL_Export.csv,83.92156862745098,1,True,AUS01,5500,True,5500,Marketing,True,True,CC1100,Australia Post,MAPPED,2026-02_NZD,0.932,-33825.812280000006,CONVERTED,28972.634359125877,32785.70497360227,143.0,False,0.0,Saturday,True,True,True,EX001;EX005
TXN000535,2026-02-20,2026-02-13,2026-02,AUS01,5300,CC3200,Hays,INV13838,,AUD,-7930.53,GST,Payment for services,Oracle,2026-02-20,2026-02-13,2026,02,-7930.53,True,payment for services,2026-02-22 23:27:14.356841,Raw_GL_Export.csv,83.92156862745098,1,True,AUS01,5300,True,5300,Professional Services,True,True,CC3200,Hays Recruitment,MAPPED,2026-02_AUD,1.0,-7930.53,DOMESTIC,33232.533450429684,35951.49997313202,128.0,False,0.0,Friday,False,True,True,EX001;EX005
TXN000536,07/04/2025,06/27/2025,2025-07,AUS01,5210,CC1200,Google,INV80458,PO1860,USD,-13867.02,INPUT,Payment for subscription,SAP,2025-04-07,2025-06-27,2025,07,-13867.02,True,payment for subscription,2026-02-22 23:27:14.356841,Raw_GL_Export.csv,83.92156862745098,2,True,AUS01,5210,True,5210,Cloud Services,True,True,CC1200,Google Cloud,MAPPED,2025-07_USD,1.528,-21188.80656,CONVERTED,31620.56664919015,27460.393400888206,142.0,False,0.0,Monday,False,True,True,EX005
TXN000537,2026-02-04,2026-01-30,2026-02,AUS01,5020,CC2100,BCG,INV32326,PO8548,GBP,12219.05,,Payment for services,Oracle,2026-02-04,2026-01-30,2026,02,12219.05,False,payment for services,2026-02-22 23:27:14.356841,Raw_GL_Export.csv,83.92156862745098,0,True,AUS01,5020,True,5020,Contractor Fees,True,True,CC2100,Boston Consulting Group,MAPPED,2026-02_GBP,1.955,23888.24275,CONVERTED,28445.577844280295,21241.721119146277,132.0,False,0.0,Wednesday,False,True,True,EX009
TXN000538,11/01/2025,01/01/2025,2025-01,AUS01,5920,CC3100,Optus Pty,INV41525,PO9029,AUD,23527.19,,Payment for subscription,Workday,2025-01-11,2025-01-01,2025,01,23527.19,False,payment for subscription,2026-02-22 23:27:14.356841,Raw_GL_Export.csv,83.92156862745098,0,True,AUS01,5920,True,5920,FX Loss,True,True,CC3100,Optus,MAPPED,2025-01_AUD,1.0,23527.19,DOMESTIC,27533.92400565971,21784.021192347693,144.0,False,0.0,Saturday,True,True,True,EX009
TXN000539,25-02-2026,21-02-2026,2026-02,AUS01,5020,CC2100,KPMG Australia,INV41768,PO4373,AUD,15950.14,,Payment for services,SAP,2026-02-25,2026-02-21,2026,02,15950.14,False,payment for services,2026-02-22 23:27:14.356841,Raw_GL_Export.csv,83.92156862745098,0,True,AUS01,5020,True,5020,Contractor Fees,True,True,CC2100,KPMG,MAPPED,2026-02_AUD,1.0,15950.14,DOMESTIC,28445.577844280295,21241.721119146277,132.0,False,0.0,Wednesday,False,True,True,EX009
TXN000540,2026-01-16,2026-01-12,2026-01,AUS01,5000,CC2000,LinkedIn Corp,INV23701,PO9644,GBP,8537.49,,Payment for license,Workday,2026-01-16,2026-01-12,2026,01,8537.49,False,payment for license,2026-02-22 23:27:14.356841,Raw_GL_Export.csv,83.92156862745098,0,True,AUS01,5000,True,5000,Salaries and Wages,True,True,CC2000,LinkedIn,MAPPED,2026-01_GBP,1.957,16707.86793,CONVERTED,30471.385558248177,22939.768434623154,137.0,False,0.0,Friday,False,True,True,EX009
TXN000541,01/25/2026,01/17/2026,2026-01,AUS01,5620,CC1200,Robert Half International,INV38676,PO7317,AUD,41144.22,,Payment for consulting,API Import,2026-01-25,2026-01-17,2026,01,41144.22,False,payment for consulting,2026-02-22 23:27:14.356841,Raw_GL_Export.csv,83.92156862745098,0,True,AUS01,5620,True,5620,Insurance,True,True,CC1200,Robert Half,MAPPED,2026-01_AUD,1.0,41144.22,DOMESTIC,32410.971605588227,27490.799177232966,170.0,False,0.0,Sunday,True,True,True,EX009
TXN000542,17/02/2026,10/02/2026,2026-02,AUS01,5200,CC1100,PWC,INV50258,PO2672,GBP,7472.41,,Payment for goods,Manual Entry,2026-02-17,2026-02-10,2026,02,7472.41,False,payment for goods,2026-02-22 23:27:14.356841,Raw_GL_Export.csv,83.92156862745098,0,True,AUS01,5200,True,5200,Software Licenses,True,True,CC1100,PwC,MAPPED,2026-02_GBP,1.955,14608.56155,CONVERTED,30196.543712413786,22166.314759696765,145.0,False,0.0,Tuesday,False,True,True,EX009
TXN000543,2025-08-04,2025-07-31,2025-08,AUS01,5000,CC3200,Oracle,INV96754,PO6766,NZD,1383.52,,Payment for subscription,SAP,2025-08-04,2025-07-31,2025,08,1383.52,False,payment for subscription,2026-02-22 23:27:14.356841,Raw_GL_Export.csv,83.92156862745098,0,True,AUS01,5000,True,5000,Salaries and Wages,True,True,CC3200,Oracle Corporation,MAPPED,2025-08_NZD,0.93,1286.6736,CONVERTED,30471.385558248177,22939.768434623154,137.0,False,0.0,Monday,False,True,True,EX009
TXN000544,2026-02-18,2026-02-12,2026-02,AUS01,5410,CC2000,Zoom,INV76574,PO8230,GBP,22648.35,,Payment for subscription,Workday,2026-02-18,2026-02-12,2026,02,22648.35,False,payment for subscription,2026-02-22 23:27:14.356841,Raw_GL_Export.csv,83.92156862745098,0,True,AUS01,5410,True,5410,Accommodation,True,True,CC2000,Zoom Video Communications,MAPPED,2026-02_GBP,1.955,44277.52425,CONVERTED,29277.518810999987,22143.12829502557,155.0,False,0.0,Wednesday,False,True,True,EX009
TXN000545,2026-01-04,2025-12-28,2026-01,AUS01,5800,CC3100,SAP,INV33153,PO9676,NZD,8606.29,,Payment for license,Manual Entry,2026-01-04,2025-12-28,2026,01,8606.29,False,payment for license,2026-02-22 23:27:14.356841,Raw_GL_Export.csv,83.92156862745098,0,True,AUS01,5800,True,5800,Depreciation,True,True,CC3100,SAP SE,MAPPED,2026-01_NZD,0.9335,8033.971715000001,CONVERTED,30184.39373025477,34245.09535020032,157.0,False,0.0,Sunday,True,True,True,EX009
TXN000546,17-02-2026,15-02-2026,2026-02,AUS01,5700,CC1000,Accenture Pty,INV16964,PO5361,AUD,9959.13,,Payment for goods,SAP,2026-02-17,2026-02-15,2026,02,9959.13,False,payment for goods,2026-02-22 23:27:14.356841,Raw_GL_Export.csv,83.92156862745098,0,True,AUS01,5700,True,5700,Training,True,True,CC1000,Accenture,MAPPED,2026-02_AUD,1.0,9959.13,DOMESTIC,31110.431902446802,30160.111495086097,141.0,False,0.0,Tuesday,False,True,True,EX009
TXN000547,2026-01-18,2026-01-13,2026-01,AUS01,5210,CC4100,DHL Express,INV38821,PO5395,GBP,17740.56,,Payment for consulting,Oracle,2026-01-18,2026-01-13,2026,01,17740.56,False,payment for consulting,2026-02-22 23:27:14.356841,Raw_GL_Export.csv,83.92156862745098,0,True,AUS01,5210,True,5210,Cloud Services,True,True,CC4100,DHL,MAPPED,2026-01_GBP,1.957,34718.27592000001,CONVERTED,31620.56664919015,27460.393400888206,142.0,False,0.0,Sunday,True,True,True,EX009
TXN000548,06/01/2026,31/12/2025,2026-01,AUS01,5620,CC2100,KPMG Australia,INV75960,PO8811,AUD,4331.49,,Payment for subscription,Oracle,2026-01-06,2025-12-31,2026,01,4331.49,False,payment for subscription,2026-02-22 23:27:14.356841,Raw_GL_Export.csv,83.92156862745098,0,True,AUS01,5620,True,5620,Insurance,True,True,CC2100,KPMG,MAPPED,2026-01_AUD,1.0,4331.49,DOMESTIC,32410.971605588227,27490.799177232966,170.0,False,0.0,Tuesday,False,True,True,EX009
TXN000549,02/06/2026,02/04/2026,2026-02,AUS01,5120,CC1200,BCG,INV11669,PO8011,GBP,6468.33,,Payment for subscription,SAP,2026-06-02,2026-04-02,2026,02,6468.33,False,payment for subscription,2026-02-22 23:27:14.356841,Raw_GL_Export.csv,83.92156862745098,1,True,AUS01,5120,True,5120,Office Supplies,True,True,CC1200,Boston Consulting Group,MAPPED,2026-02_GBP,1.955,12645.58515,CONVERTED,34269.00595485611,35424.20705021751,139.0,False,0.0,Tuesday,False,True,True,EX007;EX009
TXN000550,01/06/2026,01/04/2026,2026-01,AUS01,5120,CC1000,WeWork Australia,INV74003,PO8742,GBP,26283.83,,Payment for services,SAP,2026-06-01,2026-04-01,2026,01,26283.83,False,payment for services,2026-02-22 23:27:14.356841,Raw_GL_Export.csv,83.92156862745098,1,True,AUS01,5120,True,5120,Office Supplies,True,True,CC1000,WeWork,MAPPED,2026-01_GBP,1.957,51437.455310000005,CONVERTED,34269.00595485611,35424.20705021751,139.0,False,0.0,Monday,False,True,True,EX004;EX009
TXN000551,2026-01-27,2026-01-17,2026-01,AUS01,5700,CC2100,ServiceNow Inc,INV22308,,USD,33999.16,,Payment for subscription,Manual Entry,2026-01-27,2026-01-17,2026,01,33999.16,False,payment for subscription,2026-02-22 23:27:14.356841,Raw_GL_Export.csv,83.92156862745098,0,True,AUS01,5700,True,5700,Training,True,True,CC2100,ServiceNow,MAPPED,2026-01_USD,1.527,51916.71732,CONVERTED,31110.431902446802,30160.111495086097,141.0,False,0.0,Tuesday,False,True,True,EX001;EX004;EX009
TXN000552,01/16/2026,01/07/2026,2026-01,AUS01,5220,CC3200,Deloitte Touche,INV56219,PO6467,NZD,20697.91,,Payment for license,API Import,2026-01-16,2026-07-01,2026,01,20697.91,False,payment for license,2026-02-22 23:27:14.356841,Raw_GL_Export.csv,83.92156862745098,0,True,AUS01,5220,True,5220,IT Support,True,True,CC3200,Deloitte,MAPPED,2026-01_NZD,0.9335,19321.498985,CONVERTED,29540.94372533058,19404.169897416657,121.0,False,0.0,Friday,False,True,True,EX009
TXN000553,2026-02-16,2026-02-11,2026-02,AUS01,5700,CC4000,Amazon,INV38869,PO3320,USD,44040.82,,Payment for subscription,Manual Entry,2026-02-16,2026-02-11,2026,02,44040.82,False,payment for subscription,2026-02-22 23:27:14.356841,Raw_GL_Export.csv,83.92156862745098,0,True,AUS01,5700,True,5700,Training,True,True,CC4000,Amazon Web Services,MAPPED,2026-02_USD,1.525,67162.2505,CONVERTED,31110.431902446802,30160.111495086097,141.0,False,0.0,Monday,False,True,True,EX004;EX009
TXN000554,01/02/2026,22/01/2026,2026-02,AUS01,5800,CC3100,Regus Australia,INV35407,PO7189,USD,33521.99,,Payment for services,Workday,2026-02-01,2026-01-22,2026,02,33521.99,False,payment for services,2026-02-22 23:27:14.356841,Raw_GL_Export.csv,83.92156862745098,0,True,AUS01,5800,True,5800,Depreciation,True,True,CC3100,Regus,MAPPED,2026-02_USD,1.525,51121.03474999999,CONVERTED,30184.39373025477,34245.09535020032,157.0,False,0.0,Sunday,True,True,True,EX004;EX009
TXN000555,21-01-2026,12-01-2026,2026-01,AUS01,5120,CC2100,WeWork Australia,INV64695,PO5526,NZD,17657.08,,Payment for subscription,Oracle,2026-01-21,2026-01-12,2026,01,17657.08,False,payment for subscription,2026-02-22 23:27:14.356841,Raw_GL_Export.csv,83.92156862745098,0,True,AUS01,5120,True,5120,Office Supplies,True,True,CC2100,WeWork,MAPPED,2026-01_NZD,0.9335,16482.88418,CONVERTED,34269.00595485611,35424.20705021751,139.0,False,0.0,Wednesday,False,True,True,EX009
TXN000556,06/02/2025,05/23/2025,2025-06,AUS01,5100,CC3100,LinkedIn Corp,INV11092,PO3410,NZD,13049.54,,Payment for consulting,Oracle,2025-02-06,2025-05-23,2025,06,13049.54,False,payment for consulting,2026-02-22 23:27:14.356841,Raw_GL_Export.csv,83.92156862745098,1,True,AUS01,5100,True,5100,Office Rent,True,True,CC3100,LinkedIn,MAPPED,2025-06_NZD,0.931,12149.121740000002,CONVERTED,29138.02959753333,27547.65120166844,150.0,False,0.0,Thursday,False,True,True,EX009
TXN000557,02/17/2026,02/07/2026,2026-02,AUS01,5520,CC1200,EY Australia,INV48630,,GBP,13042.87,,Payment for services,Oracle,2026-02-17,2026-07-02,2026,02,13042.87,False,payment for services,2026-02-22 23:27:14.356841,Raw_GL_Export.csv,83.92156862745098,0,True,AUS01,5520,True,5520,Events,True,True,CC1200,EY,MAPPED,2026-02_GBP,1.955,25498.81085,CONVERTED,30860.276023483882,21900.267908653983,155.0,False,0.0,Tuesday,False,True,True,EX001;EX009
TXN000558,2026-02-10,2026-02-09,2026-02,AUS01,5500,CC2100,AWS,INV10084,,GBP,15916.27,,Payment for goods,Workday,2026-02-10,2026-02-09,2026,02,15916.27,False,payment for goods,2026-02-22 23:27:14.356841,Raw_GL_Export.csv,83.92156862745098,0,True,AUS01,5500,True,5500,Marketing,True,True,CC2100,Amazon Web Services,MAPPED,2026-02_GBP,1.955,31116.30785,CONVERTED,28972.634359125877,32785.70497360227,143.0,False,0.0,Tuesday,False,True,True,EX001;EX009
TXN000559,10/10/2025,08/10/2025,2025-10,AUS01,5710,CC2100,Zoom,INV20579,,USD,19499.08,,Payment for services,Manual Entry,2025-10-10,2025-10-08,2025,10,19499.08,False,payment for services,2026-02-22 23:27:14.356841,Raw_GL_Export.csv,83.92156862745098,0,True,AUS01,5710,True,5710,Recruitment,True,True,CC2100,Zoom Video Communications,MAPPED,2025-10_USD,1.521,29658.10068,CONVERTED,29496.09592285716,24753.031499859637,133.0,False,0.0,Friday,False,True,True,EX001;EX009
TXN000560,12/01/2026,05/01/2026,2026-01,AUS01,5410,CC3100,GCP,INV88255,PO8140,NZD,41416.72,,Payment for subscription,API Import,2026-01-12,2026-01-05,2026,01,41416.72,False,payment for subscription,2026-02-22 23:27:14.356841,Raw_GL_Export.csv,83.92156862745098,0,True,AUS01,5410,True,5410,Accommodation,True,True,CC3100,Google Cloud,MAPPED,2026-01_NZD,0.9335,38662.50812,CONVERTED,29277.518810999987,22143.12829502557,155.0,False,0.0,Monday,False,True,True,EX009
TXN000561,05/01/2026,31/12/2025,2026-01,AUS01,5110,CC3100,SAP,INV48972,PO8555,NZD,13794.32,,Payment for license,Oracle,2026-01-05,2025-12-31,2026,01,13794.32,False,payment for license,2026-02-22 23:27:14.356841,Raw_GL_Export.csv,83.92156862745098,0,True,AUS01,5110,True,5110,Utilities,True,True,CC3100,SAP SE,MAPPED,2026-01_NZD,0.9335,12876.99772,CONVERTED,27865.288293732876,21409.69928933269,146.0,False,0.0,Monday,False,True,True,EX009
TXN000562,13-12-2025,11-12-2025,2025-12,AUS01,5110,CC4000,Optus Pty,INV99805,PO8673,NZD,22721.3,,Payment for subscription,Manual Entry,2025-12-13,2025-12-11,2025,12,22721.3,False,payment for subscription,2026-02-22 23:27:14.356841,Raw_GL_Export.csv,83.92156862745098,0,True,AUS01,5110,True,5110,Utilities,True,True,CC4000,Optus,MAPPED,2025-12_NZD,0.9305,21142.16965,CONVERTED,27865.288293732876,21409.69928933269,146.0,False,0.0,Saturday,True,True,True,EX009
TXN000563,15-11-2025,08-11-2025,2025-11,AUS01,5420,CC1000,Amazon,INV28426,PO5954,GBP,4070.46,,Payment for goods,API Import,2025-11-15,2025-11-08,2025,11,4070.46,False,payment for goods,2026-02-22 23:27:14.356841,Raw_GL_Export.csv,83.92156862745098,0,True,AUS01,5420,True,5420,Meals and Entertainment,True,True,CC1000,Amazon Web Services,MAPPED,2025-11_GBP,1.956,7961.81976,CONVERTED,30119.54810314684,25344.73848974119,143.0,False,0.0,Saturday,True,True,True,EX009
TXN000564,01/17/2026,01/14/2026,2026-01,AUS01,5610,CC4000,KPMG Australia,INV61466,,AUD,34014.55,,Payment for services,Manual Entry,2026-01-17,2026-01-14,2026,01,34014.55,False,payment for services,2026-02-22 23:27:14.356841,Raw_GL_Export.csv,83.92156862745098,0,True,AUS01,5610,True,5610,Postage and Courier,True,True,CC4000,KPMG,MAPPED,2026-01_AUD,1.0,34014.55,DOMESTIC,29081.766845273953,25872.32663648796,146.0,False,0.0,Saturday,True,True,True,EX001;EX009
TXN000565,26-01-2026,25-01-2026,2026-01,AUS01,5020,CC1000,PWC,INV22766,PO8888,AUD,15073.41,,Payment for subscription,SAP,2026-01-26,2026-01-25,2026,01,15073.41,False,payment for subscription,2026-02-22 23:27:14.356841,Raw_GL_Export.csv,83.92156862745098,0,True,AUS01,5020,True,5020,Contractor Fees,True,True,CC1000,PwC,MAPPED,2026-01_AUD,1.0,15073.41,DOMESTIC,28445.577844280295,21241.721119146277,132.0,False,0.0,Monday,False,True,True,EX009
TXN000566,2025-02-04,2025-01-31,2025-02,AUS01,5510,CC1200,Hays,INV98562,PO3535,USD,10137.11,,Payment for subscription,Workday,2025-02-04,2025-01-31,2025,02,10137.11,False,payment for subscription,2026-02-22 23:27:14.356841,Raw_GL_Export.csv,83.92156862745098,0,True,AUS01,5510,True,5510,Advertising,True,True,CC1200,Hays Recruitment,MAPPED,2025-02_USD,1.51,15307.036100000001,CONVERTED,28498.583342781956,23667.16979723599,133.0,False,0.0,Tuesday,False,True,True,EX009
TXN000567,2026-01-24,2026-01-16,2026-01,AUS01,5610,CC2000,Atlassian Pty,INV89140,PO9516,AUD,101.6,,Payment for services,Oracle,2026-01-24,2026-01-16,2026,01,101.6,False,payment for services,2026-02-22 23:27:14.356841,Raw_GL_Export.csv,83.92156862745098,0,True,AUS01,5610,True,5610,Postage and Courier,True,True,CC2000,Atlassian,MAPPED,2026-01_AUD,1.0,101.6,DOMESTIC,29081.766845273953,25872.32663648796,146.0,False,0.0,Saturday,True,True,True,EX009
TXN000568,2026-02-07,2026-01-30,2026-02,AUS01,5000,CC4000,Optus Pty,INV25966,,GBP,2598.83,,Payment for consulting,Oracle,2026-02-07,2026-01-30,2026,02,2598.83,False,payment for consulting,2026-02-22 23:27:14.356841,Raw_GL_Export.csv,83.92156862745098,0,True,AUS01,5000,True,5000,Salaries and Wages,True,True,CC4000,Optus,MAPPED,2026-02_GBP,1.955,5080.71265,CONVERTED,30471.385558248177,22939.768434623154,137.0,False,0.0,Saturday,True,True,True,EX001;EX009
TXN000569,27/06/2025,18/06/2025,2025-06,AUS01,5220,CC4100,Optus Pty,INV93387,,AUD,19512.68,,Payment for goods,Oracle,2025-06-27,2025-06-18,2025,06,19512.68,False,payment for goods,2026-02-22 23:27:14.356841,Raw_GL_Export.csv,83.92156862745098,0,True,AUS01,5220,True,5220,IT Support,True,True,CC4100,Optus,MAPPED,2025-06_AUD,1.0,19512.68,DOMESTIC,29540.94372533058,19404.169897416657,121.0,False,0.0,Friday,False,True,True,EX001;EX009
TXN000570,06/11/2025,29/10/2025,2025-11,AUS01,5500,CC2100,KPMG Australia,INV74613,PO5508,AUD,43163.2,,Payment for consulting,Manual Entry,2025-11-06,2025-10-29,2025,11,43163.2,False,payment for consulting,2026-02-22 23:27:14.356841,Raw_GL_Export.csv,83.92156862745098,0,True,AUS01,5500,True,5500,Marketing,True,True,CC2100,KPMG,MAPPED,2025-11_AUD,1.0,43163.2,DOMESTIC,28972.634359125877,32785.70497360227,143.0,False,0.0,Thursday,False,True,True,EX009
TXN000571,2025-10-23,2025-10-15,2025-10,AUS01,5410,CC3100,Zoom,INV25745,PO1180,AUD,12825.66,,Payment for license,Workday,2025-10-23,2025-10-15,2025,10,12825.66,False,payment for license,2026-02-22 23:27:14.356841,Raw_GL_Export.csv,83.92156862745098,0,True,AUS01,5410,True,5410,Accommodation,True,True,CC3100,Zoom Video Communications,MAPPED,2025-10_AUD,1.0,12825.66,DOMESTIC,29277.518810999987,22143.12829502557,155.0,False,0.0,Thursday,False,True,True,EX009
TXN000572,02-01-2026,01-01-2026,2026-01,AUS01,5320,CC1200,LinkedIn Corp,INV30750,PO9244,GBP,12532.99,,Payment for goods,Workday,2026-01-02,2026-01-01,2026,01,12532.99,False,payment for goods,2026-02-22 23:27:14.356841,Raw_GL_Export.csv,83.92156862745098,0,True,AUS01,5320,True,5320,Audit Fees,True,True,CC1200,LinkedIn,MAPPED,2026-01_GBP,1.957,24527.06143,CONVERTED,31658.610713475173,32284.527206153973,141.0,False,0.0,Friday,False,True,True,EX009
TXN000573,23-01-2026,14-01-2026,2026-01,AUS01,5020,CC1200,Zoom,INV83812,PO3294,NZD,29551.41,,Payment for subscription,Workday,2026-01-23,2026-01-14,2026,01,29551.41,False,payment for subscription,2026-02-22 23:27:14.356841,Raw_GL_Export.csv,83.92156862745098,0,True,AUS01,5020,True,5020,Contractor Fees,True,True,CC1200,Zoom Video Communications,MAPPED,2026-01_NZD,0.9335,27586.241235,CONVERTED,28445.577844280295,21241.721119146277,132.0,False,0.0,Friday,False,True,True,EX009
TXN000574,2025-09-13,2025-09-05,2025-09,AUS01,5400,CC3200,Oracle,INV52477,PO6703,NZD,5911.05,,Payment for license,API Import,2025-09-13,2025-09-05,2025,09,5911.05,False,payment for license,2026-02-22 23:27:14.356841,Raw_GL_Export.csv,83.92156862745098,0,True,AUS01,5400,True,5400,Travel,True,True,CC3200,Oracle Corporation,MAPPED,2025-09_NZD,0.927,5479.543350000001,CONVERTED,31663.682660000006,30146.476988256833,133.0,False,0.0,Saturday,True,True,True,EX009
TXN000575,27-01-2026,25-01-2026,2026-01,AUS01,5010,CC1000,Adobe,INV23922,PO8805,USD,4434.67,,Payment for subscription,Oracle,2026-01-27,2026-01-25,2026,01,4434.67,False,payment for subscription,2026-02-22 23:27:14.356841,Raw_GL_Export.csv,83.92156862745098,0,True,AUS01,5010,True,5010,Employee Benefits,True,True,CC1000,Adobe Systems,MAPPED,2026-01_USD,1.527,6771.7410899999995,CONVERTED,27923.213086278203,19430.63083039902,133.0,False,0.0,Tuesday,False,True,True,EX009
TXN000576,25/02/2026,23/02/2026,2026-02,AUS01,5120,CC3100,AusPost,INV42831,,AUD,2880.51,,Payment for services,Manual Entry,2026-02-25,2026-02-23,2026,02,2880.51,False,payment for services,2026-02-22 23:27:14.356841,Raw_GL_Export.csv,83.92156862745098,0,True,AUS01,5120,True,5120,Office Supplies,True,True,CC3100,Australia Post,MAPPED,2026-02_AUD,1.0,2880.51,DOMESTIC,34269.00595485611,35424.20705021751,139.0,False,0.0,Wednesday,False,True,True,EX001;EX009
TXN000577,11/25/2025,11/15/2025,2025-11,AUS01,5620,CC1000,Oracle,INV68918,PO4272,NZD,4933.98,,Payment for goods,Workday,2025-11-25,2025-11-15,2025,11,4933.98,False,payment for goods,2026-02-22 23:27:14.356841,Raw_GL_Export.csv,83.92156862745098,0,True,AUS01,5620,True,5620,Insurance,True,True,CC1000,Oracle Corporation,MAPPED,2025-11_NZD,0.933,4603.40334,CONVERTED,32410.971605588227,27490.799177232966,170.0,False,0.0,Tuesday,False,True,True,EX009
TXN000578,16-02-2026,11-02-2026,2026-02,AUS01,5210,CC2000,Adobe,INV35204,,GBP,36641.31,,Payment for services,SAP,2026-02-16,2026-02-11,2026,02,36641.31,False,payment for services,2026-02-22 23:27:14.356841,Raw_GL_Export.csv,83.92156862745098,0,True,AUS01,5210,True,5210,Cloud Services,True,True,CC2000,Adobe Systems,MAPPED,2026-02_GBP,1.955,71633.76105,CONVERTED,31620.56664919015,27460.393400888206,142.0,False,0.0,Monday,False,True,True,EX001;EX004;EX009
TXN000579,2026-01-07,2026-01-04,2026-01,AUS01,5000,CC3000,AusPost,INV99438,PO9653,AUD,15397.94,,Payment for consulting,Oracle,2026-01-07,2026-01-04,2026,01,15397.94,False,payment for consulting,2026-02-22 23:27:14.356841,Raw_GL_Export.csv,83.92156862745098,0,True,AUS01,5000,True,5000,Salaries and Wages,True,True,CC3000,Australia Post,MAPPED,2026-01_AUD,1.0,15397.94,DOMESTIC,30471.385558248177,22939.768434623154,137.0,False,0.0,Wednesday,False,True,True,EX009
TXN000580,27/02/2026,17/02/2026,2026-02,AUS01,5910,CC3200,Robert Half International,INV83229,PO2100,NZD,16106.19,,Payment for consulting,Manual Entry,2026-02-27,2026-02-17,2026,02,16106.19,False,payment for consulting,2026-02-22 23:27:14.356841,Raw_GL_Export.csv,83.92156862745098,0,True,AUS01,5910,True,5910,Interest Expense,True,True,CC3200,Robert Half,MAPPED,2026-02_NZD,0.932,15010.96908,CONVERTED,33774.54824600841,21661.31598456901,119.0,False,0.0,Friday,False,True,True,EX009
TXN000581,21-01-2026,19-01-2026,2026-01,AUS01,5600,CC1100,Slack,INV75367,,NZD,4630.99,,Payment for license,API Import,2026-01-21,2026-01-19,2026,01,4630.99,False,payment for license,2026-02-22 23:27:14.356841,Raw_GL_Export.csv,83.92156862745098,0,True,AUS01,5600,True,5600,Telecommunications,True,True,CC1100,Slack Technologies,MAPPED,2026-01_NZD,0.9335,4323.029165,CONVERTED,32190.120230168057,26805.910450208805,119.0,False,0.0,Wednesday,False,True,True,EX001;EX009
TXN000582,2026-02-11,2026-02-07,2026-02,AUS01,5910,CC2100,Deloitte Touche,INV18906,PO3586,GBP,31676.97,,Payment for subscription,SAP,2026-02-11,2026-02-07,2026,02,31676.97,False,payment for subscription,2026-02-22 23:27:14.356841,Raw_GL_Export.csv,83.92156862745098,0,True,AUS01,5910,True,5910,Interest Expense,True,True,CC2100,Deloitte,MAPPED,2026-02_GBP,1.955,61928.476350000004,CONVERTED,33774.54824600841,21661.31598456901,119.0,False,0.0,Wednesday,False,True,True,EX004;EX009
TXN000583,18/01/2026,09/01/2026,2026-01,AUS01,5610,CC4000,EY Australia,INV81557,PO2816,GBP,27877.16,,Payment for license,Manual Entry,2026-01-18,2026-01-09,2026,01,27877.16,False,payment for license,2026-02-22 23:27:14.356841,Raw_GL_Export.csv,83.92156862745098,0,True,AUS01,5610,True,5610,Postage and Courier,True,True,CC4000,EY,MAPPED,2026-01_GBP,1.957,54555.60212,CONVERTED,29081.766845273953,25872.32663648796,146.0,False,0.0,Sunday,True,True,True,EX004;EX009
TXN000584,2026-02-09,2026-02-08,2026-02,AUS01,5310,CC3100,Deloitte Touche,INV17784,,USD,15120.9,,Payment for license,Workday,2026-02-09,2026-02-08,2026,02,15120.9,False,payment for license,2026-02-22 23:27:14.356841,Raw_GL_Export.csv,83.92156862745098,0,True,AUS01,5310,True,5310,Legal Fees,True,True,CC3100,Deloitte,MAPPED,2026-02_USD,1.525,23059.372499999998,CONVERTED,33139.04129260232,28423.631835285127,171.0,False,0.0,Monday,False,True,True,EX001;EX009
TXN000585,2026-01-25,2026-01-21,2026-01,AUS01,5500,CC1100,Microsoft,INV64557,PO2320,NZD,44149.42,,Payment for license,Manual Entry,2026-01-25,2026-01-21,2026,01,44149.42,False,payment for license,2026-02-22 23:27:14.356841,Raw_GL_Export.csv,83.92156862745098,0,True,AUS01,5500,True,5500,Marketing,True,True,CC1100,Microsoft Corporation,MAPPED,2026-01_NZD,0.9335,41213.48357,CONVERTED,28972.634359125877,32785.70497360227,143.0,False,0.0,Sunday,True,True,True,EX009
TXN000586,01/05/2026,01/04/2026,2026-01,AUS01,5100,CC1000,Hays,INV66559,PO4731,USD,29300.13,,Payment for services,SAP,2026-05-01,2026-04-01,2026,01,29300.13,False,payment for services,2026-02-22 23:27:14.356841,Raw_GL_Export.csv,83.92156862745098,1,True,AUS01,5100,True,5100,Office Rent,True,True,CC1000,Hays Recruitment,MAPPED,2026-01_USD,1.527,44741.29851,CONVERTED,29138.02959753333,27547.65120166844,150.0,False,0.0,Friday,False,True,True,EX009
TXN000587,01/02/2026,23/01/2026,2026-02,AUS01,5610,CC3100,Amazon,INV59444,PO8040,GBP,2441.1,,Payment for consulting,API Import,2026-02-01,2026-01-23,2026,02,2441.1,False,payment for consulting,2026-02-22 23:27:14.356841,Raw_GL_Export.csv,83.92156862745098,0,True,AUS01,5610,True,5610,Postage and Courier,True,True,CC3100,Amazon Web Services,MAPPED,2026-02_GBP,1.955,4772.3505,CONVERTED,29081.766845273953,25872.32663648796,146.0,False,0.0,Sunday,True,True,True,EX009
TXN000588,2026-01-05,2025-12-28,2026-01,AUS01,5100,CC4100,Regus Australia,INV67216,PO4902,NZD,8794.69,,Payment for goods,SAP,2026-01-05,2025-12-28,2026,01,8794.69,False,payment for goods,2026-02-22 23:27:14.356841,Raw_GL_Export.csv,83.92156862745098,0,True,AUS01,5100,True,5100,Office Rent,True,True,CC4100,Regus,MAPPED,2026-01_NZD,0.9335,8209.843115,CONVERTED,29138.02959753333,27547.65120166844,150.0,False,0.0,Monday,False,True,True,EX009
TXN000589,2025-01-19,2025-01-15,2025-01,AUS01,5410,CC4000,Microsoft,INV42757,PO2255,AUD,39309.19,,Payment for services,Oracle,2025-01-19,2025-01-15,2025,01,39309.19,False,payment for services,2026-02-22 23:27:14.356841,Raw_GL_Export.csv,83.92156862745098,0,True,AUS01,5410,True,5410,Accommodation,True,True,CC4000,Microsoft Corporation,MAPPED,2025-01_AUD,1.0,39309.19,DOMESTIC,29277.518810999987,22143.12829502557,155.0,False,0.0,Sunday,True,True,True,EX009
TXN000590,15/12/2025,10/12/2025,2025-12,AUS01,5010,CC3000,WeWork Australia,INV27002,PO8843,USD,44914.19,,Payment for services,SAP,2025-12-15,2025-12-10,2025,12,44914.19,False,payment for services,2026-02-22 23:27:14.356841,Raw_GL_Export.csv,83.92156862745098,0,True,AUS01,5010,True,5010,Employee Benefits,True,True,CC3000,WeWork,MAPPED,2025-12_USD,1.523,68404.31137,CONVERTED,27923.213086278203,19430.63083039902,133.0,False,0.0,Monday,False,True,True,EX004;EX009
TXN000591,10/03/2025,09/24/2025,2025-10,AUS01,5200,CC3200,WeWork Australia,INV49677,PO5795,USD,20015.03,,Payment for goods,API Import,2025-03-10,2025-09-24,2025,10,20015.03,False,payment for goods,2026-02-22 23:27:14.356841,Raw_GL_Export.csv,83.92156862745098,1,True,AUS01,5200,True,5200,Software Licenses,True,True,CC3200,WeWork,MAPPED,2025-10_USD,1.521,30442.860629999996,CONVERTED,30196.543712413786,22166.314759696765,145.0,False,0.0,Monday,False,True,True,EX009
TXN000592,02/09/2026,01/31/2026,2026-02,AUS01,5510,CC1100,MSFT,INV91509,PO2285,NZD,40529.1,,Payment for goods,Oracle,2026-09-02,2026-01-31,2026,02,40529.1,False,payment for goods,2026-02-22 23:27:14.356841,Raw_GL_Export.csv,83.92156862745098,1,True,AUS01,5510,True,5510,Advertising,True,True,CC1100,Microsoft Corporation,MAPPED,2026-02_NZD,0.932,37773.1212,CONVERTED,28498.583342781956,23667.16979723599,133.0,False,0.0,Wednesday,False,True,True,EX007;EX009
TXN000593,27/01/2026,22/01/2026,2026-01,AUS01,5800,CC4000,Workday,INV28607,,AUD,16820.31,,Payment for goods,Manual Entry,2026-01-27,2026-01-22,2026,01,16820.31,False,payment for goods,2026-02-22 23:27:14.356841,Raw_GL_Export.csv,83.92156862745098,0,True,AUS01,5800,True,5800,Depreciation,True,True,CC4000,Workday Inc,MAPPED,2026-01_AUD,1.0,16820.31,DOMESTIC,30184.39373025477,34245.09535020032,157.0,False,0.0,Tuesday,False,True,True,EX001;EX009
TXN000594,21-04-2025,19-04-2025,2025-04,AUS01,5000,CC3200,Microsoft,INV60354,PO2384,NZD,12580.73,,Payment for services,Workday,2025-04-21,2025-04-19,2025,04,12580.73,False,payment for services,2026-02-22 23:27:14.356841,Raw_GL_Export.csv,83.92156862745098,0,True,AUS01,5000,True,5000,Salaries and Wages,True,True,CC3200,Microsoft Corporation,MAPPED,2025-04_NZD,0.932,11725.24036,CONVERTED,30471.385558248177,22939.768434623154,137.0,False,0.0,Monday,False,True,True,EX009
TXN000595,28-01-2026,20-01-2026,2026-01,AUS01,5000,CC3100,Federal Express,INV36965,PO8062,GBP,2094.26,,Payment for license,SAP,2026-01-28,2026-01-20,2026,01,2094.26,False,payment for license,2026-02-22 23:27:14.356841,Raw_GL_Export.csv,83.92156862745098,0,True,AUS01,5000,True,5000,Salaries and Wages,True,True,CC3100,FedEx,MAPPED,2026-01_GBP,1.957,4098.466820000001,CONVERTED,30471.385558248177,22939.768434623154,137.0,False,0.0,Wednesday,False,True,True,EX009
TXN000596,12/22/2025,12/21/2025,2025-12,AUS01,5520,CC3000,Amazon,INV44410,PO4547,NZD,41529.17,,Payment for services,Workday,2025-12-22,2025-12-21,2025,12,41529.17,False,payment for services,2026-02-22 23:27:14.356841,Raw_GL_Export.csv,83.92156862745098,0,True,AUS01,5520,True,5520,Events,True,True,CC3000,Amazon Web Services,MAPPED,2025-12_NZD,0.9305,38642.892685,CONVERTED,30860.276023483882,21900.267908653983,155.0,False,0.0,Monday,False,True,True,EX009
TXN000597,24-10-2025,17-10-2025,2025-10,AUS01,5900,CC1000,GCP,INV98862,,GBP,42866.06,,Payment for license,Manual Entry,2025-10-24,2025-10-17,2025,10,42866.06,False,payment for license,2026-02-22 23:27:14.356841,Raw_GL_Export.csv,83.92156862745098,0,True,AUS01,5900,True,5900,Bank Charges,True,True,CC1000,Google Cloud,MAPPED,2025-10_GBP,1.951,83631.68306,CONVERTED,31670.032329854675,24882.231532617723,172.0,False,0.0,Friday,False,True,True,EX001;EX004;EX009
TXN000598,01/14/2026,01/11/2026,2026-01,AUS01,5400,CC3200,Accenture Pty,INV46791,PO5495,USD,40856.3,,Payment for services,Oracle,2026-01-14,2026-11-01,2026,01,40856.3,False,payment for services,2026-02-22 23:27:14.356841,Raw_GL_Export.csv,83.92156862745098,0,True,AUS01,5400,True,5400,Travel,True,True,CC3200,Accenture,MAPPED,2026-01_USD,1.527,62387.570100000004,CONVERTED,31663.682660000006,30146.476988256833,133.0,False,0.0,Wednesday,False,True,True,EX004;EX009
TXN000599,01/25/2026,01/19/2026,2026-01,AUS01,5600,CC3100,Microsoft,INV96406,,NZD,16340.1,,Payment for license,SAP,2026-01-25,2026-01-19,2026,01,16340.1,False,payment for license,2026-02-22 23:27:14.356841,Raw_GL_Export.csv,83.92156862745098,0,True,AUS01,5600,True,5600,Telecommunications,True,True,CC3100,Microsoft Corporation,MAPPED,2026-01_NZD,0.9335,15253.48335,CONVERTED,32190.120230168057,26805.910450208805,119.0,False,0.0,Sunday,True,True,True,EX001;EX009
TXN000600,01/04/2026,12/25/2025,2026-01,AUS01,5700,CC3000,Deloitte Touche,INV12263,PO8642,USD,20027.01,,Payment for services,Workday,2026-04-01,2025-12-25,2026,01,20027.01,False,payment for services,2026-02-22 23:27:14.356841,Raw_GL_Export.csv,83.92156862745098,1,True,AUS01,5700,True,5700,Training,True,True,CC3000,Deloitte,MAPPED,2026-01_USD,1.527,30581.244269999996,CONVERTED,31110.431902446802,30160.111495086097,141.0,False,0.0,Wednesday,False,True,True,EX009
TXN000601,16/01/2026,09/01/2026,2026-01,AUS01,5010,CC4100,Google,INV82279,PO2049,NZD,40377.29,,Payment for consulting,Oracle,2026-01-16,2026-01-09,2026,01,40377.29,False,payment for consulting,2026-02-22 23:27:14.356841,Raw_GL_Export.csv,83.92156862745098,0,True,AUS01,5010,True,5010,Employee Benefits,True,True,CC4100,Google Cloud,MAPPED,2026-01_NZD,0.9335,37692.200215,CONVERTED,27923.213086278203,19430.63083039902,133.0,False,0.0,Friday,False,True,True,EX009
TXN000602,02/09/2026,02/04/2026,2026-02,AUS01,5920,CC3200,Slack,INV29254,PO1812,USD,28402.18,,Payment for goods,SAP,2026-09-02,2026-04-02,2026,02,28402.18,False,payment for goods,2026-02-22 23:27:14.356841,Raw_GL_Export.csv,83.92156862745098,1,True,AUS01,5920,True,5920,FX Loss,True,True,CC3200,Slack Technologies,MAPPED,2026-02_USD,1.525,43313.324499999995,CONVERTED,27533.92400565971,21784.021192347693,144.0,False,0.0,Wednesday,False,True,True,EX007;EX009
TXN000603,2026-01-21,2026-01-18,2026-01,AUS01,5700,CC4000,Optus Pty,INV39878,,NZD,1983.81,,Payment for subscription,Workday,2026-01-21,2026-01-18,2026,01,1983.81,False,payment for subscription,2026-02-22 23:27:14.356841,Raw_GL_Export.csv,83.92156862745098,0,True,AUS01,5700,True,5700,Training,True,True,CC4000,Optus,MAPPED,2026-01_NZD,0.9335,1851.8866349999998,CONVERTED,31110.431902446802,30160.111495086097,141.0,False,0.0,Wednesday,False,True,True,EX001;EX009
TXN000604,01/01/2026,12/23/2025,2026-01,AUS01,5710,CC1000,Accenture Pty,INV76445,PO9372,NZD,5001.44,,Payment for services,Oracle,2026-01-01,2025-12-23,2026,01,5001.44,False,payment for services,2026-02-22 23:27:14.356841,Raw_GL_Export.csv,83.92156862745098,0,True,AUS01,5710,True,5710,Recruitment,True,True,CC1000,Accenture,MAPPED,2026-01_NZD,0.9335,4668.844239999999,CONVERTED,29496.09592285716,24753.031499859637,133.0,False,0.0,Thursday,False,True,True,EX009
TXN000605,01/07/2026,12/28/2025,2026-01,AUS01,5320,CC3100,Salesforce,INV28753,,GBP,39425.81,,Payment for license,Workday,2026-07-01,2025-12-28,2026,01,39425.81,False,payment for license,2026-02-22 23:27:14.356841,Raw_GL_Export.csv,83.92156862745098,1,True,AUS01,5320,True,5320,Audit Fees,True,True,CC3100,Salesforce Inc,MAPPED,2026-01_GBP,1.957,77156.31017,CONVERTED,31658.610713475173,32284.527206153973,141.0,False,0.0,Wednesday,False,True,True,EX001;EX004;EX009
TXN000606,11-11-2025,05-11-2025,2025-11,AUS01,5500,CC2100,Amazon,INV48125,PO1418,USD,16636.76,,Payment for services,API Import,2025-11-11,2025-11-05,2025,11,16636.76,False,payment for services,2026-02-22 23:27:14.356841,Raw_GL_Export.csv,83.92156862745098,0,True,AUS01,5500,True,5500,Marketing,True,True,CC2100,Amazon Web Services,MAPPED,2025-11_USD,1.526,25387.69576,CONVERTED,28972.634359125877,32785.70497360227,143.0,False,0.0,Tuesday,False,True,True,EX009
TXN000607,07/07/2025,06/28/2025,2025-07,AUS01,5710,CC4000,WeWork Australia,INV86373,,USD,17109.9,,Payment for goods,Manual Entry,2025-07-07,2025-06-28,2025,07,17109.9,False,payment for goods,2026-02-22 23:27:14.356841,Raw_GL_Export.csv,83.92156862745098,0,True,AUS01,5710,True,5710,Recruitment,True,True,CC4000,WeWork,MAPPED,2025-07_USD,1.528,26143.927200000002,CONVERTED,29496.09592285716,24753.031499859637,133.0,False,0.0,Monday,False,True,True,EX001;EX009
TXN000608,2026-01-25,2026-01-23,2026-01,AUS01,5210,CC4100,Robert Half International,INV25891,PO9646,GBP,24299.64,,Payment for services,API Import,2026-01-25,2026-01-23,2026,01,24299.64,False,payment for services,2026-02-22 23:27:14.356841,Raw_GL_Export.csv,83.92156862745098,0,True,AUS01,5210,True,5210,Cloud Services,True,True,CC4100,Robert Half,MAPPED,2026-01_GBP,1.957,47554.39548,CONVERTED,31620.56664919015,27460.393400888206,142.0,False,0.0,Sunday,True,True,True,EX009
TXN000609,16-02-2026,10-02-2026,2026-02,AUS01,5220,CC2000,KPMG Australia,INV57443,,USD,14857.93,,Payment for subscription,SAP,2026-02-16,2026-02-10,2026,02,14857.93,False,payment for subscription,2026-02-22 23:27:14.356841,Raw_GL_Export.csv,83.92156862745098,0,True,AUS01,5220,True,5220,IT Support,True,True,CC2000,KPMG,MAPPED,2026-02_USD,1.525,22658.343249999998,CONVERTED,29540.94372533058,19404.169897416657,121.0,False,0.0,Monday,False,True,True,EX001;EX009
TXN000610,23/05/2025,15/05/2025,2025-05,AUS01,5800,CC3100,Regus Australia,INV76275,,AUD,15904.11,,Payment for subscription,Manual Entry,2025-05-23,2025-05-15,2025,05,15904.11,False,payment for subscription,2026-02-22 23:27:14.356841,Raw_GL_Export.csv,83.92156862745098,0,True,AUS01,5800,True,5800,Depreciation,True,True,CC3100,Regus,MAPPED,2025-05_AUD,1.0,15904.11,DOMESTIC,30184.39373025477,34245.09535020032,157.0,False,0.0,Friday,False,True,True,EX001;EX009
TXN000611,20/12/2025,12/12/2025,2025-12,AUS01,5900,CC3100,ServiceNow Inc,INV42105,PO7678,USD,41664.69,,Payment for license,Oracle,2025-12-20,2025-12-12,2025,12,41664.69,False,payment for license,2026-02-22 23:27:14.356841,Raw_GL_Export.csv,83.92156862745098,0,True,AUS01,5900,True,5900,Bank Charges,True,True,CC3100,ServiceNow,MAPPED,2025-12_USD,1.523,63455.322869999996,CONVERTED,31670.032329854675,24882.231532617723,172.0,False,0.0,Saturday,True,True,True,EX004;EX009
TXN000612,01/20/2026,01/15/2026,2026-01,AUS01,5310,CC3000,Atlassian Pty,INV76194,PO9096,AUD,18441.78,,Payment for goods,Oracle,2026-01-20,2026-01-15,2026,01,18441.78,False,payment for goods,2026-02-22 23:27:14.356841,Raw_GL_Export.csv,83.92156862745098,0,True,AUS01,5310,True,5310,Legal Fees,True,True,CC3000,Atlassian,MAPPED,2026-01_AUD,1.0,18441.78,DOMESTIC,33139.04129260232,28423.631835285127,171.0,False,0.0,Tuesday,False,True,True,EX009
TXN000613,2025-04-15,2025-04-12,2025-04,AUS01,5100,CC3100,Deloitte Touche,INV26567,PO8068,GBP,33454.14,,Payment for services,Oracle,2025-04-15,2025-04-12,2025,04,33454.14,False,payment for services,2026-02-22 23:27:14.356841,Raw_GL_Export.csv,83.92156862745098,0,True,AUS01,5100,True,5100,Office Rent,True,True,CC3100,Deloitte,MAPPED,2025-04_GBP,1.955,65402.8437,CONVERTED,29138.02959753333,27547.65120166844,150.0,False,0.0,Tuesday,False,True,True,EX004;EX009
TXN000614,03/02/2026,25/01/2026,2026-02,AUS01,5920,CC4000,Federal Express,INV62732,PO4955,GBP,16011.11,,Payment for subscription,SAP,2026-02-03,2026-01-25,2026,02,16011.11,False,payment for subscription,2026-02-22 23:27:14.356841,Raw_GL_Export.csv,83.92156862745098,0,True,AUS01,5920,True,5920,FX Loss,True,True,CC4000,FedEx,MAPPED,2026-02_GBP,1.955,31301.720050000004,CONVERTED,27533.92400565971,21784.021192347693,144.0,False,0.0,Tuesday,False,True,True,EX009
TXN000615,02/11/2026,02/01/2026,2026-02,AUS01,5610,CC4100,GCP,INV56525,PO7699,AUD,3411.49,,Payment for consulting,Manual Entry,2026-11-02,2026-01-02,2026,02,3411.49,False,payment for consulting,2026-02-22 23:27:14.356841,Raw_GL_Export.csv,83.92156862745098,1,True,AUS01,5610,True,5610,Postage and Courier,True,True,CC4100,Google Cloud,MAPPED,2026-02_AUD,1.0,3411.49,DOMESTIC,29081.766845273953,25872.32663648796,146.0,False,0.0,Monday,False,True,True,EX007;EX009
TXN000616,10-01-2026,07-01-2026,2026-01,AUS01,5800,CC1200,Robert Half International,INV11020,PO7060,AUD,6936.31,,Payment for consulting,Manual Entry,2026-01-10,2026-01-07,2026,01,6936.31,False,payment for consulting,2026-02-22 23:27:14.356841,Raw_GL_Export.csv,83.92156862745098,0,True,AUS01,5800,True,5800,Depreciation,True,True,CC1200,Robert Half,MAPPED,2026-01_AUD,1.0,6936.31,DOMESTIC,30184.39373025477,34245.09535020032,157.0,False,0.0,Saturday,True,True,True,EX009
TXN000617,11-01-2025,08-01-2025,2025-01,AUS01,5510,CC4100,PWC,INV74656,PO9481,AUD,10528.63,,Payment for license,API Import,2025-01-11,2025-01-08,2025,01,10528.63,False,payment for license,2026-02-22 23:27:14.356841,Raw_GL_Export.csv,83.92156862745098,0,True,AUS01,5510,True,5510,Advertising,True,True,CC4100,PwC,MAPPED,2025-01_AUD,1.0,10528.63,DOMESTIC,28498.583342781956,23667.16979723599,133.0,False,0.0,Saturday,True,True,True,EX009
TXN000618,17-02-2025,12-02-2025,2025-02,AUS01,5310,CC3100,McKinsey,INV15496,PO4451,USD,42912.76,,Payment for consulting,API Import,2025-02-17,2025-02-12,2025,02,42912.76,False,payment for consulting,2026-02-22 23:27:14.356841,Raw_GL_Export.csv,83.92156862745098,0,True,AUS01,5310,True,5310,Legal Fees,True,True,CC3100,McKinsey & Company,MAPPED,2025-02_USD,1.51,64798.26760000001,CONVERTED,33139.04129260232,28423.631835285127,171.0,False,0.0,Monday,False,True,True,EX004;EX009
TXN000619,03/09/2025,03/07/2025,2025-03,AUS01,5320,CC2100,Adobe,INV73784,PO3774,AUD,13024.16,,Payment for subscription,Workday,2025-09-03,2025-07-03,2025,03,13024.16,False,payment for subscription,2026-02-22 23:27:14.356841,Raw_GL_Export.csv,83.92156862745098,1,True,AUS01,5320,True,5320,Audit Fees,True,True,CC2100,Adobe Systems,MAPPED,2025-03_AUD,1.0,13024.16,DOMESTIC,31658.610713475173,32284.527206153973,141.0,False,0.0,Wednesday,False,True,True,EX009
TXN000620,2026-02-20,2026-02-16,2026-02,AUS01,5700,CC2100,Zoom,INV76676,PO1448,AUD,9387.26,,Payment for license,SAP,2026-02-20,2026-02-16,2026,02,9387.26,False,payment for license,2026-02-22 23:27:14.356841,Raw_GL_Export.csv,83.92156862745098,0,True,AUS01,5700,True,5700,Training,True,True,CC2100,Zoom Video Communications,MAPPED,2026-02_AUD,1.0,9387.26,DOMESTIC,31110.431902446802,30160.111495086097,141.0,False,0.0,Friday,False,True,True,EX009
TXN000621,18/07/2025,17/07/2025,2025-07,AUS01,5500,CC1000,Regus Australia,INV84863,PO8288,USD,12754.5,,Payment for license,Oracle,2025-07-18,2025-07-17,2025,07,12754.5,False,payment for license,2026-02-22 23:27:14.356841,Raw_GL_Export.csv,83.92156862745098,0,True,AUS01,5500,True,5500,Marketing,True,True,CC1000,Regus,MAPPED,2025-07_USD,1.528,19488.876,CONVERTED,28972.634359125877,32785.70497360227,143.0,False,0.0,Friday,False,True,True,EX009
TXN000622,27-01-2026,22-01-2026,2026-01,AUS01,5100,CC1100,Optus Pty,INV21385,PO5562,GBP,22247.17,,Payment for services,Workday,2026-01-27,2026-01-22,2026,01,22247.17,False,payment for services,2026-02-22 23:27:14.356841,Raw_GL_Export.csv,83.92156862745098,0,True,AUS01,5100,True,5100,Office Rent,True,True,CC1100,Optus,MAPPED,2026-01_GBP,1.957,43537.71169,CONVERTED,29138.02959753333,27547.65120166844,150.0,False,0.0,Tuesday,False,True,True,EX009
TXN000623,2026-01-26,2026-01-22,2026-01,AUS01,5800,CC1100,McKinsey,INV46190,PO9402,USD,22867.0,,Payment for services,Workday,2026-01-26,2026-01-22,2026,01,22867.0,False,payment for services,2026-02-22 23:27:14.356841,Raw_GL_Export.csv,83.92156862745098,0,True,AUS01,5800,True,5800,Depreciation,True,True,CC1100,McKinsey & Company,MAPPED,2026-01_USD,1.527,34917.909,CONVERTED,30184.39373025477,34245.09535020032,157.0,False,0.0,Monday,False,True,True,EX009
TXN000624,02-01-2026,31-12-2025,2026-01,AUS01,5710,CC4000,McKinsey,INV96655,PO1583,USD,37880.25,,Payment for services,Oracle,2026-01-02,2025-12-31,2026,01,37880.25,False,payment for services,2026-02-22 23:27:14.356841,Raw_GL_Export.csv,83.92156862745098,0,True,AUS01,5710,True,5710,Recruitment,True,True,CC4000,McKinsey & Company,MAPPED,2026-01_USD,1.527,57843.141749999995,CONVERTED,29496.09592285716,24753.031499859637,133.0,False,0.0,Friday,False,True,True,EX004;EX009
TXN000625,05-02-2026,01-02-2026,2026-02,AUS01,5700,CC2000,Deloitte Touche,INV34524,PO5630,GBP,6899.35,,Payment for goods,Oracle,2026-02-05,2026-02-01,2026,02,6899.35,False,payment for goods,2026-02-22 23:27:14.356841,Raw_GL_Export.csv,83.92156862745098,0,True,AUS01,5700,True,5700,Training,True,True,CC2000,Deloitte,MAPPED,2026-02_GBP,1.955,13488.22925,CONVERTED,31110.431902446802,30160.111495086097,141.0,False,0.0,Thursday,False,True,True,EX009
TXN000626,2026-01-21,2026-01-12,2026-01,AUS01,5920,CC2000,AWS,INV83103,PO3918,GBP,3120.03,,Payment for services,Manual Entry,2026-01-21,2026-01-12,2026,01,3120.03,False,payment for services,2026-02-22 23:27:14.356841,Raw_GL_Export.csv,83.92156862745098,0,True,AUS01,5920,True,5920,FX Loss,True,True,CC2000,Amazon Web Services,MAPPED,2026-01_GBP,1.957,6105.89871,CONVERTED,27533.92400565971,21784.021192347693,144.0,False,0.0,Wednesday,False,True,True,EX009
TXN000627,08/23/2025,08/13/2025,2025-08,AUS01,5400,CC4100,Accenture Pty,INV96106,PO5916,NZD,21842.06,,Payment for goods,Workday,2025-08-23,2025-08-13,2025,08,21842.06,False,payment for goods,2026-02-22 23:27:14.356841,Raw_GL_Export.csv,83.92156862745098,0,True,AUS01,5400,True,5400,Travel,True,True,CC4100,Accenture,MAPPED,2025-08_NZD,0.93,20313.115800000003,CONVERTED,31663.682660000006,30146.476988256833,133.0,False,0.0,Saturday,True,True,True,EX009
TXN000628,22-01-2026,14-01-2026,2026-01,AUS01,5900,CC3100,WeWork Australia,INV38695,,GBP,13364.23,,Payment for subscription,Manual Entry,2026-01-22,2026-01-14,2026,01,13364.23,False,payment for subscription,2026-02-22 23:27:14.356841,Raw_GL_Export.csv,83.92156862745098,0,True,AUS01,5900,True,5900,Bank Charges,True,True,CC3100,WeWork,MAPPED,2026-01_GBP,1.957,26153.79811,CONVERTED,31670.032329854675,24882.231532617723,172.0,False,0.0,Thursday,False,True,True,EX001;EX009
TXN000629,02/15/2026,02/11/2026,2026-02,AUS01,5700,CC3100,Atlassian Pty,INV51799,PO6694,USD,20966.64,,Payment for consulting,Oracle,2026-02-15,2026-11-02,2026,02,20966.64,False,payment for consulting,2026-02-22 23:27:14.356841,Raw_GL_Export.csv,83.92156862745098,0,True,AUS01,5700,True,5700,Training,True,True,CC3100,Atlassian,MAPPED,2026-02_USD,1.525,31974.125999999997,CONVERTED,31110.431902446802,30160.111495086097,141.0,False,0.0,Sunday,True,True,True,EX009
TXN000630,25-01-2026,17-01-2026,2026-01,AUS01,5610,CC3100,Accenture Pty,INV76517,,AUD,13162.77,,Payment for consulting,SAP,2026-01-25,2026-01-17,2026,01,13162.77,False,payment for consulting,2026-02-22 23:27:14.356841,Raw_GL_Export.csv,83.92156862745098,0,True,AUS01,5610,True,5610,Postage and Courier,True,True,CC3100,Accenture,MAPPED,2026-01_AUD,1.0,13162.77,DOMESTIC,29081.766845273953,25872.32663648796,146.0,False,0.0,Sunday,True,True,True,EX001;EX009
TXN000631,02/18/2026,02/13/2026,2026-02,AUS01,5700,CC3000,AusPost,INV65731,PO1895,GBP,36425.47,,Payment for subscription,Manual Entry,2026-02-18,2026-02-13,2026,02,36425.47,False,payment for subscription,2026-02-22 23:27:14.356841,Raw_GL_Export.csv,83.92156862745098,0,True,AUS01,5700,True,5700,Training,True,True,CC3000,Australia Post,MAPPED,2026-02_GBP,1.955,71211.79385,CONVERTED,31110.431902446802,30160.111495086097,141.0,False,0.0,Wednesday,False,True,True,EX004;EX009
TXN000632,24/02/2026,18/02/2026,2026-02,AUS01,5620,CC1000,EY Australia,INV85039,PO9782,GBP,18500.54,,Payment for goods,SAP,2026-02-24,2026-02-18,2026,02,18500.54,False,payment for goods,2026-02-22 23:27:14.356841,Raw_GL_Export.csv,83.92156862745098,0,True,AUS01,5620,True,5620,Insurance,True,True,CC1000,EY,MAPPED,2026-02_GBP,1.955,36168.555700000004,CONVERTED,32410.971605588227,27490.799177232966,170.0,False,0.0,Tuesday,False,True,True,EX009
TXN000633,02/20/2026,02/17/2026,2026-02,AUS01,5610,CC4000,Amazon,INV21829,PO6460,AUD,36128.34,,Payment for subscription,API Import,2026-02-20,2026-02-17,2026,02,36128.34,False,payment for subscription,2026-02-22 23:27:14.356841,Raw_GL_Export.csv,83.92156862745098,0,True,AUS01,5610,True,5610,Postage and Courier,True,True,CC4000,Amazon Web Services,MAPPED,2026-02_AUD,1.0,36128.34,DOMESTIC,29081.766845273953,25872.32663648796,146.0,False,0.0,Friday,False,True,True,EX009
TXN000634,2026-01-03,2025-12-25,2026-01,AUS01,5200,CC3000,SAP,INV61842,PO4757,USD,37732.89,,Payment for subscription,Oracle,2026-01-03,2025-12-25,2026,01,37732.89,False,payment for subscription,2026-02-22 23:27:14.356841,Raw_GL_Export.csv,83.92156862745098,0,True,AUS01,5200,True,5200,Software Licenses,True,True,CC3000,SAP SE,MAPPED,2026-01_USD,1.527,57618.123029999995,CONVERTED,30196.543712413786,22166.314759696765,145.0,False,0.0,Saturday,True,True,True,EX004;EX009
TXN000635,01/12/2026,01/05/2026,2026-01,AUS01,5200,CC4000,Accenture Pty,INV12625,PO9627,AUD,1719.77,,Payment for services,API Import,2026-12-01,2026-05-01,2026,01,1719.77,False,payment for services,2026-02-22 23:27:14.356841,Raw_GL_Export.csv,83.92156862745098,1,True,AUS01,5200,True,5200,Software Licenses,True,True,CC4000,Accenture,MAPPED,2026-01_AUD,1.0,1719.77,DOMESTIC,30196.543712413786,22166.314759696765,145.0,False,0.0,Tuesday,False,True,True,EX009
TXN000636,13-03-2025,12-03-2025,2025-03,AUS01,5120,CC2100,EY Australia,INV42415,,AUD,10427.24,,Payment for services,Manual Entry,2025-03-13,2025-03-12,2025,03,10427.24,False,payment for services,2026-02-22 23:27:14.356841,Raw_GL_Export.csv,83.92156862745098,0,True,AUS01,5120,True,5120,Office Supplies,True,True,CC2100,EY,MAPPED,2025-03_AUD,1.0,10427.24,DOMESTIC,34269.00595485611,35424.20705021751,139.0,False,0.0,Thursday,False,True,True,EX001;EX009
TXN000637,21-01-2026,18-01-2026,2026-01,AUS01,5910,CC2100,Google,INV64444,,AUD,3417.67,,Payment for license,API Import,2026-01-21,2026-01-18,2026,01,3417.67,False,payment for license,2026-02-22 23:27:14.356841,Raw_GL_Export.csv,83.92156862745098,0,True,AUS01,5910,True,5910,Interest Expense,True,True,CC2100,Google Cloud,MAPPED,2026-01_AUD,1.0,3417.67,DOMESTIC,33774.54824600841,21661.31598456901,119.0,False,0.0,Wednesday,False,True,True,EX001;EX009
TXN000638,2026-02-05,2026-01-26,2026-02,AUS01,5900,CC3100,SAP,INV65725,PO1383,NZD,35336.25,,Payment for subscription,Workday,2026-02-05,2026-01-26,2026,02,35336.25,False,payment for subscription,2026-02-22 23:27:14.356841,Raw_GL_Export.csv,83.92156862745098,0,True,AUS01,5900,True,5900,Bank Charges,True,True,CC3100,SAP SE,MAPPED,2026-02_NZD,0.932,32933.385,CONVERTED,31670.032329854675,24882.231532617723,172.0,False,0.0,Thursday,False,True,True,EX009
TXN000639,15/01/2026,13/01/2026,2026-01,AUS01,5220,CC4100,Seek Limited,INV22197,,GBP,13176.62,,Payment for consulting,API Import,2026-01-15,2026-01-13,2026,01,13176.62,False,payment for consulting,2026-02-22 23:27:14.356841,Raw_GL_Export.csv,83.92156862745098,0,True,AUS01,5220,True,5220,IT Support,True,True,CC4100,Seek,MAPPED,2026-01_GBP,1.957,25786.645340000003,CONVERTED,29540.94372533058,19404.169897416657,121.0,False,0.0,Thursday,False,True,True,EX001;EX009
TXN000640,09-03-2025,04-03-2025,2025-03,AUS01,5710,CC4000,Robert Half International,INV75147,PO7106,USD,17270.13,,Payment for license,SAP,2025-03-09,2025-03-04,2025,03,17270.13,False,payment for license,2026-02-22 23:27:14.356841,Raw_GL_Export.csv,83.92156862745098,0,True,AUS01,5710,True,5710,Recruitment,True,True,CC4000,Robert Half,MAPPED,2025-03_USD,1.53,26423.2989,CONVERTED,29496.09592285716,24753.031499859637,133.0,False,0.0,Sunday,True,True,True,EX009
TXN000641,15/03/2025,05/03/2025,2025-03,AUS01,5000,CC3100,ServiceNow Inc,INV83813,,GBP,16704.99,,Payment for subscription,Workday,2025-03-15,2025-03-05,2025,03,16704.99,False,payment for subscription,2026-02-22 23:27:14.356841,Raw_GL_Export.csv,83.92156862745098,0,True,AUS01,5000,True,5000,Salaries and Wages,True,True,CC3100,ServiceNow,MAPPED,2025-03_GBP,1.96,32741.780400000003,CONVERTED,30471.385558248177,22939.768434623154,137.0,False,0.0,Saturday,True,True,True,EX001;EX009
TXN000642,2025-12-05,2025-12-03,2025-12,AUS01,5520,CC1200,Workday,INV20995,,GBP,26744.09,,Payment for license,Manual Entry,2025-12-05,2025-12-03,2025,12,26744.09,False,payment for license,2026-02-22 23:27:14.356841,Raw_GL_Export.csv,83.92156862745098,0,True,AUS01,5520,True,5520,Events,True,True,CC1200,Workday Inc,MAPPED,2025-12_GBP,1.953,52231.20777,CONVERTED,30860.276023483882,21900.267908653983,155.0,False,0.0,Friday,False,True,True,EX001;EX004;EX009
TXN000643,17/12/2025,16/12/2025,2025-12,AUS01,5810,CC3200,Deloitte Touche,INV54285,PO1598,GBP,14084.33,,Payment for subscription,API Import,2025-12-17,2025-12-16,2025,12,14084.33,False,payment for subscription,2026-02-22 23:27:14.356841,Raw_GL_Export.csv,83.92156862745098,0,True,AUS01,5810,True,5810,Amortization,True,True,CC3200,Deloitte,MAPPED,2025-12_GBP,1.953,27506.696490000002,CONVERTED,31768.91314562501,27328.351394475325,120.0,False,0.0,Wednesday,False,True,True,EX009
TXN000644,20-02-2026,19-02-2026,2026-02,AUS01,5220,CC2000,Hays,INV95460,,GBP,14154.43,,Payment for consulting,Manual Entry,2026-02-20,2026-02-19,2026,02,14154.43,False,payment for consulting,2026-02-22 23:27:14.356841,Raw_GL_Export.csv,83.92156862745098,0,True,AUS01,5220,True,5220,IT Support,True,True,CC2000,Hays Recruitment,MAPPED,2026-02_GBP,1.955,27671.91065,CONVERTED,29540.94372533058,19404.169897416657,121.0,False,0.0,Friday,False,True,True,EX001;EX009
TXN000645,2025-07-17,2025-07-15,2025-07,AUS01,5410,CC1100,Federal Express,INV31245,PO2990,USD,34084.21,,Payment for goods,Oracle,2025-07-17,2025-07-15,2025,07,34084.21,False,payment for goods,2026-02-22 23:27:14.356841,Raw_GL_Export.csv,83.92156862745098,0,True,AUS01,5410,True,5410,Accommodation,True,True,CC1100,FedEx,MAPPED,2025-07_USD,1.528,52080.67288,CONVERTED,29277.518810999987,22143.12829502557,155.0,False,0.0,Thursday,False,True,True,EX004;EX009
TXN000646,2026-02-15,2026-02-14,2026-02,AUS01,5410,CC3200,Adobe,INV81707,PO1151,GBP,6379.96,,Payment for subscription,SAP,2026-02-15,2026-02-14,2026,02,6379.96,False,payment for subscription,2026-02-22 23:27:14.356841,Raw_GL_Export.csv,83.92156862745098,0,True,AUS01,5410,True,5410,Accommodation,True,True,CC3200,Adobe Systems,MAPPED,2026-02_GBP,1.955,12472.8218,CONVERTED,29277.518810999987,22143.12829502557,155.0,False,0.0,Sunday,True,True,True,EX009
TXN000647,02/14/2026,02/09/2026,2026-02,AUS01,5510,CC3000,Regus Australia,INV78583,PO7082,USD,6454.14,,Payment for license,API Import,2026-02-14,2026-09-02,2026,02,6454.14,False,payment for license,2026-02-22 23:27:14.356841,Raw_GL_Export.csv,83.92156862745098,0,True,AUS01,5510,True,5510,Advertising,True,True,CC3000,Regus,MAPPED,2026-02_USD,1.525,9842.5635,CONVERTED,28498.583342781956,23667.16979723599,133.0,False,0.0,Saturday,True,True,True,EX009
TXN000648,09-02-2025,01-02-2025,2025-02,AUS01,5200,CC3000,Slack,INV72111,,USD,23644.59,,Payment for consulting,Oracle,2025-02-09,2025-02-01,2025,02,23644.59,False,payment for consulting,2026-02-22 23:27:14.356841,Raw_GL_Export.csv,83.92156862745098,0,True,AUS01,5200,True,5200,Software Licenses,True,True,CC3000,Slack Technologies,MAPPED,2025-02_USD,1.51,35703.3309,CONVERTED,30196.543712413786,22166.314759696765,145.0,False,0.0,Sunday,True,True,True,EX001;EX009
TXN000649,05-01-2026,03-01-2026,2026-01,AUS01,5000,CC2100,SAP,INV80481,PO2551,USD,31262.63,,Payment for services,API Import,2026-01-05,2026-01-03,2026,01,31262.63,False,payment for services,2026-02-22 23:27:14.356841,Raw_GL_Export.csv,83.92156862745098,0,True,AUS01,5000,True,5000,Salaries and Wages,True,True,CC2100,SAP SE,MAPPED,2026-01_USD,1.527,47738.036009999996,CONVERTED,30471.385558248177,22939.768434623154,137.0,False,0.0,Monday,False,True,True,EX009
TXN000650,15/12/2025,13/12/2025,2025-12,AUS01,5320,CC4000,ServiceNow Inc,INV35249,,NZD,28334.1,,Payment for consulting,API Import,2025-12-15,2025-12-13,2025,12,28334.1,False,payment for consulting,2026-02-22 23:27:14.356841,Raw_GL_Export.csv,83.92156862745098,0,True,AUS01,5320,True,5320,Audit Fees,True,True,CC4000,ServiceNow,MAPPED,2025-12_NZD,0.9305,26364.88005,CONVERTED,31658.610713475173,32284.527206153973,141.0,False,0.0,Monday,False,True,True,EX001;EX009
TXN000651,02/24/2026,02/18/2026,2026-02,AUS01,5610,CC3100,Deloitte Touche,INV29978,,USD,3578.68,,Payment for goods,Workday,2026-02-24,2026-02-18,2026,02,3578.68,False,payment for goods,2026-02-22 23:27:14.356841,Raw_GL_Export.csv,83.92156862745098,0,True,AUS01,5610,True,5610,Postage and Courier,True,True,CC3100,Deloitte,MAPPED,2026-02_USD,1.525,5457.486999999999,CONVERTED,29081.766845273953,25872.32663648796,146.0,False,0.0,Tuesday,False,True,True,EX001;EX009
TXN000652,01/06/2025,12/27/2024,2025-01,AUS01,5100,CC1200,Federal Express,INV87616,PO8756,NZD,25946.94,,Payment for goods,Oracle,2025-06-01,2024-12-27,2025,01,25946.94,False,payment for goods,2026-02-22 23:27:14.356841,Raw_GL_Export.csv,83.92156862745098,1,True,AUS01,5100,True,5100,Office Rent,True,True,CC1200,FedEx,MAPPED,2025-01_NZD,0.93,24130.6542,CONVERTED,29138.02959753333,27547.65120166844,150.0,False,0.0,Sunday,True,True,True,EX009
TXN000653,01/12/2025,27/11/2025,2025-12,AUS01,5020,CC4100,Zoom,INV10032,PO1855,USD,7500.35,,Payment for goods,API Import,2025-12-01,2025-11-27,2025,12,7500.35,False,payment for goods,2026-02-22 23:27:14.356841,Raw_GL_Export.csv,83.92156862745098,0,True,AUS01,5020,True,5020,Contractor Fees,True,True,CC4100,Zoom Video Communications,MAPPED,2025-12_USD,1.523,11423.03305,CONVERTED,28445.577844280295,21241.721119146277,132.0,False,0.0,Monday,False,True,True,EX009
TXN000654,26-01-2026,19-01-2026,2026-01,AUS01,5700,CC3200,McKinsey,INV25374,,NZD,22566.84,,Payment for consulting,Manual Entry,2026-01-26,2026-01-19,2026,01,22566.84,False,payment for consulting,2026-02-22 23:27:14.356841,Raw_GL_Export.csv,83.92156862745098,0,True,AUS01,5700,True,5700,Training,True,True,CC3200,McKinsey & Company,MAPPED,2026-01_NZD,0.9335,21066.14514,CONVERTED,31110.431902446802,30160.111495086097,141.0,False,0.0,Monday,False,True,True,EX001;EX009
TXN000655,25-03-2025,17-03-2025,2025-03,AUS01,5320,CC2100,McKinsey,INV38036,PO5550,AUD,39759.52,,Payment for goods,Manual Entry,2025-03-25,2025-03-17,2025,03,39759.52,False,payment for goods,2026-02-22 23:27:14.356841,Raw_GL_Export.csv,83.92156862745098,0,True,AUS01,5320,True,5320,Audit Fees,True,True,CC2100,McKinsey & Company,MAPPED,2025-03_AUD,1.0,39759.52,DOMESTIC,31658.610713475173,32284.527206153973,141.0,False,0.0,Tuesday,False,True,True,EX009
TXN000656,18-08-2025,10-08-2025,2025-08,AUS01,5710,CC2100,Atlassian Pty,INV33332,,GBP,29378.94,,Payment for subscription,Manual Entry,2025-08-18,2025-08-10,2025,08,29378.94,False,payment for subscription,2026-02-22 23:27:14.356841,Raw_GL_Export.csv,83.92156862745098,0,True,AUS01,5710,True,5710,Recruitment,True,True,CC2100,Atlassian,MAPPED,2025-08_GBP,1.954,57406.44876,CONVERTED,29496.09592285716,24753.031499859637,133.0,False,0.0,Monday,False,True,True,EX001;EX004;EX009
TXN000657,02/25/2026,02/18/2026,2026-02,AUS01,5200,CC4100,SAP,INV11398,,GBP,16901.84,,Payment for subscription,API Import,2026-02-25,2026-02-18,2026,02,16901.84,False,payment for subscription,2026-02-22 23:27:14.356841,Raw_GL_Export.csv,83.92156862745098,0,True,AUS01,5200,True,5200,Software Licenses,True,True,CC4100,SAP SE,MAPPED,2026-02_GBP,1.955,33043.097200000004,CONVERTED,30196.543712413786,22166.314759696765,145.0,False,0.0,Wednesday,False,True,True,EX001;EX009
TXN000658,2025-07-07,2025-06-27,2025-07,AUS01,5300,CC3000,GCP,INV75902,PO5473,NZD,41219.74,,Payment for services,Workday,2025-07-07,2025-06-27,2025,07,41219.74,False,payment for services,2026-02-22 23:27:14.356841,Raw_GL_Export.csv,83.92156862745098,0,True,AUS01,5300,True,5300,Professional Services,True,True,CC3000,Google Cloud,MAPPED,2025-07_NZD,0.934,38499.23716,CONVERTED,33232.533450429684,35951.49997313202,128.0,False,0.0,Monday,False,True,True,EX009
TXN000659,21-11-2025,14-11-2025,2025-11,AUS01,5010,CC2100,PWC,INV13988,PO8713,AUD,43704.22,,Payment for license,Manual Entry,2025-11-21,2025-11-14,2025,11,43704.22,False,payment for license,2026-02-22 23:27:14.356841,Raw_GL_Export.csv,83.92156862745098,0,True,AUS01,5010,True,5010,Employee Benefits,True,True,CC2100,PwC,MAPPED,2025-11_AUD,1.0,43704.22,DOMESTIC,27923.213086278203,19430.63083039902,133.0,False,0.0,Friday,False,True,True,EX009
TXN000660,16/01/2026,08/01/2026,2026-01,AUS01,5800,CC4000,GCP,INV90336,PO3509,AUD,16692.07,,Payment for goods,Oracle,2026-01-16,2026-01-08,2026,01,16692.07,False,payment for goods,2026-02-22 23:27:14.356841,Raw_GL_Export.csv,83.92156862745098,0,True,AUS01,5800,True,5800,Depreciation,True,True,CC4000,Google Cloud,MAPPED,2026-01_AUD,1.0,16692.07,DOMESTIC,30184.39373025477,34245.09535020032,157.0,False,0.0,Friday,False,True,True,EX009
TXN000661,03-02-2026,01-02-2026,2026-02,AUS01,5010,CC3200,MSFT,INV81314,,NZD,4476.65,,Payment for goods,API Import,2026-02-03,2026-02-01,2026,02,4476.65,False,payment for goods,2026-02-22 23:27:14.356841,Raw_GL_Export.csv,83.92156862745098,0,True,AUS01,5010,True,5010,Employee Benefits,True,True,CC3200,Microsoft Corporation,MAPPED,2026-02_NZD,0.932,4172.2378,CONVERTED,27923.213086278203,19430.63083039902,133.0,False,0.0,Tuesday,False,True,True,EX001;EX009
TXN000662,2026-01-24,2026-01-18,2026-01,AUS01,5910,CC3000,Adobe,INV97096,PO2007,NZD,23283.69,,Payment for services,Oracle,2026-01-24,2026-01-18,2026,01,23283.69,False,payment for services,2026-02-22 23:27:14.356841,Raw_GL_Export.csv,83.92156862745098,0,True,AUS01,5910,True,5910,Interest Expense,True,True,CC3000,Adobe Systems,MAPPED,2026-01_NZD,0.9335,21735.324614999998,CONVERTED,33774.54824600841,21661.31598456901,119.0,False,0.0,Saturday,True,True,True,EX009
TXN000663,27/02/2026,22/02/2026,2026-02,AUS01,5020,CC1200,Optus Pty,INV36041,PO7705,AUD,12471.09,,Payment for goods,SAP,2026-02-27,2026-02-22,2026,02,12471.09,False,payment for goods,2026-02-22 23:27:14.356841,Raw_GL_Export.csv,83.92156862745098,0,True,AUS01,5020,True,5020,Contractor Fees,True,True,CC1200,Optus,MAPPED,2026-02_AUD,1.0,12471.09,DOMESTIC,28445.577844280295,21241.721119146277,132.0,False,0.0,Friday,False,True,True,EX009
TXN000664,02/10/2026,02/01/2026,2026-02,AUS01,5320,CC1100,BCG,INV21284,PO8585,GBP,25610.98,,Payment for services,SAP,2026-10-02,2026-01-02,2026,02,25610.98,False,payment for services,2026-02-22 23:27:14.356841,Raw_GL_Export.csv,83.92156862745098,1,True,AUS01,5320,True,5320,Audit Fees,True,True,CC1100,Boston Consulting Group,MAPPED,2026-02_GBP,1.955,50069.4659,CONVERTED,31658.610713475173,32284.527206153973,141.0,False,0.0,Friday,False,True,True,EX004;EX007;EX009
TXN000665,03/01/2026,01/01/2026,2026-01,AUS01,5120,CC3000,Amazon,INV38511,PO8542,USD,35514.28,,Payment for services,Oracle,2026-01-03,2026-01-01,2026,01,35514.28,False,payment for services,2026-02-22 23:27:14.356841,Raw_GL_Export.csv,83.92156862745098,0,True,AUS01,5120,True,5120,Office Supplies,True,True,CC3000,Amazon Web Services,MAPPED,2026-01_USD,1.527,54230.30555999999,CONVERTED,34269.00595485611,35424.20705021751,139.0,False,0.0,Saturday,True,True,True,EX004;EX009
TXN000666,10/09/2025,07/09/2025,2025-09,AUS01,5300,CC1000,Federal Express,INV28405,PO7782,NZD,8092.38,,Payment for goods,Oracle,2025-09-10,2025-09-07,2025,09,8092.38,False,payment for goods,2026-02-22 23:27:14.356841,Raw_GL_Export.csv,83.92156862745098,0,True,AUS01,5300,True,5300,Professional Services,True,True,CC1000,FedEx,MAPPED,2025-09_NZD,0.927,7501.63626,CONVERTED,33232.533450429684,35951.49997313202,128.0,False,0.0,Wednesday,False,True,True,EX009
TXN000667,09/01/2026,06/01/2026,2026-01,AUS01,5300,CC2100,Optus Pty,INV56550,PO6715,NZD,4249.3,,Payment for license,Manual Entry,2026-01-09,2026-01-06,2026,01,4249.3,False,payment for license,2026-02-22 23:27:14.356841,Raw_GL_Export.csv,83.92156862745098,0,True,AUS01,5300,True,5300,Professional Services,True,True,CC2100,Optus,MAPPED,2026-01_NZD,0.9335,3966.72155,CONVERTED,33232.533450429684,35951.49997313202,128.0,False,0.0,Friday,False,True,True,EX009
TXN000668,27/01/2026,26/01/2026,2026-01,AUS01,5910,CC4100,Federal Express,INV37611,PO8108,USD,24253.9,,Payment for subscription,Workday,2026-01-27,2026-01-26,2026,01,24253.9,False,payment for subscription,2026-02-22 23:27:14.356841,Raw_GL_Export.csv,83.92156862745098,0,True,AUS01,5910,True,5910,Interest Expense,True,True,CC4100,FedEx,MAPPED,2026-01_USD,1.527,37035.7053,CONVERTED,33774.54824600841,21661.31598456901,119.0,False,0.0,Tuesday,False,True,True,EX009
TXN000669,01/07/2026,12/29/2025,2026-01,AUS01,5520,CC2100,Google,INV71300,,USD,11693.8,,Payment for services,API Import,2026-07-01,2025-12-29,2026,01,11693.8,False,payment for services,2026-02-22 23:27:14.356841,Raw_GL_Export.csv,83.92156862745098,1,True,AUS01,5520,True,5520,Events,True,True,CC2100,Google Cloud,MAPPED,2026-01_USD,1.527,17856.432599999996,CONVERTED,30860.276023483882,21900.267908653983,155.0,False,0.0,Wednesday,False,True,True,EX001;EX009
TXN000670,22/02/2026,14/02/2026,2026-02,AUS01,5110,CC3200,McKinsey,INV96285,PO1554,NZD,25413.25,,Payment for subscription,SAP,2026-02-22,2026-02-14,2026,02,25413.25,False,payment for subscription,2026-02-22 23:27:14.356841,Raw_GL_Export.csv,83.92156862745098,0,True,AUS01,5110,True,5110,Utilities,True,True,CC3200,McKinsey & Company,MAPPED,2026-02_NZD,0.932,23685.149,CONVERTED,27865.288293732876,21409.69928933269,146.0,False,0.0,Sunday,True,True,True,EX009
TXN000671,02/21/2026,02/20/2026,2026-02,AUS01,5120,CC3100,Seek Limited,INV23134,,NZD,15216.57,,Payment for subscription,Workday,2026-02-21,2026-02-20,2026,02,15216.57,False,payment for subscription,2026-02-22 23:27:14.356841,Raw_GL_Export.csv,83.92156862745098,0,True,AUS01,5120,True,5120,Office Supplies,True,True,CC3100,Seek,MAPPED,2026-02_NZD,0.932,14181.84324,CONVERTED,34269.00595485611,35424.20705021751,139.0,False,0.0,Saturday,True,True,True,EX001;EX009
TXN000672,06-01-2026,28-12-2025,2026-01,AUS01,5120,CC1000,Optus Pty,INV67012,PO8759,GBP,26751.51,,Payment for goods,Workday,2026-01-06,2025-12-28,2026,01,26751.51,False,payment for goods,2026-02-22 23:27:14.356841,Raw_GL_Export.csv,83.92156862745098,0,True,AUS01,5120,True,5120,Office Supplies,True,True,CC1000,Optus,MAPPED,2026-01_GBP,1.957,52352.705069999996,CONVERTED,34269.00595485611,35424.20705021751,139.0,False,0.0,Tuesday,False,True,True,EX004;EX009
TXN000673,02/24/2026,02/14/2026,2026-02,AUS01,5310,CC3200,DHL Express,INV40710,PO9306,NZD,1901.79,,Payment for services,Manual Entry,2026-02-24,2026-02-14,2026,02,1901.79,False,payment for services,2026-02-22 23:27:14.356841,Raw_GL_Export.csv,83.92156862745098,0,True,AUS01,5310,True,5310,Legal Fees,True,True,CC3200,DHL,MAPPED,2026-02_NZD,0.932,1772.46828,CONVERTED,33139.04129260232,28423.631835285127,171.0,False,0.0,Tuesday,False,True,True,EX009
TXN000674,10/14/2025,10/04/2025,2025-10,AUS01,5400,CC4100,Amazon,INV49397,PO9586,USD,23097.98,,Payment for goods,API Import,2025-10-14,2025-04-10,2025,10,23097.98,False,payment for goods,2026-02-22 23:27:14.356841,Raw_GL_Export.csv,83.92156862745098,0,True,AUS01,5400,True,5400,Travel,True,True,CC4100,Amazon Web Services,MAPPED,2025-10_USD,1.521,35132.027579999994,CONVERTED,31663.682660000006,30146.476988256833,133.0,False,0.0,Tuesday,False,True,True,EX009
TXN000675,25/09/2025,22/09/2025,2025-09,AUS01,5700,CC3000,MSFT,INV28541,PO8515,AUD,13986.38,,Payment for consulting,Oracle,2025-09-25,2025-09-22,2025,09,13986.38,False,payment for consulting,2026-02-22 23:27:14.356841,Raw_GL_Export.csv,83.92156862745098,0,True,AUS01,5700,True,5700,Training,True,True,CC3000,Microsoft Corporation,MAPPED,2025-09_AUD,1.0,13986.38,DOMESTIC,31110.431902446802,30160.111495086097,141.0,False,0.0,Thursday,False,True,True,EX009
TXN000676,2026-01-15,2026-01-12,2026-01,AUS01,5200,CC1200,EY Australia,INV40957,PO8152,NZD,3708.85,,Payment for services,Oracle,2026-01-15,2026-01-12,2026,01,3708.85,False,payment for services,2026-02-22 23:27:14.356841,Raw_GL_Export.csv,83.92156862745098,0,True,AUS01,5200,True,5200,Software Licenses,True,True,CC1200,EY,MAPPED,2026-01_NZD,0.9335,3462.211475,CONVERTED,30196.543712413786,22166.314759696765,145.0,False,0.0,Thursday,False,True,True,EX009
TXN000677,01/05/2026,01/04/2026,2026-01,AUS01,5500,CC1200,WeWork Australia,INV61648,PO8738,AUD,21238.95,,Payment for consulting,Manual Entry,2026-05-01,2026-04-01,2026,01,21238.95,False,payment for consulting,2026-02-22 23:27:14.356841,Raw_GL_Export.csv,83.92156862745098,1,True,AUS01,5500,True,5500,Marketing,True,True,CC1200,WeWork,MAPPED,2026-01_AUD,1.0,21238.95,DOMESTIC,28972.634359125877,32785.70497360227,143.0,False,0.0,Friday,False,True,True,EX009
TXN000678,23/01/2026,21/01/2026,2026-01,AUS01,5400,CC1200,McKinsey,INV52875,PO7956,USD,18054.77,,Payment for license,Manual Entry,2026-01-23,2026-01-21,2026,01,18054.77,False,payment for license,2026-02-22 23:27:14.356841,Raw_GL_Export.csv,83.92156862745098,0,True,AUS01,5400,True,5400,Travel,True,True,CC1200,McKinsey & Company,MAPPED,2026-01_USD,1.527,27569.63379,CONVERTED,31663.682660000006,30146.476988256833,133.0,False,0.0,Friday,False,True,True,EX009
TXN000679,2025-04-18,2025-04-12,2025-04,AUS01,5500,CC4100,Amazon,INV33351,PO7047,USD,39862.91,,Payment for subscription,Workday,2025-04-18,2025-04-12,2025,04,39862.91,False,payment for subscription,2026-02-22 23:27:14.356841,Raw_GL_Export.csv,83.92156862745098,0,True,AUS01,5500,True,5500,Marketing,True,True,CC4100,Amazon Web Services,MAPPED,2025-04_USD,1.525,60790.937750000005,CONVERTED,28972.634359125877,32785.70497360227,143.0,False,0.0,Friday,False,True,True,EX004;EX009
TXN000680,2026-01-17,2026-01-07,2026-01,AUS01,5610,CC3100,Salesforce,INV34637,,USD,6299.79,,Payment for subscription,Manual Entry,2026-01-17,2026-01-07,2026,01,6299.79,False,payment for subscription,2026-02-22 23:27:14.356841,Raw_GL_Export.csv,83.92156862745098,0,True,AUS01,5610,True,5610,Postage and Courier,True,True,CC3100,Salesforce Inc,MAPPED,2026-01_USD,1.527,9619.77933,CONVERTED,29081.766845273953,25872.32663648796,146.0,False,0.0,Saturday,True,True,True,EX001;EX009
TXN000681,02/03/2026,01/27/2026,2026-02,AUS01,5620,CC1200,Telstra Corp,INV98509,PO1570,USD,78497.13,EXPORT,Payment for subscription,Manual Entry,2026-03-02,2026-01-27,2026,02,78497.13,False,payment for subscription,2026-02-22 23:27:14.356841,Raw_GL_Export.csv,83.92156862745098,1,True,AUS01,5620,True,5620,Insurance,True,True,CC1200,Telstra,MAPPED,2026-02_USD,1.525,119708.12325,CONVERTED,32410.971605588227,27490.799177232966,170.0,False,0.0,Monday,False,True,True,EX004;EX007
TXN000682,06/01/2026,30/12/2025,2026-01,AUS01,5700,CC4000,GCP,INV99923,PO7626,GBP,130623.09,INPUT,Payment for services,Oracle,2026-01-06,2025-12-30,2026,01,130623.09,False,payment for services,2026-02-22 23:27:14.356841,Raw_GL_Export.csv,83.92156862745098,0,True,AUS01,5700,True,5700,Training,True,True,CC4000,Google Cloud,MAPPED,2026-01_GBP,1.957,255629.38713,CONVERTED,31110.431902446802,30160.111495086097,141.0,True,0.0,Tuesday,False,True,True,EX004;EX010
TXN000683,11/02/2026,01/02/2026,2026-02,AUS01,5510,CC3100,LinkedIn Corp,INV65372,PO5963,AUD,98614.45,EXPORT,Payment for consulting,Workday,2026-02-11,2026-02-01,2026,02,98614.45,False,payment for consulting,2026-02-22 23:27:14.356841,Raw_GL_Export.csv,83.92156862745098,0,True,AUS01,5510,True,5510,Advertising,True,True,CC3100,LinkedIn,MAPPED,2026-02_AUD,1.0,98614.45,DOMESTIC,28498.583342781956,23667.16979723599,133.0,False,0.0,Wednesday,False,True,True,EX004
TXN000684,2025-06-24,2025-06-14,2025-06,AUS01,5900,CC3200,Robert Half International,INV80126,PO2829,NZD,128100.57,INPUT,Payment for goods,Manual Entry,2025-06-24,2025-06-14,2025,06,128100.57,False,payment for goods,2026-02-22 23:27:14.356841,Raw_GL_Export.csv,83.92156862745098,0,True,AUS01,5900,True,5900,Bank Charges,True,True,CC3200,Robert Half,MAPPED,2025-06_NZD,0.931,119261.63067000001,CONVERTED,31670.032329854675,24882.231532617723,172.0,False,0.0,Tuesday,False,True,True,EX004
TXN000685,18-10-2025,16-10-2025,2025-10,AUS01,5110,CC1000,BCG,INV67001,,NZD,69762.11,EXPORT,Payment for subscription,SAP,2025-10-18,2025-10-16,2025,10,69762.11,False,payment for subscription,2026-02-22 23:27:14.356841,Raw_GL_Export.csv,83.92156862745098,0,True,AUS01,5110,True,5110,Utilities,True,True,CC1000,Boston Consulting Group,MAPPED,2025-10_NZD,0.929,64809.000190000006,CONVERTED,27865.288293732876,21409.69928933269,146.0,False,0.0,Saturday,True,True,True,EX001;EX004
TXN000686,04-02-2026,27-01-2026,2026-02,AUS01,5320,CC1000,Regus Australia,INV13084,PO3928,NZD,92570.83,INPUT,Payment for subscription,Workday,2026-02-04,2026-01-27,2026,02,92570.83,False,payment for subscription,2026-02-22 23:27:14.356841,Raw_GL_Export.csv,83.92156862745098,0,True,AUS01,5320,True,5320,Audit Fees,True,True,CC1000,Regus,MAPPED,2026-02_NZD,0.932,86276.01356,CONVERTED,31658.610713475173,32284.527206153973,141.0,False,0.0,Wednesday,False,True,True,EX004
TXN000687,2026-02-14,2026-02-06,2026-02,AUS01,5310,CC2100,Microsoft,INV79634,PO5073,AUD,85725.09,GST,Payment for goods,SAP,2026-02-14,2026-02-06,2026,02,85725.09,False,payment for goods,2026-02-22 23:27:14.356841,Raw_GL_Export.csv,83.92156862745098,0,True,AUS01,5310,True,5310,Legal Fees,True,True,CC2100,Microsoft Corporation,MAPPED,2026-02_AUD,1.0,85725.09,DOMESTIC,33139.04129260232,28423.631835285127,171.0,False,0.0,Saturday,True,True,True,EX004
TXN000688,2025-04-18,2025-04-15,2025-04,AUS01,5800,CC1200,Hays,INV70035,PO4999,GBP,139271.78,INPUT,Payment for license,API Import,2025-04-18,2025-04-15,2025,04,139271.78,False,payment for license,2026-02-22 23:27:14.356841,Raw_GL_Export.csv,83.92156862745098,0,True,AUS01,5800,True,5800,Depreciation,True,True,CC1200,Hays Recruitment,MAPPED,2025-04_GBP,1.955,272276.3299,CONVERTED,30184.39373025477,34245.09535020032,157.0,True,0.0,Friday,False,True,True,EX004;EX010
TXN000689,2025-03-15,2025-03-13,2025-03,AUS01,5310,CC3000,Microsoft,INV60058,PO2290,USD,110935.74,GST,Payment for subscription,Workday,2025-03-15,2025-03-13,2025,03,110935.74,False,payment for subscription,2026-02-22 23:27:14.356841,Raw_GL_Export.csv,83.92156862745098,0,True,AUS01,5310,True,5310,Legal Fees,True,True,CC3000,Microsoft Corporation,MAPPED,2025-03_USD,1.53,169731.6822,CONVERTED,33139.04129260232,28423.631835285127,171.0,False,0.0,Saturday,True,True,True,EX004
TXN000690,14-01-2026,13-01-2026,2026-01,AUS01,5120,CC2100,Google,INV84828,,GBP,146516.04,GST-FREE,Payment for subscription,API Import,2026-01-14,2026-01-13,2026,01,146516.04,False,payment for subscription,2026-02-22 23:27:14.356841,Raw_GL_Export.csv,83.92156862745098,0,True,AUS01,5120,True,5120,Office Supplies,True,True,CC2100,Google Cloud,MAPPED,2026-01_GBP,1.957,286731.89028000005,CONVERTED,34269.00595485611,35424.20705021751,139.0,True,0.0,Wednesday,False,True,True,EX001;EX004;EX010
TXN000691,17/01/2025,16/01/2025,2025-01,AUS01,5320,CC4100,Seek Limited,INV46016,PO4042,USD,126072.14,EXPORT,Payment for subscription,API Import,2025-01-17,2025-01-16,2025,01,126072.14,False,payment for subscription,2026-02-22 23:27:14.356841,Raw_GL_Export.csv,83.92156862745098,0,True,AUS01,5320,True,5320,Audit Fees,True,True,CC4100,Seek,MAPPED,2025-01_USD,1.52,191629.6528,CONVERTED,31658.610713475173,32284.527206153973,141.0,False,0.0,Friday,False,True,True,EX004
TXN000692,2026-02-22,2026-02-12,2026-02,AUS01,5400,CC1200,KPMG Australia,INV12453,PO3126,NZD,50506.1,GST-FREE,Payment for subscription,Workday,2026-02-22,2026-02-12,2026,02,50506.1,False,payment for subscription,2026-02-22 23:27:14.356841,Raw_GL_Export.csv,83.92156862745098,0,True,AUS01,5400,True,5400,Travel,True,True,CC1200,KPMG,MAPPED,2026-02_NZD,0.932,47071.6852,CONVERTED,31663.682660000006,30146.476988256833,133.0,False,0.0,Sunday,True,True,False,
TXN000693,01/15/2026,01/13/2026,2026-01,AUS01,5210,CC2000,Amazon,INV89864,PO7893,NZD,72106.55,INPUT,Payment for license,Workday,2026-01-15,2026-01-13,2026,01,72106.55,False,payment for license,2026-02-22 23:27:14.356841,Raw_GL_Export.csv,83.92156862745098,0,True,AUS01,5210,True,5210,Cloud Services,True,True,CC2000,Amazon Web Services,MAPPED,2026-01_NZD,0.9335,67311.464425,CONVERTED,31620.56664919015,27460.393400888206,142.0,False,0.0,Thursday,False,True,True,EX004
TXN000694,18-01-2025,10-01-2025,2025-01,AUS01,5520,CC1000,BCG,INV29893,PO9175,NZD,81964.96,EXPORT,Payment for goods,API Import,2025-01-18,2025-01-10,2025,01,81964.96,False,payment for goods,2026-02-22 23:27:14.356841,Raw_GL_Export.csv,83.92156862745098,0,True,AUS01,5520,True,5520,Events,True,True,CC1000,Boston Consulting Group,MAPPED,2025-01_NZD,0.93,76227.4128,CONVERTED,30860.276023483882,21900.267908653983,155.0,False,0.0,Saturday,True,True,True,EX004
TXN000695,23/12/2025,16/12/2025,2025-12,AUS01,5220,CC3100,Microsoft,INV20891,,AUD,113138.77,INPUT,Payment for license,Workday,2025-12-23,2025-12-16,2025,12,113138.77,False,payment for license,2026-02-22 23:27:14.356841,Raw_GL_Export.csv,83.92156862745098,0,True,AUS01,5220,True,5220,IT Support,True,True,CC3100,Microsoft Corporation,MAPPED,2025-12_AUD,1.0,113138.77,DOMESTIC,29540.94372533058,19404.169897416657,121.0,False,0.0,Tuesday,False,True,True,EX001;EX004
TXN000696,02/10/2026,02/04/2026,2026-02,AUS01,5420,CC3200,Amazon,INV91823,PO8070,USD,112486.64,GST-FREE,Payment for consulting,SAP,2026-10-02,2026-04-02,2026,02,112486.64,False,payment for consulting,2026-02-22 23:27:14.356841,Raw_GL_Export.csv,83.92156862745098,1,True,AUS01,5420,True,5420,Meals and Entertainment,True,True,CC3200,Amazon Web Services,MAPPED,2026-02_USD,1.525,171542.126,CONVERTED,30119.54810314684,25344.73848974119,143.0,True,0.0,Friday,False,True,True,EX004;EX007;EX010
TXN000697,12/25/2025,12/16/2025,2025-12,AUS01,5800,CC3200,Accenture Pty,INV59601,PO3023,GBP,142117.71,GST-FREE,Payment for services,Manual Entry,2025-12-25,2025-12-16,2025,12,142117.71,False,payment for services,2026-02-22 23:27:14.356841,Raw_GL_Export.csv,83.92156862745098,0,True,AUS01,5800,True,5800,Depreciation,True,True,CC3200,Accenture,MAPPED,2025-12_GBP,1.953,277555.88763,CONVERTED,30184.39373025477,34245.09535020032,157.0,True,0.0,Thursday,False,True,True,EX004;EX010
TXN000698,07/02/2026,05/02/2026,2026-02,AUS01,5600,CC2100,Oracle,INV82098,PO4567,USD,126687.7,EXPORT,Payment for consulting,API Import,2026-02-07,2026-02-05,2026,02,126687.7,False,payment for consulting,2026-02-22 23:27:14.356841,Raw_GL_Export.csv,83.92156862745098,0,True,AUS01,5600,True,5600,Telecommunications,True,True,CC2100,Oracle Corporation,MAPPED,2026-02_USD,1.525,193198.7425,CONVERTED,32190.120230168057,26805.910450208805,119.0,True,0.0,Saturday,True,True,True,EX004;EX010
TXN000699,09/09/2025,09/03/2025,2025-09,AUS01,5620,CC1100,McKinsey,INV74858,PO5690,GBP,72510.7,EXPORT,Payment for consulting,Oracle,2025-09-09,2025-03-09,2025,09,72510.7,False,payment for consulting,2026-02-22 23:27:14.356841,Raw_GL_Export.csv,83.92156862745098,0,True,AUS01,5620,True,5620,Insurance,True,True,CC1100,McKinsey & Company,MAPPED,2025-09_GBP,1.949,141323.3543,CONVERTED,32410.971605588227,27490.799177232966,170.0,False,0.0,Tuesday,False,True,True,EX004
TXN000700,28/02/2026,21/02/2026,2026-02,AUS01,5300,CC1000,BCG,INV60246,PO7850,GBP,115619.41,GST,Payment for consulting,Manual Entry,2026-02-28,2026-02-21,2026,02,115619.41,False,payment for consulting,2026-02-22 23:27:14.356841,Raw_GL_Export.csv,83.92156862745098,0,True,AUS01,5300,True,5300,Professional Services,True,True,CC1000,Boston Consulting Group,MAPPED,2026-02_GBP,1.955,226035.94655000002,CONVERTED,33232.533450429684,35951.49997313202,128.0,True,0.0,Saturday,True,True,True,EX004;EX010
TXN000701,2025-04-07,2025-03-28,2025-04,AUS01,5210,CC1200,Robert Half International,INV12992,PO5095,AUD,109957.22,EXPORT,Payment for goods,API Import,2025-04-07,2025-03-28,2025,04,109957.22,False,payment for goods,2026-02-22 23:27:14.356841,Raw_GL_Export.csv,83.92156862745098,0,True,AUS01,5210,True,5210,Cloud Services,True,True,CC1200,Robert Half,MAPPED,2025-04_AUD,1.0,109957.22,DOMESTIC,31620.56664919015,27460.393400888206,142.0,False,0.0,Monday,False,True,True,EX004
TXN000702,21-02-2026,19-02-2026,2026-02,AUS01,5320,CC1000,Federal Express,INV70000,PO4920,USD,135031.05,GST-FREE,Payment for goods,Manual Entry,2026-02-21,2026-02-19,2026,02,135031.05,False,payment for goods,2026-02-22 23:27:14.356841,Raw_GL_Export.csv,83.92156862745098,0,True,AUS01,5320,True,5320,Audit Fees,True,True,CC1000,FedEx,MAPPED,2026-02_USD,1.525,205922.35124999998,CONVERTED,31658.610713475173,32284.527206153973,141.0,True,0.0,Saturday,True,True,True,EX004;EX010
TXN000703,23/09/2025,17/09/2025,2025-09,AUS01,5110,CC2100,Salesforce,INV70187,,AUD,70701.52,EXPORT,Payment for license,Manual Entry,2025-09-23,2025-09-17,2025,09,70701.52,False,payment for license,2026-02-22 23:27:14.356841,Raw_GL_Export.csv,83.92156862745098,0,True,AUS01,5110,True,5110,Utilities,True,True,CC2100,Salesforce Inc,MAPPED,2025-09_AUD,1.0,70701.52,DOMESTIC,27865.288293732876,21409.69928933269,146.0,False,0.0,Tuesday,False,True,True,EX001;EX004
TXN000704,08/02/2026,31/01/2026,2026-02,AUS01,5510,CC1100,BCG,INV10902,PO7657,USD,74487.1,GST,Payment for license,Manual Entry,2026-02-08,2026-01-31,2026,02,74487.1,False,payment for license,2026-02-22 23:27:14.356841,Raw_GL_Export.csv,83.92156862745098,0,True,AUS01,5510,True,5510,Advertising,True,True,CC1100,Boston Consulting Group,MAPPED,2026-02_USD,1.525,113592.8275,CONVERTED,28498.583342781956,23667.16979723599,133.0,False,0.0,Sunday,True,True,True,EX004
TXN000705,28-02-2026,26-02-2026,2026-02,AUS01,5900,CC3100,Deloitte Touche,INV67477,PO1979,AUD,121579.77,GST,Payment for subscription,Manual Entry,2026-02-28,2026-02-26,2026,02,121579.77,False,payment for subscription,2026-02-22 23:27:14.356841,Raw_GL_Export.csv,83.92156862745098,0,True,AUS01,5900,True,5900,Bank Charges,True,True,CC3100,Deloitte,MAPPED,2026-02_AUD,1.0,121579.77,DOMESTIC,31670.032329854675,24882.231532617723,172.0,False,0.0,Saturday,True,True,True,EX004
TXN000706,2025-04-27,2025-04-21,2025-04,AUS01,5400,CC4000,Optus Pty,INV29134,PO2831,GBP,128742.57,GST,Payment for goods,Workday,2025-04-27,2025-04-21,2025,04,128742.57,False,payment for goods,2026-02-22 23:27:14.356841,Raw_GL_Export.csv,83.92156862745098,0,True,AUS01,5400,True,5400,Travel,True,True,CC4000,Optus,MAPPED,2025-04_GBP,1.955,251691.72435000003,CONVERTED,31663.682660000006,30146.476988256833,133.0,True,0.0,Sunday,True,True,True,EX004;EX010
TXN000707,02/14/2026,02/11/2026,2026-02,AUS01,5210,CC3200,Workday,INV70062,PO9053,NZD,59713.47,GST,Payment for goods,Workday,2026-02-14,2026-11-02,2026,02,59713.47,False,payment for goods,2026-02-22 23:27:14.356841,Raw_GL_Export.csv,83.92156862745098,0,True,AUS01,5210,True,5210,Cloud Services,True,True,CC3200,Workday Inc,MAPPED,2026-02_NZD,0.932,55652.954040000004,CONVERTED,31620.56664919015,27460.393400888206,142.0,False,0.0,Saturday,True,True,True,EX004
TXN000708,02/11/2026,02/03/2026,2026-02,AUS01,5310,CC3200,Deloitte Touche,INV29401,PO1425,NZD,109443.22,GST-FREE,Payment for goods,Workday,2026-11-02,2026-03-02,2026,02,109443.22,False,payment for goods,2026-02-22 23:27:14.356841,Raw_GL_Export.csv,83.92156862745098,1,True,AUS01,5310,True,5310,Legal Fees,True,True,CC3200,Deloitte,MAPPED,2026-02_NZD,0.932,102001.08104,CONVERTED,33139.04129260232,28423.631835285127,171.0,False,0.0,Monday,False,True,True,EX004;EX007
TXN000709,01/19/2026,01/14/2026,2026-01,AUS01,5300,CC1200,EY Australia,INV30242,PO3106,GBP,121308.17,INPUT,Payment for goods,API Import,2026-01-19,2026-01-14,2026,01,121308.17,False,payment for goods,2026-02-22 23:27:14.356841,Raw_GL_Export.csv,83.92156862745098,0,True,AUS01,5300,True,5300,Professional Services,True,True,CC1200,EY,MAPPED,2026-01_GBP,1.957,237400.08869,CONVERTED,33232.533450429684,35951.49997313202,128.0,True,0.0,Monday,False,True,True,EX004;EX010
TXN000710,10-02-2026,05-02-2026,2026-02,AUS01,5620,CC2000,Amazon,INV86576,,USD,108323.45,GST-FREE,Payment for subscription,API Import,2026-02-10,2026-02-05,2026,02,108323.45,False,payment for subscription,2026-02-22 23:27:14.356841,Raw_GL_Export.csv,83.92156862745098,0,True,AUS01,5620,True,5620,Insurance,True,True,CC2000,Amazon Web Services,MAPPED,2026-02_USD,1.525,165193.26124999998,CONVERTED,32410.971605588227,27490.799177232966,170.0,False,0.0,Tuesday,False,True,True,EX001;EX004
TXN000711,24-02-2026,16-02-2026,2026-02,AUS01,5610,CC1200,WeWork Australia,INV78594,PO8950,USD,108713.96,INPUT,Payment for goods,API Import,2026-02-24,2026-02-16,2026,02,108713.96,False,payment for goods,2026-02-22 23:27:14.356841,Raw_GL_Export.csv,83.92156862745098,0,True,AUS01,5610,True,5610,Postage and Courier,True,True,CC1200,WeWork,MAPPED,2026-02_USD,1.525,165788.789,CONVERTED,29081.766845273953,25872.32663648796,146.0,True,0.0,Tuesday,False,True,True,EX004;EX010
TXN000712,16/01/2026,08/01/2026,2026-01,AUS01,5400,CC1000,Salesforce,INV39400,,NZD,72483.29,GST-FREE,Payment for license,SAP,2026-01-16,2026-01-08,2026,01,72483.29,False,payment for license,2026-02-22 23:27:14.356841,Raw_GL_Export.csv,83.92156862745098,0,True,AUS01,5400,True,5400,Travel,True,True,CC1000,Salesforce Inc,MAPPED,2026-01_NZD,0.9335,67663.15121499999,CONVERTED,31663.682660000006,30146.476988256833,133.0,False,0.0,Friday,False,True,True,EX001;EX004
TXN000713,21/02/2026,15/02/2026,2026-02,AUS01,5500,CC3200,AWS,INV97063,,USD,124138.04,INPUT,Payment for services,Workday,2026-02-21,2026-02-15,2026,02,124138.04,False,payment for services,2026-02-22 23:27:14.356841,Raw_GL_Export.csv,83.92156862745098,0,True,AUS01,5500,True,5500,Marketing,True,True,CC3200,Amazon Web Services,MAPPED,2026-02_USD,1.525,189310.51099999997,CONVERTED,28972.634359125877,32785.70497360227,143.0,False,0.0,Saturday,True,True,True,EX001;EX004
TXN000714,2025-12-17,2025-12-12,2025-12,AUS01,5520,CC4000,Google,INV42072,,AUD,94663.84,GST-FREE,Payment for goods,Oracle,2025-12-17,2025-12-12,2025,12,94663.84,False,payment for goods,2026-02-22 23:27:14.356841,Raw_GL_Export.csv,83.92156862745098,0,True,AUS01,5520,True,5520,Events,True,True,CC4000,Google Cloud,MAPPED,2025-12_AUD,1.0,94663.84,DOMESTIC,30860.276023483882,21900.267908653983,155.0,False,0.0,Wednesday,False,True,True,EX001;EX004
TXN000715,08-01-2026,05-01-2026,2026-01,AUS01,5010,CC4100,PWC,INV18345,PO3171,NZD,59136.83,GST-FREE,Payment for license,Workday,2026-01-08,2026-01-05,2026,01,59136.83,False,payment for license,2026-02-22 23:27:14.356841,Raw_GL_Export.csv,83.92156862745098,0,True,AUS01,5010,True,5010,Employee Benefits,True,True,CC4100,PwC,MAPPED,2026-01_NZD,0.9335,55204.230805,CONVERTED,27923.213086278203,19430.63083039902,133.0,False,0.0,Thursday,False,True,True,EX004
TXN000716,02/01/2026,29/12/2025,2026-01,AUS01,5210,CC4100,Seek Limited,INV51793,PO2196,GBP,59827.93,GST,Payment for goods,Manual Entry,2026-01-02,2025-12-29,2026,01,59827.93,False,payment for goods,2026-02-22 23:27:14.356841,Raw_GL_Export.csv,83.92156862745098,0,True,AUS01,5210,True,5210,Cloud Services,True,True,CC4100,Seek,MAPPED,2026-01_GBP,1.957,117083.25901000001,CONVERTED,31620.56664919015,27460.393400888206,142.0,False,0.0,Friday,False,True,True,EX004
TXN000717,04-02-2026,02-02-2026,2026-02,AUS01,5500,CC2000,GCP,INV84623,,USD,109829.78,INPUT,Payment for consulting,SAP,2026-02-04,2026-02-02,2026,02,109829.78,False,payment for consulting,2026-02-22 23:27:14.356841,Raw_GL_Export.csv,83.92156862745098,0,True,AUS01,5500,True,5500,Marketing,True,True,CC2000,Google Cloud,MAPPED,2026-02_USD,1.525,167490.41449999998,CONVERTED,28972.634359125877,32785.70497360227,143.0,False,0.0,Wednesday,False,True,True,EX001;EX004
TXN000718,24-02-2026,20-02-2026,2026-02,AUS01,5600,CC4100,LinkedIn Corp,INV88820,,AUD,75175.53,EXPORT,Payment for goods,Workday,2026-02-24,2026-02-20,2026,02,75175.53,False,payment for goods,2026-02-22 23:27:14.356841,Raw_GL_Export.csv,83.92156862745098,0,True,AUS01,5600,True,5600,Telecommunications,True,True,CC4100,LinkedIn,MAPPED,2026-02_AUD,1.0,75175.53,DOMESTIC,32190.120230168057,26805.910450208805,119.0,False,0.0,Tuesday,False,True,True,EX001;EX004
TXN000719,17-04-2025,08-04-2025,2025-04,AUS01,5300,CC2100,Deloitte Touche,INV92040,PO3984,USD,84114.89,INPUT,Payment for consulting,SAP,2025-04-17,2025-04-08,2025,04,84114.89,False,payment for consulting,2026-02-22 23:27:14.356841,Raw_GL_Export.csv,83.92156862745098,0,True,AUS01,5300,True,5300,Professional Services,True,True,CC2100,Deloitte,MAPPED,2025-04_USD,1.525,128275.20724999999,CONVERTED,33232.533450429684,35951.49997313202,128.0,False,0.0,Thursday,False,True,True,EX004
TXN000720,11-01-2026,03-01-2026,2026-01,AUS01,5120,CC1200,Salesforce,INV68090,PO9824,GBP,117297.95,GST,Payment for goods,Oracle,2026-01-11,2026-01-03,2026,01,117297.95,False,payment for goods,2026-02-22 23:27:14.356841,Raw_GL_Export.csv,83.92156862745098,0,True,AUS01,5120,True,5120,Office Supplies,True,True,CC1200,Salesforce Inc,MAPPED,2026-01_GBP,1.957,229552.08815,CONVERTED,34269.00595485611,35424.20705021751,139.0,True,0.0,Sunday,True,True,True,EX004;EX010
TXN000721,2026-02-25,2026-02-21,2026-02,AUS01,5200,CC2100,Robert Half International,INV23489,PO4445,NZD,82002.27,EXPORT,Payment for license,Oracle,2026-02-25,2026-02-21,2026,02,82002.27,False,payment for license,2026-02-22 23:27:14.356841,Raw_GL_Export.csv,83.92156862745098,0,True,AUS01,5200,True,5200,Software Licenses,True,True,CC2100,Robert Half,MAPPED,2026-02_NZD,0.932,76426.11564,CONVERTED,30196.543712413786,22166.314759696765,145.0,False,0.0,Wednesday,False,True,True,EX004
TXN000722,11/11/2025,07/11/2025,2025-11,AUS01,5810,CC3100,Adobe,INV52687,PO8762,USD,111012.71,GST-FREE,Payment for license,Manual Entry,2025-11-11,2025-11-07,2025,11,111012.71,False,payment for license,2026-02-22 23:27:14.356841,Raw_GL_Export.csv,83.92156862745098,0,True,AUS01,5810,True,5810,Amortization,True,True,CC3100,Adobe Systems,MAPPED,2025-11_USD,1.526,169405.39546,CONVERTED,31768.91314562501,27328.351394475325,120.0,True,0.0,Tuesday,False,True,True,EX004;EX010
TXN000723,10/25/2025,10/21/2025,2025-10,AUS01,5220,CC3200,EY Australia,INV56390,PO6166,NZD,64499.51,INPUT,Payment for consulting,Workday,2025-10-25,2025-10-21,2025,10,64499.51,False,payment for consulting,2026-02-22 23:27:14.356841,Raw_GL_Export.csv,83.92156862745098,0,True,AUS01,5220,True,5220,IT Support,True,True,CC3200,EY,MAPPED,2025-10_NZD,0.929,59920.04479000001,CONVERTED,29540.94372533058,19404.169897416657,121.0,False,0.0,Saturday,True,True,True,EX004
TXN000724,14-09-2025,07-09-2025,2025-09,AUS01,5000,CC3100,MSFT,INV69885,PO1319,GBP,85361.84,GST-FREE,Payment for goods,Oracle,2025-09-14,2025-09-07,2025,09,85361.84,False,payment for goods,2026-02-22 23:27:14.356841,Raw_GL_Export.csv,83.92156862745098,0,True,AUS01,5000,True,5000,Salaries and Wages,True,True,CC3100,Microsoft Corporation,MAPPED,2025-09_GBP,1.949,166370.22616,CONVERTED,30471.385558248177,22939.768434623154,137.0,True,0.0,Sunday,True,True,True,EX004;EX010
TXN000725,02/22/2026,02/17/2026,2026-02,AUS01,5910,CC3000,Amazon,INV52688,PO4267,NZD,92750.41,EXPORT,Payment for goods,API Import,2026-02-22,2026-02-17,2026,02,92750.41,False,payment for goods,2026-02-22 23:27:14.356841,Raw_GL_Export.csv,83.92156862745098,0,True,AUS01,5910,True,5910,Interest Expense,True,True,CC3000,Amazon Web Services,MAPPED,2026-02_NZD,0.932,86443.38212000001,CONVERTED,33774.54824600841,21661.31598456901,119.0,False,0.0,Sunday,True,True,True,EX004
TXN000726,17-02-2026,12-02-2026,2026-02,AUS01,5100,CC1100,Accenture Pty,INV87717,PO1753,USD,82548.98,EXPORT,Payment for consulting,Manual Entry,2026-02-17,2026-02-12,2026,02,82548.98,False,payment for consulting,2026-02-22 23:27:14.356841,Raw_GL_Export.csv,83.92156862745098,0,True,AUS01,5100,True,5100,Office Rent,True,True,CC1100,Accenture,MAPPED,2026-02_USD,1.525,125887.19449999998,CONVERTED,29138.02959753333,27547.65120166844,150.0,False,0.0,Tuesday,False,True,True,EX004
TXN000727,01/08/2026,12/29/2025,2026-01,AUS01,5600,CC3100,MSFT,INV46181,PO8178,AUD,55612.4,INPUT,Payment for subscription,SAP,2026-08-01,2025-12-29,2026,01,55612.4,False,payment for subscription,2026-02-22 23:27:14.356841,Raw_GL_Export.csv,83.92156862745098,1,True,AUS01,5600,True,5600,Telecommunications,True,True,CC3100,Microsoft Corporation,MAPPED,2026-01_AUD,1.0,55612.4,DOMESTIC,32190.120230168057,26805.910450208805,119.0,False,0.0,Saturday,True,True,True,EX004
TXN000728,16/01/2026,14/01/2026,2026-01,AUS01,5310,CC3100,Zoom,INV83641,,USD,108981.24,GST-FREE,Payment for goods,Workday,2026-01-16,2026-01-14,2026,01,108981.24,False,payment for goods,2026-02-22 23:27:14.356841,Raw_GL_Export.csv,83.92156862745098,0,True,AUS01,5310,True,5310,Legal Fees,True,True,CC3100,Zoom Video Communications,MAPPED,2026-01_USD,1.527,166414.35348,CONVERTED,33139.04129260232,28423.631835285127,171.0,False,0.0,Friday,False,True,True,EX001;EX004
TXN000729,99/99/9999,99/99/9999,2025-11,AUS01,5710,CC1000,Slack,INV57347,PO8304,AUD,39195.57,INPUT,Payment for goods,Oracle,,,2025,11,39195.57,False,payment for goods,2026-02-22 23:27:14.356841,Raw_GL_Export.csv,83.92156862745098,2,True,AUS01,5710,True,5710,Recruitment,True,True,CC1000,Slack Technologies,MAPPED,2025-11_AUD,1.0,39195.57,DOMESTIC,29496.09592285716,24753.031499859637,133.0,False,,,False,False,True,EX008
TXN000730,99/99/9999,INVALID,2025-10,AUS01,5210,CC3200,Regus Australia,INV43470,PO1379,NZD,9034.43,INPUT,Payment for goods,SAP,,,2025,10,9034.43,False,payment for goods,2026-02-22 23:27:14.356841,Raw_GL_Export.csv,83.92156862745098,2,True,AUS01,5210,True,5210,Cloud Services,True,True,CC3200,Regus,MAPPED,2025-10_NZD,0.929,8392.985470000001,CONVERTED,31620.56664919015,27460.393400888206,142.0,False,,,False,False,True,EX008
TXN000731,INVALID,INVALID,2026-01,AUS01,5400,CC3200,MSFT,INV12123,PO1525,AUD,41092.9,INPUT,Payment for license,Workday,,,2026,01,41092.9,False,payment for license,2026-02-22 23:27:14.356841,Raw_GL_Export.csv,83.92156862745098,2,True,AUS01,5400,True,5400,Travel,True,True,CC3200,Microsoft Corporation,MAPPED,2026-01_AUD,1.0,41092.9,DOMESTIC,31663.682660000006,30146.476988256833,133.0,False,,,False,False,True,EX008
TXN000732,INVALID,99/99/9999,2026-01,AUS01,5600,CC3000,Salesforce,INV79699,,AUD,25482.28,GST,Payment for license,SAP,,,2026,01,25482.28,False,payment for license,2026-02-22 23:27:14.356841,Raw_GL_Export.csv,83.92156862745098,2,True,AUS01,5600,True,5600,Telecommunications,True,True,CC3000,Salesforce Inc,MAPPED,2026-01_AUD,1.0,25482.28,DOMESTIC,32190.120230168057,26805.910450208805,119.0,False,,,False,False,True,EX001;EX008
TXN000733,INVALID,2026-13-45,2025-08,AUS01,5810,CC1100,Telstra Corp,INV95254,PO3976,NZD,21010.61,GST-FREE,Payment for license,Workday,,,2025,08,21010.61,False,payment for license,2026-02-22 23:27:14.356841,Raw_GL_Export.csv,83.92156862745098,2,True,AUS01,5810,True,5810,Amortization,True,True,CC1100,Telstra,MAPPED,2025-08_NZD,0.93,19539.8673,CONVERTED,31768.91314562501,27328.351394475325,120.0,False,,,False,False,True,EX008
TXN000734,INVALID,INVALID,2026-02,AUS01,5000,CC3100,KPMG Australia,INV12473,,AUD,28103.67,EXPORT,Payment for subscription,Manual Entry,,,2026,02,28103.67,False,payment for subscription,2026-02-22 23:27:14.356841,Raw_GL_Export.csv,83.92156862745098,2,True,AUS01,5000,True,5000,Salaries and Wages,True,True,CC3100,KPMG,MAPPED,2026-02_AUD,1.0,28103.67,DOMESTIC,30471.385558248177,22939.768434623154,137.0,False,,,False,False,True,EX001;EX008
TXN000735,2026-13-45,99/99/9999,2025-09,AUS01,5920,CC2000,McKinsey,INV85292,PO3500,GBP,29447.21,GST-FREE,Payment for goods,Oracle,,,2025,09,29447.21,False,payment for goods,2026-02-22 23:27:14.356841,Raw_GL_Export.csv,83.92156862745098,2,True,AUS01,5920,True,5920,FX Loss,True,True,CC2000,McKinsey & Company,MAPPED,2025-09_GBP,1.949,57392.61229,CONVERTED,27533.92400565971,21784.021192347693,144.0,False,,,False,False,True,EX004;EX008
TXN000736,2026-13-45,99/99/9999,2026-01,AUS01,5120,CC1100,Amazon,INV19078,PO6166,AUD,35097.9,INPUT,Payment for goods,Oracle,,,2026,01,35097.9,False,payment for goods,2026-02-22 23:27:14.356841,Raw_GL_Export.csv,83.92156862745098,2,True,AUS01,5120,True,5120,Office Supplies,True,True,CC1100,Amazon Web Services,MAPPED,2026-01_AUD,1.0,35097.9,DOMESTIC,34269.00595485611,35424.20705021751,139.0,False,,,False,False,True,EX008
TXN000737,2026-13-45,99/99/9999,2025-09,AUS01,5120,CC3100,PWC,INV56575,,USD,42139.97,GST-FREE,Payment for consulting,SAP,,,2025,09,42139.97,False,payment for consulting,2026-02-22 23:27:14.356841,Raw_GL_Export.csv,83.92156862745098,2,True,AUS01,5120,True,5120,Office Supplies,True,True,CC3100,PwC,MAPPED,2025-09_USD,1.519,64010.614429999994,CONVERTED,34269.00595485611,35424.20705021751,139.0,False,,,False,False,True,EX001;EX004;EX008
TXN000738,INVALID,32/13/2026,2026-01,AUS01,5420,CC2000,Federal Express,INV36035,,AUD,20161.88,EXPORT,Payment for consulting,API Import,,,2026,01,20161.88,False,payment for consulting,2026-02-22 23:27:14.356841,Raw_GL_Export.csv,83.92156862745098,2,True,AUS01,5420,True,5420,Meals and Entertainment,True,True,CC2000,FedEx,MAPPED,2026-01_AUD,1.0,20161.88,DOMESTIC,30119.54810314684,25344.73848974119,143.0,False,,,False,False,True,EX001;EX008
TXN000739,32/13/2026,32/13/2026,2026-02,AUS01,5120,CC4000,Atlassian Pty,INV74108,PO6871,USD,34071.63,GST,Payment for subscription,Manual Entry,,,2026,02,34071.63,False,payment for subscription,2026-02-22 23:27:14.356841,Raw_GL_Export.csv,83.92156862745098,2,True,AUS01,5120,True,5120,Office Supplies,True,True,CC4000,Atlassian,MAPPED,2026-02_USD,1.525,51959.23574999999,CONVERTED,34269.00595485611,35424.20705021751,139.0,False,,,False,False,True,EX004;EX008
TXN000740,2026-13-45,2026-13-45,2025-03,AUS01,5020,CC4000,Regus Australia,INV69893,,GBP,11562.28,GST,Payment for consulting,Manual Entry,,,2025,03,11562.28,False,payment for consulting,2026-02-22 23:27:14.356841,Raw_GL_Export.csv,83.92156862745098,2,True,AUS01,5020,True,5020,Contractor Fees,True,True,CC4000,Regus,MAPPED,2025-03_GBP,1.96,22662.0688,CONVERTED,28445.577844280295,21241.721119146277,132.0,False,,,False,False,True,EX001;EX008
TXN000741,INVALID,32/13/2026,2025-12,AUS01,5320,CC3000,EY Australia,INV40062,PO2383,AUD,19593.28,INPUT,Payment for consulting,Manual Entry,,,2025,12,19593.28,False,payment for consulting,2026-02-22 23:27:14.356841,Raw_GL_Export.csv,83.92156862745098,2,True,AUS01,5320,True,5320,Audit Fees,True,True,CC3000,EY,MAPPED,2025-12_AUD,1.0,19593.28,DOMESTIC,31658.610713475173,32284.527206153973,141.0,False,,,False,False,True,EX008
TXN000742,32/13/2026,99/99/9999,2026-02,AUS01,5800,CC3000,Microsoft,INV84000,,USD,38148.92,GST-FREE,Payment for license,Oracle,,,2026,02,38148.92,False,payment for license,2026-02-22 23:27:14.356841,Raw_GL_Export.csv,83.92156862745098,2,True,AUS01,5800,True,5800,Depreciation,True,True,CC3000,Microsoft Corporation,MAPPED,2026-02_USD,1.525,58177.102999999996,CONVERTED,30184.39373025477,34245.09535020032,157.0,False,,,False,False,True,EX001;EX004;EX008
TXN000743,2026-13-45,INVALID,2026-02,AUS01,5810,CC1000,MSFT,INV58719,PO3580,USD,38998.89,INPUT,Payment for consulting,Oracle,,,2026,02,38998.89,False,payment for consulting,2026-02-22 23:27:14.356841,Raw_GL_Export.csv,83.92156862745098,2,True,AUS01,5810,True,5810,Amortization,True,True,CC1000,Microsoft Corporation,MAPPED,2026-02_USD,1.525,59473.30725,CONVERTED,31768.91314562501,27328.351394475325,120.0,False,,,False,False,True,EX004;EX008
TXN000744,2026-13-45,2026-13-45,2026-02,AUS01,5800,CC1200,Regus Australia,INV75215,,AUD,35416.4,GST,Payment for consulting,Workday,,,2026,02,35416.4,False,payment for consulting,2026-02-22 23:27:14.356841,Raw_GL_Export.csv,83.92156862745098,2,True,AUS01,5800,True,5800,Depreciation,True,True,CC1200,Regus,MAPPED,2026-02_AUD,1.0,35416.4,DOMESTIC,30184.39373025477,34245.09535020032,157.0,False,,,False,False,True,EX001;EX008
TXN000745,99/99/9999,99/99/9999,2025-04,AUS01,5000,CC1000,BCG,INV28919,PO1761,AUD,40008.04,GST,Payment for license,Manual Entry,,,2025,04,40008.04,False,payment for license,2026-02-22 23:27:14.356841,Raw_GL_Export.csv,83.92156862745098,2,True,AUS01,5000,True,5000,Salaries and Wages,True,True,CC1000,Boston Consulting Group,MAPPED,2025-04_AUD,1.0,40008.04,DOMESTIC,30471.385558248177,22939.768434623154,137.0,False,,,False,False,True,EX008
TXN000746,2026-13-45,2026-13-45,2025-07,AUS01,5100,CC1000,WeWork Australia,INV24733,PO8609,USD,4236.36,GST,Payment for consulting,API Import,,,2025,07,4236.36,False,payment for consulting,2026-02-22 23:27:14.356841,Raw_GL_Export.csv,83.92156862745098,2,True,AUS01,5100,True,5100,Office Rent,True,True,CC1000,WeWork,MAPPED,2025-07_USD,1.528,6473.158079999999,CONVERTED,29138.02959753333,27547.65120166844,150.0,False,,,False,False,True,EX008
TXN000747,INVALID,2026-13-45,2026-01,AUS01,5920,CC4100,AWS,INV26803,PO9847,NZD,21483.33,INPUT,Payment for subscription,API Import,,,2026,01,21483.33,False,payment for subscription,2026-02-22 23:27:14.356841,Raw_GL_Export.csv,83.92156862745098,2,True,AUS01,5920,True,5920,FX Loss,True,True,CC4100,Amazon Web Services,MAPPED,2026-01_NZD,0.9335,20054.688555,CONVERTED,27533.92400565971,21784.021192347693,144.0,False,,,False,False,True,EX008
TXN000748,32/13/2026,INVALID,2026-01,AUS01,5500,CC4100,SAP,INV28690,,USD,9947.07,GST-FREE,Payment for services,SAP,,,2026,01,9947.07,False,payment for services,2026-02-22 23:27:14.356841,Raw_GL_Export.csv,83.92156862745098,2,True,AUS01,5500,True,5500,Marketing,True,True,CC4100,SAP SE,MAPPED,2026-01_USD,1.527,15189.175889999999,CONVERTED,28972.634359125877,32785.70497360227,143.0,False,,,False,False,True,EX001;EX008
TXN000749,INVALID,99/99/9999,2026-02,AUS01,5610,CC1100,Accenture Pty,INV53073,PO8571,USD,11355.11,INPUT,Payment for license,API Import,,,2026,02,11355.11,False,payment for license,2026-02-22 23:27:14.356841,Raw_GL_Export.csv,83.92156862745098,2,True,AUS01,5610,True,5610,Postage and Courier,True,True,CC1100,Accenture,MAPPED,2026-02_USD,1.525,17316.54275,CONVERTED,29081.766845273953,25872.32663648796,146.0,False,,,False,False,True,EX008
TXN000750,99/99/9999,2026-13-45,2026-02,AUS01,5310,CC3100,Regus Australia,INV60466,PO4242,USD,26113.65,GST,Payment for goods,SAP,,,2026,02,26113.65,False,payment for goods,2026-02-22 23:27:14.356841,Raw_GL_Export.csv,83.92156862745098,2,True,AUS01,5310,True,5310,Legal Fees,True,True,CC3100,Regus,MAPPED,2026-02_USD,1.525,39823.31625,CONVERTED,33139.04129260232,28423.631835285127,171.0,False,,,False,False,True,EX008
TXN000751,2026-13-45,32/13/2026,2025-07,AUS01,5910,CC2000,Adobe,INV73418,PO4076,GBP,14581.7,EXPORT,Payment for license,Manual Entry,,,2025,07,14581.7,False,payment for license,2026-02-22 23:27:14.356841,Raw_GL_Export.csv,83.92156862745098,2,True,AUS01,5910,True,5910,Interest Expense,True,True,CC2000,Adobe Systems,MAPPED,2025-07_GBP,1.958,28550.9686,CONVERTED,33774.54824600841,21661.31598456901,119.0,False,,,False,False,True,EX008
TXN000752,INVALID,2026-13-45,2026-02,AUS01,5420,CC4100,Deloitte Touche,INV95912,PO6527,GBP,5390.08,INPUT,Payment for subscription,Oracle,,,2026,02,5390.08,False,payment for subscription,2026-02-22 23:27:14.356841,Raw_GL_Export.csv,83.92156862745098,2,True,AUS01,5420,True,5420,Meals and Entertainment,True,True,CC4100,Deloitte,MAPPED,2026-02_GBP,1.955,10537.6064,CONVERTED,30119.54810314684,25344.73848974119,143.0,False,,,False,False,True,EX008
TXN000753,99/99/9999,99/99/9999,2026-02,AUS01,5900,CC3200,LinkedIn Corp,INV78035,,AUD,30093.77,INPUT,Payment for subscription,Manual Entry,,,2026,02,30093.77,False,payment for subscription,2026-02-22 23:27:14.356841,Raw_GL_Export.csv,83.92156862745098,2,True,AUS01,5900,True,5900,Bank Charges,True,True,CC3200,LinkedIn,MAPPED,2026-02_AUD,1.0,30093.77,DOMESTIC,31670.032329854675,24882.231532617723,172.0,False,,,False,False,True,EX001;EX008
TXN000754,32/13/2026,2026-13-45,2025-12,AUS01,5100,CC2000,LinkedIn Corp,INV26554,PO6030,AUD,5500.47,INPUT,Payment for consulting,Manual Entry,,,2025,12,5500.47,False,payment for consulting,2026-02-22 23:27:14.356841,Raw_GL_Export.csv,83.92156862745098,2,True,AUS01,5100,True,5100,Office Rent,True,True,CC2000,LinkedIn,MAPPED,2025-12_AUD,1.0,5500.47,DOMESTIC,29138.02959753333,27547.65120166844,150.0,False,,,False,False,True,EX008
TXN000755,32/13/2026,2026-13-45,2026-02,AUS01,5400,CC4000,SAP,INV12191,,USD,37816.58,GST-FREE,Payment for subscription,API Import,,,2026,02,37816.58,False,payment for subscription,2026-02-22 23:27:14.356841,Raw_GL_Export.csv,83.92156862745098,2,True,AUS01,5400,True,5400,Travel,True,True,CC4000,SAP SE,MAPPED,2026-02_USD,1.525,57670.2845,CONVERTED,31663.682660000006,30146.476988256833,133.0,False,,,False,False,True,EX001;EX004;EX008
TXN000756,2026-13-45,32/13/2026,2025-12,AUS01,5900,CC4000,Regus Australia,INV59082,,USD,31246.89,GST-FREE,Payment for goods,API Import,,,2025,12,31246.89,False,payment for goods,2026-02-22 23:27:14.356841,Raw_GL_Export.csv,83.92156862745098,2,True,AUS01,5900,True,5900,Bank Charges,True,True,CC4000,Regus,MAPPED,2025-12_USD,1.523,47589.01347,CONVERTED,31670.032329854675,24882.231532617723,172.0,False,,,False,False,True,EX001;EX008
TXN000757,2026-13-45,2026-13-45,2025-09,AUS01,5520,CC4100,Telstra Corp,INV48862,PO9548,USD,12601.12,EXPORT,Payment for consulting,Manual Entry,,,2025,09,12601.12,False,payment for consulting,2026-02-22 23:27:14.356841,Raw_GL_Export.csv,83.92156862745098,2,True,AUS01,5520,True,5520,Events,True,True,CC4100,Telstra,MAPPED,2025-09_USD,1.519,19141.10128,CONVERTED,30860.276023483882,21900.267908653983,155.0,False,,,False,False,True,EX008
TXN000758,INVALID,99/99/9999,2026-02,AUS01,5110,CC2100,AWS,INV37361,PO2094,AUD,11384.68,INPUT,Payment for services,Manual Entry,,,2026,02,11384.68,False,payment for services,2026-02-22 23:27:14.356841,Raw_GL_Export.csv,83.92156862745098,2,True,AUS01,5110,True,5110,Utilities,True,True,CC2100,Amazon Web Services,MAPPED,2026-02_AUD,1.0,11384.68,DOMESTIC,27865.288293732876,21409.69928933269,146.0,False,,,False,False,True,EX008
TXN000759,2026-13-45,2026-13-45,2026-02,AUS01,5500,CC1200,Accenture Pty,INV61249,PO5072,GBP,35405.45,EXPORT,Payment for subscription,SAP,,,2026,02,35405.45,False,payment for subscription,2026-02-22 23:27:14.356841,Raw_GL_Export.csv,83.92156862745098,2,True,AUS01,5500,True,5500,Marketing,True,True,CC1200,Accenture,MAPPED,2026-02_GBP,1.955,69217.65475,CONVERTED,28972.634359125877,32785.70497360227,143.0,False,,,False,False,True,EX004;EX008
TXN000760,2026-13-45,99/99/9999,2025-06,AUS01,5110,CC3100,Atlassian Pty,INV98111,,USD,9341.82,GST-FREE,Payment for subscription,SAP,,,2025,06,9341.82,False,payment for subscription,2026-02-22 23:27:14.356841,Raw_GL_Export.csv,83.92156862745098,2,True,AUS01,5110,True,5110,Utilities,True,True,CC3100,Atlassian,MAPPED,2025-06_USD,1.522,14218.250039999999,CONVERTED,27865.288293732876,21409.69928933269,146.0,False,,,False,False,True,EX001;EX008
TXN000761,32/13/2026,99/99/9999,2026-02,AUS01,5510,CC1100,Seek Limited,INV26366,PO8444,USD,29752.92,INPUT,Payment for goods,SAP,,,2026,02,29752.92,False,payment for goods,2026-02-22 23:27:14.356841,Raw_GL_Export.csv,83.92156862745098,2,True,AUS01,5510,True,5510,Advertising,True,True,CC1100,Seek,MAPPED,2026-02_USD,1.525,45373.202999999994,CONVERTED,28498.583342781956,23667.16979723599,133.0,False,,,False,False,True,EX008
TXN000762,99/99/9999,99/99/9999,2025-12,AUS01,5010,CC3100,Deloitte Touche,INV86674,,AUD,28247.74,EXPORT,Payment for consulting,Workday,,,2025,12,28247.74,False,payment for consulting,2026-02-22 23:27:14.356841,Raw_GL_Export.csv,83.92156862745098,2,True,AUS01,5010,True,5010,Employee Benefits,True,True,CC3100,Deloitte,MAPPED,2025-12_AUD,1.0,28247.74,DOMESTIC,27923.213086278203,19430.63083039902,133.0,False,,,False,False,True,EX001;EX008
TXN000763,2026-13-45,32/13/2026,2026-02,AUS01,5020,CC4100,Regus Australia,INV66685,PO2723,USD,39134.32,EXPORT,Payment for subscription,Workday,,,2026,02,39134.32,False,payment for subscription,2026-02-22 23:27:14.356841,Raw_GL_Export.csv,83.92156862745098,2,True,AUS01,5020,True,5020,Contractor Fees,True,True,CC4100,Regus,MAPPED,2026-02_USD,1.525,59679.837999999996,CONVERTED,28445.577844280295,21241.721119146277,132.0,False,,,False,False,True,EX004;EX008
TXN000764,99/99/9999,99/99/9999,2026-02,AUS01,5410,CC2100,WeWork Australia,INV41816,PO4627,AUD,680.38,EXPORT,Payment for license,Manual Entry,,,2026,02,680.38,False,payment for license,2026-02-22 23:27:14.356841,Raw_GL_Export.csv,83.92156862745098,2,True,AUS01,5410,True,5410,Accommodation,True,True,CC2100,WeWork,MAPPED,2026-02_AUD,1.0,680.38,DOMESTIC,29277.518810999987,22143.12829502557,155.0,False,,,False,False,True,EX008
TXN000765,99/99/9999,32/13/2026,2026-02,AUS01,5810,CC3200,Federal Express,INV87377,PO2615,GBP,1990.35,GST,Payment for license,SAP,,,2026,02,1990.35,False,payment for license,2026-02-22 23:27:14.356841,Raw_GL_Export.csv,83.92156862745098,2,True,AUS01,5810,True,5810,Amortization,True,True,CC3200,FedEx,MAPPED,2026-02_GBP,1.955,3891.13425,CONVERTED,31768.91314562501,27328.351394475325,120.0,False,,,False,False,True,EX008
TXN000766,32/13/2026,2026-13-45,2026-02,AUS01,5320,CC4100,AusPost,INV55521,PO8212,GBP,32351.18,GST,Payment for consulting,API Import,,,2026,02,32351.18,False,payment for consulting,2026-02-22 23:27:14.356841,Raw_GL_Export.csv,83.92156862745098,2,True,AUS01,5320,True,5320,Audit Fees,True,True,CC4100,Australia Post,MAPPED,2026-02_GBP,1.955,63246.5569,CONVERTED,31658.610713475173,32284.527206153973,141.0,False,,,False,False,True,EX004;EX008
TXN000767,32/13/2026,INVALID,2025-07,AUS01,5910,CC3100,Amazon,INV92643,PO2618,USD,25555.16,GST,Payment for subscription,Manual Entry,,,2025,07,25555.16,False,payment for subscription,2026-02-22 23:27:14.356841,Raw_GL_Export.csv,83.92156862745098,2,True,AUS01,5910,True,5910,Interest Expense,True,True,CC3100,Amazon Web Services,MAPPED,2025-07_USD,1.528,39048.28448,CONVERTED,33774.54824600841,21661.31598456901,119.0,False,,,False,False,True,EX008
TXN000768,32/13/2026,INVALID,2026-01,AUS01,5920,CC2100,WeWork Australia,INV46258,PO1783,NZD,15921.79,GST-FREE,Payment for subscription,Manual Entry,,,2026,01,15921.79,False,payment for subscription,2026-02-22 23:27:14.356841,Raw_GL_Export.csv,83.92156862745098,2,True,AUS01,5920,True,5920,FX Loss,True,True,CC2100,WeWork,MAPPED,2026-01_NZD,0.9335,14862.990965,CONVERTED,27533.92400565971,21784.021192347693,144.0,False,,,False,False,True,EX008
TXN000769,99/99/9999,2026-13-45,2026-02,AUS01,5200,CC4000,McKinsey,INV75514,PO6468,GBP,33924.03,GST-FREE,Payment for subscription,API Import,,,2026,02,33924.03,False,payment for subscription,2026-02-22 23:27:14.356841,Raw_GL_Export.csv,83.92156862745098,2,True,AUS01,5200,True,5200,Software Licenses,True,True,CC4000,McKinsey & Company,MAPPED,2026-02_GBP,1.955,66321.47865,CONVERTED,30196.543712413786,22166.314759696765,145.0,False,,,False,False,True,EX004;EX008
TXN000770,2026-13-45,99/99/9999,2026-01,AUS01,5910,CC2100,GCP,INV91500,PO4050,AUD,28811.38,INPUT,Payment for consulting,Oracle,,,2026,01,28811.38,False,payment for consulting,2026-02-22 23:27:14.356841,Raw_GL_Export.csv,83.92156862745098,2,True,AUS01,5910,True,5910,Interest Expense,True,True,CC2100,Google Cloud,MAPPED,2026-01_AUD,1.0,28811.38,DOMESTIC,33774.54824600841,21661.31598456901,119.0,False,,,False,False,True,EX008
TXN000771,99/99/9999,INVALID,2026-02,AUS01,5320,CC3000,Optus Pty,INV52304,,NZD,33989.21,GST-FREE,Payment for goods,API Import,,,2026,02,33989.21,False,payment for goods,2026-02-22 23:27:14.356841,Raw_GL_Export.csv,83.92156862745098,2,True,AUS01,5320,True,5320,Audit Fees,True,True,CC3000,Optus,MAPPED,2026-02_NZD,0.932,31677.94372,CONVERTED,31658.610713475173,32284.527206153973,141.0,False,,,False,False,True,EX001;EX008
TXN000772,99/99/9999,99/99/9999,2026-02,AUS01,5810,CC4000,Oracle,INV36033,,GBP,27869.35,GST,Payment for license,Manual Entry,,,2026,02,27869.35,False,payment for license,2026-02-22 23:27:14.356841,Raw_GL_Export.csv,83.92156862745098,2,True,AUS01,5810,True,5810,Amortization,True,True,CC4000,Oracle Corporation,MAPPED,2026-02_GBP,1.955,54484.57925,CONVERTED,31768.91314562501,27328.351394475325,120.0,False,,,False,False,True,EX001;EX004;EX008
TXN000773,99/99/9999,2026-13-45,2025-07,AUS01,5710,CC3000,WeWork Australia,INV23582,PO5815,GBP,6073.15,EXPORT,Payment for license,API Import,,,2025,07,6073.15,False,payment for license,2026-02-22 23:27:14.356841,Raw_GL_Export.csv,83.92156862745098,2,True,AUS01,5710,True,5710,Recruitment,True,True,CC3000,WeWork,MAPPED,2025-07_GBP,1.958,11891.2277,CONVERTED,29496.09592285716,24753.031499859637,133.0,False,,,False,False,True,EX008
TXN000774,32/13/2026,99/99/9999,2025-08,AUS01,5210,CC3200,Microsoft,INV13454,PO4587,USD,24704.63,INPUT,Payment for goods,Oracle,,,2025,08,24704.63,False,payment for goods,2026-02-22 23:27:14.356841,Raw_GL_Export.csv,83.92156862745098,2,True,AUS01,5210,True,5210,Cloud Services,True,True,CC3200,Microsoft Corporation,MAPPED,2025-08_USD,1.524,37649.856120000004,CONVERTED,31620.56664919015,27460.393400888206,142.0,False,,,False,False,True,EX008
TXN000775,INVALID,2026-13-45,2025-04,AUS01,5110,CC1000,KPMG Australia,INV67534,PO4149,USD,43410.11,EXPORT,Payment for consulting,Oracle,,,2025,04,43410.11,False,payment for consulting,2026-02-22 23:27:14.356841,Raw_GL_Export.csv,83.92156862745098,2,True,AUS01,5110,True,5110,Utilities,True,True,CC1000,KPMG,MAPPED,2025-04_USD,1.525,66200.41775,CONVERTED,27865.288293732876,21409.69928933269,146.0,False,,,False,False,True,EX004;EX008
TXN000776,INVALID,INVALID,2026-01,AUS01,5800,CC2100,Regus Australia,INV40763,PO6850,NZD,19466.03,INPUT,Payment for services,Oracle,,,2026,01,19466.03,False,payment for services,2026-02-22 23:27:14.356841,Raw_GL_Export.csv,83.92156862745098,2,True,AUS01,5800,True,5800,Depreciation,True,True,CC2100,Regus,MAPPED,2026-01_NZD,0.9335,18171.539005,CONVERTED,30184.39373025477,34245.09535020032,157.0,False,,,False,False,True,EX008
TXN000777,11/02/2026,02/02/2026,2026-02,AUS01,5600,CC1200,GCP,INV80170,PO4732,EUR,44147.4,EXPORT,Payment for subscription,API Import,2026-02-11,2026-02-02,2026,02,44147.4,False,payment for subscription,2026-02-22 23:27:14.356841,Raw_GL_Export.csv,83.92156862745098,0,True,AUS01,5600,True,5600,Telecommunications,True,True,CC1200,Google Cloud,MAPPED,2026-02_EUR,,,FAILED,32190.120230168057,26805.910450208805,119.0,False,0.0,Wednesday,False,True,False,
TXN000778,27/02/2026,19/02/2026,2026-02,AUS01,5220,CC4100,MSFT,INV75160,PO2059,EUR,20764.73,EXPORT,Payment for goods,SAP,2026-02-27,2026-02-19,2026,02,20764.73,False,payment for goods,2026-02-22 23:27:14.356841,Raw_GL_Export.csv,83.92156862745098,0,True,AUS01,5220,True,5220,IT Support,True,True,CC4100,Microsoft Corporation,MAPPED,2026-02_EUR,,,FAILED,29540.94372533058,19404.169897416657,121.0,False,0.0,Friday,False,True,False,
TXN000779,18-02-2026,09-02-2026,2026-02,AUS01,5620,CC1000,WeWork Australia,INV18359,PO2071,EUR,21500.53,GST-FREE,Payment for subscription,API Import,2026-02-18,2026-02-09,2026,02,21500.53,False,payment for subscription,2026-02-22 23:27:14.356841,Raw_GL_Export.csv,83.92156862745098,0,True,AUS01,5620,True,5620,Insurance,True,True,CC1000,WeWork,MAPPED,2026-02_EUR,,,FAILED,32410.971605588227,27490.799177232966,170.0,False,0.0,Wednesday,False,True,False,
TXN000780,2025-05-09,2025-04-29,2025-05,AUS01,5500,CC3100,Slack,INV96743,PO9821,EUR,44380.68,GST-FREE,Payment for subscription,Workday,2025-05-09,2025-04-29,2025,05,44380.68,False,payment for subscription,2026-02-22 23:27:14.356841,Raw_GL_Export.csv,83.92156862745098,0,True,AUS01,5500,True,5500,Marketing,True,True,CC3100,Slack Technologies,MAPPED,2025-05_EUR,,,FAILED,28972.634359125877,32785.70497360227,143.0,False,0.0,Friday,False,True,False,
TXN000781,08-04-2025,05-04-2025,2025-04,AUS01,5810,CC4000,McKinsey,INV56969,PO2163,EUR,38836.76,GST,Payment for license,SAP,2025-04-08,2025-04-05,2025,04,38836.76,False,payment for license,2026-02-22 23:27:14.356841,Raw_GL_Export.csv,83.92156862745098,0,True,AUS01,5810,True,5810,Amortization,True,True,CC4000,McKinsey & Company,MAPPED,2025-04_EUR,,,FAILED,31768.91314562501,27328.351394475325,120.0,False,0.0,Tuesday,False,True,False,
TXN000782,17-02-2026,14-02-2026,2026-02,AUS01,5800,CC2000,Accenture Pty,INV33755,,EUR,44092.21,GST-FREE,Payment for consulting,SAP,2026-02-17,2026-02-14,2026,02,44092.21,False,payment for consulting,2026-02-22 23:27:14.356841,Raw_GL_Export.csv,83.92156862745098,0,True,AUS01,5800,True,5800,Depreciation,True,True,CC2000,Accenture,MAPPED,2026-02_EUR,,,FAILED,30184.39373025477,34245.09535020032,157.0,False,0.0,Tuesday,False,True,True,EX001
TXN000783,2025-08-11,2025-08-09,2025-08,AUS01,5400,CC4100,Federal Express,INV72181,,EUR,36240.64,EXPORT,Payment for subscription,Oracle,2025-08-11,2025-08-09,2025,08,36240.64,False,payment for subscription,2026-02-22 23:27:14.356841,Raw_GL_Export.csv,83.92156862745098,0,True,AUS01,5400,True,5400,Travel,True,True,CC4100,FedEx,MAPPED,2025-08_EUR,,,FAILED,31663.682660000006,30146.476988256833,133.0,False,0.0,Monday,False,True,True,EX001
TXN000784,01/04/2026,12/29/2025,2026-01,AUS01,5120,CC3100,Deloitte Touche,INV44144,PO4713,EUR,22535.71,GST-FREE,Payment for subscription,SAP,2026-04-01,2025-12-29,2026,01,22535.71,False,payment for subscription,2026-02-22 23:27:14.356841,Raw_GL_Export.csv,83.92156862745098,1,True,AUS01,5120,True,5120,Office Supplies,True,True,CC3100,Deloitte,MAPPED,2026-01_EUR,,,FAILED,34269.00595485611,35424.20705021751,139.0,False,0.0,Wednesday,False,True,False,
TXN000785,11-01-2026,09-01-2026,2026-01,AUS01,5510,CC2100,Amazon,INV83023,,EUR,39580.63,GST,Payment for subscription,SAP,2026-01-11,2026-01-09,2026,01,39580.63,False,payment for subscription,2026-02-22 23:27:14.356841,Raw_GL_Export.csv,83.92156862745098,0,True,AUS01,5510,True,5510,Advertising,True,True,CC2100,Amazon Web Services,MAPPED,2026-01_EUR,,,FAILED,28498.583342781956,23667.16979723599,133.0,False,0.0,Sunday,True,True,True,EX001
TXN000786,2026-01-06,2025-12-28,2026-01,AUS01,5000,CC1000,McKinsey,INV84459,PO2136,EUR,17375.43,GST,Payment for goods,Oracle,2026-01-06,2025-12-28,2026,01,17375.43,False,payment for goods,2026-02-22 23:27:14.356841,Raw_GL_Export.csv,83.92156862745098,0,True,AUS01,5000,True,5000,Salaries and Wages,True,True,CC1000,McKinsey & Company,MAPPED,2026-01_EUR,,,FAILED,30471.385558248177,22939.768434623154,137.0,False,0.0,Tuesday,False,True,False,
TXN000787,21-02-2026,18-02-2026,2026-02,AUS01,5520,CC2000,WeWork Australia,INV88606,PO3898,EUR,4453.76,GST-FREE,Payment for consulting,Oracle,2026-02-21,2026-02-18,2026,02,4453.76,False,payment for consulting,2026-02-22 23:27:14.356841,Raw_GL_Export.csv,83.92156862745098,0,True,AUS01,5520,True,5520,Events,True,True,CC2000,WeWork,MAPPED,2026-02_EUR,,,FAILED,30860.276023483882,21900.267908653983,155.0,False,0.0,Saturday,True,True,False,
TXN000788,17/07/2025,09/07/2025,2025-07,AUS01,5000,CC4100,Microsoft,INV50850,PO2765,EUR,42094.66,GST,Payment for subscription,Oracle,2025-07-17,2025-07-09,2025,07,42094.66,False,payment for subscription,2026-02-22 23:27:14.356841,Raw_GL_Export.csv,83.92156862745098,0,True,AUS01,5000,True,5000,Salaries and Wages,True,True,CC4100,Microsoft Corporation,MAPPED,2025-07_EUR,,,FAILED,30471.385558248177,22939.768434623154,137.0,False,0.0,Thursday,False,True,False,
TXN000789,19/02/2026,17/02/2026,2026-02,AUS01,5500,CC2000,Zoom,INV69594,PO9978,EUR,44880.65,INPUT,Payment for consulting,Manual Entry,2026-02-19,2026-02-17,2026,02,44880.65,False,payment for consulting,2026-02-22 23:27:14.356841,Raw_GL_Export.csv,83.92156862745098,0,True,AUS01,5500,True,5500,Marketing,True,True,CC2000,Zoom Video Communications,MAPPED,2026-02_EUR,,,FAILED,28972.634359125877,32785.70497360227,143.0,False,0.0,Thursday,False,True,False,
TXN000790,2026-02-04,2026-01-29,2026-02,AUS01,5210,CC3000,Zoom,INV34686,PO1681,EUR,10851.37,EXPORT,Payment for subscription,SAP,2026-02-04,2026-01-29,2026,02,10851.37,False,payment for subscription,2026-02-22 23:27:14.356841,Raw_GL_Export.csv,83.92156862745098,0,True,AUS01,5210,True,5210,Cloud Services,True,True,CC3000,Zoom Video Communications,MAPPED,2026-02_EUR,,,FAILED,31620.56664919015,27460.393400888206,142.0,False,0.0,Wednesday,False,True,False,
TXN000791,2025-12-16,2025-12-07,2025-12,AUS01,5020,CC3000,DHL Express,INV47035,PO8338,EUR,34085.86,GST-FREE,Payment for goods,Workday,2025-12-16,2025-12-07,2025,12,34085.86,False,payment for goods,2026-02-22 23:27:14.356841,Raw_GL_Export.csv,83.92156862745098,0,True,AUS01,5020,True,5020,Contractor Fees,True,True,CC3000,DHL,MAPPED,2025-12_EUR,,,FAILED,28445.577844280295,21241.721119146277,132.0,False,0.0,Tuesday,False,True,False,
TXN000792,21-07-2025,14-07-2025,2025-07,AUS01,5410,CC3100,Google,INV23673,PO8931,EUR,22121.89,EXPORT,Payment for license,Manual Entry,2025-07-21,2025-07-14,2025,07,22121.89,False,payment for license,2026-02-22 23:27:14.356841,Raw_GL_Export.csv,83.92156862745098,0,True,AUS01,5410,True,5410,Accommodation,True,True,CC3100,Google Cloud,MAPPED,2025-07_EUR,,,FAILED,29277.518810999987,22143.12829502557,155.0,False,0.0,Monday,False,True,False,
TXN000793,10-01-2025,05-01-2025,2025-01,AUS01,5810,CC1000,Microsoft,INV50254,PO9893,EUR,8544.74,GST,Payment for goods,Workday,2025-01-10,2025-01-05,2025,01,8544.74,False,payment for goods,2026-02-22 23:27:14.356841,Raw_GL_Export.csv,83.92156862745098,0,True,AUS01,5810,True,5810,Amortization,True,True,CC1000,Microsoft Corporation,MAPPED,2025-01_EUR,,,FAILED,31768.91314562501,27328.351394475325,120.0,False,0.0,Friday,False,True,False,
TXN000794,2026-02-24,2026-02-15,2026-02,AUS01,5000,CC1000,EY Australia,INV80485,,EUR,17382.07,INPUT,Payment for consulting,API Import,2026-02-24,2026-02-15,2026,02,17382.07,False,payment for consulting,2026-02-22 23:27:14.356841,Raw_GL_Export.csv,83.92156862745098,0,True,AUS01,5000,True,5000,Salaries and Wages,True,True,CC1000,EY,MAPPED,2026-02_EUR,,,FAILED,30471.385558248177,22939.768434623154,137.0,False,0.0,Tuesday,False,True,True,EX001
TXN000795,17/01/2026,08/01/2026,2026-01,AUS01,5320,CC1000,Workday,INV39041,PO2195,EUR,4529.42,GST-FREE,Payment for goods,Manual Entry,2026-01-17,2026-01-08,2026,01,4529.42,False,payment for goods,2026-02-22 23:27:14.356841,Raw_GL_Export.csv,83.92156862745098,0,True,AUS01,5320,True,5320,Audit Fees,True,True,CC1000,Workday Inc,MAPPED,2026-01_EUR,,,FAILED,31658.610713475173,32284.527206153973,141.0,False,0.0,Saturday,True,True,False,
TXN000796,2025-12-07,2025-12-06,2025-12,AUS01,5400,CC2000,Atlassian Pty,INV41508,PO6419,EUR,41601.62,GST,Payment for goods,Manual Entry,2025-12-07,2025-12-06,2025,12,41601.62,False,payment for goods,2026-02-22 23:27:14.356841,Raw_GL_Export.csv,83.92156862745098,0,True,AUS01,5400,True,5400,Travel,True,True,CC2000,Atlassian,MAPPED,2025-12_EUR,,,FAILED,31663.682660000006,30146.476988256833,133.0,False,0.0,Sunday,True,True,False,
TXN000797,27/01/2026,21/01/2026,2026-01,AUS01,5910,CC3100,Microsoft,INV91495,PO7927,EUR,7101.21,GST-FREE,Payment for license,Workday,2026-01-27,2026-01-21,2026,01,7101.21,False,payment for license,2026-02-22 23:27:14.356841,Raw_GL_Export.csv,83.92156862745098,0,True,AUS01,5910,True,5910,Interest Expense,True,True,CC3100,Microsoft Corporation,MAPPED,2026-01_EUR,,,FAILED,33774.54824600841,21661.31598456901,119.0,False,0.0,Tuesday,False,True,False,
TXN000798,02/07/2026,01/31/2026,2026-02,AUS01,5710,CC1000,AusPost,INV46449,PO4104,EUR,37077.62,EXPORT,Payment for consulting,Workday,2026-07-02,2026-01-31,2026,02,37077.62,False,payment for consulting,2026-02-22 23:27:14.356841,Raw_GL_Export.csv,83.92156862745098,1,True,AUS01,5710,True,5710,Recruitment,True,True,CC1000,Australia Post,MAPPED,2026-02_EUR,,,FAILED,29496.09592285716,24753.031499859637,133.0,False,0.0,Thursday,False,True,True,EX007
TXN000799,2026-02-20,2026-02-13,2026-02,AUS01,5010,CC3200,Slack,INV19243,PO2888,EUR,29867.04,GST-FREE,Payment for goods,Manual Entry,2026-02-20,2026-02-13,2026,02,29867.04,False,payment for goods,2026-02-22 23:27:14.356841,Raw_GL_Export.csv,83.92156862745098,0,True,AUS01,5010,True,5010,Employee Benefits,True,True,CC3200,Slack Technologies,MAPPED,2026-02_EUR,,,FAILED,27923.213086278203,19430.63083039902,133.0,False,0.0,Friday,False,True,False,
TXN000800,03/02/2025,25/01/2025,2025-02,AUS01,5310,CC1200,Deloitte Touche,INV47330,PO5664,EUR,42993.74,EXPORT,Payment for license,Workday,2025-02-03,2025-01-25,2025,02,42993.74,False,payment for license,2026-02-22 23:27:14.356841,Raw_GL_Export.csv,83.92156862745098,0,True,AUS01,5310,True,5310,Legal Fees,True,True,CC1200,Deloitte,MAPPED,2025-02_EUR,,,FAILED,33139.04129260232,28423.631835285127,171.0,False,0.0,Monday,False,True,False,
TXN000801,2025-09-04,2025-08-28,2025-09,AUS01,5910,CC2000,Google,INV36317,,EUR,25008.27,EXPORT,Payment for services,Manual Entry,2025-09-04,2025-08-28,2025,09,25008.27,False,payment for services,2026-02-22 23:27:14.356841,Raw_GL_Export.csv,83.92156862745098,0,True,AUS01,5910,True,5910,Interest Expense,True,True,CC2000,Google Cloud,MAPPED,2025-09_EUR,,,FAILED,33774.54824600841,21661.31598456901,119.0,False,0.0,Thursday,False,True,True,EX001
TXN000802,2025-01-16,2025-01-14,2025-01,AUS01,5210,CC1000,Federal Express,INV41686,PO7076,EUR,8383.08,GST,Payment for consulting,Oracle,2025-01-16,2025-01-14,2025,01,8383.08,False,payment for consulting,2026-02-22 23:27:14.356841,Raw_GL_Export.csv,83.92156862745098,0,True,AUS01,5210,True,5210,Cloud Services,True,True,CC1000,FedEx,MAPPED,2025-01_EUR,,,FAILED,31620.56664919015,27460.393400888206,142.0,False,0.0,Thursday,False,True,False,
TXN000803,2026-01-15,2026-01-06,2026-01,AUS01,5810,CC2000,Workday,INV84553,,EUR,32648.47,GST,Payment for goods,Workday,2026-01-15,2026-01-06,2026,01,32648.47,False,payment for goods,2026-02-22 23:27:14.356841,Raw_GL_Export.csv,83.92156862745098,0,True,AUS01,5810,True,5810,Amortization,True,True,CC2000,Workday Inc,MAPPED,2026-01_EUR,,,FAILED,31768.91314562501,27328.351394475325,120.0,False,0.0,Thursday,False,True,True,EX001
TXN000804,02/28/2026,02/25/2026,2026-02,AUS01,5320,CC3200,SAP,INV61290,PO5780,EUR,40580.17,GST,Payment for license,SAP,2026-02-28,2026-02-25,2026,02,40580.17,False,payment for license,2026-02-22 23:27:14.356841,Raw_GL_Export.csv,83.92156862745098,0,True,AUS01,5320,True,5320,Audit Fees,True,True,CC3200,SAP SE,MAPPED,2026-02_EUR,,,FAILED,31658.610713475173,32284.527206153973,141.0,False,0.0,Saturday,True,True,False,
TXN000805,08/02/2026,04/02/2026,2026-02,AUS01,5310,CC3200,Amazon,INV42214,PO5715,EUR,39223.05,GST,Payment for license,Oracle,2026-02-08,2026-02-04,2026,02,39223.05,False,payment for license,2026-02-22 23:27:14.356841,Raw_GL_Export.csv,83.92156862745098,0,True,AUS01,5310,True,5310,Legal Fees,True,True,CC3200,Amazon Web Services,MAPPED,2026-02_EUR,,,FAILED,33139.04129260232,28423.631835285127,171.0,False,0.0,Sunday,True,True,False,
TXN000806,12/05/2025,12/04/2025,2025-12,AUS01,5100,CC1100,AusPost,INV91079,PO6270,EUR,23360.32,GST,Payment for subscription,SAP,2025-05-12,2025-04-12,2025,12,23360.32,False,payment for subscription,2026-02-22 23:27:14.356841,Raw_GL_Export.csv,83.92156862745098,1,True,AUS01,5100,True,5100,Office Rent,True,True,CC1100,Australia Post,MAPPED,2025-12_EUR,,,FAILED,29138.02959753333,27547.65120166844,150.0,False,0.0,Monday,False,True,False,
TXN000807,2026-01-05,2026-01-01,2026-01,AUS01,5000,CC3100,AWS,INV84311,,EUR,25365.75,EXPORT,Payment for goods,SAP,2026-01-05,2026-01-01,2026,01,25365.75,False,payment for goods,2026-02-22 23:27:14.356841,Raw_GL_Export.csv,83.92156862745098,0,True,AUS01,5000,True,5000,Salaries and Wages,True,True,CC3100,Amazon Web Services,MAPPED,2026-01_EUR,,,FAILED,30471.385558248177,22939.768434623154,137.0,False,0.0,Monday,False,True,True,EX001
TXN000808,2025-05-19,2025-05-18,2025-05,AUS01,5620,CC3200,Federal Express,INV68939,PO4893,EUR,12782.83,EXPORT,Payment for consulting,API Import,2025-05-19,2025-05-18,2025,05,12782.83,False,payment for consulting,2026-02-22 23:27:14.356841,Raw_GL_Export.csv,83.92156862745098,0,True,AUS01,5620,True,5620,Insurance,True,True,CC3200,FedEx,MAPPED,2025-05_EUR,,,FAILED,32410.971605588227,27490.799177232966,170.0,False,0.0,Monday,False,True,False,
TXN000809,02/09/2026,02/01/2026,2026-01,AUS01,5500,CC1200,LinkedIn Corp,INV93505,PO7364,NZD,10150.41,INPUT,Payment for subscription,Oracle,2026-09-02,2026-01-02,2026,01,10150.41,False,payment for subscription,2026-02-22 23:27:14.356841,Raw_GL_Export.csv,83.92156862745098,1,True,AUS01,5500,True,5500,Marketing,True,True,CC1200,LinkedIn,MAPPED,2026-01_NZD,0.9335,9475.407735,CONVERTED,28972.634359125877,32785.70497360227,143.0,False,0.0,Wednesday,False,True,False,
TXN000810,2026-03-12,2026-03-05,2026-02,AUS01,5900,CC2100,Zoom,INV62721,,AUD,20750.95,GST-FREE,Payment for subscription,Oracle,2026-03-12,2026-03-05,2026,02,20750.95,False,payment for subscription,2026-02-22 23:27:14.356841,Raw_GL_Export.csv,83.92156862745098,1,True,AUS01,5900,True,5900,Bank Charges,True,True,CC2100,Zoom Video Communications,MAPPED,2026-02_AUD,1.0,20750.95,DOMESTIC,31670.032329854675,24882.231532617723,172.0,False,0.0,Thursday,False,True,True,EX001;EX007
TXN000811,13-02-2025,06-02-2025,2025-01,AUS01,5420,CC3200,Optus Pty,INV52730,PO3180,GBP,20911.92,INPUT,Payment for license,Oracle,2025-02-13,2025-02-06,2025,01,20911.92,False,payment for license,2026-02-22 23:27:14.356841,Raw_GL_Export.csv,83.92156862745098,1,True,AUS01,5420,True,5420,Meals and Entertainment,True,True,CC3200,Optus,MAPPED,2025-01_GBP,1.95,40778.244,CONVERTED,30119.54810314684,25344.73848974119,143.0,False,0.0,Thursday,False,True,False,
TXN000812,08/03/2026,04/03/2026,2026-02,AUS01,5600,CC2000,Regus Australia,INV59127,PO4498,GBP,24714.43,EXPORT,Payment for consulting,Oracle,2026-03-08,2026-03-04,2026,02,24714.43,False,payment for consulting,2026-02-22 23:27:14.356841,Raw_GL_Export.csv,83.92156862745098,1,True,AUS01,5600,True,5600,Telecommunications,True,True,CC2000,Regus,MAPPED,2026-02_GBP,1.955,48316.71065,CONVERTED,32190.120230168057,26805.910450208805,119.0,False,0.0,Sunday,True,True,True,EX007
TXN000813,2025-05-16,2025-05-07,2025-04,AUS01,5620,CC3200,EY Australia,INV54260,PO3567,GBP,2384.77,GST-FREE,Payment for consulting,API Import,2025-05-16,2025-05-07,2025,04,2384.77,False,payment for consulting,2026-02-22 23:27:14.356841,Raw_GL_Export.csv,83.92156862745098,1,True,AUS01,5620,True,5620,Insurance,True,True,CC3200,EY,MAPPED,2025-04_GBP,1.955,4662.22535,CONVERTED,32410.971605588227,27490.799177232966,170.0,False,0.0,Friday,False,True,False,
TXN000814,14/03/2026,06/03/2026,2026-02,AUS01,5000,CC2000,Federal Express,INV94048,PO4240,USD,12372.07,GST-FREE,Payment for goods,Manual Entry,2026-03-14,2026-03-06,2026,02,12372.07,False,payment for goods,2026-02-22 23:27:14.356841,Raw_GL_Export.csv,83.92156862745098,1,True,AUS01,5000,True,5000,Salaries and Wages,True,True,CC2000,FedEx,MAPPED,2026-02_USD,1.525,18867.40675,CONVERTED,30471.385558248177,22939.768434623154,137.0,False,0.0,Saturday,True,True,True,EX007
TXN000815,11-03-2026,07-03-2026,2026-02,AUS01,5920,CC1200,Hays,INV98629,,NZD,27505.08,GST,Payment for services,SAP,2026-03-11,2026-03-07,2026,02,27505.08,False,payment for services,2026-02-22 23:27:14.356841,Raw_GL_Export.csv,83.92156862745098,1,True,AUS01,5920,True,5920,FX Loss,True,True,CC1200,Hays Recruitment,MAPPED,2026-02_NZD,0.932,25634.734560000004,CONVERTED,27533.92400565971,21784.021192347693,144.0,False,0.0,Wednesday,False,True,True,EX001;EX007
TXN000816,2025-09-01,2025-08-31,2025-08,AUS01,5310,CC1100,McKinsey,INV37919,PO2081,NZD,9215.02,GST-FREE,Payment for subscription,API Import,2025-09-01,2025-08-31,2025,08,9215.02,False,payment for subscription,2026-02-22 23:27:14.356841,Raw_GL_Export.csv,83.92156862745098,1,True,AUS01,5310,True,5310,Legal Fees,True,True,CC1100,McKinsey & Company,MAPPED,2025-08_NZD,0.93,8569.9686,CONVERTED,33139.04129260232,28423.631835285127,171.0,False,0.0,Monday,False,True,False,
TXN000817,11-03-2026,03-03-2026,2026-02,AUS01,5310,CC1200,KPMG Australia,INV29925,,NZD,4657.33,GST-FREE,Payment for services,API Import,2026-03-11,2026-03-03,2026,02,4657.33,False,payment for services,2026-02-22 23:27:14.356841,Raw_GL_Export.csv,83.92156862745098,1,True,AUS01,5310,True,5310,Legal Fees,True,True,CC1200,KPMG,MAPPED,2026-02_NZD,0.932,4340.63156,CONVERTED,33139.04129260232,28423.631835285127,171.0,False,0.0,Wednesday,False,True,True,EX001;EX007
TXN000818,20-05-2025,17-05-2025,2025-04,AUS01,5520,CC4000,Seek Limited,INV24858,PO3402,NZD,31079.37,GST-FREE,Payment for consulting,SAP,2025-05-20,2025-05-17,2025,04,31079.37,False,payment for consulting,2026-02-22 23:27:14.356841,Raw_GL_Export.csv,83.92156862745098,1,True,AUS01,5520,True,5520,Events,True,True,CC4000,Seek,MAPPED,2025-04_NZD,0.932,28965.972840000002,CONVERTED,30860.276023483882,21900.267908653983,155.0,False,0.0,Tuesday,False,True,False,
TXN000819,2026-02-25,2026-02-22,2026-01,AUS01,5400,CC3200,Federal Express,INV86831,PO6937,GBP,7753.56,GST,Payment for consulting,API Import,2026-02-25,2026-02-22,2026,01,7753.56,False,payment for consulting,2026-02-22 23:27:14.356841,Raw_GL_Export.csv,83.92156862745098,1,True,AUS01,5400,True,5400,Travel,True,True,CC3200,FedEx,MAPPED,2026-01_GBP,1.957,15173.71692,CONVERTED,31663.682660000006,30146.476988256833,133.0,False,0.0,Wednesday,False,True,False,
TXN000820,19/02/2026,11/02/2026,2026-01,AUS01,5000,CC3200,WeWork Australia,INV19029,,NZD,44452.91,INPUT,Payment for license,Workday,2026-02-19,2026-02-11,2026,01,44452.91,False,payment for license,2026-02-22 23:27:14.356841,Raw_GL_Export.csv,83.92156862745098,1,True,AUS01,5000,True,5000,Salaries and Wages,True,True,CC3200,WeWork,MAPPED,2026-01_NZD,0.9335,41496.791485,CONVERTED,30471.385558248177,22939.768434623154,137.0,False,0.0,Thursday,False,True,True,EX001
TXN000821,22-08-2025,19-08-2025,2025-07,AUS01,5100,CC2000,McKinsey,INV56492,PO9105,NZD,32042.23,GST,Payment for services,API Import,2025-08-22,2025-08-19,2025,07,32042.23,False,payment for services,2026-02-22 23:27:14.356841,Raw_GL_Export.csv,83.92156862745098,1,True,AUS01,5100,True,5100,Office Rent,True,True,CC2000,McKinsey & Company,MAPPED,2025-07_NZD,0.934,29927.44282,CONVERTED,29138.02959753333,27547.65120166844,150.0,False,0.0,Friday,False,True,False,
TXN000822,19-05-2025,16-05-2025,2025-04,AUS01,5320,CC2100,SAP,INV74174,PO3734,NZD,44193.43,GST,Payment for services,Oracle,2025-05-19,2025-05-16,2025,04,44193.43,False,payment for services,2026-02-22 23:27:14.356841,Raw_GL_Export.csv,83.92156862745098,1,True,AUS01,5320,True,5320,Audit Fees,True,True,CC2100,SAP SE,MAPPED,2025-04_NZD,0.932,41188.27676,CONVERTED,31658.610713475173,32284.527206153973,141.0,False,0.0,Monday,False,True,False,
TXN000823,03/23/2026,03/18/2026,2026-02,AUS01,5420,CC3100,BCG,INV96430,,AUD,12350.36,EXPORT,Payment for license,SAP,2026-03-23,2026-03-18,2026,02,12350.36,False,payment for license,2026-02-22 23:27:14.356841,Raw_GL_Export.csv,83.92156862745098,1,True,AUS01,5420,True,5420,Meals and Entertainment,True,True,CC3100,Boston Consulting Group,MAPPED,2026-02_AUD,1.0,12350.36,DOMESTIC,30119.54810314684,25344.73848974119,143.0,False,0.0,Monday,False,True,True,EX001;EX007
TXN000824,2026-03-05,2026-02-23,2026-02,AUS01,5000,CC2100,Federal Express,INV60907,,USD,40713.61,EXPORT,Payment for subscription,Manual Entry,2026-03-05,2026-02-23,2026,02,40713.61,False,payment for subscription,2026-02-22 23:27:14.356841,Raw_GL_Export.csv,83.92156862745098,1,True,AUS01,5000,True,5000,Salaries and Wages,True,True,CC2100,FedEx,MAPPED,2026-02_USD,1.525,62088.255249999995,CONVERTED,30471.385558248177,22939.768434623154,137.0,False,0.0,Thursday,False,True,True,EX001;EX004;EX007
TXN000825,02/11/2026,02/02/2026,2026-01,AUS01,5920,CC3100,AusPost,INV44286,PO9008,NZD,6042.07,INPUT,Payment for subscription,Workday,2026-11-02,2026-02-02,2026,01,6042.07,False,payment for subscription,2026-02-22 23:27:14.356841,Raw_GL_Export.csv,83.92156862745098,1,True,AUS01,5920,True,5920,FX Loss,True,True,CC3100,Australia Post,MAPPED,2026-01_NZD,0.9335,5640.272344999999,CONVERTED,27533.92400565971,21784.021192347693,144.0,False,0.0,Monday,False,True,False,
TXN000826,03-02-2026,01-02-2026,2026-01,AUS01,5900,CC3000,Robert Half International,INV24031,,AUD,1133.03,GST-FREE,Payment for goods,Workday,2026-02-03,2026-02-01,2026,01,1133.03,False,payment for goods,2026-02-22 23:27:14.356841,Raw_GL_Export.csv,83.92156862745098,1,True,AUS01,5900,True,5900,Bank Charges,True,True,CC3000,Robert Half,MAPPED,2026-01_AUD,1.0,1133.03,DOMESTIC,31670.032329854675,24882.231532617723,172.0,False,0.0,Tuesday,False,True,True,EX001
TXN000827,03/02/2026,24/01/2026,2026-01,AUS01,5900,CC2000,Google,INV54713,PO2153,AUD,533.07,GST,Payment for goods,API Import,2026-02-03,2026-01-24,2026,01,533.07,False,payment for goods,2026-02-22 23:27:14.356841,Raw_GL_Export.csv,83.92156862745098,1,True,AUS01,5900,True,5900,Bank Charges,True,True,CC2000,Google Cloud,MAPPED,2026-01_AUD,1.0,533.07,DOMESTIC,31670.032329854675,24882.231532617723,172.0,False,0.0,Tuesday,False,True,False,
TXN000828,21-02-2026,15-02-2026,2026-01,AUS01,5900,CC1100,Atlassian Pty,INV20637,,AUD,31716.23,GST-FREE,Payment for services,SAP,2026-02-21,2026-02-15,2026,01,31716.23,False,payment for services,2026-02-22 23:27:14.356841,Raw_GL_Export.csv,83.92156862745098,1,True,AUS01,5900,True,5900,Bank Charges,True,True,CC1100,Atlassian,MAPPED,2026-01_AUD,1.0,31716.23,DOMESTIC,31670.032329854675,24882.231532617723,172.0,False,0.0,Saturday,True,True,True,EX001
TXN000829,14/04/2025,10/04/2025,2025-03,AUS01,5010,CC1100,Federal Express,INV72396,PO9115,NZD,28182.78,GST-FREE,Payment for license,Oracle,2025-04-14,2025-04-10,2025,03,28182.78,False,payment for license,2026-02-22 23:27:14.356841,Raw_GL_Export.csv,83.92156862745098,1,True,AUS01,5010,True,5010,Employee Benefits,True,True,CC1100,FedEx,MAPPED,2025-03_NZD,0.935,26350.8993,CONVERTED,27923.213086278203,19430.63083039902,133.0,False,0.0,Monday,False,True,False,
TXN000830,03/16/2025,03/06/2025,2025-02,AUS01,5920,CC1000,Optus Pty,INV33049,PO5313,USD,22890.54,GST,Payment for goods,API Import,2025-03-16,2025-06-03,2025,02,22890.54,False,payment for goods,2026-02-22 23:27:14.356841,Raw_GL_Export.csv,83.92156862745098,1,True,AUS01,5920,True,5920,FX Loss,True,True,CC1000,Optus,MAPPED,2025-02_USD,1.51,34564.7154,CONVERTED,27533.92400565971,21784.021192347693,144.0,False,0.0,Sunday,True,True,False,
TXN000831,19/04/2025,17/04/2025,2025-03,AUS01,5710,CC1100,SAP,INV31289,PO5861,USD,38202.87,GST-FREE,Payment for license,Manual Entry,2025-04-19,2025-04-17,2025,03,38202.87,False,payment for license,2026-02-22 23:27:14.356841,Raw_GL_Export.csv,83.92156862745098,1,True,AUS01,5710,True,5710,Recruitment,True,True,CC1100,SAP SE,MAPPED,2025-03_USD,1.53,58450.39110000001,CONVERTED,29496.09592285716,24753.031499859637,133.0,False,0.0,Saturday,True,True,True,EX004
TXN000832,04/17/2025,04/13/2025,2025-03,AUS01,5410,CC2100,WeWork Australia,INV46890,PO2059,USD,23921.73,INPUT,Payment for services,SAP,2025-04-17,2025-04-13,2025,03,23921.73,False,payment for services,2026-02-22 23:27:14.356841,Raw_GL_Export.csv,83.92156862745098,1,True,AUS01,5410,True,5410,Accommodation,True,True,CC2100,WeWork,MAPPED,2025-03_USD,1.53,36600.2469,CONVERTED,29277.518810999987,22143.12829502557,155.0,False,0.0,Thursday,False,True,False,
TXN000833,03/16/2026,03/15/2026,2026-02,AUS01,5610,CC3100,Google,INV51733,PO6922,GBP,638.75,GST,Payment for license,SAP,2026-03-16,2026-03-15,2026,02,638.75,False,payment for license,2026-02-22 23:27:14.356841,Raw_GL_Export.csv,83.92156862745098,1,True,AUS01,5610,True,5610,Postage and Courier,True,True,CC3100,Google Cloud,MAPPED,2026-02_GBP,1.955,1248.7562500000001,CONVERTED,29081.766845273953,25872.32663648796,146.0,False,0.0,Monday,False,True,True,EX007
TXN000834,03/19/2026,03/13/2026,2026-02,AUS01,5420,CC3000,Seek Limited,INV51087,PO4117,NZD,22536.3,EXPORT,Payment for goods,API Import,2026-03-19,2026-03-13,2026,02,22536.3,False,payment for goods,2026-02-22 23:27:14.356841,Raw_GL_Export.csv,83.92156862745098,1,True,AUS01,5420,True,5420,Meals and Entertainment,True,True,CC3000,Seek,MAPPED,2026-02_NZD,0.932,21003.8316,CONVERTED,30119.54810314684,25344.73848974119,143.0,False,0.0,Thursday,False,True,True,EX007
TXN000835,2026-03-06,2026-02-28,2026-02,AUS01,5410,CC3200,LinkedIn Corp,INV70768,PO8608,NZD,41562.73,EXPORT,Payment for consulting,Oracle,2026-03-06,2026-02-28,2026,02,41562.73,False,payment for consulting,2026-02-22 23:27:14.356841,Raw_GL_Export.csv,83.92156862745098,1,True,AUS01,5410,True,5410,Accommodation,True,True,CC3200,LinkedIn,MAPPED,2026-02_NZD,0.932,38736.464360000005,CONVERTED,29277.518810999987,22143.12829502557,155.0,False,0.0,Friday,False,True,True,EX007
TXN000836,05-03-2026,26-02-2026,2026-02,AUS01,5000,CC1200,McKinsey,INV62352,PO8116,GBP,44540.32,GST-FREE,Payment for goods,Oracle,2026-03-05,2026-02-26,2026,02,44540.32,False,payment for goods,2026-02-22 23:27:14.356841,Raw_GL_Export.csv,83.92156862745098,1,True,AUS01,5000,True,5000,Salaries and Wages,True,True,CC1200,McKinsey & Company,MAPPED,2026-02_GBP,1.955,87076.3256,CONVERTED,30471.385558248177,22939.768434623154,137.0,False,0.0,Thursday,False,True,True,EX004;EX007
TXN000837,19/02/2026,15/02/2026,2026-01,AUS01,5100,CC1000,DHL Express,INV35920,,GBP,6830.5,INPUT,Payment for consulting,Oracle,2026-02-19,2026-02-15,2026,01,6830.5,False,payment for consulting,2026-02-22 23:27:14.356841,Raw_GL_Export.csv,83.92156862745098,1,True,AUS01,5100,True,5100,Office Rent,True,True,CC1000,DHL,MAPPED,2026-01_GBP,1.957,13367.2885,CONVERTED,29138.02959753333,27547.65120166844,150.0,False,0.0,Thursday,False,True,True,EX001
TXN000838,02/10/2026,02/06/2026,2026-01,AUS01,5200,CC3200,Hays,INV73876,PO1979,GBP,19636.33,GST-FREE,Payment for subscription,SAP,2026-10-02,2026-06-02,2026,01,19636.33,False,payment for subscription,2026-02-22 23:27:14.356841,Raw_GL_Export.csv,83.92156862745098,1,True,AUS01,5200,True,5200,Software Licenses,True,True,CC3200,Hays Recruitment,MAPPED,2026-01_GBP,1.957,38428.297810000004,CONVERTED,30196.543712413786,22166.314759696765,145.0,False,0.0,Friday,False,True,False,
TXN000839,02/03/2026,01/26/2026,2026-01,AUS01,5610,CC2100,Zoom,INV38364,PO1212,USD,23392.45,EXPORT,Payment for subscription,Oracle,2026-03-02,2026-01-26,2026,01,23392.45,False,payment for subscription,2026-02-22 23:27:14.356841,Raw_GL_Export.csv,83.92156862745098,1,True,AUS01,5610,True,5610,Postage and Courier,True,True,CC2100,Zoom Video Communications,MAPPED,2026-01_USD,1.527,35720.27115,CONVERTED,29081.766845273953,25872.32663648796,146.0,False,0.0,Monday,False,True,False,
TXN000840,03/11/2026,03/01/2026,2026-02,AUS01,5410,CC4100,Atlassian Pty,INV58936,PO3099,USD,23880.69,INPUT,Payment for subscription,API Import,2026-11-03,2026-01-03,2026,02,23880.69,False,payment for subscription,2026-02-22 23:27:14.356841,Raw_GL_Export.csv,83.92156862745098,1,True,AUS01,5410,True,5410,Accommodation,True,True,CC4100,Atlassian,MAPPED,2026-02_USD,1.525,36418.05224999999,CONVERTED,29277.518810999987,22143.12829502557,155.0,False,0.0,Tuesday,False,True,True,EX007
TXN000841,2026-03-16,2026-03-15,2026-02,AUS01,5420,CC3000,AusPost,INV40597,PO6120,USD,9504.57,INPUT,Payment for consulting,Workday,2026-03-16,2026-03-15,2026,02,9504.57,False,payment for consulting,2026-02-22 23:27:14.356841,Raw_GL_Export.csv,83.92156862745098,1,True,AUS01,5420,True,5420,Meals and Entertainment,True,True,CC3000,Australia Post,MAPPED,2026-02_USD,1.525,14494.469249999998,CONVERTED,30119.54810314684,25344.73848974119,143.0,False,0.0,Monday,False,True,True,EX007
TXN000842,12/18/2025,12/08/2025,2025-11,AUS01,5900,CC3000,SAP,INV87704,PO5081,USD,43449.78,GST-FREE,Payment for consulting,API Import,2025-12-18,2025-08-12,2025,11,43449.78,False,payment for consulting,2026-02-22 23:27:14.356841,Raw_GL_Export.csv,83.92156862745098,1,True,AUS01,5900,True,5900,Bank Charges,True,True,CC3000,SAP SE,MAPPED,2025-11_USD,1.526,66304.36428,CONVERTED,31670.032329854675,24882.231532617723,172.0,False,0.0,Thursday,False,True,True,EX004
TXN000843,2026-03-16,2026-03-10,2026-02,AUS01,5510,CC1100,Federal Express,INV79367,PO5358,USD,28099.95,GST,Payment for services,Manual Entry,2026-03-16,2026-03-10,2026,02,28099.95,False,payment for services,2026-02-22 23:27:14.356841,Raw_GL_Export.csv,83.92156862745098,1,True,AUS01,5510,True,5510,Advertising,True,True,CC1100,FedEx,MAPPED,2026-02_USD,1.525,42852.42375,CONVERTED,28498.583342781956,23667.16979723599,133.0,False,0.0,Monday,False,True,True,EX007
TXN000844,13/06/2025,08/06/2025,2025-05,AUS01,5710,CC1200,Regus Australia,INV92977,,AUD,21371.24,GST-FREE,Payment for subscription,API Import,2025-06-13,2025-06-08,2025,05,21371.24,False,payment for subscription,2026-02-22 23:27:14.356841,Raw_GL_Export.csv,83.92156862745098,1,True,AUS01,5710,True,5710,Recruitment,True,True,CC1200,Regus,MAPPED,2025-05_AUD,1.0,21371.24,DOMESTIC,29496.09592285716,24753.031499859637,133.0,False,0.0,Friday,False,True,True,EX001
TXN000845,16/02/2026,11/02/2026,2026-01,AUS01,5310,CC3200,McKinsey,INV88326,PO5843,USD,37103.73,GST-FREE,Payment for services,Oracle,2026-02-16,2026-02-11,2026,01,37103.73,False,payment for services,2026-02-22 23:27:14.356841,Raw_GL_Export.csv,83.92156862745098,1,True,AUS01,5310,True,5310,Legal Fees,True,True,CC3200,McKinsey & Company,MAPPED,2026-01_USD,1.527,56657.395710000004,CONVERTED,33139.04129260232,28423.631835285127,171.0,False,0.0,Monday,False,True,True,EX004
TXN000846,01/17/2026,01/13/2026,2025-12,AUS01,5900,CC3100,Telstra Corp,INV28882,,AUD,13488.15,GST-FREE,Payment for services,Manual Entry,2026-01-17,2026-01-13,2025,12,13488.15,False,payment for services,2026-02-22 23:27:14.356841,Raw_GL_Export.csv,83.92156862745098,1,True,AUS01,5900,True,5900,Bank Charges,True,True,CC3100,Telstra,MAPPED,2025-12_AUD,1.0,13488.15,DOMESTIC,31670.032329854675,24882.231532617723,172.0,False,0.0,Saturday,True,True,True,EX001
TXN000847,02/03/2026,01/26/2026,2026-01,AUS01,5810,CC1200,Optus Pty,INV51168,,GBP,25031.37,EXPORT,Payment for subscription,Manual Entry,2026-03-02,2026-01-26,2026,01,25031.37,False,payment for subscription,2026-02-22 23:27:14.356841,Raw_GL_Export.csv,83.92156862745098,1,True,AUS01,5810,True,5810,Amortization,True,True,CC1200,Optus,MAPPED,2026-01_GBP,1.957,48986.39109,CONVERTED,31768.91314562501,27328.351394475325,120.0,False,0.0,Monday,False,True,True,EX001
TXN000848,09/06/2025,30/05/2025,2025-05,AUS01,5420,CC2100,Adobe,INV26241,,USD,14593.89,GST,Payment for subscription,API Import,2025-06-09,2025-05-30,2025,05,14593.89,False,payment for subscription,2026-02-22 23:27:14.356841,Raw_GL_Export.csv,83.92156862745098,1,True,AUS01,5420,True,5420,Meals and Entertainment,True,True,CC2100,Adobe Systems,MAPPED,2025-05_USD,1.518,22153.52502,CONVERTED,30119.54810314684,25344.73848974119,143.0,False,0.0,Monday,False,True,True,EX001
TXN000849,02/16/2026,02/13/2026,2026-01,AUS01,5310,CC3100,Amazon,INV33330,PO1565,GBP,29120.14,EXPORT,Payment for subscription,Workday,2026-02-16,2026-02-13,2026,01,29120.14,False,payment for subscription,2026-02-22 23:27:14.356841,Raw_GL_Export.csv,83.92156862745098,1,True,AUS01,5310,True,5310,Legal Fees,True,True,CC3100,Amazon Web Services,MAPPED,2026-01_GBP,1.957,56988.11398,CONVERTED,33139.04129260232,28423.631835285127,171.0,False,0.0,Monday,False,True,True,EX004
TXN000850,2025-08-19,2025-08-10,2025-07,AUS01,5010,CC1200,Hays,INV29866,,AUD,41720.0,GST-FREE,Payment for goods,Oracle,2025-08-19,2025-08-10,2025,07,41720.0,False,payment for goods,2026-02-22 23:27:14.356841,Raw_GL_Export.csv,83.92156862745098,1,True,AUS01,5010,True,5010,Employee Benefits,True,True,CC1200,Hays Recruitment,MAPPED,2025-07_AUD,1.0,41720.0,DOMESTIC,27923.213086278203,19430.63083039902,133.0,False,0.0,Tuesday,False,True,True,EX001
TXN000851,03/03/2026,02/25/2026,2026-02,AUS01,5310,CC1100,AusPost,INV62502,PO9596,NZD,33813.2,EXPORT,Payment for consulting,Manual Entry,2026-03-03,2026-02-25,2026,02,33813.2,False,payment for consulting,2026-02-22 23:27:14.356841,Raw_GL_Export.csv,83.92156862745098,1,True,AUS01,5310,True,5310,Legal Fees,True,True,CC1100,Australia Post,MAPPED,2026-02_NZD,0.932,31513.9024,CONVERTED,33139.04129260232,28423.631835285127,171.0,False,0.0,Tuesday,False,True,True,EX007
TXN000852,23/11/2025,14/11/2025,2025-10,AUS01,5910,CC1100,Workday,INV39805,,GBP,7241.81,INPUT,Payment for license,SAP,2025-11-23,2025-11-14,2025,10,7241.81,False,payment for license,2026-02-22 23:27:14.356841,Raw_GL_Export.csv,83.92156862745098,1,True,AUS01,5910,True,5910,Interest Expense,True,True,CC1100,Workday Inc,MAPPED,2025-10_GBP,1.951,14128.771310000002,CONVERTED,33774.54824600841,21661.31598456901,119.0,False,0.0,Sunday,True,True,True,EX001
TXN000853,02/03/2026,22/02/2026,2026-02,AUS01,5010,CC1000,ServiceNow Inc,INV75612,PO7349,USD,42753.47,GST-FREE,Payment for consulting,SAP,2026-03-02,2026-02-22,2026,02,42753.47,False,payment for consulting,2026-02-22 23:27:14.356841,Raw_GL_Export.csv,83.92156862745098,1,True,AUS01,5010,True,5010,Employee Benefits,True,True,CC1000,ServiceNow,MAPPED,2026-02_USD,1.525,65199.04175,CONVERTED,27923.213086278203,19430.63083039902,133.0,False,0.0,Monday,False,True,True,EX004;EX007
TXN000854,11/17/2025,11/09/2025,2025-10,AUS01,5000,CC3100,Salesforce,INV37372,,AUD,9085.59,GST,Payment for consulting,SAP,2025-11-17,2025-09-11,2025,10,9085.59,False,payment for consulting,2026-02-22 23:27:14.356841,Raw_GL_Export.csv,83.92156862745098,1,True,AUS01,5000,True,5000,Salaries and Wages,True,True,CC3100,Salesforce Inc,MAPPED,2025-10_AUD,1.0,9085.59,DOMESTIC,30471.385558248177,22939.768434623154,137.0,False,0.0,Monday,False,True,True,EX001
TXN000855,2026-01-12,2026-01-02,2025-12,AUS01,5320,CC4000,Adobe,INV92271,PO5610,GBP,9653.75,GST,Payment for subscription,API Import,2026-01-12,2026-01-02,2025,12,9653.75,False,payment for subscription,2026-02-22 23:27:14.356841,Raw_GL_Export.csv,83.92156862745098,1,True,AUS01,5320,True,5320,Audit Fees,True,True,CC4000,Adobe Systems,MAPPED,2025-12_GBP,1.953,18853.77375,CONVERTED,31658.610713475173,32284.527206153973,141.0,False,0.0,Monday,False,True,False,
TXN000856,12-03-2026,09-03-2026,2026-02,AUS01,5910,CC2000,Deloitte Touche,INV61463,,NZD,8890.18,INPUT,Payment for subscription,Manual Entry,2026-03-12,2026-03-09,2026,02,8890.18,False,payment for subscription,2026-02-22 23:27:14.356841,Raw_GL_Export.csv,83.92156862745098,1,True,AUS01,5910,True,5910,Interest Expense,True,True,CC2000,Deloitte,MAPPED,2026-02_NZD,0.932,8285.64776,CONVERTED,33774.54824600841,21661.31598456901,119.0,False,0.0,Thursday,False,True,True,EX001;EX007
TXN000857,01-02-2026,22-01-2026,2026-02,AUS01,5620,CC4000,DHL Express,INV60784,PO4368,USD,8398.96,GST,Payment for goods,API Import,2026-02-01,2026-01-22,2026,02,8398.96,False,payment for goods,2026-02-22 23:27:14.356841,Raw_GL_Export.csv,83.92156862745098,0,True,AUS01,5620,True,5620,Insurance,True,True,CC4000,DHL,MAPPED,2026-02_USD,1.525,12808.413999999997,CONVERTED,32410.971605588227,27490.799177232966,170.0,False,0.0,Sunday,True,True,False,
TXN000858,02/24/2026,02/20/2026,2026-02,AUS01,5600,CC2100,Regus Australia,INV84297,PO5134,GBP,2541.1,GST-FREE,Payment for goods,API Import,2026-02-24,2026-02-20,2026,02,2541.1,False,payment for goods,2026-02-22 23:27:14.356841,Raw_GL_Export.csv,83.92156862745098,0,True,AUS01,5600,True,5600,Telecommunications,True,True,CC2100,Regus,MAPPED,2026-02_GBP,1.955,4967.8505,CONVERTED,32190.120230168057,26805.910450208805,119.0,False,0.0,Tuesday,False,True,False,
TXN000859,02/01/2026,01/31/2026,2026-02,AUS01,5200,CC1200,BCG,INV52907,PO7402,USD,22531.71,EXPORT,Payment for license,Oracle,2026-01-02,2026-01-31,2026,02,22531.71,False,payment for license,2026-02-22 23:27:14.356841,Raw_GL_Export.csv,83.92156862745098,1,True,AUS01,5200,True,5200,Software Licenses,True,True,CC1200,Boston Consulting Group,MAPPED,2026-02_USD,1.525,34360.857749999996,CONVERTED,30196.543712413786,22166.314759696765,145.0,False,0.0,Friday,False,True,False,
TXN000860,16-02-2026,07-02-2026,2026-02,AUS01,5610,CC2100,Accenture Pty,INV14089,PO1183,AUD,27775.03,GST,Payment for subscription,SAP,2026-02-16,2026-02-07,2026,02,27775.03,False,payment for subscription,2026-02-22 23:27:14.356841,Raw_GL_Export.csv,83.92156862745098,0,True,AUS01,5610,True,5610,Postage and Courier,True,True,CC2100,Accenture,MAPPED,2026-02_AUD,1.0,27775.03,DOMESTIC,29081.766845273953,25872.32663648796,146.0,False,0.0,Monday,False,True,False,
TXN000861,10-01-2026,03-01-2026,2026-01,AUS01,5800,CC4100,Adobe,INV94642,,AUD,2503.85,GST-FREE,Payment for consulting,Workday,2026-01-10,2026-01-03,2026,01,2503.85,False,payment for consulting,2026-02-22 23:27:14.356841,Raw_GL_Export.csv,83.92156862745098,0,True,AUS01,5800,True,5800,Depreciation,True,True,CC4100,Adobe Systems,MAPPED,2026-01_AUD,1.0,2503.85,DOMESTIC,30184.39373025477,34245.09535020032,157.0,False,0.0,Saturday,True,True,True,EX001
TXN000862,02/03/2026,01/27/2026,2026-02,AUS01,5620,CC1000,EY Australia,INV28591,,AUD,40443.62,INPUT,Payment for goods,SAP,2026-03-02,2026-01-27,2026,02,40443.62,False,payment for goods,2026-02-22 23:27:14.356841,Raw_GL_Export.csv,83.92156862745098,1,True,AUS01,5620,True,5620,Insurance,True,True,CC1000,EY,MAPPED,2026-02_AUD,1.0,40443.62,DOMESTIC,32410.971605588227,27490.799177232966,170.0,False,0.0,Monday,False,True,True,EX001;EX007
TXN000863,2025-05-21,2025-05-13,2025-05,AUS01,5120,CC1000,Atlassian Pty,INV85992,PO5475,AUD,32643.93,EXPORT,Payment for subscription,SAP,2025-05-21,2025-05-13,2025,05,32643.93,False,payment for subscription,2026-02-22 23:27:14.356841,Raw_GL_Export.csv,83.92156862745098,0,True,AUS01,5120,True,5120,Office Supplies,True,True,CC1000,Atlassian,MAPPED,2025-05_AUD,1.0,32643.93,DOMESTIC,34269.00595485611,35424.20705021751,139.0,False,0.0,Wednesday,False,True,False,
TXN000864,23-01-2026,21-01-2026,2026-01,AUS01,5800,CC1200,Workday,INV13918,,AUD,17949.5,EXPORT,Payment for consulting,Manual Entry,2026-01-23,2026-01-21,2026,01,17949.5,False,payment for consulting,2026-02-22 23:27:14.356841,Raw_GL_Export.csv,83.92156862745098,0,True,AUS01,5800,True,5800,Depreciation,True,True,CC1200,Workday Inc,MAPPED,2026-01_AUD,1.0,17949.5,DOMESTIC,30184.39373025477,34245.09535020032,157.0,False,0.0,Friday,False,True,True,EX001
TXN000865,14/02/2025,13/02/2025,2025-02,AUS01,5600,CC1000,Salesforce,INV36568,PO1399,NZD,31974.59,EXPORT,Payment for subscription,Oracle,2025-02-14,2025-02-13,2025,02,31974.59,False,payment for subscription,2026-02-22 23:27:14.356841,Raw_GL_Export.csv,83.92156862745098,0,True,AUS01,5600,True,5600,Telecommunications,True,True,CC1000,Salesforce Inc,MAPPED,2025-02_NZD,0.925,29576.495750000002,CONVERTED,32190.120230168057,26805.910450208805,119.0,False,0.0,Friday,False,True,False,
TXN000866,08-02-2025,07-02-2025,2025-02,AUS01,5620,CC1000,Telstra Corp,INV47554,PO7017,GBP,35659.17,GST,Payment for consulting,Manual Entry,2025-02-08,2025-02-07,2025,02,35659.17,False,payment for consulting,2026-02-22 23:27:14.356841,Raw_GL_Export.csv,83.92156862745098,0,True,AUS01,5620,True,5620,Insurance,True,True,CC1000,Telstra,MAPPED,2025-02_GBP,1.94,69178.7898,CONVERTED,32410.971605588227,27490.799177232966,170.0,False,0.0,Saturday,True,True,True,EX004
TXN000867,18/01/2026,12/01/2026,2026-01,AUS01,5700,CC3000,Zoom,INV63346,,NZD,33110.25,INPUT,Payment for consulting,Workday,2026-01-18,2026-01-12,2026,01,33110.25,False,payment for consulting,2026-02-22 23:27:14.356841,Raw_GL_Export.csv,83.92156862745098,0,True,AUS01,5700,True,5700,Training,True,True,CC3000,Zoom Video Communications,MAPPED,2026-01_NZD,0.9335,30908.418375,CONVERTED,31110.431902446802,30160.111495086097,141.0,False,0.0,Sunday,True,True,True,EX001
TXN000868,08/15/2025,08/10/2025,2025-08,AUS01,5110,CC3200,AusPost,INV88925,,NZD,43266.25,GST,Payment for goods,Workday,2025-08-15,2025-10-08,2025,08,43266.25,False,payment for goods,2026-02-22 23:27:14.356841,Raw_GL_Export.csv,83.92156862745098,0,True,AUS01,5110,True,5110,Utilities,True,True,CC3200,Australia Post,MAPPED,2025-08_NZD,0.93,40237.6125,CONVERTED,27865.288293732876,21409.69928933269,146.0,False,0.0,Friday,False,True,True,EX001
TXN000869,12-01-2026,04-01-2026,2026-01,AUS01,5810,CC4000,Adobe,INV88484,PO3612,AUD,15521.07,GST-FREE,Payment for license,Oracle,2026-01-12,2026-01-04,2026,01,15521.07,False,payment for license,2026-02-22 23:27:14.356841,Raw_GL_Export.csv,83.92156862745098,0,True,AUS01,5810,True,5810,Amortization,True,True,CC4000,Adobe Systems,MAPPED,2026-01_AUD,1.0,15521.07,DOMESTIC,31768.91314562501,27328.351394475325,120.0,False,0.0,Monday,False,True,False,
TXN000870,27/08/2025,20/08/2025,2025-08,AUS01,5020,CC3100,Atlassian Pty,INV43386,PO3698,AUD,23428.64,GST,Payment for goods,Workday,2025-08-27,2025-08-20,2025,08,23428.64,False,payment for goods,2026-02-22 23:27:14.356841,Raw_GL_Export.csv,83.92156862745098,0,True,AUS01,5020,True,5020,Contractor Fees,True,True,CC3100,Atlassian,MAPPED,2025-08_AUD,1.0,23428.64,DOMESTIC,28445.577844280295,21241.721119146277,132.0,False,0.0,Wednesday,False,True,False,
TXN000871,2025-05-16,2025-05-10,2025-05,AUS01,5800,CC3000,DHL Express,INV63477,PO2743,GBP,9936.31,INPUT,Payment for goods,Manual Entry,2025-05-16,2025-05-10,2025,05,9936.31,False,payment for goods,2026-02-22 23:27:14.356841,Raw_GL_Export.csv,83.92156862745098,0,True,AUS01,5800,True,5800,Depreciation,True,True,CC3000,DHL,MAPPED,2025-05_GBP,1.948,19355.93188,CONVERTED,30184.39373025477,34245.09535020032,157.0,False,0.0,Friday,False,True,False,
TXN000872,05/04/2025,04/04/2025,2025-04,AUS01,5900,CC4000,GCP,INV50180,,GBP,6581.56,GST,Payment for consulting,Workday,2025-04-05,2025-04-04,2025,04,6581.56,False,payment for consulting,2026-02-22 23:27:14.356841,Raw_GL_Export.csv,83.92156862745098,0,True,AUS01,5900,True,5900,Bank Charges,True,True,CC4000,Google Cloud,MAPPED,2025-04_GBP,1.955,12866.949800000002,CONVERTED,31670.032329854675,24882.231532617723,172.0,False,0.0,Saturday,True,True,True,EX001
TXN000873,27/02/2026,18/02/2026,2026-02,AUS01,5620,CC1100,SAP,INV25869,,AUD,828.28,INPUT,Payment for services,SAP,2026-02-27,2026-02-18,2026,02,828.28,False,payment for services,2026-02-22 23:27:14.356841,Raw_GL_Export.csv,83.92156862745098,0,True,AUS01,5620,True,5620,Insurance,True,True,CC1100,SAP SE,MAPPED,2026-02_AUD,1.0,828.28,DOMESTIC,32410.971605588227,27490.799177232966,170.0,False,0.0,Friday,False,True,True,EX001
TXN000874,09-01-2026,07-01-2026,2026-01,AUS01,5410,CC3000,DHL Express,INV54979,PO4415,AUD,31432.05,INPUT,Payment for subscription,Manual Entry,2026-01-09,2026-01-07,2026,01,31432.05,False,payment for subscription,2026-02-22 23:27:14.356841,Raw_GL_Export.csv,83.92156862745098,0,True,AUS01,5410,True,5410,Accommodation,True,True,CC3000,DHL,MAPPED,2026-01_AUD,1.0,31432.05,DOMESTIC,29277.518810999987,22143.12829502557,155.0,False,0.0,Friday,False,True,False,
TXN000875,20-02-2026,10-02-2026,2026-02,AUS01,5600,CC1000,Hays,INV14068,,AUD,22549.77,INPUT,Payment for consulting,Manual Entry,2026-02-20,2026-02-10,2026,02,22549.77,False,payment for consulting,2026-02-22 23:27:14.356841,Raw_GL_Export.csv,83.92156862745098,0,True,AUS01,5600,True,5600,Telecommunications,True,True,CC1000,Hays Recruitment,MAPPED,2026-02_AUD,1.0,22549.77,DOMESTIC,32190.120230168057,26805.910450208805,119.0,False,0.0,Friday,False,True,True,EX001
TXN000876,2026-01-25,2026-01-18,2026-01,AUS01,5710,CC4100,WeWork Australia,INV15068,PO2422,GBP,44759.26,EXPORT,Payment for consulting,Workday,2026-01-25,2026-01-18,2026,01,44759.26,False,payment for consulting,2026-02-22 23:27:14.356841,Raw_GL_Export.csv,83.92156862745098,0,True,AUS01,5710,True,5710,Recruitment,True,True,CC4100,WeWork,MAPPED,2026-01_GBP,1.957,87593.87182,CONVERTED,29496.09592285716,24753.031499859637,133.0,False,0.0,Sunday,True,True,True,EX004
TXN000877,2026-02-18,2026-02-16,2026-02,AUS01,5210,CC1100,LinkedIn Corp,INV89116,PO1562,GBP,33732.44,GST-FREE,Payment for subscription,Workday,2026-02-18,2026-02-16,2026,02,33732.44,False,payment for subscription,2026-02-22 23:27:14.356841,Raw_GL_Export.csv,83.92156862745098,0,True,AUS01,5210,True,5210,Cloud Services,True,True,CC1100,LinkedIn,MAPPED,2026-02_GBP,1.955,65946.92020000001,CONVERTED,31620.56664919015,27460.393400888206,142.0,False,0.0,Wednesday,False,True,True,EX004
TXN000878,18-06-2025,14-06-2025,2025-06,AUS01,5610,CC3100,GCP,INV76361,PO9225,AUD,30803.69,GST,Payment for goods,Manual Entry,2025-06-18,2025-06-14,2025,06,30803.69,False,payment for goods,2026-02-22 23:27:14.356841,Raw_GL_Export.csv,83.92156862745098,0,True,AUS01,5610,True,5610,Postage and Courier,True,True,CC3100,Google Cloud,MAPPED,2025-06_AUD,1.0,30803.69,DOMESTIC,29081.766845273953,25872.32663648796,146.0,False,0.0,Wednesday,False,True,False,
TXN000879,09-01-2026,31-12-2025,2026-01,AUS01,5620,CC1000,Deloitte Touche,INV32795,PO5806,AUD,31449.92,EXPORT,Payment for goods,SAP,2026-01-09,2025-12-31,2026,01,31449.92,False,payment for goods,2026-02-22 23:27:14.356841,Raw_GL_Export.csv,83.92156862745098,0,True,AUS01,5620,True,5620,Insurance,True,True,CC1000,Deloitte,MAPPED,2026-01_AUD,1.0,31449.92,DOMESTIC,32410.971605588227,27490.799177232966,170.0,False,0.0,Friday,False,True,False,
TXN000880,01/10/2026,01/03/2026,2026-01,AUS01,5100,CC1200,Salesforce,INV10746,PO3893,USD,21748.36,GST-FREE,Payment for consulting,SAP,2026-10-01,2026-03-01,2026,01,21748.36,False,payment for consulting,2026-02-22 23:27:14.356841,Raw_GL_Export.csv,83.92156862745098,1,True,AUS01,5100,True,5100,Office Rent,True,True,CC1200,Salesforce Inc,MAPPED,2026-01_USD,1.527,33209.74572,CONVERTED,29138.02959753333,27547.65120166844,150.0,False,0.0,Thursday,False,True,False,
TXN000881,10/01/2026,06/01/2026,2026-01,AUS01,5310,CC4100,Hays,INV23308,,USD,32150.87,GST,Payment for goods,API Import,2026-01-10,2026-01-06,2026,01,32150.87,False,payment for goods,2026-02-22 23:27:14.356841,Raw_GL_Export.csv,83.92156862745098,0,True,AUS01,5310,True,5310,Legal Fees,True,True,CC4100,Hays Recruitment,MAPPED,2026-01_USD,1.527,49094.378489999996,CONVERTED,33139.04129260232,28423.631835285127,171.0,False,0.0,Saturday,True,True,True,EX001
TXN000882,2025-03-19,2025-03-11,2025-03,AUS01,5500,CC3000,Telstra Corp,INV93208,PO7858,AUD,31907.56,INPUT,Payment for consulting,SAP,2025-03-19,2025-03-11,2025,03,31907.56,False,payment for consulting,2026-02-22 23:27:14.356841,Raw_GL_Export.csv,83.92156862745098,0,True,AUS01,5500,True,5500,Marketing,True,True,CC3000,Telstra,MAPPED,2025-03_AUD,1.0,31907.56,DOMESTIC,28972.634359125877,32785.70497360227,143.0,False,0.0,Wednesday,False,True,False,
TXN000883,09-03-2025,28-02-2025,2025-03,AUS01,5710,CC3100,Salesforce,INV72210,PO4985,AUD,4017.21,INPUT,Payment for goods,SAP,2025-03-09,2025-02-28,2025,03,4017.21,False,payment for goods,2026-02-22 23:27:14.356841,Raw_GL_Export.csv,83.92156862745098,0,True,AUS01,5710,True,5710,Recruitment,True,True,CC3100,Salesforce Inc,MAPPED,2025-03_AUD,1.0,4017.21,DOMESTIC,29496.09592285716,24753.031499859637,133.0,False,0.0,Sunday,True,True,False,
TXN000884,01/03/2025,27/02/2025,2025-03,AUS01,5600,CC1200,SAP,INV83055,,GBP,29727.8,INPUT,Payment for services,Oracle,2025-03-01,2025-02-27,2025,03,29727.8,False,payment for services,2026-02-22 23:27:14.356841,Raw_GL_Export.csv,83.92156862745098,0,True,AUS01,5600,True,5600,Telecommunications,True,True,CC1200,SAP SE,MAPPED,2025-03_GBP,1.96,58266.488,CONVERTED,32190.120230168057,26805.910450208805,119.0,False,0.0,Saturday,True,True,True,EX001;EX004
TXN000885,19-05-2025,17-05-2025,2025-05,AUS01,5520,CC1000,ServiceNow Inc,INV61211,,USD,6717.69,GST-FREE,Payment for services,API Import,2025-05-19,2025-05-17,2025,05,6717.69,False,payment for services,2026-02-22 23:27:14.356841,Raw_GL_Export.csv,83.92156862745098,0,True,AUS01,5520,True,5520,Events,True,True,CC1000,ServiceNow,MAPPED,2025-05_USD,1.518,10197.45342,CONVERTED,30860.276023483882,21900.267908653983,155.0,False,0.0,Monday,False,True,True,EX001
TXN000886,2026-02-26,2026-02-24,2026-02,AUS01,5510,CC2100,AWS,INV51881,PO8870,NZD,39629.27,GST-FREE,Payment for goods,Oracle,2026-02-26,2026-02-24,2026,02,39629.27,False,payment for goods,2026-02-22 23:27:14.356841,Raw_GL_Export.csv,83.92156862745098,0,True,AUS01,5510,True,5510,Advertising,True,True,CC2100,Amazon Web Services,MAPPED,2026-02_NZD,0.932,36934.47964,CONVERTED,28498.583342781956,23667.16979723599,133.0,False,0.0,Thursday,False,True,False,
TXN000887,22-01-2026,14-01-2026,2026-01,AUS01,5500,CC2000,GCP,INV29151,PO9353,USD,17514.8,GST,Payment for goods,SAP,2026-01-22,2026-01-14,2026,01,17514.8,False,payment for goods,2026-02-22 23:27:14.356841,Raw_GL_Export.csv,83.92156862745098,0,True,AUS01,5500,True,5500,Marketing,True,True,CC2000,Google Cloud,MAPPED,2026-01_USD,1.527,26745.099599999998,CONVERTED,28972.634359125877,32785.70497360227,143.0,False,0.0,Thursday,False,True,False,
TXN000888,2025-04-16,2025-04-06,2025-04,AUS01,5120,CC2000,AusPost,INV63266,,NZD,42198.62,INPUT,Payment for consulting,SAP,2025-04-16,2025-04-06,2025,04,42198.62,False,payment for consulting,2026-02-22 23:27:14.356841,Raw_GL_Export.csv,83.92156862745098,0,True,AUS01,5120,True,5120,Office Supplies,True,True,CC2000,Australia Post,MAPPED,2025-04_NZD,0.932,39329.113840000005,CONVERTED,34269.00595485611,35424.20705021751,139.0,False,0.0,Wednesday,False,True,True,EX001
TXN000889,02/28/2026,02/21/2026,2026-02,AUS01,5000,CC2000,Regus Australia,INV26688,PO9348,GBP,20297.29,GST-FREE,Payment for consulting,Oracle,2026-02-28,2026-02-21,2026,02,20297.29,False,payment for consulting,2026-02-22 23:27:14.356841,Raw_GL_Export.csv,83.92156862745098,0,True,AUS01,5000,True,5000,Salaries and Wages,True,True,CC2000,Regus,MAPPED,2026-02_GBP,1.955,39681.20195,CONVERTED,30471.385558248177,22939.768434623154,137.0,False,0.0,Saturday,True,True,False,
TXN000890,07/08/2025,06/30/2025,2025-07,AUS01,5810,CC1100,Telstra Corp,INV29079,PO1654,AUD,18837.51,GST,Payment for subscription,Workday,2025-08-07,2025-06-30,2025,07,18837.51,False,payment for subscription,2026-02-22 23:27:14.356841,Raw_GL_Export.csv,83.92156862745098,1,True,AUS01,5810,True,5810,Amortization,True,True,CC1100,Telstra,MAPPED,2025-07_AUD,1.0,18837.51,DOMESTIC,31768.91314562501,27328.351394475325,120.0,False,0.0,Thursday,False,True,False,
TXN000891,02/13/2026,02/05/2026,2026-02,AUS01,5620,CC3000,EY Australia,INV77035,PO3248,NZD,41377.77,EXPORT,Payment for consulting,Workday,2026-02-13,2026-05-02,2026,02,41377.77,False,payment for consulting,2026-02-22 23:27:14.356841,Raw_GL_Export.csv,83.92156862745098,0,True,AUS01,5620,True,5620,Insurance,True,True,CC3000,EY,MAPPED,2026-02_NZD,0.932,38564.08164,CONVERTED,32410.971605588227,27490.799177232966,170.0,False,0.0,Friday,False,True,False,
TXN000892,03-02-2026,28-01-2026,2026-02,AUS01,5520,CC4000,Salesforce,INV47872,PO4732,NZD,28347.55,INPUT,Payment for subscription,Workday,2026-02-03,2026-01-28,2026,02,28347.55,False,payment for subscription,2026-02-22 23:27:14.356841,Raw_GL_Export.csv,83.92156862745098,0,True,AUS01,5520,True,5520,Events,True,True,CC4000,Salesforce Inc,MAPPED,2026-02_NZD,0.932,26419.9166,CONVERTED,30860.276023483882,21900.267908653983,155.0,False,0.0,Tuesday,False,True,False,
TXN000893,08/02/2026,02/02/2026,2026-02,AUS01,5300,CC2000,BCG,INV97776,PO3281,GBP,12605.64,EXPORT,Payment for subscription,Oracle,2026-02-08,2026-02-02,2026,02,12605.64,False,payment for subscription,2026-02-22 23:27:14.356841,Raw_GL_Export.csv,83.92156862745098,0,True,AUS01,5300,True,5300,Professional Services,True,True,CC2000,Boston Consulting Group,MAPPED,2026-02_GBP,1.955,24644.0262,CONVERTED,33232.533450429684,35951.49997313202,128.0,False,0.0,Sunday,True,True,False,
TXN000894,02/22/2026,02/13/2026,2026-02,AUS01,5520,CC3000,Workday,INV25363,PO5775,GBP,26220.53,GST-FREE,Payment for goods,Oracle,2026-02-22,2026-02-13,2026,02,26220.53,False,payment for goods,2026-02-22 23:27:14.356841,Raw_GL_Export.csv,83.92156862745098,0,True,AUS01,5520,True,5520,Events,True,True,CC3000,Workday Inc,MAPPED,2026-02_GBP,1.955,51261.13615,CONVERTED,30860.276023483882,21900.267908653983,155.0,False,0.0,Sunday,True,True,True,EX004
TXN000895,02/20/2026,02/17/2026,2026-02,AUS01,5620,CC3200,Regus Australia,INV84473,PO6593,USD,17684.2,INPUT,Payment for goods,Workday,2026-02-20,2026-02-17,2026,02,17684.2,False,payment for goods,2026-02-22 23:27:14.356841,Raw_GL_Export.csv,83.92156862745098,0,True,AUS01,5620,True,5620,Insurance,True,True,CC3200,Regus,MAPPED,2026-02_USD,1.525,26968.405,CONVERTED,32410.971605588227,27490.799177232966,170.0,False,0.0,Friday,False,True,False,
TXN000896,2026-01-20,2026-01-15,2026-01,AUS01,5100,CC3100,DHL Express,INV74887,PO5539,AUD,3087.93,INPUT,Payment for license,API Import,2026-01-20,2026-01-15,2026,01,3087.93,False,payment for license,2026-02-22 23:27:14.356841,Raw_GL_Export.csv,83.92156862745098,0,True,AUS01,5100,True,5100,Office Rent,True,True,CC3100,DHL,MAPPED,2026-01_AUD,1.0,3087.93,DOMESTIC,29138.02959753333,27547.65120166844,150.0,False,0.0,Tuesday,False,True,False,
TXN000897,14/01/2026,09/01/2026,2026-01,AUS01,5010,CC3100,Hays,INV51044,,AUD,21488.93,EXPORT,Payment for goods,SAP,2026-01-14,2026-01-09,2026,01,21488.93,False,payment for goods,2026-02-22 23:27:14.356841,Raw_GL_Export.csv,83.92156862745098,0,True,AUS01,5010,True,5010,Employee Benefits,True,True,CC3100,Hays Recruitment,MAPPED,2026-01_AUD,1.0,21488.93,DOMESTIC,27923.213086278203,19430.63083039902,133.0,False,0.0,Wednesday,False,True,True,EX001
TXN000898,2026-01-12,2026-01-11,2026-01,AUS01,5920,CC1100,PWC,INV26701,PO7934,AUD,24727.23,INPUT,Payment for goods,SAP,2026-01-12,2026-01-11,2026,01,24727.23,False,payment for goods,2026-02-22 23:27:14.356841,Raw_GL_Export.csv,83.92156862745098,0,True,AUS01,5920,True,5920,FX Loss,True,True,CC1100,PwC,MAPPED,2026-01_AUD,1.0,24727.23,DOMESTIC,27533.92400565971,21784.021192347693,144.0,False,0.0,Monday,False,True,False,
TXN000899,2025-08-22,2025-08-21,2025-08,AUS01,5100,CC3000,PWC,INV38893,PO5370,NZD,19398.14,GST-FREE,Payment for license,Workday,2025-08-22,2025-08-21,2025,08,19398.14,False,payment for license,2026-02-22 23:27:14.356841,Raw_GL_Export.csv,83.92156862745098,0,True,AUS01,5100,True,5100,Office Rent,True,True,CC3000,PwC,MAPPED,2025-08_NZD,0.93,18040.2702,CONVERTED,29138.02959753333,27547.65120166844,150.0,False,0.0,Friday,False,True,False,
TXN000900,27/02/2026,24/02/2026,2026-02,AUS01,5000,CC4000,McKinsey,INV36626,PO1285,USD,7815.72,EXPORT,Payment for goods,SAP,2026-02-27,2026-02-24,2026,02,7815.72,False,payment for goods,2026-02-22 23:27:14.356841,Raw_GL_Export.csv,83.92156862745098,0,True,AUS01,5000,True,5000,Salaries and Wages,True,True,CC4000,McKinsey & Company,MAPPED,2026-02_USD,1.525,11918.973,CONVERTED,30471.385558248177,22939.768434623154,137.0,False,0.0,Friday,False,True,False,
TXN000901,01/19/2026,01/11/2026,2026-01,AUS01,5100,CC1100,Accenture Pty,INV89902,,GBP,10021.71,EXPORT,Payment for goods,Oracle,2026-01-19,2026-11-01,2026,01,10021.71,False,payment for goods,2026-02-22 23:27:14.356841,Raw_GL_Export.csv,83.92156862745098,0,True,AUS01,5100,True,5100,Office Rent,True,True,CC1100,Accenture,MAPPED,2026-01_GBP,1.957,19612.48647,CONVERTED,29138.02959753333,27547.65120166844,150.0,False,0.0,Monday,False,True,True,EX001
TXN000902,2026-01-09,2026-01-08,2026-01,AUS01,5210,CC2100,Telstra Corp,INV23155,PO7693,GBP,20132.82,GST-FREE,Payment for consulting,Manual Entry,2026-01-09,2026-01-08,2026,01,20132.82,False,payment for consulting,2026-02-22 23:27:14.356841,Raw_GL_Export.csv,83.92156862745098,0,True,AUS01,5210,True,5210,Cloud Services,True,True,CC2100,Telstra,MAPPED,2026-01_GBP,1.957,39399.92874,CONVERTED,31620.56664919015,27460.393400888206,142.0,False,0.0,Friday,False,True,False,
TXN000903,05-01-2026,26-12-2025,2026-01,AUS01,5810,CC3100,Amazon,INV67232,PO9584,NZD,9310.28,EXPORT,Payment for subscription,Workday,2026-01-05,2025-12-26,2026,01,9310.28,False,payment for subscription,2026-02-22 23:27:14.356841,Raw_GL_Export.csv,83.92156862745098,0,True,AUS01,5810,True,5810,Amortization,True,True,CC3100,Amazon Web Services,MAPPED,2026-01_NZD,0.9335,8691.14638,CONVERTED,31768.91314562501,27328.351394475325,120.0,False,0.0,Monday,False,True,False,
TXN000904,01-01-2026,23-12-2025,2026-01,AUS01,5610,CC3100,Optus Pty,INV88768,PO7187,USD,16845.95,GST,Payment for goods,Manual Entry,2026-01-01,2025-12-23,2026,01,16845.95,False,payment for goods,2026-02-22 23:27:14.356841,Raw_GL_Export.csv,83.92156862745098,0,True,AUS01,5610,True,5610,Postage and Courier,True,True,CC3100,Optus,MAPPED,2026-01_USD,1.527,25723.76565,CONVERTED,29081.766845273953,25872.32663648796,146.0,False,0.0,Thursday,False,True,False,
TXN000905,07/02/2026,01/02/2026,2026-02,AUS01,5320,CC3100,PWC,INV59734,PO8695,USD,32200.53,GST-FREE,Payment for services,API Import,2026-02-07,2026-02-01,2026,02,32200.53,False,payment for services,2026-02-22 23:27:14.356841,Raw_GL_Export.csv,83.92156862745098,0,True,AUS01,5320,True,5320,Audit Fees,True,True,CC3100,PwC,MAPPED,2026-02_USD,1.525,49105.808249999995,CONVERTED,31658.610713475173,32284.527206153973,141.0,False,0.0,Saturday,True,True,False,
TXN000906,2026-01-08,2025-12-31,2026-01,AUS01,5710,CC1000,Federal Express,INV74350,PO8296,NZD,16242.47,GST,Payment for consulting,SAP,2026-01-08,2025-12-31,2026,01,16242.47,False,payment for consulting,2026-02-22 23:27:14.356841,Raw_GL_Export.csv,83.92156862745098,0,True,AUS01,5710,True,5710,Recruitment,True,True,CC1000,FedEx,MAPPED,2026-01_NZD,0.9335,15162.345744999999,CONVERTED,29496.09592285716,24753.031499859637,133.0,False,0.0,Thursday,False,True,False,
TXN000907,02/14/2026,02/08/2026,2026-02,AUS01,5210,CC2100,Regus Australia,INV38722,PO9473,NZD,21586.03,GST-FREE,Payment for license,API Import,2026-02-14,2026-08-02,2026,02,21586.03,False,payment for license,2026-02-22 23:27:14.356841,Raw_GL_Export.csv,83.92156862745098,0,True,AUS01,5210,True,5210,Cloud Services,True,True,CC2100,Regus,MAPPED,2026-02_NZD,0.932,20118.17996,CONVERTED,31620.56664919015,27460.393400888206,142.0,False,0.0,Saturday,True,True,False,
TXN000908,26/08/2025,25/08/2025,2025-08,AUS01,5400,CC3000,MSFT,INV22108,PO1820,USD,4139.77,GST-FREE,Payment for subscription,SAP,2025-08-26,2025-08-25,2025,08,4139.77,False,payment for subscription,2026-02-22 23:27:14.356841,Raw_GL_Export.csv,83.92156862745098,0,True,AUS01,5400,True,5400,Travel,True,True,CC3000,Microsoft Corporation,MAPPED,2025-08_USD,1.524,6309.009480000001,CONVERTED,31663.682660000006,30146.476988256833,133.0,False,0.0,Tuesday,False,True,False,
TXN000909,01/17/2026,01/09/2026,2026-01,AUS01,5110,CC2100,Zoom,INV40027,PO3730,GBP,12605.25,GST-FREE,Payment for license,SAP,2026-01-17,2026-09-01,2026,01,12605.25,False,payment for license,2026-02-22 23:27:14.356841,Raw_GL_Export.csv,83.92156862745098,0,True,AUS01,5110,True,5110,Utilities,True,True,CC2100,Zoom Video Communications,MAPPED,2026-01_GBP,1.957,24668.47425,CONVERTED,27865.288293732876,21409.69928933269,146.0,False,0.0,Saturday,True,True,False,
TXN000910,2026-02-08,2026-01-29,2026-02,AUS01,5010,CC4100,Oracle,INV32010,,NZD,24702.44,EXPORT,Payment for goods,API Import,2026-02-08,2026-01-29,2026,02,24702.44,False,payment for goods,2026-02-22 23:27:14.356841,Raw_GL_Export.csv,83.92156862745098,0,True,AUS01,5010,True,5010,Employee Benefits,True,True,CC4100,Oracle Corporation,MAPPED,2026-02_NZD,0.932,23022.67408,CONVERTED,27923.213086278203,19430.63083039902,133.0,False,0.0,Sunday,True,True,True,EX001
TXN000911,2025-10-23,2025-10-21,2025-10,AUS01,5810,CC1100,PWC,INV82540,PO3931,USD,24074.5,EXPORT,Payment for goods,API Import,2025-10-23,2025-10-21,2025,10,24074.5,False,payment for goods,2026-02-22 23:27:14.356841,Raw_GL_Export.csv,83.92156862745098,0,True,AUS01,5810,True,5810,Amortization,True,True,CC1100,PwC,MAPPED,2025-10_USD,1.521,36617.3145,CONVERTED,31768.91314562501,27328.351394475325,120.0,False,0.0,Thursday,False,True,False,
TXN000912,06/01/2026,05/01/2026,2026-01,AUS01,5310,CC1200,PWC,INV61616,,AUD,22591.0,GST,Payment for services,Manual Entry,2026-01-06,2026-01-05,2026,01,22591.0,False,payment for services,2026-02-22 23:27:14.356841,Raw_GL_Export.csv,83.92156862745098,0,True,AUS01,5310,True,5310,Legal Fees,True,True,CC1200,PwC,MAPPED,2026-01_AUD,1.0,22591.0,DOMESTIC,33139.04129260232,28423.631835285127,171.0,False,0.0,Tuesday,False,True,True,EX001
TXN000913,05/02/2026,01/02/2026,2026-02,AUS01,5920,CC4100,Regus Australia,INV32956,PO5066,NZD,20861.99,EXPORT,Payment for goods,API Import,2026-02-05,2026-02-01,2026,02,20861.99,False,payment for goods,2026-02-22 23:27:14.356841,Raw_GL_Export.csv,83.92156862745098,0,True,AUS01,5920,True,5920,FX Loss,True,True,CC4100,Regus,MAPPED,2026-02_NZD,0.932,19443.37468,CONVERTED,27533.92400565971,21784.021192347693,144.0,False,0.0,Thursday,False,True,False,
TXN000914,2026-02-25,2026-02-23,2026-02,AUS01,5400,CC1200,AWS,INV98804,PO9871,NZD,20788.69,EXPORT,Payment for consulting,API Import,2026-02-25,2026-02-23,2026,02,20788.69,False,payment for consulting,2026-02-22 23:27:14.356841,Raw_GL_Export.csv,83.92156862745098,0,True,AUS01,5400,True,5400,Travel,True,True,CC1200,Amazon Web Services,MAPPED,2026-02_NZD,0.932,19375.05908,CONVERTED,31663.682660000006,30146.476988256833,133.0,False,0.0,Wednesday,False,True,False,
TXN000915,10/15/2025,10/05/2025,2025-10,AUS01,5600,CC3100,Deloitte Touche,INV26546,PO4389,GBP,7593.61,EXPORT,Payment for services,API Import,2025-10-15,2025-05-10,2025,10,7593.61,False,payment for services,2026-02-22 23:27:14.356841,Raw_GL_Export.csv,83.92156862745098,0,True,AUS01,5600,True,5600,Telecommunications,True,True,CC3100,Deloitte,MAPPED,2025-10_GBP,1.951,14815.13311,CONVERTED,32190.120230168057,26805.910450208805,119.0,False,0.0,Wednesday,False,True,False,
TXN000916,01/12/2026,01/10/2026,2026-01,AUS01,5610,CC3100,Federal Express,INV51228,PO1262,GBP,13548.36,GST,Payment for goods,Manual Entry,2026-12-01,2026-10-01,2026,01,13548.36,False,payment for goods,2026-02-22 23:27:14.356841,Raw_GL_Export.csv,83.92156862745098,1,True,AUS01,5610,True,5610,Postage and Courier,True,True,CC3100,FedEx,MAPPED,2026-01_GBP,1.957,26514.14052,CONVERTED,29081.766845273953,25872.32663648796,146.0,False,0.0,Tuesday,False,True,False,
TXN000917,25/02/2026,17/02/2026,2026-02,AUS01,5920,CC4100,Slack,INV12146,PO8193,NZD,17896.6,GST-FREE,Payment for subscription,Manual Entry,2026-02-25,2026-02-17,2026,02,17896.6,False,payment for subscription,2026-02-22 23:27:14.356841,Raw_GL_Export.csv,83.92156862745098,0,True,AUS01,5920,True,5920,FX Loss,True,True,CC4100,Slack Technologies,MAPPED,2026-02_NZD,0.932,16679.6312,CONVERTED,27533.92400565971,21784.021192347693,144.0,False,0.0,Wednesday,False,True,False,
TXN000918,13-02-2025,05-02-2025,2025-02,AUS01,5320,CC2000,LinkedIn Corp,INV42160,PO2659,USD,18769.42,GST,Payment for subscription,Workday,2025-02-13,2025-02-05,2025,02,18769.42,False,payment for subscription,2026-02-22 23:27:14.356841,Raw_GL_Export.csv,83.92156862745098,0,True,AUS01,5320,True,5320,Audit Fees,True,True,CC2000,LinkedIn,MAPPED,2025-02_USD,1.51,28341.8242,CONVERTED,31658.610713475173,32284.527206153973,141.0,False,0.0,Thursday,False,True,False,
TXN000919,02/02/2026,01/25/2026,2026-02,AUS01,5400,CC3100,Salesforce,INV15311,PO8855,NZD,16029.37,EXPORT,Payment for services,Workday,2026-02-02,2026-01-25,2026,02,16029.37,False,payment for services,2026-02-22 23:27:14.356841,Raw_GL_Export.csv,83.92156862745098,0,True,AUS01,5400,True,5400,Travel,True,True,CC3100,Salesforce Inc,MAPPED,2026-02_NZD,0.932,14939.372840000002,CONVERTED,31663.682660000006,30146.476988256833,133.0,False,0.0,Monday,False,True,False,
TXN000920,11/02/2025,06/02/2025,2025-02,AUS01,5510,CC1200,AWS,INV17849,,AUD,6652.66,INPUT,Payment for goods,API Import,2025-02-11,2025-02-06,2025,02,6652.66,False,payment for goods,2026-02-22 23:27:14.356841,Raw_GL_Export.csv,83.92156862745098,0,True,AUS01,5510,True,5510,Advertising,True,True,CC1200,Amazon Web Services,MAPPED,2025-02_AUD,1.0,6652.66,DOMESTIC,28498.583342781956,23667.16979723599,133.0,False,0.0,Tuesday,False,True,True,EX001
TXN000921,2026-02-12,2026-02-04,2026-02,AUS01,5400,CC3000,LinkedIn Corp,INV58230,,NZD,28017.59,INPUT,Payment for license,API Import,2026-02-12,2026-02-04,2026,02,28017.59,False,payment for license,2026-02-22 23:27:14.356841,Raw_GL_Export.csv,83.92156862745098,0,True,AUS01,5400,True,5400,Travel,True,True,CC3000,LinkedIn,MAPPED,2026-02_NZD,0.932,26112.393880000003,CONVERTED,31663.682660000006,30146.476988256833,133.0,False,0.0,Thursday,False,True,True,EX001
TXN000922,04-08-2025,27-07-2025,2025-08,AUS01,5410,CC4000,Microsoft,INV59535,PO8206,AUD,44939.14,GST-FREE,Payment for subscription,Oracle,2025-08-04,2025-07-27,2025,08,44939.14,False,payment for subscription,2026-02-22 23:27:14.356841,Raw_GL_Export.csv,83.92156862745098,0,True,AUS01,5410,True,5410,Accommodation,True,True,CC4000,Microsoft Corporation,MAPPED,2025-08_AUD,1.0,44939.14,DOMESTIC,29277.518810999987,22143.12829502557,155.0,False,0.0,Monday,False,True,False,
TXN000923,05/01/2026,03/01/2026,2026-01,AUS01,5610,CC3100,PWC,INV49703,,GBP,9988.67,GST,Payment for goods,Oracle,2026-01-05,2026-01-03,2026,01,9988.67,False,payment for goods,2026-02-22 23:27:14.356841,Raw_GL_Export.csv,83.92156862745098,0,True,AUS01,5610,True,5610,Postage and Courier,True,True,CC3100,PwC,MAPPED,2026-01_GBP,1.957,19547.82719,CONVERTED,29081.766845273953,25872.32663648796,146.0,False,0.0,Monday,False,True,True,EX001
TXN000924,14/01/2026,07/01/2026,2026-01,AUS01,5900,CC1200,Telstra Corp,INV10074,PO3677,NZD,44570.14,GST-FREE,Payment for services,Workday,2026-01-14,2026-01-07,2026,01,44570.14,False,payment for services,2026-02-22 23:27:14.356841,Raw_GL_Export.csv,83.92156862745098,0,True,AUS01,5900,True,5900,Bank Charges,True,True,CC1200,Telstra,MAPPED,2026-01_NZD,0.9335,41606.22569,CONVERTED,31670.032329854675,24882.231532617723,172.0,False,0.0,Wednesday,False,True,False,
TXN000925,24-07-2025,22-07-2025,2025-07,AUS01,5210,CC3200,Adobe,INV54923,PO7096,GBP,5229.24,EXPORT,Payment for consulting,Workday,2025-07-24,2025-07-22,2025,07,5229.24,False,payment for consulting,2026-02-22 23:27:14.356841,Raw_GL_Export.csv,83.92156862745098,0,True,AUS01,5210,True,5210,Cloud Services,True,True,CC3200,Adobe Systems,MAPPED,2025-07_GBP,1.958,10238.85192,CONVERTED,31620.56664919015,27460.393400888206,142.0,False,0.0,Thursday,False,True,False,
TXN000926,08/19/2025,08/13/2025,2025-08,AUS01,5510,CC1200,PWC,INV66868,PO6376,USD,10256.33,GST,Payment for license,Workday,2025-08-19,2025-08-13,2025,08,10256.33,False,payment for license,2026-02-22 23:27:14.356841,Raw_GL_Export.csv,83.92156862745098,0,True,AUS01,5510,True,5510,Advertising,True,True,CC1200,PwC,MAPPED,2025-08_USD,1.524,15630.64692,CONVERTED,28498.583342781956,23667.16979723599,133.0,False,0.0,Tuesday,False,True,False,
TXN000927,16-01-2026,15-01-2026,2026-01,AUS01,5600,CC2100,Deloitte Touche,INV38698,PO5075,AUD,37100.7,GST-FREE,Payment for consulting,Oracle,2026-01-16,2026-01-15,2026,01,37100.7,False,payment for consulting,2026-02-22 23:27:14.356841,Raw_GL_Export.csv,83.92156862745098,0,True,AUS01,5600,True,5600,Telecommunications,True,True,CC2100,Deloitte,MAPPED,2026-01_AUD,1.0,37100.7,DOMESTIC,32190.120230168057,26805.910450208805,119.0,False,0.0,Friday,False,True,False,
TXN000928,01/04/2026,12/28/2025,2026-01,AUS01,5800,CC3100,AusPost,INV31292,PO2086,NZD,13528.9,GST-FREE,Payment for subscription,SAP,2026-04-01,2025-12-28,2026,01,13528.9,False,payment for subscription,2026-02-22 23:27:14.356841,Raw_GL_Export.csv,83.92156862745098,1,True,AUS01,5800,True,5800,Depreciation,True,True,CC3100,Australia Post,MAPPED,2026-01_NZD,0.9335,12629.228149999999,CONVERTED,30184.39373025477,34245.09535020032,157.0,False,0.0,Wednesday,False,True,False,
TXN000929,14-01-2026,07-01-2026,2026-01,AUS01,5110,CC3100,Seek Limited,INV25496,PO8971,AUD,15086.98,INPUT,Payment for consulting,Manual Entry,2026-01-14,2026-01-07,2026,01,15086.98,False,payment for consulting,2026-02-22 23:27:14.356841,Raw_GL_Export.csv,83.92156862745098,0,True,AUS01,5110,True,5110,Utilities,True,True,CC3100,Seek,MAPPED,2026-01_AUD,1.0,15086.98,DOMESTIC,27865.288293732876,21409.69928933269,146.0,False,0.0,Wednesday,False,True,False,
TXN000930,19/05/2025,12/05/2025,2025-05,AUS01,5410,CC2000,KPMG Australia,INV54054,,USD,27514.72,GST-FREE,Payment for subscription,API Import,2025-05-19,2025-05-12,2025,05,27514.72,False,payment for subscription,2026-02-22 23:27:14.356841,Raw_GL_Export.csv,83.92156862745098,0,True,AUS01,5410,True,5410,Accommodation,True,True,CC2000,KPMG,MAPPED,2025-05_USD,1.518,41767.34496,CONVERTED,29277.518810999987,22143.12829502557,155.0,False,0.0,Monday,False,True,True,EX001
TXN000931,2025-01-13,2025-01-11,2025-01,AUS01,5020,CC1100,AWS,INV22099,PO3488,USD,24362.63,EXPORT,Payment for services,SAP,2025-01-13,2025-01-11,2025,01,24362.63,False,payment for services,2026-02-22 23:27:14.356841,Raw_GL_Export.csv,83.92156862745098,0,True,AUS01,5020,True,5020,Contractor Fees,True,True,CC1100,Amazon Web Services,MAPPED,2025-01_USD,1.52,37031.1976,CONVERTED,28445.577844280295,21241.721119146277,132.0,False,0.0,Monday,False,True,False,
TXN000932,16/02/2026,15/02/2026,2026-02,AUS01,5110,CC2100,Regus Australia,INV15299,,NZD,30006.01,GST,Payment for subscription,Workday,2026-02-16,2026-02-15,2026,02,30006.01,False,payment for subscription,2026-02-22 23:27:14.356841,Raw_GL_Export.csv,83.92156862745098,0,True,AUS01,5110,True,5110,Utilities,True,True,CC2100,Regus,MAPPED,2026-02_NZD,0.932,27965.60132,CONVERTED,27865.288293732876,21409.69928933269,146.0,False,0.0,Monday,False,True,True,EX001
TXN000933,2026-01-04,2025-12-25,2026-01,AUS01,5020,CC1000,AWS,INV74272,,USD,35550.47,EXPORT,Payment for license,Workday,2026-01-04,2025-12-25,2026,01,35550.47,False,payment for license,2026-02-22 23:27:14.356841,Raw_GL_Export.csv,83.92156862745098,0,True,AUS01,5020,True,5020,Contractor Fees,True,True,CC1000,Amazon Web Services,MAPPED,2026-01_USD,1.527,54285.567689999996,CONVERTED,28445.577844280295,21241.721119146277,132.0,False,0.0,Sunday,True,True,True,EX001;EX004
TXN000934,2026-01-20,2026-01-10,2026-01,AUS01,5300,CC1200,Salesforce,INV30629,PO9435,GBP,27316.93,INPUT,Payment for services,Manual Entry,2026-01-20,2026-01-10,2026,01,27316.93,False,payment for services,2026-02-22 23:27:14.356841,Raw_GL_Export.csv,83.92156862745098,0,True,AUS01,5300,True,5300,Professional Services,True,True,CC1200,Salesforce Inc,MAPPED,2026-01_GBP,1.957,53459.23201,CONVERTED,33232.533450429684,35951.49997313202,128.0,False,0.0,Tuesday,False,True,True,EX004
TXN000935,20/02/2026,15/02/2026,2026-02,AUS01,5010,CC3100,BCG,INV57022,PO6020,USD,31301.4,EXPORT,Payment for subscription,Manual Entry,2026-02-20,2026-02-15,2026,02,31301.4,False,payment for subscription,2026-02-22 23:27:14.356841,Raw_GL_Export.csv,83.92156862745098,0,True,AUS01,5010,True,5010,Employee Benefits,True,True,CC3100,Boston Consulting Group,MAPPED,2026-02_USD,1.525,47734.635,CONVERTED,27923.213086278203,19430.63083039902,133.0,False,0.0,Friday,False,True,False,
TXN000936,14/02/2025,09/02/2025,2025-02,AUS01,5700,CC3000,Workday,INV14823,,USD,20811.78,GST-FREE,Payment for license,SAP,2025-02-14,2025-02-09,2025,02,20811.78,False,payment for license,2026-02-22 23:27:14.356841,Raw_GL_Export.csv,83.92156862745098,0,True,AUS01,5700,True,5700,Training,True,True,CC3000,Workday Inc,MAPPED,2025-02_USD,1.51,31425.7878,CONVERTED,31110.431902446802,30160.111495086097,141.0,False,0.0,Friday,False,True,True,EX001
TXN000937,2026-01-05,2025-12-28,2026-01,AUS01,5110,CC1200,Salesforce,INV85926,,NZD,34689.47,INPUT,Payment for consulting,Manual Entry,2026-01-05,2025-12-28,2026,01,34689.47,False,payment for consulting,2026-02-22 23:27:14.356841,Raw_GL_Export.csv,83.92156862745098,0,True,AUS01,5110,True,5110,Utilities,True,True,CC1200,Salesforce Inc,MAPPED,2026-01_NZD,0.9335,32382.620245000002,CONVERTED,27865.288293732876,21409.69928933269,146.0,False,0.0,Monday,False,True,True,EX001
TXN000938,2026-01-14,2026-01-05,2026-01,AUS01,5800,CC4100,EY Australia,INV57737,,USD,40311.97,GST,Payment for goods,Workday,2026-01-14,2026-01-05,2026,01,40311.97,False,payment for goods,2026-02-22 23:27:14.356841,Raw_GL_Export.csv,83.92156862745098,0,True,AUS01,5800,True,5800,Depreciation,True,True,CC4100,EY,MAPPED,2026-01_USD,1.527,61556.378189999996,CONVERTED,30184.39373025477,34245.09535020032,157.0,False,0.0,Wednesday,False,True,True,EX001;EX004
TXN000939,2025-05-03,2025-05-02,2025-05,AUS01,5910,CC2100,Federal Express,INV96288,PO6301,USD,36582.09,EXPORT,Payment for consulting,Oracle,2025-05-03,2025-05-02,2025,05,36582.09,False,payment for consulting,2026-02-22 23:27:14.356841,Raw_GL_Export.csv,83.92156862745098,0,True,AUS01,5910,True,5910,Interest Expense,True,True,CC2100,FedEx,MAPPED,2025-05_USD,1.518,55531.61261999999,CONVERTED,33774.54824600841,21661.31598456901,119.0,False,0.0,Saturday,True,True,True,EX004
TXN000940,02/27/2026,02/20/2026,2026-02,AUS01,5700,CC3000,Oracle,INV42846,PO8977,AUD,39125.92,GST-FREE,Payment for subscription,Oracle,2026-02-27,2026-02-20,2026,02,39125.92,False,payment for subscription,2026-02-22 23:27:14.356841,Raw_GL_Export.csv,83.92156862745098,0,True,AUS01,5700,True,5700,Training,True,True,CC3000,Oracle Corporation,MAPPED,2026-02_AUD,1.0,39125.92,DOMESTIC,31110.431902446802,30160.111495086097,141.0,False,0.0,Friday,False,True,False,
TXN000941,02/02/2026,29/01/2026,2026-02,AUS01,5510,CC4100,Hays,INV64771,,NZD,40838.08,GST-FREE,Payment for services,Workday,2026-02-02,2026-01-29,2026,02,40838.08,False,payment for services,2026-02-22 23:27:14.356841,Raw_GL_Export.csv,83.92156862745098,0,True,AUS01,5510,True,5510,Advertising,True,True,CC4100,Hays Recruitment,MAPPED,2026-02_NZD,0.932,38061.090560000004,CONVERTED,28498.583342781956,23667.16979723599,133.0,False,0.0,Monday,False,True,True,EX001
TXN000942,01/23/2026,01/13/2026,2026-01,AUS01,5320,CC3000,AWS,INV37664,,AUD,21777.65,GST-FREE,Payment for license,Workday,2026-01-23,2026-01-13,2026,01,21777.65,False,payment for license,2026-02-22 23:27:14.356841,Raw_GL_Export.csv,83.92156862745098,0,True,AUS01,5320,True,5320,Audit Fees,True,True,CC3000,Amazon Web Services,MAPPED,2026-01_AUD,1.0,21777.65,DOMESTIC,31658.610713475173,32284.527206153973,141.0,False,0.0,Friday,False,True,True,EX001
TXN000943,17-11-2025,08-11-2025,2025-11,AUS01,5600,CC4100,SAP,INV69631,PO9964,GBP,34660.06,GST,Payment for subscription,API Import,2025-11-17,2025-11-08,2025,11,34660.06,False,payment for subscription,2026-02-22 23:27:14.356841,Raw_GL_Export.csv,83.92156862745098,0,True,AUS01,5600,True,5600,Telecommunications,True,True,CC4100,SAP SE,MAPPED,2025-11_GBP,1.956,67795.07736,CONVERTED,32190.120230168057,26805.910450208805,119.0,False,0.0,Monday,False,True,True,EX004
TXN000944,25-02-2026,24-02-2026,2026-02,AUS01,5300,CC3000,Amazon,INV72195,PO7836,GBP,26560.48,GST,Payment for consulting,API Import,2026-02-25,2026-02-24,2026,02,26560.48,False,payment for consulting,2026-02-22 23:27:14.356841,Raw_GL_Export.csv,83.92156862745098,0,True,AUS01,5300,True,5300,Professional Services,True,True,CC3000,Amazon Web Services,MAPPED,2026-02_GBP,1.955,51925.7384,CONVERTED,33232.533450429684,35951.49997313202,128.0,False,0.0,Wednesday,False,True,True,EX004
TXN000945,19/01/2026,13/01/2026,2026-01,AUS01,5910,CC4100,ServiceNow Inc,INV40077,PO5163,GBP,11985.05,GST,Payment for consulting,Workday,2026-01-19,2026-01-13,2026,01,11985.05,False,payment for consulting,2026-02-22 23:27:14.356841,Raw_GL_Export.csv,83.92156862745098,0,True,AUS01,5910,True,5910,Interest Expense,True,True,CC4100,ServiceNow,MAPPED,2026-01_GBP,1.957,23454.74285,CONVERTED,33774.54824600841,21661.31598456901,119.0,False,0.0,Monday,False,True,False,
TXN000946,01/01/2026,31/12/2025,2026-01,AUS01,5210,CC3200,Accenture Pty,INV19975,PO5483,GBP,201.04,GST,Payment for license,API Import,2026-01-01,2025-12-31,2026,01,201.04,False,payment for license,2026-02-22 23:27:14.356841,Raw_GL_Export.csv,83.92156862745098,0,True,AUS01,5210,True,5210,Cloud Services,True,True,CC3200,Accenture,MAPPED,2026-01_GBP,1.957,393.43528,CONVERTED,31620.56664919015,27460.393400888206,142.0,False,0.0,Thursday,False,True,False,
TXN000947,2025-06-14,2025-06-05,2025-06,AUS01,5920,CC2100,MSFT,INV80004,PO5711,GBP,44500.19,GST-FREE,Payment for services,Oracle,2025-06-14,2025-06-05,2025,06,44500.19,False,payment for services,2026-02-22 23:27:14.356841,Raw_GL_Export.csv,83.92156862745098,0,True,AUS01,5920,True,5920,FX Loss,True,True,CC2100,Microsoft Corporation,MAPPED,2025-06_GBP,1.952,86864.37088,CONVERTED,27533.92400565971,21784.021192347693,144.0,False,0.0,Saturday,True,True,True,EX004
TXN000948,02/13/2026,02/10/2026,2026-02,AUS01,5520,CC2000,AWS,INV72896,,GBP,3677.49,GST-FREE,Payment for goods,Workday,2026-02-13,2026-10-02,2026,02,3677.49,False,payment for goods,2026-02-22 23:27:14.356841,Raw_GL_Export.csv,83.92156862745098,0,True,AUS01,5520,True,5520,Events,True,True,CC2000,Amazon Web Services,MAPPED,2026-02_GBP,1.955,7189.49295,CONVERTED,30860.276023483882,21900.267908653983,155.0,False,0.0,Friday,False,True,True,EX001
TXN000949,02/06/2026,02/01/2026,2026-02,AUS01,5410,CC1200,Telstra Corp,INV22793,PO5731,USD,32839.36,INPUT,Payment for subscription,API Import,2026-06-02,2026-01-02,2026,02,32839.36,False,payment for subscription,2026-02-22 23:27:14.356841,Raw_GL_Export.csv,83.92156862745098,1,True,AUS01,5410,True,5410,Accommodation,True,True,CC1200,Telstra,MAPPED,2026-02_USD,1.525,50080.024,CONVERTED,29277.518810999987,22143.12829502557,155.0,False,0.0,Tuesday,False,True,True,EX004;EX007
TXN000950,2026-01-23,2026-01-21,2026-01,AUS01,5110,CC1100,AWS,INV33458,,USD,3062.6,INPUT,Payment for consulting,Workday,2026-01-23,2026-01-21,2026,01,3062.6,False,payment for consulting,2026-02-22 23:27:14.356841,Raw_GL_Export.csv,83.92156862745098,0,True,AUS01,5110,True,5110,Utilities,True,True,CC1100,Amazon Web Services,MAPPED,2026-01_USD,1.527,4676.5902,CONVERTED,27865.288293732876,21409.69928933269,146.0,False,0.0,Friday,False,True,True,EX001
TXN000951,04-08-2025,26-07-2025,2025-08,AUS01,5100,CC3200,PWC,INV56299,,AUD,16096.03,GST,Payment for goods,API Import,2025-08-04,2025-07-26,2025,08,16096.03,False,payment for goods,2026-02-22 23:27:14.356841,Raw_GL_Export.csv,83.92156862745098,0,True,AUS01,5100,True,5100,Office Rent,True,True,CC3200,PwC,MAPPED,2025-08_AUD,1.0,16096.03,DOMESTIC,29138.02959753333,27547.65120166844,150.0,False,0.0,Monday,False,True,True,EX001
TXN000952,2026-02-09,2026-01-30,2026-02,AUS01,5900,CC1100,Salesforce,INV78430,PO9762,USD,6647.0,GST-FREE,Payment for goods,Manual Entry,2026-02-09,2026-01-30,2026,02,6647.0,False,payment for goods,2026-02-22 23:27:14.356841,Raw_GL_Export.csv,83.92156862745098,0,True,AUS01,5900,True,5900,Bank Charges,True,True,CC1100,Salesforce Inc,MAPPED,2026-02_USD,1.525,10136.675,CONVERTED,31670.032329854675,24882.231532617723,172.0,False,0.0,Monday,False,True,False,
TXN000953,01/25/2026,01/24/2026,2026-01,AUS01,5310,CC3100,Telstra Corp,INV37834,,AUD,36346.65,EXPORT,Payment for license,Manual Entry,2026-01-25,2026-01-24,2026,01,36346.65,False,payment for license,2026-02-22 23:27:14.356841,Raw_GL_Export.csv,83.92156862745098,0,True,AUS01,5310,True,5310,Legal Fees,True,True,CC3100,Telstra,MAPPED,2026-01_AUD,1.0,36346.65,DOMESTIC,33139.04129260232,28423.631835285127,171.0,False,0.0,Sunday,True,True,True,EX001
TXN000954,2026-01-25,2026-01-21,2026-01,AUS01,5910,CC3200,LinkedIn Corp,INV36098,PO1596,GBP,14567.41,INPUT,Payment for consulting,Oracle,2026-01-25,2026-01-21,2026,01,14567.41,False,payment for consulting,2026-02-22 23:27:14.356841,Raw_GL_Export.csv,83.92156862745098,0,True,AUS01,5910,True,5910,Interest Expense,True,True,CC3200,LinkedIn,MAPPED,2026-01_GBP,1.957,28508.42137,CONVERTED,33774.54824600841,21661.31598456901,119.0,False,0.0,Sunday,True,True,False,
TXN000955,01/01/2026,12/31/2025,2026-01,AUS01,5700,CC3000,BCG,INV51309,PO2396,GBP,33763.0,GST,Payment for goods,SAP,2026-01-01,2025-12-31,2026,01,33763.0,False,payment for goods,2026-02-22 23:27:14.356841,Raw_GL_Export.csv,83.92156862745098,0,True,AUS01,5700,True,5700,Training,True,True,CC3000,Boston Consulting Group,MAPPED,2026-01_GBP,1.957,66074.191,CONVERTED,31110.431902446802,30160.111495086097,141.0,False,0.0,Thursday,False,True,True,EX004
TXN000956,2025-11-20,2025-11-10,2025-11,AUS01,5110,CC3200,Hays,INV93634,PO6112,NZD,5476.91,GST,Payment for license,Manual Entry,2025-11-20,2025-11-10,2025,11,5476.91,False,payment for license,2026-02-22 23:27:14.356841,Raw_GL_Export.csv,83.92156862745098,0,True,AUS01,5110,True,5110,Utilities,True,True,CC3200,Hays Recruitment,MAPPED,2025-11_NZD,0.933,5109.9570300000005,CONVERTED,27865.288293732876,21409.69928933269,146.0,False,0.0,Thursday,False,True,False,
TXN000957,2026-01-10,2026-01-08,2026-01,AUS01,5010,CC2100,Slack,INV46787,PO7750,NZD,36724.63,GST-FREE,Payment for services,API Import,2026-01-10,2026-01-08,2026,01,36724.63,False,payment for services,2026-02-22 23:27:14.356841,Raw_GL_Export.csv,83.92156862745098,0,True,AUS01,5010,True,5010,Employee Benefits,True,True,CC2100,Slack Technologies,MAPPED,2026-01_NZD,0.9335,34282.442104999995,CONVERTED,27923.213086278203,19430.63083039902,133.0,False,0.0,Saturday,True,True,False,
TXN000958,2026-02-12,2026-02-04,2026-02,AUS01,5300,CC2100,AusPost,INV52959,,AUD,1274.04,INPUT,Payment for services,Oracle,2026-02-12,2026-02-04,2026,02,1274.04,False,payment for services,2026-02-22 23:27:14.356841,Raw_GL_Export.csv,83.92156862745098,0,True,AUS01,5300,True,5300,Professional Services,True,True,CC2100,Australia Post,MAPPED,2026-02_AUD,1.0,1274.04,DOMESTIC,33232.533450429684,35951.49997313202,128.0,False,0.0,Thursday,False,True,True,EX001
TXN000959,2025-05-17,2025-05-11,2025-05,AUS01,5100,CC1100,Deloitte Touche,INV33936,PO2291,NZD,14392.2,GST,Payment for goods,SAP,2025-05-17,2025-05-11,2025,05,14392.2,False,payment for goods,2026-02-22 23:27:14.356841,Raw_GL_Export.csv,83.92156862745098,0,True,AUS01,5100,True,5100,Office Rent,True,True,CC1100,Deloitte,MAPPED,2025-05_NZD,0.928,13355.9616,CONVERTED,29138.02959753333,27547.65120166844,150.0,False,0.0,Saturday,True,True,False,
TXN000960,02/09/2026,01/31/2026,2026-02,AUS01,5810,CC4000,Google,INV23164,PO1667,NZD,40793.74,INPUT,Payment for subscription,Manual Entry,2026-09-02,2026-01-31,2026,02,40793.74,False,payment for subscription,2026-02-22 23:27:14.356841,Raw_GL_Export.csv,83.92156862745098,1,True,AUS01,5810,True,5810,Amortization,True,True,CC4000,Google Cloud,MAPPED,2026-02_NZD,0.932,38019.76568,CONVERTED,31768.91314562501,27328.351394475325,120.0,False,0.0,Wednesday,False,True,True,EX007
TXN000961,08/03/2025,07/29/2025,2025-08,AUS01,5800,CC1000,Slack,INV24002,PO1696,AUD,4334.74,GST,Payment for consulting,Workday,2025-03-08,2025-07-29,2025,08,4334.74,False,payment for consulting,2026-02-22 23:27:14.356841,Raw_GL_Export.csv,83.92156862745098,1,True,AUS01,5800,True,5800,Depreciation,True,True,CC1000,Slack Technologies,MAPPED,2025-08_AUD,1.0,4334.74,DOMESTIC,30184.39373025477,34245.09535020032,157.0,False,0.0,Saturday,True,True,False,
TXN000962,2026-02-13,2026-02-08,2026-02,AUS01,5120,CC4100,Accenture Pty,INV94998,PO2701,AUD,15099.42,GST-FREE,Payment for services,Manual Entry,2026-02-13,2026-02-08,2026,02,15099.42,False,payment for services,2026-02-22 23:27:14.356841,Raw_GL_Export.csv,83.92156862745098,0,True,AUS01,5120,True,5120,Office Supplies,True,True,CC4100,Accenture,MAPPED,2026-02_AUD,1.0,15099.42,DOMESTIC,34269.00595485611,35424.20705021751,139.0,False,0.0,Friday,False,True,False,
TXN000963,07/07/2025,04/07/2025,2025-07,AUS01,5800,CC4000,Accenture Pty,INV85588,PO4072,GBP,337.36,INPUT,Payment for consulting,API Import,2025-07-07,2025-07-04,2025,07,337.36,False,payment for consulting,2026-02-22 23:27:14.356841,Raw_GL_Export.csv,83.92156862745098,0,True,AUS01,5800,True,5800,Depreciation,True,True,CC4000,Accenture,MAPPED,2025-07_GBP,1.958,660.55088,CONVERTED,30184.39373025477,34245.09535020032,157.0,False,0.0,Monday,False,True,False,
TXN000964,2026-01-08,2026-01-01,2026-01,AUS01,5200,CC4100,Federal Express,INV55123,,USD,37143.64,INPUT,Payment for license,Manual Entry,2026-01-08,2026-01-01,2026,01,37143.64,False,payment for license,2026-02-22 23:27:14.356841,Raw_GL_Export.csv,83.92156862745098,0,True,AUS01,5200,True,5200,Software Licenses,True,True,CC4100,FedEx,MAPPED,2026-01_USD,1.527,56718.338279999996,CONVERTED,30196.543712413786,22166.314759696765,145.0,False,0.0,Thursday,False,True,True,EX001;EX004
TXN000965,05/19/2025,05/14/2025,2025-05,AUS01,5210,CC4100,Atlassian Pty,INV10190,PO7644,GBP,11549.47,EXPORT,Payment for license,Oracle,2025-05-19,2025-05-14,2025,05,11549.47,False,payment for license,2026-02-22 23:27:14.356841,Raw_GL_Export.csv,83.92156862745098,0,True,AUS01,5210,True,5210,Cloud Services,True,True,CC4100,Atlassian,MAPPED,2025-05_GBP,1.948,22498.36756,CONVERTED,31620.56664919015,27460.393400888206,142.0,False,0.0,Monday,False,True,False,
TXN000966,01/24/2026,01/21/2026,2026-01,AUS01,5600,CC1200,Atlassian Pty,INV40258,PO1762,USD,6046.94,GST,Payment for services,Manual Entry,2026-01-24,2026-01-21,2026,01,6046.94,False,payment for services,2026-02-22 23:27:14.356841,Raw_GL_Export.csv,83.92156862745098,0,True,AUS01,5600,True,5600,Telecommunications,True,True,CC1200,Atlassian,MAPPED,2026-01_USD,1.527,9233.67738,CONVERTED,32190.120230168057,26805.910450208805,119.0,False,0.0,Saturday,True,True,False,
TXN000967,05/02/2026,31/01/2026,2026-02,AUS01,5100,CC4100,AWS,INV64179,,USD,32303.92,GST,Payment for goods,Manual Entry,2026-02-05,2026-01-31,2026,02,32303.92,False,payment for goods,2026-02-22 23:27:14.356841,Raw_GL_Export.csv,83.92156862745098,0,True,AUS01,5100,True,5100,Office Rent,True,True,CC4100,Amazon Web Services,MAPPED,2026-02_USD,1.525,49263.477999999996,CONVERTED,29138.02959753333,27547.65120166844,150.0,False,0.0,Thursday,False,True,True,EX001
TXN000968,05/02/2026,03/02/2026,2026-02,AUS01,5920,CC3000,McKinsey,INV68118,PO3390,GBP,17104.74,INPUT,Payment for goods,Manual Entry,2026-02-05,2026-02-03,2026,02,17104.74,False,payment for goods,2026-02-22 23:27:14.356841,Raw_GL_Export.csv,83.92156862745098,0,True,AUS01,5920,True,5920,FX Loss,True,True,CC3000,McKinsey & Company,MAPPED,2026-02_GBP,1.955,33439.76670000001,CONVERTED,27533.92400565971,21784.021192347693,144.0,False,0.0,Thursday,False,True,False,
TXN000969,12/08/2025,08/08/2025,2025-08,AUS01,5500,CC3200,PWC,INV66792,PO2006,GBP,2297.11,GST,Payment for services,Manual Entry,2025-08-12,2025-08-08,2025,08,2297.11,False,payment for services,2026-02-22 23:27:14.356841,Raw_GL_Export.csv,83.92156862745098,0,True,AUS01,5500,True,5500,Marketing,True,True,CC3200,PwC,MAPPED,2025-08_GBP,1.954,4488.5529400000005,CONVERTED,28972.634359125877,32785.70497360227,143.0,False,0.0,Tuesday,False,True,False,
TXN000970,12/17/2025,12/13/2025,2025-12,AUS01,5410,CC1100,KPMG Australia,INV65856,PO8753,USD,12826.73,GST-FREE,Payment for license,SAP,2025-12-17,2025-12-13,2025,12,12826.73,False,payment for license,2026-02-22 23:27:14.356841,Raw_GL_Export.csv,83.92156862745098,0,True,AUS01,5410,True,5410,Accommodation,True,True,CC1100,KPMG,MAPPED,2025-12_USD,1.523,19535.10979,CONVERTED,29277.518810999987,22143.12829502557,155.0,False,0.0,Wednesday,False,True,False,
TXN000971,19-02-2026,13-02-2026,2026-02,AUS01,5300,CC2000,Optus Pty,INV72499,PO5417,USD,31010.55,INPUT,Payment for goods,Manual Entry,2026-02-19,2026-02-13,2026,02,31010.55,False,payment for goods,2026-02-22 23:27:14.356841,Raw_GL_Export.csv,83.92156862745098,0,True,AUS01,5300,True,5300,Professional Services,True,True,CC2000,Optus,MAPPED,2026-02_USD,1.525,47291.088749999995,CONVERTED,33232.533450429684,35951.49997313202,128.0,False,0.0,Thursday,False,True,False,
TXN000972,08-06-2025,05-06-2025,2025-06,AUS01,5000,CC2000,Hays,INV24394,,GBP,9927.39,GST-FREE,Payment for subscription,API Import,2025-06-08,2025-06-05,2025,06,9927.39,False,payment for subscription,2026-02-22 23:27:14.356841,Raw_GL_Export.csv,83.92156862745098,0,True,AUS01,5000,True,5000,Salaries and Wages,True,True,CC2000,Hays Recruitment,MAPPED,2025-06_GBP,1.952,19378.26528,CONVERTED,30471.385558248177,22939.768434623154,137.0,False,0.0,Sunday,True,True,True,EX001
TXN000973,2026-02-09,2026-02-04,2026-02,AUS01,5920,CC4000,EY Australia,INV41617,PO5130,GBP,1011.45,GST,Payment for goods,API Import,2026-02-09,2026-02-04,2026,02,1011.45,False,payment for goods,2026-02-22 23:27:14.356841,Raw_GL_Export.csv,83.92156862745098,0,True,AUS01,5920,True,5920,FX Loss,True,True,CC4000,EY,MAPPED,2026-02_GBP,1.955,1977.3847500000002,CONVERTED,27533.92400565971,21784.021192347693,144.0,False,0.0,Monday,False,True,False,
TXN000974,28/02/2026,20/02/2026,2026-02,AUS01,5510,CC1000,Zoom,INV84442,PO8881,AUD,14799.21,EXPORT,Payment for goods,Oracle,2026-02-28,2026-02-20,2026,02,14799.21,False,payment for goods,2026-02-22 23:27:14.356841,Raw_GL_Export.csv,83.92156862745098,0,True,AUS01,5510,True,5510,Advertising,True,True,CC1000,Zoom Video Communications,MAPPED,2026-02_AUD,1.0,14799.21,DOMESTIC,28498.583342781956,23667.16979723599,133.0,False,0.0,Saturday,True,True,False,
TXN000975,02/04/2026,01/28/2026,2026-02,AUS01,5220,CC2100,SAP,INV22594,PO4215,GBP,30175.65,INPUT,Payment for goods,Workday,2026-04-02,2026-01-28,2026,02,30175.65,False,payment for goods,2026-02-22 23:27:14.356841,Raw_GL_Export.csv,83.92156862745098,1,True,AUS01,5220,True,5220,IT Support,True,True,CC2100,SAP SE,MAPPED,2026-02_GBP,1.955,58993.39575,CONVERTED,29540.94372533058,19404.169897416657,121.0,False,0.0,Thursday,False,True,True,EX004;EX007
TXN000976,02/02/2026,01/27/2026,2026-02,AUS01,5500,CC2000,BCG,INV19996,,GBP,10318.24,GST,Payment for goods,Oracle,2026-02-02,2026-01-27,2026,02,10318.24,False,payment for goods,2026-02-22 23:27:14.356841,Raw_GL_Export.csv,83.92156862745098,0,True,AUS01,5500,True,5500,Marketing,True,True,CC2000,Boston Consulting Group,MAPPED,2026-02_GBP,1.955,20172.159200000002,CONVERTED,28972.634359125877,32785.70497360227,143.0,False,0.0,Monday,False,True,True,EX001
TXN000977,2026-02-14,2026-02-10,2026-02,AUS01,5420,CC3100,Salesforce,INV27789,,AUD,30675.14,EXPORT,Payment for goods,Oracle,2026-02-14,2026-02-10,2026,02,30675.14,False,payment for goods,2026-02-22 23:27:14.356841,Raw_GL_Export.csv,83.92156862745098,0,True,AUS01,5420,True,5420,Meals and Entertainment,True,True,CC3100,Salesforce Inc,MAPPED,2026-02_AUD,1.0,30675.14,DOMESTIC,30119.54810314684,25344.73848974119,143.0,False,0.0,Saturday,True,True,True,EX001
TXN000978,2026-01-12,2026-01-11,2026-01,AUS01,5220,CC1000,AusPost,INV37405,,AUD,44610.07,EXPORT,Payment for goods,API Import,2026-01-12,2026-01-11,2026,01,44610.07,False,payment for goods,2026-02-22 23:27:14.356841,Raw_GL_Export.csv,83.92156862745098,0,True,AUS01,5220,True,5220,IT Support,True,True,CC1000,Australia Post,MAPPED,2026-01_AUD,1.0,44610.07,DOMESTIC,29540.94372533058,19404.169897416657,121.0,False,0.0,Monday,False,True,True,EX001
TXN000979,2026-02-04,2026-01-30,2026-02,AUS01,5900,CC4100,Accenture Pty,INV80919,,AUD,21472.96,INPUT,Payment for services,Manual Entry,2026-02-04,2026-01-30,2026,02,21472.96,False,payment for services,2026-02-22 23:27:14.356841,Raw_GL_Export.csv,83.92156862745098,0,True,AUS01,5900,True,5900,Bank Charges,True,True,CC4100,Accenture,MAPPED,2026-02_AUD,1.0,21472.96,DOMESTIC,31670.032329854675,24882.231532617723,172.0,False,0.0,Wednesday,False,True,True,EX001
TXN000980,27/12/2025,20/12/2025,2025-12,AUS01,5310,CC1100,Google,INV10012,PO6717,USD,41624.02,INPUT,Payment for subscription,Manual Entry,2025-12-27,2025-12-20,2025,12,41624.02,False,payment for subscription,2026-02-22 23:27:14.356841,Raw_GL_Export.csv,83.92156862745098,0,True,AUS01,5310,True,5310,Legal Fees,True,True,CC1100,Google Cloud,MAPPED,2025-12_USD,1.523,63393.38245999999,CONVERTED,33139.04129260232,28423.631835285127,171.0,False,0.0,Saturday,True,True,True,EX004
TXN000981,18/06/2025,17/06/2025,2025-06,AUS01,5800,CC1100,Amazon,INV40699,PO3939,NZD,8745.25,GST-FREE,Payment for goods,Oracle,2025-06-18,2025-06-17,2025,06,8745.25,False,payment for goods,2026-02-22 23:27:14.356841,Raw_GL_Export.csv,83.92156862745098,0,True,AUS01,5800,True,5800,Depreciation,True,True,CC1100,Amazon Web Services,MAPPED,2025-06_NZD,0.931,8141.82775,CONVERTED,30184.39373025477,34245.09535020032,157.0,False,0.0,Wednesday,False,True,False,
TXN000982,07/02/2026,02/02/2026,2026-02,AUS01,5420,CC1000,Optus Pty,INV25450,PO4345,USD,27877.21,GST,Payment for subscription,Workday,2026-02-07,2026-02-02,2026,02,27877.21,False,payment for subscription,2026-02-22 23:27:14.356841,Raw_GL_Export.csv,83.92156862745098,0,True,AUS01,5420,True,5420,Meals and Entertainment,True,True,CC1000,Optus,MAPPED,2026-02_USD,1.525,42512.74524999999,CONVERTED,30119.54810314684,25344.73848974119,143.0,False,0.0,Saturday,True,True,False,
TXN000983,27-02-2025,24-02-2025,2025-02,AUS01,5710,CC1100,Adobe,INV59091,,GBP,17076.07,GST-FREE,Payment for goods,Manual Entry,2025-02-27,2025-02-24,2025,02,17076.07,False,payment for goods,2026-02-22 23:27:14.356841,Raw_GL_Export.csv,83.92156862745098,0,True,AUS01,5710,True,5710,Recruitment,True,True,CC1100,Adobe Systems,MAPPED,2025-02_GBP,1.94,33127.5758,CONVERTED,29496.09592285716,24753.031499859637,133.0,False,0.0,Thursday,False,True,True,EX001
TXN000984,2026-02-04,2026-02-01,2026-02,AUS01,5200,CC1100,Zoom,INV31782,,GBP,4968.94,GST-FREE,Payment for license,API Import,2026-02-04,2026-02-01,2026,02,4968.94,False,payment for license,2026-02-22 23:27:14.356841,Raw_GL_Export.csv,83.92156862745098,0,True,AUS01,5200,True,5200,Software Licenses,True,True,CC1100,Zoom Video Communications,MAPPED,2026-02_GBP,1.955,9714.277699999999,CONVERTED,30196.543712413786,22166.314759696765,145.0,False,0.0,Wednesday,False,True,True,EX001
TXN000985,01/22/2026,01/14/2026,2026-01,AUS01,5120,CC4100,Workday,INV46592,PO4508,GBP,19177.4,EXPORT,Payment for services,Oracle,2026-01-22,2026-01-14,2026,01,19177.4,False,payment for services,2026-02-22 23:27:14.356841,Raw_GL_Export.csv,83.92156862745098,0,True,AUS01,5120,True,5120,Office Supplies,True,True,CC4100,Workday Inc,MAPPED,2026-01_GBP,1.957,37530.171800000004,CONVERTED,34269.00595485611,35424.20705021751,139.0,False,0.0,Thursday,False,True,False,
TXN000986,02/13/2026,02/06/2026,2026-02,AUS01,5810,CC4000,LinkedIn Corp,INV26617,PO4764,AUD,39375.14,GST,Payment for license,SAP,2026-02-13,2026-06-02,2026,02,39375.14,False,payment for license,2026-02-22 23:27:14.356841,Raw_GL_Export.csv,83.92156862745098,0,True,AUS01,5810,True,5810,Amortization,True,True,CC4000,LinkedIn,MAPPED,2026-02_AUD,1.0,39375.14,DOMESTIC,31768.91314562501,27328.351394475325,120.0,False,0.0,Friday,False,True,False,
TXN000987,18-01-2025,11-01-2025,2025-01,AUS01,5620,CC4100,Slack,INV26571,,AUD,23356.15,GST-FREE,Payment for services,API Import,2025-01-18,2025-01-11,2025,01,23356.15,False,payment for services,2026-02-22 23:27:14.356841,Raw_GL_Export.csv,83.92156862745098,0,True,AUS01,5620,True,5620,Insurance,True,True,CC4100,Slack Technologies,MAPPED,2025-01_AUD,1.0,23356.15,DOMESTIC,32410.971605588227,27490.799177232966,170.0,False,0.0,Saturday,True,True,True,EX001
TXN000988,2026-01-28,2026-01-24,2026-01,AUS01,5520,CC4000,Google,INV44033,,NZD,23675.91,GST,Payment for license,Oracle,2026-01-28,2026-01-24,2026,01,23675.91,False,payment for license,2026-02-22 23:27:14.356841,Raw_GL_Export.csv,83.92156862745098,0,True,AUS01,5520,True,5520,Events,True,True,CC4000,Google Cloud,MAPPED,2026-01_NZD,0.9335,22101.461984999998,CONVERTED,30860.276023483882,21900.267908653983,155.0,False,0.0,Wednesday,False,True,True,EX001
TXN000989,27/01/2026,26/01/2026,2026-01,AUS01,5410,CC3200,Workday,INV93394,,USD,36148.87,GST-FREE,Payment for goods,API Import,2026-01-27,2026-01-26,2026,01,36148.87,False,payment for goods,2026-02-22 23:27:14.356841,Raw_GL_Export.csv,83.92156862745098,0,True,AUS01,5410,True,5410,Accommodation,True,True,CC3200,Workday Inc,MAPPED,2026-01_USD,1.527,55199.32449,CONVERTED,29277.518810999987,22143.12829502557,155.0,False,0.0,Tuesday,False,True,True,EX001;EX004
TXN000990,2025-02-15,2025-02-08,2025-02,AUS01,5800,CC4000,Google,INV54260,,NZD,20794.37,INPUT,Payment for services,SAP,2025-02-15,2025-02-08,2025,02,20794.37,False,payment for services,2026-02-22 23:27:14.356841,Raw_GL_Export.csv,83.92156862745098,0,True,AUS01,5800,True,5800,Depreciation,True,True,CC4000,Google Cloud,MAPPED,2025-02_NZD,0.925,19234.79225,CONVERTED,30184.39373025477,34245.09535020032,157.0,False,0.0,Saturday,True,True,True,EX001
TXN000991,2026-01-25,2026-01-24,2026-01,AUS01,5020,CC3000,Adobe,INV73016,PO2609,AUD,3810.2,GST-FREE,Payment for consulting,API Import,2026-01-25,2026-01-24,2026,01,3810.2,False,payment for consulting,2026-02-22 23:27:14.356841,Raw_GL_Export.csv,83.92156862745098,0,True,AUS01,5020,True,5020,Contractor Fees,True,True,CC3000,Adobe Systems,MAPPED,2026-01_AUD,1.0,3810.2,DOMESTIC,28445.577844280295,21241.721119146277,132.0,False,0.0,Sunday,True,True,False,
TXN000992,01/21/2026,01/20/2026,2026-01,AUS01,5900,CC4100,Amazon,INV59682,PO9257,USD,44479.29,INPUT,Payment for subscription,Workday,2026-01-21,2026-01-20,2026,01,44479.29,False,payment for subscription,2026-02-22 23:27:14.356841,Raw_GL_Export.csv,83.92156862745098,0,True,AUS01,5900,True,5900,Bank Charges,True,True,CC4100,Amazon Web Services,MAPPED,2026-01_USD,1.527,67919.87583,CONVERTED,31670.032329854675,24882.231532617723,172.0,False,0.0,Wednesday,False,True,True,EX004
TXN000993,09/12/2025,07/12/2025,2025-12,AUS01,5520,CC1200,Seek Limited,INV29736,,NZD,22152.15,GST,Payment for subscription,API Import,2025-12-09,2025-12-07,2025,12,22152.15,False,payment for subscription,2026-02-22 23:27:14.356841,Raw_GL_Export.csv,83.92156862745098,0,True,AUS01,5520,True,5520,Events,True,True,CC1200,Seek,MAPPED,2025-12_NZD,0.9305,20612.575575000003,CONVERTED,30860.276023483882,21900.267908653983,155.0,False,0.0,Tuesday,False,True,True,EX001
TXN000994,2026-02-20,2026-02-14,2026-02,AUS01,5400,CC3200,Microsoft,INV88539,,GBP,21082.34,GST,Payment for subscription,Oracle,2026-02-20,2026-02-14,2026,02,21082.34,False,payment for subscription,2026-02-22 23:27:14.356841,Raw_GL_Export.csv,83.92156862745098,0,True,AUS01,5400,True,5400,Travel,True,True,CC3200,Microsoft Corporation,MAPPED,2026-02_GBP,1.955,41215.9747,CONVERTED,31663.682660000006,30146.476988256833,133.0,False,0.0,Friday,False,True,True,EX001
TXN000995,01/13/2026,01/07/2026,2026-01,AUS01,5020,CC3000,PWC,INV40907,PO5414,USD,18292.73,GST,Payment for license,Oracle,2026-01-13,2026-07-01,2026,01,18292.73,False,payment for license,2026-02-22 23:27:14.356841,Raw_GL_Export.csv,83.92156862745098,0,True,AUS01,5020,True,5020,Contractor Fees,True,True,CC3000,PwC,MAPPED,2026-01_USD,1.527,27932.998709999996,CONVERTED,28445.577844280295,21241.721119146277,132.0,False,0.0,Tuesday,False,True,False,
TXN000996,02/11/2026,02/10/2026,2026-02,AUS01,5320,CC2100,Adobe,INV91922,PO7663,GBP,32859.03,GST,Payment for goods,Oracle,2026-11-02,2026-10-02,2026,02,32859.03,False,payment for goods,2026-02-22 23:27:14.356841,Raw_GL_Export.csv,83.92156862745098,1,True,AUS01,5320,True,5320,Audit Fees,True,True,CC2100,Adobe Systems,MAPPED,2026-02_GBP,1.955,64239.40365,CONVERTED,31658.610713475173,32284.527206153973,141.0,False,0.0,Monday,False,True,True,EX004;EX007
TXN000997,14-02-2026,04-02-2026,2026-02,AUS01,5320,CC1000,Oracle,INV16158,PO7417,USD,2996.7,INPUT,Payment for subscription,API Import,2026-02-14,2026-02-04,2026,02,2996.7,False,payment for subscription,2026-02-22 23:27:14.356841,Raw_GL_Export.csv,83.92156862745098,0,True,AUS01,5320,True,5320,Audit Fees,True,True,CC1000,Oracle Corporation,MAPPED,2026-02_USD,1.525,4569.9675,CONVERTED,31658.610713475173,32284.527206153973,141.0,False,0.0,Saturday,True,True,False,
TXN000998,2026-02-04,2026-01-30,2026-02,AUS01,5620,CC2100,Oracle,INV77589,,GBP,22480.28,GST-FREE,Payment for goods,API Import,2026-02-04,2026-01-30,2026,02,22480.28,False,payment for goods,2026-02-22 23:27:14.356841,Raw_GL_Export.csv,83.92156862745098,0,True,AUS01,5620,True,5620,Insurance,True,True,CC2100,Oracle Corporation,MAPPED,2026-02_GBP,1.955,43948.9474,CONVERTED,32410.971605588227,27490.799177232966,170.0,False,0.0,Wednesday,False,True,True,EX001
TXN000999,2026-02-21,2026-02-14,2026-02,AUS01,5220,CC2000,Zoom,INV91143,PO3799,AUD,6453.39,EXPORT,Payment for license,API Import,2026-02-21,2026-02-14,2026,02,6453.39,False,payment for license,2026-02-22 23:27:14.356841,Raw_GL_Export.csv,83.92156862745098,0,True,AUS01,5220,True,5220,IT Support,True,True,CC2000,Zoom Video Communications,MAPPED,2026-02_AUD,1.0,6453.39,DOMESTIC,29540.94372533058,19404.169897416657,121.0,False,0.0,Saturday,True,True,False,
TXN001000,02/21/2026,02/14/2026,2026-02,AUS01,5300,CC1200,Amazon,INV58268,PO9656,USD,39587.13,GST-FREE,Payment for consulting,Oracle,2026-02-21,2026-02-14,2026,02,39587.13,False,payment for consulting,2026-02-22 23:27:14.356841,Raw_GL_Export.csv,83.92156862745098,0,True,AUS01,5300,True,5300,Professional Services,True,True,CC1200,Amazon Web Services,MAPPED,2026-02_USD,1.525,60370.37324999999,CONVERTED,33232.533450429684,35951.49997313202,128.0,False,0.0,Saturday,True,True,True,EX004
TXN001001,02/04/2026,01/30/2026,2026-02,AUS01,5020,CC3200,Microsoft,INV30535,PO7122,GBP,13193.98,EXPORT,Payment for subscription,SAP,2026-04-02,2026-01-30,2026,02,13193.98,False,payment for subscription,2026-02-22 23:27:14.356841,Raw_GL_Export.csv,83.92156862745098,1,True,AUS01,5020,True,5020,Contractor Fees,True,True,CC3200,Microsoft Corporation,MAPPED,2026-02_GBP,1.955,25794.2309,CONVERTED,28445.577844280295,21241.721119146277,132.0,False,0.0,Thursday,False,True,True,EX007
TXN001002,06-01-2025,02-01-2025,2025-01,AUS01,5800,CC3000,BCG,INV97643,,USD,13293.11,GST,Payment for consulting,Workday,2025-01-06,2025-01-02,2025,01,13293.11,False,payment for consulting,2026-02-22 23:27:14.356841,Raw_GL_Export.csv,83.92156862745098,0,True,AUS01,5800,True,5800,Depreciation,True,True,CC3000,Boston Consulting Group,MAPPED,2025-01_USD,1.52,20205.5272,CONVERTED,30184.39373025477,34245.09535020032,157.0,False,0.0,Monday,False,True,True,EX001
TXN001003,03/14/2025,03/09/2025,2025-03,AUS01,5510,CC4100,Robert Half International,INV58283,,AUD,34764.46,GST,Payment for license,API Import,2025-03-14,2025-09-03,2025,03,34764.46,False,payment for license,2026-02-22 23:27:14.356841,Raw_GL_Export.csv,83.92156862745098,0,True,AUS01,5510,True,5510,Advertising,True,True,CC4100,Robert Half,MAPPED,2025-03_AUD,1.0,34764.46,DOMESTIC,28498.583342781956,23667.16979723599,133.0,False,0.0,Friday,False,True,True,EX001
TXN001004,02/06/2026,01/31/2026,2026-02,AUS01,5800,CC1200,LinkedIn Corp,INV14920,,AUD,30348.13,INPUT,Payment for services,Workday,2026-06-02,2026-01-31,2026,02,30348.13,False,payment for services,2026-02-22 23:27:14.356841,Raw_GL_Export.csv,83.92156862745098,1,True,AUS01,5800,True,5800,Depreciation,True,True,CC1200,LinkedIn,MAPPED,2026-02_AUD,1.0,30348.13,DOMESTIC,30184.39373025477,34245.09535020032,157.0,False,0.0,Tuesday,False,True,True,EX001;EX007
TXN001005,08/05/2025,04/05/2025,2025-05,AUS01,5200,CC3000,SAP,INV61736,PO3316,NZD,26461.76,GST,Payment for services,SAP,2025-05-08,2025-05-04,2025,05,26461.76,False,payment for services,2026-02-22 23:27:14.356841,Raw_GL_Export.csv,83.92156862745098,0,True,AUS01,5200,True,5200,Software Licenses,True,True,CC3000,SAP SE,MAPPED,2025-05_NZD,0.928,24556.51328,CONVERTED,30196.543712413786,22166.314759696765,145.0,False,0.0,Thursday,False,True,False,
TXN001006,04-02-2026,26-01-2026,2026-02,AUS01,5420,CC1100,MSFT,INV92689,PO9070,USD,10925.22,GST,Payment for goods,Oracle,2026-02-04,2026-01-26,2026,02,10925.22,False,payment for goods,2026-02-22 23:27:14.356841,Raw_GL_Export.csv,83.92156862745098,0,True,AUS01,5420,True,5420,Meals and Entertainment,True,True,CC1100,Microsoft Corporation,MAPPED,2026-02_USD,1.525,16660.960499999997,CONVERTED,30119.54810314684,25344.73848974119,143.0,False,0.0,Wednesday,False,True,False,
TXN001007,02/13/2026,02/09/2026,2026-02,AUS01,5010,CC3100,Microsoft,INV52918,PO2561,AUD,43033.86,EXPORT,Payment for consulting,API Import,2026-02-13,2026-09-02,2026,02,43033.86,False,payment for consulting,2026-02-22 23:27:14.356841,Raw_GL_Export.csv,83.92156862745098,0,True,AUS01,5010,True,5010,Employee Benefits,True,True,CC3100,Microsoft Corporation,MAPPED,2026-02_AUD,1.0,43033.86,DOMESTIC,27923.213086278203,19430.63083039902,133.0,False,0.0,Friday,False,True,False,
TXN001008,28-01-2026,19-01-2026,2026-01,AUS01,5800,CC4000,AWS,INV13482,PO1481,AUD,41026.84,GST-FREE,Payment for license,SAP,2026-01-28,2026-01-19,2026,01,41026.84,False,payment for license,2026-02-22 23:27:14.356841,Raw_GL_Export.csv,83.92156862745098,0,True,AUS01,5800,True,5800,Depreciation,True,True,CC4000,Amazon Web Services,MAPPED,2026-01_AUD,1.0,41026.84,DOMESTIC,30184.39373025477,34245.09535020032,157.0,False,0.0,Wednesday,False,True,False,
TXN001009,11-12-2025,09-12-2025,2025-12,AUS01,5520,CC1200,AWS,INV71901,PO9148,USD,31009.01,INPUT,Payment for subscription,Workday,2025-12-11,2025-12-09,2025,12,31009.01,False,payment for subscription,2026-02-22 23:27:14.356841,Raw_GL_Export.csv,83.92156862745098,0,True,AUS01,5520,True,5520,Events,True,True,CC1200,Amazon Web Services,MAPPED,2025-12_USD,1.523,47226.72222999999,CONVERTED,30860.276023483882,21900.267908653983,155.0,False,0.0,Thursday,False,True,False,
TXN001010,2025-09-27,2025-09-20,2025-09,AUS01,5000,CC4100,Workday,INV27553,PO2249,GBP,16618.93,INPUT,Payment for subscription,API Import,2025-09-27,2025-09-20,2025,09,16618.93,False,payment for subscription,2026-02-22 23:27:14.356841,Raw_GL_Export.csv,83.92156862745098,0,True,AUS01,5000,True,5000,Salaries and Wages,True,True,CC4100,Workday Inc,MAPPED,2025-09_GBP,1.949,32390.294570000002,CONVERTED,30471.385558248177,22939.768434623154,137.0,False,0.0,Saturday,True,True,False,
TXN001011,2025-03-03,2025-02-22,2025-03,AUS01,5620,CC4100,KPMG Australia,INV40323,PO8820,AUD,24311.4,GST-FREE,Payment for subscription,SAP,2025-03-03,2025-02-22,2025,03,24311.4,False,payment for subscription,2026-02-22 23:27:14.356841,Raw_GL_Export.csv,83.92156862745098,0,True,AUS01,5620,True,5620,Insurance,True,True,CC4100,KPMG,MAPPED,2025-03_AUD,1.0,24311.4,DOMESTIC,32410.971605588227,27490.799177232966,170.0,False,0.0,Monday,False,True,False,
TXN001012,19/01/2026,12/01/2026,2026-01,AUS01,5200,CC1200,Adobe,INV19633,,USD,27334.92,GST-FREE,Payment for subscription,Workday,2026-01-19,2026-01-12,2026,01,27334.92,False,payment for subscription,2026-02-22 23:27:14.356841,Raw_GL_Export.csv,83.92156862745098,0,True,AUS01,5200,True,5200,Software Licenses,True,True,CC1200,Adobe Systems,MAPPED,2026-01_USD,1.527,41740.42283999999,CONVERTED,30196.543712413786,22166.314759696765,145.0,False,0.0,Monday,False,True,True,EX001
TXN001013,11-10-2025,09-10-2025,2025-10,AUS01,5020,CC2100,Microsoft,INV15616,PO1348,NZD,5939.36,EXPORT,Payment for subscription,Oracle,2025-10-11,2025-10-09,2025,10,5939.36,False,payment for subscription,2026-02-22 23:27:14.356841,Raw_GL_Export.csv,83.92156862745098,0,True,AUS01,5020,True,5020,Contractor Fees,True,True,CC2100,Microsoft Corporation,MAPPED,2025-10_NZD,0.929,5517.66544,CONVERTED,28445.577844280295,21241.721119146277,132.0,False,0.0,Saturday,True,True,False,
TXN001014,16-02-2026,09-02-2026,2026-02,AUS01,5410,CC1000,GCP,INV12355,PO4161,AUD,33610.8,EXPORT,Payment for services,API Import,2026-02-16,2026-02-09,2026,02,33610.8,False,payment for services,2026-02-22 23:27:14.356841,Raw_GL_Export.csv,83.92156862745098,0,True,AUS01,5410,True,5410,Accommodation,True,True,CC1000,Google Cloud,MAPPED,2026-02_AUD,1.0,33610.8,DOMESTIC,29277.518810999987,22143.12829502557,155.0,False,0.0,Monday,False,True,False,
TXN001015,02/07/2026,01/31/2026,2026-02,AUS01,5400,CC4100,Google,INV19526,PO4487,AUD,17444.16,EXPORT,Payment for services,Oracle,2026-07-02,2026-01-31,2026,02,17444.16,False,payment for services,2026-02-22 23:27:14.356841,Raw_GL_Export.csv,83.92156862745098,1,True,AUS01,5400,True,5400,Travel,True,True,CC4100,Google Cloud,MAPPED,2026-02_AUD,1.0,17444.16,DOMESTIC,31663.682660000006,30146.476988256833,133.0,False,0.0,Thursday,False,True,True,EX007
TXN001016,25/05/2025,20/05/2025,2025-05,AUS01,5310,CC3000,MSFT,INV67178,PO8952,GBP,22957.5,GST-FREE,Payment for consulting,Manual Entry,2025-05-25,2025-05-20,2025,05,22957.5,False,payment for consulting,2026-02-22 23:27:14.356841,Raw_GL_Export.csv,83.92156862745098,0,True,AUS01,5310,True,5310,Legal Fees,True,True,CC3000,Microsoft Corporation,MAPPED,2025-05_GBP,1.948,44721.21,CONVERTED,33139.04129260232,28423.631835285127,171.0,False,0.0,Sunday,True,True,False,
TXN001017,25/01/2026,15/01/2026,2026-01,AUS01,5200,CC4000,Deloitte Touche,INV25181,,NZD,33759.88,GST,Payment for license,SAP,2026-01-25,2026-01-15,2026,01,33759.88,False,payment for license,2026-02-22 23:27:14.356841,Raw_GL_Export.csv,83.92156862745098,0,True,AUS01,5200,True,5200,Software Licenses,True,True,CC4000,Deloitte,MAPPED,2026-01_NZD,0.9335,31514.84798,CONVERTED,30196.543712413786,22166.314759696765,145.0,False,0.0,Sunday,True,True,True,EX001
TXN001018,26-01-2026,22-01-2026,2026-01,AUS01,5310,CC2100,Accenture Pty,INV63406,,GBP,38841.23,GST-FREE,Payment for goods,Workday,2026-01-26,2026-01-22,2026,01,38841.23,False,payment for goods,2026-02-22 23:27:14.356841,Raw_GL_Export.csv,83.92156862745098,0,True,AUS01,5310,True,5310,Legal Fees,True,True,CC2100,Accenture,MAPPED,2026-01_GBP,1.957,76012.28711,CONVERTED,33139.04129260232,28423.631835285127,171.0,False,0.0,Monday,False,True,True,EX001;EX004
TXN001019,2026-02-20,2026-02-19,2026-02,AUS01,5100,CC3000,Optus Pty,INV76505,PO2062,AUD,27295.12,GST,Payment for subscription,Workday,2026-02-20,2026-02-19,2026,02,27295.12,False,payment for subscription,2026-02-22 23:27:14.356841,Raw_GL_Export.csv,83.92156862745098,0,True,AUS01,5100,True,5100,Office Rent,True,True,CC3000,Optus,MAPPED,2026-02_AUD,1.0,27295.12,DOMESTIC,29138.02959753333,27547.65120166844,150.0,False,0.0,Friday,False,True,False,
TXN001020,19/02/2026,18/02/2026,2026-02,AUS01,5710,CC3200,Deloitte Touche,INV91852,PO7158,USD,18188.19,EXPORT,Payment for subscription,API Import,2026-02-19,2026-02-18,2026,02,18188.19,False,payment for subscription,2026-02-22 23:27:14.356841,Raw_GL_Export.csv,83.92156862745098,0,True,AUS01,5710,True,5710,Recruitment,True,True,CC3200,Deloitte,MAPPED,2026-02_USD,1.525,27736.989749999997,CONVERTED,29496.09592285716,24753.031499859637,133.0,False,0.0,Thursday,False,True,False,
TXN001021,21-09-2025,19-09-2025,2025-09,AUS01,5510,CC2100,Zoom,INV29258,PO2686,NZD,26109.65,GST-FREE,Payment for subscription,SAP,2025-09-21,2025-09-19,2025,09,26109.65,False,payment for subscription,2026-02-22 23:27:14.356841,Raw_GL_Export.csv,83.92156862745098,0,True,AUS01,5510,True,5510,Advertising,True,True,CC2100,Zoom Video Communications,MAPPED,2025-09_NZD,0.927,24203.64555,CONVERTED,28498.583342781956,23667.16979723599,133.0,False,0.0,Sunday,True,True,False,
TXN001022,01/25/2026,01/15/2026,2026-01,AUS01,5610,CC2000,Oracle,INV48591,PO8043,USD,4965.13,GST-FREE,Payment for consulting,API Import,2026-01-25,2026-01-15,2026,01,4965.13,False,payment for consulting,2026-02-22 23:27:14.356841,Raw_GL_Export.csv,83.92156862745098,0,True,AUS01,5610,True,5610,Postage and Courier,True,True,CC2000,Oracle Corporation,MAPPED,2026-01_USD,1.527,7581.75351,CONVERTED,29081.766845273953,25872.32663648796,146.0,False,0.0,Sunday,True,True,False,
TXN001023,2026-01-18,2026-01-11,2026-01,AUS01,5610,CC1000,Seek Limited,INV69923,PO1500,USD,17969.92,GST,Payment for consulting,Oracle,2026-01-18,2026-01-11,2026,01,17969.92,False,payment for consulting,2026-02-22 23:27:14.356841,Raw_GL_Export.csv,83.92156862745098,0,True,AUS01,5610,True,5610,Postage and Courier,True,True,CC1000,Seek,MAPPED,2026-01_USD,1.527,27440.067839999996,CONVERTED,29081.766845273953,25872.32663648796,146.0,False,0.0,Sunday,True,True,False,
TXN001024,24/01/2026,19/01/2026,2026-01,AUS01,5520,CC2000,ServiceNow Inc,INV95221,,NZD,30189.58,INPUT,Payment for license,Oracle,2026-01-24,2026-01-19,2026,01,30189.58,False,payment for license,2026-02-22 23:27:14.356841,Raw_GL_Export.csv,83.92156862745098,0,True,AUS01,5520,True,5520,Events,True,True,CC2000,ServiceNow,MAPPED,2026-01_NZD,0.9335,28181.97293,CONVERTED,30860.276023483882,21900.267908653983,155.0,False,0.0,Saturday,True,True,True,EX001
TXN001025,2025-02-22,2025-02-17,2025-02,AUS01,5910,CC1000,WeWork Australia,INV28672,PO8113,GBP,39938.99,GST,Payment for subscription,SAP,2025-02-22,2025-02-17,2025,02,39938.99,False,payment for subscription,2026-02-22 23:27:14.356841,Raw_GL_Export.csv,83.92156862745098,0,True,AUS01,5910,True,5910,Interest Expense,True,True,CC1000,WeWork,MAPPED,2025-02_GBP,1.94,77481.6406,CONVERTED,33774.54824600841,21661.31598456901,119.0,False,0.0,Saturday,True,True,True,EX004
TXN001026,18/02/2026,11/02/2026,2026-02,AUS01,5600,CC3000,Zoom,INV82170,PO7198,GBP,29775.25,GST,Payment for subscription,Manual Entry,2026-02-18,2026-02-11,2026,02,29775.25,False,payment for subscription,2026-02-22 23:27:14.356841,Raw_GL_Export.csv,83.92156862745098,0,True,AUS01,5600,True,5600,Telecommunications,True,True,CC3000,Zoom Video Communications,MAPPED,2026-02_GBP,1.955,58210.613750000004,CONVERTED,32190.120230168057,26805.910450208805,119.0,False,0.0,Wednesday,False,True,True,EX004
TXN001027,2025-05-21,2025-05-17,2025-05,AUS01,5000,CC4000,Seek Limited,INV34941,PO6139,GBP,4511.55,GST-FREE,Payment for license,Workday,2025-05-21,2025-05-17,2025,05,4511.55,False,payment for license,2026-02-22 23:27:14.356841,Raw_GL_Export.csv,83.92156862745098,0,True,AUS01,5000,True,5000,Salaries and Wages,True,True,CC4000,Seek,MAPPED,2025-05_GBP,1.948,8788.4994,CONVERTED,30471.385558248177,22939.768434623154,137.0,False,0.0,Wednesday,False,True,False,
TXN001028,2025-01-25,2025-01-20,2025-01,AUS01,5910,CC2000,PWC,INV87019,PO6091,GBP,24411.92,GST-FREE,Payment for license,Workday,2025-01-25,2025-01-20,2025,01,24411.92,False,payment for license,2026-02-22 23:27:14.356841,Raw_GL_Export.csv,83.92156862745098,0,True,AUS01,5910,True,5910,Interest Expense,True,True,CC2000,PwC,MAPPED,2025-01_GBP,1.95,47603.244,CONVERTED,33774.54824600841,21661.31598456901,119.0,False,0.0,Saturday,True,True,False,
TXN001029,2025-03-21,2025-03-20,2025-03,AUS01,5910,CC1200,Seek Limited,INV88694,PO7378,USD,143.92,EXPORT,Payment for services,SAP,2025-03-21,2025-03-20,2025,03,143.92,False,payment for services,2026-02-22 23:27:14.356841,Raw_GL_Export.csv,83.92156862745098,0,True,AUS01,5910,True,5910,Interest Expense,True,True,CC1200,Seek,MAPPED,2025-03_USD,1.53,220.1976,CONVERTED,33774.54824600841,21661.31598456901,119.0,False,0.0,Friday,False,True,False,
TXN001030,04-05-2025,25-04-2025,2025-05,AUS01,5200,CC1100,Google,INV13340,,USD,36662.69,INPUT,Payment for services,Manual Entry,2025-05-04,2025-04-25,2025,05,36662.69,False,payment for services,2026-02-22 23:27:14.356841,Raw_GL_Export.csv,83.92156862745098,0,True,AUS01,5200,True,5200,Software Licenses,True,True,CC1100,Google Cloud,MAPPED,2025-05_USD,1.518,55653.96342000001,CONVERTED,30196.543712413786,22166.314759696765,145.0,False,0.0,Sunday,True,True,True,EX001;EX004
TXN001031,2026-01-17,2026-01-07,2026-01,AUS01,5620,CC2100,Google,INV52125,,NZD,28380.8,GST,Payment for consulting,Oracle,2026-01-17,2026-01-07,2026,01,28380.8,False,payment for consulting,2026-02-22 23:27:14.356841,Raw_GL_Export.csv,83.92156862745098,0,True,AUS01,5620,True,5620,Insurance,True,True,CC2100,Google Cloud,MAPPED,2026-01_NZD,0.9335,26493.4768,CONVERTED,32410.971605588227,27490.799177232966,170.0,False,0.0,Saturday,True,True,True,EX001
TXN001032,28/01/2026,18/01/2026,2026-01,AUS01,5420,CC3100,Zoom,INV93558,,AUD,32875.94,GST-FREE,Payment for services,Manual Entry,2026-01-28,2026-01-18,2026,01,32875.94,False,payment for services,2026-02-22 23:27:14.356841,Raw_GL_Export.csv,83.92156862745098,0,True,AUS01,5420,True,5420,Meals and Entertainment,True,True,CC3100,Zoom Video Communications,MAPPED,2026-01_AUD,1.0,32875.94,DOMESTIC,30119.54810314684,25344.73848974119,143.0,False,0.0,Wednesday,False,True,True,EX001
TXN001033,15-05-2025,05-05-2025,2025-05,AUS01,5300,CC3100,Adobe,INV28314,PO7744,AUD,32172.76,EXPORT,Payment for goods,API Import,2025-05-15,2025-05-05,2025,05,32172.76,False,payment for goods,2026-02-22 23:27:14.356841,Raw_GL_Export.csv,83.92156862745098,0,True,AUS01,5300,True,5300,Professional Services,True,True,CC3100,Adobe Systems,MAPPED,2025-05_AUD,1.0,32172.76,DOMESTIC,33232.533450429684,35951.49997313202,128.0,False,0.0,Thursday,False,True,False,
TXN001034,01/05/2026,01/04/2026,2026-01,AUS01,5520,CC1100,Hays,INV31098,PO2094,GBP,41535.02,GST,Payment for subscription,SAP,2026-05-01,2026-04-01,2026,01,41535.02,False,payment for subscription,2026-02-22 23:27:14.356841,Raw_GL_Export.csv,83.92156862745098,1,True,AUS01,5520,True,5520,Events,True,True,CC1100,Hays Recruitment,MAPPED,2026-01_GBP,1.957,81284.03414,CONVERTED,30860.276023483882,21900.267908653983,155.0,False,0.0,Friday,False,True,True,EX004
TXN001035,01/13/2026,01/11/2026,2026-01,AUS01,5200,CC2000,SAP,INV51182,PO3805,GBP,10521.88,GST-FREE,Payment for goods,Workday,2026-01-13,2026-11-01,2026,01,10521.88,False,payment for goods,2026-02-22 23:27:14.356841,Raw_GL_Export.csv,83.92156862745098,0,True,AUS01,5200,True,5200,Software Licenses,True,True,CC2000,SAP SE,MAPPED,2026-01_GBP,1.957,20591.31916,CONVERTED,30196.543712413786,22166.314759696765,145.0,False,0.0,Tuesday,False,True,False,
TXN001036,2026-02-13,2026-02-05,2026-02,AUS01,5520,CC1100,LinkedIn Corp,INV98871,,AUD,9300.78,GST-FREE,Payment for license,Oracle,2026-02-13,2026-02-05,2026,02,9300.78,False,payment for license,2026-02-22 23:27:14.356841,Raw_GL_Export.csv,83.92156862745098,0,True,AUS01,5520,True,5520,Events,True,True,CC1100,LinkedIn,MAPPED,2026-02_AUD,1.0,9300.78,DOMESTIC,30860.276023483882,21900.267908653983,155.0,False,0.0,Friday,False,True,True,EX001
TXN001037,01-06-2025,30-05-2025,2025-06,AUS01,5210,CC3100,Accenture Pty,INV81580,PO6651,NZD,6042.8,EXPORT,Payment for consulting,SAP,2025-06-01,2025-05-30,2025,06,6042.8,False,payment for consulting,2026-02-22 23:27:14.356841,Raw_GL_Export.csv,83.92156862745098,0,True,AUS01,5210,True,5210,Cloud Services,True,True,CC3100,Accenture,MAPPED,2025-06_NZD,0.931,5625.8468,CONVERTED,31620.56664919015,27460.393400888206,142.0,False,0.0,Sunday,True,True,False,
TXN001038,07/01/2026,30/12/2025,2026-01,AUS01,5020,CC4000,KPMG Australia,INV32111,PO6292,NZD,11980.48,GST,Payment for services,Oracle,2026-01-07,2025-12-30,2026,01,11980.48,False,payment for services,2026-02-22 23:27:14.356841,Raw_GL_Export.csv,83.92156862745098,0,True,AUS01,5020,True,5020,Contractor Fees,True,True,CC4000,KPMG,MAPPED,2026-01_NZD,0.9335,11183.77808,CONVERTED,28445.577844280295,21241.721119146277,132.0,False,0.0,Wednesday,False,True,False,
TXN001039,28-02-2026,23-02-2026,2026-02,AUS01,5510,CC1000,GCP,INV40999,PO5098,GBP,12465.09,GST,Payment for services,Manual Entry,2026-02-28,2026-02-23,2026,02,12465.09,False,payment for services,2026-02-22 23:27:14.356841,Raw_GL_Export.csv,83.92156862745098,0,True,AUS01,5510,True,5510,Advertising,True,True,CC1000,Google Cloud,MAPPED,2026-02_GBP,1.955,24369.25095,CONVERTED,28498.583342781956,23667.16979723599,133.0,False,0.0,Saturday,True,True,False,
TXN001040,2025-11-16,2025-11-13,2025-11,AUS01,5420,CC3200,Robert Half International,INV11836,PO2511,USD,41191.16,GST,Payment for consulting,API Import,2025-11-16,2025-11-13,2025,11,41191.16,False,payment for consulting,2026-02-22 23:27:14.356841,Raw_GL_Export.csv,83.92156862745098,0,True,AUS01,5420,True,5420,Meals and Entertainment,True,True,CC3200,Robert Half,MAPPED,2025-11_USD,1.526,62857.71016000001,CONVERTED,30119.54810314684,25344.73848974119,143.0,False,0.0,Sunday,True,True,True,EX004
TXN001041,18/12/2025,16/12/2025,2025-12,AUS01,5620,CC2000,Deloitte Touche,INV74396,PO8175,GBP,7805.72,INPUT,Payment for goods,Manual Entry,2025-12-18,2025-12-16,2025,12,7805.72,False,payment for goods,2026-02-22 23:27:14.356841,Raw_GL_Export.csv,83.92156862745098,0,True,AUS01,5620,True,5620,Insurance,True,True,CC2000,Deloitte,MAPPED,2025-12_GBP,1.953,15244.571160000001,CONVERTED,32410.971605588227,27490.799177232966,170.0,False,0.0,Thursday,False,True,False,
TXN001042,28/02/2026,19/02/2026,2026-02,AUS01,5210,CC1100,Robert Half International,INV63533,,USD,24503.68,INPUT,Payment for goods,API Import,2026-02-28,2026-02-19,2026,02,24503.68,False,payment for goods,2026-02-22 23:27:14.356841,Raw_GL_Export.csv,83.92156862745098,0,True,AUS01,5210,True,5210,Cloud Services,True,True,CC1100,Robert Half,MAPPED,2026-02_USD,1.525,37368.112,CONVERTED,31620.56664919015,27460.393400888206,142.0,False,0.0,Saturday,True,True,True,EX001
TXN001043,25-02-2026,24-02-2026,2026-02,AUS01,5500,CC4100,Telstra Corp,INV69450,PO2000,GBP,30665.46,GST,Payment for consulting,Manual Entry,2026-02-25,2026-02-24,2026,02,30665.46,False,payment for consulting,2026-02-22 23:27:14.356841,Raw_GL_Export.csv,83.92156862745098,0,True,AUS01,5500,True,5500,Marketing,True,True,CC4100,Telstra,MAPPED,2026-02_GBP,1.955,59950.9743,CONVERTED,28972.634359125877,32785.70497360227,143.0,False,0.0,Wednesday,False,True,True,EX004
TXN001044,08-03-2025,27-02-2025,2025-03,AUS01,5810,CC1200,AWS,INV80860,,NZD,34427.67,EXPORT,Payment for goods,Oracle,2025-03-08,2025-02-27,2025,03,34427.67,False,payment for goods,2026-02-22 23:27:14.356841,Raw_GL_Export.csv,83.92156862745098,0,True,AUS01,5810,True,5810,Amortization,True,True,CC1200,Amazon Web Services,MAPPED,2025-03_NZD,0.935,32189.87145,CONVERTED,31768.91314562501,27328.351394475325,120.0,False,0.0,Saturday,True,True,True,EX001
TXN001045,02/08/2026,02/02/2026,2026-02,AUS01,5700,CC1200,Google,INV11944,PO9832,GBP,30575.75,INPUT,Payment for consulting,SAP,2026-08-02,2026-02-02,2026,02,30575.75,False,payment for consulting,2026-02-22 23:27:14.356841,Raw_GL_Export.csv,83.92156862745098,1,True,AUS01,5700,True,5700,Training,True,True,CC1200,Google Cloud,MAPPED,2026-02_GBP,1.955,59775.591250000005,CONVERTED,31110.431902446802,30160.111495086097,141.0,False,0.0,Sunday,True,True,True,EX004;EX007
TXN001046,04/22/2025,04/15/2025,2025-04,AUS01,5600,CC1200,Salesforce,INV52911,PO8482,USD,3366.62,GST-FREE,Payment for license,SAP,2025-04-22,2025-04-15,2025,04,3366.62,False,payment for license,2026-02-22 23:27:14.356841,Raw_GL_Export.csv,83.92156862745098,0,True,AUS01,5600,True,5600,Telecommunications,True,True,CC1200,Salesforce Inc,MAPPED,2025-04_USD,1.525,5134.095499999999,CONVERTED,32190.120230168057,26805.910450208805,119.0,False,0.0,Tuesday,False,True,False,
TXN001047,01/18/2026,01/14/2026,2026-01,AUS01,5410,CC4100,KPMG Australia,INV14952,PO1555,AUD,42893.6,GST-FREE,Payment for license,Oracle,2026-01-18,2026-01-14,2026,01,42893.6,False,payment for license,2026-02-22 23:27:14.356841,Raw_GL_Export.csv,83.92156862745098,0,True,AUS01,5410,True,5410,Accommodation,True,True,CC4100,KPMG,MAPPED,2026-01_AUD,1.0,42893.6,DOMESTIC,29277.518810999987,22143.12829502557,155.0,False,0.0,Sunday,True,True,False,
TXN001048,22-02-2026,12-02-2026,2026-02,AUS01,5710,CC2100,Robert Half International,INV89376,PO9391,NZD,29211.84,INPUT,Payment for license,SAP,2026-02-22,2026-02-12,2026,02,29211.84,False,payment for license,2026-02-22 23:27:14.356841,Raw_GL_Export.csv,83.92156862745098,0,True,AUS01,5710,True,5710,Recruitment,True,True,CC2100,Robert Half,MAPPED,2026-02_NZD,0.932,27225.43488,CONVERTED,29496.09592285716,24753.031499859637,133.0,False,0.0,Sunday,True,True,False,
TXN001049,2026-02-21,2026-02-16,2026-02,AUS01,5320,CC3200,Robert Half International,INV95830,PO6848,GBP,43313.11,GST,Payment for goods,Oracle,2026-02-21,2026-02-16,2026,02,43313.11,False,payment for goods,2026-02-22 23:27:14.356841,Raw_GL_Export.csv,83.92156862745098,0,True,AUS01,5320,True,5320,Audit Fees,True,True,CC3200,Robert Half,MAPPED,2026-02_GBP,1.955,84677.13005,CONVERTED,31658.610713475173,32284.527206153973,141.0,False,0.0,Saturday,True,True,True,EX004
TXN001050,18-03-2025,10-03-2025,2025-03,AUS01,5400,CC3200,SAP,INV46031,PO2277,USD,1277.18,EXPORT,Payment for license,SAP,2025-03-18,2025-03-10,2025,03,1277.18,False,payment for license,2026-02-22 23:27:14.356841,Raw_GL_Export.csv,83.92156862745098,0,True,AUS01,5400,True,5400,Travel,True,True,CC3200,SAP SE,MAPPED,2025-03_USD,1.53,1954.0854000000002,CONVERTED,31663.682660000006,30146.476988256833,133.0,False,0.0,Tuesday,False,True,False,
TXN001051,24-10-2025,16-10-2025,2025-10,AUS01,5610,CC4000,Hays,INV76296,PO3521,GBP,24434.76,EXPORT,Payment for goods,Workday,2025-10-24,2025-10-16,2025,10,24434.76,False,payment for goods,2026-02-22 23:27:14.356841,Raw_GL_Export.csv,83.92156862745098,0,True,AUS01,5610,True,5610,Postage and Courier,True,True,CC4000,Hays Recruitment,MAPPED,2025-10_GBP,1.951,47672.216759999996,CONVERTED,29081.766845273953,25872.32663648796,146.0,False,0.0,Friday,False,True,False,
TXN001052,17/02/2026,09/02/2026,2026-02,AUS01,5800,CC1000,McKinsey,INV99435,PO4890,AUD,17996.86,GST-FREE,Payment for subscription,SAP,2026-02-17,2026-02-09,2026,02,17996.86,False,payment for subscription,2026-02-22 23:27:14.356841,Raw_GL_Export.csv,83.92156862745098,0,True,AUS01,5800,True,5800,Depreciation,True,True,CC1000,McKinsey & Company,MAPPED,2026-02_AUD,1.0,17996.86,DOMESTIC,30184.39373025477,34245.09535020032,157.0,False,0.0,Tuesday,False,True,False,
TXN001053,12/23/2025,12/22/2025,2025-12,AUS01,5700,CC3000,Federal Express,INV99864,PO1627,GBP,32773.22,INPUT,Payment for services,SAP,2025-12-23,2025-12-22,2025,12,32773.22,False,payment for services,2026-02-22 23:27:14.356841,Raw_GL_Export.csv,83.92156862745098,0,True,AUS01,5700,True,5700,Training,True,True,CC3000,FedEx,MAPPED,2025-12_GBP,1.953,64006.09866,CONVERTED,31110.431902446802,30160.111495086097,141.0,False,0.0,Tuesday,False,True,True,EX004
TXN001054,02/06/2026,01/28/2026,2026-02,AUS01,5120,CC3000,Regus Australia,INV70383,PO4213,NZD,11379.14,EXPORT,Payment for goods,Workday,2026-06-02,2026-01-28,2026,02,11379.14,False,payment for goods,2026-02-22 23:27:14.356841,Raw_GL_Export.csv,83.92156862745098,1,True,AUS01,5120,True,5120,Office Supplies,True,True,CC3000,Regus,MAPPED,2026-02_NZD,0.932,10605.35848,CONVERTED,34269.00595485611,35424.20705021751,139.0,False,0.0,Tuesday,False,True,True,EX007
TXN001055,02/27/2026,02/24/2026,2026-02,AUS01,5620,CC2000,Slack,INV35502,PO2689,NZD,35550.13,GST-FREE,Payment for subscription,Manual Entry,2026-02-27,2026-02-24,2026,02,35550.13,False,payment for subscription,2026-02-22 23:27:14.356841,Raw_GL_Export.csv,83.92156862745098,0,True,AUS01,5620,True,5620,Insurance,True,True,CC2000,Slack Technologies,MAPPED,2026-02_NZD,0.932,33132.72116,CONVERTED,32410.971605588227,27490.799177232966,170.0,False,0.0,Friday,False,True,False,
TXN001056,01/06/2026,01/04/2026,2026-01,AUS01,5700,CC3000,Oracle,INV33317,PO6625,NZD,32536.7,EXPORT,Payment for consulting,Oracle,2026-06-01,2026-04-01,2026,01,32536.7,False,payment for consulting,2026-02-22 23:27:14.356841,Raw_GL_Export.csv,83.92156862745098,1,True,AUS01,5700,True,5700,Training,True,True,CC3000,Oracle Corporation,MAPPED,2026-01_NZD,0.9335,30373.00945,CONVERTED,31110.431902446802,30160.111495086097,141.0,False,0.0,Monday,False,True,False,
TXN001057,19/01/2026,12/01/2026,2026-01,AUS01,5600,CC2000,ServiceNow Inc,INV23398,,NZD,23885.37,INPUT,Payment for license,SAP,2026-01-19,2026-01-12,2026,01,23885.37,False,payment for license,2026-02-22 23:27:14.356841,Raw_GL_Export.csv,83.92156862745098,0,True,AUS01,5600,True,5600,Telecommunications,True,True,CC2000,ServiceNow,MAPPED,2026-01_NZD,0.9335,22296.992895,CONVERTED,32190.120230168057,26805.910450208805,119.0,False,0.0,Monday,False,True,True,EX001
TXN001058,18-02-2026,12-02-2026,2026-02,AUS01,5320,CC1000,Hays,INV12048,PO8991,NZD,43036.03,INPUT,Payment for subscription,Workday,2026-02-18,2026-02-12,2026,02,43036.03,False,payment for subscription,2026-02-22 23:27:14.356841,Raw_GL_Export.csv,83.92156862745098,0,True,AUS01,5320,True,5320,Audit Fees,True,True,CC1000,Hays Recruitment,MAPPED,2026-02_NZD,0.932,40109.57996,CONVERTED,31658.610713475173,32284.527206153973,141.0,False,0.0,Wednesday,False,True,False,
TXN001059,2026-02-08,2026-02-04,2026-02,AUS01,5300,CC4100,Atlassian Pty,INV73074,PO3700,AUD,41691.71,GST,Payment for services,Oracle,2026-02-08,2026-02-04,2026,02,41691.71,False,payment for services,2026-02-22 23:27:14.356841,Raw_GL_Export.csv,83.92156862745098,0,True,AUS01,5300,True,5300,Professional Services,True,True,CC4100,Atlassian,MAPPED,2026-02_AUD,1.0,41691.71,DOMESTIC,33232.533450429684,35951.49997313202,128.0,False,0.0,Sunday,True,True,False,
TXN001060,09/17/2025,09/07/2025,2025-09,AUS01,5210,CC2100,Microsoft,INV61711,PO6328,AUD,37751.47,GST-FREE,Payment for subscription,Manual Entry,2025-09-17,2025-07-09,2025,09,37751.47,False,payment for subscription,2026-02-22 23:27:14.356841,Raw_GL_Export.csv,83.92156862745098,0,True,AUS01,5210,True,5210,Cloud Services,True,True,CC2100,Microsoft Corporation,MAPPED,2025-09_AUD,1.0,37751.47,DOMESTIC,31620.56664919015,27460.393400888206,142.0,False,0.0,Wednesday,False,True,False,
TXN001061,01/04/2026,12/29/2025,2026-01,AUS01,5200,CC1100,Workday,INV64982,PO9593,USD,16538.34,GST-FREE,Payment for services,Oracle,2026-04-01,2025-12-29,2026,01,16538.34,False,payment for services,2026-02-22 23:27:14.356841,Raw_GL_Export.csv,83.92156862745098,1,True,AUS01,5200,True,5200,Software Licenses,True,True,CC1100,Workday Inc,MAPPED,2026-01_USD,1.527,25254.045179999997,CONVERTED,30196.543712413786,22166.314759696765,145.0,False,0.0,Wednesday,False,True,False,
TXN001062,26-01-2026,18-01-2026,2026-01,AUS01,5920,CC3000,Microsoft,INV29619,PO2787,AUD,43195.03,INPUT,Payment for subscription,SAP,2026-01-26,2026-01-18,2026,01,43195.03,False,payment for subscription,2026-02-22 23:27:14.356841,Raw_GL_Export.csv,83.92156862745098,0,True,AUS01,5920,True,5920,FX Loss,True,True,CC3000,Microsoft Corporation,MAPPED,2026-01_AUD,1.0,43195.03,DOMESTIC,27533.92400565971,21784.021192347693,144.0,False,0.0,Monday,False,True,False,
TXN001063,02/02/2026,01/30/2026,2026-02,AUS01,5420,CC3100,Atlassian Pty,INV72654,,GBP,25310.7,GST-FREE,Payment for subscription,Oracle,2026-02-02,2026-01-30,2026,02,25310.7,False,payment for subscription,2026-02-22 23:27:14.356841,Raw_GL_Export.csv,83.92156862745098,0,True,AUS01,5420,True,5420,Meals and Entertainment,True,True,CC3100,Atlassian,MAPPED,2026-02_GBP,1.955,49482.4185,CONVERTED,30119.54810314684,25344.73848974119,143.0,False,0.0,Monday,False,True,True,EX001
TXN001064,02/08/2026,02/01/2026,2026-02,AUS01,5120,CC1200,BCG,INV86489,PO8369,GBP,18782.13,INPUT,Payment for license,Manual Entry,2026-08-02,2026-01-02,2026,02,18782.13,False,payment for license,2026-02-22 23:27:14.356841,Raw_GL_Export.csv,83.92156862745098,1,True,AUS01,5120,True,5120,Office Supplies,True,True,CC1200,Boston Consulting Group,MAPPED,2026-02_GBP,1.955,36719.064150000006,CONVERTED,34269.00595485611,35424.20705021751,139.0,False,0.0,Sunday,True,True,True,EX007
TXN001065,01/09/2025,01/06/2025,2025-01,AUS01,5110,CC3200,BCG,INV80955,PO7913,NZD,44243.61,INPUT,Payment for subscription,Workday,2025-09-01,2025-06-01,2025,01,44243.61,False,payment for subscription,2026-02-22 23:27:14.356841,Raw_GL_Export.csv,83.92156862745098,1,True,AUS01,5110,True,5110,Utilities,True,True,CC3200,Boston Consulting Group,MAPPED,2025-01_NZD,0.93,41146.5573,CONVERTED,27865.288293732876,21409.69928933269,146.0,False,0.0,Monday,False,True,False,
TXN001066,02/26/2026,02/23/2026,2026-02,AUS01,5510,CC1200,EY Australia,INV53554,,AUD,43546.78,EXPORT,Payment for services,SAP,2026-02-26,2026-02-23,2026,02,43546.78,False,payment for services,2026-02-22 23:27:14.356841,Raw_GL_Export.csv,83.92156862745098,0,True,AUS01,5510,True,5510,Advertising,True,True,CC1200,EY,MAPPED,2026-02_AUD,1.0,43546.78,DOMESTIC,28498.583342781956,23667.16979723599,133.0,False,0.0,Thursday,False,True,True,EX001
TXN001067,02/01/2026,28/12/2025,2026-01,AUS01,5320,CC2000,ServiceNow Inc,INV94233,PO2896,AUD,43134.91,GST-FREE,Payment for subscription,Workday,2026-01-02,2025-12-28,2026,01,43134.91,False,payment for subscription,2026-02-22 23:27:14.356841,Raw_GL_Export.csv,83.92156862745098,0,True,AUS01,5320,True,5320,Audit Fees,True,True,CC2000,ServiceNow,MAPPED,2026-01_AUD,1.0,43134.91,DOMESTIC,31658.610713475173,32284.527206153973,141.0,False,0.0,Friday,False,True,False,
TXN001068,03/01/2026,02/01/2026,2026-01,AUS01,5310,CC3000,Seek Limited,INV82816,PO2644,AUD,23528.23,EXPORT,Payment for subscription,Workday,2026-01-03,2026-01-02,2026,01,23528.23,False,payment for subscription,2026-02-22 23:27:14.356841,Raw_GL_Export.csv,83.92156862745098,0,True,AUS01,5310,True,5310,Legal Fees,True,True,CC3000,Seek,MAPPED,2026-01_AUD,1.0,23528.23,DOMESTIC,33139.04129260232,28423.631835285127,171.0,False,0.0,Saturday,True,True,False,
TXN001069,10-02-2026,03-02-2026,2026-02,AUS01,5600,CC4100,Hays,INV65452,PO8226,USD,22531.34,GST-FREE,Payment for subscription,Manual Entry,2026-02-10,2026-02-03,2026,02,22531.34,False,payment for subscription,2026-02-22 23:27:14.356841,Raw_GL_Export.csv,83.92156862745098,0,True,AUS01,5600,True,5600,Telecommunications,True,True,CC4100,Hays Recruitment,MAPPED,2026-02_USD,1.525,34360.2935,CONVERTED,32190.120230168057,26805.910450208805,119.0,False,0.0,Tuesday,False,True,False,
TXN001070,2026-01-05,2026-01-02,2026-01,AUS01,5320,CC4000,Adobe,INV78921,,NZD,13027.31,GST,Payment for goods,API Import,2026-01-05,2026-01-02,2026,01,13027.31,False,payment for goods,2026-02-22 23:27:14.356841,Raw_GL_Export.csv,83.92156862745098,0,True,AUS01,5320,True,5320,Audit Fees,True,True,CC4000,Adobe Systems,MAPPED,2026-01_NZD,0.9335,12160.993885,CONVERTED,31658.610713475173,32284.527206153973,141.0,False,0.0,Monday,False,True,True,EX001
TXN001071,2025-03-26,2025-03-23,2025-03,AUS01,5200,CC1100,Slack,INV92170,PO2517,USD,27335.41,GST,Payment for services,Manual Entry,2025-03-26,2025-03-23,2025,03,27335.41,False,payment for services,2026-02-22 23:27:14.356841,Raw_GL_Export.csv,83.92156862745098,0,True,AUS01,5200,True,5200,Software Licenses,True,True,CC1100,Slack Technologies,MAPPED,2025-03_USD,1.53,41823.1773,CONVERTED,30196.543712413786,22166.314759696765,145.0,False,0.0,Wednesday,False,True,False,
TXN001072,2026-01-24,2026-01-22,2026-01,AUS01,5510,CC2000,AusPost,INV82449,PO1396,NZD,22080.25,GST-FREE,Payment for license,Oracle,2026-01-24,2026-01-22,2026,01,22080.25,False,payment for license,2026-02-22 23:27:14.356841,Raw_GL_Export.csv,83.92156862745098,0,True,AUS01,5510,True,5510,Advertising,True,True,CC2000,Australia Post,MAPPED,2026-01_NZD,0.9335,20611.913375,CONVERTED,28498.583342781956,23667.16979723599,133.0,False,0.0,Saturday,True,True,False,
TXN001073,25-01-2026,18-01-2026,2026-01,AUS01,5510,CC1100,LinkedIn Corp,INV72924,PO5265,USD,35432.84,INPUT,Payment for subscription,API Import,2026-01-25,2026-01-18,2026,01,35432.84,False,payment for subscription,2026-02-22 23:27:14.356841,Raw_GL_Export.csv,83.92156862745098,0,True,AUS01,5510,True,5510,Advertising,True,True,CC1100,LinkedIn,MAPPED,2026-01_USD,1.527,54105.946679999994,CONVERTED,28498.583342781956,23667.16979723599,133.0,False,0.0,Sunday,True,True,True,EX004
TXN001074,02/21/2026,02/13/2026,2026-02,AUS01,5110,CC3100,Zoom,INV76968,PO8431,AUD,14712.0,GST,Payment for consulting,API Import,2026-02-21,2026-02-13,2026,02,14712.0,False,payment for consulting,2026-02-22 23:27:14.356841,Raw_GL_Export.csv,83.92156862745098,0,True,AUS01,5110,True,5110,Utilities,True,True,CC3100,Zoom Video Communications,MAPPED,2026-02_AUD,1.0,14712.0,DOMESTIC,27865.288293732876,21409.69928933269,146.0,False,0.0,Saturday,True,True,False,
TXN001075,2025-04-08,2025-04-01,2025-04,AUS01,5010,CC4000,Oracle,INV33009,,GBP,43219.74,EXPORT,Payment for goods,Oracle,2025-04-08,2025-04-01,2025,04,43219.74,False,payment for goods,2026-02-22 23:27:14.356841,Raw_GL_Export.csv,83.92156862745098,0,True,AUS01,5010,True,5010,Employee Benefits,True,True,CC4000,Oracle Corporation,MAPPED,2025-04_GBP,1.955,84494.5917,CONVERTED,27923.213086278203,19430.63083039902,133.0,False,0.0,Tuesday,False,True,True,EX001;EX004
TXN001076,15/02/2026,05/02/2026,2026-02,AUS01,5620,CC4100,Oracle,INV30341,PO4507,AUD,14729.44,GST-FREE,Payment for consulting,Oracle,2026-02-15,2026-02-05,2026,02,14729.44,False,payment for consulting,2026-02-22 23:27:14.356841,Raw_GL_Export.csv,83.92156862745098,0,True,AUS01,5620,True,5620,Insurance,True,True,CC4100,Oracle Corporation,MAPPED,2026-02_AUD,1.0,14729.44,DOMESTIC,32410.971605588227,27490.799177232966,170.0,False,0.0,Sunday,True,True,False,
TXN001077,04-02-2026,29-01-2026,2026-02,AUS01,5700,CC4100,Salesforce,INV40992,PO6326,NZD,10708.62,GST-FREE,Payment for subscription,Oracle,2026-02-04,2026-01-29,2026,02,10708.62,False,payment for subscription,2026-02-22 23:27:14.356841,Raw_GL_Export.csv,83.92156862745098,0,True,AUS01,5700,True,5700,Training,True,True,CC4100,Salesforce Inc,MAPPED,2026-02_NZD,0.932,9980.433840000002,CONVERTED,31110.431902446802,30160.111495086097,141.0,False,0.0,Wednesday,False,True,False,
TXN001078,26/02/2026,20/02/2026,2026-02,AUS01,5520,CC2100,PWC,INV74631,,GBP,5584.83,EXPORT,Payment for consulting,Workday,2026-02-26,2026-02-20,2026,02,5584.83,False,payment for consulting,2026-02-22 23:27:14.356841,Raw_GL_Export.csv,83.92156862745098,0,True,AUS01,5520,True,5520,Events,True,True,CC2100,PwC,MAPPED,2026-02_GBP,1.955,10918.34265,CONVERTED,30860.276023483882,21900.267908653983,155.0,False,0.0,Thursday,False,True,True,EX001
TXN001079,2026-02-08,2026-01-29,2026-02,AUS01,5310,CC2100,Deloitte Touche,INV33653,PO8189,GBP,27543.46,GST,Payment for services,Oracle,2026-02-08,2026-01-29,2026,02,27543.46,False,payment for services,2026-02-22 23:27:14.356841,Raw_GL_Export.csv,83.92156862745098,0,True,AUS01,5310,True,5310,Legal Fees,True,True,CC2100,Deloitte,MAPPED,2026-02_GBP,1.955,53847.4643,CONVERTED,33139.04129260232,28423.631835285127,171.0,False,0.0,Sunday,True,True,True,EX004
TXN001080,19/01/2026,11/01/2026,2026-01,AUS01,5020,CC1200,MSFT,INV79074,PO2843,NZD,11167.37,EXPORT,Payment for goods,Manual Entry,2026-01-19,2026-01-11,2026,01,11167.37,False,payment for goods,2026-02-22 23:27:14.356841,Raw_GL_Export.csv,83.92156862745098,0,True,AUS01,5020,True,5020,Contractor Fees,True,True,CC1200,Microsoft Corporation,MAPPED,2026-01_NZD,0.9335,10424.739895,CONVERTED,28445.577844280295,21241.721119146277,132.0,False,0.0,Monday,False,True,False,
TXN001081,03/23/2025,03/20/2025,2025-03,AUS01,5600,CC4000,Accenture Pty,INV27657,PO7506,USD,6800.86,GST,Payment for services,API Import,2025-03-23,2025-03-20,2025,03,6800.86,False,payment for services,2026-02-22 23:27:14.356841,Raw_GL_Export.csv,83.92156862745098,0,True,AUS01,5600,True,5600,Telecommunications,True,True,CC4000,Accenture,MAPPED,2025-03_USD,1.53,10405.3158,CONVERTED,32190.120230168057,26805.910450208805,119.0,False,0.0,Sunday,True,True,False,
TXN001082,07/01/2026,06/01/2026,2026-01,AUS01,5010,CC2100,Hays,INV55785,PO7098,GBP,23386.22,EXPORT,Payment for license,Workday,2026-01-07,2026-01-06,2026,01,23386.22,False,payment for license,2026-02-22 23:27:14.356841,Raw_GL_Export.csv,83.92156862745098,0,True,AUS01,5010,True,5010,Employee Benefits,True,True,CC2100,Hays Recruitment,MAPPED,2026-01_GBP,1.957,45766.83254,CONVERTED,27923.213086278203,19430.63083039902,133.0,False,0.0,Wednesday,False,True,False,
TXN001083,06/11/2025,28/10/2025,2025-11,AUS01,5400,CC1000,Microsoft,INV40970,PO2343,USD,878.43,INPUT,Payment for license,API Import,2025-11-06,2025-10-28,2025,11,878.43,False,payment for license,2026-02-22 23:27:14.356841,Raw_GL_Export.csv,83.92156862745098,0,True,AUS01,5400,True,5400,Travel,True,True,CC1000,Microsoft Corporation,MAPPED,2025-11_USD,1.526,1340.48418,CONVERTED,31663.682660000006,30146.476988256833,133.0,False,0.0,Thursday,False,True,False,
TXN001084,2026-01-11,2026-01-03,2026-01,AUS01,5020,CC3000,Adobe,INV12993,PO3743,USD,39253.1,GST,Payment for license,Workday,2026-01-11,2026-01-03,2026,01,39253.1,False,payment for license,2026-02-22 23:27:14.356841,Raw_GL_Export.csv,83.92156862745098,0,True,AUS01,5020,True,5020,Contractor Fees,True,True,CC3000,Adobe Systems,MAPPED,2026-01_USD,1.527,59939.4837,CONVERTED,28445.577844280295,21241.721119146277,132.0,False,0.0,Sunday,True,True,True,EX004
TXN001085,2026-01-22,2026-01-20,2026-01,AUS01,5300,CC2000,Seek Limited,INV17430,PO4216,NZD,29453.59,GST-FREE,Payment for services,API Import,2026-01-22,2026-01-20,2026,01,29453.59,False,payment for services,2026-02-22 23:27:14.356841,Raw_GL_Export.csv,83.92156862745098,0,True,AUS01,5300,True,5300,Professional Services,True,True,CC2000,Seek,MAPPED,2026-01_NZD,0.9335,27494.926265,CONVERTED,33232.533450429684,35951.49997313202,128.0,False,0.0,Thursday,False,True,False,
TXN001086,14-01-2026,12-01-2026,2026-01,AUS01,5200,CC4100,Hays,INV29029,PO3472,AUD,27430.5,GST,Payment for goods,SAP,2026-01-14,2026-01-12,2026,01,27430.5,False,payment for goods,2026-02-22 23:27:14.356841,Raw_GL_Export.csv,83.92156862745098,0,True,AUS01,5200,True,5200,Software Licenses,True,True,CC4100,Hays Recruitment,MAPPED,2026-01_AUD,1.0,27430.5,DOMESTIC,30196.543712413786,22166.314759696765,145.0,False,0.0,Wednesday,False,True,False,
TXN001087,07/02/2026,05/02/2026,2026-02,AUS01,5920,CC3200,AusPost,INV17012,,GBP,33894.43,GST-FREE,Payment for services,SAP,2026-02-07,2026-02-05,2026,02,33894.43,False,payment for services,2026-02-22 23:27:14.356841,Raw_GL_Export.csv,83.92156862745098,0,True,AUS01,5920,True,5920,FX Loss,True,True,CC3200,Australia Post,MAPPED,2026-02_GBP,1.955,66263.61065,CONVERTED,27533.92400565971,21784.021192347693,144.0,False,0.0,Saturday,True,True,True,EX001;EX004
TXN001088,04-02-2026,28-01-2026,2026-02,AUS01,5100,CC1200,Oracle,INV68522,,AUD,5530.96,GST,Payment for subscription,API Import,2026-02-04,2026-01-28,2026,02,5530.96,False,payment for subscription,2026-02-22 23:27:14.356841,Raw_GL_Export.csv,83.92156862745098,0,True,AUS01,5100,True,5100,Office Rent,True,True,CC1200,Oracle Corporation,MAPPED,2026-02_AUD,1.0,5530.96,DOMESTIC,29138.02959753333,27547.65120166844,150.0,False,0.0,Wednesday,False,True,True,EX001
TXN001089,25-06-2025,21-06-2025,2025-06,AUS01,5200,CC4100,Workday,INV66550,PO4414,AUD,13283.19,GST-FREE,Payment for license,SAP,2025-06-25,2025-06-21,2025,06,13283.19,False,payment for license,2026-02-22 23:27:14.356841,Raw_GL_Export.csv,83.92156862745098,0,True,AUS01,5200,True,5200,Software Licenses,True,True,CC4100,Workday Inc,MAPPED,2025-06_AUD,1.0,13283.19,DOMESTIC,30196.543712413786,22166.314759696765,145.0,False,0.0,Wednesday,False,True,False,
TXN001090,22/04/2025,14/04/2025,2025-04,AUS01,5620,CC2100,GCP,INV33086,,USD,34419.77,INPUT,Payment for subscription,SAP,2025-04-22,2025-04-14,2025,04,34419.77,False,payment for subscription,2026-02-22 23:27:14.356841,Raw_GL_Export.csv,83.92156862745098,0,True,AUS01,5620,True,5620,Insurance,True,True,CC2100,Google Cloud,MAPPED,2025-04_USD,1.525,52490.149249999995,CONVERTED,32410.971605588227,27490.799177232966,170.0,False,0.0,Tuesday,False,True,True,EX001;EX004
TXN001091,26-02-2025,17-02-2025,2025-02,AUS01,5110,CC3000,AWS,INV88161,,NZD,44191.07,GST-FREE,Payment for goods,SAP,2025-02-26,2025-02-17,2025,02,44191.07,False,payment for goods,2026-02-22 23:27:14.356841,Raw_GL_Export.csv,83.92156862745098,0,True,AUS01,5110,True,5110,Utilities,True,True,CC3000,Amazon Web Services,MAPPED,2025-02_NZD,0.925,40876.73975,CONVERTED,27865.288293732876,21409.69928933269,146.0,False,0.0,Wednesday,False,True,True,EX001
TXN001092,27/01/2026,21/01/2026,2026-01,AUS01,5320,CC3100,Salesforce,INV97418,PO6656,AUD,36260.76,GST-FREE,Payment for goods,API Import,2026-01-27,2026-01-21,2026,01,36260.76,False,payment for goods,2026-02-22 23:27:14.356841,Raw_GL_Export.csv,83.92156862745098,0,True,AUS01,5320,True,5320,Audit Fees,True,True,CC3100,Salesforce Inc,MAPPED,2026-01_AUD,1.0,36260.76,DOMESTIC,31658.610713475173,32284.527206153973,141.0,False,0.0,Tuesday,False,True,False,
TXN001093,2026-02-16,2026-02-14,2026-02,AUS01,5210,CC3200,Atlassian Pty,INV57056,PO9841,USD,12468.24,EXPORT,Payment for subscription,Manual Entry,2026-02-16,2026-02-14,2026,02,12468.24,False,payment for subscription,2026-02-22 23:27:14.356841,Raw_GL_Export.csv,83.92156862745098,0,True,AUS01,5210,True,5210,Cloud Services,True,True,CC3200,Atlassian,MAPPED,2026-02_USD,1.525,19014.066,CONVERTED,31620.56664919015,27460.393400888206,142.0,False,0.0,Monday,False,True,False,
TXN001094,10/01/2026,06/01/2026,2026-01,AUS01,5920,CC1000,Deloitte Touche,INV13361,,AUD,39975.79,GST-FREE,Payment for consulting,SAP,2026-01-10,2026-01-06,2026,01,39975.79,False,payment for consulting,2026-02-22 23:27:14.356841,Raw_GL_Export.csv,83.92156862745098,0,True,AUS01,5920,True,5920,FX Loss,True,True,CC1000,Deloitte,MAPPED,2026-01_AUD,1.0,39975.79,DOMESTIC,27533.92400565971,21784.021192347693,144.0,False,0.0,Saturday,True,True,True,EX001
TXN001095,2026-01-14,2026-01-08,2026-01,AUS01,5610,CC1200,Seek Limited,INV17904,,USD,25133.03,INPUT,Payment for license,SAP,2026-01-14,2026-01-08,2026,01,25133.03,False,payment for license,2026-02-22 23:27:14.356841,Raw_GL_Export.csv,83.92156862745098,0,True,AUS01,5610,True,5610,Postage and Courier,True,True,CC1200,Seek,MAPPED,2026-01_USD,1.527,38378.136809999996,CONVERTED,29081.766845273953,25872.32663648796,146.0,False,0.0,Wednesday,False,True,True,EX001
